Category;Real Category;Business Name;Address;City;State;Postal Code;Country;Phone;Email;Website;Latitude;Longitude;Map Link;Details Link
"toko bangunan";"Toko Swalayan";"Toko bangunan Sinar jaya/usaha muda";"Tanah Abang, Kec. Pamenang, Kabupaten Merangin, Jambi 37481";"Kec. Pamenang, Kabupaten Merangin";"JAMBI";"37481";"Indonesia";" 081293982708";"";"";"-2.1996013";"102.5794295";"https://maps.google.com/?cid=0x0:0x3903c27bd2ea5318";""
"toko bangunan";"Toko Perlengkapan Rumah";"Melly Bangunan";"V9J6+J47, Mampun Baru, Kec. Pamenang Bar., Kabupaten Merangin, Jambi 37352";"Mampun Baru, Kec. Pamenang Bar., Kabupaten Merangin";"JAMBI";"37352";"Indonesia";"";"";"";"-2.1184522";"102.3602816";"https://maps.google.com/?cid=0x0:0x92686ea871db869c";""
"toko bangunan";"Toko Bahan Bangunan";"Toko Ragam bangunan pamenang";"VG55+WF6, Toko Ragam bangunan sebelah polsek pamenang desa kenalip kecamatan pamenang, Pamenang, bangko, Kabupaten Merangin, Jambi 37352";"Toko Ragam bangunan sebelah polsek pamenang desa kenalip kecamatan pamenang, Pamenang, bangko, Kabupaten Merangin";"JAMBI";"37352";"Indonesia";" 081326571015";"";"";"-2.1402063";"102.5086312";"https://maps.google.com/?cid=0x0:0xb6c6c45b97a879b7";""
"toko bangunan";"Toko Bahan Bangunan";"Tb Istana Bangunan";"Bukit Tigo, Kec. Singkut, Kabupaten Sarolangun, Jambi";"Kabupaten Sarolangun, Jambi";"JAMBI";"";"Indonesia";" 08388827765";"";"";"-2.5065121";"102.7127211";"https://maps.google.com/?cid=0x0:0xfe8f686056cc802b";""
"toko bangunan";"Toko Bahan Bangunan";"Toko Bangunan Dua Putra";"PHQF+GXH, Jl. Lintas Sumatera, Tanjung, Kec. Batin VIII, Kabupaten Sarolangun, Jambi 37481";"Jl. Lintas Sumatera, Tanjung, Kec. Batin VIII, Kabupaten Sarolangun";"JAMBI";"37481";"Indonesia";"";"";"";"-2.2611772";"102.5749747";"https://maps.google.com/?cid=0x0:0xe1490c3c4ae5435c";""
"toko bangunan";"Toko Bahan Bangunan";"Toko Bahan Bangunan CV. RIDHO";"Jalan Poros Pinang Merah - Mampun Baru, RT.20/RW.001, Pinang Merah, Kec. Pamenang Bar., Kabupaten Merangin, Jambi 37352";"RT.20/RW.001, Pinang Merah, Kec. Pamenang Bar., Kabupaten Merangin";"JAMBI";"37352";"Indonesia";" 081367697068";"";"";"-2.1242736";"102.4033825";"https://maps.google.com/?cid=0x0:0xf42a02e78d52abf0";""
"toko bangunan";"Toko Bahan Bangunan";"Sarana indah Plafon cabang B1";"Pinang Merah, Kec. Pamenang Bar., Kabupaten Merangin, Jambi 37352";"Kec. Pamenang Bar., Kabupaten Merangin";"JAMBI";"37352";"Indonesia";" 082183013191";"";"";"-2.1354018";"102.4088549";"https://maps.google.com/?cid=0x0:0x5835bb1a7e6f7d3c";""
"toko bangunan";"Toko";"Toko Bangunan Sinar Rena";"GP57+3H4, Bukit Tigo, Kec. Singkut, Kabupaten Sarolangun, Jambi 37482";"Bukit Tigo, Kec. Singkut, Kabupaten Sarolangun";"JAMBI";"37482";"Indonesia";" 085266901160";"";"";"-2.4923611";"102.7139654";"https://maps.google.com/?cid=0x0:0xb32a97bcba22bd3";""
"toko bangunan";"Perusahaan Konstruksi";"Syifa Las";"RT.04, Limbur Tembesi, Kec. Batin VIII, Kabupaten Sarolangun, Jambi 37481";"Limbur Tembesi, Kec. Batin VIII, Kabupaten Sarolangun";"JAMBI";"37481";"Indonesia";" 082333347033";"";"";"-2.255378";"102.5241223";"https://maps.google.com/?cid=0x0:0xa322bb7c406b0157";""
"toko bangunan";"Toko Bahan Bangunan";"Depo Sahabat Keramik";"FPM7+6JP, Bukit Tigo, Kec. Singkut, Kabupaten Sarolangun, Jambi 37482";"Bukit Tigo, Kec. Singkut, Kabupaten Sarolangun";"JAMBI";"37482";"Indonesia";"";"";"";"-2.5169002";"102.7140649";"https://maps.google.com/?cid=0x0:0xee588bb318aa0fdf";""
"toko bangunan";"Toko Bahan Bangunan";"Nasir Bahan Meja, Slice, Slab";"M9XW+8R3, Selango, Kec. Pamenang Sel., Kabupaten Merangin, Jambi";"Kabupaten Merangin, Jambi";"JAMBI";"";"Indonesia";"";"";"";"-2.3017257";"102.3970609";"https://maps.google.com/?cid=0x0:0x3bf350775775be7a";""
"toko bangunan";"Toko Bahan Bangunan";"Toko Bangunan Kita Jaya";"JQFQ+MXQ, JL Grogol Raya, Limo, Grogol, Kec. Limo, Kota Depok, Jawa Barat 16514";"JL Grogol Raya, Limo, Grogol, Kec. Limo, Kota Depok";"JAMBI";"16514";"Indonesia";"";"";"";"-6.375775";"106.7899716";"https://maps.google.com/?cid=0x0:0xa8b38aa2ca5e36";""
"toko bangunan";"Toko Perlengkapan Rumah";"Belanja Keramik Cinere";"Jl. H. Isan, Meruyung, Kec. Limo, Kota Depok, Jawa Barat 16514";"Meruyung, Kec. Limo, Kota Depok";"JAMBI";"16514";"Indonesia";" 081513032000";"";"";"-6.3741633";"106.7713665";"https://maps.google.com/?cid=0x0:0x40eae30b6c824071";""
"toko bangunan";"Toko Bahan Bangunan";"BELANJA KERAMIK BOJONGSARI";"Jl. H. Nawi Malik, RT.003/RW.02, Serua, Kec. Bojongsari, Kota Depok, Jawa Barat 16517";"RT.003/RW.02, Serua, Kec. Bojongsari, Kota Depok";"JAMBI";"16517";"Indonesia";" 081575832000";"";"";"-6.3609869";"106.7328007";"https://maps.google.com/?cid=0x0:0x622d0fd5f3460216";""
"toko bangunan";"Toko Bahan Bangunan";"toko bangunan";"Jl. Limo Raya No.5, RT.2/RW.7, Limo, Kec. Limo, Kota Depok, Jawa Barat 16514";"RT.2/RW.7, Limo, Kec. Limo, Kota Depok";"JAMBI";"16514";"Indonesia";"";"";"";"-6.369027";"106.7742338";"https://maps.google.com/?cid=0x0:0xb7622103321317a2";""
"toko bangunan";"toko bangunan";"Jambi 37481";"Kabupaten Sarolangun, Jambi";"Kabupaten Sarolangun, Jambi";"JAMBI";"";"Indonesia";"";"";"";"-2.2659016";"102.644587";"https://maps.google.com/?cid=0x0:0xf9504b93697d6b34";""
"toko bangunan";"toko bangunan";"Batu alam";"Jl. Lintas Sumatera j No.km 04, Bernai, Kec. Sarolangun, Kabupaten Sarolangun, Jambi 37481";"Bernai, Kec. Sarolangun, Kabupaten Sarolangun";"JAMBI";"37481";"Indonesia";" 081367365667";"";"";"-2.3034467";"102.6919993";"https://maps.google.com/?cid=0x0:0x7aebcaa996b1da75";""
"toko bangunan";"Toko Bahan Bangunan";"Toko Bangunan Rizky Kito";"MPW6+H3R, Aur, Kec. Sarolangun, Kabupaten Sarolangun, Jambi";"Kabupaten Sarolangun, Jambi";"JAMBI";"";"Indonesia";" 085384122338";"";"";"-2.3035225";"102.7101379";"https://maps.google.com/?cid=0x0:0x51933ee538b0dc29";""
"toko bangunan";"Toko Bahan Bangunan";"Tb.SUMBER RIZKY";"Sebelum SPBU, Jl. Lintas Sumatera No.Km3, Bernai, Kec. Sarolangun, Kabupaten Sarolangun, Jambi";"Kabupaten Sarolangun, Jambi";"JAMBI";"";"Indonesia";" 085266665857";"";"";"-2.3043695";"102.6849777";"https://maps.google.com/?cid=0x0:0x5241dd8e02cb481c";""
"toko bangunan";"Toko Bahan Bangunan";"TOKO BANGUNAN SAHABAT LAMA SAROLANGUN";"Jl. Lintas Sumatera, Ps. Sarolangun, Kec. Sarolangun, Kabupaten Sarolangun, Jambi 37481";"Ps. Sarolangun, Kec. Sarolangun, Kabupaten Sarolangun";"JAMBI";"37481";"Indonesia";" 082383443524";"";"";"-2.3011297";"102.7191295";"https://maps.google.com/?cid=0x0:0x2d6dcc10812b0ff1";""
"toko bangunan";"Toko Perlengkapan Rumah";"Toko Sinar Bangunan";"MPXC+HVX, Jl. H.A. Kamil, Ps. Sarolangun, Kec. Sarolangun, Kabupaten Sarolangun, Jambi 37481";"Jl. H.A. Kamil, Ps. Sarolangun, Kec. Sarolangun, Kabupaten Sarolangun";"JAMBI";"37481";"Indonesia";" 0127489103";"";"";"-2.3010129";"102.7222468";"https://maps.google.com/?cid=0x0:0x6ead758e6c360f5b";""
"toko bangunan";"Toko Bahan Bangunan";"Toko Bangunan Ara";"JM7H+59R, Unnamed Road, Lubuk Sayak, Kec. Pelawan, Kabupaten Sarolangun, Jambi 37482";"Unnamed Road, Lubuk Sayak, Kec. Pelawan, Kabupaten Sarolangun";"JAMBI";"37482";"Indonesia";" 081212198787";"";"";"-2.3870062";"102.6783849";"https://maps.google.com/?cid=0x0:0xecfe89c7ef31302b";""
"toko bangunan";"Toko Bahan Bangunan";"Cahaya Terang";"Jl. Lintas Sumatera No.Km. 27, Limbur Tembesi, Kec. Sarolangun, Kabupaten Sarolangun, Jambi 37481";"Limbur Tembesi, Kec. Sarolangun, Kabupaten Sarolangun";"JAMBI";"37481";"Indonesia";"";"";"";"-2.2481838";"102.5122095";"https://maps.google.com/?cid=0x0:0x928950777fed0312";""
"toko bangunan";"Toko Bahan Bangunan";"Toko Bangunan Fitri";"MP2G+25G, Muara Danau, Kec. Pelawan, Kabupaten Sarolangun, Jambi 37481";"Muara Danau, Kec. Pelawan, Kabupaten Sarolangun";"JAMBI";"37481";"Indonesia";" 081266291278";"";"";"-2.3499443";"102.7254445";"https://maps.google.com/?cid=0x0:0xcdbf81d99e6d6993";""
"toko bangunan";"Toko Perlengkapan Rumah";"Jotun NAN INDAH";"MPW7+VWQ, Jl. Simpang Raya, Aur, Kec. Sarolangun, Kabupaten Sarolangun, Jambi 37481";"Jl. Simpang Raya, Aur, Kec. Sarolangun, Kabupaten Sarolangun";"JAMBI";"37481";"Indonesia";" 082184553133";"";"";"-2.3027774";"102.7148506";"https://maps.google.com/?cid=0x0:0x7c233f17574e25cf";""
"toko bangunan";"Toko Bahan Bangunan";"Tb. Andalas Jaya";"MPXG+P2X, Ps. Sarolangun, Kec. Sarolangun, Kabupaten Sarolangun, Jambi 37481";"Ps. Sarolangun, Kec. Sarolangun, Kabupaten Sarolangun";"JAMBI";"37481";"Indonesia";"";"";"";"-2.3006437";"102.7251243";"https://maps.google.com/?cid=0x0:0xa2add9732ec45a32";""
"toko bangunan";"Toko Bahan Bangunan";"Rizky Kito 2";"MMWW+QJ4, Bernai, Kec. Sarolangun, Kabupaten Sarolangun, Jambi 37481";"Bernai, Kec. Sarolangun, Kabupaten Sarolangun";"JAMBI";"37481";"Indonesia";"";"";"";"-2.3031235";"102.6965834";"https://maps.google.com/?cid=0x0:0xe563c0a17d083739";""
"toko bangunan";"Toko Bahan Bangunan";"Toko bangunan KIM (tiga putra)";"Jl. Lintas Sumatera, Limbur Tembesi, Kec. Batin VIII, Kabupaten Sarolangun, Jambi 37481";"Limbur Tembesi, Kec. Batin VIII, Kabupaten Sarolangun";"JAMBI";"37481";"Indonesia";" 082306307340";"";"";"-2.2530004";"102.5226874";"https://maps.google.com/?cid=0x0:0x4206c2a7d905c74c";""
"toko bangunan";"Toko Bahan Bangunan";"Bumdes bina karya abadi";"MJVX+R2R, Unnamed Road, Panti, Kec. Sarolangun, Kabupaten Sarolangun, Jambi 37481";"Unnamed Road, Panti, Kec. Sarolangun, Kabupaten Sarolangun";"JAMBI";"37481";"Indonesia";" 081271103711";"";"";"-2.3053972";"102.6475301";"https://maps.google.com/?cid=0x0:0xa962b0a35690bdca";""
"toko bangunan";"Toko Bahan Bangunan";"TB.MUZAMMIL";"JM9W+R4H, Jl. Lintas Sumatera, tanjung rambai, kelurahan gunung kembang, Kabupaten Sarolangun, Jambi 37482";"Jl. Lintas Sumatera, tanjung rambai, kelurahan gunung kembang, Kabupaten Sarolangun";"JAMBI";"37482";"Indonesia";" 085298650755";"";"";"-2.3804272";"102.6953615";"https://maps.google.com/?cid=0x0:0xfbe39e50e549d670";""
"toko bangunan";"Toko Bahan Bangunan";"Toko bangunan ARIEL";"Lubuk Resam, Kec. Cermin Nan Gedan, Kabupaten Sarolangun, Jambi 37482";"Kec. Cermin Nan Gedan, Kabupaten Sarolangun";"JAMBI";"37482";"Indonesia";" 082175704850";"";"";"-2.3868318";"102.6315308";"https://maps.google.com/?cid=0x0:0x5144cf0682bf8805";""
"toko bangunan";"Toko Bahan Bangunan";"TB Sahabat Lama";"Bukit Tigo, Kec. Singkut, Kabupaten Sarolangun, Jambi 37482";"Kec. Singkut, Kabupaten Sarolangun";"JAMBI";"37482";"Indonesia";"";"";"";"-2.50403";"102.7117664";"https://maps.google.com/?cid=0x0:0x93a35214822ff3d2";""
"toko bangunan";"";"TB. MITRA GLOBAL SENTOSA";"Jl. Lintas Sumatera, Bernai, Luar, Kabupaten Sarolangun, Jambi 37481";"Bernai, Luar, Kabupaten Sarolangun";"JAMBI";"37481";"Indonesia";" 081277446060";"";"";"-2.3043695";"102.6849777";"https://maps.google.com/?cid=0x0:0xfd64fc3e7d705f6d";""
"toko bangunan";"Toko Bahan Bangunan";"TOKO BANGUNAN ARIL";"Jl. Lintas Sumatera No.KM.08, Lubuk Sepuh, Kec. Pelawan, Kabupaten Sarolangun, Jambi 37482";"Lubuk Sepuh, Kec. Pelawan, Kabupaten Sarolangun";"JAMBI";"37482";"Indonesia";" 082292336724";"";"";"-2.3696062";"102.7177511";"https://maps.google.com/?cid=0x0:0x68579f981fec4a55";""
"toko bangunan";"Toko Bahan Bangunan";"Toko Sumber Jaya Bangunan";"Sebelah Toko Baju Serba 35, Jalan, Aur, Kec. Sarolangun, Kabupaten Sarolangun, Jambi 37481";"Jalan, Aur, Kec. Sarolangun, Kabupaten Sarolangun";"JAMBI";"37481";"Indonesia";" 082374225015";"";"";"-2.2893955";"102.7077668";"https://maps.google.com/?cid=0x0:0xb689413160ed57aa";""
"toko bangunan";"Toko Bahan Bangunan";"Toko Helmi Bangunan";"Sungai Udang, Kec. Pamenang, Kabupaten Merangin, Jambi 37352";"Kec. Pamenang, Kabupaten Merangin";"JAMBI";"37352";"Indonesia";" 085273055461";"";"";"-2.1698346";"102.5520276";"https://maps.google.com/?cid=0x0:0xcfd772248939726f";""
"toko bangunan";"Toko Cat";"Samurai Paint - Syafiq Motor";"Jl. Rio Hasan No.2, Sukasari, Kec. Sarolangun, Kabupaten Sarolangun, Jambi 37481";"Sukasari, Kec. Sarolangun, Kabupaten Sarolangun";"JAMBI";"37481";"Indonesia";"";"";"";"-2.2994558";"102.7235672";"https://maps.google.com/?cid=0x0:0x711cb71cce07e4e6";""
"toko bangunan";"toko bangunan";"Batu alam";"Jl. Lintas Sumatera j No.km 04, Bernai, Kec. Sarolangun, Kabupaten Sarolangun, Jambi 37481";"Bernai, Kec. Sarolangun, Kabupaten Sarolangun";"JAMBI";"37481";"Indonesia";" 081367365667";"";"";"-2.3034467";"102.6919993";"https://maps.google.com/?cid=0x0:0x7aebcaa996b1da75";""
"toko bangunan";"Toko Bahan Bangunan";"OTO STEEL INDONESIA (OSI) PAUH";"VV92+823, Jl. Sarolangun - Muara Tembesi, Kp. Baru, Kec. Pauh, Kabupaten Batang Hari, Jambi";"Kabupaten Batang Hari, Jambi";"JAMBI";"";"Indonesia";" 081232439762";"";"";"-2.1317415";"102.8500383";"https://maps.google.com/?cid=0x0:0x73936829520d1d49";""
"toko bangunan";"Toko Bahan Bangunan";"Toko Bangunan Rizky Kito";"MPW6+H3R, Aur, Kec. Sarolangun, Kabupaten Sarolangun, Jambi";"Kabupaten Sarolangun, Jambi";"JAMBI";"";"Indonesia";" 085384122338";"";"";"-2.3035225";"102.7101379";"https://maps.google.com/?cid=0x0:0x51933ee538b0dc29";""
"toko bangunan";"Toko Bahan Bangunan";"Toko Bangunan Ara";"JM7H+59R, Unnamed Road, Lubuk Sayak, Kec. Pelawan, Kabupaten Sarolangun, Jambi 37482";"Unnamed Road, Lubuk Sayak, Kec. Pelawan, Kabupaten Sarolangun";"JAMBI";"37482";"Indonesia";" 081212198787";"";"";"-2.3870062";"102.6783849";"https://maps.google.com/?cid=0x0:0xecfe89c7ef31302b";""
"toko bangunan";"Toko Bahan Bangunan";"Tb.SUMBER RIZKY";"Sebelum SPBU, Jl. Lintas Sumatera No.Km3, Bernai, Kec. Sarolangun, Kabupaten Sarolangun, Jambi";"Kabupaten Sarolangun, Jambi";"JAMBI";"";"Indonesia";" 085266665857";"";"";"-2.3043695";"102.6849777";"https://maps.google.com/?cid=0x0:0x5241dd8e02cb481c";""
"toko bangunan";"Toko Bahan Bangunan";"TOKO BANGUNAN SAHABAT LAMA SAROLANGUN";"Jl. Lintas Sumatera, Ps. Sarolangun, Kec. Sarolangun, Kabupaten Sarolangun, Jambi 37481";"Ps. Sarolangun, Kec. Sarolangun, Kabupaten Sarolangun";"JAMBI";"37481";"Indonesia";" 082383443524";"";"";"-2.3011297";"102.7191295";"https://maps.google.com/?cid=0x0:0x2d6dcc10812b0ff1";""
"toko bangunan";"Toko Bahan Bangunan";"Toko Bangunan Bahri";"Jl. Budi Utomo No.21, Sungai Benteng, Kec. Singkut, Kabupaten Sarolangun, Jambi 37482";"Sungai Benteng, Kec. Singkut, Kabupaten Sarolangun";"JAMBI";"37482";"Indonesia";" 085367828282";"";"";"-2.5036706";"102.7108368";"https://maps.google.com/?cid=0x0:0x718dc3907b9b0fce";""
"toko bangunan";"Toko Perlengkapan Rumah";"TOKO BANGUNAN KARSONO";"XX88+9H8, Jl. Sarolangun - Muara Tembesi, Mandiangin, Kec. Mandiangin, Kabupaten Sarolangun, Jambi 37492";"Jl. Sarolangun - Muara Tembesi, Mandiangin, Kec. Mandiangin, Kabupaten Sarolangun";"JAMBI";"37492";"Indonesia";" 085282994701";"";"";"-2.0340925";"102.9664421";"https://maps.google.com/?cid=0x0:0xeb79572e6371727d";""
"toko bangunan";"Kantor Perusahaan";"Samhutani (Samil). PT";"Lubuk Napal, Km. 22, Pauh, Sarolangun, Lubuk Napal, Kec. Pauh, Kabupaten Sarolangun, Jambi 37491";"Km. 22, Pauh, Sarolangun, Lubuk Napal, Kec. Pauh, Kabupaten Sarolangun";"JAMBI";"37491";"Indonesia";" 07413859610";"";"";"-2.234293";"102.878288";"https://maps.google.com/?cid=0x0:0x1e9ec3dcb1539847";""
"toko bangunan";"";"Tb. Merangin Indah";"Jl. Sarolangun - Muara Tembesi, Pauh, Kec. Pauh, Kabupaten Sarolangun, Jambi 37491";"Pauh, Kec. Pauh, Kabupaten Sarolangun";"JAMBI";"37491";"Indonesia";"";"";"";"-2.1396111";"102.8159492";"https://maps.google.com/?cid=0x0:0x4e695394c3630246";""
"toko bangunan";"Toko Bahan Bangunan";"Cahaya Terang";"Jl. Lintas Sumatera No.Km. 27, Limbur Tembesi, Kec. Sarolangun, Kabupaten Sarolangun, Jambi 37481";"Limbur Tembesi, Kec. Sarolangun, Kabupaten Sarolangun";"JAMBI";"37481";"Indonesia";"";"";"";"-2.2481838";"102.5122095";"https://maps.google.com/?cid=0x0:0x928950777fed0312";""
"toko bangunan";"Toko Bahan Bangunan";"Toko Bangunan Fitri";"MP2G+25G, Muara Danau, Kec. Pelawan, Kabupaten Sarolangun, Jambi 37481";"Muara Danau, Kec. Pelawan, Kabupaten Sarolangun";"JAMBI";"37481";"Indonesia";" 081266291278";"";"";"-2.3499443";"102.7254445";"https://maps.google.com/?cid=0x0:0xcdbf81d99e6d6993";""
"toko bangunan";"Toko Perlengkapan Rumah";"Jotun NAN INDAH";"MPW7+VWQ, Jl. Simpang Raya, Aur, Kec. Sarolangun, Kabupaten Sarolangun, Jambi 37481";"Jl. Simpang Raya, Aur, Kec. Sarolangun, Kabupaten Sarolangun";"JAMBI";"37481";"Indonesia";" 082184553133";"";"";"-2.3027774";"102.7148506";"https://maps.google.com/?cid=0x0:0x7c233f17574e25cf";""
"toko bangunan";"Toko Perlengkapan Rumah";"Toko 'Sinar Bangunan'";"XH6J+HPW, Mentawak Baru, Kec. Air Hitam, Kabupaten Sarolangun, Jambi 37491";"Mentawak Baru, Kec. Air Hitam, Kabupaten Sarolangun";"JAMBI";"37491";"Indonesia";" 085273978127";"";"";"-2.0385103";"102.5818226";"https://maps.google.com/?cid=0x0:0x5665b30295de7a88";""
"toko bangunan";"Toko Bahan Bangunan";"TB.MUZAMMIL";"JM9W+R4H, Jl. Lintas Sumatera, tanjung rambai, kelurahan gunung kembang, Kabupaten Sarolangun, Jambi 37482";"Jl. Lintas Sumatera, tanjung rambai, kelurahan gunung kembang, Kabupaten Sarolangun";"JAMBI";"37482";"Indonesia";" 085298650755";"";"";"-2.3804272";"102.6953615";"https://maps.google.com/?cid=0x0:0xfbe39e50e549d670";""
"toko bangunan";"Toko Bahan Bangunan";"TB Jaya sempurna";"Deretan ruko depan pasar baru, Pauh, Kec. Pauh, Kabupaten Sarolangun, Jambi 37491";"Pauh, Kec. Pauh, Kabupaten Sarolangun";"JAMBI";"37491";"Indonesia";" 082374935802";"";"";"-2.1419897";"102.8155652";"https://maps.google.com/?cid=0x0:0x3d65a8eaddb37872";""
"toko bangunan";"Toko Bahan Bangunan";"Tb. Andalas Jaya";"MPXG+P2X, Ps. Sarolangun, Kec. Sarolangun, Kabupaten Sarolangun, Jambi 37481";"Ps. Sarolangun, Kec. Sarolangun, Kabupaten Sarolangun";"JAMBI";"37481";"Indonesia";"";"";"";"-2.3006437";"102.7251243";"https://maps.google.com/?cid=0x0:0xa2add9732ec45a32";""
"toko bangunan";"Toko Bahan Bangunan";"Rizky Kito 2";"MMWW+QJ4, Bernai, Kec. Sarolangun, Kabupaten Sarolangun, Jambi 37481";"Bernai, Kec. Sarolangun, Kabupaten Sarolangun";"JAMBI";"37481";"Indonesia";"";"";"";"-2.3031235";"102.6965834";"https://maps.google.com/?cid=0x0:0xe563c0a17d083739";""
"toko bangunan";"Toko Bahan Bangunan";"Toko bangunan ARIEL";"Lubuk Resam, Kec. Cermin Nan Gedan, Kabupaten Sarolangun, Jambi 37482";"Kec. Cermin Nan Gedan, Kabupaten Sarolangun";"JAMBI";"37482";"Indonesia";" 082175704850";"";"";"-2.3868318";"102.6315308";"https://maps.google.com/?cid=0x0:0x5144cf0682bf8805";""
"toko bangunan";"toko bangunan";"Kec. Pauh";"Kabupaten Sarolangun, Jambi";"Kabupaten Sarolangun, Jambi";"JAMBI";"";"Indonesia";"";"";"";"-2.136479";"102.8156984";"https://maps.google.com/?cid=0x0:0xacf6fbed2598c15";""
"toko bangunan";"Toko Bahan Bangunan";"TB tekhnik mandiri";"RT.06/RW.km 7, Danau Serdang, Kec. Pauh, Kabupaten Sarolangun, Jambi";"Kabupaten Sarolangun, Jambi";"JAMBI";"";"Indonesia";"";"";"";"-2.1668059";"102.8529217";"https://maps.google.com/?cid=0x0:0x755b74818030562e";""
"toko bangunan";"Produsen";"Pak RONI BATA ,,,SPG ROTAN,,,";"QRM8+FQH, Karang Mendapo, Kec. Pauh, Kabupaten Sarolangun, Jambi 37491";"Karang Mendapo, Kec. Pauh, Kabupaten Sarolangun";"JAMBI";"37491";"Indonesia";"";"";"";"-2.2163129";"102.8169757";"https://maps.google.com/?cid=0x0:0x51d6b0c7db2e0cef";""
"toko bangunan";"";"Toko Bangunan Rizky Kito 2 Pauh";"Pauh, Kec. Pauh, Kabupaten Sarolangun, Jambi";"Kabupaten Sarolangun, Jambi";"JAMBI";"";"Indonesia";"";"";"";"-2.1448911";"102.8137971";"https://maps.google.com/?cid=0x0:0xe9811ff767d3cd71";""
"toko bangunan";"Tempat Parkir";"Tugu SIMPANG TIGA PAUH";"VR78+C34, Pauh, Kec. Pauh, Kabupaten Sarolangun, Jambi 37491";"Pauh, Kec. Pauh, Kabupaten Sarolangun";"JAMBI";"37491";"Indonesia";"";"";"";"-2.1364798";"102.8152139";"https://maps.google.com/?cid=0x0:0x4f0a7cdec950a38e";""
"toko bangunan";"Toko Perlengkapan Rumah";"Toko Sinar Bangunan";"MPXC+HVX, Jl. H.A. Kamil, Ps. Sarolangun, Kec. Sarolangun, Kabupaten Sarolangun, Jambi 37481";"Jl. H.A. Kamil, Ps. Sarolangun, Kec. Sarolangun, Kabupaten Sarolangun";"JAMBI";"37481";"Indonesia";" 0127489103";"";"";"-2.3010129";"102.7222468";"https://maps.google.com/?cid=0x0:0x6ead758e6c360f5b";""
"toko bangunan";"Toko Bahan Bangunan";"Toko Helmi Bangunan";"Sungai Udang, Kec. Pamenang, Kabupaten Merangin, Jambi 37352";"Kec. Pamenang, Kabupaten Merangin";"JAMBI";"37352";"Indonesia";" 085273055461";"";"";"-2.1698346";"102.5520276";"https://maps.google.com/?cid=0x0:0xcfd772248939726f";""
"toko bangunan";"Toko Perlengkapan Rumah";"TB. Multi Talenta Perkasa";"Jl. Raya Tapos No.78, RT.002/RW.20, Tapos, Kec. Tapos, Kota Depok, Jawa Barat 16457";"RT.002/RW.20, Tapos, Kec. Tapos, Kota Depok";"JAMBI";"16457";"Indonesia";" 089658111192";"";"";"-6.4067655";"106.8904566";"https://maps.google.com/?cid=0x0:0x59296ee14817d6d7";""
"toko bangunan";"Toko Bahan Bangunan";"Depo Wulan Jaya Bangunan";"Jl. By Pass No.KM 7, Pisang, Kec. Pauh, Kota Padang, Sumatera Barat 25161";"Pisang, Kec. Pauh, Kota Padang";"JAMBI";"25161";"Indonesia";" 08116611335";"";"";"-0.9432316";"100.3998205";"https://maps.google.com/?cid=0x0:0xdc4ef52f97baed19";""
"toko bangunan";"Toko Bahan Bangunan";"Toko Ade Bangunan";"Jl. Limau Manis No.Kel, Limau Manis, Kec. Pauh, Kota Padang, Sumatera Barat 25176";"Limau Manis, Kec. Pauh, Kota Padang";"JAMBI";"25176";"Indonesia";" 082172467729";"";"";"-0.9199839";"100.4637342";"https://maps.google.com/?cid=0x0:0xe6c9de7edef6f0a6";""
"toko bangunan";"toko bangunan";"Batu alam";"Jl. Lintas Sumatera j No.km 04, Bernai, Kec. Sarolangun, Kabupaten Sarolangun, Jambi 37481";"Bernai, Kec. Sarolangun, Kabupaten Sarolangun";"JAMBI";"37481";"Indonesia";" 081367365667";"";"";"-2.3034467";"102.6919993";"https://maps.google.com/?cid=0x0:0x7aebcaa996b1da75";""
"toko bangunan";"Toko Bahan Bangunan";"OTO STEEL INDONESIA (OSI) PAUH";"VV92+823, Jl. Sarolangun - Muara Tembesi, Kp. Baru, Kec. Pauh, Kabupaten Batang Hari, Jambi";"Kabupaten Batang Hari, Jambi";"JAMBI";"";"Indonesia";" 081232439762";"";"";"-2.1317415";"102.8500383";"https://maps.google.com/?cid=0x0:0x73936829520d1d49";""
"toko bangunan";"Toko Bahan Bangunan";"Toko Bangunan Rizky Kito";"MPW6+H3R, Aur, Kec. Sarolangun, Kabupaten Sarolangun, Jambi";"Kabupaten Sarolangun, Jambi";"JAMBI";"";"Indonesia";" 085384122338";"";"";"-2.3035225";"102.7101379";"https://maps.google.com/?cid=0x0:0x51933ee538b0dc29";""
"toko bangunan";"Toko Perlengkapan Rumah";"Toko Bangunan Serikat";"MPPJ+8H5, Gn. Kembang, Kec. Sarolangun, Kabupaten Sarolangun, Jambi 37481";"Gn. Kembang, Kec. Sarolangun, Kabupaten Sarolangun";"JAMBI";"37481";"Indonesia";"";"";"";"-2.3142382";"102.7314776";"https://maps.google.com/?cid=0x0:0x544384ec7436878d";""
"toko bangunan";"Toko Bahan Bangunan";"Toko Bangunan Bahri";"Jl. Budi Utomo No.21, Sungai Benteng, Kec. Singkut, Kabupaten Sarolangun, Jambi 37482";"Sungai Benteng, Kec. Singkut, Kabupaten Sarolangun";"JAMBI";"37482";"Indonesia";" 085367828282";"";"";"-2.5036706";"102.7108368";"https://maps.google.com/?cid=0x0:0x718dc3907b9b0fce";""
"toko bangunan";"Toko Bahan Bangunan";"Tb.SUMBER RIZKY";"Sebelum SPBU, Jl. Lintas Sumatera No.Km3, Bernai, Kec. Sarolangun, Kabupaten Sarolangun, Jambi";"Kabupaten Sarolangun, Jambi";"JAMBI";"";"Indonesia";" 085266665857";"";"";"-2.3043695";"102.6849777";"https://maps.google.com/?cid=0x0:0x5241dd8e02cb481c";""
"toko bangunan";"";"Tb. Merangin Indah";"Jl. Sarolangun - Muara Tembesi, Pauh, Kec. Pauh, Kabupaten Sarolangun, Jambi 37491";"Pauh, Kec. Pauh, Kabupaten Sarolangun";"JAMBI";"37491";"Indonesia";"";"";"";"-2.1396111";"102.8159492";"https://maps.google.com/?cid=0x0:0x4e695394c3630246";""
"toko bangunan";"Kantor Perusahaan";"Samhutani (Samil). PT";"Lubuk Napal, Km. 22, Pauh, Sarolangun, Lubuk Napal, Kec. Pauh, Kabupaten Sarolangun, Jambi 37491";"Km. 22, Pauh, Sarolangun, Lubuk Napal, Kec. Pauh, Kabupaten Sarolangun";"JAMBI";"37491";"Indonesia";" 07413859610";"";"";"-2.234293";"102.878288";"https://maps.google.com/?cid=0x0:0x1e9ec3dcb1539847";""
"toko bangunan";"Toko Bahan Bangunan";"TOKO BANGUNAN SAHABAT LAMA SAROLANGUN";"Jl. Lintas Sumatera, Ps. Sarolangun, Kec. Sarolangun, Kabupaten Sarolangun, Jambi 37481";"Ps. Sarolangun, Kec. Sarolangun, Kabupaten Sarolangun";"JAMBI";"37481";"Indonesia";" 082383443524";"";"";"-2.3011297";"102.7191295";"https://maps.google.com/?cid=0x0:0x2d6dcc10812b0ff1";""
"toko bangunan";"Toko Perlengkapan Rumah";"TOKO BANGUNAN KARSONO";"XX88+9H8, Jl. Sarolangun - Muara Tembesi, Mandiangin, Kec. Mandiangin, Kabupaten Sarolangun, Jambi 37492";"Jl. Sarolangun - Muara Tembesi, Mandiangin, Kec. Mandiangin, Kabupaten Sarolangun";"JAMBI";"37492";"Indonesia";" 085282994701";"";"";"-2.0340925";"102.9664421";"https://maps.google.com/?cid=0x0:0xeb79572e6371727d";""
"toko bangunan";"Toko Perlengkapan Rumah";"Jotun NAN INDAH";"MPW7+VWQ, Jl. Simpang Raya, Aur, Kec. Sarolangun, Kabupaten Sarolangun, Jambi 37481";"Jl. Simpang Raya, Aur, Kec. Sarolangun, Kabupaten Sarolangun";"JAMBI";"37481";"Indonesia";" 082184553133";"";"";"-2.3027774";"102.7148506";"https://maps.google.com/?cid=0x0:0x7c233f17574e25cf";""
"toko bangunan";"Toko Perlengkapan Rumah";"Toko 'Sinar Bangunan'";"XH6J+HPW, Mentawak Baru, Kec. Air Hitam, Kabupaten Sarolangun, Jambi 37491";"Mentawak Baru, Kec. Air Hitam, Kabupaten Sarolangun";"JAMBI";"37491";"Indonesia";" 085273978127";"";"";"-2.0385103";"102.5818226";"https://maps.google.com/?cid=0x0:0x5665b30295de7a88";""
"toko bangunan";"Toko Bahan Bangunan";"Cahaya Terang";"Jl. Lintas Sumatera No.Km. 27, Limbur Tembesi, Kec. Sarolangun, Kabupaten Sarolangun, Jambi 37481";"Limbur Tembesi, Kec. Sarolangun, Kabupaten Sarolangun";"JAMBI";"37481";"Indonesia";"";"";"";"-2.2481838";"102.5122095";"https://maps.google.com/?cid=0x0:0x928950777fed0312";""
"toko bangunan";"Toko Bahan Bangunan";"Toko Bangunan Fitri";"MP2G+25G, Muara Danau, Kec. Pelawan, Kabupaten Sarolangun, Jambi 37481";"Muara Danau, Kec. Pelawan, Kabupaten Sarolangun";"JAMBI";"37481";"Indonesia";" 081266291278";"";"";"-2.3499443";"102.7254445";"https://maps.google.com/?cid=0x0:0xcdbf81d99e6d6993";""
