Category;Real Category;Business Name;Address;City;State;Postal Code;Country;Phone;Latitude;Longitude;Map Link
supermarket bangunan;Toko Bahan Bangunan;UD.Horas Jaya;Jl. Silaen No.67, Sigumpar Bar, Sigumpar Bar., Kec. Sigumpar, Toba, Sumatera Utara 22384;Sigumpar Bar, Sigumpar Bar., Kec. Sigumpar, Toba;SUMATERA UTARA;22384;Indonesia;;23.981.683;991.650.529;https://maps.google.com/?cid=0x0:0xf766b5f60badeb71
supermarket bangunan;Toko Bahan Bangunan;TOKO INDO MAJU;Jl. Gereja No.92 B-C, Martimbang, Kec. Siantar Sel., Kota Pematang Siantar, Sumatera Utara 21117;Martimbang, Kec. Siantar Sel., Kota Pematang Siantar;SUMATERA UTARA;21117;Indonesia;85213250678;29.463.706;990.556.131;https://maps.google.com/?cid=0x0:0x75d63997330e6437
supermarket bangunan;supermarket bangunan;UD.PRAMESWARA;C57F+J6V, Jl.nauli desa siahaan, Nauli, Kec. Sigumpar, Toba, Sumatera Utara 22384;Jl.nauli desa siahaan, Nauli, Kec. Sigumpar, Toba;SUMATERA UTARA;22384;Indonesia;;24.141.147;991.730.489;https://maps.google.com/?cid=0x0:0x440c754cc1e08422
supermarket bangunan;supermarket bangunan;Sumatera Utara 22381;Toba, Sumatera Utara;Toba, Sumatera Utara;SUMATERA UTARA;;Indonesia;;23.314.866;991.677.572;https://maps.google.com/?cid=0x0:0x742e649cff46ad69
supermarket bangunan;Kantor Perusahaan;Cv. Deborah Material;Sigumpar Bar., Kec. Sigumpar, Toba, Sumatera Utara 22384;Kec. Sigumpar, Toba;SUMATERA UTARA;22384;Indonesia;81263780710;23.969.182;991.604.236;https://maps.google.com/?cid=0x0:0x14120ad352ed2df6
supermarket bangunan;Toko Bahan Bangunan;Toko Lindur Plan Laguboti;Jl. Sisingamangaraja No.83, Ps. Laguboti, Kec. Laguboti, Toba, Sumatera Utara 22381;Ps. Laguboti, Kec. Laguboti, Toba;SUMATERA UTARA;22381;Indonesia;82168346644;23.570.604;9.912.859;https://maps.google.com/?cid=0x0:0x6d34a18222544ebb
supermarket bangunan;Toko Bahan Bangunan;Pratama Supermarket Bahan Bangunan Jababeka;Jl. Cikarang Baru Raya No.2, Mekarmukti, Kec. Cikarang Utara, Kabupaten Bekasi, Jawa Barat 17530;Mekarmukti, Kec. Cikarang Utara, Kabupaten Bekasi;SUMATERA UTARA;17530;Indonesia;81401948281;-63.004.397;107.167.426;https://maps.google.com/?cid=0x0:0x16010b489f707de5
supermarket bangunan;Toko Bahan Bangunan;SM BANGUNAN (SUPERMARKET BANGUNAN);Sukatani, Kec. Cisoka, Kabupaten Tangerang, Banten 15730;Kec. Cisoka, Kabupaten Tangerang;SUMATERA UTARA;15730;Indonesia;82112427393;-6.269.409;1.064.222.065;https://maps.google.com/?cid=0x0:0xf1979a6eb99dc96
supermarket bangunan;Toko Bahan Bangunan;Pratama Supermarket Bahan Bangunan;Jl. Raya Lemahabang No.27, Mekarmukti, Kec. Cikarang Utara, Kabupaten Bekasi, Jawa Barat 17530;Mekarmukti, Kec. Cikarang Utara, Kabupaten Bekasi;SUMATERA UTARA;17530;Indonesia;218934974;-62.894.221;1.071.531.609;https://maps.google.com/?cid=0x0:0x167f4446dd2fadda
supermarket bangunan;Pemasok Bahan Bangunan;Toko Besi Gidion Jaya;83QM+VV6, Saribu Raja Janji Maria, Kec. Balige, Toba, Sumatera Utara;Toba, Sumatera Utara;SUMATERA UTARA;;Indonesia;82277778834;23.395.433;990.847.341;https://maps.google.com/?cid=0x0:0xf7c39dd571d9f71e
supermarket bangunan;Toko Bahan Bangunan;UD.Horas Jaya;Jl. Silaen No.67, Sigumpar Bar, Sigumpar Bar., Kec. Sigumpar, Toba, Sumatera Utara 22384;Sigumpar Bar, Sigumpar Bar., Kec. Sigumpar, Toba;SUMATERA UTARA;22384;Indonesia;;23.981.683;991.650.529;https://maps.google.com/?cid=0x0:0xf766b5f60badeb71
supermarket bangunan;Toko Bahan Bangunan;UD. TIMBUL;95X8+62R, Sigumpar, Kec. Sigumpar, Toba, Sumatera Utara 22384;Sigumpar, Kec. Sigumpar, Toba;SUMATERA UTARA;22384;Indonesia;;23.981.223;991.650.105;https://maps.google.com/?cid=0x0:0xdaf306907106a36e
supermarket bangunan;supermarket bangunan;UD.PRAMESWARA;C57F+J6V, Jl.nauli desa siahaan, Nauli, Kec. Sigumpar, Toba, Sumatera Utara 22384;Jl.nauli desa siahaan, Nauli, Kec. Sigumpar, Toba;SUMATERA UTARA;22384;Indonesia;;24.141.147;991.730.489;https://maps.google.com/?cid=0x0:0x440c754cc1e08422
supermarket bangunan;supermarket bangunan;Kec. Sigumpar;Toba, Sumatera Utara;Toba, Sumatera Utara;SUMATERA UTARA;;Indonesia;;23.984.672;991.614.491;https://maps.google.com/?cid=0x0:0x4b5c026ca4275f15
supermarket bangunan;Toko Perlengkapan Rumah;Panglong Cv Debora Material;Marsangap, Kec. Sigumpar, Toba, Sumatera Utara 22384;Kec. Sigumpar, Toba;SUMATERA UTARA;22384;Indonesia;81265082957;2.399.666;991.788.535;https://maps.google.com/?cid=0x0:0xe4983d883af56a39
supermarket bangunan;Komplek perumahan;UD.Mual Nauli;SIPITU-PITU, Narumonda V, Kec. Siantar Narumonda, Toba, Sumatera Utara 22384;Narumonda V, Kec. Siantar Narumonda, Toba;SUMATERA UTARA;22384;Indonesia;81263779356;241.854;99.170.237;https://maps.google.com/?cid=0x0:0xdceae349028e5d2b
supermarket bangunan;Toko Alat Tulis Kantor;TOKO BAHAN BANGUNAN BORNAP;C5H7+84W, Narumonda V, Kec. Siantar Narumonda, Toba, Sumatera Utara;Toba, Sumatera Utara;SUMATERA UTARA;;Indonesia;83186603738;2.428.356;991.628.206;https://maps.google.com/?cid=0x0:0x1dc1134dad54ec84
supermarket bangunan;supermarket bangunan;Kec. Silaen;Toba, Sumatera Utara;Toba, Sumatera Utara;SUMATERA UTARA;;Indonesia;;24.076.991;992.079.342;https://maps.google.com/?cid=0x0:0x7c27220334d9e271
supermarket bangunan;Kantor Perusahaan;Toko Bangunan CV.Bersama (Garuda Rajagukguk);C5W4+XPF, Jl. Dr. bisuk Siahaan, Parparean IV, Kec. Parmaksian, Toba, Sumatera Utara 22384;Jl. Dr. bisuk Siahaan, Parparean IV, Kec. Parmaksian, Toba;SUMATERA UTARA;22384;Indonesia;81361158234;24.474.336;991.567.975;https://maps.google.com/?cid=0x0:0xe29b88afa49f48aa
supermarket bangunan;Toko Bahan Bangunan;Toko Lindur Plan Laguboti;Jl. Sisingamangaraja No.83, Ps. Laguboti, Kec. Laguboti, Toba, Sumatera Utara 22381;Ps. Laguboti, Kec. Laguboti, Toba;SUMATERA UTARA;22381;Indonesia;82168346644;23.570.604;9.912.859;https://maps.google.com/?cid=0x0:0x6d34a18222544ebb
supermarket bangunan;Toko Bahan Bangunan;Toko keramik alat bangunan dan bengkel las;439M+HCW, Sipahutar I, Kec. Sipahutar, Kabupaten Tapanuli Utara, Sumatera Utara 22471;Sipahutar I, Kec. Sipahutar, Kabupaten Tapanuli Utara;SUMATERA UTARA;22471;Indonesia;81388221119;21.189.864;990.835.759;https://maps.google.com/?cid=0x0:0x59e7c841521173b2
supermarket bangunan;Toko Bahan Bangunan;Toko ANDE Bangunan;Jl. Sisingamangaraja, Desa Pealangge, Kec. Siborongborong, Kabupaten Tapanuli Utara, Sumatera Utara 22474;Desa Pealangge, Kec. Siborongborong, Kabupaten Tapanuli Utara;SUMATERA UTARA;22474;Indonesia;82272564170;21.804.617;989.676.753;https://maps.google.com/?cid=0x0:0x3643994345aacb5
supermarket bangunan;Toko Bahan Bangunan;Toko Bangunan Semangat;Jl. Sisingamangaraja No.268, Kota Sidikalang, Kec. Sidikalang, Kabupaten Dairi, Sumatera Utara 22219;Kota Sidikalang, Kec. Sidikalang, Kabupaten Dairi;SUMATERA UTARA;22219;Indonesia;82186923375;27.530.175;983.094.409;https://maps.google.com/?cid=0x0:0x439881f410e4b147
supermarket bangunan;Toko Bahan Bangunan;Pratama Supermarket Bahan Bangunan;Jl. Raya Lemahabang No.27, Mekarmukti, Kec. Cikarang Utara, Kabupaten Bekasi, Jawa Barat 17530;Mekarmukti, Kec. Cikarang Utara, Kabupaten Bekasi;SUMATERA UTARA;17530;Indonesia;218934974;-62.894.221;1.071.531.609;https://maps.google.com/?cid=0x0:0x167f4446dd2fadda
supermarket bangunan;Toko Bahan Bangunan;Toko Bangunan Marusaha;33JQ+XPP, Siabal Abal II, Kec. Sipahutar, Kabupaten Tapanuli Utara, Sumatera Utara 22471;Siabal Abal II, Kec. Sipahutar, Kabupaten Tapanuli Utara;SUMATERA UTARA;22471;Indonesia;;20.824.646;990.893.416;https://maps.google.com/?cid=0x0:0x7ce77ce39923a51a
supermarket bangunan;Toko;Toko Saholoan;Jl. Simpang Pesantren No.3, Kalangan, Kec. Pandan, Kabupaten Tapanuli Tengah, Sumatera Utara 22615;Kalangan, Kec. Pandan, Kabupaten Tapanuli Tengah;SUMATERA UTARA;22615;Indonesia;82369916353;16.759.499;988.280.927;https://maps.google.com/?cid=0x0:0xaa0c25b6414cdefe
supermarket bangunan;Perhimpunan Pengembang Perumahan;Toko Bangunan;7CG2+G3, Lumban Rau Utara, Kec. Nassau, Toba, Sumatera Utara;Toba, Sumatera Utara;SUMATERA UTARA;;Indonesia;;22.763.195;994.002.208;https://maps.google.com/?cid=0x0:0x34a4b5ab65fd55ad
supermarket bangunan;Toko Bahan Bangunan;Tirta Bangunan Supermarket;4, Jl. Tole Iskandar Ruko Griya Depok B11 No.1, Mekar Jaya, Kec. Sukmajaya, Kota Depok, Jawa Barat 16412;Jl. Tole Iskandar Ruko Griya Depok B11 No.1, Mekar Jaya, Kec. Sukmajaya, Kota Depok;SUMATERA UTARA;16412;Indonesia;2177821139;-64.038.263;1.068.401.994;https://maps.google.com/?cid=0x0:0x88c18c4cc1dd79fa
supermarket bangunan;Toko Bahan Bangunan;Tirta Bangunan Supermarket;Jl. Siliwangi No.1, Depok, Kec. Pancoran Mas, Kota Depok, Jawa Barat 16431;Depok, Kec. Pancoran Mas, Kota Depok;SUMATERA UTARA;16431;Indonesia;2177211585;-63.994.435;106.820.465;https://maps.google.com/?cid=0x0:0x6c5691b15a29e9f8
supermarket bangunan;Toko Bahan Bangunan;Tirta Bangunan Supermarket;Jl. Raya Sawangan No.88, Pancoran MAS, Kec. Pancoran Mas, Kota Depok, Jawa Barat 16436;Pancoran MAS, Kec. Pancoran Mas, Kota Depok;SUMATERA UTARA;16436;Indonesia;2177216007;-63.956.644;1.068.033.311;https://maps.google.com/?cid=0x0:0xb2a503adeb35329d
supermarket bangunan;Pemasok Bahan Bangunan;Supermarket Bangunan Abadi ( Bangunan Abadi ) Meruya;Jl. Meruya Ilir Raya No.13 3, RT.3/RW.2, Meruya Utara, Kec. Kembangan, Kota Jakarta Barat, Daerah Khusus Ibukota Jakarta 11610;RT.3/RW.2, Meruya Utara, Kec. Kembangan, Kota Jakarta Barat;SUMATERA UTARA;11610;Indonesia;215856801;-61.976.477;1.067.425.118;https://maps.google.com/?cid=0x0:0x13872e6ebcfc2cac
supermarket bangunan;supermarket bangunan;Kec. Tampahan;Toba, Sumatera Utara;Toba, Sumatera Utara;SUMATERA UTARA;;Indonesia;;23.261.055;990.132.625;https://maps.google.com/?cid=0x0:0x9d6ff76f83d5dbd8
supermarket bangunan;Toko Bahan Bangunan;Istana Bangunan Suksess;83H3+V2M, Jl. Dr. Sutomo, Sangkar Nihuta, Kec. Balige, Toba, Sumatera Utara 22312;Jl. Dr. Sutomo, Sangkar Nihuta, Kec. Balige, Toba;SUMATERA UTARA;22312;Indonesia;81354094591;23.297.169;990.525.539;https://maps.google.com/?cid=0x0:0xc73b65604f81d0b6
supermarket bangunan;Toko Cat;UD.HOLBUNG;7X7X+596 Sp, Jl. Bandara Silangit, Silando, Kec. Muara, Kabupaten Tapanuli Utara, Sumatera Utara 22312;Jl. Bandara Silangit, Silando, Kec. Muara, Kabupaten Tapanuli Utara;SUMATERA UTARA;22312;Indonesia;82366936961;22.629.067;989.983.795;https://maps.google.com/?cid=0x0:0x623bb7e67b869066
supermarket bangunan;Toko Bahan Bangunan;Valentino Jaya Abadi;Jl. Raja Paindoan No.18, Lumban Dolok Haume Bange, Kec. Balige, Toba, Sumatera Utara 22312;Lumban Dolok Haume Bange, Kec. Balige, Toba;SUMATERA UTARA;22312;Indonesia;81210122243;23.329.941;990.658.715;https://maps.google.com/?cid=0x0:0x33f61cde67a3a200
supermarket bangunan;Toko;Toko Sejahtera;Jl. Sisingamangaraja No.6, Napitupulu, Kec. Balige, Toba, Sumatera Utara 22311;Napitupulu, Kec. Balige, Toba;SUMATERA UTARA;22311;Indonesia;81320214148;23.347.208;990.646.691;https://maps.google.com/?cid=0x0:0xb378a0349625801c
supermarket bangunan;Pemasok Bahan Bangunan;Wijaya Bangunan;Jl. Siliwangi, Kec. Balige, Toba, Sumatera Utara 78384;Kec. Balige, Toba;SUMATERA UTARA;78384;Indonesia;82364222719;23.358.562;990.623.531;https://maps.google.com/?cid=0x0:0x9a72372f623ef5a3
supermarket bangunan;Pemasok Bahan Bangunan;Toko Bangunan Posma Sari Balige;83PG+V54, Jalan, Sibola Hotangsas, Balige, Toba, North Sumatra;Toba, Sumatera Utara;SUMATERA UTARA;;Indonesia;81264259256;23.371.251;990.754.489;https://maps.google.com/?cid=0x0:0xefa7f591a35bbb
supermarket bangunan;Toko Bahan Bangunan;Toko Bangunan;7X2X+7HP, Parik Sabungan, Kec. Siborongborong, Kabupaten Tapanuli Utara, Sumatera Utara 22312;Parik Sabungan, Kec. Siborongborong, Kabupaten Tapanuli Utara;SUMATERA UTARA;22312;Indonesia;82272769816;22.507.213;989.989.675;https://maps.google.com/?cid=0x0:0x80a7d28754ddb7bf
supermarket bangunan;Toko Bahan Bangunan;UD. Michelle;Jalan Simpang Muara Silangit No.Desa, Parik Sabungan, Kec. Siborongborong, Kabupaten Tapanuli Utara, Sumatera Utara 22474;Parik Sabungan, Kec. Siborongborong, Kabupaten Tapanuli Utara;SUMATERA UTARA;22474;Indonesia;81375369881;22.632.162;990.020.468;https://maps.google.com/?cid=0x0:0xa67a9cd447dae4c9
supermarket bangunan;Pemasok Bahan Bangunan;Toko parpipa Tampubolon;83M8+GG8, Jl. Patuan Anggi, Lumban Dolok Haume Bange, Kec. Balige, Toba, Sumatera Utara;Toba, Sumatera Utara;SUMATERA UTARA;;Indonesia;;23.337.765;990.663.406;https://maps.google.com/?cid=0x0:0xfa389cb0d54b2192
supermarket bangunan;Toko Bahan Bangunan;Toko Generasi;83M9+JH7, Pasar Jl. Sisingamangaraja, Napitupulu Bagasan, Kec. Balige, Toba, Sumatera Utara;Toba, Sumatera Utara;SUMATERA UTARA;;Indonesia;;23.340.322;990.689.372;https://maps.google.com/?cid=0x0:0x13ddde66d3e6055e
supermarket bangunan;Toko Bahan Bangunan;Toko Hapanda;Jl. Sisingamangaraja No.28, Balige II, Kec. Balige, Toba, Sumatera Utara 22312;Balige II, Kec. Balige, Toba;SUMATERA UTARA;22312;Indonesia;632322344;23.338.921;990.710.149;https://maps.google.com/?cid=0x0:0xe49c7b6fe835d518
supermarket bangunan;Toko Bahan Bangunan;UD Waldy;Jl. Bukit Barisan No.3, Kec. Balige, Toba, Sumatera Utara 22312;Kec. Balige, Toba;SUMATERA UTARA;22312;Indonesia;;23.358.749;990.623.618;https://maps.google.com/?cid=0x0:0xc000a1a9fd3b1719
supermarket bangunan;Rumah Pondokan;Wisma Tondong;Jalan Tarutung - Balige, Simpang Sianjur, Desa, Parik Sabungan, Kec. Siborongborong, Kabupaten Tapanuli Utara, Sumatera Utara 22474;Simpang Sianjur, Desa, Parik Sabungan, Kec. Siborongborong, Kabupaten Tapanuli Utara;SUMATERA UTARA;22474;Indonesia;82272769816;22.507.702;989.988.114;https://maps.google.com/?cid=0x0:0x285172a0bf3a7e93
supermarket bangunan;Toko Bahan Bangunan;Cv.Bintang Terang;C4J8+GG3, Partoruan Janji Matogu, Kec. Uluan, Toba, Sumatera Utara 22384;Partoruan Janji Matogu, Kec. Uluan, Toba;SUMATERA UTARA;22384;Indonesia;;24.312.742;991.162.813;https://maps.google.com/?cid=0x0:0x46760b72c87a2bd7
supermarket bangunan;Toko Bahan Bangunan;CV.Hotma Pulungan;G47J+QQ7, Lumban Lobu, Kabupaten Toba, Toba, Sumatera Utara 22386;Lumban Lobu, Kabupaten Toba, Toba;SUMATERA UTARA;22386;Indonesia;;25.144.086;991.319.199;https://maps.google.com/?cid=0x0:0x648f64aab5bf3c71
supermarket bangunan;supermarket bangunan;Sumatera Utara 22385;Kec. Uluan, Toba, Sumatera Utara;Toba, Sumatera Utara;SUMATERA UTARA;;Indonesia;;24.319.358;99.098.584;https://maps.google.com/?cid=0x0:0x6b3c735c6e1bedc7
supermarket bangunan;Kantor Perusahaan;Toko Bangunan CV.Bersama (Garuda Rajagukguk);C5W4+XPF, Jl. Dr. bisuk Siahaan, Parparean IV, Kec. Parmaksian, Toba, Sumatera Utara 22384;Jl. Dr. bisuk Siahaan, Parparean IV, Kec. Parmaksian, Toba;SUMATERA UTARA;22384;Indonesia;81361158234;24.474.336;991.567.975;https://maps.google.com/?cid=0x0:0xe29b88afa49f48aa
mall;mall;Kec. Ajibata;Toba, Sumatera Utara;Toba, Sumatera Utara;SUMATERA UTARA;;Indonesia;;25.963.467;989.706.883;https://maps.google.com/?cid=0x0:0xfb02817ce17ade9a
mall;Toko;Mysolatt Mart;JWHG+WM4, Parsaoran Ajibata, Kec. Ajibata, Toba, Sumatera Utara 22386;Parsaoran Ajibata, Kec. Ajibata, Toba;SUMATERA UTARA;22386;Indonesia;85262178984;26.297.663;989.267.047;https://maps.google.com/?cid=0x0:0x9587d91f0c9274f2
mall;Terminal Feri;Pelabuhan Ajibata;MW5M+QRH, Jl. Justin Sirait, Pardamean Ajibata, Kec. Ajibata, Kabupaten Simalungun, Sumatera Utara 21174;Jl. Justin Sirait, Pardamean Ajibata, Kec. Ajibata, Kabupaten Simalungun;SUMATERA UTARA;21174;Indonesia;;26.594.408;989.346.176;https://maps.google.com/?cid=0x0:0x94b49e482663d92d
mall;Pusat Perbelanjaan;Motung Arabika Coffee;JWMM+MWW Lumban Sitorus Motung, Parsaoran Ajibata, Ajibata, Toba, North Sumatra 22386;Parsaoran Ajibata, Ajibata, Toba;SUMATERA UTARA;22386;Indonesia;85261078677;26.342.489;989.348.171;https://maps.google.com/?cid=0x0:0xd910d80922e2fc53
mall;Pusat Perbelanjaan;Pusat kota;MW7M+2M3, Tiga Raja, Kec. Girsang Sipangan Bolon, Kabupaten Simalungun, Sumatera Utara;Kabupaten Simalungun, Sumatera Utara;SUMATERA UTARA;;Indonesia;;26.625.151;989.341.627;https://maps.google.com/?cid=0x0:0xfcd0823042efcc8
mall;Toko Pakaian;"Tobatak Goods  Wears""""";Jl. Haranggaol No.17, Siburakburak, Kec. Girsang Sipangan Bolon, Kabupaten Simalungun, Sumatera Utara 21174;Siburakburak, Kec. Girsang Sipangan Bolon, Kabupaten Simalungun;SUMATERA UTARA;21174;Indonesia;82216315454;26.643.547;989.312.982;https://maps.google.com/?cid=0x0:0xf33e0f442d340adc
mall;Pusat Perbelanjaan;Mora Coffee Motung;JWMM+PW6 Lumban Sitorus, Motung, Ajibata, Toba, North Sumatra 22386;Motung, Ajibata, Toba;SUMATERA UTARA;22386;Indonesia;;26.342.866;989.347.694;https://maps.google.com/?cid=0x0:0xf9e4f37b64d0cd57
mall;ATM;BRILink Cello Sitorus;HXVF+FHX, Parsaoran Sibisa, Kec. Ajibata, Toba, Sumatera Utara 21174;Parsaoran Sibisa, Kec. Ajibata, Toba;SUMATERA UTARA;21174;Indonesia;;25.937.352;989.739.993;https://maps.google.com/?cid=0x0:0xe9df99839dcf6db
mall;Terminal Feri;PELABUHAN FERRY KMP. TAO TOBA AJIBATA;Jl. Justin Sirait No.32, Pardamean Ajibata, Toba, Sumatera Utara 21174;Pardamean Ajibata, Toba;SUMATERA UTARA;21174;Indonesia;82161699668;26.540.532;989.339.128;https://maps.google.com/?cid=0x0:0x2a730bb3f8d137ae
mall;mall;Pardamean Ajibata;Kec. Ajibata, Toba, Sumatera Utara;Toba, Sumatera Utara;SUMATERA UTARA;;Indonesia;;26.484.825;989.383.338;https://maps.google.com/?cid=0x0:0xa0c5375ef3bef6e
mall;Grup Seni Pertunjukan;Cristin Buah;Pasar, Tiga Raja, Kec. Girsang Sipangan Bolon, Kabupaten Simalungun, Sumatera Utara 21174;Tiga Raja, Kec. Girsang Sipangan Bolon, Kabupaten Simalungun;SUMATERA UTARA;21174;Indonesia;;26.610.194;989.308.618;https://maps.google.com/?cid=0x0:0x6fb67008fb11bf8e
mall;Tujuan Wisata;The Kaldera;Sigapiton, Kec. Ajibata, Toba, Sumatera Utara;Toba, Sumatera Utara;SUMATERA UTARA;;Indonesia;6142002060;26.067.911;989.459.367;https://maps.google.com/?cid=0x0:0x75154767a18d02c8
mall;Pusat Perbelanjaan;Merdeka united;MW7V+MRW, Jl. Merdeka, Tiga Raja, Kec. Girsang Sipangan Bolon, Kabupaten Simalungun, Sumatera Utara 21174;Jl. Merdeka, Tiga Raja, Kec. Girsang Sipangan Bolon, Kabupaten Simalungun;SUMATERA UTARA;21174;Indonesia;81377010569;26.642.408;98.944.588;https://maps.google.com/?cid=0x0:0x9d6d3761e426170a
mall;Kantor Perusahaan;PT. ASDP Indonesia Ferry (Persero) Danau Toba;Pardamean Ajibata, Kec. Girsang Sipangan Bolon, Toba, Sumatera Utara;Toba, Sumatera Utara;SUMATERA UTARA;;Indonesia;82181653659;26.593.194;98.934.446;https://maps.google.com/?cid=0x0:0xfff400b1cc9cb91
mall;mall;Sumatera Utara 22311;Kec. Balige, Toba, Sumatera Utara;Toba, Sumatera Utara;SUMATERA UTARA;;Indonesia;;23.090.226;990.640.199;https://maps.google.com/?cid=0x0:0xdd78aaebf862e5b
mall;Balai masyarakat;Pasar Balige;83M8+M7M, Jl. Sisingamangaraja, Napitupulu Bagasan, Kec. Balige, Toba, Sumatera Utara;Toba, Sumatera Utara;SUMATERA UTARA;;Indonesia;;23.342.217;990.656.871;https://maps.google.com/?cid=0x0:0x2def9558f53e68b4
mall;Toko bahan makanan;Alfamidi Jl. Gereja Balige;83M8+9V5, Lumban Dolok Haume Bange, Kec. Balige, Toba, Sumatera Utara;Toba, Sumatera Utara;SUMATERA UTARA;;Indonesia;81584465794;23.333.867;990.672.464;https://maps.google.com/?cid=0x0:0x6ff670441e01bcc8
mall;Pasar;Balerong - Balige, Toba Samosir, North Sumatra, Indonesia;Jl. Lintas Sumatera No.88, Napitupulu Bagasan, Kec. Balige, Toba, Sumatera Utara 22312;Napitupulu Bagasan, Kec. Balige, Toba;SUMATERA UTARA;22312;Indonesia;;23.343.791;990.657.796;https://maps.google.com/?cid=0x0:0xb7ec069919b52c02
mall;Toko;Thesa ulos;Jl. Sisingamangaraja No.9, Gurgur Aek Raja, Kec. Balige, Toba, Sumatera Utara 22311;Gurgur Aek Raja, Kec. Balige, Toba;SUMATERA UTARA;22311;Indonesia;82272698831;23.269.664;990.131.493;https://maps.google.com/?cid=0x0:0x7fe2b74660f6b2b7
mall;Layanan Transportasi;Pelabuhan Penyeberangan Balige;Jl. Bukit Barisan No.15, Kec. Balige, Toba, Sumatera Utara 22312;Kec. Balige, Toba;SUMATERA UTARA;22312;Indonesia;;23.374.423;990.628.054;https://maps.google.com/?cid=0x0:0x9fa1a51e227d7cbf
mall;Toko Swalayan;MR. DIY;Jl. Patuan Nagari, Pardede Onan, Kec. Balige, Toba, Sumatera Utara;Toba, Sumatera Utara;SUMATERA UTARA;;Indonesia;81361507404;23.340.954;990.632.255;https://maps.google.com/?cid=0x0:0xc582fc1623f025da
mall;Toko sembako pemerintah;Welshop;Jalan By Pass, Parsuratan, Kec. Balige, Toba, Sumatera Utara 22312;Parsuratan, Kec. Balige, Toba;SUMATERA UTARA;22312;Indonesia;85277301111;23.209.559;990.889.074;https://maps.google.com/?cid=0x0:0xfc74fdb343b5bb02
mall;mall;Papua Mart Balige;Jl. Baba Lubis, Sangkarnihuta Listrik, Dekat Gereja Katolik Balige, Kec. Balige, Sumatera Utara;Toba, Sumatera Utara;SUMATERA UTARA;;Indonesia;8116204885;23.306.282;990.591.885;https://maps.google.com/?cid=0x0:0x110515b27d8fe45e
mall;Arena Perlombaan;Puncak Sibodiala;827Q+3WJ Puncak Sibodiala, Silalahi Pagar Batu, Kec. Balige, Toba, Sumatera Utara;Toba, Sumatera Utara;SUMATERA UTARA;;Indonesia;;23.127.244;990.397.609;https://maps.google.com/?cid=0x0:0x6db82082598b850d
mall;Komplek perumahan;PERUMAHAN DL;83WW+29H, Lumban Gaol, Kec. Balige, Toba, Sumatera Utara;Toba, Sumatera Utara;SUMATERA UTARA;;Indonesia;;23.450.695;990.959.777;https://maps.google.com/?cid=0x0:0x210e9b2754aba45d
mall;Toko Kesehatan dan Kecantikan;CNI-Store Mulia Raja (Balige);Kompleks : Ruko Subur, Jl. Mulia Raja No.8, Kelurahan Napitupulu, Kec. Balige, Toba, Sumatera Utara 22312;Jl. Mulia Raja No.8, Kelurahan Napitupulu, Kec. Balige, Toba;SUMATERA UTARA;22312;Indonesia;81362025396;23.375.497;990.636.713;https://maps.google.com/?cid=0x0:0xb9e21255804f9b46
mall;mall;Sumatera Utara 22312;Kec. Tampahan, Toba, Sumatera Utara;Toba, Sumatera Utara;SUMATERA UTARA;;Indonesia;;22.639.672;990.681.668;https://maps.google.com/?cid=0x0:0x55fb2041cbca315
mall;Pusat Perbelanjaan;Master;84V2+VMH, Lumban Gaol, Kec. Balige, Toba, Sumatera Utara;Toba, Sumatera Utara;SUMATERA UTARA;;Indonesia;82160057154;2.344.693;99.101.742;https://maps.google.com/?cid=0x0:0x4a8fbbb6ec86b805
mall;Pasar;Balerong - Balige, Toba Samosir, North Sumatra, Indonesia;Jl. Lintas Sumatera No.88, Napitupulu Bagasan, Kec. Balige, Toba, Sumatera Utara 22312;Napitupulu Bagasan, Kec. Balige, Toba;SUMATERA UTARA;22312;Indonesia;;23.343.791;990.657.796;https://maps.google.com/?cid=0x0:0xb7ec069919b52c02
mall;Toko;Thesa ulos;Jl. Sisingamangaraja No.9, Gurgur Aek Raja, Kec. Balige, Toba, Sumatera Utara 22311;Gurgur Aek Raja, Kec. Balige, Toba;SUMATERA UTARA;22311;Indonesia;82272698831;23.269.664;990.131.493;https://maps.google.com/?cid=0x0:0x7fe2b74660f6b2b7
mall;Toko bahan makanan;Alfamidi Hinalang Balige;Jl. Lintas Sumatera No.16, Hinalang Bagasan, Kec. Balige, Toba, Sumatera Utara 22312;Hinalang Bagasan, Kec. Balige, Toba;SUMATERA UTARA;22312;Indonesia;;23.265.391;990.513.577;https://maps.google.com/?cid=0x0:0x198ba68089423c4a
mall;mall;Balige;Sibola Hotangsas, Kec. Balige, Toba, Sumatera Utara;Toba, Sumatera Utara;SUMATERA UTARA;;Indonesia;;23.337.119;99.083.252;https://maps.google.com/?cid=0x0:0xc6beb74287f355a5
mall;Toko bahan makanan;Alfamidi Jl. Gereja Balige;83M8+9V5, Lumban Dolok Haume Bange, Kec. Balige, Toba, Sumatera Utara;Toba, Sumatera Utara;SUMATERA UTARA;;Indonesia;81584465794;23.333.867;990.672.464;https://maps.google.com/?cid=0x0:0x6ff670441e01bcc8
mall;Toko;Subur Jaya;83MM+F8J, Sibola Hotangsas, Kec. Balige, Toba, Sumatera Utara;Toba, Sumatera Utara;SUMATERA UTARA;;Indonesia;;23.337.119;99.083.252;https://maps.google.com/?cid=0x0:0x193d5a02568f4bb3
mall;Layanan Transportasi;Pelabuhan Penyeberangan Balige;Jl. Bukit Barisan No.15, Kec. Balige, Toba, Sumatera Utara 22312;Kec. Balige, Toba;SUMATERA UTARA;22312;Indonesia;;23.374.423;990.628.054;https://maps.google.com/?cid=0x0:0x9fa1a51e227d7cbf
mall;Toko sembako pemerintah;Welshop;Jalan By Pass, Parsuratan, Kec. Balige, Toba, Sumatera Utara 22312;Parsuratan, Kec. Balige, Toba;SUMATERA UTARA;22312;Indonesia;85277301111;23.209.559;990.889.074;https://maps.google.com/?cid=0x0:0xfc74fdb343b5bb02
mall;Restoran;Hutanta Cafe;Jl. P. Siantar No.KM 2, Sibola Hotangsas, Kec. Balige, Toba, Sumatera Utara 22312;Sibola Hotangsas, Kec. Balige, Toba;SUMATERA UTARA;22312;Indonesia;8111926991;23.383.059;990.812.835;https://maps.google.com/?cid=0x0:0x8a2c3d5bd45ef7ee
mall;mall;Sumatera Utara 22313;Kec. Balige, Toba, Sumatera Utara;Toba, Sumatera Utara;SUMATERA UTARA;;Indonesia;;23.017.352;990.612.554;https://maps.google.com/?cid=0x0:0x6905910a0ac5487b
mall;Balai masyarakat;Pasar Balige;83M8+M7M, Jl. Sisingamangaraja, Napitupulu Bagasan, Kec. Balige, Toba, Sumatera Utara;Toba, Sumatera Utara;SUMATERA UTARA;;Indonesia;;23.342.217;990.656.871;https://maps.google.com/?cid=0x0:0x2def9558f53e68b4
mall;Pusat Perbelanjaan;Master;84V2+VMH, Lumban Gaol, Kec. Balige, Toba, Sumatera Utara;Toba, Sumatera Utara;SUMATERA UTARA;;Indonesia;82160057154;2.344.693;99.101.742;https://maps.google.com/?cid=0x0:0x4a8fbbb6ec86b805
mall;Toko;Thesa ulos;Jl. Sisingamangaraja No.9, Gurgur Aek Raja, Kec. Balige, Toba, Sumatera Utara 22311;Gurgur Aek Raja, Kec. Balige, Toba;SUMATERA UTARA;22311;Indonesia;82272698831;23.269.664;990.131.493;https://maps.google.com/?cid=0x0:0x7fe2b74660f6b2b7
mall;Toko bahan makanan;Alfamidi Jl. Gereja Balige;83M8+9V5, Lumban Dolok Haume Bange, Kec. Balige, Toba, Sumatera Utara;Toba, Sumatera Utara;SUMATERA UTARA;;Indonesia;81584465794;23.333.867;990.672.464;https://maps.google.com/?cid=0x0:0x6ff670441e01bcc8
mall;Toko Ponsel;Pardes Ponsel;Jl. Sisingamangaraja No.Kelurahan, Balige I, Kec. Balige, Toba, Sumatera Utara 22313;Balige I, Kec. Balige, Toba;SUMATERA UTARA;22313;Indonesia;82167773454;2.334.198;990.672.133;https://maps.google.com/?cid=0x0:0x1b6d1e94563e174c
mall;Layanan Transportasi;Pelabuhan Penyeberangan Balige;Jl. Bukit Barisan No.15, Kec. Balige, Toba, Sumatera Utara 22312;Kec. Balige, Toba;SUMATERA UTARA;22312;Indonesia;;23.374.423;990.628.054;https://maps.google.com/?cid=0x0:0x9fa1a51e227d7cbf
mall;Toko Swalayan;MR. DIY;Jl. Patuan Nagari, Pardede Onan, Kec. Balige, Toba, Sumatera Utara;Toba, Sumatera Utara;SUMATERA UTARA;;Indonesia;81361507404;23.340.954;990.632.255;https://maps.google.com/?cid=0x0:0xc582fc1623f025da
