Category;Real Category;Business Name;Address;City;State;Postal Code;Country;Phone;Latitude;Longitude;Map Link
cafe;Restoran;RM Podomoro;H2VM+3H3, Jl. Lintas Sumatera, Sionggang Utara, Kec. Lumban Julu, Toba, Sumatera Utara 22386;Jl. Lintas Sumatera, Sionggang Utara, Kec. Lumban Julu, Toba;SUMATERA UTARA;22386;Indonesia;82162339926;25.926.342;990.339.344;https://maps.google.com/?cid=0x0:0x48cd563a202e4cd0
cafe;cafe;Sumatera Utara 22383;Kec. Borbor, Toba, Sumatera Utara;Toba, Sumatera Utara;SUMATERA UTARA;;Indonesia;;23.103.966;994.117.197;https://maps.google.com/?cid=0x0:0xf766a39a824a797d
cafe;cafe;Nassau;Batu Manumpak, Kec. Nassau, Toba, Sumatera Utara;Toba, Sumatera Utara;SUMATERA UTARA;;Indonesia;;2.266.667;99.416.667;https://maps.google.com/?cid=0x0:0x59b40b4a0b316441
cafe;Kedai Kopi;Batas Kafe;7FJ9+647, Siantarasa, Kec. Nassau, Toba, Sumatera Utara 22383;Siantarasa, Kec. Nassau, Toba;SUMATERA UTARA;22383;Indonesia;;22.805.409;994.677.901;https://maps.google.com/?cid=0x0:0xd1c296deef29e3d6
cafe;Indonesia;SINI CAFE;No.77 A, Jl. Sei Asahan Keluarahan, Padang Bulan Selayang I, Kec. Medan Selayang, Kota Medan, Sumatera Utara 20154;Jl. Sei Asahan Keluarahan, Padang Bulan Selayang I, Kec. Medan Selayang, Kota Medan;SUMATERA UTARA;20154;Indonesia;8116162333;35.717.406;986.467.814;https://maps.google.com/?cid=0x0:0x4f038e8faf82b9b7
cafe;Kedai Kopi;Sana Sini Cafe;Jl. Bunga Tj. XI No.14, Tj. Sari, Kec. Medan Selayang, Kota Medan, Sumatera Utara 20133;Tj. Sari, Kec. Medan Selayang, Kota Medan;SUMATERA UTARA;20133;Indonesia;81361309706;35.594.117;986.305.477;https://maps.google.com/?cid=0x0:0x404e48592fab36e2
cafe;cafe;Kec. Parmaksian;Toba, Sumatera Utara;Toba, Sumatera Utara;SUMATERA UTARA;;Indonesia;;24.648.679;991.885.048;https://maps.google.com/?cid=0x0:0x8815bba38c5deaa2
cafe;Kedai Kopi;Kafe Panatapan;F5GX+457, Banjar Ganjang, Kec. Parmaksian, Toba, Sumatera Utara 22384;Banjar Ganjang, Kec. Parmaksian, Toba;SUMATERA UTARA;22384;Indonesia;;24.752.856;991.979.212;https://maps.google.com/?cid=0x0:0xb9bb39e6078f06af
cafe;Restoran;Simpang Empat Desa Banjar Ganjang;F56F+QXV, Jl. Prof. Dr. Midian Sirait, Bius Gu Barat, Kec. Parmaksian, Toba, Sumatera Utara 22384;Jl. Prof. Dr. Midian Sirait, Bius Gu Barat, Kec. Parmaksian, Toba;SUMATERA UTARA;22384;Indonesia;85359111705;24.619.918;991.749.129;https://maps.google.com/?cid=0x0:0x8b4297768b88cb49
cafe;Kedai Kopi;Destiny coffee;F57Q+H35, Jl. Sigura - Gura, Jonggi Manulus, Kec. Parmaksian, Toba, Sumatera Utara 22384;Jl. Sigura - Gura, Jonggi Manulus, Kec. Parmaksian, Toba;SUMATERA UTARA;22384;Indonesia;;24.638.937;991.877.295;https://maps.google.com/?cid=0x0:0xe7a8816f653183a5
cafe;Kedai Kopi;Kedai Kopi Op GANDA;F56F+VWX, simpang empat, Banjar Ganjang, Kec. Parmaksian, Toba, Sumatera Utara 22384;simpang empat, Banjar Ganjang, Kec. Parmaksian, Toba;SUMATERA UTARA;22384;Indonesia;85359111705;24.622.328;991.748.724;https://maps.google.com/?cid=0x0:0xc1e659371f3f4265
cafe;Kedai Kopi;Warung Op Maria;Pangombusan, Kec. Parmaksian, Toba, Sumatera Utara 22384;Kec. Parmaksian, Toba;SUMATERA UTARA;22384;Indonesia;;24.801.401;991.926.741;https://maps.google.com/?cid=0x0:0x4e46afc899bc3096
cafe;Kedai Kopi;Kedai Kopi Hitar Jaya Coffee;F56F+VWX, Jonggi Manulus, Kec. Parmaksian, Toba, Sumatera Utara 22384;Jonggi Manulus, Kec. Parmaksian, Toba;SUMATERA UTARA;22384;Indonesia;;24.622.388;991.748.683;https://maps.google.com/?cid=0x0:0x4fc096a7d5f2a849
cafe;Batak;Rotiart cafe resto;F57Q+XCC, Jl dr bisuk siahaan, simpang empat, Kec. Parmaksian, Toba, Sumatera Utara;Toba, Sumatera Utara;SUMATERA UTARA;;Indonesia;82387392061;24.649.303;991.885.209;https://maps.google.com/?cid=0x0:0x9520fb3c5b716ba
cafe;Nasi;LAPO TUAK CANDRO;F5FF+HC9, Pangombusan, Kec. Parmaksian, Toba, Sumatera Utara 22384;Pangombusan, Kec. Parmaksian, Toba;SUMATERA UTARA;22384;Indonesia;82110718124;24.739.104;991.736.246;https://maps.google.com/?cid=0x0:0x26c86f96f60b7770
cafe;Kedai Kopi;Warung Oppung Dava (Mak Septi);F5FF+HC9, Pangombusan, Kec. Parmaksian, Toba, Sumatera Utara 22384;Pangombusan, Kec. Parmaksian, Toba;SUMATERA UTARA;22384;Indonesia;;24.738.046;991.737.235;https://maps.google.com/?cid=0x0:0x8a722995968cebb6
cafe;Kedai Kopi;Anto cafe;F6M3+48Q, Pangombusan, Kec. Parmaksian, Toba, Sumatera Utara 22384;Pangombusan, Kec. Parmaksian, Toba;SUMATERA UTARA;22384;Indonesia;;24.828.472;992.033.652;https://maps.google.com/?cid=0x0:0xc294b221954f755
cafe;Kedai Kopi;Kedai opung azhar;Jl. Sabam Sirait No.150, Jonggi Manulus, Kec. Parmaksian, Toba, Sumatera Utara 22384;Jonggi Manulus, Kec. Parmaksian, Toba;SUMATERA UTARA;22384;Indonesia;81273103506;24.501.321;991.732.804;https://maps.google.com/?cid=0x0:0xa74b6856aba551f0
cafe;Kafe;Cafe Marlumba;F6P3+PMW, Jl. Sigura - Gura, Pangombusan, Kec. Parmaksian, Toba, Sumatera Utara 22384;Jl. Sigura - Gura, Pangombusan, Kec. Parmaksian, Toba;SUMATERA UTARA;22384;Indonesia;;24.868.639;992.041.896;https://maps.google.com/?cid=0x0:0xca401256a7d02257
cafe;Kedai Kopi;Posma Coffee  Resto;C5W4+92J, Ps. Porsea, Kec. Porsea, Toba, Sumatera Utara 22384;Ps. Porsea, Kec. Porsea, Toba;SUMATERA UTARA;22384;Indonesia;;24.459.681;991.550.091;https://maps.google.com/?cid=0x0:0x4c14fc4b25c7fbc3
cafe;cafe;Sumatera Utara 22384;Toba, Sumatera Utara;Toba, Sumatera Utara;SUMATERA UTARA;;Indonesia;;24.479.424;992.563.859;https://maps.google.com/?cid=0x0:0x2ed6716afbaeaafb
cafe;Kedai Kopi;Posma Coffee  Resto;C5W4+92J, Ps. Porsea, Kec. Porsea, Toba, Sumatera Utara 22384;Ps. Porsea, Kec. Porsea, Toba;SUMATERA UTARA;22384;Indonesia;;24.459.681;991.550.091;https://maps.google.com/?cid=0x0:0x4c14fc4b25c7fbc3
cafe;Kafe;Hitaro Beta Cafe;Jl. Sigura - Gura, Banjar Ganjang, Kec. Parmaksian, Toba, Sumatera Utara 22384;Banjar Ganjang, Kec. Parmaksian, Toba;SUMATERA UTARA;22384;Indonesia;81290808980;24.617.962;991.706.697;https://maps.google.com/?cid=0x0:0x917476b9e39960a0
cafe;Kafe;Cafe Joss;G7F7+HCW, Ambar Halim, Kec. Pintu Pohan Merant, Toba, Sumatera Utara 22384;Ambar Halim, Kec. Pintu Pohan Merant, Toba;SUMATERA UTARA;22384;Indonesia;;25.239.996;992.635.641;https://maps.google.com/?cid=0x0:0x51b08c5a66a42896
cafe;Stan Kopi;Muliadong Coffee;Jl. Sisingamangaraja No.39, Ps. Porsea, Kec. Porsea, Toba, Sumatera Utara 22384;Ps. Porsea, Kec. Porsea, Toba;SUMATERA UTARA;22384;Indonesia;82166475511;24.434.733;99.159.609;https://maps.google.com/?cid=0x0:0x7062b50d74df0fbe
cafe;Kedai Kopi;Cafè WakuWaku Toba;Jl. Sisingamangaraja XII, Ps. Porsea, Kec. Porsea, Toba, Sumatera Utara 22384;Ps. Porsea, Kec. Porsea, Toba;SUMATERA UTARA;22384;Indonesia;82369036202;24.463.328;991.550.337;https://maps.google.com/?cid=0x0:0xb8d684f2f83d41c3
cafe;Restoran;Simpang Empat Desa Banjar Ganjang;F56F+QXV, Jl. Prof. Dr. Midian Sirait, Bius Gu Barat, Kec. Parmaksian, Toba, Sumatera Utara 22384;Jl. Prof. Dr. Midian Sirait, Bius Gu Barat, Kec. Parmaksian, Toba;SUMATERA UTARA;22384;Indonesia;85359111705;24.619.918;991.749.129;https://maps.google.com/?cid=0x0:0x8b4297768b88cb49
cafe;Kedai Kopi;FPO COFFEE;F522+7X4, Jl. Lintas Sumatera, Patane III, Kec. Porsea, Toba, Sumatera Utara 22384;Jl. Lintas Sumatera, Patane III, Kec. Porsea, Toba;SUMATERA UTARA;22384;Indonesia;;24.506.369;991.524.621;https://maps.google.com/?cid=0x0:0xac45d9e90ed337fd
cafe;Kedai Kopi;Kafe Panatapan;F5GX+457, Banjar Ganjang, Kec. Parmaksian, Toba, Sumatera Utara 22384;Banjar Ganjang, Kec. Parmaksian, Toba;SUMATERA UTARA;22384;Indonesia;;24.752.856;991.979.212;https://maps.google.com/?cid=0x0:0xb9bb39e6078f06af
cafe;Kedai Kopi;Porsea;siraituruk Patane 1, Patane V, Kec. Porsea, Toba, Sumatera Utara 22384;Patane V, Kec. Porsea, Toba;SUMATERA UTARA;22384;Indonesia;;24.691.533;991.449.875;https://maps.google.com/?cid=0x0:0xe4c0340fbf92e633
cafe;Rumah Kaca;Pasar Baru;C5W9+2Q8, Parparean IV, Kec. Porsea, Toba, Sumatera Utara 22384;Parparean IV, Kec. Porsea, Toba;SUMATERA UTARA;22384;Indonesia;;24.450.366;991.694.614;https://maps.google.com/?cid=0x0:0x3575372107ca6c2b
cafe;Kedai Kopi;Kedai Kopi Hitar Jaya Coffee;F56F+VWX, Jonggi Manulus, Kec. Parmaksian, Toba, Sumatera Utara 22384;Jonggi Manulus, Kec. Parmaksian, Toba;SUMATERA UTARA;22384;Indonesia;;24.622.388;991.748.683;https://maps.google.com/?cid=0x0:0x4fc096a7d5f2a849
cafe;Kedai Kopi;Destiny coffee;F57Q+H35, Jl. Sigura - Gura, Jonggi Manulus, Kec. Parmaksian, Toba, Sumatera Utara 22384;Jl. Sigura - Gura, Jonggi Manulus, Kec. Parmaksian, Toba;SUMATERA UTARA;22384;Indonesia;;24.638.937;991.877.295;https://maps.google.com/?cid=0x0:0xe7a8816f653183a5
cafe;Kedai Kopi;Kedai Kopi Bona - Porsea;C5V4+JCF, Ps. Porsea, Kec. Porsea, Toba, Sumatera Utara 22384;Ps. Porsea, Kec. Porsea, Toba;SUMATERA UTARA;22384;Indonesia;;24.440.561;991.560.316;https://maps.google.com/?cid=0x0:0x1928463dbfb2d4af
cafe;cafe;Porsea;Patane I, Kec. Porsea, Toba, Sumatera Utara;Toba, Sumatera Utara;SUMATERA UTARA;;Indonesia;;2.461.736;99.136.017;https://maps.google.com/?cid=0x0:0x530e7df2317874c0
cafe;Restoran;Quality Time Cafe;Jl. Patuan Nagari No.49, Ps. Porsea, Kec. Porsea, Toba, Sumatera Utara 22384;Ps. Porsea, Kec. Porsea, Toba;SUMATERA UTARA;22384;Indonesia;81265856042;2.445.189;9.915.714;https://maps.google.com/?cid=0x0:0xa06b380d9db2cf6c
cafe;Kedai Kopi;Porsea;siraituruk Patane 1, Patane V, Kec. Porsea, Toba, Sumatera Utara 22384;Patane V, Kec. Porsea, Toba;SUMATERA UTARA;22384;Indonesia;;24.691.533;991.449.875;https://maps.google.com/?cid=0x0:0xe4c0340fbf92e633
cafe;Kedai Kopi;Tabobah Cafe;Jl pasar raja, Parparean III, Kec. Porsea, Toba, Sumatera Utara 22384;Parparean III, Kec. Porsea, Toba;SUMATERA UTARA;22384;Indonesia;81262941511;24.402.861;991.574.241;https://maps.google.com/?cid=0x0:0x64bc306729efb892
cafe;Kedai Kopi;FPO COFFEE;F522+7X4, Jl. Lintas Sumatera, Patane III, Kec. Porsea, Toba, Sumatera Utara 22384;Jl. Lintas Sumatera, Patane III, Kec. Porsea, Toba;SUMATERA UTARA;22384;Indonesia;;24.506.369;991.524.621;https://maps.google.com/?cid=0x0:0xac45d9e90ed337fd
cafe;Rumah Kaca;Pasar Baru;C5W9+2Q8, Parparean IV, Kec. Porsea, Toba, Sumatera Utara 22384;Parparean IV, Kec. Porsea, Toba;SUMATERA UTARA;22384;Indonesia;;24.450.366;991.694.614;https://maps.google.com/?cid=0x0:0x3575372107ca6c2b
cafe;Kedai Kopi;Point Coffee Porsea;C5X3+6P2, Patane III, Kec. Porsea, Toba, Sumatera Utara 22384;Patane III, Kec. Porsea, Toba;SUMATERA UTARA;22384;Indonesia;;24.480.544;991.542.826;https://maps.google.com/?cid=0x0:0xc6636479a61e722a
cafe;Kedai Kopi;Kedai Kopi Bona - Porsea;C5V4+JCF, Ps. Porsea, Kec. Porsea, Toba, Sumatera Utara 22384;Ps. Porsea, Kec. Porsea, Toba;SUMATERA UTARA;22384;Indonesia;;24.440.561;991.560.316;https://maps.google.com/?cid=0x0:0x1928463dbfb2d4af
cafe;Kedai Kopi;SUNSET CAFE;Parparean II, Kec. Porsea, Toba, Sumatera Utara 22384;Kec. Porsea, Toba;SUMATERA UTARA;22384;Indonesia;;2.430.804;991.496.309;https://maps.google.com/?cid=0x0:0x7a7eeb8043c73a83
cafe;Kedai Kopi;Star Coffee;Jl. Sisingamangaraja Kelurahan No.19, Ps. Porsea, Kec. Porsea, Toba, Sumatera Utara 22384;Ps. Porsea, Kec. Porsea, Toba;SUMATERA UTARA;22384;Indonesia;81260402221;24.432.121;99.156.176;https://maps.google.com/?cid=0x0:0xe97732bf5df8cb0a
cafe;Kedai Kopi;Kedai Kopi Joslan;C5R4+7WR, Parparean II, Kec. Porsea, Toba, Sumatera Utara 22384;Parparean II, Kec. Porsea, Toba;SUMATERA UTARA;22384;Indonesia;;24.407.326;991.572.795;https://maps.google.com/?cid=0x0:0x57500df3336ddfce
cafe;Kafe;Bachtiar Yosep butar;F49W+399, Jl. Lintas Sumatera, Patane V, Kec. Porsea, Toba, Sumatera Utara 22384;Jl. Lintas Sumatera, Patane V, Kec. Porsea, Toba;SUMATERA UTARA;22384;Indonesia;;2.467.659;99.145.979;https://maps.google.com/?cid=0x0:0x29d04678e3908f01
cafe;Kedai Kopi;Lovena koffie;Unnamed Road, Parparean II, Kec. Porsea, Toba, Sumatera Utara 22384;Parparean II, Kec. Porsea, Toba;SUMATERA UTARA;22384;Indonesia;81362298652;2.432.654;991.502.991;https://maps.google.com/?cid=0x0:0x9d9f226f188a1a2f
cafe;Stan Kopi;Kedai Patriot;C5W3+XXJ, Ps. Porsea, Kec. Porsea, Toba, Sumatera Utara 22384;Ps. Porsea, Kec. Porsea, Toba;SUMATERA UTARA;22384;Indonesia;;24.474.638;99.154.893;https://maps.google.com/?cid=0x0:0x6dc9729f9ef3dca9
cafe;cafe;Kec. Siantar Narumonda;Toba, Sumatera Utara;Toba, Sumatera Utara;SUMATERA UTARA;;Indonesia;;24.247.803;991.797.673;https://maps.google.com/?cid=0x0:0x58d2a90cbc78427b
cafe;Kedai Kopi;Warunk Friendzone;Narumonda 1, Kec. Siantar Narumonda, Sumatera Utara 22384;Kec. Siantar Narumonda;SUMATERA UTARA;22384;Indonesia;81262876101;24.208.568;991.776.305;https://maps.google.com/?cid=0x0:0xb42d897c66e5204b
cafe;Kedai Kopi;"WarkopBang habib""""";C5FH+FQG, Narumonda I, Kec. Siantar Narumonda, Toba, Sumatera Utara 22384;Narumonda I, Kec. Siantar Narumonda, Toba;SUMATERA UTARA;22384;Indonesia;;24.236.933;991.794.542;https://maps.google.com/?cid=0x0:0xff0b92c1dbf4365a
cafe;Kedai Kopi;Kd Akong;C5FH+WW6, Narumonda III, Kec. Siantar Narumonda, Toba, Sumatera Utara;Toba, Sumatera Utara;SUMATERA UTARA;;Indonesia;;24.247.803;991.797.673;https://maps.google.com/?cid=0x0:0x56e972f3f2164298
cafe;Stan Kopi;Muliadong Coffee;Jl. Sisingamangaraja No.39, Ps. Porsea, Kec. Porsea, Toba, Sumatera Utara 22384;Ps. Porsea, Kec. Porsea, Toba;SUMATERA UTARA;22384;Indonesia;82166475511;24.434.733;99.159.609;https://maps.google.com/?cid=0x0:0x7062b50d74df0fbe
cafe;Indonesia;SOP Kerbau Siparo Gogo;C5FH+VVJ, Unnamed Road, Narumonda III, Kec. Siantar Narumonda, Toba, Sumatera Utara 22384;Unnamed Road, Narumonda III, Kec. Siantar Narumonda, Toba;SUMATERA UTARA;22384;Indonesia;;24.247.075;991.796.321;https://maps.google.com/?cid=0x0:0x557c4882a3d694cc
cafe;Kedai Kopi;Posma Coffee  Resto;C5W4+92J, Ps. Porsea, Kec. Porsea, Toba, Sumatera Utara 22384;Ps. Porsea, Kec. Porsea, Toba;SUMATERA UTARA;22384;Indonesia;;24.459.681;991.550.091;https://maps.google.com/?cid=0x0:0x4c14fc4b25c7fbc3
cafe;Brunch;Lapo Op Harry;C5VF+XX8, Narumonda IV, Kec. Siantar Narumonda, Toba, Sumatera Utara 22384;Narumonda IV, Kec. Siantar Narumonda, Toba;SUMATERA UTARA;22384;Indonesia;81221101105;24.449.213;991.749.382;https://maps.google.com/?cid=0x0:0x5e2843ed454c5bf6
cafe;Restoran;Quality Time Cafe;Jl. Patuan Nagari No.49, Ps. Porsea, Kec. Porsea, Toba, Sumatera Utara 22384;Ps. Porsea, Kec. Porsea, Toba;SUMATERA UTARA;22384;Indonesia;81265856042;2.445.189;9.915.714;https://maps.google.com/?cid=0x0:0xa06b380d9db2cf6c
cafe;Kedai Kopi;Cafè WakuWaku Toba;Jl. Sisingamangaraja XII, Ps. Porsea, Kec. Porsea, Toba, Sumatera Utara 22384;Ps. Porsea, Kec. Porsea, Toba;SUMATERA UTARA;22384;Indonesia;82369036202;24.463.328;991.550.337;https://maps.google.com/?cid=0x0:0xb8d684f2f83d41c3
cafe;Kedai Kopi;SUNSET CAFE;Parparean II, Kec. Porsea, Toba, Sumatera Utara 22384;Kec. Porsea, Toba;SUMATERA UTARA;22384;Indonesia;;2.430.804;991.496.309;https://maps.google.com/?cid=0x0:0x7a7eeb8043c73a83
cafe;Rumah Makan;Babi Panggang Karo;C5J6+HF2, Narumonda V, Kec. Siantar Narumonda, Toba, Sumatera Utara 22384;Narumonda V, Kec. Siantar Narumonda, Toba;SUMATERA UTARA;22384;Indonesia;;24.314.326;991.611.309;https://maps.google.com/?cid=0x0:0x778def41fa47c1e8
cafe;Dapur Umum;WARUNG WAHYU;Jln.prof.Dr.Kp Tarnama Sinambela no 66 Narumonda 1, Kec. Siantar Narumonda;Toba, Sumatera Utara;SUMATERA UTARA;;Indonesia;82274450609;24.254.497;991.774.276;https://maps.google.com/?cid=0x0:0xcb82e168f1edf749
cafe;Kedai Kopi;FPO COFFEE;F522+7X4, Jl. Lintas Sumatera, Patane III, Kec. Porsea, Toba, Sumatera Utara 22384;Jl. Lintas Sumatera, Patane III, Kec. Porsea, Toba;SUMATERA UTARA;22384;Indonesia;;24.506.369;991.524.621;https://maps.google.com/?cid=0x0:0xac45d9e90ed337fd
cafe;cafe;Kec. Sigumpar;Toba, Sumatera Utara;Toba, Sumatera Utara;SUMATERA UTARA;;Indonesia;;23.984.672;991.614.491;https://maps.google.com/?cid=0x0:0x4b5c026ca4275f15
cafe;Kedai Kopi;Up Size Coffee;Jl. Porsea, Jl. Balige, Sigumpar Dangsina, Kec. Sigumpar, Toba, Sumatera Utara 22381;Jl. Balige, Sigumpar Dangsina, Kec. Sigumpar, Toba;SUMATERA UTARA;22381;Indonesia;82277592764;23.835.757;991.501.035;https://maps.google.com/?cid=0x0:0x6ef3130fd596ccc5
cafe;cafe;DCo Cafe;Kompleks IT Del, Sitoluama, Kec. Laguboti, Toba, Sumatera Utara 22381;Sitoluama, Kec. Laguboti, Toba;SUMATERA UTARA;22381;Indonesia;87844043032;2.383.206;991.486.272;https://maps.google.com/?cid=0x0:0x32da8a6796f8c5a7
cafe;Kedai Kopi;Warung Kopi Godang;95X8+CVH, Unnamed Road, Sigumpar, Kec. Sigumpar, Toba, Sumatera Utara 22384;Unnamed Road, Sigumpar, Kec. Sigumpar, Toba;SUMATERA UTARA;22384;Indonesia;;23.985.507;991.672.374;https://maps.google.com/?cid=0x0:0xb52c1e7068f95dc6
cafe;Dapur Umum;Cafe Sairo Geopark;9428+JG6, Jl. Lintas Sumatera, Aruan, Kec. Laguboti, Toba, Sumatera Utara 22381;Jl. Lintas Sumatera, Aruan, Kec. Laguboti, Toba;SUMATERA UTARA;22381;Indonesia;81311188845;23.515.256;991.162.558;https://maps.google.com/?cid=0x0:0x19bbed1ed0c9586a
cafe;cafe;Kode Debora;C546+HRV, Situa-Tua, Kec. Sigumpar, Toba, Sumatera Utara 22384;Situa-Tua, Kec. Sigumpar, Toba;SUMATERA UTARA;22384;Indonesia;;24.064.856;991.620.381;https://maps.google.com/?cid=0x0:0x8bf9cbaf8b8590a
cafe;Toko bahan makanan;Radot;96P4+P7J, Jl. Parsoburan, Marsangap, Kec. Sigumpar, Toba, Sumatera Utara 22384;Jl. Parsoburan, Marsangap, Kec. Sigumpar, Toba;SUMATERA UTARA;22384;Indonesia;;23.868.496;992.056.381;https://maps.google.com/?cid=0x0:0x6de508751a58118b
cafe;Kedai Kopi;St.sariman Siagian;Banuahuta, dusun 3, Sigumpar Julu, Kec. Sigumpar, Toba, Sumatera Utara 22384;dusun 3, Sigumpar Julu, Kec. Sigumpar, Toba;SUMATERA UTARA;22384;Indonesia;;23.750.582;991.797.136;https://maps.google.com/?cid=0x0:0x52e7f15f8a412ebb
cafe;Indonesia;Lapo  Catering Samosir;95W4+7XX, Sigumpar Dangsina, Kec. Sigumpar, Toba, Sumatera Utara 22384;Sigumpar Dangsina, Kec. Sigumpar, Toba;SUMATERA UTARA;22384;Indonesia;81396206205;23.957.419;991.574.875;https://maps.google.com/?cid=0x0:0x6e6a1a72ca47a14d
cafe;Kafe;Kedai sihombing;95VF+G24, Unnamed Road, Banua Huta, Kec. Sigumpar, Toba, Sumatera Utara 22384;Unnamed Road, Banua Huta, Kec. Sigumpar, Toba;SUMATERA UTARA;22384;Indonesia;;23.937.676;991.725.788;https://maps.google.com/?cid=0x0:0x6829152a352a1ab2
cafe;Rumah Makan;Lapo Sitatuan;C538+RGJ, Jl. Lintas Sumatera, Situa-Tua, Kec. Sigumpar, Toba, Sumatera Utara 22384;Jl. Lintas Sumatera, Situa-Tua, Kec. Sigumpar, Toba;SUMATERA UTARA;22384;Indonesia;;2.404.594;991.662.622;https://maps.google.com/?cid=0x0:0x1a3170d651a4295
cafe;Kedai Kopi;Pondok sebatas kemampuan;C44X+5RP, desa, Situa-Tua, Kec. Sigumpar, Toba, Sumatera Utara;Toba, Sumatera Utara;SUMATERA UTARA;;Indonesia;82110241100;24.054.572;99.149.591;https://maps.google.com/?cid=0x0:0xcb649b71707c541b
cafe;Kedai Kopi;Rumah;95X6+9PR, Jl. Silaen, Sigumpar Bar., Kec. Sigumpar, Toba, Sumatera Utara 22384;Jl. Silaen, Sigumpar Bar., Kec. Sigumpar, Toba;SUMATERA UTARA;22384;Indonesia;82168620156;23.984.882;991.617.657;https://maps.google.com/?cid=0x0:0xdb7cd3a56747ddef
cafe;Mi;Kedai Bakmi SABAS;Jl. Silaen, Sigumpar Bar., Kec. Sigumpar, Toba, Sumatera Utara 22384;Sigumpar Bar., Kec. Sigumpar, Toba;SUMATERA UTARA;22384;Indonesia;81376182539;2.398.261;991.618.869;https://maps.google.com/?cid=0x0:0x7342f900863d4de
cafe;cafe;Kec. Silaen;Toba, Sumatera Utara;Toba, Sumatera Utara;SUMATERA UTARA;;Indonesia;;24.076.991;992.079.342;https://maps.google.com/?cid=0x0:0x7c27220334d9e271
cafe;Kedai Kopi;Mau tiung?sini gas lah;F8CQ+PR8, Meranti Bar., Kec. Silaen, Toba, Sumatera Utara 22384;Meranti Bar., Kec. Silaen, Toba;SUMATERA UTARA;22384;Indonesia;85259191646;2.471.777;993.395.636;https://maps.google.com/?cid=0x0:0x6280abeb25214408
cafe;Kedai Kopi;Kopi ,silalahi;96X9+8RQ, Silaen, Kec. Silaen, Toba, Sumatera Utara 22384;Silaen, Kec. Silaen, Toba;SUMATERA UTARA;22384;Indonesia;82199776766;23.983.411;992.195.964;https://maps.google.com/?cid=0x0:0x214c6d96586eb796
cafe;Kedai Kopi;Lapota Dolok;C6GJ+8VM, Huta Gurgur I, Kec. Silaen, Toba, Sumatera Utara;Toba, Sumatera Utara;SUMATERA UTARA;;Indonesia;85359283261;24.258.496;992.321.775;https://maps.google.com/?cid=0x0:0xe05957e4b98e4b00
cafe;Kedai Kopi;Silaen;96V4+WRF, Jl. D.I. Panjaitan, Silaen, Kec. Silaen, Toba, Sumatera Utara 22384;Jl. D.I. Panjaitan, Silaen, Kec. Silaen, Toba;SUMATERA UTARA;22384;Indonesia;;23.948.008;992.070.315;https://maps.google.com/?cid=0x0:0x82d1188bc59caca1
cafe;Kedai Kopi;Destiny coffee;F57Q+H35, Jl. Sigura - Gura, Jonggi Manulus, Kec. Parmaksian, Toba, Sumatera Utara 22384;Jl. Sigura - Gura, Jonggi Manulus, Kec. Parmaksian, Toba;SUMATERA UTARA;22384;Indonesia;;24.638.937;991.877.295;https://maps.google.com/?cid=0x0:0xe7a8816f653183a5
cafe;Komplek perumahan;Kedai Pancur;86VH+JQM, Ombur, Kec. Silaen, Toba, Sumatera Utara 22384;Ombur, Kec. Silaen, Toba;SUMATERA UTARA;22384;Indonesia;82276698653;23.440.957;992.294.081;https://maps.google.com/?cid=0x0:0xe79ed64706100abc
cafe;Kedai Kopi;Teguh Coffee;C645+W2C, Sitorang I, Kec. Silaen, Toba, Sumatera Utara 22384;Sitorang I, Kec. Silaen, Toba;SUMATERA UTARA;22384;Indonesia;;24.073.114;992.075.122;https://maps.google.com/?cid=0x0:0x72b03c1bfda32fb6
cafe;Restoran;Simpang Empat Desa Banjar Ganjang;F56F+QXV, Jl. Prof. Dr. Midian Sirait, Bius Gu Barat, Kec. Parmaksian, Toba, Sumatera Utara 22384;Jl. Prof. Dr. Midian Sirait, Bius Gu Barat, Kec. Parmaksian, Toba;SUMATERA UTARA;22384;Indonesia;85359111705;24.619.918;991.749.129;https://maps.google.com/?cid=0x0:0x8b4297768b88cb49
cafe;Kedai Kopi;Lapo tuak sitanggang;C67G+JJ, Sitorang I, Kec. Silaen, Toba, Sumatera Utara 22384;Sitorang I, Kec. Silaen, Toba;SUMATERA UTARA;22384;Indonesia;;24.143.261;992.274.991;https://maps.google.com/?cid=0x0:0x22b73cd20b27e45d
cafe;Kedai Kopi;Kedai Kopi Kawan;C644+RJ2, Jl. D.I. Panjaitan, Hutanamora, Kec. Silaen, Toba, Sumatera Utara 22384;Jl. D.I. Panjaitan, Hutanamora, Kec. Silaen, Toba;SUMATERA UTARA;22384;Indonesia;;24.070.192;992.065.175;https://maps.google.com/?cid=0x0:0x9e3f7cd61bf42697
cafe;Kedai Kopi;Kedai PANJAITAN Huta Ginjang;Dalihan Natolu, Kec. Silaen, Toba, Sumatera Utara;Toba, Sumatera Utara;SUMATERA UTARA;;Indonesia;;24.147.482;992.206.407;https://maps.google.com/?cid=0x0:0x4b10e85666caa84a
cafe;Batak;Lumban Langge;96CC+FGG, Unnamed Road, Napitupulu, Kec. Silaen, Toba, Sumatera Utara 22384;Unnamed Road, Napitupulu, Kec. Silaen, Toba;SUMATERA UTARA;22384;Indonesia;81572608557;23.711.924;992.213.358;https://maps.google.com/?cid=0x0:0x9534d88e3985cfc2
cafe;Kafe;Warkop Vandes;9675+FGW, Parsambilan, Kec. Silaen, Toba, Sumatera Utara 22384;Parsambilan, Kec. Silaen, Toba;SUMATERA UTARA;22384;Indonesia;;23.637.256;992.088.155;https://maps.google.com/?cid=0x0:0xee6f7d0c843f4620
cafe;cafe;Kec. Tampahan;Toba, Sumatera Utara;Toba, Sumatera Utara;SUMATERA UTARA;;Indonesia;;23.261.055;990.132.625;https://maps.google.com/?cid=0x0:0x9d6ff76f83d5dbd8
cafe;Kedai Kopi;Tampahan;82G7+C8R, Gurgur Aek Raja, Kec. Tampahan, Toba, Sumatera Utara 22312;Gurgur Aek Raja, Kec. Tampahan, Toba;SUMATERA UTARA;22312;Indonesia;;23.261.055;990.132.625;https://maps.google.com/?cid=0x0:0x353ca3bcfd906e50
cafe;Hotel bintang 3;Tepi Danau Bistro;Jl. Pemandian No.1, Sangkar Nihuta, Kec. Balige, Toba, Sumatera Utara 22312;Sangkar Nihuta, Kec. Balige, Toba;SUMATERA UTARA;22312;Indonesia;81264761015;23.343.426;990.561.066;https://maps.google.com/?cid=0x0:0x7b92db9623ce4f01
cafe;Restoran;Hutanta Cafe;Jl. P. Siantar No.KM 2, Sibola Hotangsas, Kec. Balige, Toba, Sumatera Utara 22312;Sibola Hotangsas, Kec. Balige, Toba;SUMATERA UTARA;22312;Indonesia;8111926991;23.383.059;990.812.835;https://maps.google.com/?cid=0x0:0x8a2c3d5bd45ef7ee
cafe;Restoran;Caldera Resto and Coffee;Jl. Patuan Nagari, Sangkar Nihuta, Kec. Balige, Toba, Sumatera Utara 22312;Sangkar Nihuta, Kec. Balige, Toba;SUMATERA UTARA;22312;Indonesia;82311648700;23.310.672;990.570.638;https://maps.google.com/?cid=0x0:0xa704d25efebb8e08
cafe;Restoran;Cafe Panca Jelita;82XR+MVP, Jl. Pemandian, Lumban Silintong, Kec. Balige, Toba, Sumatera Utara 22312;Jl. Pemandian, Lumban Silintong, Kec. Balige, Toba;SUMATERA UTARA;22312;Indonesia;88262159231;23.492.191;990.422.013;https://maps.google.com/?cid=0x0:0x8f92193fdf7283c
cafe;Makanan Siap Saji;Cafe Gurgur;8267+MMP, Jl. Sisingamangaraja, Gurgur Aek Raja, Kec. Tampahan, Toba, Sumatera Utara;Toba, Sumatera Utara;SUMATERA UTARA;;Indonesia;;23.117.021;990.142.185;https://maps.google.com/?cid=0x0:0xa8db3c43fa9329e0
cafe;Kedai Kopi;Tarhilala coffee;Jl. Sisingamangaraja C No.200, Balige II, Kec. Balige, Toba, Sumatera Utara 22312;Balige II, Kec. Balige, Toba;SUMATERA UTARA;22312;Indonesia;;23.343.736;990.685.596;https://maps.google.com/?cid=0x0:0x334714e8466ee5c3
cafe;Restoran;Warung Gapura;72J5+4FJ, Tangga Batu Tim., Kec. Tampahan, Toba, Sumatera Utara 22312;Tangga Batu Tim., Kec. Tampahan, Toba;SUMATERA UTARA;22312;Indonesia;;22.803.336;990.086.513;https://maps.google.com/?cid=0x0:0x85e57beddf54cac5
cafe;Kedai Kopi;Marsaor coffee and resto;Jl. Siborongborong - Parapat No.15, Sangkar Nihuta, Kec. Balige, Toba, Sumatera Utara 22312;Sangkar Nihuta, Kec. Balige, Toba;SUMATERA UTARA;22312;Indonesia;82360456467;23.296.459;990.549.803;https://maps.google.com/?cid=0x0:0x4cd323d829465803
cafe;Kedai Kopi;Cafe Gur Gur;Jl. Siborongborong - Parapat No.100, Gurgur Aek Raja, Kec. Tampahan, Toba, Sumatera Utara 22312;Gurgur Aek Raja, Kec. Tampahan, Toba;SUMATERA UTARA;22312;Indonesia;;23.182.649;990.146.235;https://maps.google.com/?cid=0x0:0xec4e5a8ec586d290
cafe;Kedai Kopi;Etha Cafe;8263+6RX Wisata, Meat, Kec. Tampahan, Toba, Sumatera Utara 22312;Meat, Kec. Tampahan, Toba;SUMATERA UTARA;22312;Indonesia;;23.106.208;990.046.048;https://maps.google.com/?cid=0x0:0x99c5bb7352e1d213
cafe;Kafe;Tao Tio Coffee and Resto;Jl. Dr. Sutomo No.21, Sangkar Nihuta, Kec. Balige, Toba, Sumatera Utara 22312;Sangkar Nihuta, Kec. Balige, Toba;SUMATERA UTARA;22312;Indonesia;81284928400;23.296.704;990.523.756;https://maps.google.com/?cid=0x0:0x7e8c5eb7fa9755e8
cafe;Bar;Wita Cafe;82WV+QQF, Sumatra, Toba, Sumatera Utara 22312;Sumatra, Toba;SUMATERA UTARA;22312;Indonesia;8126403251;23.469.318;990.444.172;https://maps.google.com/?cid=0x0:0xf9ef6504571fb6f0
