Category;Real Category;Business Name;Address;City;State;Postal Code;Country;Phone;Email;Website;Latitude;Longitude;Map Link;Details Link
"mall";"Taman";"Mata Air Malindo (Santan Murni)";"3WGH+6CH, Jl. St. Bar., Kebonjati, Kec. Cikole, Kota Sukabumi, Jawa Barat 43111";"Jl. St. Bar., Kebonjati, Kec. Cikole, Kota Sukabumi";"JAWA BARAT";"43111";"Indonesia";" 085722410370";"";"";"-6.924428";"106.9286023";"https://maps.google.com/?cid=0x0:0x161500598af68467";""
"mall";"Kedai Kopi";"CAPPUCINO CINCAU CIGODEG";"Lampu merah simpang cigodek, Jl. RH. Didi Sukardi, Nanggeleng, Kec. Citamiang, Kota Sukabumi, Jawa Barat 43143";"Jl. RH. Didi Sukardi, Nanggeleng, Kec. Citamiang, Kota Sukabumi";"JAWA BARAT";"43143";"Indonesia";" 085363482115";"";"";"-6.9316738";"106.9324886";"https://maps.google.com/?cid=0x0:0xe77dfbaf99c34c1c";""
"mall";"Pusat Perbelanjaan";"Warung IBu Indri #BONKAW67";"Jl pemuda2 RT/RW 006/007, Tipar, Kec. Citamiang, Kota Sukabumi, Jawa Barat 43141";"Tipar, Kec. Citamiang, Kota Sukabumi";"JAWA BARAT";"43141";"Indonesia";" 081563504056";"";"";"-6.9296436";"106.9294492";"https://maps.google.com/?cid=0x0:0x4fac00a86a38986d";""
"mall";"Maskapai Penerbangan";"Citimall Sukabumi";"Jl. A. Yani No.121-127, Gunungparang, Kec. Cikole, Kota Sukabumi, Jawa Barat 43111";"Gunungparang, Kec. Cikole, Kota Sukabumi";"JAWA BARAT";"43111";"Indonesia";" 0266232820";"";"";"-6.9216947";"106.9286093";"https://maps.google.com/?cid=0x0:0x25d779dd316516f7";""
"mall";"Ruang Kerja Bersama";"Bumi Arsa Creative Space";"Jl. RH. Didi Sukardi No.37, Gedongpanjang, Kec. Citamiang, Kota Sukabumi, Jawa Barat 43143";"Gedongpanjang, Kec. Citamiang, Kota Sukabumi";"JAWA BARAT";"43143";"Indonesia";" 081386095151";"";"";"-6.93405";"106.93194";"https://maps.google.com/?cid=0x0:0x177857d23615d9b2";""
"mall";"";"doa ibu gedong panjang";"3W4M+V9R, Jl. RH. Didi Sukardi, Citamiang, Kec. Citamiang, Kota Sukabumi, Jawa Barat 43143";"Jl. RH. Didi Sukardi, Citamiang, Kec. Citamiang, Kota Sukabumi";"JAWA BARAT";"43143";"Indonesia";"";"";"";"-6.9427638";"106.9333971";"https://maps.google.com/?cid=0x0:0x2ee1a88877be8d94";""
"mall";"Toko Pakaian";"Matahari Departement Store";"Citimall Sukabumi Lt. 1- 2, Jl. A. Yani No.125-127, Gunungparang, Kec. Cikole, Kota Sukabumi, Jawa Barat 43111";"Jl. A. Yani No.125-127, Gunungparang, Kec. Cikole, Kota Sukabumi";"JAWA BARAT";"43111";"Indonesia";" 0266232816";"";"/url?q>>u003dhttp://www.matahari.co.id/>>u0026opi>>u003d79508299>>u0026sa>>u003dU>>u0026ved>>u003d0ahUKEwj6otC6qPyLAxVSh68BHXQINlwQ61gIFigS>>u0026usg>>u003dAOvVaw0Lc9i6X3HIpAKEH5vo2p1I";"-6.9218068";"106.9288177";"https://maps.google.com/?cid=0x0:0xce2be0afaff8de48";""
"mall";"Brunch";"Kupat Sayur Bah Jae";"3W5M+JG3, Gedongpanjang, Kec. Citamiang, Kota Sukabumi, Jawa Barat 43144";"Gedongpanjang, Kec. Citamiang, Kota Sukabumi";"JAWA BARAT";"43144";"Indonesia";" 087874731906";"";"";"-6.9409959";"106.9337877";"https://maps.google.com/?cid=0x0:0x35e83f42a7a28698";""
"mall";"Toko umum";".";"Jl. Balandongan, RT.03/RW.02, Sudajaya Hilir, Kec. Baros, Kota Sukabumi, Jawa Barat 43161";"RT.03/RW.02, Sudajaya Hilir, Kec. Baros, Kota Sukabumi";"JAWA BARAT";"43161";"Indonesia";" 086564246754";"";"";"-6.9465427";"106.9231112";"https://maps.google.com/?cid=0x0:0x80e8d8832af65df6";""
"mall";"Toko Olahraga Luar Ruangan";"Cabela Outdoor";"Jl. Lio Babakan , Kec. Citamiang, Kota Sukabumi, Jawa Barat 43144, Kota Sukabumi, Jawa Barat 43153";"Kec. Citamiang, Kota Sukabumi, Jawa Barat";"JAWA BARAT";"43144";"Indonesia";" 083815720968";"";"";"-6.9452122";"106.9240192";"https://maps.google.com/?cid=0x0:0x12f7922f6fb3424";""
"mall";"Gudang";"Indogrosir Sukabumi";"Jl. Lkr. Sel., RT.01/RW.03, Sudajaya Hilir, Kec. Baros, Kota Sukabumi, Jawa Barat 43161";"RT.01/RW.03, Sudajaya Hilir, Kec. Baros, Kota Sukabumi";"JAWA BARAT";"43161";"Indonesia";" 02662489291";"";"/url?q>>u003dhttps://wa.me/6287819545846>>u0026opi>>u003d79508299>>u0026sa>>u003dU>>u0026ved>>u003d0ahUKEwikw-O7qPyLAxViS2cHHU4aLIYQ61gIFigS>>u0026usg>>u003dAOvVaw1zU2oLJuIJEDMvCfmP4Uiu";"-6.9522044";"106.9266579";"https://maps.google.com/?cid=0x0:0x9962a6d50202333d";""
"mall";"Toko bahan makanan";"Moci Setia";"jl raya sala kopi No.4, Tipar, Kec. Citamiang, Kota Sukabumi, Jawa Barat 43141";"Tipar, Kec. Citamiang, Kota Sukabumi";"JAWA BARAT";"43141";"Indonesia";" 085846317938";"";"";"-6.9277361";"106.9299578";"https://maps.google.com/?cid=0x0:0xcbf905481aa2ec58";""
"mall";"Pusat Perbelanjaan";"SIN Cell";"Jl. Lio Santa No.20, Cikondang, Kec. Citamiang, Kota Sukabumi, Jawa Barat 43142";"Cikondang, Kec. Citamiang, Kota Sukabumi";"JAWA BARAT";"43142";"Indonesia";"";"";"";"-6.9452536";"106.9241813";"https://maps.google.com/?cid=0x0:0x37b4891206e11bb7";""
"mall";"Komplek perumahan";"Perum Nanggeleng";"Jl. Pasir Mulus No.60, Nanggeleng, Kec. Citamiang, Kota Sukabumi, Jawa Barat 43145";"Nanggeleng, Kec. Citamiang, Kota Sukabumi";"JAWA BARAT";"43145";"Indonesia";"";"";"";"-6.9377599";"106.9355106";"https://maps.google.com/?cid=0x0:0xcef1ddf54e2c3a40";""
"mall";"Pusat Perbelanjaan";"Dede santan";"3WFJ+8WM, Tipar, Kec. Citamiang, Kota Sukabumi, Jawa Barat 43141";"Tipar, Kec. Citamiang, Kota Sukabumi";"JAWA BARAT";"43141";"Indonesia";" 085722410370";"";"";"-6.9266593";"106.9323002";"https://maps.google.com/?cid=0x0:0x7042f483d1d963c4";""
"mall";"Toko Kue";"Central mochi";"Jl. Lkr. Sel. No.212-213, Limusnunggal, Kec. Cibeureum, Kota Sukabumi, Jawa Barat 43165";"Limusnunggal, Kec. Cibeureum, Kota Sukabumi";"JAWA BARAT";"43165";"Indonesia";" 085863348619";"";"";"-6.9494359";"106.9353424";"https://maps.google.com/?cid=0x0:0x80267b4e0ce4e38f";""
"mall";"Toko";"Citty mall";"3WFH+W7G, Tipar, Kec. Citamiang, Kota Sukabumi, Jawa Barat 43141";"Tipar, Kec. Citamiang, Kota Sukabumi";"JAWA BARAT";"43141";"Indonesia";"";"";"";"-6.9251916";"106.9281898";"https://maps.google.com/?cid=0x0:0xd63ff9f96f175ce4";""
"mall";"Pusat Perbelanjaan";"VIRLY";"Depan Ramayana, Ruko, Jl. Tipar No.50, Tipar, Kec. Citamiang, Kota Sukabumi, Jawa Barat 43145";"Ruko, Jl. Tipar No.50, Tipar, Kec. Citamiang, Kota Sukabumi";"JAWA BARAT";"43145";"Indonesia";" 08156150718";"";"";"-6.9254271";"106.9292439";"https://maps.google.com/?cid=0x0:0xe9a8b91859e8209c";""
"mall";"Toko Swalayan";"gudang kang bemo";"3W3C+JJM, Jl. Begeg, Cikondang, Kec. Citamiang, Kota Sukabumi, Jawa Barat 43167";"Jl. Begeg, Cikondang, Kec. Citamiang, Kota Sukabumi";"JAWA BARAT";"43167";"Indonesia";"";"";"";"-6.9459218";"106.9215385";"https://maps.google.com/?cid=0x0:0x2eef44f02188253d";""
"mall";"Pusat Perbelanjaan";"Lobby Utama Citymal Sukabumi";"3WHH+3GV, Jl. A. Yani, Gunungparang, Kec. Cikole, Kota Sukabumi, Jawa Barat 43131";"Jl. A. Yani, Gunungparang, Kec. Cikole, Kota Sukabumi";"JAWA BARAT";"43131";"Indonesia";" 083819935432";"";"";"-6.9222508";"106.9288125";"https://maps.google.com/?cid=0x0:0x741b464229dc65eb";""
"mall";"Restoran";"Toserba Selamat";"Jl. R. E. Martadinata No.67-515, Kebonjati, Kec. Cikole, Kota Sukabumi, Jawa Barat 43113";"Kebonjati, Kec. Cikole, Kota Sukabumi";"JAWA BARAT";"43113";"Indonesia";" 0266243734";"";"";"-6.9210805";"106.9348566";"https://maps.google.com/?cid=0x0:0x116464f8e24a0e41";""
"mall";"Distributor Baja";"Centrak baja";"3W2Q+RF3, Jl. Lkr. Sel., Limusnunggal, Kec. Cibeureum, Kota Sukabumi, Jawa Barat 43165";"Jl. Lkr. Sel., Limusnunggal, Kec. Cibeureum, Kota Sukabumi";"JAWA BARAT";"43165";"Indonesia";" 085624242435";"";"";"-6.9479911";"106.9386703";"https://maps.google.com/?cid=0x0:0x1b6bd0ce1e37d4be";""
"mall";"mall";"Jawa Barat 43144";"Gedongpanjang, Kec. Citamiang, Kota Sukabumi, Jawa Barat";"Kota Sukabumi, Jawa Barat";"JAWA BARAT";"";"Indonesia";"";"";"";"-6.9444732";"106.9314335";"https://maps.google.com/?cid=0x0:0x1c00c5eb568ed0c0";""
"mall";"Toko";"garasi classic 88";"2WWJ+C4M, Jayaraksa, Kec. Baros, Kabupaten Sukabumi, Jawa Barat 43166";"Jayaraksa, Kec. Baros, Kabupaten Sukabumi";"JAWA BARAT";"43166";"Indonesia";" 085624811813";"";"";"-6.9539089";"106.9302989";"https://maps.google.com/?cid=0x0:0xfd3d24ecc98f16bb";""
"mall";"Pusat Perbelanjaan";"Effanorium";"Jl. RH. Didi Sukardi, Gedongpanjang, Kec. Citamiang, Kota Sukabumi, Jawa Barat 43144";"Gedongpanjang, Kec. Citamiang, Kota Sukabumi";"JAWA BARAT";"43144";"Indonesia";" 085798889779";"";"";"-6.9444504";"106.9335952";"https://maps.google.com/?cid=0x0:0x28e653665f6c9542";""
"mall";"Kantor Perusahaan";"Pemotongan ayam";"Jl. Letda T. Asmita No.77, Gedongpanjang, Kec. Citamiang, Kota Sukabumi, Jawa Barat 43144";"Gedongpanjang, Kec. Citamiang, Kota Sukabumi";"JAWA BARAT";"43144";"Indonesia";"";"";"";"-6.9409642";"106.9340899";"https://maps.google.com/?cid=0x0:0x145de62bfb4d6667";""
"mall";"Toko Pakaian Wanita";"Ridez Fashion Shop";"3W9J+3G9, Citamiang, Kec. Citamiang, Kota Sukabumi, Jawa Barat 43143";"Citamiang, Kec. Citamiang, Kota Sukabumi";"JAWA BARAT";"43143";"Indonesia";" 081654911652";"";"";"-6.9323372";"106.9313505";"https://maps.google.com/?cid=0x0:0xda2b00cdf20a224d";""
"mall";"";"Warung Neneng";"3W2V+HCP, Unnamed Road, Limusnunggal, Kec. Cibeureum, Kota Sukabumi, Jawa Barat 43165";"Unnamed Road, Limusnunggal, Kec. Cibeureum, Kota Sukabumi";"JAWA BARAT";"43165";"Indonesia";" 081311566078";"";"";"-6.9485465";"106.9435797";"https://maps.google.com/?cid=0x0:0x397f31f7fc920226";""
"mall";"Maskapai Penerbangan";"Citimall Sukabumi";"Jl. A. Yani No.121-127, Gunungparang, Kec. Cikole, Kota Sukabumi, Jawa Barat 43111";"Gunungparang, Kec. Cikole, Kota Sukabumi";"JAWA BARAT";"43111";"Indonesia";" 0266232820";"";"";"-6.9216947";"106.9286093";"https://maps.google.com/?cid=0x0:0x25d779dd316516f7";""
"mall";"Ruang Kerja Bersama";"Bumi Arsa Creative Space";"Jl. RH. Didi Sukardi No.37, Gedongpanjang, Kec. Citamiang, Kota Sukabumi, Jawa Barat 43143";"Gedongpanjang, Kec. Citamiang, Kota Sukabumi";"JAWA BARAT";"43143";"Indonesia";" 081386095151";"";"";"-6.93405";"106.93194";"https://maps.google.com/?cid=0x0:0x177857d23615d9b2";""
"mall";"";"doa ibu gedong panjang";"3W4M+V9R, Jl. RH. Didi Sukardi, Citamiang, Kec. Citamiang, Kota Sukabumi, Jawa Barat 43143";"Jl. RH. Didi Sukardi, Citamiang, Kec. Citamiang, Kota Sukabumi";"JAWA BARAT";"43143";"Indonesia";"";"";"";"-6.9427638";"106.9333971";"https://maps.google.com/?cid=0x0:0x2ee1a88877be8d94";""
"mall";"Toko";"pusat alat hikmah sukabumi";"Unnamed Road, Nanggeleng, Kec. Citamiang, Kota Sukabumi, Jawa Barat 43145";"Nanggeleng, Kec. Citamiang, Kota Sukabumi";"JAWA BARAT";"43145";"Indonesia";" 081517754628";"";"";"-6.9303537";"106.9391248";"https://maps.google.com/?cid=0x0:0xc393c8dba6ae951";""
"mall";"Komplek perumahan";"Perum Nanggeleng";"Jl. Pasir Mulus No.60, Nanggeleng, Kec. Citamiang, Kota Sukabumi, Jawa Barat 43145";"Nanggeleng, Kec. Citamiang, Kota Sukabumi";"JAWA BARAT";"43145";"Indonesia";"";"";"";"-6.9377599";"106.9355106";"https://maps.google.com/?cid=0x0:0xcef1ddf54e2c3a40";""
"mall";"Pusat Perbelanjaan";"VIRLY";"Depan Ramayana, Ruko, Jl. Tipar No.50, Tipar, Kec. Citamiang, Kota Sukabumi, Jawa Barat 43145";"Ruko, Jl. Tipar No.50, Tipar, Kec. Citamiang, Kota Sukabumi";"JAWA BARAT";"43145";"Indonesia";" 08156150718";"";"";"-6.9254271";"106.9292439";"https://maps.google.com/?cid=0x0:0xe9a8b91859e8209c";""
"mall";"Toko bahan makanan";"Moci Setia";"jl raya sala kopi No.4, Tipar, Kec. Citamiang, Kota Sukabumi, Jawa Barat 43141";"Tipar, Kec. Citamiang, Kota Sukabumi";"JAWA BARAT";"43141";"Indonesia";" 085846317938";"";"";"-6.9277361";"106.9299578";"https://maps.google.com/?cid=0x0:0xcbf905481aa2ec58";""
"mall";"Toko bahan makanan";"Warung Halimah";"Nanggeleng, Kec. Citamiang, Kota Sukabumi, Jawa Barat 43145";"Kec. Citamiang, Kota Sukabumi";"JAWA BARAT";"43145";"Indonesia";"";"";"";"-6.9279147";"106.9390232";"https://maps.google.com/?cid=0x0:0x64b67623b5287796";""
"mall";"Toko grosir";"Pd Sekawan Group";"Jl. Cijangkar,rt003, RW.009, Nanggeleng, Kec. Citamiang, Kota Sukabumi, Jawa Barat 43145";"RW.009, Nanggeleng, Kec. Citamiang, Kota Sukabumi";"JAWA BARAT";"43145";"Indonesia";" 085723332045";"";"/url?q>>u003dhttp://www.sekawan.com/>>u0026opi>>u003d79508299>>u0026sa>>u003dU>>u0026ved>>u003d0ahUKEwj62evQqPyLAxVqxzgGHWHaAjoQ61gIFigS>>u0026usg>>u003dAOvVaw0oIufLknmoOpUlNBeoDiet";"-6.9285573";"106.9362721";"https://maps.google.com/?cid=0x0:0x980694386981dfed";""
"mall";"Pusat Perbelanjaan";"Dede santan";"3WFJ+8WM, Tipar, Kec. Citamiang, Kota Sukabumi, Jawa Barat 43141";"Tipar, Kec. Citamiang, Kota Sukabumi";"JAWA BARAT";"43141";"Indonesia";" 085722410370";"";"";"-6.9266593";"106.9323002";"https://maps.google.com/?cid=0x0:0x7042f483d1d963c4";""
"mall";"Toko bahan makanan";"Iyank Mart";"Jl. Cijangkar No.7, Nanggeleng, Kec. Citamiang, Kota Sukabumi, Jawa Barat 43145";"Nanggeleng, Kec. Citamiang, Kota Sukabumi";"JAWA BARAT";"43145";"Indonesia";" 085863374429";"";"";"-6.9284539";"106.936039";"https://maps.google.com/?cid=0x0:0x8de8e412aa47b8f8";""
"mall";"Pusat Perbelanjaan";"WMS SUKABUMI";"Gunungparang, Kec. Cikole, Kota Sukabumi, Jawa Barat";"Kota Sukabumi, Jawa Barat";"JAWA BARAT";"";"Indonesia";" 085640470315";"";"";"-6.9236725";"106.9280822";"https://maps.google.com/?cid=0x0:0xb6c03d90079b1fd1";""
"mall";"Pusat Perbelanjaan";"Lejel Sukabumi";"3WGQ+QPG, Gg. Mahmud, Cisarua, Kec. Cikole, Kota Sukabumi, Jawa Barat 43115";"Gg. Mahmud, Cisarua, Kec. Cikole, Kota Sukabumi";"JAWA BARAT";"43115";"Indonesia";" 0266229911";"";"/url?q>>u003dhttps://lejel.co.id/>>u0026opi>>u003d79508299>>u0026sa>>u003dU>>u0026ved>>u003d0ahUKEwjXsO3RqPyLAxU_TGwGHfO-A_oQ61gIFSgR>>u0026usg>>u003dAOvVaw0nBJJ2YUqqw1qERa3-yvdm";"-6.9230571";"106.9393218";"https://maps.google.com/?cid=0x0:0xef6819e540c543d3";""
"mall";"Toko";"Citty mall";"3WFH+W7G, Tipar, Kec. Citamiang, Kota Sukabumi, Jawa Barat 43141";"Tipar, Kec. Citamiang, Kota Sukabumi";"JAWA BARAT";"43141";"Indonesia";"";"";"";"-6.9251916";"106.9281898";"https://maps.google.com/?cid=0x0:0xd63ff9f96f175ce4";""
"mall";"Restoran";"Toserba Selamat";"Jl. R. E. Martadinata No.67-515, Kebonjati, Kec. Cikole, Kota Sukabumi, Jawa Barat 43113";"Kebonjati, Kec. Cikole, Kota Sukabumi";"JAWA BARAT";"43113";"Indonesia";" 0266243734";"";"/url?q>>u003dhttp://www.toserbaselamat.id/>>u0026opi>>u003d79508299>>u0026sa>>u003dU>>u0026ved>>u003d0ahUKEwimo6vSqPyLAxWvoWMGHfMnEFoQ61gIFigS>>u0026usg>>u003dAOvVaw16VrdcyZM1NHe4CexAN44J";"-6.9210805";"106.9348566";"https://maps.google.com/?cid=0x0:0x116464f8e24a0e41";""
"mall";"Pusat Perbelanjaan";"Lobby Utama Citymal Sukabumi";"3WHH+3GV, Jl. A. Yani, Gunungparang, Kec. Cikole, Kota Sukabumi, Jawa Barat 43131";"Jl. A. Yani, Gunungparang, Kec. Cikole, Kota Sukabumi";"JAWA BARAT";"43131";"Indonesia";" 083819935432";"";"";"-6.9222508";"106.9288125";"https://maps.google.com/?cid=0x0:0x741b464229dc65eb";""
"mall";"Pusat Perbelanjaan";"PD.SAUDARA BERSATU";"3WCQ+QJQ, Jl. Cijangkar, Nanggeleng, Kec. Citamiang, Kota Sukabumi, Jawa Barat 43145";"Jl. Cijangkar, Nanggeleng, Kec. Citamiang, Kota Sukabumi";"JAWA BARAT";"43145";"Indonesia";" 082258094411";"";"";"-6.9280298";"106.9391026";"https://maps.google.com/?cid=0x0:0x7e39d8f3c6a513e5";""
"mall";"Toserba";"Vienna Ramayana Smi";"Jl. Tipar No.17, Tipar, Kec. Citamiang, Kota Sukabumi, Jawa Barat 43141";"Tipar, Kec. Citamiang, Kota Sukabumi";"JAWA BARAT";"43141";"Indonesia";"";"";"/url?q>>u003dhttps://ramayana.co.id/>>u0026opi>>u003d79508299>>u0026sa>>u003dU>>u0026ved>>u003d0ahUKEwjCuJDTqPyLAxVS8DgGHTrJOUUQ61gIEigO>>u0026usg>>u003dAOvVaw0xaIm83PgUXU3lLsrqFtyL";"-6.9255811";"106.9296416";"https://maps.google.com/?cid=0x0:0x10c5ba899361953b";""
"mall";"Toko Swalayan";"Coms Cell Car";"Jl. A. Yani No.212/232, Kebonjati, Kec. Cikole, Kota Sukabumi, Jawa Barat 43111";"Kebonjati, Kec. Cikole, Kota Sukabumi";"JAWA BARAT";"43111";"Indonesia";" 085659511969";"";"";"-6.9228705";"106.9329148";"https://maps.google.com/?cid=0x0:0x8e2004b0998623c1";""
"mall";"mall";"Jawa Barat 43145";"Kec. Citamiang, Kabupaten Sukabumi, Jawa Barat";"Kabupaten Sukabumi, Jawa Barat";"JAWA BARAT";"";"Indonesia";"";"";"";"-6.9339244";"106.9373361";"https://maps.google.com/?cid=0x0:0x1c00c5eb568ed0e0";""
"mall";"Taman";"Triloka Dago Sukabumi";"Jl. Ir. H. Juanda, Cikole, Kec. Cikole, Kota Sukabumi, Jawa Barat 43111";"Cikole, Kec. Cikole, Kota Sukabumi";"JAWA BARAT";"43111";"Indonesia";" 085624575859";"";"";"-6.9202373";"106.931252";"https://maps.google.com/?cid=0x0:0xb7c38166ec4a79a3";""
"mall";"Distributor Baja";"Centrak baja";"3W2Q+RF3, Jl. Lkr. Sel., Limusnunggal, Kec. Cibeureum, Kota Sukabumi, Jawa Barat 43165";"Jl. Lkr. Sel., Limusnunggal, Kec. Cibeureum, Kota Sukabumi";"JAWA BARAT";"43165";"Indonesia";" 085624242435";"";"";"-6.9479911";"106.9386703";"https://maps.google.com/?cid=0x0:0x1b6bd0ce1e37d4be";""
"mall";"Pusat Perbelanjaan";"Warung IBu Indri #BONKAW67";"Jl pemuda2 RT/RW 006/007, Tipar, Kec. Citamiang, Kota Sukabumi, Jawa Barat 43141";"Tipar, Kec. Citamiang, Kota Sukabumi";"JAWA BARAT";"43141";"Indonesia";" 081563504056";"";"";"-6.9296436";"106.9294492";"https://maps.google.com/?cid=0x0:0x4fac00a86a38986d";""
"mall";"Restoran";"Waroeng Cibay";"3WFW+579, Cibeureum Hilir, Kec. Cibeureum, Kota Sukabumi, Jawa Barat 43165";"Cibeureum Hilir, Kec. Cibeureum, Kota Sukabumi";"JAWA BARAT";"43165";"Indonesia";" 081573555346";"";"";"-6.9270799";"106.9457292";"https://maps.google.com/?cid=0x0:0x71cc1e1e6628943f";""
"mall";"Toko Pakaian Wanita";"Ridez Fashion Shop";"3W9J+3G9, Citamiang, Kec. Citamiang, Kota Sukabumi, Jawa Barat 43143";"Citamiang, Kec. Citamiang, Kota Sukabumi";"JAWA BARAT";"43143";"Indonesia";" 081654911652";"";"";"-6.9323372";"106.9313505";"https://maps.google.com/?cid=0x0:0xda2b00cdf20a224d";""
"mall";"Maskapai Penerbangan";"Citimall Sukabumi";"Jl. A. Yani No.121-127, Gunungparang, Kec. Cikole, Kota Sukabumi, Jawa Barat 43111";"Gunungparang, Kec. Cikole, Kota Sukabumi";"JAWA BARAT";"43111";"Indonesia";" 0266232820";"";"";"-6.9216947";"106.9286093";"https://maps.google.com/?cid=0x0:0x25d779dd316516f7";""
"mall";"Pusat Perbelanjaan";"Trust Store";"Karamat, Kec. Gunungpuyuh, Kota Sukabumi, Jawa Barat 43122";"Kec. Gunungpuyuh, Kota Sukabumi";"JAWA BARAT";"43122";"Indonesia";" 085863676728";"";"";"-6.9099543";"106.9217439";"https://maps.google.com/?cid=0x0:0x112459741e3a7683";""
"mall";"Pusat Perbelanjaan";"Sinar Paut";"Jl. Babakan Garung No.5, Karang Tengah, Kec. Gunungpuyuh, Kota Sukabumi, Jawa Barat 43121";"Karang Tengah, Kec. Gunungpuyuh, Kota Sukabumi";"JAWA BARAT";"43121";"Indonesia";" 081563698714";"";"";"-6.9110443";"106.9127355";"https://maps.google.com/?cid=0x0:0xf36209bda51c6521";""
"mall";"Pusat Perbelanjaan";"NAGA SURYA "mekar jaya"";"Jl. Babakan Garung No.15, Karang Tengah, Kec. Gunungpuyuh, Kota Sukabumi, Jawa Barat 43121";"Karang Tengah, Kec. Gunungpuyuh, Kota Sukabumi";"JAWA BARAT";"43121";"Indonesia";" 085795577007";"";"";"-6.9094618";"106.91191";"https://maps.google.com/?cid=0x0:0x8f9aa2779a1b0b2e";""
"mall";"Pusat Perbelanjaan";"Sari pala bonti dees sadulur";"Sukakarya, Kec. Warudoyong, Kota Sukabumi, Jawa Barat";"Kota Sukabumi, Jawa Barat";"JAWA BARAT";"";"Indonesia";" 081517832493";"";"";"-6.9184612";"106.9075284";"https://maps.google.com/?cid=0x0:0xfd53c839a5fce4c1";""
"mall";"Pusat Perbelanjaan";"R-cell";"Jl. Tegal Wangi No.5, Sukakarya, Kec. Warudoyong, Kota Sukabumi, Jawa Barat 43135";"Sukakarya, Kec. Warudoyong, Kota Sukabumi";"JAWA BARAT";"43135";"Indonesia";"";"";"";"-6.9164768";"106.9056674";"https://maps.google.com/?cid=0x0:0x93857d0f9374f55a";""
"mall";"Dealer mobil";"PT Selamat Toyota Sukabumi";"3WP4+878, Jl. Tegal Wangi, Sukakarya, Kec. Warudoyong, Kota Sukabumi, Jawa Barat 43135";"Jl. Tegal Wangi, Sukakarya, Kec. Warudoyong, Kota Sukabumi";"JAWA BARAT";"43135";"Indonesia";"";"";"";"-6.9142105";"106.9056952";"https://maps.google.com/?cid=0x0:0x201436691c6d0398";""
"mall";"Toko Ponsel";"SILIWANGI CELL";"3WW9+H9P, Jl. Karamat, Karamat, Kec. Gunungpuyuh, Kota Sukabumi, Jawa Barat 43122";"Jl. Karamat, Karamat, Kec. Gunungpuyuh, Kota Sukabumi";"JAWA BARAT";"43122";"Indonesia";" 085870013538";"";"";"-6.9035346";"106.9184491";"https://maps.google.com/?cid=0x0:0xa31d4d68c84a84fc";""
"mall";"Pusat Perbelanjaan";"JASTIPMIMO";"3WM9+7PX, Gg. Brawijaya III, Sriwidari, Kec. Gunungpuyuh, Kota Sukabumi, Jawa Barat 43121";"Gg. Brawijaya III, Sriwidari, Kec. Gunungpuyuh, Kota Sukabumi";"JAWA BARAT";"43121";"Indonesia";" 082219003477";"";"";"-6.9167524";"106.9193745";"https://maps.google.com/?cid=0x0:0xbc26e1a7c3bd1e73";""
"mall";"Pusat Perbelanjaan";"GATH";"BLOK C no 9 PERUM BUMI BABAKAN RAHESTHA, Jl. Pasir Pogor, Sukaresmi, Kec. Cisaat, Kabupaten Sukabumi, Jawa Barat 43152";"Jl. Pasir Pogor, Sukaresmi, Kec. Cisaat, Kabupaten Sukabumi";"JAWA BARAT";"43152";"Indonesia";" 089638840344";"";"";"-6.8919688";"106.9129808";"https://maps.google.com/?cid=0x0:0x66368cd3bdb2caa7";""
"mall";"Pusat Perbelanjaan";"R CELL";"Jl. Palasari, Sukakarya, Kec. Warudoyong, Kota Sukabumi, Jawa Barat 43135";"Sukakarya, Kec. Warudoyong, Kota Sukabumi";"JAWA BARAT";"43135";"Indonesia";" 08881218881";"";"";"-6.919897";"106.909393";"https://maps.google.com/?cid=0x0:0xd71c93bf7353e8a7";""
"mall";"Pusat Perbelanjaan";"Seruny'(SR) Collection";"Karang Tengah, Kec. Gunungpuyuh, Kota Sukabumi, Jawa Barat 43121";"Kec. Gunungpuyuh, Kota Sukabumi";"JAWA BARAT";"43121";"Indonesia";" 085795130455";"";"";"-6.9111051";"106.9119504";"https://maps.google.com/?cid=0x0:0x2cea4f9ae50eba50";""
"mall";"Kantor Pemerintah";"Umkm Kota Sukabumi";"3WQ6+RX7, Jl. Babakan Garung, Karang Tengah, Kec. Gunungpuyuh, Kota Sukabumi, Jawa Barat 43121";"Jl. Babakan Garung, Karang Tengah, Kec. Gunungpuyuh, Kota Sukabumi";"JAWA BARAT";"43121";"Indonesia";" 085793627647";"";"";"-6.910472";"106.9124356";"https://maps.google.com/?cid=0x0:0xf838a6cf6dbd2f02";""
"mall";"Pemasok Air Minum Dalam Kemasan";"Depot Air Mineral Pondok Pesantren Syamul Ulum";"3WM8+7G2, Jl. Bhayangkara Gg. Pesantren, Gunungpuyuh, Kec. Gunungpuyuh, Kota Sukabumi, Jawa Barat 43123";"Jl. Bhayangkara Gg. Pesantren, Gunungpuyuh, Kec. Gunungpuyuh, Kota Sukabumi";"JAWA BARAT";"43123";"Indonesia";" 085860991847";"";"";"-6.9168626";"106.9162685";"https://maps.google.com/?cid=0x0:0xfdb2ada319fcea39";""
"mall";"Pusat Perbelanjaan";"intan cell";"3WRH+4J3, Gg. Masjid, Karamat, Kec. Gunungpuyuh, Kota Sukabumi, Jawa Barat 43122";"Gg. Masjid, Karamat, Kec. Gunungpuyuh, Kota Sukabumi";"JAWA BARAT";"43122";"Indonesia";"";"";"";"-6.9097319";"106.929058";"https://maps.google.com/?cid=0x0:0xb55df4558bd66a21";""
"mall";"Toko bahan makanan";"WARUNG UMI";"3WMH+R4P, Selabatu, Kec. Cikole, Kota Sukabumi, Jawa Barat 43114";"Selabatu, Kec. Cikole, Kota Sukabumi";"JAWA BARAT";"43114";"Indonesia";" 085764033838";"";"";"-6.9154207";"106.9278221";"https://maps.google.com/?cid=0x0:0x822e970a89821c59";""
"mall";"Toko";"WARUNG MANG DADANG/IBU LILIH";"3WM6+9F5, Karang Tengah, Kec. Gunungpuyuh, Kota Sukabumi, Jawa Barat 43121";"Karang Tengah, Kec. Gunungpuyuh, Kota Sukabumi";"JAWA BARAT";"43121";"Indonesia";" 085723265331";"";"";"-6.9166023";"106.9112499";"https://maps.google.com/?cid=0x0:0xaaf27e30e07669b3";""
"mall";"Desainer bunga";"Florist Pipe Cleaner Sukabumi";"Jl. Terusan Karamat Gotong Royong, Gunungpuyuh, Kec. Gunungpuyuh, Kota Sukabumi, Jawa Barat 43123";"Gunungpuyuh, Kec. Gunungpuyuh, Kota Sukabumi";"JAWA BARAT";"43123";"Indonesia";" 085179798366";"";"";"-6.9120451";"106.916477";"https://maps.google.com/?cid=0x0:0xd6ea80bf0ef034e0";""
"mall";"Minimarket";"Warung mamih";"3WV7+VMX, Jl. Raya Sukabumi, Karang Tengah, Kec. Gunungpuyuh, Kabupaten Sukabumi, Jawa Barat 43121";"Jl. Raya Sukabumi, Karang Tengah, Kec. Gunungpuyuh, Kabupaten Sukabumi";"JAWA BARAT";"43121";"Indonesia";"";"";"";"-6.9052691";"106.9142236";"https://maps.google.com/?cid=0x0:0x5f6c51d047466197";""
"mall";"mall";"Jawa Barat 43121";"Kec. Gunungpuyuh, Kabupaten Sukabumi, Jawa Barat";"Kabupaten Sukabumi, Jawa Barat";"JAWA BARAT";"";"Indonesia";"";"";"";"-6.9063748";"106.9137265";"https://maps.google.com/?cid=0x0:0x1c00c5eb568ecfd0";""
"mall";"Pusat Perbelanjaan";"Mall";"3WP5+FQQ, Karang Tengah, Kec. Gunungpuyuh, Kota Sukabumi, Jawa Barat 43121";"Karang Tengah, Kec. Gunungpuyuh, Kota Sukabumi";"JAWA BARAT";"43121";"Indonesia";"";"";"";"-6.9137783";"106.9094705";"https://maps.google.com/?cid=0x0:0x8fceab77ba68b9ee";""
"mall";"Toko Pakaian dan Peralatan Luar Ruangan";"MOUNTAIN ROUTE SUKABUMI";"Jl. Ciwangi, Gunungparang, Kec. Cikole, Kota Sukabumi, Jawa Barat";"Kota Sukabumi, Jawa Barat";"JAWA BARAT";"";"Indonesia";" 081333253258";"";"/url?q>>u003dhttps://heylink.me/areistoresukabumi>>u0026opi>>u003d79508299>>u0026sa>>u003dU>>u0026ved>>u003d0ahUKEwjqmYXqqPyLAxW71DgGHXh0JkMQ61gIFigS>>u0026usg>>u003dAOvVaw2KZvKOjfB7RHnHRYX8IpyR";"-6.9207271";"106.9280307";"https://maps.google.com/?cid=0x0:0x9750b09d004abf3e";""
"mall";"Toko Pakaian";"Matahari Departement Store";"Citimall Sukabumi Lt. 1- 2, Jl. A. Yani No.125-127, Gunungparang, Kec. Cikole, Kota Sukabumi, Jawa Barat 43111";"Jl. A. Yani No.125-127, Gunungparang, Kec. Cikole, Kota Sukabumi";"JAWA BARAT";"43111";"Indonesia";" 0266232816";"";"/url?q>>u003dhttp://www.matahari.co.id/>>u0026opi>>u003d79508299>>u0026sa>>u003dU>>u0026ved>>u003d0ahUKEwicjbDqqPyLAxViyzgGHcxbGhUQ61gIFigS>>u0026usg>>u003dAOvVaw24rKJBZ0ZUJ9V1dYuwfyqf";"-6.9218068";"106.9288177";"https://maps.google.com/?cid=0x0:0xce2be0afaff8de48";""
"mall";"Pusat Perbelanjaan";"Qitha Cell";"Jl. Merbabu No.1, Karang Tengah, Kec. Gunungpuyuh, Kota Sukabumi, Jawa Barat 43121";"Karang Tengah, Kec. Gunungpuyuh, Kota Sukabumi";"JAWA BARAT";"43121";"Indonesia";" 08999665557";"";"";"-6.9179982";"106.9119075";"https://maps.google.com/?cid=0x0:0xc3eed66846a8bdef";""
"mall";"Restoran";"Toserba Selamat";"Jl. R. E. Martadinata No.67-515, Kebonjati, Kec. Cikole, Kota Sukabumi, Jawa Barat 43113";"Kebonjati, Kec. Cikole, Kota Sukabumi";"JAWA BARAT";"43113";"Indonesia";" 0266243734";"";"/url?q>>u003dhttp://www.toserbaselamat.id/>>u0026opi>>u003d79508299>>u0026sa>>u003dU>>u0026ved>>u003d0ahUKEwiFi-fqqPyLAxWEi2MGHehGBX8Q61gIFigS>>u0026usg>>u003dAOvVaw2nPc_F-Edu_v7LNfJjyHJG";"-6.9210805";"106.9348566";"https://maps.google.com/?cid=0x0:0x116464f8e24a0e41";""
