Category;Real Category;Business Name;Address;City;State;Postal Code;Country;Phone;Email;Website;Latitude;Longitude;Map Link;Details Link
"supermarket";"Minimarket";"Super Indo Supermaket";"3WHV+2PH, Jl. R.A. Kosasih, Cisarua, Kec. Cikole, Kota Sukabumi, Jawa Barat 43116";"Jl. R.A. Kosasih, Cisarua, Kec. Cikole, Kota Sukabumi";"JAWA BARAT";"43116";"Indonesia";"";"";"/url?q>>u003dhttps://www.superindo.co.id/>>u0026opi>>u003d79508299>>u0026sa>>u003dU>>u0026ved>>u003d0ahUKEwj1s-HsrfyLAxWO4zgGHSOBF0cQ61gIESgN>>u0026usg>>u003dAOvVaw3Jvlw-ogsTXn9Ytft2kuK3";"-6.9224405";"106.944374";"https://maps.google.com/?cid=0x0:0xced948d964921be3";""
"supermarket";"Toko bahan makanan";"Bright";"3WFM+96F, Jalan Tipar Gede, Tipar, Citamiang, Tipar, Kec. Citamiang, Kota Sukabumi, Jawa Barat 43141";"Jalan Tipar Gede, Tipar, Citamiang, Tipar, Kec. Citamiang, Kota Sukabumi";"JAWA BARAT";"43141";"Indonesia";" 081586448773";"";"";"-6.9265719";"106.933043";"https://maps.google.com/?cid=0x0:0xab8c39bfdc3bb37";""
"supermarket";"Grosir";"Multi Grosir (MG Tipar) Sukabumi";"Jl. Tipar Gede No.55-58, Tipar, Kec. Citamiang, Kota Sukabumi, Jawa Barat 43151";"Tipar, Kec. Citamiang, Kota Sukabumi";"JAWA BARAT";"43151";"Indonesia";" 0816630390";"";"/url?q>>u003dhttps://www.instagram.com/multi.grosir/>>u0026opi>>u003d79508299>>u0026sa>>u003dU>>u0026ved>>u003d0ahUKEwiaz7jtrfyLAxXf8DgGHaWCAFUQ61gIFigS>>u0026usg>>u003dAOvVaw2vzR28GcfSrwf2XNibV8eN";"-6.9254999";"106.9299454";"https://maps.google.com/?cid=0x0:0x14a0a6712ee57919";""
"supermarket";"Toko bahan makanan";"Warung akbar";"3WCJ+346, Citamiang, Kec. Citamiang, Kota Sukabumi, Jawa Barat 43141";"Citamiang, Kec. Citamiang, Kota Sukabumi";"JAWA BARAT";"43141";"Indonesia";"";"";"";"-6.9298387";"106.9302575";"https://maps.google.com/?cid=0x0:0xd2df1233675c1a03";""
"supermarket";"Toko Swalayan";"Prima Centre";"Jalan Tembusan Stasiun Timur No.2, Cikole, Kebonjati, Kec. Cikole, Kota Sukabumi, Jawa Barat 43141";"Cikole, Kebonjati, Kec. Cikole, Kota Sukabumi";"JAWA BARAT";"43141";"Indonesia";" 085795685197";"";"";"-6.9254131";"106.9315833";"https://maps.google.com/?cid=0x0:0x53d912e63f1e7fc8";""
"supermarket";"Minimarket";"Kebon Kawung";"Jalan Pelabuhan 2 No.105 Nyomplong Warudoyong, Tipar, Kec. Citamiang, Kota Sukabumi, Jawa Barat 43131";"Tipar, Kec. Citamiang, Kota Sukabumi";"JAWA BARAT";"43131";"Indonesia";" 0266224913";"";"";"-6.9301734";"106.9259921";"https://maps.google.com/?cid=0x0:0x35bd9f07f24a7dc6";""
"supermarket";"Toko bahan makanan";"Warung panji / panji sf";"Jl. RH. Didi Sukardi No.15, Gedongpanjang, Kec. Citamiang, Kota Sukabumi, Jawa Barat 43143";"Gedongpanjang, Kec. Citamiang, Kota Sukabumi";"JAWA BARAT";"43143";"Indonesia";" 085703000406";"";"";"-6.9323532";"106.9323554";"https://maps.google.com/?cid=0x0:0xbaf2552f70a4ed62";""
"supermarket";"Grosir";"MULTI GROSIR";"Jl. St. Tim. No.40, RT.02, Gunungparang, Kec. Cikole, Kota Sukabumi, Jawa Barat 43111";"RT.02, Gunungparang, Kec. Cikole, Kota Sukabumi";"JAWA BARAT";"43111";"Indonesia";" 0816630391";"";"/url?q>>u003dhttps://www.instagram.com/multi.grosir/>>u0026opi>>u003d79508299>>u0026sa>>u003dU>>u0026ved>>u003d0ahUKEwjAoMzurfyLAxWdXGwGHf-EAB4Q61gIFigS>>u0026usg>>u003dAOvVaw0g9xQ6OdQ6muGgTb9KEdVr";"-6.9240707";"106.9308117";"https://maps.google.com/?cid=0x0:0x289ccb32f2d49ca6";""
"supermarket";"Toko bahan makanan";"Alfamart";"Jl. Pemuda, RT.002/RW.06, Citamiang, Sukabumi Selatan, Kota Sukabumi, Jawa Barat 43143";"RT.002/RW.06, Citamiang, Sukabumi Selatan, Kota Sukabumi";"JAWA BARAT";"43143";"Indonesia";" 1500959";"";"";"-6.930958";"106.929432";"https://maps.google.com/?cid=0x0:0xbb1fb99e741bac12";""
"supermarket";"Pusat Perbelanjaan";"Citymall soekabumi";"3WHH+4G3, Jl. A. Yani, Gunungparang, Kec. Cikole, Kota Sukabumi, Jawa Barat";"Kota Sukabumi, Jawa Barat";"JAWA BARAT";"";"Indonesia";" 081328181984";"";"";"-6.9222407";"106.9288007";"https://maps.google.com/?cid=0x0:0xa15704f1328005d5";""
"supermarket";"Toko Swalayan";"Warung RISKA RISKI";"3WFJ+GCG, Jl. Tipar, Tipar, Kec. Citamiang, Kota Sukabumi, Jawa Barat 43141";"Jl. Tipar, Tipar, Kec. Citamiang, Kota Sukabumi";"JAWA BARAT";"43141";"Indonesia";"";"";"";"-6.9261964";"106.931074";"https://maps.google.com/?cid=0x0:0x4435ae563ffafd74";""
"supermarket";"Toko Buah dan Sayuran";"Kios Sayuran Muhamad Rivaldi";"3WFM+G93, Jl. Tipar, Tipar, Kec. Citamiang, Kota Sukabumi, Jawa Barat 43141";"Jl. Tipar, Tipar, Kec. Citamiang, Kota Sukabumi";"JAWA BARAT";"43141";"Indonesia";" 082111828702";"";"";"-6.9262288";"106.9334182";"https://maps.google.com/?cid=0x0:0xf89bfab5b0274bb8";""
"supermarket";"supermarket";"Jawa Barat 43141";"Kec. Citamiang, Kota Sukabumi, Jawa Barat";"Kota Sukabumi, Jawa Barat";"JAWA BARAT";"";"Indonesia";"";"";"";"-6.9290813";"106.9284822";"https://maps.google.com/?cid=0x0:0x1c00c5eb568ed090";""
"supermarket";"Toko";"MINISO - Citimall Sukabumi";"3WHH+6FQ, Gunungparang, Kec. Cikole, Kota Sukabumi, Jawa Barat 43111";"Gunungparang, Kec. Cikole, Kota Sukabumi";"JAWA BARAT";"43111";"Indonesia";"";"";"";"-6.92191";"106.9287223";"https://maps.google.com/?cid=0x0:0xf295317011a656a4";""
"supermarket";"Koperasi";"Koperasi Mart (Kop-Mart) Sukabumi";"Jl. Surya Kencana No.3, Selabatu, Kec. Cikole, Kota Sukabumi, Jawa Barat 43143";"Selabatu, Kec. Cikole, Kota Sukabumi";"JAWA BARAT";"43143";"Indonesia";" 081297347719";"";"";"-6.9189957";"106.9280705";"https://maps.google.com/?cid=0x0:0xfb471034d2939349";""
"supermarket";"Minimarket";"Super Indo Supermaket";"3WHV+2PH, Jl. R.A. Kosasih, Cisarua, Kec. Cikole, Kota Sukabumi, Jawa Barat 43116";"Jl. R.A. Kosasih, Cisarua, Kec. Cikole, Kota Sukabumi";"JAWA BARAT";"43116";"Indonesia";"";"";"/url?q>>u003dhttps://www.superindo.co.id/>>u0026opi>>u003d79508299>>u0026sa>>u003dU>>u0026ved>>u003d0ahUKEwi_16f8rfyLAxXgj68BHbiSEtMQ61gIESgN>>u0026usg>>u003dAOvVaw2XLrEVfObe48UEAGrcx-Yk";"-6.9224405";"106.944374";"https://maps.google.com/?cid=0x0:0xced948d964921be3";""
"supermarket";"Toko Swalayan";"Warung Ibu Linda";"3W7J+M4Q, Citamiang, Kec. Citamiang, Kota Sukabumi, Jawa Barat 43143";"Citamiang, Kec. Citamiang, Kota Sukabumi";"JAWA BARAT";"43143";"Indonesia";"";"";"";"-6.9357806";"106.9303591";"https://maps.google.com/?cid=0x0:0x15d811a2263cbe65";""
"supermarket";"Grosir";"MULTI GROSIR";"Jl. St. Tim. No.40, RT.02, Gunungparang, Kec. Cikole, Kota Sukabumi, Jawa Barat 43111";"RT.02, Gunungparang, Kec. Cikole, Kota Sukabumi";"JAWA BARAT";"43111";"Indonesia";" 0816630391";"";"/url?q>>u003dhttps://www.instagram.com/multi.grosir/>>u0026opi>>u003d79508299>>u0026sa>>u003dU>>u0026ved>>u003d0ahUKEwi66Of8rfyLAxUes1YBHZ1oGvMQ61gIFigS>>u0026usg>>u003dAOvVaw0H8oI9gS2EnjKEvetlT2Kl";"-6.9240707";"106.9308117";"https://maps.google.com/?cid=0x0:0x289ccb32f2d49ca6";""
"supermarket";"Minimarket";"warung Bintang";"3WCR+V5Q, Jl. Babakan Bandung, Nanggeleng, Kec. Citamiang, Kota Sukabumi, Jawa Barat 43145";"Jl. Babakan Bandung, Nanggeleng, Kec. Citamiang, Kota Sukabumi";"JAWA BARAT";"43145";"Indonesia";"";"";"";"-6.9277867";"106.9404747";"https://maps.google.com/?cid=0x0:0xe829874d041ba1b4";""
"supermarket";"Minimarket";"Toko DD";"Perumahan Puri Cibeureum Permai I, Jalan Pangrango Blok B, No. 6, Cibeureum Hilir, Cibeureum, Cibeureum Hilir, Kec. Cibeureum, Kabupaten Sukabumi, Jawa Barat 43164";"Jalan Pangrango Blok B, No. 6, Cibeureum Hilir, Cibeureum, Cibeureum Hilir, Kec. Cibeureum, Kabupaten Sukabumi";"JAWA BARAT";"43164";"Indonesia";" 085721450011";"";"";"-6.9244594";"106.9529513";"https://maps.google.com/?cid=0x0:0x476863f3d085e514";""
"supermarket";"Toko Kelontong Asia";"toko sembako";"Jl. Letda T. Asmita No.28, Gedongpanjang, Kec. Citamiang, Kota Sukabumi, Jawa Barat 43144";"Gedongpanjang, Kec. Citamiang, Kota Sukabumi";"JAWA BARAT";"43144";"Indonesia";" 085759434745";"";"";"-6.9388536";"106.9341635";"https://maps.google.com/?cid=0x0:0x9e3c2b3955257c";""
"supermarket";"Minimarket";"Toko Segar";"Jl. Pemuda No.26, Cikondang, Kec. Citamiang, Kota Sukabumi, Jawa Barat 43143";"Cikondang, Kec. Citamiang, Kota Sukabumi";"JAWA BARAT";"43143";"Indonesia";" 085794129489";"";"";"-6.9310161";"106.9273416";"https://maps.google.com/?cid=0x0:0xef54a28a6dba2698";""
"supermarket";"";"Toko";"Jalan Baru Sukaraja / Jalan Selakaso Babakan Cibeureum, Cikaret, Kec. Kebonpedes, Kabupaten Sukabumi, Jawa Barat 43142";"Cikaret, Kec. Kebonpedes, Kabupaten Sukabumi";"JAWA BARAT";"43142";"Indonesia";"";"";"";"-6.9227204";"106.9582859";"https://maps.google.com/?cid=0x0:0x7ceb9fb14a24d71";""
"supermarket";"Toko umum";"Warung Abah Endid";"3WCP+99G, Jl. Cijangkar, RT.5/RW.9, Nanggeleng, Kec. Citamiang, Kota Sukabumi, Jawa Barat 43145";"Jl. Cijangkar, RT.5/RW.9, Nanggeleng, Kec. Citamiang, Kota Sukabumi";"JAWA BARAT";"43145";"Indonesia";"";"";"";"-6.9290697";"106.9359677";"https://maps.google.com/?cid=0x0:0x6459c87d0dfebf70";""
"supermarket";"Toko Swalayan";"Warung Ibu Gress";"Perumahan Puri Cibeureum Permai 2,Jl Seruni NO.18 Blok L,RW 09 RT 09, Babakan, Kec. Cibeureum, Kota Sukabumi";"Kota Sukabumi, Jawa Barat";"JAWA BARAT";"";"Indonesia";" 087708464760";"";"";"-6.924115";"106.9565053";"https://maps.google.com/?cid=0x0:0xec03b9edfa0771ac";""
"supermarket";"Toko bahan makanan";"Toko Anto";"No.mor 19, Jl. Bougenville No.19, Babakan, Kec. Cibeureum, Kota Sukabumi, Jawa Barat 43142";"Jl. Bougenville No.19, Babakan, Kec. Cibeureum, Kota Sukabumi";"JAWA BARAT";"43142";"Indonesia";" 085863259000";"";"";"-6.9257562";"106.9552044";"https://maps.google.com/?cid=0x0:0x36fcef68ceca63f6";""
"supermarket";"Toko bahan makanan";"Warung H dudu";"Jl. Bojonggaling No.36, Kebonpedes, Kec. Kebonpedes, Kabupaten Sukabumi, Jawa Barat 43194";"Kebonpedes, Kec. Kebonpedes, Kabupaten Sukabumi";"JAWA BARAT";"43194";"Indonesia";"";"";"";"-6.931126";"106.972566";"https://maps.google.com/?cid=0x0:0xa8ad3540f523959e";""
"supermarket";"Toko Buah dan Sayur";"Gudang Buah Maranatha";"3XG6+QQP, Jl. Baru Sukaraja, Pasirhalang, Kec. Sukaraja, Kota Sukabumi, Jawa Barat";"Kota Sukabumi, Jawa Barat";"JAWA BARAT";"";"Indonesia";" 083163533848";"";"";"-6.9230469";"106.9619468";"https://maps.google.com/?cid=0x0:0x2058a8e92ba52e5";""
"supermarket";"Toko bahan makanan";"Toko Mamah Santi";"3XG4+MG4, Jl. Kaliandra, Babakan, Kec. Cibeureum, Kota Sukabumi, Jawa Barat 43142";"Jl. Kaliandra, Babakan, Kec. Cibeureum, Kota Sukabumi";"JAWA BARAT";"43142";"Indonesia";"";"";"";"-6.9233513";"106.9563346";"https://maps.google.com/?cid=0x0:0xaf7a2535257a0edf";""
"supermarket";"Minimarket";"Indomaret Pelda re suryanta";"Jl. Pelda Suryanta No.83, RT.3/RW.013, Nanggeleng, Kec. Citamiang, Kota Sukabumi, Jawa Barat 43145";"RT.3/RW.013, Nanggeleng, Kec. Citamiang, Kota Sukabumi";"JAWA BARAT";"43145";"Indonesia";" 0266244484";"";"/url?q>>u003dhttp://indomaret.co.id/utama/promosi/super-hemat.html>>u0026opi>>u003d79508299>>u0026sa>>u003dU>>u0026ved>>u003d0ahUKEwjd45KArvyLAxUizjQHHUt-IXEQ61gIFigS>>u0026usg>>u003dAOvVaw2FC89Hp_XOOHTrrd3OVRML";"-6.9355868";"106.9356715";"https://maps.google.com/?cid=0x0:0x44a1b2421ca02df1";""
"supermarket";"Toko bahan makanan";"Misbah warung";"3W9W+H3X, Cibeureum Hilir, Kec. Cibeureum, Kota Sukabumi, Jawa Barat 43165";"Cibeureum Hilir, Kec. Cibeureum, Kota Sukabumi";"JAWA BARAT";"43165";"Indonesia";" 081398365436";"";"";"-6.9310115";"106.9452263";"https://maps.google.com/?cid=0x0:0x79511931d7a4a19e";""
"supermarket";"Toko bahan makanan";"Warung bunda ovy";"Jl. Utama Afnan Regency blok A71, Sasagaran, Kebonpedes, Sukabumi Regency, West Java";"Kabupaten Sukabumi, Jawa Barat";"JAWA BARAT";"";"Indonesia";"";"";"";"-6.9553943";"106.9608392";"https://maps.google.com/?cid=0x0:0xa1c354b047dbb28a";""
"supermarket";"Toko Swalayan";"Warung qalisya";"Jln peramuka 2i City, Citamiang, Kec. Citamiang, Kota Sukabumi, Jawa Barat 43143";"Citamiang, Kec. Citamiang, Kota Sukabumi";"JAWA BARAT";"43143";"Indonesia";"";"";"";"-6.9353592";"106.9296316";"https://maps.google.com/?cid=0x0:0x2d095792f5f14233";""
"supermarket";"Toko Buah dan Sayuran";"Waroeng Buah Dan Sayur";"3WCP+J4M, Jl. Cijangkar, Nanggeleng, Kec. Citamiang, Kota Sukabumi, Jawa Barat 43145";"Jl. Cijangkar, Nanggeleng, Kec. Citamiang, Kota Sukabumi";"JAWA BARAT";"43145";"Indonesia";" 085720630408";"";"";"-6.9284045";"106.9352934";"https://maps.google.com/?cid=0x0:0x996a9a605bee2132";""
"supermarket";"supermarket";"Jawa Barat 43142";"Kec. Cibeureum, Kabupaten Sukabumi, Jawa Barat";"Kabupaten Sukabumi, Jawa Barat";"JAWA BARAT";"";"Indonesia";"";"";"";"-6.9396812";"106.9565206";"https://maps.google.com/?cid=0x0:0x1c00c5eb568ed0a0";""
"supermarket";"Minimarket";""Waroeng Rizky"";"3W5M+HFW, Gedongpanjang, Kec. Citamiang, Kota Sukabumi, Jawa Barat 43144";"Gedongpanjang, Kec. Citamiang, Kota Sukabumi";"JAWA BARAT";"43144";"Indonesia";" 085721319090";"";"";"-6.9410136";"106.9336967";"https://maps.google.com/?cid=0x0:0x9da0bed45408cef";""
"supermarket";"Toko";"Toko Sembako Sarimadu";"3XC3+VF8, Jl. Matahari, Babakan, Kec. Cibeureum, Kota Sukabumi, Jawa Barat 43165";"Jl. Matahari, Babakan, Kec. Cibeureum, Kota Sukabumi";"JAWA BARAT";"43165";"Indonesia";" 083113966027";"";"";"-6.9278418";"106.9537109";"https://maps.google.com/?cid=0x0:0xe0814b07605ef66c";""
"supermarket";"supermarket";"N/A";"";"";"JAWA BARAT";"";"Indonesia";" 085720507298";"";"";"-6.8678439";"107.605137";"https://maps.google.com/?cid=0x0:0xe002230c4f62ae73";""
"supermarket";"Pusat Perbelanjaan";"Ramayana departemen store";"Jl. Tipar Gede No.17, Tipar, Kec. Citamiang, Kota Sukabumi, Jawa Barat 43151";"Tipar, Kec. Citamiang, Kota Sukabumi";"JAWA BARAT";"43151";"Indonesia";"";"";"/url?q>>u003dhttp://ramayana.co.id/>>u0026opi>>u003d79508299>>u0026sa>>u003dU>>u0026ved>>u003d0ahUKEwi30reCrvyLAxWnzzgGHQMOMFoQ61gIEigO>>u0026usg>>u003dAOvVaw0WXRwpEOzW4o9es-dU4dJX";"-6.9256251";"106.9292051";"https://maps.google.com/?cid=0x0:0x2116016f77b3ae77";""
"supermarket";"Toko bahan makanan";"Warung Adoel";"Jalan R. A. no . 372Kosasih, Cisarua, Kec. Cibeureum, Kota Sukabumi, Jawa Barat 43165";"Cisarua, Kec. Cibeureum, Kota Sukabumi";"JAWA BARAT";"43165";"Indonesia";" 081387648571";"";"";"-6.9197855";"106.9543076";"https://maps.google.com/?cid=0x0:0xe1f23858e9cd1c93";""
"supermarket";"Toko bahan makanan";"Warung Kevin";"3W9X+6HF, Jalan Raya Ciandam  Jalan Sarasa Sudajaya, Cibeureum, Cibeureum Hilir, Kec. Cibeureum, Kabupaten Sukabumi, Jawa Barat 43165";"Jalan Raya Ciandam  Jalan Sarasa Sudajaya, Cibeureum, Cibeureum Hilir, Kec. Cibeureum, Kabupaten Sukabumi";"JAWA BARAT";"43165";"Indonesia";" 085871516833";"";"";"-6.9319397";"106.948931";"https://maps.google.com/?cid=0x0:0xa3bbeaec2e9a942b";""
"supermarket";"Minimarket";"SRC Nizam";"Jl. Rancakadu, Babakan, Kec. Cibeureum, Kabupaten Sukabumi, Jawa Barat 43142";"Babakan, Kec. Cibeureum, Kabupaten Sukabumi";"JAWA BARAT";"43142";"Indonesia";" 085882222829";"";"";"-6.931181";"106.9487212";"https://maps.google.com/?cid=0x0:0x9f8a7e6fdb370e3e";""
"supermarket";"Toko";"WarungKu";"3X24+XVW, Sindangpalay, Kec. Cibeureum, Kota Sukabumi, Jawa Barat 43162";"Sindangpalay, Kec. Cibeureum, Kota Sukabumi";"JAWA BARAT";"43162";"Indonesia";" 081295090185";"";"";"-6.9475181";"106.9571932";"https://maps.google.com/?cid=0x0:0x1e50ab0a453cf23";""
"supermarket";"Toko bahan makanan";"warung berkah Salamet";"Kebonpedes, Kec. Kebonpedes, Kabupaten Sukabumi, Jawa Barat 43194";"Kec. Kebonpedes, Kabupaten Sukabumi";"JAWA BARAT";"43194";"Indonesia";" 08818108068";"";"";"-6.93994";"106.9679955";"https://maps.google.com/?cid=0x0:0xe52de116e8e5c7e2";""
"supermarket";"Minimarket";""Waroeng Rizky"";"3W5M+HFW, Gedongpanjang, Kec. Citamiang, Kota Sukabumi, Jawa Barat 43144";"Gedongpanjang, Kec. Citamiang, Kota Sukabumi";"JAWA BARAT";"43144";"Indonesia";" 085721319090";"";"";"-6.9410136";"106.9336967";"https://maps.google.com/?cid=0x0:0x9da0bed45408cef";""
"supermarket";"Toko Swalayan";"Warung Ibu Linda";"3W7J+M4Q, Citamiang, Kec. Citamiang, Kota Sukabumi, Jawa Barat 43143";"Citamiang, Kec. Citamiang, Kota Sukabumi";"JAWA BARAT";"43143";"Indonesia";"";"";"";"-6.9357806";"106.9303591";"https://maps.google.com/?cid=0x0:0x15d811a2263cbe65";""
"supermarket";"Toko bahan makanan";"warung ayu";"3WCM+PX3, Unnamed Road, Nanggeleng, Kec. Citamiang, Kota Sukabumi, Jawa Barat 43145";"Unnamed Road, Nanggeleng, Kec. Citamiang, Kota Sukabumi";"JAWA BARAT";"43145";"Indonesia";" 0895320388001";"";"";"-6.9282421";"106.934913";"https://maps.google.com/?cid=0x0:0x3f25b04171d90b77";""
"supermarket";"Toko bahan makanan";"Warung Darus";"3WCJ+M56, Tipar, Kec. Citamiang, Kota Sukabumi, Jawa Barat 43141";"Tipar, Kec. Citamiang, Kota Sukabumi";"JAWA BARAT";"43141";"Indonesia";"";"";"";"-6.9283303";"106.9303786";"https://maps.google.com/?cid=0x0:0xebdd6bd4b7896053";""
"supermarket";"Toko Kelontong Asia";"toko sembako";"Jl. Letda T. Asmita No.28, Gedongpanjang, Kec. Citamiang, Kota Sukabumi, Jawa Barat 43144";"Gedongpanjang, Kec. Citamiang, Kota Sukabumi";"JAWA BARAT";"43144";"Indonesia";" 085759434745";"";"";"-6.9388536";"106.9341635";"https://maps.google.com/?cid=0x0:0x9e3c2b3955257c";""
"supermarket";"Toko bahan makanan";"Alfamart";"Jl. Pemuda, RT.002/RW.06, Citamiang, Sukabumi Selatan, Kota Sukabumi, Jawa Barat 43143";"RT.002/RW.06, Citamiang, Sukabumi Selatan, Kota Sukabumi";"JAWA BARAT";"43143";"Indonesia";" 1500959";"";"";"-6.930958";"106.929432";"https://maps.google.com/?cid=0x0:0xbb1fb99e741bac12";""
"supermarket";"Toko bahan makanan";"Ram.toko enung";"Jl. RH. Didi Sukardi No.132, RW.001, Citamiang, Kec. Citamiang, Kota Sukabumi, Jawa Barat 43143";"RW.001, Citamiang, Kec. Citamiang, Kota Sukabumi";"JAWA BARAT";"43143";"Indonesia";"";"";"";"-6.9405667";"106.9310598";"https://maps.google.com/?cid=0x0:0xaffb715508181456";""
"supermarket";"Toko bahan makanan";"Rumah Kang Anto";"perum cipoho, Jl. Rebab No.2, Cikondang, Kec. Citamiang, Kota Sukabumi, Jawa Barat 43141";"Jl. Rebab No.2, Cikondang, Kec. Citamiang, Kota Sukabumi";"JAWA BARAT";"43141";"Indonesia";" 0813801929993";"";"";"-6.9366016";"106.9250613";"https://maps.google.com/?cid=0x0:0xb933141e4ec81554";""
"supermarket";"Toko bahan makanan";"Bright";"3WFM+96F, Jalan Tipar Gede, Tipar, Citamiang, Tipar, Kec. Citamiang, Kota Sukabumi, Jawa Barat 43141";"Jalan Tipar Gede, Tipar, Citamiang, Tipar, Kec. Citamiang, Kota Sukabumi";"JAWA BARAT";"43141";"Indonesia";" 081586448773";"";"";"-6.9265719";"106.933043";"https://maps.google.com/?cid=0x0:0xab8c39bfdc3bb37";""
"supermarket";"Toko bahan makanan";"Warung panji / panji sf";"Jl. RH. Didi Sukardi No.15, Gedongpanjang, Kec. Citamiang, Kota Sukabumi, Jawa Barat 43143";"Gedongpanjang, Kec. Citamiang, Kota Sukabumi";"JAWA BARAT";"43143";"Indonesia";" 085703000406";"";"";"-6.9323532";"106.9323554";"https://maps.google.com/?cid=0x0:0xbaf2552f70a4ed62";""
"supermarket";"Toko Kelontong Asia";"Nasution";"Jl. Pelda Suryanta No.63, Nanggeleng, Kec. Citamiang, Kota Sukabumi, Jawa Barat 43145";"Nanggeleng, Kec. Citamiang, Kota Sukabumi";"JAWA BARAT";"43145";"Indonesia";" 081310013919";"";"";"-6.9348163";"106.9348685";"https://maps.google.com/?cid=0x0:0xe044b544e09935ab";""
"supermarket";"Minimarket";"Super Indo Supermaket";"3WHV+2PH, Jl. R.A. Kosasih, Cisarua, Kec. Cikole, Kota Sukabumi, Jawa Barat 43116";"Jl. R.A. Kosasih, Cisarua, Kec. Cikole, Kota Sukabumi";"JAWA BARAT";"43116";"Indonesia";"";"";"";"-6.9224405";"106.944374";"https://maps.google.com/?cid=0x0:0xced948d964921be3";""
"supermarket";"Grosir";"Multi Grosir (MG Tipar) Sukabumi";"Jl. Tipar Gede No.55-58, Tipar, Kec. Citamiang, Kota Sukabumi, Jawa Barat 43151";"Tipar, Kec. Citamiang, Kota Sukabumi";"JAWA BARAT";"43151";"Indonesia";" 0816630390";"";"/url?q>>u003dhttps://www.instagram.com/multi.grosir/>>u0026opi>>u003d79508299>>u0026sa>>u003dU>>u0026ved>>u003d0ahUKEwiK-u2hrvyLAxVBTmwGHbWkJEEQ61gIFigS>>u0026usg>>u003dAOvVaw3zT32513dM6tRtx6ER0AP5";"-6.9254999";"106.9299454";"https://maps.google.com/?cid=0x0:0x14a0a6712ee57919";""
"supermarket";"Toko Kelontong Asia";"Warung Riri";"Jl. Pramuka II, Citamiang, Kec. Citamiang, Kota Sukabumi, Jawa Barat 43143";"Citamiang, Kec. Citamiang, Kota Sukabumi";"JAWA BARAT";"43143";"Indonesia";" 08562226959";"";"";"-6.936718";"106.927753";"https://maps.google.com/?cid=0x0:0x370bcaa84155d73a";""
"supermarket";"Pusat Perbelanjaan";"Ramayana departemen store";"Jl. Tipar Gede No.17, Tipar, Kec. Citamiang, Kota Sukabumi, Jawa Barat 43151";"Tipar, Kec. Citamiang, Kota Sukabumi";"JAWA BARAT";"43151";"Indonesia";"";"";"/url?q>>u003dhttp://ramayana.co.id/>>u0026opi>>u003d79508299>>u0026sa>>u003dU>>u0026ved>>u003d0ahUKEwiX4piirvyLAxXFSWwGHVI0B0YQ61gIEigO>>u0026usg>>u003dAOvVaw3KbtdS81WkFY1FzJjuv1i5";"-6.9256251";"106.9292051";"https://maps.google.com/?cid=0x0:0x2116016f77b3ae77";""
"supermarket";"Minimarket";"Toko Segar";"Jl. Pemuda No.26, Cikondang, Kec. Citamiang, Kota Sukabumi, Jawa Barat 43143";"Cikondang, Kec. Citamiang, Kota Sukabumi";"JAWA BARAT";"43143";"Indonesia";" 085794129489";"";"";"-6.9310161";"106.9273416";"https://maps.google.com/?cid=0x0:0xef54a28a6dba2698";""
"supermarket";"Toko bahan makanan";"Toko lubis";"3W3H+67Q, Jl. lamping, Gedongpanjang, Kec. Citamiang, Kota Sukabumi, Jawa Barat 43144";"Jl. lamping, Gedongpanjang, Kec. Citamiang, Kota Sukabumi";"JAWA BARAT";"43144";"Indonesia";"";"";"";"-6.9469025";"106.9282399";"https://maps.google.com/?cid=0x0:0x8a8134b83aaa6fb8";""
"supermarket";"Minimarket";"Toko Regar SMANSA";"Jl. RH. Didi Sukardi, RT.002/RW.004, Citamiang, Kec. Citamiang, Kota Sukabumi, Jawa Barat 43143";"RT.002/RW.004, Citamiang, Kec. Citamiang, Kota Sukabumi";"JAWA BARAT";"43143";"Indonesia";"";"";"";"-6.9388099";"106.9312805";"https://maps.google.com/?cid=0x0:0xb7a0948c58d4fe24";""
"supermarket";"Toko Swalayan";"Warung qalisya";"Jln peramuka 2i City, Citamiang, Kec. Citamiang, Kota Sukabumi, Jawa Barat 43143";"Citamiang, Kec. Citamiang, Kota Sukabumi";"JAWA BARAT";"43143";"Indonesia";"";"";"";"-6.9353592";"106.9296316";"https://maps.google.com/?cid=0x0:0x2d095792f5f14233";""
"supermarket";"Toko Buah dan Sayuran";"Waroeng Buah Dan Sayur";"3WCP+J4M, Jl. Cijangkar, Nanggeleng, Kec. Citamiang, Kota Sukabumi, Jawa Barat 43145";"Jl. Cijangkar, Nanggeleng, Kec. Citamiang, Kota Sukabumi";"JAWA BARAT";"43145";"Indonesia";" 085720630408";"";"";"-6.9284045";"106.9352934";"https://maps.google.com/?cid=0x0:0x996a9a605bee2132";""
"supermarket";"supermarket";"Jawa Barat 43143";"Citamiang, Kec. Citamiang, Kota Sukabumi, Jawa Barat";"Kota Sukabumi, Jawa Barat";"JAWA BARAT";"";"Indonesia";"";"";"";"-6.9361579";"106.92922";"https://maps.google.com/?cid=0x0:0x1c00c5eb568ed0b0";""
"supermarket";"Grosir";"MULTI GROSIR";"Jl. St. Tim. No.40, RT.02, Gunungparang, Kec. Cikole, Kota Sukabumi, Jawa Barat 43111";"RT.02, Gunungparang, Kec. Cikole, Kota Sukabumi";"JAWA BARAT";"43111";"Indonesia";" 0816630391";"";"/url?q>>u003dhttps://www.instagram.com/multi.grosir/>>u0026opi>>u003d79508299>>u0026sa>>u003dU>>u0026ved>>u003d0ahUKEwjC9ZukrvyLAxUDT2wGHareAuUQ61gIFigS>>u0026usg>>u003dAOvVaw0fa0648RvLiUlKfs67-Yc7";"-6.9240707";"106.9308117";"https://maps.google.com/?cid=0x0:0x289ccb32f2d49ca6";""
"supermarket";"supermarket";"N/A";"";"";"JAWA BARAT";"";"Indonesia";" 085720507298";"";"";"-6.8678439";"107.605137";"https://maps.google.com/?cid=0x0:0xe002230c4f62ae73";""
"supermarket";"Minimarket";"Indomaret Pelda re suryanta";"Jl. Pelda Suryanta No.83, RT.3/RW.013, Nanggeleng, Kec. Citamiang, Kota Sukabumi, Jawa Barat 43145";"RT.3/RW.013, Nanggeleng, Kec. Citamiang, Kota Sukabumi";"JAWA BARAT";"43145";"Indonesia";" 0266244484";"";"/url?q>>u003dhttp://indomaret.co.id/utama/promosi/super-hemat.html>>u0026opi>>u003d79508299>>u0026sa>>u003dU>>u0026ved>>u003d0ahUKEwj_wL6krvyLAxXH8qACHcYfOvEQ61gIFigS>>u0026usg>>u003dAOvVaw3gRQx58fRBVeChO84dhomT";"-6.9355868";"106.9356715";"https://maps.google.com/?cid=0x0:0x44a1b2421ca02df1";""
"supermarket";"Toko";"Kerupuk kulit sapi "Perjuangan Snack"";"Jl. RH. Didi Sukardi No.142, Citamiang, Kec. Citamiang, Kota Sukabumi, Jawa Barat 43143";"Citamiang, Kec. Citamiang, Kota Sukabumi";"JAWA BARAT";"43143";"Indonesia";" 082126708341";"";"";"-6.94138";"106.9311115";"https://maps.google.com/?cid=0x0:0x5c3e8390b5d3e516";""
"supermarket";"Minimarket";""Waroeng Rizky"";"3W5M+HFW, Gedongpanjang, Kec. Citamiang, Kota Sukabumi, Jawa Barat 43144";"Gedongpanjang, Kec. Citamiang, Kota Sukabumi";"JAWA BARAT";"43144";"Indonesia";" 085721319090";"";"";"-6.9410136";"106.9336967";"https://maps.google.com/?cid=0x0:0x9da0bed45408cef";""
"supermarket";"Toko bahan makanan";"Toko lubis";"3W3H+67Q, Jl. lamping, Gedongpanjang, Kec. Citamiang, Kota Sukabumi, Jawa Barat 43144";"Jl. lamping, Gedongpanjang, Kec. Citamiang, Kota Sukabumi";"JAWA BARAT";"43144";"Indonesia";"";"";"";"-6.9469025";"106.9282399";"https://maps.google.com/?cid=0x0:0x8a8134b83aaa6fb8";""
"supermarket";"Toko Kelontong Asia";"toko sembako";"Jl. Letda T. Asmita No.28, Gedongpanjang, Kec. Citamiang, Kota Sukabumi, Jawa Barat 43144";"Gedongpanjang, Kec. Citamiang, Kota Sukabumi";"JAWA BARAT";"43144";"Indonesia";" 085759434745";"";"";"-6.9388536";"106.9341635";"https://maps.google.com/?cid=0x0:0x9e3c2b3955257c";""
"supermarket";"Toko Swalayan";"Warung Ibu Lampung";"3W7H+XP8, Jl. Pramuka II, Citamiang, Kec. Citamiang, Kota Sukabumi, Jawa Barat 43143";"Jl. Pramuka II, Citamiang, Kec. Citamiang, Kota Sukabumi";"JAWA BARAT";"43143";"Indonesia";" 089657638388";"";"";"-6.935085";"106.9293416";"https://maps.google.com/?cid=0x0:0x912672f14442b9f2";""
"supermarket";"Toko Kelontong Asia";"Nasution";"Jl. Pelda Suryanta No.63, Nanggeleng, Kec. Citamiang, Kota Sukabumi, Jawa Barat 43145";"Nanggeleng, Kec. Citamiang, Kota Sukabumi";"JAWA BARAT";"43145";"Indonesia";" 081310013919";"";"";"-6.9348163";"106.9348685";"https://maps.google.com/?cid=0x0:0xe044b544e09935ab";""
"supermarket";"Toko Swalayan";"Toko Oim";"Jalan Lamping Nomor 18, Gedong Panjang, Citamiang, Gedongpanjang, Kec. Citamiang, Kota Sukabumi, Jawa Barat 43144";"Gedong Panjang, Citamiang, Gedongpanjang, Kec. Citamiang, Kota Sukabumi";"JAWA BARAT";"43144";"Indonesia";" 085863356775";"";"";"-6.9443877";"106.9314575";"https://maps.google.com/?cid=0x0:0x199cafe60f7e9f6a";""
