Category;Real Category;Business Name;Address;City;State;Postal Code;Country;Phone;Email;Website;Latitude;Longitude;Map Link;Details Link
"supermarket";"Toko bahan makanan";"K-uCan Mart";"2WXF+CCX, Sudajaya Hilir, Kec. Baros, Kota Sukabumi, Jawa Barat 43161";"Sudajaya Hilir, Kec. Baros, Kota Sukabumi";"JAWA BARAT";"43161";"Indonesia";"";"";"";"-6.951389";"106.9236047";"https://maps.google.com/?cid=0x0:0xc06b4a3345651d4b";""
"supermarket";"Toko bahan makanan";"Warung Ole";"2WQR+7R5, Baros, Kec. Baros, Kota Sukabumi, Jawa Barat 43161";"Baros, Kec. Baros, Kota Sukabumi";"JAWA BARAT";"43161";"Indonesia";" 089526943925";"";"";"-6.9618605";"106.9420956";"https://maps.google.com/?cid=0x0:0xb41ced738e2f28d3";""
"supermarket";"Minimarket";"Alfamart Baros";"Kp. Ganteng, Jl. Baros, Baros, Kec. Baros, Kota Sukabumi, Jawa Barat 43195";"Jl. Baros, Baros, Kec. Baros, Kota Sukabumi";"JAWA BARAT";"43195";"Indonesia";"";"";"";"-6.9648459";"106.9392406";"https://maps.google.com/?cid=0x0:0x10b51211dd397eaa";""
"supermarket";"Toko Swalayan";"waroeng mang awit";"2WPX+CG9, Jl. Nangela, Ciwalen, Kec. Baros, Kabupaten Sukabumi, Jawa Barat 43161";"Jl. Nangela, Ciwalen, Kec. Baros, Kabupaten Sukabumi";"JAWA BARAT";"43161";"Indonesia";"";"";"";"-6.9639555";"106.9488633";"https://maps.google.com/?cid=0x0:0x4d38463e5b3e009e";""
"supermarket";"Toko bahan makanan";"Toko Bu pipih";"2WPQ+QFH, Jl. Genteng, Baros, Kec. Baros, Kota Sukabumi, Jawa Barat 43161";"Jl. Genteng, Baros, Kec. Baros, Kota Sukabumi";"JAWA BARAT";"43161";"Indonesia";" 08996057033";"";"";"-6.9630516";"106.9387199";"https://maps.google.com/?cid=0x0:0x9a127cdc4a871b36";""
"supermarket";"Toko umum";"Dheranolshop";"Baros, Kec. Baros, Kota Sukabumi, Jawa Barat 43161";"Kec. Baros, Kota Sukabumi";"JAWA BARAT";"43161";"Indonesia";" 085720777004";"";"";"-6.9607287";"106.9485224";"https://maps.google.com/?cid=0x0:0x104dc3b1e0f9bc1e";""
"supermarket";"Toko Swalayan";"Tk.Landon Enestey";"jl.Raya Baros km06Rt02 No.06, Nangela, Kec. Baros, Kota Sukabumi, Jawa Barat 43161";"Nangela, Kec. Baros, Kota Sukabumi";"JAWA BARAT";"43161";"Indonesia";" 08170176455";"";"";"-6.9603908";"106.9429792";"https://maps.google.com/?cid=0x0:0xceae8bb5ddb68cdd";""
"supermarket";"Toko bahan makanan";"Toko Ibu Ihat";"Sudajaya, Jl. Baros No.83, RT.03 RW03, Jayaraksa, Kec. Baros, Kota Sukabumi, Jawa Barat 43166";"Jl. Baros No.83, RT.03 RW03, Jayaraksa, Kec. Baros, Kota Sukabumi";"JAWA BARAT";"43166";"Indonesia";" 085720524282";"";"";"-6.9526938";"106.9328372";"https://maps.google.com/?cid=0x0:0x2f19f7603e8a4222";""
"supermarket";"Minimarket";"Toko Warna";"Jl. Lkr. Sel. No.18, Jayamekar, Kec. Baros, Kota Sukabumi, Jawa Barat 43166";"Jayamekar, Kec. Baros, Kota Sukabumi";"JAWA BARAT";"43166";"Indonesia";" 08164638303";"";"";"-6.951366";"106.9280795";"https://maps.google.com/?cid=0x0:0x47a278692d3fd3a0";""
"supermarket";"Toko bahan makanan";"toko mulya jaya";"2WPQ+F2C, Jl. Tangkil - Agrabinta, Baros, Kec. Baros, Kota Sukabumi, Jawa Barat 43161";"Jl. Tangkil - Agrabinta, Baros, Kec. Baros, Kota Sukabumi";"JAWA BARAT";"43161";"Indonesia";"";"";"";"-6.9638213";"106.9375105";"https://maps.google.com/?cid=0x0:0xbaa37298cf95a15d";""
"supermarket";"Toko bahan makanan";"Toko Teja";"Jl. Safir Raya Perum Baros Kencana No.07, Baros, Kec. Baros, Kota Sukabumi, Jawa Barat 43161";"Baros, Kec. Baros, Kota Sukabumi";"JAWA BARAT";"43161";"Indonesia";" 082115564881";"";"";"-6.9610992";"106.9434129";"https://maps.google.com/?cid=0x0:0x3f425c8a39fe9867";""
"supermarket";"Paket Makanan Pokok";"Toko Seger Galih";"Jl. Garuda No.104, Baros, Kec. Baros, Kota Sukabumi, Jawa Barat 43161";"Baros, Kec. Baros, Kota Sukabumi";"JAWA BARAT";"43161";"Indonesia";" 085850207011";"";"";"-6.9587249";"106.945969";"https://maps.google.com/?cid=0x0:0x3a385ca4ea82f996";""
"supermarket";"Minimarket";"AHS JURAGAN";"Jl. Baros, Jayaraksa, Kec. Baros, Kabupaten Sukabumi, Jawa Barat 43166";"Jayaraksa, Kec. Baros, Kabupaten Sukabumi";"JAWA BARAT";"43166";"Indonesia";" 081564987999";"";"";"-6.9621058";"106.9347147";"https://maps.google.com/?cid=0x0:0xdc0a4388f9c8d40a";""
"supermarket";"Toko bahan makanan";"Toko Ahmad";"2WRW+JH4, Baros, Kec. Baros, Kota Sukabumi, Jawa Barat 43161";"Baros, Kec. Baros, Kota Sukabumi";"JAWA BARAT";"43161";"Indonesia";"";"";"";"-6.9584988";"106.9464621";"https://maps.google.com/?cid=0x0:0x68f8fbbefeb29704";""
"supermarket";"Toko bahan makanan";"SRC Toko Yani";"2WPQ+HWH, Baros, Kec. Baros, Kota Sukabumi, Jawa Barat 43161";"Baros, Kec. Baros, Kota Sukabumi";"JAWA BARAT";"43161";"Indonesia";" 085735555776";"";"";"-6.9635641";"106.9398643";"https://maps.google.com/?cid=0x0:0x1d8fe07004904ddd";""
"supermarket";"Toko bahan makanan";"Gorengan Mak encum";"Belakang SPBU Baros Rt 01/Rw01, Baros, Kec. Baros, Kota Sukabumi, Jawa Barat 43161";"Baros, Kec. Baros, Kota Sukabumi";"JAWA BARAT";"43161";"Indonesia";" 085703222443";"";"";"-6.9645414";"106.9364663";"https://maps.google.com/?cid=0x0:0x10139d7bcd304708";""
"supermarket";"";"TOKO IBU ENTIN";"2WPM+QJ3, Jayaraksa, Kec. Baros, Kabupaten Sukabumi, Jawa Barat 43166";"Jayaraksa, Kec. Baros, Kabupaten Sukabumi";"JAWA BARAT";"43166";"Indonesia";"";"";"";"-6.9631045";"106.9340609";"https://maps.google.com/?cid=0x0:0x113748051f311218";""
"supermarket";"supermarket";"Jawa Barat 43161";"Kec. Baros, Kabupaten Sukabumi, Jawa Barat";"Kabupaten Sukabumi, Jawa Barat";"JAWA BARAT";"";"Indonesia";"";"";"";"-6.9597603";"106.9373361";"https://maps.google.com/?cid=0x0:0x1c00c5eb568ed140";""
"supermarket";"Toko bahan makanan";"Warung pa Ade";"2WMW+598, Jl. Tangkil - Agrabinta, Baros, Kec. Baros, Kabupaten Sukabumi, Jawa Barat 43161";"Jl. Tangkil - Agrabinta, Baros, Kec. Baros, Kabupaten Sukabumi";"JAWA BARAT";"43161";"Indonesia";"";"";"";"-6.9670874";"106.9459555";"https://maps.google.com/?cid=0x0:0x2e070c07a547658e";""
"supermarket";"Toko";"Hemat Toserba  Grosir Unit Baros";"6536+5H7, Bojong, Kec. Karangtengah, Kabupaten Cianjur, Jawa Barat 43281";"Bojong, Kec. Karangtengah, Kabupaten Cianjur";"JAWA BARAT";"43281";"Indonesia";"";"";"";"-6.7970851";"107.1614304";"https://maps.google.com/?cid=0x0:0x6eb2cc46dbfcf522";""
"supermarket";"Grosir air mineral";"Aqua Home Service (AHS) | Baros - Raja Kores";"Baros, Kec. Baros, Kota Sukabumi, Jawa Barat 43161";"Kec. Baros, Kota Sukabumi";"JAWA BARAT";"43161";"Indonesia";" 081293844883";"";"";"-6.9602403";"106.9494649";"https://maps.google.com/?cid=0x0:0x4dafe55ee5693812";""
"supermarket";"Minimarket";"Alfamart";"Jl. Baros No.124, RT.05/RW.03, Sudajaya Hilir, Kec. Baros, Kota Sukabumi, Jawa Barat 43195";"RT.05/RW.03, Sudajaya Hilir, Kec. Baros, Kota Sukabumi";"JAWA BARAT";"43195";"Indonesia";" 1500959";"";"";"-6.9564305";"106.9333538";"https://maps.google.com/?cid=0x0:0xb3775efeda32c868";""
"supermarket";"Minimarket";"Dustira Mart";"4G7M+744, Jl. Jend. Sudirman, Baros, Kec. Cimahi Tengah, Kota Cimahi, Jawa Barat 40521";"Jl. Jend. Sudirman, Baros, Kec. Cimahi Tengah, Kota Cimahi";"JAWA BARAT";"40521";"Indonesia";" 0226652207";"";"";"-6.8868646";"107.532813";"https://maps.google.com/?cid=0x0:0x19434598c8eee9f2";""
"supermarket";"Toko";"SRC Daffa Baros";"Jl. Proklamasi, Jayamekar, Kec. Baros, Kota Sukabumi, Jawa Barat 43166";"Jayamekar, Kec. Baros, Kota Sukabumi";"JAWA BARAT";"43166";"Indonesia";" 085624439077";"";"";"-6.9657686";"106.9282955";"https://maps.google.com/?cid=0x0:0x202e7a1e67104df4";""
"supermarket";"Toko Swalayan";"Prima Centre 9 Baros";"Jl. Kecubung 3 No.3, Baros, Kec. Baros, Kota Sukabumi, Jawa Barat 43161";"Baros, Kec. Baros, Kota Sukabumi";"JAWA BARAT";"43161";"Indonesia";"";"";"";"-6.9629444";"106.9429485";"https://maps.google.com/?cid=0x0:0xc4f2397d9ea20a33";""
"supermarket";"Toko bahan makanan";"Toko Ibu Ihat";"Sudajaya, Jl. Baros No.83, RT.03 RW03, Jayaraksa, Kec. Baros, Kota Sukabumi, Jawa Barat 43166";"Jl. Baros No.83, RT.03 RW03, Jayaraksa, Kec. Baros, Kota Sukabumi";"JAWA BARAT";"43166";"Indonesia";" 085720524282";"";"";"-6.9526938";"106.9328372";"https://maps.google.com/?cid=0x0:0x2f19f7603e8a4222";""
"supermarket";"Minimarket";"Alfamart Baros";"Kp. Ganteng, Jl. Baros, Baros, Kec. Baros, Kota Sukabumi, Jawa Barat 43195";"Jl. Baros, Baros, Kec. Baros, Kota Sukabumi";"JAWA BARAT";"43195";"Indonesia";"";"";"";"-6.9648459";"106.9392406";"https://maps.google.com/?cid=0x0:0x10b51211dd397eaa";""
"supermarket";"Toko bahan makanan";"K-uCan Mart";"2WXF+CCX, Sudajaya Hilir, Kec. Baros, Kota Sukabumi, Jawa Barat 43161";"Sudajaya Hilir, Kec. Baros, Kota Sukabumi";"JAWA BARAT";"43161";"Indonesia";"";"";"";"-6.951389";"106.9236047";"https://maps.google.com/?cid=0x0:0xc06b4a3345651d4b";""
"supermarket";"Minimarket";"AHS JURAGAN";"Jl. Baros, Jayaraksa, Kec. Baros, Kabupaten Sukabumi, Jawa Barat 43166";"Jayaraksa, Kec. Baros, Kabupaten Sukabumi";"JAWA BARAT";"43166";"Indonesia";" 081564987999";"";"";"-6.9621058";"106.9347147";"https://maps.google.com/?cid=0x0:0xdc0a4388f9c8d40a";""
"supermarket";"Toko bahan makanan";"Warung Pojok";"3W2M+2G2, Jl. Lkr. Sel., Jayaraksa, Kec. Baros, Kota Sukabumi, Jawa Barat 43166";"Jl. Lkr. Sel., Jayaraksa, Kec. Baros, Kota Sukabumi";"JAWA BARAT";"43166";"Indonesia";" 087820920875";"";"";"-6.9499873";"106.9337677";"https://maps.google.com/?cid=0x0:0xe0c5e258e6450a96";""
"supermarket";"Toko bahan makanan";"toko mulya jaya";"2WPQ+F2C, Jl. Tangkil - Agrabinta, Baros, Kec. Baros, Kota Sukabumi, Jawa Barat 43161";"Jl. Tangkil - Agrabinta, Baros, Kec. Baros, Kota Sukabumi";"JAWA BARAT";"43161";"Indonesia";"";"";"";"-6.9638213";"106.9375105";"https://maps.google.com/?cid=0x0:0xbaa37298cf95a15d";""
"supermarket";"Toko bahan makanan";"Toko Bu pipih";"2WPQ+QFH, Jl. Genteng, Baros, Kec. Baros, Kota Sukabumi, Jawa Barat 43161";"Jl. Genteng, Baros, Kec. Baros, Kota Sukabumi";"JAWA BARAT";"43161";"Indonesia";" 08996057033";"";"";"-6.9630516";"106.9387199";"https://maps.google.com/?cid=0x0:0x9a127cdc4a871b36";""
"supermarket";"Toko Swalayan";"ME WARUNG AKSESORIS";"2WXJ+VV3, Jayaraksa, Kec. Baros, Kota Sukabumi, Jawa Barat 43166";"Jayaraksa, Kec. Baros, Kota Sukabumi";"JAWA BARAT";"43166";"Indonesia";" 08524252612";"";"";"-6.9503524";"106.9321869";"https://maps.google.com/?cid=0x0:0x3e8c4d4bba77e979";""
"supermarket";"Toko bahan makanan";"Warung Ole";"2WQR+7R5, Baros, Kec. Baros, Kota Sukabumi, Jawa Barat 43161";"Baros, Kec. Baros, Kota Sukabumi";"JAWA BARAT";"43161";"Indonesia";" 089526943925";"";"";"-6.9618605";"106.9420956";"https://maps.google.com/?cid=0x0:0xb41ced738e2f28d3";""
"supermarket";"Minimarket";"Syaiful";"3W2M+3JX, Jalan Lingkar Selatan, Jayaraksa, Baros, Jayaraksa, Kec. Baros, Kota Sukabumi, Jawa Barat 43166";"Jalan Lingkar Selatan, Jayaraksa, Baros, Jayaraksa, Kec. Baros, Kota Sukabumi";"JAWA BARAT";"43166";"Indonesia";" 085723355943";"";"";"-6.9497711";"106.9341177";"https://maps.google.com/?cid=0x0:0x57433ad26b7b9861";""
"supermarket";"";"TOKO IBU ENTIN";"2WPM+QJ3, Jayaraksa, Kec. Baros, Kabupaten Sukabumi, Jawa Barat 43166";"Jayaraksa, Kec. Baros, Kabupaten Sukabumi";"JAWA BARAT";"43166";"Indonesia";"";"";"";"-6.9631045";"106.9340609";"https://maps.google.com/?cid=0x0:0x113748051f311218";""
"supermarket";"Minimarket";"Toko Rizky Putra";"Cibodas, Jl. Cicadas, Sudajaya Hilir, Kec. Baros, Kota Sukabumi, Jawa Barat 43168";"Jl. Cicadas, Sudajaya Hilir, Kec. Baros, Kota Sukabumi";"JAWA BARAT";"43168";"Indonesia";"";"";"";"-6.9628005";"106.9164546";"https://maps.google.com/?cid=0x0:0x2a6c4325be2ed253";""
"supermarket";"Minimarket";"Warung andi";"2WXJ+C9R, Jl. Sudajaya Hilir, Jayaraksa, Kec. Baros, Kota Sukabumi, Jawa Barat 43166";"Jl. Sudajaya Hilir, Jayaraksa, Kec. Baros, Kota Sukabumi";"JAWA BARAT";"43166";"Indonesia";" 085860666633";"";"";"-6.9513951";"106.9308782";"https://maps.google.com/?cid=0x0:0xc68192251314351f";""
"supermarket";"Pemasok Air Minum Dalam Kemasan";"Mutiara Water Sukabumi";"2WXJ+764, Jl. Sudajaya Hilir, Jayaraksa, Kec. Baros, Kota Sukabumi, Jawa Barat 43166";"Jl. Sudajaya Hilir, Jayaraksa, Kec. Baros, Kota Sukabumi";"JAWA BARAT";"43166";"Indonesia";" 085210743533";"";"";"-6.95186";"106.9305718";"https://maps.google.com/?cid=0x0:0xf5371d28be70683b";""
"supermarket";"Toko umum";"Warung Sayuran Teh Leni";"2WRV+6G7, Jl. Garuda, Baros, Kec. Baros, Kota Sukabumi, Jawa Barat 43161";"Jl. Garuda, Baros, Kec. Baros, Kota Sukabumi";"JAWA BARAT";"43161";"Indonesia";"";"";"";"-6.9594665";"106.9437864";"https://maps.google.com/?cid=0x0:0x2145744e8d03fc1f";""
"supermarket";"Toko bahan makanan";"Warung Tati";"2WVF+H58, Sudajaya Hilir, Kec. Baros, Kota Sukabumi, Jawa Barat 43167";"Sudajaya Hilir, Kec. Baros, Kota Sukabumi";"JAWA BARAT";"43167";"Indonesia";"";"";"";"-6.95608";"106.9229593";"https://maps.google.com/?cid=0x0:0x7b85df983f4ebc4a";""
"supermarket";"Toko bahan makanan";"e-warong Harmoni";"Jayamekar, Kec. Baros, Kabupaten Sukabumi, Jawa Barat 43166";"Kec. Baros, Kabupaten Sukabumi";"JAWA BARAT";"43166";"Indonesia";"";"";"";"-6.9562713";"106.926099";"https://maps.google.com/?cid=0x0:0x1867004ca58d80d";""
"supermarket";"supermarket";"Jawa Barat 43166";"Kec. Baros, Kabupaten Sukabumi, Jawa Barat";"Kabupaten Sukabumi, Jawa Barat";"JAWA BARAT";"";"Indonesia";"";"";"";"-6.9614306";"106.9270066";"https://maps.google.com/?cid=0x0:0x1c00c5eb568ed1f0";""
"supermarket";"Minimarket";"Baros Mart";"Jl. Zamrud Raya No.9, Baros, Kec. Baros, Kota Sukabumi, Jawa Barat 43161";"Baros, Kec. Baros, Kota Sukabumi";"JAWA BARAT";"43161";"Indonesia";"";"";"";"-6.963019";"106.9414967";"https://maps.google.com/?cid=0x0:0x306b43cdb084e0f4";""
"supermarket";"Toko";"Hemat Toserba  Grosir Unit Baros";"6536+5H7, Bojong, Kec. Karangtengah, Kabupaten Cianjur, Jawa Barat 43281";"Bojong, Kec. Karangtengah, Kabupaten Cianjur";"JAWA BARAT";"43281";"Indonesia";"";"";"";"-6.7970851";"107.1614304";"https://maps.google.com/?cid=0x0:0x6eb2cc46dbfcf522";""
"supermarket";"Toko bahan makanan";"Toko Teja";"Jl. Safir Raya Perum Baros Kencana No.07, Baros, Kec. Baros, Kota Sukabumi, Jawa Barat 43161";"Baros, Kec. Baros, Kota Sukabumi";"JAWA BARAT";"43161";"Indonesia";" 082115564881";"";"";"-6.9610992";"106.9434129";"https://maps.google.com/?cid=0x0:0x3f425c8a39fe9867";""
"supermarket";"Minimarket";"Dustira Mart";"4G7M+744, Jl. Jend. Sudirman, Baros, Kec. Cimahi Tengah, Kota Cimahi, Jawa Barat 40521";"Jl. Jend. Sudirman, Baros, Kec. Cimahi Tengah, Kota Cimahi";"JAWA BARAT";"40521";"Indonesia";" 0226652207";"";"";"-6.8868646";"107.532813";"https://maps.google.com/?cid=0x0:0x19434598c8eee9f2";""
"supermarket";"Toko umum";"Dheranolshop";"Baros, Kec. Baros, Kota Sukabumi, Jawa Barat 43161";"Kec. Baros, Kota Sukabumi";"JAWA BARAT";"43161";"Indonesia";" 085720777004";"";"";"-6.9607287";"106.9485224";"https://maps.google.com/?cid=0x0:0x104dc3b1e0f9bc1e";""
"supermarket";"Minimarket";"Alfamart";"Jl. Baros No.124, RT.05/RW.03, Sudajaya Hilir, Kec. Baros, Kota Sukabumi, Jawa Barat 43195";"RT.05/RW.03, Sudajaya Hilir, Kec. Baros, Kota Sukabumi";"JAWA BARAT";"43195";"Indonesia";" 1500959";"";"";"-6.9564305";"106.9333538";"https://maps.google.com/?cid=0x0:0xb3775efeda32c868";""
"supermarket";"Toko Swalayan";"Tk.Landon Enestey";"jl.Raya Baros km06Rt02 No.06, Nangela, Kec. Baros, Kota Sukabumi, Jawa Barat 43161";"Nangela, Kec. Baros, Kota Sukabumi";"JAWA BARAT";"43161";"Indonesia";" 08170176455";"";"";"-6.9603908";"106.9429792";"https://maps.google.com/?cid=0x0:0xceae8bb5ddb68cdd";""
"supermarket";"Toko Swalayan";"E WARONG CIBEUREUM 1";"3W5W+5CG, Limusnunggal, Kec. Cibeureum, Kabupaten Sukabumi, Jawa Barat 43165";"Limusnunggal, Kec. Cibeureum, Kabupaten Sukabumi";"JAWA BARAT";"43165";"Indonesia";"";"";"";"-6.9420679";"106.9460926";"https://maps.google.com/?cid=0x0:0x87382a1162a3bc38";""
"supermarket";"Toko Swalayan";"Warung Ibu Gress";"Perumahan Puri Cibeureum Permai 2,Jl Seruni NO.18 Blok L,RW 09 RT 09, Babakan, Kec. Cibeureum, Kota Sukabumi";"Kota Sukabumi, Jawa Barat";"JAWA BARAT";"";"Indonesia";" 087708464760";"";"";"-6.924115";"106.9565053";"https://maps.google.com/?cid=0x0:0xec03b9edfa0771ac";""
"supermarket";"Minimarket";"Toko DD";"Perumahan Puri Cibeureum Permai I, Jalan Pangrango Blok B, No. 6, Cibeureum Hilir, Cibeureum, Cibeureum Hilir, Kec. Cibeureum, Kabupaten Sukabumi, Jawa Barat 43164";"Jalan Pangrango Blok B, No. 6, Cibeureum Hilir, Cibeureum, Cibeureum Hilir, Kec. Cibeureum, Kabupaten Sukabumi";"JAWA BARAT";"43164";"Indonesia";" 085721450011";"";"";"-6.9244594";"106.9529513";"https://maps.google.com/?cid=0x0:0x476863f3d085e514";""
"supermarket";"Dapur Umum";"Warung Teh Yuli";"Kp.Cibungur, 43165, Limusnunggal, Kec. Cibeureum, Kabupaten Sukabumi, Jawa Barat 43165";"43165, Limusnunggal, Kec. Cibeureum, Kabupaten Sukabumi";"JAWA BARAT";"43165";"Indonesia";"";"";"";"-6.9508594";"106.94543";"https://maps.google.com/?cid=0x0:0xd2c6ebfc2adb4839";""
"supermarket";"";"Toko";"Jalan Baru Sukaraja / Jalan Selakaso Babakan Cibeureum, Cikaret, Kec. Kebonpedes, Kabupaten Sukabumi, Jawa Barat 43142";"Cikaret, Kec. Kebonpedes, Kabupaten Sukabumi";"JAWA BARAT";"43142";"Indonesia";"";"";"";"-6.9227204";"106.9582859";"https://maps.google.com/?cid=0x0:0x7ceb9fb14a24d71";""
"supermarket";"Toko bahan makanan";"Warung Ibu Halimah";"3X55+CWJ, Babakan, Kec. Cibeureum, Kabupaten Sukabumi, Jawa Barat 43142";"Babakan, Kec. Cibeureum, Kabupaten Sukabumi";"JAWA BARAT";"43142";"Indonesia";" 085862920547";"";"";"-6.9414187";"106.9597534";"https://maps.google.com/?cid=0x0:0x22505203f9b3adaf";""
"supermarket";"Toko bahan makanan";"Toko Mamah Santi";"3XG4+MG4, Jl. Kaliandra, Babakan, Kec. Cibeureum, Kota Sukabumi, Jawa Barat 43142";"Jl. Kaliandra, Babakan, Kec. Cibeureum, Kota Sukabumi";"JAWA BARAT";"43142";"Indonesia";"";"";"";"-6.9233513";"106.9563346";"https://maps.google.com/?cid=0x0:0xaf7a2535257a0edf";""
"supermarket";"Minimarket";"Toko Cibeureum 2";"Jl. Ciandam KM. 1, Cibeureum Hilir, Cibeureum, Cibeureum Hilir, Kec. Cibeureum, Kabupaten Sukabumi, Jawa Barat 43165";"Cibeureum Hilir, Cibeureum, Cibeureum Hilir, Kec. Cibeureum, Kabupaten Sukabumi";"JAWA BARAT";"43165";"Indonesia";" 085798660979";"";"";"-6.9273465";"106.9464579";"https://maps.google.com/?cid=0x0:0xa2997219ae53f2e3";""
"supermarket";"Toko Swalayan";"WARUNG KANG BOHEL";"2WXW+F5R, Sindangpalay, Kec. Cibeureum, Kota Sukabumi, Jawa Barat 43162";"Sindangpalay, Kec. Cibeureum, Kota Sukabumi";"JAWA BARAT";"43162";"Indonesia";" 085694113840";"";"";"-6.9512551";"106.9453918";"https://maps.google.com/?cid=0x0:0x71ca62629a44ae3";""
"supermarket";"Toko";"WarungKu";"3X24+XVW, Sindangpalay, Kec. Cibeureum, Kota Sukabumi, Jawa Barat 43162";"Sindangpalay, Kec. Cibeureum, Kota Sukabumi";"JAWA BARAT";"43162";"Indonesia";" 081295090185";"";"";"-6.9475181";"106.9571932";"https://maps.google.com/?cid=0x0:0x1e50ab0a453cf23";""
"supermarket";"Toko bahan makanan";"Toko Anto";"No.mor 19, Jl. Bougenville No.19, Babakan, Kec. Cibeureum, Kota Sukabumi, Jawa Barat 43142";"Jl. Bougenville No.19, Babakan, Kec. Cibeureum, Kota Sukabumi";"JAWA BARAT";"43142";"Indonesia";" 085863259000";"";"";"-6.9257562";"106.9552044";"https://maps.google.com/?cid=0x0:0x36fcef68ceca63f6";""
"supermarket";"Minimarket";"SRC Nizam";"Jl. Rancakadu, Babakan, Kec. Cibeureum, Kabupaten Sukabumi, Jawa Barat 43142";"Babakan, Kec. Cibeureum, Kabupaten Sukabumi";"JAWA BARAT";"43142";"Indonesia";" 085882222829";"";"";"-6.931181";"106.9487212";"https://maps.google.com/?cid=0x0:0x9f8a7e6fdb370e3e";""
"supermarket";"Toko bahan makanan";"Misbah warung";"3W9W+H3X, Cibeureum Hilir, Kec. Cibeureum, Kota Sukabumi, Jawa Barat 43165";"Cibeureum Hilir, Kec. Cibeureum, Kota Sukabumi";"JAWA BARAT";"43165";"Indonesia";" 081398365436";"";"";"-6.9310115";"106.9452263";"https://maps.google.com/?cid=0x0:0x79511931d7a4a19e";""
"supermarket";"Toko Swalayan";"Warung Syafa";"Perumahan, Haidar Sentosa Resident, Jl. Garuda No.07 Blok W, Sindangpalay, Kec. Cibeureum, Kota Sukabumi, Jawa Barat 43162";"Haidar Sentosa Resident, Jl. Garuda No.07 Blok W, Sindangpalay, Kec. Cibeureum, Kota Sukabumi";"JAWA BARAT";"43162";"Indonesia";" 081398160019";"";"";"-6.9513188";"106.9529654";"https://maps.google.com/?cid=0x0:0xc3dcfd236717c642";""
"supermarket";"Toko bahan makanan";"Toko Penti";"2WVX+PJ2, Sindangpalay, Kec. Cibeureum, Kabupaten Sukabumi, Jawa Barat 43162";"Sindangpalay, Kec. Cibeureum, Kabupaten Sukabumi";"JAWA BARAT";"43162";"Indonesia";"";"";"";"-6.9557332";"106.9490276";"https://maps.google.com/?cid=0x0:0xed20edf1e905f369";""
"supermarket";"Minimarket";"Alfamart";"Kp.Cibungur, RT.01/RW.3, Sindangpalay, Kec. Cibeureum, Kabupaten Sukabumi, Jawa Barat 43162";"RT.01/RW.3, Sindangpalay, Kec. Cibeureum, Kabupaten Sukabumi";"JAWA BARAT";"43162";"Indonesia";" 1500959";"";"";"-6.9508351";"106.9472734";"https://maps.google.com/?cid=0x0:0x99aee40fd6a15f1e";""
"supermarket";"Toko bahan makanan";"Warung Kevin";"3W9X+6HF, Jalan Raya Ciandam  Jalan Sarasa Sudajaya, Cibeureum, Cibeureum Hilir, Kec. Cibeureum, Kabupaten Sukabumi, Jawa Barat 43165";"Jalan Raya Ciandam  Jalan Sarasa Sudajaya, Cibeureum, Cibeureum Hilir, Kec. Cibeureum, Kabupaten Sukabumi";"JAWA BARAT";"43165";"Indonesia";" 085871516833";"";"";"-6.9319397";"106.948931";"https://maps.google.com/?cid=0x0:0xa3bbeaec2e9a942b";""
"supermarket";"Minimarket";"Toko Sarah";"Jl. Gn. Arjuna 1 No.12, Cibeureum Hilir, Kec. Cibeureum, Kota Sukabumi, Jawa Barat 43165";"Cibeureum Hilir, Kec. Cibeureum, Kota Sukabumi";"JAWA BARAT";"43165";"Indonesia";" 082115154544";"";"";"-6.9255838";"106.9529929";"https://maps.google.com/?cid=0x0:0xee8a402dd16d8bd";""
"supermarket";"Toko Swalayan";"warung tasya";"3XG3+QP3, Jl. Gn. Semeru, Cibeureum Hilir, Kec. Cibeureum, Kota Sukabumi, Jawa Barat 43165";"Jl. Gn. Semeru, Cibeureum Hilir, Kec. Cibeureum, Kota Sukabumi";"JAWA BARAT";"43165";"Indonesia";"";"";"";"-6.9231121";"106.9542885";"https://maps.google.com/?cid=0x0:0x6c4545a951ad88a8";""
"supermarket";"supermarket";"Jawa Barat 43142";"Kec. Cibeureum, Kabupaten Sukabumi, Jawa Barat";"Kabupaten Sukabumi, Jawa Barat";"JAWA BARAT";"";"Indonesia";"";"";"";"-6.9396812";"106.9565206";"https://maps.google.com/?cid=0x0:0x1c00c5eb568ed0a0";""
"supermarket";"Toko Swalayan";"Warung barokah bapak Handoko";"3W2V+M88, Kp. Ciseupan, Limusnunggal, Kec. Cibeureum, Kota Sukabumi, Jawa Barat 43165";"Kp. Ciseupan, Limusnunggal, Kec. Cibeureum, Kota Sukabumi";"JAWA BARAT";"43165";"Indonesia";" 081211620049";"";"";"-6.9483383";"106.9433225";"https://maps.google.com/?cid=0x0:0x282c847c4398a3a3";""
"supermarket";"Toko bahan makanan";"Warung Adoel";"Jalan R. A. no . 372Kosasih, Cisarua, Kec. Cibeureum, Kota Sukabumi, Jawa Barat 43165";"Cisarua, Kec. Cibeureum, Kota Sukabumi";"JAWA BARAT";"43165";"Indonesia";" 081387648571";"";"";"-6.9197855";"106.9543076";"https://maps.google.com/?cid=0x0:0xe1f23858e9cd1c93";""
"supermarket";"Toko bahan makanan";"Alfamart Sarasa F 2J06";"Jl. Sarasa No.1, Kp. Loasari, Sindangpalay, Kec. Cibeureum, Kota Sukabumi, Jawa Barat 43162";"Kp. Loasari, Sindangpalay, Kec. Cibeureum, Kota Sukabumi";"JAWA BARAT";"43162";"Indonesia";" 1500959";"";"";"-6.9457438";"106.9518139";"https://maps.google.com/?cid=0x0:0x8f32b99003cd1960";""
"supermarket";"Toko";"Ruko pa ayi jalur";"3W4V+PWM, Jl. Lkr. Sel., Limusnunggal, Kec. Cibeureum, Kota Sukabumi, Jawa Barat 43165";"Jl. Lkr. Sel., Limusnunggal, Kec. Cibeureum, Kota Sukabumi";"JAWA BARAT";"43165";"Indonesia";"";"";"";"-6.9431719";"106.9447914";"https://maps.google.com/?cid=0x0:0xa2e1c9ff4e5d734f";""
"supermarket";"Minimarket";""Waroeng Rizky"";"3W5M+HFW, Gedongpanjang, Kec. Citamiang, Kota Sukabumi, Jawa Barat 43144";"Gedongpanjang, Kec. Citamiang, Kota Sukabumi";"JAWA BARAT";"43144";"Indonesia";" 085721319090";"";"";"-6.9410136";"106.9336967";"https://maps.google.com/?cid=0x0:0x9da0bed45408cef";""
"supermarket";"Pusat Perbelanjaan";"Samsi";"Jl. Samsi No.1, Cisarua, Kec. Cikole, Kota Sukabumi, Jawa Barat 43115";"Cisarua, Kec. Cikole, Kota Sukabumi";"JAWA BARAT";"43115";"Indonesia";"";"";"";"-6.9220307";"106.9401094";"https://maps.google.com/?cid=0x0:0xc62b8d9fab04ac64";""
"supermarket";"Minimarket";"Super Indo Supermaket";"3WHV+2PH, Jl. R.A. Kosasih, Cisarua, Kec. Cikole, Kota Sukabumi, Jawa Barat 43116";"Jl. R.A. Kosasih, Cisarua, Kec. Cikole, Kota Sukabumi";"JAWA BARAT";"43116";"Indonesia";"";"";"/url?q>>u003dhttps://www.superindo.co.id/>>u0026opi>>u003d79508299>>u0026sa>>u003dU>>u0026ved>>u003d0ahUKEwi95Ozoq_yLAxWv4zgGHd94NYYQ61gIESgN>>u0026usg>>u003dAOvVaw0ua2kq5gLlcXNXwrmukdmI";"-6.9224405";"106.944374";"https://maps.google.com/?cid=0x0:0xced948d964921be3";""
"supermarket";"Toko Swalayan";"Toko Alifia / Warung Wawa";"Jl. Ciandam No.227, Cibeureum Hilir, Kec. Cibeureum, Kota Sukabumi, Jawa Barat 43165";"Cibeureum Hilir, Kec. Cibeureum, Kota Sukabumi";"JAWA BARAT";"43165";"Indonesia";" 085793938034";"";"";"-6.9352274";"106.9509511";"https://maps.google.com/?cid=0x0:0xd7bf5f33afbabb5";""
"supermarket";"Minimarket";"Alfamart";"Jl. R.A. Kosasih No.6, RT.01, Sukaraja, Kec. Sukaraja, Kabupaten Sukabumi, Jawa Barat 43192";"RT.01, Sukaraja, Kec. Sukaraja, Kabupaten Sukabumi";"JAWA BARAT";"43192";"Indonesia";" 1500959";"";"";"-6.9190554";"106.9562405";"https://maps.google.com/?cid=0x0:0x19d8e15400d63d";""
"supermarket";"Toko Swalayan";"WARUNG KANG BOHEL";"2WXW+F5R, Sindangpalay, Kec. Cibeureum, Kota Sukabumi, Jawa Barat 43162";"Sindangpalay, Kec. Cibeureum, Kota Sukabumi";"JAWA BARAT";"43162";"Indonesia";" 085694113840";"";"";"-6.9512551";"106.9453918";"https://maps.google.com/?cid=0x0:0x71ca62629a44ae3";""
"supermarket";"Minimarket";"Alfamart";"Kp.Cibungur, RT.01/RW.3, Sindangpalay, Kec. Cibeureum, Kabupaten Sukabumi, Jawa Barat 43162";"RT.01/RW.3, Sindangpalay, Kec. Cibeureum, Kabupaten Sukabumi";"JAWA BARAT";"43162";"Indonesia";" 1500959";"";"";"-6.9508351";"106.9472734";"https://maps.google.com/?cid=0x0:0x99aee40fd6a15f1e";""
"supermarket";"Dapur Umum";"Warung Teh Yuli";"Kp.Cibungur, 43165, Limusnunggal, Kec. Cibeureum, Kabupaten Sukabumi, Jawa Barat 43165";"43165, Limusnunggal, Kec. Cibeureum, Kabupaten Sukabumi";"JAWA BARAT";"43165";"Indonesia";"";"";"";"-6.9508594";"106.94543";"https://maps.google.com/?cid=0x0:0xd2c6ebfc2adb4839";""
