Category,Real Category,Business Name,Address,City,State,Postal Code,Country,Phone,Email,Website,Latitude,Longitude,Map Link,Details Link
restaurant,Indonesia,Meguna Ubud Restaurant,"Jl. Monkey Forest, Padang Tegal Kelod, Kecamatan Ubud, Kabupaten Gianyar, Bali 80571","Padang Tegal Kelod, Kecamatan Ubud, Kabupaten Gianyar",BALI,80571.0,Indonesia,85163500890.0,,,-8.5181996,115.2621656,https://maps.google.com/?cid=0x0:0xcc80f79a627be370,
restaurant,Indonesia,Bali Luwih Ubud,"Jl. Sukma Kesuma, Peliatan, Kecamatan Ubud, Kabupaten Gianyar, Bali 80571","Peliatan, Kecamatan Ubud, Kabupaten Gianyar",BALI,80571.0,Indonesia,81339593557.0,,,-8.516289,115.2668939,https://maps.google.com/?cid=0x0:0xef14fd4259ee754,
restaurant,Restoran,Ibu Rai Restaurant,"Jl. Monkey Forest No.72, Ubud, Kecamatan Ubud, Kabupaten Gianyar, Bali 80571","Ubud, Kecamatan Ubud, Kabupaten Gianyar",BALI,80571.0,Indonesia,361973472.0,,,-8.5093617,115.2615927,https://maps.google.com/?cid=0x0:0x32e07a1621feae27,
restaurant,Restoran,Lynked Restaurant Ubud,"Jalan Raya, Ubud, Gianyar Regency, Bali 80571","Ubud, Gianyar Regency",BALI,80571.0,Indonesia,81338739955.0,,,-8.507724,115.2640565,https://maps.google.com/?cid=0x0:0x121a3a696a2b6771,
restaurant,Restoran,Shrida Ubud Restaurant By Royal Kamuela Ubud,"Jl. Bisma, Ubud, Kecamatan Ubud, Kabupaten Gianyar, Bali 80571","Ubud, Kecamatan Ubud, Kabupaten Gianyar",BALI,80571.0,Indonesia,85175469700.0,,,-8.5161632,115.2580637,https://maps.google.com/?cid=0x0:0xda1fcc9d672d7df9,
restaurant,China,Omiiku Ubud (Hongalia),"Jl. Raya Mas No.165, Mas, Kecamatan Ubud, Kabupaten Gianyar, Bali 80571","Mas, Kecamatan Ubud, Kabupaten Gianyar",BALI,80571.0,Indonesia,81139608822.0,,,-8.5361572,115.272576,https://maps.google.com/?cid=0x0:0xf3ca5786a89991f6,
restaurant,Indonesia,Warung tradisi ubud,"Jl. Goutama No.20, Ubud, Kecamatan Ubud, Kabupaten Gianyar, Bali 80571","Ubud, Kecamatan Ubud, Kabupaten Gianyar",BALI,80571.0,Indonesia,81236496831.0,,,-8.5097481,115.2638474,https://maps.google.com/?cid=0x0:0xcea46514445bea43,
restaurant,Restoran,Nusa By/Suka - Ubud,"Jl. Raya Ubud, Ubud, Kecamatan Ubud, Kabupaten Gianyar, Bali 80571","Ubud, Kecamatan Ubud, Kabupaten Gianyar",BALI,80571.0,Indonesia,82266610099.0,,,-8.5062639,115.260924,https://maps.google.com/?cid=0x0:0x3f7689b8a3a80f7a,
cafe,Klub Sepak Bola,Bali United Cafe,"Jl. Tribun Tenggara, Buruan, Kec. Blahbatuh, Kabupaten Gianyar, Bali 80581","Buruan, Kec. Blahbatuh, Kabupaten Gianyar",BALI,80581.0,Indonesia,88801888888.0,,,-8.5474549,115.3059314,https://maps.google.com/?cid=0x0:0xd52ce9c7f95c3f85,
cafe,Rumah wisata,Yeh Pulu Cafe,"F7CV+45G Br. Batulumbang, Jl. Yeh Pulu, Bedulu, Kec. Blahbatuh, Kabupaten Gianyar, Bali 80581","Jl. Yeh Pulu, Bedulu, Kec. Blahbatuh, Kabupaten Gianyar",BALI,80581.0,Indonesia,87761257848.0,,,-8.5296983,115.2929774,https://maps.google.com/?cid=0x0:0x5afd61c7650ebf1b,
cafe,Rumah Makan,Warung Uma Batuh,"Blahbatuh, Kec. Blahbatuh, Kabupaten Gianyar, Bali 80581","Kec. Blahbatuh, Kabupaten Gianyar",BALI,80581.0,Indonesia,8123972373.0,,,-8.5697248,115.3045475,https://maps.google.com/?cid=0x0:0xee69351efc3d82e6,
cafe,Restoran,Warung Yeh Batu,"Jl. Raya Blangsinga, Saba, Kec. Blahbatuh, Kabupaten Gianyar, Bali 80581","Saba, Kec. Blahbatuh, Kabupaten Gianyar",BALI,80581.0,Indonesia,,,,-8.575368,115.2905736,https://maps.google.com/?cid=0x0:0x222721cb450e121b,
cafe,Kafe,High5 Cafetaria,"Jl. Raya Semebaung No.2, Bedulu, Kec. Blahbatuh, Kabupaten Gianyar, Bali 80581","Bedulu, Kec. Blahbatuh, Kabupaten Gianyar",BALI,80581.0,Indonesia,81805504666.0,,,-8.5344284,115.3048676,https://maps.google.com/?cid=0x0:0x27ab1519f69f4f4e,
cafe,Makanan Kecil,Warung Tunyaw,"Jl. Pantai Saba, Saba, Kec. Blahbatuh, Kabupaten Gianyar, Bali 80581","Saba, Kec. Blahbatuh, Kabupaten Gianyar",BALI,80581.0,Indonesia,89652113982.0,,,-8.5818687,115.2907759,https://maps.google.com/?cid=0x0:0xf063ecb93f2455a8,
cafe,Restoran,Warung Iluh,"C874+4J3, Pering, Kec. Blahbatuh, Kabupaten Gianyar, Bali 80581","Pering, Kec. Blahbatuh, Kabupaten Gianyar",BALI,80581.0,Indonesia,,,,-8.5872446,115.3065346,https://maps.google.com/?cid=0x0:0xf89a6fc9d1fd7109,
cafe,cafe,,,,BALI,,Indonesia,,,,,,https://maps.google.com/?cid=0x0:0x222721cb450e121bu0026onu0026midu003d/g/11q84n6skm,
cafe,cafe,,,,BALI,,Indonesia,,,,,,https://maps.google.com/?cid=0x0:0x222721cb450e121bu0026onu003dPizzau0026midu003d/g/11q84n6skm,
cafe,cafe,Bali 80511,"Kec. Gianyar, Kabupaten Gianyar, Bali","Kabupaten Gianyar, Bali",BALI,,Indonesia,,,,-8.5386152,115.328206,https://maps.google.com/?cid=0x0:0x3a6ab5e6526148c8,
cafe,Restoran,Lukisan Coffee,"Jl. Kesatrian, Abianbase, Kec. Gianyar, Kabupaten Gianyar, Bali 80511","Abianbase, Kec. Gianyar, Kabupaten Gianyar",BALI,80511.0,Indonesia,8174777788.0,,,-8.5483094,115.3257706,https://maps.google.com/?cid=0x0:0xf41cf82a0a51bd54,
cafe,Kedai Kopi,Ejji Coffee Dharmagiri Gianyar District 24,"Jl. Dharma Giri No.18c, Gianyar, Kec. Gianyar, Kabupaten Gianyar, Bali 80511","Gianyar, Kec. Gianyar, Kabupaten Gianyar",BALI,80511.0,Indonesia,81337313650.0,,,-8.5409317,115.3195822,https://maps.google.com/?cid=0x0:0x1195cdf6996fd4d8,
cafe,Restoran,Ning's Coffee  Eatery,"Sumampan, Jl. Ir. Sutami, Kemenuh, Kec. Sukawati, Kabupaten Gianyar, Bali","Kabupaten Gianyar, Bali",BALI,,Indonesia,83115183927.0,,,-8.5551594,115.2858907,https://maps.google.com/?cid=0x0:0x69ae74010627206c,
cafe,Kedai Kopi,Rumalogy Coffee  Kitchen,"Jl. Sinta Jl. Raya Tugu Pahlawan No.mor 52, Bitera, Kec. Gianyar, Kabupaten Gianyar, Bali 80581","Bitera, Kec. Gianyar, Kabupaten Gianyar",BALI,80581.0,Indonesia,81239528912.0,,,-8.5477611,115.3173305,https://maps.google.com/?cid=0x0:0xa7f6a0df8c2fd119,
cafe,Rumah Makan,GRAHA WANGI,"Jl. Rambutan, Gianyar, Kec. Gianyar, Kabupaten Gianyar, Bali 80511","Gianyar, Kec. Gianyar, Kabupaten Gianyar",BALI,80511.0,Indonesia,,,,-8.5393893,115.327396,https://maps.google.com/?cid=0x0:0xa83c8e43f26435be,
cafe,Restoran,Warmmeet Gianyar,"Jl. Ciung Wanara-Gianyar No.88, Gianyar, Kec. Gianyar, Kabupaten Gianyar, Bali 80361","Gianyar, Kec. Gianyar, Kabupaten Gianyar",BALI,80361.0,Indonesia,,,,-8.5386393,115.3228113,https://maps.google.com/?cid=0x0:0x42587583efa033ee,
cafe,Kedai Kopi,Hanzho Coffee,"Jl. Raya Semebaung, Bedulu, Kec. Blahbatuh, Kabupaten Gianyar, Bali 80581","Bedulu, Kec. Blahbatuh, Kabupaten Gianyar",BALI,80581.0,Indonesia,85792310224.0,,,-8.5346938,115.3070487,https://maps.google.com/?cid=0x0:0x5ac72792fc4411d,
cafe,Kedai Kopi,Yooji Cafe,"Jl. Dharma Giri, Bitera, Kec. Gianyar, Kabupaten Gianyar, Bali 80511","Bitera, Kec. Gianyar, Kabupaten Gianyar",BALI,80511.0,Indonesia,81337157843.0,,,-8.5429621,115.3143684,https://maps.google.com/?cid=0x0:0x9f0f35da567b4be,
cafe,Kedai Kopi,Kukamu Eatery Cafe,"Jl. Dharma Giri No.88, Gianyar, Kec. Gianyar, Kabupaten Gianyar, Bali 80511","Gianyar, Kec. Gianyar, Kabupaten Gianyar",BALI,80511.0,Indonesia,87735903910.0,,,-8.5409821,115.3200439,https://maps.google.com/?cid=0x0:0x2a296276206124e,
cafe,Kedai Kopi,Kopi Tepuk,"Jl. Kenumang No.18, Gianyar, Kec. Gianyar, Kabupaten Gianyar, Bali 80511","Gianyar, Kec. Gianyar, Kabupaten Gianyar",BALI,80511.0,Indonesia,85100915169.0,,,-8.5424643,115.3205519,https://maps.google.com/?cid=0x0:0x780ce440dee9019e,
cafe,Kedai Kopi,Vunja Coffee,"Jl. Raya Petemon No.Br, Pejeng Kelod, Kec. Tampaksiring, Kabupaten Gianyar, Bali 80552","Pejeng Kelod, Kec. Tampaksiring, Kabupaten Gianyar",BALI,80552.0,Indonesia,82247981420.0,,,-8.5174597,115.3039756,https://maps.google.com/?cid=0x0:0x543481fba253da57,
cafe,Restoran,WDG - Warung Dajan Gereja Gianyar,"F87F+WWV, Jl. Burung Gereja, Beng, Kec. Gianyar, Kabupaten Gianyar, Bali 80513","Jl. Burung Gereja, Beng, Kec. Gianyar, Kabupaten Gianyar",BALI,80513.0,Indonesia,81934390407.0,,,-8.5351414,115.3248018,https://maps.google.com/?cid=0x0:0x7e21a7c44ec991e2,
cafe,Kafe,Genius Caf Gianyar,"Jl. Pantai Masceti, Medahan, Kec. Blahbatuh, Kabupaten Gianyar, Bali 80581","Medahan, Kec. Blahbatuh, Kabupaten Gianyar",BALI,80581.0,Indonesia,82236944873.0,,,-8.5762993,115.3381626,https://maps.google.com/?cid=0x0:0x23425b61f0a6922,
cafe,Kedai Kopi,Laris Manis Kopi,"Jl. Manik No.3, Gianyar, Kec. Gianyar, Kabupaten Gianyar, Bali 80511","Gianyar, Kec. Gianyar, Kabupaten Gianyar",BALI,80511.0,Indonesia,,,,-8.5399128,115.3234313,https://maps.google.com/?cid=0x0:0x699e4b6ffa3ced27,
cafe,Kafe,Labrasa Kopi,"Jl. Jaya Negara Gg. X No.8, Gianyar, Kec. Gianyar, Kabupaten Gianyar, Bali 80511","Gianyar, Kec. Gianyar, Kabupaten Gianyar",BALI,80511.0,Indonesia,,,,-8.5451609,115.3234473,https://maps.google.com/?cid=0x0:0x3d011329c7b12ed,
cafe,Kedai Kopi,OTG Coffee Shop Gianyar,"Jl. Dharma Giri No.1A, Gianyar, Kec. Gianyar, Kabupaten Gianyar, Bali 80511","Gianyar, Kec. Gianyar, Kabupaten Gianyar",BALI,80511.0,Indonesia,81338379776.0,,,-8.5410067,115.3220318,https://maps.google.com/?cid=0x0:0xa3478f54cbb3a830,
cafe,Restoran,Kober Mie Bali - Gianyar,"Jl. Dharma Giri No.27, Gianyar, Kec. Gianyar, Kabupaten Gianyar, Bali 80511","Gianyar, Kec. Gianyar, Kabupaten Gianyar",BALI,80511.0,Indonesia,81236017942.0,,,-8.5406943,115.3179811,https://maps.google.com/?cid=0x0:0x6b1d51ea515b6c73,
cafe,Restoran,Living Life Coffee Eatery,"Jl. Ir. Sutami, Kemenuh, Kec. Sukawati, Kabupaten Gianyar, Bali 80582","Kemenuh, Kec. Sukawati, Kabupaten Gianyar",BALI,80582.0,Indonesia,82311917509.0,,,-8.5477866,115.2815372,https://maps.google.com/?cid=0x0:0xbfb3e07b3c288248,
cafe,Kedai Kopi,Sore coffee  Eatery,"97V2+V6J Tegal Temu Space, Jl. Pura Dalem Tegal Tamu, Tegaltamu, Batubulan, Kec. Sukawati, Kabupaten Gianyar, Bali 80582","Jl. Pura Dalem Tegal Tamu, Tegaltamu, Batubulan, Kec. Sukawati, Kabupaten Gianyar",BALI,80582.0,Indonesia,85792120163.0,,,-8.6055919,115.2505208,https://maps.google.com/?cid=0x0:0xa52d6fcd849cae60,
cafe,Kedai Kopi,satusatu kopi,"Jl. Triwanasa kawan, Bakbakan, Kec. Gianyar, Kabupaten Gianyar, Bali 80515","Bakbakan, Kec. Gianyar, Kabupaten Gianyar",BALI,80515.0,Indonesia,,,,-8.5044932,115.3210595,https://maps.google.com/?cid=0x0:0x68bc5d8ff85b014e,
cafe,Kedai Kopi,Harsa coffee,"Jl. Raya Getas Buruan No.260, Buruan, Kec. Blahbatuh, Kabupaten Gianyar, Bali 80511","Buruan, Kec. Blahbatuh, Kabupaten Gianyar",BALI,80511.0,Indonesia,81391537132.0,,,-8.5514791,115.3030875,https://maps.google.com/?cid=0x0:0x55ae41315e86e93c,
cafe,cafe,Kedai Kopi Siap,"Side of RS Sanjiwani, Gianyar, Kec. Gianyar, Kabupaten Gianyar, Bali","Kabupaten Gianyar, Bali",BALI,,Indonesia,81330932059.0,,,-8.5373253,115.3219742,https://maps.google.com/?cid=0x0:0x277bd1f772145b5,
cafe,cafe,Bali 80512,"Samplangan, Kec. Gianyar, Kabupaten Gianyar, Bali","Kabupaten Gianyar, Bali",BALI,,Indonesia,,,,-8.532747,115.3400575,https://maps.google.com/?cid=0x0:0x1c00c5eb6016be70,
cafe,Kafe,Genius Caf Gianyar,"Jl. Pantai Masceti, Medahan, Kec. Blahbatuh, Kabupaten Gianyar, Bali 80581","Medahan, Kec. Blahbatuh, Kabupaten Gianyar",BALI,80581.0,Indonesia,82236944873.0,,,-8.5762993,115.3381626,https://maps.google.com/?cid=0x0:0x23425b61f0a6922,
cafe,Restoran,Lukisan Coffee,"Jl. Kesatrian, Abianbase, Kec. Gianyar, Kabupaten Gianyar, Bali 80511","Abianbase, Kec. Gianyar, Kabupaten Gianyar",BALI,80511.0,Indonesia,8174777788.0,,,-8.5483094,115.3257706,https://maps.google.com/?cid=0x0:0xf41cf82a0a51bd54,
cafe,Restoran,",","Jl. Astina Timur No.10x, Samplangan, Kec. Gianyar, Kabupaten Gianyar, Bali 80512","Samplangan, Kec. Gianyar, Kabupaten Gianyar",BALI,80512.0,Indonesia,8123634917.0,,,-8.5395369,115.3398902,https://maps.google.com/?cid=0x0:0x86955c401df3b8e3,
cafe,Restoran,Warmmeet Gianyar,"Jl. Ciung Wanara-Gianyar No.88, Gianyar, Kec. Gianyar, Kabupaten Gianyar, Bali 80361","Gianyar, Kec. Gianyar, Kabupaten Gianyar",BALI,80361.0,Indonesia,,,,-8.5386393,115.3228113,https://maps.google.com/?cid=0x0:0x42587583efa033ee,
cafe,Restoran,Tefa Cafe Green,"Jalan Gunung Lempuyang , Selat, Samplangan, Kec. Gianyar, Bali 80512","Selat, Samplangan, Kec. Gianyar",BALI,80512.0,Indonesia,,,,-8.5335421,115.3352492,https://maps.google.com/?cid=0x0:0x84903d9bd8fc21b0,
cafe,Bubur,BUBUR BALI,"Jl. Bukit Buluh, Beng, Kec. Gianyar, Kabupaten Gianyar, Bali 80513","Beng, Kec. Gianyar, Kabupaten Gianyar",BALI,80513.0,Indonesia,81236151515.0,,,-8.5291858,115.325312,https://maps.google.com/?cid=0x0:0x31ced7008bd8632a,
cafe,Rumah Makan,Warong Legong,"Jalan Professor Doktor Ida Bagus Mantra No. 300A Keramas, Medahan, Kec. Blahbatuh, Kabupaten Gianyar, Bali","Kabupaten Gianyar, Bali",BALI,,Indonesia,82145011601.0,,,-8.5946372,115.3358249,https://maps.google.com/?cid=0x0:0x8ef8fcf999c8f3b8,
cafe,Rumah Makan,GRAHA WANGI,"Jl. Rambutan, Gianyar, Kec. Gianyar, Kabupaten Gianyar, Bali 80511","Gianyar, Kec. Gianyar, Kabupaten Gianyar",BALI,80511.0,Indonesia,,,,-8.5393893,115.327396,https://maps.google.com/?cid=0x0:0xa83c8e43f26435be,
cafe,Kedai Kopi,Laris Manis Kopi,"Jl. Manik No.3, Gianyar, Kec. Gianyar, Kabupaten Gianyar, Bali 80511","Gianyar, Kec. Gianyar, Kabupaten Gianyar",BALI,80511.0,Indonesia,,,,-8.5399128,115.3234313,https://maps.google.com/?cid=0x0:0x699e4b6ffa3ced27,
cafe,Kedai Kopi,OTG Coffee Shop Gianyar,"Jl. Dharma Giri No.1A, Gianyar, Kec. Gianyar, Kabupaten Gianyar, Bali 80511","Gianyar, Kec. Gianyar, Kabupaten Gianyar",BALI,80511.0,Indonesia,81338379776.0,,,-8.5410067,115.3220318,https://maps.google.com/?cid=0x0:0xa3478f54cbb3a830,
cafe,Kafe,Huma Cafe by Goldmine,"Jalan Cinta, Tegallalang, Kec. Tegallalang, Kabupaten Gianyar, Bali 80561","Tegallalang, Kec. Tegallalang, Kabupaten Gianyar",BALI,80561.0,Indonesia,82144363996.0,,,-8.4610161,115.2721347,https://maps.google.com/?cid=0x0:0xadf2e8a4e24cbd5c,
cafe,Kedai Kopi,cafe gianyar,"F848+J4C, Unnamed Road, Bitera, Kec. Gianyar, Kabupaten Gianyar, Bali 80515","Unnamed Road, Bitera, Kec. Gianyar, Kabupaten Gianyar",BALI,80515.0,Indonesia,,,,-8.5434277,115.3152805,https://maps.google.com/?cid=0x0:0x3070b76166e63fc6,
cafe,Brunch,KISSIDAN CAFE  RESTO,"Jl. Raya Sidan, Sidan, Kec. Gianyar, Kabupaten Gianyar, Bali 80515","Sidan, Kec. Gianyar, Kabupaten Gianyar",BALI,80515.0,Indonesia,87732185292.0,,,-8.5346392,115.347504,https://maps.google.com/?cid=0x0:0xbc34d344292148a2,
cafe,cafe,Kedai Kopi Siap,"Side of RS Sanjiwani, Gianyar, Kec. Gianyar, Kabupaten Gianyar, Bali","Kabupaten Gianyar, Bali",BALI,,Indonesia,81330932059.0,,,-8.5373253,115.3219742,https://maps.google.com/?cid=0x0:0x277bd1f772145b5,
cafe,Restoran,WDG - Warung Dajan Gereja Gianyar,"F87F+WWV, Jl. Burung Gereja, Beng, Kec. Gianyar, Kabupaten Gianyar, Bali 80513","Jl. Burung Gereja, Beng, Kec. Gianyar, Kabupaten Gianyar",BALI,80513.0,Indonesia,81934390407.0,,,-8.5351414,115.3248018,https://maps.google.com/?cid=0x0:0x7e21a7c44ec991e2,
cafe,Kafe,Caffe Happy,"Beng, Kec. Gianyar, Kabupaten Gianyar, Bali 80512","Kec. Gianyar, Kabupaten Gianyar",BALI,80512.0,Indonesia,81803192808.0,,,-8.5358361,115.3325369,https://maps.google.com/?cid=0x0:0xbe8ab38d63c97a40,
cafe,Bali,Warung Babi Guling Pande Egi,"Banjar Pande, Beng, Kec. Gianyar, Kabupaten Gianyar, Bali 80513","Beng, Kec. Gianyar, Kabupaten Gianyar",BALI,80513.0,Indonesia,87883328808.0,,,-8.526876,115.3248255,https://maps.google.com/?cid=0x0:0x9469d9bb05940a59,
cafe,Restoran,GUGELL FOOD  DRINK,"Jl. Astina Timur No.38, Samplangan, Kec. Gianyar, Kabupaten Gianyar, Bali 80512","Samplangan, Kec. Gianyar, Kabupaten Gianyar",BALI,80512.0,Indonesia,85738589429.0,,,-8.5394413,115.3409016,https://maps.google.com/?cid=0x0:0x42dfc4b7ef0a03c7,
cafe,Kedai Kopi,Vunja Coffee,"Jl. Raya Petemon No.Br, Pejeng Kelod, Kec. Tampaksiring, Kabupaten Gianyar, Bali 80552","Pejeng Kelod, Kec. Tampaksiring, Kabupaten Gianyar",BALI,80552.0,Indonesia,82247981420.0,,,-8.5174597,115.3039756,https://maps.google.com/?cid=0x0:0x543481fba253da57,
cafe,Kafe,High5 Cafetaria,"Jl. Raya Semebaung No.2, Bedulu, Kec. Blahbatuh, Kabupaten Gianyar, Bali 80581","Bedulu, Kec. Blahbatuh, Kabupaten Gianyar",BALI,80581.0,Indonesia,81805504666.0,,,-8.5344284,115.3048676,https://maps.google.com/?cid=0x0:0x27ab1519f69f4f4e,
cafe,Restoran,Simpel Kopi,"Jl. Ir. Sutami, Kemenuh, Kec. Sukawati, Kabupaten Gianyar, Bali","Kabupaten Gianyar, Bali",BALI,,Indonesia,87761543732.0,,,-8.553818,115.2852444,https://maps.google.com/?cid=0x0:0xf71f7cdda0f92991,
cafe,Restoran,StarPizza Gianyar,"Jl. Kebo Iwa No.27, Gianyar, Kec. Gianyar, Kabupaten Gianyar, Bali 80512","Gianyar, Kec. Gianyar, Kabupaten Gianyar",BALI,80512.0,Indonesia,81818276655.0,,,-8.5457904,115.3226637,https://maps.google.com/?cid=0x0:0xb33a19f76290819e,
cafe,Kedai Kopi,TOMORO COFFEE - Gianyar,"F859+J3C, Jl. Lingkungan, Candi Baru, Kec. Gianyar, Kabupaten Gianyar, Bali 80515","Jl. Lingkungan, Candi Baru, Kec. Gianyar, Kabupaten Gianyar",BALI,80515.0,Indonesia,,,,-8.54093,115.3176454,https://maps.google.com/?cid=0x0:0x2179f15036da6f70,
cafe,Kedai Kopi,Grand Sweet Coffee,"Jl. Ratna II No.07, Tegal Tugu, Kec. Gianyar, Kabupaten Gianyar, Bali 80515","Tegal Tugu, Kec. Gianyar, Kabupaten Gianyar",BALI,80515.0,Indonesia,82219726698.0,,,-8.5471724,115.3339087,https://maps.google.com/?cid=0x0:0x5d083fb6904a00fd,
cafe,Kedai Kopi,Yooji Cafe,"Jl. Dharma Giri, Bitera, Kec. Gianyar, Kabupaten Gianyar, Bali 80511","Bitera, Kec. Gianyar, Kabupaten Gianyar",BALI,80511.0,Indonesia,81337157843.0,,,-8.5429621,115.3143684,https://maps.google.com/?cid=0x0:0x9f0f35da567b4be,
cafe,Kedai Kopi,Sore coffee  Eatery,"97V2+V6J Tegal Temu Space, Jl. Pura Dalem Tegal Tamu, Tegaltamu, Batubulan, Kec. Sukawati, Kabupaten Gianyar, Bali 80582","Jl. Pura Dalem Tegal Tamu, Tegaltamu, Batubulan, Kec. Sukawati, Kabupaten Gianyar",BALI,80582.0,Indonesia,85792120163.0,,,-8.6055919,115.2505208,https://maps.google.com/?cid=0x0:0xa52d6fcd849cae60,
cafe,Kedai Kopi,Hanzho Coffee,"Jl. Raya Semebaung, Bedulu, Kec. Blahbatuh, Kabupaten Gianyar, Bali 80581","Bedulu, Kec. Blahbatuh, Kabupaten Gianyar",BALI,80581.0,Indonesia,85792310224.0,,,-8.5346938,115.3070487,https://maps.google.com/?cid=0x0:0x5ac72792fc4411d,
cafe,cafe,Bali 80513,"Kec. Gianyar, Kabupaten Gianyar, Bali","Kabupaten Gianyar, Bali",BALI,,Indonesia,,,,-8.5273675,115.3267245,https://maps.google.com/?cid=0x0:0x726f6b72398c7c97,
cafe,Kedai Kopi,Ejji Coffee Dharmagiri Gianyar District 24,"Jl. Dharma Giri No.18c, Gianyar, Kec. Gianyar, Kabupaten Gianyar, Bali 80511","Gianyar, Kec. Gianyar, Kabupaten Gianyar",BALI,80511.0,Indonesia,81337313650.0,,,-8.5409317,115.3195822,https://maps.google.com/?cid=0x0:0x1195cdf6996fd4d8,
cafe,Kafe,Genius Caf Gianyar,"Jl. Pantai Masceti, Medahan, Kec. Blahbatuh, Kabupaten Gianyar, Bali 80581","Medahan, Kec. Blahbatuh, Kabupaten Gianyar",BALI,80581.0,Indonesia,82236944873.0,,,-8.5762993,115.3381626,https://maps.google.com/?cid=0x0:0x23425b61f0a6922,
cafe,Restoran,WDG - Warung Dajan Gereja Gianyar,"F87F+WWV, Jl. Burung Gereja, Beng, Kec. Gianyar, Kabupaten Gianyar, Bali 80513","Jl. Burung Gereja, Beng, Kec. Gianyar, Kabupaten Gianyar",BALI,80513.0,Indonesia,81934390407.0,,,-8.5351414,115.3248018,https://maps.google.com/?cid=0x0:0x7e21a7c44ec991e2,
cafe,Restoran,Warmmeet Gianyar,"Jl. Ciung Wanara-Gianyar No.88, Gianyar, Kec. Gianyar, Kabupaten Gianyar, Bali 80361","Gianyar, Kec. Gianyar, Kabupaten Gianyar",BALI,80361.0,Indonesia,,,,-8.5386393,115.3228113,https://maps.google.com/?cid=0x0:0x42587583efa033ee,
cafe,Kedai Kopi,Weka Coffee  Eatery,"Jl. Sawo, Bitera, Kec. Gianyar, Kabupaten Gianyar, Bali 80511","Bitera, Kec. Gianyar, Kabupaten Gianyar",BALI,80511.0,Indonesia,81353671559.0,,,-8.5193299,115.3208659,https://maps.google.com/?cid=0x0:0x4ba0d476e241e2a1,
cafe,Bubur,BUBUR BALI,"Jl. Bukit Buluh, Beng, Kec. Gianyar, Kabupaten Gianyar, Bali 80513","Beng, Kec. Gianyar, Kabupaten Gianyar",BALI,80513.0,Indonesia,81236151515.0,,,-8.5291858,115.325312,https://maps.google.com/?cid=0x0:0x31ced7008bd8632a,
cafe,Kedai Kopi,Rumalogy Coffee  Kitchen,"Jl. Sinta Jl. Raya Tugu Pahlawan No.mor 52, Bitera, Kec. Gianyar, Kabupaten Gianyar, Bali 80581","Bitera, Kec. Gianyar, Kabupaten Gianyar",BALI,80581.0,Indonesia,81239528912.0,,,-8.5477611,115.3173305,https://maps.google.com/?cid=0x0:0xa7f6a0df8c2fd119,
cafe,Bali,Warung Babi Guling Pande Egi,"Banjar Pande, Beng, Kec. Gianyar, Kabupaten Gianyar, Bali 80513","Beng, Kec. Gianyar, Kabupaten Gianyar",BALI,80513.0,Indonesia,87883328808.0,,,-8.526876,115.3248255,https://maps.google.com/?cid=0x0:0x9469d9bb05940a59,
cafe,Kedai Kopi,Sore coffee  Eatery,"97V2+V6J Tegal Temu Space, Jl. Pura Dalem Tegal Tamu, Tegaltamu, Batubulan, Kec. Sukawati, Kabupaten Gianyar, Bali 80582","Jl. Pura Dalem Tegal Tamu, Tegaltamu, Batubulan, Kec. Sukawati, Kabupaten Gianyar",BALI,80582.0,Indonesia,85792120163.0,,,-8.6055919,115.2505208,https://maps.google.com/?cid=0x0:0xa52d6fcd849cae60,
cafe,Rumah Makan,GRAHA WANGI,"Jl. Rambutan, Gianyar, Kec. Gianyar, Kabupaten Gianyar, Bali 80511","Gianyar, Kec. Gianyar, Kabupaten Gianyar",BALI,80511.0,Indonesia,,,,-8.5393893,115.327396,https://maps.google.com/?cid=0x0:0xa83c8e43f26435be,
cafe,Restoran,Kanto Lampo Warung,"Jl. Kanto Lampo Waterfall, Beng, Kec. Gianyar, Kabupaten Gianyar, Bali 80513","Beng, Kec. Gianyar, Kabupaten Gianyar",BALI,80513.0,Indonesia,85858291601.0,,,-8.5323872,115.3323587,https://maps.google.com/?cid=0x0:0x5fec077703ca751d,
cafe,Kedai Kopi,Raditya Cafe,"Banjar Bangkiangsidem, Desa/ Kel Keliki, Kec. Tegalalang, Kec. Gianyar, Kabupaten Gianyar, Bali 80361","Desa/ Kel Keliki, Kec. Tegalalang, Kec. Gianyar, Kabupaten Gianyar",BALI,80361.0,Indonesia,87860086447.0,,,-8.4886763,115.2582505,https://maps.google.com/?cid=0x0:0x78b12422ff69ee47,
cafe,Kedai Kopi,Kukamu Eatery Cafe,"Jl. Dharma Giri No.88, Gianyar, Kec. Gianyar, Kabupaten Gianyar, Bali 80511","Gianyar, Kec. Gianyar, Kabupaten Gianyar",BALI,80511.0,Indonesia,87735903910.0,,,-8.5409821,115.3200439,https://maps.google.com/?cid=0x0:0x2a296276206124e,
cafe,Restoran,Tefa Cafe Green,"Jalan Gunung Lempuyang , Selat, Samplangan, Kec. Gianyar, Bali 80512","Selat, Samplangan, Kec. Gianyar",BALI,80512.0,Indonesia,,,,-8.5335421,115.3352492,https://maps.google.com/?cid=0x0:0x84903d9bd8fc21b0,
cafe,Kedai Kopi,Vunja Coffee,"Jl. Raya Petemon No.Br, Pejeng Kelod, Kec. Tampaksiring, Kabupaten Gianyar, Bali 80552","Pejeng Kelod, Kec. Tampaksiring, Kabupaten Gianyar",BALI,80552.0,Indonesia,82247981420.0,,,-8.5174597,115.3039756,https://maps.google.com/?cid=0x0:0x543481fba253da57,
cafe,Restoran,Living Life Coffee Eatery,"Jl. Ir. Sutami, Kemenuh, Kec. Sukawati, Kabupaten Gianyar, Bali 80582","Kemenuh, Kec. Sukawati, Kabupaten Gianyar",BALI,80582.0,Indonesia,82311917509.0,,,-8.5477866,115.2815372,https://maps.google.com/?cid=0x0:0xbfb3e07b3c288248,
cafe,Restoran,Simpel Kopi,"Jl. Ir. Sutami, Kemenuh, Kec. Sukawati, Kabupaten Gianyar, Bali","Kabupaten Gianyar, Bali",BALI,,Indonesia,87761543732.0,,,-8.553818,115.2852444,https://maps.google.com/?cid=0x0:0xf71f7cdda0f92991,
cafe,cafe,Kedai Kopi Siap,"Side of RS Sanjiwani, Gianyar, Kec. Gianyar, Kabupaten Gianyar, Bali","Kabupaten Gianyar, Bali",BALI,,Indonesia,81330932059.0,,,-8.5373253,115.3219742,https://maps.google.com/?cid=0x0:0x277bd1f772145b5,
cafe,Restoran,Lukisan Coffee,"Jl. Kesatrian, Abianbase, Kec. Gianyar, Kabupaten Gianyar, Bali 80511","Abianbase, Kec. Gianyar, Kabupaten Gianyar",BALI,80511.0,Indonesia,8174777788.0,,,-8.5483094,115.3257706,https://maps.google.com/?cid=0x0:0xf41cf82a0a51bd54,
cafe,Kafe,"Sweet Bar, Gianyar","Jl. Dharma Giri No.97A, Bitera, Kec. Gianyar, Kabupaten Gianyar, Bali 80515","Bitera, Kec. Gianyar, Kabupaten Gianyar",BALI,80515.0,Indonesia,82322667797.0,,,-8.5416076,115.3143072,https://maps.google.com/?cid=0x0:0xab9366ef19abb59d,
cafe,Restoran,Ning's Coffee  Eatery,"Sumampan, Jl. Ir. Sutami, Kemenuh, Kec. Sukawati, Kabupaten Gianyar, Bali","Kabupaten Gianyar, Bali",BALI,,Indonesia,83115183927.0,,,-8.5551594,115.2858907,https://maps.google.com/?cid=0x0:0x69ae74010627206c,
cafe,Kedai Kopi,Yooji Cafe,"Jl. Dharma Giri, Bitera, Kec. Gianyar, Kabupaten Gianyar, Bali 80511","Bitera, Kec. Gianyar, Kabupaten Gianyar",BALI,80511.0,Indonesia,81337157843.0,,,-8.5429621,115.3143684,https://maps.google.com/?cid=0x0:0x9f0f35da567b4be,
cafe,Kedai Kopi,KASATMATA_bali,"F87J+M66, Jl. Bukit Jati, Gianyar, Kec. Gianyar, Kabupaten Gianyar, Bali 80511","Jl. Bukit Jati, Gianyar, Kec. Gianyar, Kabupaten Gianyar",BALI,80511.0,Indonesia,81529834711.0,,,-8.5358322,115.3305031,https://maps.google.com/?cid=0x0:0x3bbc2c52861b2390,
cafe,cafe,Bali 80515,"Kec. Gianyar, Kabupaten Gianyar, Bali","Kabupaten Gianyar, Bali",BALI,,Indonesia,,,,-8.5169426,115.3133908,https://maps.google.com/?cid=0x0:0x1c00c5eb6016be90,
cafe,Kedai Kopi,TOMORO COFFEE - Gianyar,"F859+J3C, Jl. Lingkungan, Candi Baru, Kec. Gianyar, Kabupaten Gianyar, Bali 80515","Jl. Lingkungan, Candi Baru, Kec. Gianyar, Kabupaten Gianyar",BALI,80515.0,Indonesia,,,,-8.54093,115.3176454,https://maps.google.com/?cid=0x0:0x2179f15036da6f70,
cafe,Restoran,Lukisan Coffee,"Jl. Kesatrian, Abianbase, Kec. Gianyar, Kabupaten Gianyar, Bali 80511","Abianbase, Kec. Gianyar, Kabupaten Gianyar",BALI,80511.0,Indonesia,8174777788.0,,,-8.5483094,115.3257706,https://maps.google.com/?cid=0x0:0xf41cf82a0a51bd54,
cafe,Kedai Kopi,Ejji Coffee Dharmagiri Gianyar District 24,"Jl. Dharma Giri No.18c, Gianyar, Kec. Gianyar, Kabupaten Gianyar, Bali 80511","Gianyar, Kec. Gianyar, Kabupaten Gianyar",BALI,80511.0,Indonesia,81337313650.0,,,-8.5409317,115.3195822,https://maps.google.com/?cid=0x0:0x1195cdf6996fd4d8,
cafe,Kedai Kopi,Hanzho Coffee,"Jl. Raya Semebaung, Bedulu, Kec. Blahbatuh, Kabupaten Gianyar, Bali 80581","Bedulu, Kec. Blahbatuh, Kabupaten Gianyar",BALI,80581.0,Indonesia,85792310224.0,,,-8.5346938,115.3070487,https://maps.google.com/?cid=0x0:0x5ac72792fc4411d,
cafe,Indonesia,NGERODOK RESTO,"Jl. Mulawarman No.132A, Abianbase, Kec. Gianyar, Kabupaten Gianyar, Bali 80515","Abianbase, Kec. Gianyar, Kabupaten Gianyar",BALI,80515.0,Indonesia,81913328626.0,,,-8.5527923,115.3268921,https://maps.google.com/?cid=0x0:0xedc8bb4db6aae0e3,
