Category,Real Category,Business Name,Address,City,State,Postal Code,Country,Phone,Email,Website,Latitude,Longitude,Map Link,Details Link
restaurant,Masakan Asia,Meeting point sukawati,"Jl. Lettu Nengah Duaji No.4, Sukawati, Kec. Sukawati, Kabupaten Gianyar, Bali 80582","Sukawati, Kec. Sukawati, Kabupaten Gianyar",BALI,80582.0,Indonesia,81239617846.0,,,-8.593871,115.2815073,https://maps.google.com/?cid=0x0:0x8910342660a1dc71,
restaurant,Bali,Kalamansi Bali,"Jl. Raya Batubulan No.99, Batubulan, Kec. Sukawati, Kabupaten Gianyar, Bali 80237","Batubulan, Kec. Sukawati, Kabupaten Gianyar",BALI,80237.0,Indonesia,3618402013.0,,,-8.6150456,115.2536782,https://maps.google.com/?cid=0x0:0x1a5b3e76d09dca4e,
restaurant,Restoran,Central Food Village,"C758+X66, Jl. Raya Singapadu, Singapadu, Kec. Sukawati, Kabupaten Gianyar, Bali 80582","Jl. Raya Singapadu, Singapadu, Kec. Sukawati, Kabupaten Gianyar",BALI,80582.0,Indonesia,61294357.0,,,-8.5900283,115.2653969,https://maps.google.com/?cid=0x0:0xbb45ed1eb5d95904,
restaurant,Nasi,Agas Bistro,"Jl. Raya Celuk No.35x, Batubulan, Kec. Sukawati, Kabupaten Gianyar, Bali 80582","Batubulan, Kec. Sukawati, Kabupaten Gianyar",BALI,80582.0,Indonesia,85951740088.0,,,-8.604315,115.2547269,https://maps.google.com/?cid=0x0:0x91e0bb198357a59a,
restaurant,Nasi Uduk,Bumbu Asli International Warung,"Jl. Ir. Sutami, Tempat Wisata Air Terjun Tegenungan, Kemenuh, Kec. Sukawati, Kabupaten Gianyar, Bali 80581","Tempat Wisata Air Terjun Tegenungan, Kemenuh, Kec. Sukawati, Kabupaten Gianyar",BALI,80581.0,Indonesia,85738973391.0,,,-8.5762081,115.2890334,https://maps.google.com/?cid=0x0:0x60dddc531ffa2253,
restaurant,Restoran,Warung Tepi Tebing,"Jl. Raya Singapadu, Singapadu Kaler, Kec. Sukawati, Kabupaten Gianyar, Bali 80571","Singapadu Kaler, Kec. Sukawati, Kabupaten Gianyar",BALI,80571.0,Indonesia,3618988178.0,,,-8.5671351,115.255007,https://maps.google.com/?cid=0x0:0x98d1d9d86ea7f660,
restaurant,Kedai Kopi,Tlaga Singha,"Jl. Raya Singapadu, Singapadu, Kec. Sukawati, Kabupaten Gianyar, Bali 80582","Singapadu, Kec. Sukawati, Kabupaten Gianyar",BALI,80582.0,Indonesia,82260070072.0,,,-8.591638,115.2677,https://maps.google.com/?cid=0x0:0x85775d4103757d72,
restaurant,Bali,Bebek Uma Menuh Restaurant,"Jl. Ir. Sutami, Kemenuh, Kec. Sukawati, Kabupaten Gianyar, Bali 80582","Kemenuh, Kec. Sukawati, Kabupaten Gianyar",BALI,80582.0,Indonesia,85142915029.0,,,-8.5706866,115.2865136,https://maps.google.com/?cid=0x0:0x7f5912a86bf5adf3,
restaurant,Nasi,Jero Kajanan,"Jl. Lettu Wayan Sutha II, Batuan, Kec. Sukawati, Kabupaten Gianyar, Bali 80582","Batuan, Kec. Sukawati, Kabupaten Gianyar",BALI,80582.0,Indonesia,88987084555.0,,,-8.5828399,115.2785181,https://maps.google.com/?cid=0x0:0xe8e3b4affa5c94e3,
restaurant,Klub pantai,Standing Stone Restaurant,"Jl. Pantai Purnama, Sukawati, Kec. Sukawati, Kabupaten Gianyar, Bali","Kabupaten Gianyar, Bali",BALI,,Indonesia,87800132000.0,,,-8.6193375,115.3087412,https://maps.google.com/?cid=0x0:0x3da981af9f755ce4,
restaurant,Bali,Warung koboi Sukawati,"C76Q+W2M, Jl. Ir. Sutami, Kemenuh, Kec. Sukawati, Kabupaten Gianyar, Bali","Kabupaten Gianyar, Bali",BALI,,Indonesia,87863460236.0,,,-8.5876536,115.2875488,https://maps.google.com/?cid=0x0:0xf2c1588a0b7dc789,
restaurant,Pusat Perbelanjaan,Gaharu Garden Restaurant,"C7RP+MPQ, Kemenuh, Kec. Sukawati, Kabupaten Gianyar, Bali 80582","Kemenuh, Kec. Sukawati, Kabupaten Gianyar",BALI,80582.0,Indonesia,82145200180.0,,,-8.5582973,115.2868666,https://maps.google.com/?cid=0x0:0x142344f49b5202d0,
restaurant,Sate,VANABI Warung Sate Bali,"Singapadu Kaler, Kec. Sukawati, Kabupaten Gianyar, Bali 80582","Kec. Sukawati, Kabupaten Gianyar",BALI,80582.0,Indonesia,82146459288.0,,,-8.5481968,115.2466004,https://maps.google.com/?cid=0x0:0x16fdd31695ca4791,
restaurant,Rumah Makan,Warung Lalapan Sukawati,"C74M+94M, Jalan Raya, Sukawati, Gianyar Regency, Bali 80582","Jalan Raya, Sukawati, Gianyar Regency",BALI,80582.0,Indonesia,87862065396.0,,,-8.5940475,115.2828102,https://maps.google.com/?cid=0x0:0x9bb95db9213fcee5,
restaurant,Kafe seni,Juice Time Batubulan,"Jl. Raya Batubulan, Batubulan, Kec. Sukawati, Kabupaten Gianyar, Bali 80582","Batubulan, Kec. Sukawati, Kabupaten Gianyar",BALI,80582.0,Indonesia,81246194974.0,,,-8.6249912,115.2573679,https://maps.google.com/?cid=0x0:0xe879f2af1a1e3fc1,
restaurant,Sesuai untuk keluarga,Sumampan Restaurant,"Jl. Subak Gunungsari, Banjar Sumampan, Kemenuh, Kec. Sukawati, Kabupaten Gianyar, Bali 80582","Banjar Sumampan, Kemenuh, Kec. Sukawati, Kabupaten Gianyar",BALI,80582.0,Indonesia,81238585870.0,,,-8.5452974,115.2857429,https://maps.google.com/?cid=0x0:0xd7474552572d2da5,
restaurant,Restoran,Warung lawar Arsana Sukawati,"Sukawati, Kec. Sukawati, Kabupaten Gianyar, Bali","Kabupaten Gianyar, Bali",BALI,,Indonesia,,,,-8.6033914,115.2980177,https://maps.google.com/?cid=0x0:0x78f2876d7072bae2,
restaurant,Sarapan,Nasi Tahu Ni Sarti Sukawati,"C73J+X6R, Br. Gelulung Sukawati, Gianyar, Sukawati, Kec. Sukawati, Kabupaten Gianyar, Bali 80582","Br. Gelulung Sukawati, Gianyar, Sukawati, Kec. Sukawati, Kabupaten Gianyar",BALI,80582.0,Indonesia,,,,-8.595011,115.280509,https://maps.google.com/?cid=0x0:0x107606378368c031,
restaurant,Masakan Asia,Warung 2M,"Br. Sengguan, Jl. Raya Singapadu, Singapadu, Kec. Sukawati, Kabupaten Gianyar, Bali 80582","Jl. Raya Singapadu, Singapadu, Kec. Sukawati, Kabupaten Gianyar",BALI,80582.0,Indonesia,81999989979.0,,,-8.5976699,115.2532287,https://maps.google.com/?cid=0x0:0xf1049ab122d194f0,
restaurant,Masakan Asia,The Cassowary Restaurant,"Jalan Ulun Suwi II, Singapadu, Singapadu, Kec. Sukawati, Kabupaten Gianyar, Bali 80582","Singapadu, Singapadu, Kec. Sukawati, Kabupaten Gianyar",BALI,80582.0,Indonesia,3614711222.0,,,-8.5892649,115.2647017,https://maps.google.com/?cid=0x0:0xed8c76adbf3a3a50,
restaurant,Restoran,Depot Ayu Shela,"98H2+X58, Jl. Prof. Dr. Ida Bagus Mantra, Ketewel, Kec. Sukawati, Kabupaten Gianyar, Bali 80582","Jl. Prof. Dr. Ida Bagus Mantra, Ketewel, Kec. Sukawati, Kabupaten Gianyar",BALI,80582.0,Indonesia,85237361276.0,,,-8.6200986,115.3004575,https://maps.google.com/?cid=0x0:0xa908804703e206af,
restaurant,restaurant,Tampaksiring,"Kec. Tampaksiring, Kabupaten Gianyar, Bali","Kabupaten Gianyar, Bali",BALI,,Indonesia,,,,-8.4390082,115.3104277,https://maps.google.com/?cid=0x0:0x1800e8dbac4d3f48,
restaurant,Bali,Pangkon Bali Resto  Agrotourism,"Jl. Tirta Jl. Tampaksiring No..25M, Manukaya, Kec. Tampaksiring, Kabupaten Gianyar, Bali 80552","Manukaya, Kec. Tampaksiring, Kabupaten Gianyar",BALI,80552.0,Indonesia,81239852425.0,,,-8.4176831,115.3174296,https://maps.google.com/?cid=0x0:0x9a85fcc812adb1e1,
restaurant,Restoran,Nukad Tampaksiring,"Jl. Pertiwi Brata, Selat, Kec. Tampaksiring, Kabupaten Gianyar, Bali 80552","Selat, Kec. Tampaksiring, Kabupaten Gianyar",BALI,80552.0,Indonesia,87790652875.0,,,-8.4348068,115.3179094,https://maps.google.com/?cid=0x0:0x7920231f794e8bac,
restaurant,Restoran,Warung Pondok Bali,"Jl. Sentanu No.4, Tampaksiring, Kecamatan Ubud, Kabupaten Gianyar, Bali 80552","Tampaksiring, Kecamatan Ubud, Kabupaten Gianyar",BALI,80552.0,Indonesia,87864412215.0,,,-8.4176484,115.306024,https://maps.google.com/?cid=0x0:0x2840761c659e0351,
restaurant,Restoran,Warung D'Kumba,"Jl. Raya Uma, Tampaksiring, bali, Kabupaten Gianyar, Bali 80552","Tampaksiring, bali, Kabupaten Gianyar",BALI,80552.0,Indonesia,81936240155.0,,,-8.4367732,115.3040584,https://maps.google.com/?cid=0x0:0xaf0e52d020953805,
restaurant,Restoran,Warung Tepi Sari,"Jl. Raya Pejeng Kawan, Pejeng Kawan, Kec. Tampaksiring, Kabupaten Gianyar, Bali 80552","Pejeng Kawan, Kec. Tampaksiring, Kabupaten Gianyar",BALI,80552.0,Indonesia,,,,-8.4903119,115.2823015,https://maps.google.com/?cid=0x0:0xcfabe70605765306,
restaurant,Bali,Warung Sripadi,"Jl. Tirta Empul, Manukaya, Kec. Tampaksiring, Kabupaten Gianyar, Bali 80552","Manukaya, Kec. Tampaksiring, Kabupaten Gianyar",BALI,80552.0,Indonesia,81775087019.0,,,-8.4176015,115.3133824,https://maps.google.com/?cid=0x0:0x8f0b966996df852c,
restaurant,Indonesia,Warung Gula Bali,"Jl. Tirta Empul, Manukaya, Kec. Tampaksiring, Kabupaten Gianyar, Bali 80552","Manukaya, Kec. Tampaksiring, Kabupaten Gianyar",BALI,80552.0,Indonesia,85737687775.0,,,-8.4175282,115.318072,https://maps.google.com/?cid=0x0:0xa8f12d99d8800c29,
restaurant,Restoran,Waroeng Bali Gk,"Jl. Bayu Brata, Tampaksiring, Kec. Tampaksiring, Kabupaten Gianyar, Bali 80552","Tampaksiring, Kec. Tampaksiring, Kabupaten Gianyar",BALI,80552.0,Indonesia,83115915702.0,,,-8.4236005,115.3088334,https://maps.google.com/?cid=0x0:0xe48806296bad5e0f,
restaurant,Restoran,Warung Makan Ulam Carik,"H8C5+92W, Jl. Dr. Ir. Soekarno, Tampaksiring, Kec. Tampaksiring, Kabupaten Gianyar, Bali 80552","Jl. Dr. Ir. Soekarno, Tampaksiring, Kec. Tampaksiring, Kabupaten Gianyar",BALI,80552.0,Indonesia,8123954000.0,,,-8.4290176,115.3075931,https://maps.google.com/?cid=0x0:0xb9c8504f7013759,
restaurant,Ayam Goreng,ACK TAMPAKSIRING,"Jl. Dr. Ir. Soekarno No.103, Tampaksiring, Kec. Tampaksiring, Kabupaten Gianyar, Bali 80552","Tampaksiring, Kec. Tampaksiring, Kabupaten Gianyar",BALI,80552.0,Indonesia,81999191993.0,,,-8.4266876,115.3079483,https://maps.google.com/?cid=0x0:0x461fe5cc8eabfbbf,
restaurant,Jawa,Warung Sambal Locok,"Br. Eha, Tampaksiring, Kec. Tampaksiring, Kabupaten Gianyar, Bali 80552","Tampaksiring, Kec. Tampaksiring, Kabupaten Gianyar",BALI,80552.0,Indonesia,81999113457.0,,,-8.4371766,115.305567,https://maps.google.com/?cid=0x0:0xd76943562594f015,
restaurant,Restoran,Warung Makan Sari Merta,"Tampaksiring, Kec. Tampaksiring, Kabupaten Gianyar, Bali 80552","Kec. Tampaksiring, Kabupaten Gianyar",BALI,80552.0,Indonesia,81999197270.0,,,-8.4268498,115.3079433,https://maps.google.com/?cid=0x0:0xe7b737bde52522a4,
restaurant,Restoran,"Warung Bambu,local food.","Jl. Sentanu, Tampaksiring, Kec. Tampaksiring, Kabupaten Gianyar, Bali 80552","Tampaksiring, Kec. Tampaksiring, Kabupaten Gianyar",BALI,80552.0,Indonesia,81933070404.0,,,-8.4199196,115.306674,https://maps.google.com/?cid=0x0:0x34082b6f9de857e5,
restaurant,Restoran,Warung Joglo,"H8J5+RM8, Jl. Dr. Ir. Soekarno, Tampaksiring, Kec. Tampaksiring, Kabupaten Gianyar, Bali 80552","Jl. Dr. Ir. Soekarno, Tampaksiring, Kec. Tampaksiring, Kabupaten Gianyar",BALI,80552.0,Indonesia,82340604300.0,,,-8.417972,115.3092002,https://maps.google.com/?cid=0x0:0x196171c2689545a8,
restaurant,Indonesia,Collina Kawi Restaurant,"Tampaksiring, Kec. Tampaksiring, Kabupaten Gianyar, Bali 80552","Kec. Tampaksiring, Kabupaten Gianyar",BALI,80552.0,Indonesia,3614793008.0,,,-8.4477478,115.3094798,https://maps.google.com/?cid=0x0:0xe22b005f95078811,
restaurant,Sarapan,Waroeng Pegasus,"Jl. Dr. Ir. Soekarno, Tampaksiring, Kec. Tampaksiring, Kabupaten Gianyar, Bali 80552","Tampaksiring, Kec. Tampaksiring, Kabupaten Gianyar",BALI,80552.0,Indonesia,361902194.0,,,-8.4467181,115.3095181,https://maps.google.com/?cid=0x0:0xcff6c6607fb4b5ac,
restaurant,Restoran,Waroeng De Koi,"Jl. Tirta Empul, Manukaya, Kec. Tampaksiring, Kabupaten Gianyar, Bali 80552","Manukaya, Kec. Tampaksiring, Kabupaten Gianyar",BALI,80552.0,Indonesia,8123870284.0,,,-8.4175826,115.3176032,https://maps.google.com/?cid=0x0:0xbe3252d3ccb862a7,
restaurant,Padang,RM Salero Bagindo,"H8M7+5VX, Manukaya, Kec. Tampaksiring, Kabupaten Gianyar, Bali 80552","Manukaya, Kec. Tampaksiring, Kabupaten Gianyar",BALI,80552.0,Indonesia,82236901697.0,,,-8.4170159,115.3147209,https://maps.google.com/?cid=0x0:0x4c4b993a00e2fa7a,
restaurant,Padang,RUMAH Makan Resturant,"H8P8+37J, Unnamed Road, Manukaya, Tampaksiring, Gianyar Regency, Bali 80552","Unnamed Road, Manukaya, Tampaksiring, Gianyar Regency",BALI,80552.0,Indonesia,,,,-8.4147993,115.3156328,https://maps.google.com/?cid=0x0:0x4593d3be4fe5714e,
restaurant,Ayam,BETUTU KEREN PAK RIZAL(local resto),"Pure songlayung, Tampaksiring, Kec. Tampaksiring, Kabupaten Gianyar, Bali 80552","Tampaksiring, Kec. Tampaksiring, Kabupaten Gianyar",BALI,80552.0,Indonesia,81337846192.0,,,-8.4553187,115.3080855,https://maps.google.com/?cid=0x0:0x86f8629502666f8d,
restaurant,restaurant,Bali 80552,"Kec. Tampaksiring, Kabupaten Gianyar, Bali","Kabupaten Gianyar, Bali",BALI,,Indonesia,,,,-8.4362857,115.3133908,https://maps.google.com/?cid=0x0:0x1c00c5eb6016beb0,
restaurant,Bali,Waroeng Podjok GK,"Jl. Bayu Suta No.73, Tampaksiring, Kec. Tampaksiring, Kabupaten Gianyar, Bali 80552","Tampaksiring, Kec. Tampaksiring, Kabupaten Gianyar",BALI,80552.0,Indonesia,,,,-8.4236108,115.3094952,https://maps.google.com/?cid=0x0:0x9c78a3584f544b31,
restaurant,Masakan Asia,Mango Cafe,"Jl. Raya Laplapan, Pejeng Kawan, Kec. Tampaksiring, Kabupaten Gianyar, Bali 80552","Pejeng Kawan, Kec. Tampaksiring, Kabupaten Gianyar",BALI,80552.0,Indonesia,8157904880.0,,,-8.4930188,115.2813477,https://maps.google.com/?cid=0x0:0x20e85add245ea1cf,
restaurant,Restoran,Ancut Petanu,"Jl. Sentanu, Tampaksiring, Kec. Tampaksiring, Kabupaten Gianyar, Bali 80552","Tampaksiring, Kec. Tampaksiring, Kabupaten Gianyar",BALI,80552.0,Indonesia,83147816734.0,,,-8.4195792,115.3030849,https://maps.google.com/?cid=0x0:0xbf9f5856fd5522a9,
restaurant,restaurant,Bali 80561,"Kec. Tegallalang, Kabupaten Gianyar, Bali","Kabupaten Gianyar, Bali",BALI,,Indonesia,,,,-8.3921715,115.2956118,https://maps.google.com/?cid=0x0:0x1c00c5eb6016bec0,
restaurant,Restoran,"Tebasari Resto, Bar  Lounge","Jl. Raya Tegallalang, Tegallalang, Kec. Tegallalang, Kabupaten Gianyar, Bali 80561","Tegallalang, Kec. Tegallalang, Kabupaten Gianyar",BALI,80561.0,Indonesia,3619085851.0,,,-8.4416165,115.2802618,https://maps.google.com/?cid=0x0:0xde95d6567688bd58,
restaurant,Restoran,d'Alas warung,"Jl. Raya Pujung Kaja, Sebatu, Kec. Tegallalang, Kabupaten Gianyar, Bali 80561","Sebatu, Kec. Tegallalang, Kabupaten Gianyar",BALI,80561.0,Indonesia,361902110.0,,,-8.4223646,115.2789232,https://maps.google.com/?cid=0x0:0x15673a5c8afddf3d,
restaurant,Rumah Makan,Tis Cafe,"Jl. Raya Tegallalang, Tegallalang, Kec. Tegallalang, Kabupaten Gianyar, Bali 80561","Tegallalang, Kec. Tegallalang, Kabupaten Gianyar",BALI,80561.0,Indonesia,81215985899.0,,,-8.4307634,115.2786171,https://maps.google.com/?cid=0x0:0xa0c73a52235a7df8,
restaurant,Restoran,THE KAWI RESTO POOL AND BAR,"Jl. Raya Tegallalang No.5758, Tegallalang, Kec. Tegallalang, Kabupaten Gianyar, Bali 80561","Tegallalang, Kec. Tegallalang, Kabupaten Gianyar",BALI,80561.0,Indonesia,81246585199.0,,,-8.4343451,115.2782958,https://maps.google.com/?cid=0x0:0x88fe45684732b83c,
restaurant,Tujuan Wisata,Uma Ceking Resto and Swing,"Tegallalang, Kec. Tegallalang, Kabupaten Gianyar, Bali 80561","Kec. Tegallalang, Kabupaten Gianyar",BALI,80561.0,Indonesia,83166409336.0,,,-8.4355621,115.2793731,https://maps.google.com/?cid=0x0:0xee28be3c9536d599,
restaurant,Masakan Barat,Cretya Ubud,"Jl. Raya Tegallalang, Tegallalang, Kec. Tegallalang, Kabupaten Gianyar, Bali 80561","Tegallalang, Kec. Tegallalang, Kabupaten Gianyar",BALI,80561.0,Indonesia,3619585999.0,,,-8.439962,115.280982,https://maps.google.com/?cid=0x0:0x9fc75242a6f92fa7,
restaurant,Restoran,Mimpi Manis Restaurant,"Jalan Umakelod, Sebatu, Tegallalang, Gianyar Regency, Bali 80561","Sebatu, Tegallalang, Gianyar Regency",BALI,80561.0,Indonesia,3618983475.0,,,-8.4081731,115.2959263,https://maps.google.com/?cid=0x0:0xb030f1c763403b40,
restaurant,Restoran,KUBUBALI Resto  Jungle Pool Bar,"Jl. Raya Bayad, Kedisan, Kec. Tegallalang, Kabupaten Gianyar, Bali 80561","Kedisan, Kec. Tegallalang, Kabupaten Gianyar",BALI,80561.0,Indonesia,,,,-8.4115906,115.2932982,https://maps.google.com/?cid=0x0:0x498ac30aa63167c8,
restaurant,Restoran,Greenkubu Restaurant and Swing,"Jalan Cinta, Br, Jl. Pejengaji, Tegallalang, Gianyar Regency, Bali 80561","Br, Jl. Pejengaji, Tegallalang, Gianyar Regency",BALI,80561.0,Indonesia,85211054605.0,,,-8.4520774,115.2742628,https://maps.google.com/?cid=0x0:0x7a8c99e9dbdc880f,
restaurant,Restoran,D'Pondok Warung,"Uma kaje, depan Pura EE No.desa, banjar, Sebatu, Tegallalang, Gianyar Regency, Bali 80561","depan Pura EE No.desa, banjar, Sebatu, Tegallalang, Gianyar Regency",BALI,80561.0,Indonesia,81547134989.0,,,-8.3994507,115.2943703,https://maps.google.com/?cid=0x0:0x383566aaa08833cb,
restaurant,Rumah Makan,Carik Terrace Warung,"Tegallalang, Kec. Tegallalang, Kabupaten Gianyar, Bali 80561","Kec. Tegallalang, Kabupaten Gianyar",BALI,80561.0,Indonesia,81338507796.0,,,-8.4301871,115.2786743,https://maps.google.com/?cid=0x0:0x240590d460dbdf4b,
restaurant,Restoran,Cretya Lite,"Jl. Raya Tegallalang, Tegallalang, Kec. Tegallalang, Kabupaten Gianyar, Bali 80561","Tegallalang, Kec. Tegallalang, Kabupaten Gianyar",BALI,80561.0,Indonesia,3619585999.0,,,-8.4403764,115.2806591,https://maps.google.com/?cid=0x0:0xb41f1f0d7ae06606,
restaurant,Restoran,Ceking Sari Restaurant  Coffee Corner,"Jl. Raya Tegallalang, Tegallalang, Kec. Tegallalang, Kabupaten Gianyar, Bali 80561","Tegallalang, Kec. Tegallalang, Kabupaten Gianyar",BALI,80561.0,Indonesia,81239186852.0,,,-8.4413002,115.2803759,https://maps.google.com/?cid=0x0:0xd6248d41988715d3,
restaurant,Restoran,Rice terrace cafe,"Jl. Raya Tegallalang, Tegallalang, Kec. Tegallalang, Kabupaten Gianyar, Bali 80561","Tegallalang, Kec. Tegallalang, Kabupaten Gianyar",BALI,80561.0,Indonesia,81236186003.0,,,-8.4335918,115.2786445,https://maps.google.com/?cid=0x0:0x5c85b37e13034186,
restaurant,restaurant,Jinengbali Agro,"JinengBali Agro, Banjar, Jl. Dlod Blungbang Jl. Raya Desa Kenderan, Kenderan, Tegallalang, Gianyar Regency, Bali 80561","Banjar, Jl. Dlod Blungbang Jl. Raya Desa Kenderan, Kenderan, Tegallalang, Gianyar Regency",BALI,80561.0,Indonesia,87861673837.0,,,-8.4358648,115.2933423,https://maps.google.com/?cid=0x0:0xc1e6ba6429ad6c0,
restaurant,Rumah Makan,Warung D Uma Sari,"H7MW+HRX, Kedisan, Kec. Tegallalang, Kabupaten Gianyar, Bali 80561","Kedisan, Kec. Tegallalang, Kabupaten Gianyar",BALI,80561.0,Indonesia,83119888319.0,,,-8.4160124,115.296943,https://maps.google.com/?cid=0x0:0x854d6656bd08d7a,
restaurant,Kafe,Uma Pakel Agro Tourism  swing,"H75J+C64, Jl. Raya Tegallalang, Tegallalang, Kec. Tegallalang, Kabupaten Gianyar, Bali 80561","Jl. Raya Tegallalang, Tegallalang, Kec. Tegallalang, Kabupaten Gianyar",BALI,80561.0,Indonesia,8123838702.0,,,-8.4417654,115.2805841,https://maps.google.com/?cid=0x0:0x67d944b916cf0de3,
restaurant,Kedai Kopi,"DUKUH SARI Restaurant, Luwak Coffee","Br. Penusuan, Tegallalang, Kec. Tegallalang, Kabupaten Gianyar, Bali 80561","Tegallalang, Kec. Tegallalang, Kabupaten Gianyar",BALI,80561.0,Indonesia,87761741684.0,,,-8.4586992,115.2786737,https://maps.google.com/?cid=0x0:0x8ff07e61af5509b6,
restaurant,Restoran,by Cafe,"Jl. Raya Tegallalang No.57-58, Tegallalang, Kec. Tegallalang, Kabupaten Gianyar, Bali 80561","Tegallalang, Kec. Tegallalang, Kabupaten Gianyar",BALI,80561.0,Indonesia,3619084718.0,,,-8.4322426,115.2783256,https://maps.google.com/?cid=0x0:0xdabe57e073e0a4e1,
restaurant,Restoran,Draniki Ubud,"G76C+33G, Jl. Tirta Tawar, Petulu, Kecamatan Ubud, Kabupaten Gianyar, Bali 80571","Jl. Tirta Tawar, Petulu, Kecamatan Ubud, Kabupaten Gianyar",BALI,80571.0,Indonesia,82340762660.0,,,-8.489655,115.2701112,https://maps.google.com/?cid=0x0:0x2dd78c2dfdc2ae6b,
restaurant,Restoran,Tangelo Bali,"Jl. Raya Bilukan, Sebatu, Kec. Tegallalang, Kabupaten Gianyar, Bali 80561","Sebatu, Kec. Tegallalang, Kabupaten Gianyar",BALI,80561.0,Indonesia,82341805895.0,,,-8.3897293,115.2963637,https://maps.google.com/?cid=0x0:0x338d4153fbfc640e,
restaurant,Restoran,NEUN at Bali Nguni Ubud,"Jl. Raya Keliki, Keliki, Kec. Tegallalang, Kabupaten Gianyar, Bali 80561","Keliki, Kec. Tegallalang, Kabupaten Gianyar",BALI,80561.0,Indonesia,82340243402.0,,,-8.4639597,115.2600843,https://maps.google.com/?cid=0x0:0xed868911c3804eda,
restaurant,Indonesia,Tibuan Parung Restaurant,"Jl. Uma Klod, Sebatu, Kec. Tegallalang, Kabupaten Gianyar, Bali 80561","Sebatu, Kec. Tegallalang, Kabupaten Gianyar",BALI,80561.0,Indonesia,83115562220.0,,,-8.4066932,115.295122,https://maps.google.com/?cid=0x0:0xb2529d6f6f154c69,
restaurant,Rumah Makan,Teras Padi Cafe,"Jl. Raya Tegallalang, Tegallalang, Kec. Tegallalang, Kabupaten Gianyar, Bali 80561","Tegallalang, Kec. Tegallalang, Kabupaten Gianyar",BALI,80561.0,Indonesia,81919191456.0,,,-8.4333992,115.2785658,https://maps.google.com/?cid=0x0:0xfc6f5fb2d63c33bf,
restaurant,restaurant,Ubud,"Ubud, Kecamatan Ubud, Kabupaten Gianyar, Bali","Kabupaten Gianyar, Bali",BALI,,Indonesia,,,,-8.5068536,115.2624778,https://maps.google.com/?cid=0x0:0x54a38afd6b773d1c,
restaurant,Restoran,Melali Ubud,"Jl. Sri Wedari No.58, Ubud, Kecamatan Ubud, Kabupaten Gianyar, Bali 80571","Ubud, Kecamatan Ubud, Kabupaten Gianyar",BALI,80571.0,Indonesia,82210005091.0,,,-8.4848109,115.2669997,https://maps.google.com/?cid=0x0:0xf91dc47ae6aa0266,
restaurant,Kafe,Amsterdam Restaurant Ubud,"Jl. Sri Wedari No.60, Ubud, Kecamatan Ubud, Kabupaten Gianyar, Bali 80571","Ubud, Kecamatan Ubud, Kabupaten Gianyar",BALI,80571.0,Indonesia,81246306606.0,,,-8.4998389,115.2666823,https://maps.google.com/?cid=0x0:0x498ae959d5114437,
restaurant,Restoran,Watercress Cafe Ubud,"Jl. Monkey Forest, Ubud, Bali, Kabupaten Gianyar, Bali 80571","Ubud, Bali, Kabupaten Gianyar",BALI,80571.0,Indonesia,81338685599.0,,,-8.5131112,115.2608741,https://maps.google.com/?cid=0x0:0x75599808bcc0b6da,
restaurant,Panggang,Arcadia Restaurant Ubud,"Jl. Raya Campuhan, Sayan, Kecamatan Ubud, Kabupaten Gianyar, Bali 80571","Sayan, Kecamatan Ubud, Kabupaten Gianyar",BALI,80571.0,Indonesia,81311177882.0,,,-8.5050032,115.254422,https://maps.google.com/?cid=0x0:0x897de572cb9413fe,
restaurant,Bali,Labak Sari Restaurant,"Jl. Tirta Tawar, Br. Abangan, 80571, Ubud 80571, Ubud, Tegallalang, Gianyar Regency, Bali 80571","Br. Abangan,",BALI,80571.0,Indonesia,81916321373.0,,,-8.4683069,115.2698459,https://maps.google.com/?cid=0x0:0x1e53695d4ee525d5,
restaurant,restaurant,Donna,"Jl. Monkey Forest No.67, Ubud, Kecamatan Ubud, Kabupaten Gianyar, Bali 80571","Ubud, Kecamatan Ubud, Kabupaten Gianyar",BALI,80571.0,Indonesia,81337509840.0,,,-8.513036,115.2606987,https://maps.google.com/?cid=0x0:0x24b5d5d00ac99b53,
restaurant,Bali,Sawah Indah Resto Ubud,"Jalan Raya Goa Gajah Peliatan, Ubud, Peliatan, Gianyar, Gianyar Regency, Bali 80571","Ubud, Peliatan, Gianyar, Gianyar Regency",BALI,80571.0,Indonesia,361972547.0,,,-8.5197533,115.27447,https://maps.google.com/?cid=0x0:0x18f1ddb49b83a391,
restaurant,Vegan,Herb Library,"Jl. Jembawan, Ubud, Kecamatan Ubud, Kabupaten Gianyar, Bali 80571","Ubud, Kecamatan Ubud, Kabupaten Gianyar",BALI,80571.0,Indonesia,8113893213.0,,,-8.5099766,115.2668441,https://maps.google.com/?cid=0x0:0x9de278d404870b27,
restaurant,Restoran,PASIR Ubud,"Jl. Monkey Forest No.99x, Ubud, Kecamatan Ubud, Kabupaten Gianyar, Bali 80571","Ubud, Kecamatan Ubud, Kabupaten Gianyar",BALI,80571.0,Indonesia,8112833838.0,,,-8.5122071,115.2609617,https://maps.google.com/?cid=0x0:0x90bdc95155e8aa75,
restaurant,Makanan Sehat,Tropical Bali Restaurant,"Jl. Monkey Forest No.03, Ubud, Kecamatan Ubud, Kabupaten Gianyar, Bali 80571","Ubud, Kecamatan Ubud, Kabupaten Gianyar",BALI,80571.0,Indonesia,85172115211.0,,,-8.5075441,115.2620626,https://maps.google.com/?cid=0x0:0x43eadb2600df8153,
restaurant,Restoran,This Is Bali - Balinese Food  Desserts,"Jl. Goutama No.2, Ubud, Kecamatan Ubud, Kabupaten Gianyar, Bali 80571","Ubud, Kecamatan Ubud, Kabupaten Gianyar",BALI,80571.0,Indonesia,81353766529.0,,,-8.508112,115.2641036,https://maps.google.com/?cid=0x0:0x88b3ec426fa0bb8f,
restaurant,Restoran,Tablespoon Ubud,"Jl. Suweta No.88, Ubud, Kecamatan Ubud, Kabupaten Gianyar, Bali 80571","Ubud, Kecamatan Ubud, Kabupaten Gianyar",BALI,80571.0,Indonesia,81237571449.0,,,-8.4891919,115.2651151,https://maps.google.com/?cid=0x0:0x946c0856b784eab,
restaurant,Masakan Asia,"Pundi - pundi Asian  Grill Restaurant, Ubud","Jalan Raya Pengosekan, Ubud, Kecamatan Ubud, Kabupaten Gianyar, Bali 80571","Ubud, Kecamatan Ubud, Kabupaten Gianyar",BALI,80571.0,Indonesia,81337525751.0,,,-8.5188407,115.2632208,https://maps.google.com/?cid=0x0:0x8c6f2d293ac9920f,
restaurant,Restoran,Hujan Locale,"Jl. Sri Wedari No.5, Ubud, Kecamatan Ubud, Kabupaten Gianyar, Bali 80571","Ubud, Kecamatan Ubud, Kabupaten Gianyar",BALI,80571.0,Indonesia,81353260275.0,,,-8.5073,115.265031,https://maps.google.com/?cid=0x0:0x46f26e5d7a6aee8,
restaurant,Indonesia,Casa Luna Restaurant,"Jl. Raya Ubud, Ubud, Kecamatan Ubud, Kabupaten Gianyar, Bali 80571","Ubud, Kecamatan Ubud, Kabupaten Gianyar",BALI,80571.0,Indonesia,81338239921.0,,,-8.5062395,115.2605513,https://maps.google.com/?cid=0x0:0x3704465f9bfc2f15,
restaurant,Masakan Perpaduan Asia,UMAMI BALI UBUD,"Jl. Bisma, Ubud, Kecamatan Ubud, Kabupaten Gianyar, Bali 80571","Ubud, Kecamatan Ubud, Kabupaten Gianyar",BALI,80571.0,Indonesia,82213384620.0,,,-8.5060563,115.2590996,https://maps.google.com/?cid=0x0:0x7dc0ea49fdc922ac,
restaurant,Restoran,Ada Ubud Resto,"Jl. Monkey Forest, Ubud, Kecamatan Ubud, Kabupaten Gianyar, Bali 80571","Ubud, Kecamatan Ubud, Kabupaten Gianyar",BALI,80571.0,Indonesia,85337216561.0,,,-8.511642,115.2609932,https://maps.google.com/?cid=0x0:0x9aae9471991d6877,
restaurant,Restoran,Pistachio Restaurant Ubud,"Jl. Bisma, Ubud, Kecamatan Ubud, Kabupaten Gianyar, Bali 80571","Ubud, Kecamatan Ubud, Kabupaten Gianyar",BALI,80571.0,Indonesia,85134438595.0,,,-8.5137778,115.2581204,https://maps.google.com/?cid=0x0:0xc25e11e4bbd6fdaa,
restaurant,restaurant,Bali 80571,"Kecamatan Ubud, Kabupaten Gianyar, Bali","Kabupaten Gianyar, Bali",BALI,,Indonesia,,,,-8.5164072,115.2481959,https://maps.google.com/?cid=0x0:0x1c00c5eb6016bed0,
restaurant,Bali,Laka Leke Restaurant,"Jl. Nyuh Bojog No.32, Mas, Kecamatan Ubud, Kabupaten Gianyar, Bali 80571","Mas, Kecamatan Ubud, Kabupaten Gianyar",BALI,80571.0,Indonesia,361977565.0,,,-8.5200224,115.2573454,https://maps.google.com/?cid=0x0:0x8329ad2e25eb285a,
