Category,Real Category,Business Name,Address,City,State,Postal Code,Country,Phone,Email,Website,Latitude,Longitude,Map Link,Details Link
perumahan,Komplek perumahan,Rumah Dekma,"F8V4+HVX, Jl. Wibisana, Siangan, Kec. Gianyar, Kabupaten Gianyar, Bali 80515","Jl. Wibisana, Siangan, Kec. Gianyar, Kabupaten Gianyar",BALI,80515.0,Indonesia,,,,-8.5049042,115.3068251,https://maps.google.com/?cid=0x0:0x5189e9618688b89a,
perumahan,Komplek perumahan,Rumah riska,"F878+9XR, Bitera, Kec. Gianyar, Kabupaten Gianyar, Bali 80515","Bitera, Kec. Gianyar, Kabupaten Gianyar",BALI,80515.0,Indonesia,,,,-8.536511,115.3174027,https://maps.google.com/?cid=0x0:0x48c4cf771c68be38,
perumahan,Komplek perumahan,Perumahan Wicaksana Laghawa,"C9X4+43X, Tulikup, Kec. Gianyar, Kabupaten Gianyar, Bali 80515","Tulikup, Kec. Gianyar, Kabupaten Gianyar",BALI,80515.0,Indonesia,,,,-8.5521412,115.3552202,https://maps.google.com/?cid=0x0:0x4184974298635b4e,
perumahan,Komplek perumahan,Bitera gianyar,"F828+CCF, Jl. Gumbreg, dharmagiri residenceBitera, Kec. Gianyar, Kabupaten Gianyar, Bali 80515","Jl. Gumbreg, dharmagiri residenceBitera, Kec. Gianyar, Kabupaten Gianyar",BALI,80515.0,Indonesia,,,,-8.5489414,115.3160339,https://maps.google.com/?cid=0x0:0x631d1796520aea65,
perumahan,Komplek perumahan,Rumah i kadek handa yana,"F8P4+525, Siangan, Kec. Gianyar, Kabupaten Gianyar, Bali 80515","Siangan, Kec. Gianyar, Kabupaten Gianyar",BALI,80515.0,Indonesia,,,,-8.51411,115.305081,https://maps.google.com/?cid=0x0:0x3004419caf549fb2,
perumahan,Komplek perumahan,RUMAH,"C8VF+9WG, Abianbase, Kec. Gianyar, Kabupaten Gianyar, Bali 80515","Abianbase, Kec. Gianyar, Kabupaten Gianyar",BALI,80515.0,Indonesia,,,,-8.5565668,115.3248221,https://maps.google.com/?cid=0x0:0x5f4d8156e1ddcd04,
perumahan,Komplek perumahan,EKADEWI Home sweet home,"Gg. Mawar No.5, Bitera, Kec. Gianyar, Kabupaten Gianyar, Bali 80515","Bitera, Kec. Gianyar, Kabupaten Gianyar",BALI,80515.0,Indonesia,,,,-8.5342748,115.3134334,https://maps.google.com/?cid=0x0:0xce96f53af8e3da2a,
perumahan,Komplek perumahan,Perumahan Santika Graha no 4A,"C8WM+63R, Jl. Sakura, Serongga, Kec. Gianyar, Kabupaten Gianyar, Bali 80515","Jl. Sakura, Serongga, Kec. Gianyar, Kabupaten Gianyar",BALI,80515.0,Indonesia,,,,-8.5543173,115.3326484,https://maps.google.com/?cid=0x0:0x2e7f59d4883b744d,
perumahan,Toko Pakaian,Araswara's House,"Perum Uma Angkling No.F/5, Bakbakan, Kec. Gianyar, Kabupaten Gianyar, Bali 80515","Bakbakan, Kec. Gianyar, Kabupaten Gianyar",BALI,80515.0,Indonesia,,,,-8.5199841,115.3240178,https://maps.google.com/?cid=0x0:0xf7d8fcab26a0e588,
perumahan,Pembangunan Perumahan,Bakbakan Residence,"F8QG+5XF, Bakbakan, Kec. Gianyar, Kabupaten Gianyar, Bali 80515","Bakbakan, Kec. Gianyar, Kabupaten Gianyar",BALI,80515.0,Indonesia,,,,-8.5120645,115.327419,https://maps.google.com/?cid=0x0:0x1a46d7663830fc99,
perumahan,perumahan,Bali 80572,"Kec. Payangan, Kabupaten Gianyar, Bali","Kabupaten Gianyar, Bali",BALI,,Indonesia,,,,-8.3752579,115.2481959,https://maps.google.com/?cid=0x0:0x1c00c5eb6016bee0,
perumahan,Balai masyarakat,Payangan Desa,"H6CV+Q4X Br. Payangandesa, Jl. Raya Payangan, Melinggih, Kec. Payangan, Kabupaten Gianyar, Bali 80572","Jl. Raya Payangan, Melinggih, Kec. Payangan, Kabupaten Gianyar",BALI,80572.0,Indonesia,,,,-8.4280134,115.2428708,https://maps.google.com/?cid=0x0:0xb191a5360b07678d,
perumahan,Pembangunan Perumahan,Banjar satung,"H6QJ+QXG, Buahan, Kec. Payangan, Kabupaten Gianyar, Bali 80572","Buahan, Kec. Payangan, Kabupaten Gianyar",BALI,80572.0,Indonesia,,,,-8.410569,115.2324677,https://maps.google.com/?cid=0x0:0xf408649b0cb204c0,
perumahan,Komplek perumahan,Banjar Gata,"J6XW+VFJ, Buahan Kaja, Kec. Payangan, Kabupaten Gianyar, Bali 80572","Buahan Kaja, Kec. Payangan, Kabupaten Gianyar",BALI,80572.0,Indonesia,,,,-8.35029,115.2461472,https://maps.google.com/?cid=0x0:0xffef5f583b23839a,
perumahan,Hotel bintang 2,rumah payangan,"J7F9+M2C Banjar Penginyahan, Jl. Raya Payangan, Puhu, Kec. Payangan, Kabupaten Gianyar, Bali 80572","Jl. Raya Payangan, Puhu, Kec. Payangan, Kabupaten Gianyar",BALI,80572.0,Indonesia,,,,-8.3758056,115.2675,https://maps.google.com/?cid=0x0:0x9a487694fd8b21ec,
perumahan,Pembangunan Perumahan,Griya bucu,"H7W5+GC8, Bukian, Kec. Payangan, Kabupaten Gianyar, Bali 80572","Bukian, Kec. Payangan, Kabupaten Gianyar",BALI,80572.0,Indonesia,,,,-8.403705,115.2585741,https://maps.google.com/?cid=0x0:0x41404ca12c7fb7b9,
perumahan,Komplek perumahan,Sugeng House,"J743+FM5, Puhu, Kec. Payangan, Kabupaten Gianyar, Bali 80572","Puhu, Kec. Payangan, Kabupaten Gianyar",BALI,80572.0,Indonesia,85935326711.0,,,-8.3938634,115.2542349,https://maps.google.com/?cid=0x0:0x1c3b0f5e708da101,
perumahan,Pembangunan Perumahan,Growplant,"J6CP+RG9, Buahan Kaja, Kec. Payangan, Kabupaten Gianyar, Bali 80572","Buahan Kaja, Kec. Payangan, Kabupaten Gianyar",BALI,80572.0,Indonesia,,,,-8.377971,115.2363584,https://maps.google.com/?cid=0x0:0x153fc85176847647,
perumahan,Komplek perumahan,Rumah Daun Sriarta,"J62R+RVC, Puhu, Kec. Payangan, Kabupaten Gianyar, Bali 80572","Puhu, Kec. Payangan, Kabupaten Gianyar",BALI,80572.0,Indonesia,,,,-8.3979303,115.2421302,https://maps.google.com/?cid=0x0:0xf3984aa99e9e8386,
perumahan,Komplek perumahan,Rumah Buble,"H7P3+82M, Jl. Payangan, Bukian, Kec. Payangan, Kabupaten Gianyar, Bali 80572","Jl. Payangan, Bukian, Kec. Payangan, Kabupaten Gianyar",BALI,80572.0,Indonesia,,,,-8.4141605,115.2525616,https://maps.google.com/?cid=0x0:0xc932c24b00ba8259,
perumahan,Kantor Perusahaan,"Br. Seming, Desa Kerta, Payangan Gianyar","M78C+HGG, Kerta, Kec. Payangan, Kabupaten Gianyar, Bali 80572","Kerta, Kec. Payangan, Kabupaten Gianyar",BALI,80572.0,Indonesia,,,,-8.3335616,115.2713099,https://maps.google.com/?cid=0x0:0x1a56d487ba2abdb4,
perumahan,Pembangunan Perumahan,Tegal beji,"J67Q+757, Br, Buahan, Kec. Payangan, Kabupaten Gianyar, Bali 80572","Br, Buahan, Kec. Payangan, Kabupaten Gianyar",BALI,80572.0,Indonesia,,,,-8.3868374,115.2379138,https://maps.google.com/?cid=0x0:0x94d4eeebdac560d8,
perumahan,Komplek perumahan,Iwayan sardana Adiputra,"Br Bada, Buahan Kaja, Kec. Payangan, Kabupaten Gianyar, Bali 80572","Buahan Kaja, Kec. Payangan, Kabupaten Gianyar",BALI,80572.0,Indonesia,81338057976.0,,,-8.3511256,115.2512546,https://maps.google.com/?cid=0x0:0xc6256ba92f4d67da,
perumahan,Komplek perumahan,Griya Tanggu Kediri,"H7R3+FQ8, Jalan, Bukian, Payangan, Gianyar Regency, Bali 80572","Jalan, Bukian, Payangan, Gianyar Regency",BALI,80572.0,Indonesia,85737515677.0,,,-8.4088415,115.2544466,https://maps.google.com/?cid=0x0:0x310180113a9eedad,
perumahan,Pembangunan Perumahan,Pondok MAKY,"J797+J4C, Puhu, Kec. Payangan, Kabupaten Gianyar, Bali 80572","Puhu, Kec. Payangan, Kabupaten Gianyar",BALI,80572.0,Indonesia,,,,-8.3809254,115.262771,https://maps.google.com/?cid=0x0:0x1de43beae20c01b7,
perumahan,Komplek perumahan,Barbarika,"J6PW+P7, Buahan Kaja, Kec. Payangan, Kabupaten Gianyar, Bali 80572","Buahan Kaja, Kec. Payangan, Kabupaten Gianyar",BALI,80572.0,Indonesia,,,,-8.3631767,115.2457551,https://maps.google.com/?cid=0x0:0xac56b38444b3e620,
perumahan,Pembangunan Perumahan,Arta PenkQ,"J779+2JV, Jl. Raya Bukiyan, Puhu, Kec. Payangan, Kabupaten Gianyar, Bali 80572","Jl. Raya Bukiyan, Puhu, Kec. Payangan, Kabupaten Gianyar",BALI,80572.0,Indonesia,,,,-8.387389,115.269041,https://maps.google.com/?cid=0x0:0xb4b827ac743ef4f4,
perumahan,Komplek perumahan,Omah Yan Arif,"J6MW+R45, Jl. Raya Buahan Kaja, Buahan Kaja, Kec. Payangan, Kabupaten Gianyar, Bali 80572","Jl. Raya Buahan Kaja, Buahan Kaja, Kec. Payangan, Kabupaten Gianyar",BALI,80572.0,Indonesia,,,,-8.3654851,115.2453714,https://maps.google.com/?cid=0x0:0xf76afd1fe197ee90,
perumahan,Komplek perumahan,Rumah Keluarga PKC,"H7V5+WRQ, Bukian, Kec. Payangan, Kabupaten Gianyar, Bali 80572","Bukian, Kec. Payangan, Kabupaten Gianyar",BALI,80572.0,Indonesia,,,,-8.4051625,115.2596094,https://maps.google.com/?cid=0x0:0x9398e5bcc2b96f90,
perumahan,Komplek perumahan,Kubu pindekan,"H6RQ+4C8, Br, Jl. Susut, Buahan, Kec. Payangan, Kabupaten Gianyar, Bali 80572","Br, Jl. Susut, Buahan, Kec. Payangan, Kabupaten Gianyar",BALI,80572.0,Indonesia,,,,-8.4097098,115.2385874,https://maps.google.com/?cid=0x0:0x16869451186018c9,
perumahan,Perhimpunan Pengembang Perumahan,Nando Hs,"H6MV+XVM, Jl. Raya, Melinggih, Kec. Payangan, Kabupaten Gianyar, Bali 80572","Jl. Raya, Melinggih, Kec. Payangan, Kabupaten Gianyar",BALI,80572.0,Indonesia,,,,-8.415027,115.2446657,https://maps.google.com/?cid=0x0:0x2eb32b876267740d,
perumahan,Pembangunan Perumahan,Puri Kaja Kauh Payangan,"H69V+JP, Melinggih, Kec. Payangan, Kabupaten Gianyar, Bali 80572","Melinggih, Kec. Payangan, Kabupaten Gianyar",BALI,80572.0,Indonesia,,,,-8.4309365,115.2443643,https://maps.google.com/?cid=0x0:0x53f37e69aaa8c949,
perumahan,Komplek perumahan,Pondokan sengkuad,"J724+GV7, Unnamed Road, Bukian, Kec. Payangan, Kabupaten Gianyar, Bali 80572","Unnamed Road, Bukian, Kec. Payangan, Kabupaten Gianyar",BALI,80572.0,Indonesia,,,,-8.3987047,115.2571863,https://maps.google.com/?cid=0x0:0xce7ec53c4d3988b6,
perumahan,perumahan,Sukawati,"Guwang, Kec. Sukawati, Kabupaten Gianyar, Bali","Kabupaten Gianyar, Bali",BALI,,Indonesia,,,,-8.605564,115.280502,https://maps.google.com/?cid=0x0:0x3d33c5a58391e773,
perumahan,Komplek perumahan,Location,"97GF+XWJ, Batubulan Kangin, Kec. Sukawati, Kabupaten Gianyar, Bali 80582","Batubulan Kangin, Kec. Sukawati, Kabupaten Gianyar",BALI,80582.0,Indonesia,85333560195.0,,,-8.6225277,115.2747771,https://maps.google.com/?cid=0x0:0x29e829b5dde23824,
perumahan,Komplek perumahan,Rumah Hanna,"97VJ+M2P, Guwang, Kec. Sukawati, Kabupaten Gianyar, Bali 80582","Guwang, Kec. Sukawati, Kabupaten Gianyar",BALI,80582.0,Indonesia,,,,-8.6058399,115.2799926,https://maps.google.com/?cid=0x0:0x7387c240b54005c9,
perumahan,Pembangunan Perumahan,Purnama Residence,"97VJ+Q6C, Sukawati, Kec. Sukawati, Kabupaten Gianyar, Bali","Kabupaten Gianyar, Bali",BALI,,Indonesia,,,,-8.6055637,115.2805295,https://maps.google.com/?cid=0x0:0x272629ac9dcf9106,
perumahan,Komplek perumahan,Kubu carik regent,"Jl. Raya Guwang gang jalak No.8, Guwang, Kec. Sukawati, Kabupaten Gianyar, Bali 80582","Guwang, Kec. Sukawati, Kabupaten Gianyar",BALI,80582.0,Indonesia,,,,-8.6072384,115.2797292,https://maps.google.com/?cid=0x0:0xb2bb4adde5347e0,
perumahan,Pembangunan Perumahan,Akbar,"97VJ+Q6C, Guwang, Kec. Sukawati, Kabupaten Gianyar, Bali","Kabupaten Gianyar, Bali",BALI,,Indonesia,,,,-8.6055636,115.2805295,https://maps.google.com/?cid=0x0:0x75e0bc1114c3b1a5,
perumahan,Pasar tradisional,Pasar Seni Sukawati (Sukawati Art Market),"Jalan Raya Sukawati, Sukawati, Kec. Sukawati, Kabupaten Gianyar, Bali 80582","Sukawati, Kec. Sukawati, Kabupaten Gianyar",BALI,80582.0,Indonesia,,,,-8.5965307,115.2826055,https://maps.google.com/?cid=0x0:0x960eaffe9f543e3c,
perumahan,Komplek perumahan,Rumah 2,"Gg. Anggur 4d No.1, Batubulan, Kec. Sukawati, Kabupaten Gianyar, Bali 80237","Batubulan, Kec. Sukawati, Kabupaten Gianyar",BALI,80237.0,Indonesia,83114125102.0,,,-8.6306281,115.2619551,https://maps.google.com/?cid=0x0:0x5ffe375966ed7747,
perumahan,perumahan,Tampaksiring,"Kec. Tampaksiring, Kabupaten Gianyar, Bali","Kabupaten Gianyar, Bali",BALI,,Indonesia,,,,-8.4390082,115.3104277,https://maps.google.com/?cid=0x0:0x1800e8dbac4d3f48,
perumahan,Komplek perumahan,Griya Cebaang Tampaksiring,"H8C5+92Q, Jl. Dr. Ir. Soekarno, Tampaksiring, Kec. Tampaksiring, Kabupaten Gianyar, Bali 80552","Jl. Dr. Ir. Soekarno, Tampaksiring, Kec. Tampaksiring, Kabupaten Gianyar",BALI,80552.0,Indonesia,83114179049.0,,,-8.4290281,115.3076234,https://maps.google.com/?cid=0x0:0x9eb43c4a77514305,
perumahan,Komplek perumahan,Jero kanginan tampaksiring,"Jl. Pertiwi Brata No.201, Tampaksiring, Kec. Tampaksiring, Kabupaten Gianyar, Bali 80552","Tampaksiring, Kec. Tampaksiring, Kabupaten Gianyar",BALI,80552.0,Indonesia,87760043122.0,,,-8.4298646,115.3089581,https://maps.google.com/?cid=0x0:0x7a3764952546d616,
perumahan,Pembangunan Perumahan,Seguk House,"H8F5+653, Jl. Dr. Ir. Soekarno, Tampaksiring, Kec. Tampaksiring, Kabupaten Gianyar, Bali 80552","Jl. Dr. Ir. Soekarno, Tampaksiring, Kec. Tampaksiring, Kabupaten Gianyar",BALI,80552.0,Indonesia,,,,-8.4269757,115.3079176,https://maps.google.com/?cid=0x0:0x146fc7ffa79fdbd3,
perumahan,Komplek perumahan,Rumah pak tu,"H893+WRP, Jl. Kresna, Tampaksiring, Kec. Tampaksiring, Kabupaten Gianyar, Bali 80552","Jl. Kresna, Tampaksiring, Kec. Tampaksiring, Kabupaten Gianyar",BALI,80552.0,Indonesia,,,,-8.4301541,115.3045684,https://maps.google.com/?cid=0x0:0x63fffa713486fe57,
perumahan,Pembangunan Perumahan,Puri kedatuan,"Jl. Raya Tampaksiring No.32, Sanding, Kec. Tampaksiring, Kabupaten Gianyar, Bali 80552","Sanding, Kec. Tampaksiring, Kabupaten Gianyar",BALI,80552.0,Indonesia,,,,-8.4645077,115.2960143,https://maps.google.com/?cid=0x0:0xca26522f3826bfd0,
perumahan,Pembangunan Perumahan,Puri Dewa Ketut Enteg,"Manukaya, Kec. Tampaksiring, Kabupaten Gianyar, Bali 80552","Kec. Tampaksiring, Kabupaten Gianyar",BALI,80552.0,Indonesia,,,,-8.4095134,115.3131836,https://maps.google.com/?cid=0x0:0xe8fa08c3df62d3eb,
perumahan,Jasa Konstruksi dan Bangunan,I Gede Arimbawa,"H894+C5M, Tampaksiring, Kec. Tampaksiring, Kabupaten Gianyar, Bali 80552","Tampaksiring, Kec. Tampaksiring, Kabupaten Gianyar",BALI,80552.0,Indonesia,,,,-8.4314081,115.3054066,https://maps.google.com/?cid=0x0:0x630a19355a3a1d9f,
perumahan,Pembangunan Perumahan,Rumah Dewa Made Rauh,"H8C5+6G9, Tampaksiring, Kec. Tampaksiring, Kabupaten Gianyar, Bali 80552","Tampaksiring, Kec. Tampaksiring, Kabupaten Gianyar",BALI,80552.0,Indonesia,,,,-8.4294553,115.3088616,https://maps.google.com/?cid=0x0:0x91a02b81d3eedc03,
perumahan,Komplek perumahan,Rumah,"H866+C52, Br, bukit, Kec. Tampaksiring, Kabupaten Gianyar, Bali","Kabupaten Gianyar, Bali",BALI,,Indonesia,,,,-8.4389881,115.3103764,https://maps.google.com/?cid=0x0:0x847d068e198a7d5a,
perumahan,Pembangunan Perumahan,Gria dauh peken,"Jl. Kawera Brata No.15, Tampaksiring, Kec. Tampaksiring, Kabupaten Gianyar, Bali 80552","Tampaksiring, Kec. Tampaksiring, Kabupaten Gianyar",BALI,80552.0,Indonesia,,,,-8.4298679,115.3072114,https://maps.google.com/?cid=0x0:0x57297fdf724cf72c,
perumahan,Komplek perumahan,fumah,"H8C6+763, Jl. Abimaniyu, Tampaksiring, Kec. Tampaksiring, Kabupaten Gianyar, Bali 80552","Jl. Abimaniyu, Tampaksiring, Kec. Tampaksiring, Kabupaten Gianyar",BALI,80552.0,Indonesia,,,,-8.4293555,115.310541,https://maps.google.com/?cid=0x0:0xe0ba93c6af2ca0ad,
perumahan,Perhimpunan Pengembang Perumahan,Kawan’s House,"Jl. Widura No.31, Tampaksiring, Kec. Tampaksiring, Kabupaten Gianyar, Bali 80552","Tampaksiring, Kec. Tampaksiring, Kabupaten Gianyar",BALI,80552.0,Indonesia,,,,-8.4280013,115.3048384,https://maps.google.com/?cid=0x0:0xc20df31d61f9fbc0,
perumahan,Komplek perumahan,Rumah,"H8G7+RW3, Manukaya, Kec. Tampaksiring, Kabupaten Gianyar, Bali","Kabupaten Gianyar, Bali",BALI,,Indonesia,,,,-8.4229979,115.3148079,https://maps.google.com/?cid=0x0:0x1ec6991d3502dd3d,
perumahan,perumahan,Griya Ageng Keniten Kediri Tampaksiring,"H8C5+J38, Jl. Dr. Ir. Soekarno, Tampaksiring, Kecamatan Ubud, Kabupaten Gianyar, Bali 80552","Jl. Dr. Ir. Soekarno, Tampaksiring, Kecamatan Ubud, Kabupaten Gianyar",BALI,80552.0,Indonesia,,,,-8.4283983,115.307664,https://maps.google.com/?cid=0x0:0x3d120f7aa8f4f299,
perumahan,Komplek perumahan,Puri kelodan tampaksiring,"H895+X6C, Tampaksiring, Kec. Tampaksiring, Kabupaten Gianyar, Bali 80552","Tampaksiring, Kec. Tampaksiring, Kabupaten Gianyar",BALI,80552.0,Indonesia,,,,-8.4300587,115.3080294,https://maps.google.com/?cid=0x0:0xee906e1503aa65d5,
perumahan,Komplek perumahan,WIJES Studio,"Jl. Kresna No.9, Br. Kawan, Kec. Tampaksiring, Kabupaten Gianyar, Bali 80552","Br. Kawan, Kec. Tampaksiring, Kabupaten Gianyar",BALI,80552.0,Indonesia,,,,-8.4304297,115.3045247,https://maps.google.com/?cid=0x0:0x3c926e1b30948adf,
perumahan,Komplek perumahan,GRIYA MANUABA KUMBA,"H873+WWJ, Tampaksiring, Kec. Tampaksiring, Kabupaten Gianyar, Bali","Kabupaten Gianyar, Bali",BALI,,Indonesia,,,,-8.4351534,115.304752,https://maps.google.com/?cid=0x0:0xea3768129cadaacf,
perumahan,Komplek perumahan,Satya Koi Bali,"Sanding, Kec. Tampaksiring, Kabupaten Gianyar, Bali 80552","Kec. Tampaksiring, Kabupaten Gianyar",BALI,80552.0,Indonesia,8123989991.0,,,-8.466896,115.2966289,https://maps.google.com/?cid=0x0:0x51ae82a95eeb41f,
perumahan,Hotel,Ketut house,"H8C6+7Q5, Br Tegal suci, Tampaksiring, Kec. Tampaksiring, Kabupaten Gianyar, Bali","Kabupaten Gianyar, Bali",BALI,,Indonesia,,,,-8.4293579,115.3119774,https://maps.google.com/?cid=0x0:0x217133e60cea9170,
perumahan,Komplek perumahan,Wayan suardika( Manik family),"H894+C5M, Tampaksiring, Kec. Tampaksiring, Kabupaten Gianyar, Bali 80552","Tampaksiring, Kec. Tampaksiring, Kabupaten Gianyar",BALI,80552.0,Indonesia,,,,-8.4314125,115.3054219,https://maps.google.com/?cid=0x0:0x7f2163396963bb36,
perumahan,Komplek perumahan,nathan home,"G8Q3+JJ3, Carlo Way, Sanding, Kec. Tampaksiring, Kabupaten Gianyar, Bali 80552","Carlo Way, Sanding, Kec. Tampaksiring, Kabupaten Gianyar",BALI,80552.0,Indonesia,83114588243.0,,,-8.460552,115.303884,https://maps.google.com/?cid=0x0:0x4aae6abd7dc3aede,
perumahan,Komplek perumahan,oleg house,"H852+F6, Tampaksiring, Kec. Tampaksiring, Kabupaten Gianyar, Bali 80552","Tampaksiring, Kec. Tampaksiring, Kabupaten Gianyar",BALI,80552.0,Indonesia,,,,-8.4413306,115.3005474,https://maps.google.com/?cid=0x0:0x53ef19bc735a41cb,
perumahan,Komplek perumahan,Jero Pungakan Manukaya Anyar,"H8Q6+HWP, Manukaya, Kec. Tampaksiring, Kabupaten Gianyar, Bali 80552","Manukaya, Kec. Tampaksiring, Kabupaten Gianyar",BALI,80552.0,Indonesia,,,,-8.4110361,115.3123304,https://maps.google.com/?cid=0x0:0x3cec67b52c2787f2,
perumahan,perumahan,Bali 80552,"Kec. Tampaksiring, Kabupaten Gianyar, Bali","Kabupaten Gianyar, Bali",BALI,,Indonesia,,,,-8.4362857,115.3133908,https://maps.google.com/?cid=0x0:0x1c00c5eb6016beb0,
perumahan,Pembangunan Perumahan,Kost Pak Punia,"Jl Dewi Sri No. 6, Banjar Sanding, Serongga, Tampaksiring, Gianyar Regency, Bali 80552","Banjar Sanding, Serongga, Tampaksiring, Gianyar Regency",BALI,80552.0,Indonesia,,,,-8.4651903,115.2957135,https://maps.google.com/?cid=0x0:0xddae8bf17c588756,
perumahan,Pembangunan Perumahan,WADITYA,"J78H+FP5, Taro, Kec. Tegallalang, Kabupaten Gianyar, Bali 80561","Taro, Kec. Tegallalang, Kabupaten Gianyar",BALI,80561.0,Indonesia,,,,-8.3839467,115.2791313,https://maps.google.com/?cid=0x0:0xc3226324ea80fe85,
perumahan,Komplek perumahan,Perumahan,"J77R+GM7, Sebatu, Kec. Tegallalang, Kabupaten Gianyar, Bali 80561","Sebatu, Kec. Tegallalang, Kabupaten Gianyar",BALI,80561.0,Indonesia,,,,-8.3859342,115.2916686,https://maps.google.com/?cid=0x0:0x2410a21727e4888c,
perumahan,perumahan,Bali 80561,"Kec. Tegallalang, Kabupaten Gianyar, Bali","Kabupaten Gianyar, Bali",BALI,,Indonesia,,,,-8.3921715,115.2956118,https://maps.google.com/?cid=0x0:0x1c00c5eb6016bec0,
perumahan,Pembangunan Perumahan,Perumahan,"J78V+PW5, Jl. Raya Bonjaka, Taro, Kec. Tegallalang, Kabupaten Gianyar, Bali 80561","Jl. Raya Bonjaka, Taro, Kec. Tegallalang, Kabupaten Gianyar",BALI,80561.0,Indonesia,,,,-8.3832467,115.2948535,https://maps.google.com/?cid=0x0:0x6b68bfaef9c62314,
perumahan,Perumahan,Pondok sugita,"J844+VRM, Jl. Banjar Timbul-Pupuan, Pupuan, Kec. Tegallalang, Kabupaten Gianyar, Bali 80561","Jl. Banjar Timbul-Pupuan, Pupuan, Kec. Tegallalang, Kabupaten Gianyar",BALI,80561.0,Indonesia,83119395348.0,,,-8.3927917,115.3070533,https://maps.google.com/?cid=0x0:0x76a9b6477a84f69a,
perumahan,Komplek perumahan,PONDOK TU RIRIS kampung baru bonjaka,"J78R+MF, Sebatu, Kec. Tegallalang, Kabupaten Gianyar, Bali","Kabupaten Gianyar, Bali",BALI,,Indonesia,,,,-8.3832807,115.2911805,https://maps.google.com/?cid=0x0:0x7691f2ddf3e2903,
perumahan,Perumahan,Pondok Mas Adi Gustata,"J874+8J5, Jl. Banjar Timbul-Pupuan, Pupuan, Kec. Tegallalang, Kabupaten Gianyar, Bali 80561","Jl. Banjar Timbul-Pupuan, Pupuan, Kec. Tegallalang, Kabupaten Gianyar",BALI,80561.0,Indonesia,,,,-8.3867366,115.3065975,https://maps.google.com/?cid=0x0:0xa203c383eee84cad,
perumahan,Komplek perumahan,Rumah pak kadek,"J847+3C, Pupuan, Kec. Tegallalang, Kabupaten Gianyar, Bali 80561","Pupuan, Kec. Tegallalang, Kabupaten Gianyar",BALI,80561.0,Indonesia,,,,-8.3948072,115.3135953,https://maps.google.com/?cid=0x0:0x44b63c2b02c437e5,
perumahan,Komplek perumahan,Marbun home,"H8X4+PQ3, Pupuan, Kec. Tegallalang, Kabupaten Gianyar, Bali 80561","Pupuan, Kec. Tegallalang, Kabupaten Gianyar",BALI,80561.0,Indonesia,,,,-8.4007376,115.3069063,https://maps.google.com/?cid=0x0:0x33b1d79e5c32891f,
perumahan,Perumahan,Home,"H7WQ+C3M, Jl. Raya Pujung Kaja, Sebatu, Kec. Tegallalang, Kabupaten Gianyar, Bali 80561","Jl. Raya Pujung Kaja, Sebatu, Kec. Tegallalang, Kabupaten Gianyar",BALI,80561.0,Indonesia,,,,-8.404018,115.287575,https://maps.google.com/?cid=0x0:0xf637cad808756df,
perumahan,Komplek perumahan,GRYA AGUNG LINGGAACALA,"H8X4+2GM, Pupuan, Kec. Tegallalang, Kabupaten Gianyar, Bali 80561","Pupuan, Kec. Tegallalang, Kabupaten Gianyar",BALI,80561.0,Indonesia,,,,-8.4025436,115.3062049,https://maps.google.com/?cid=0x0:0x1182e95b93227850,
perumahan,Pembangunan Perumahan,my home,"J79H+XQH, Jl. Raya Taro Kaja, Taro, Kec. Tegallalang, Kabupaten Gianyar, Bali 80561","Jl. Raya Taro Kaja, Taro, Kec. Tegallalang, Kabupaten Gianyar",BALI,80561.0,Indonesia,,,,-8.3800506,115.2794817,https://maps.google.com/?cid=0x0:0xcaba44c22d3152aa,
perumahan,Komplek perumahan,Weda home,"J858+992, Unnamed Road, Pupuan, Kec. Tegallalang, Kabupaten Gianyar, Bali 80561","Unnamed Road, Pupuan, Kec. Tegallalang, Kabupaten Gianyar",BALI,80561.0,Indonesia,,,,-8.3916137,115.3158843,https://maps.google.com/?cid=0x0:0xac148eaf956e22e4,
perumahan,Pembangunan Perumahan,Pondok kajekangin,"J73X+Q75, Sebatu, Kec. Tegallalang, Kabupaten Gianyar, Bali 80561","Sebatu, Kec. Tegallalang, Kabupaten Gianyar",BALI,80561.0,Indonesia,,,,-8.3948009,115.2984775,https://maps.google.com/?cid=0x0:0x4b7bbae37364f718,
perumahan,Pembangunan Perumahan,Rumah tinggal,"J879+R86, Banjar Tegal payang, Kec. Tegallalang, Kabupaten Gianyar, Bali","Kabupaten Gianyar, Bali",BALI,,Indonesia,,,,-8.3854549,115.3182781,https://maps.google.com/?cid=0x0:0xe038631f0590d057,
perumahan,Komplek perumahan,I Nyoman Dartu,"J7FR+4WR, Jl. Banjar Belong Taro, Taro, Kec. Tegallalang, Kabupaten Gianyar, Bali 80561","Jl. Banjar Belong Taro, Taro, Kec. Tegallalang, Kabupaten Gianyar",BALI,80561.0,Indonesia,8179274745.0,,,-8.3771352,115.2922737,https://maps.google.com/?cid=0x0:0x4c7c5db651f97400,
perumahan,Komplek perumahan,TEDUNG PENG LEAKAN BALI,"H7VW+5HW, Sebatu, Kec. Tegallalang, Kabupaten Gianyar, Bali 80561","Sebatu, Kec. Tegallalang, Kabupaten Gianyar",BALI,80561.0,Indonesia,,,,-8.4070106,115.2964587,https://maps.google.com/?cid=0x0:0xbe3ccb94352f10d8,
perumahan,Komplek perumahan,Vande Familly,"H7JR+GQ9, Kedisan, Kec. Tegallalang, Kabupaten Gianyar, Bali 80561","Kedisan, Kec. Tegallalang, Kabupaten Gianyar",BALI,80561.0,Indonesia,,,,-8.4187203,115.2919864,https://maps.google.com/?cid=0x0:0xc53e95f39422637e,
perumahan,Komplek perumahan,Rumah Hara Graha,"H7RX+G2Q, Jln raya ume kelod, Sebatu, Tegallalang, Gianyar Regency, Bali 80561","Jln raya ume kelod, Sebatu, Tegallalang, Gianyar Regency",BALI,80561.0,Indonesia,,,,-8.4083823,115.2988265,https://maps.google.com/?cid=0x0:0x4d87de81b627c746,
perumahan,Komplek perumahan,"Rumah Ramah Sadewa, Banjar Triwangsa, Tegallalang, Gianyar, Bali","G7XH+QV, Tegallalang, Kec. Tegallalang, Kabupaten Gianyar, Bali 80561","Tegallalang, Kec. Tegallalang, Kabupaten Gianyar",BALI,80561.0,Indonesia,83119558117.0,,,-8.4510441,115.2797221,https://maps.google.com/?cid=0x0:0x7193f5d906902280,
perumahan,Komplek perumahan,Rumah pujung,"Jl. Raya Pujung Kaja No.14, Sebatu, Kec. Tegallalang, Kabupaten Gianyar, Bali 80561","Sebatu, Kec. Tegallalang, Kabupaten Gianyar",BALI,80561.0,Indonesia,,,,-8.4099654,115.2854856,https://maps.google.com/?cid=0x0:0x29530bc19949714e,
perumahan,Pembangunan Perumahan,Perumahan pondok tanah putih,"H7QW+284, Jl. Raya Bayad, Kedisan, Kec. Tegallalang, Kabupaten Gianyar, Bali 80561","Jl. Raya Bayad, Kedisan, Kec. Tegallalang, Kabupaten Gianyar",BALI,80561.0,Indonesia,,,,-8.4118852,115.295242,https://maps.google.com/?cid=0x0:0x3033dc2eccc9b420,
perumahan,Rumah wisata,Giri Swastika House,"J79V+4X9, Jl. Raya Bonjaka, Sebatu, Kec. Tegallalang, Kabupaten Gianyar, Bali 80561","Jl. Raya Bonjaka, Sebatu, Kec. Tegallalang, Kabupaten Gianyar",BALI,80561.0,Indonesia,,,,-8.3822126,115.2950391,https://maps.google.com/?cid=0x0:0x496e9dba201f639a,
perumahan,Komplek perumahan,Rumah yan lego,"H7JX+553, Jl. Raya Bayad, Kedisan, Kec. Tegallalang, Kabupaten Gianyar, Bali 80561","Jl. Raya Bayad, Kedisan, Kec. Tegallalang, Kabupaten Gianyar",BALI,80561.0,Indonesia,,,,-8.419619,115.2979125,https://maps.google.com/?cid=0x0:0xdbc2190431c1c011,
perumahan,Komplek perumahan,Arsop blongking banjar bilukan sebatu tegallalang gianyar bali,"J74V+M84, Jl. Raya Bilukan, Sebatu, Kec. Tegallalang, Kabupaten Gianyar, Bali 80561","Jl. Raya Bilukan, Sebatu, Kec. Tegallalang, Kabupaten Gianyar",BALI,80561.0,Indonesia,,,,-8.393142,115.2938848,https://maps.google.com/?cid=0x0:0x4a6157d03237aa4a,
perumahan,Komplek perumahan,Jojol Taro,"J77H+J42, Taro, Kec. Tegallalang, Kabupaten Gianyar, Bali 80561","Taro, Kec. Tegallalang, Kabupaten Gianyar",BALI,80561.0,Indonesia,85238721179.0,,,-8.3859942,115.2777743,https://maps.google.com/?cid=0x0:0x7d2ed3a568b5e27c,
perumahan,Penginapan,Bayu,"J78H+JVM, Jl. Raya Taro Kaja, Taro, Kec. Tegallalang, Kabupaten Gianyar, Bali 80561","Jl. Raya Taro Kaja, Taro, Kec. Tegallalang, Kabupaten Gianyar",BALI,80561.0,Indonesia,,,,-8.3831483,115.2798247,https://maps.google.com/?cid=0x0:0xb9af38a8384038f1,
perumahan,perumahan,Ubud,"Ubud, Kecamatan Ubud, Kabupaten Gianyar, Bali","Kabupaten Gianyar, Bali",BALI,,Indonesia,,,,-8.5068536,115.2624778,https://maps.google.com/?cid=0x0:0x54a38afd6b773d1c,
