Category;Real Category;Business Name;Address;City;State;Postal Code;Country;Phone;Email;Website;Latitude;Longitude;Map Link;Details Link
"hotel";"hotel";"Kec. Air Kumbang";"Kab. Banyuasin, Sumatera Selatan";"Kab. Banyuasin, Sumatera Selatan";"SUMATERA SELATAN";"";"Indonesia";"";"";"";"-2.9142489";"105.0024809";"https://maps.google.com/?cid=0x0:0xf89e86de3e805e52";""
"hotel";"Hotel";"Hotel Soenarto";"5XGR+52V, Padang Rejo, Kec. Air Kumbang, Kab. Banyuasin, Sumatera Selatan 30962";"Padang Rejo, Kec. Air Kumbang, Kab. Banyuasin";"SUMATERA SELATAN";"30962";"Indonesia";"";"";"";"-2.8248357";"104.9899501";"https://maps.google.com/?cid=0x0:0xfb2c5eb8d59f2783";""
"hotel";"Hostel";"Ibu Utami";"5266+QMV, RT.06/RW.02, Budi Mulya, Kec. Air Kumbang, Kab. Banyuasin, Sumatera Selatan 30962";"RT.06/RW.02, Budi Mulya, Kec. Air Kumbang, Kab. Banyuasin";"SUMATERA SELATAN";"30962";"Indonesia";"";"";"";"-2.8380011";"105.0116771";"https://maps.google.com/?cid=0x0:0xbbfd404a7c75d5b7";""
"hotel";"Komplek perumahan";"Omah Demit Padang Rejo";"5XGR+MG2, Padang Rejo, Kec. Air Kumbang, Kab. Banyuasin, Sumatera Selatan 30962";"Padang Rejo, Kec. Air Kumbang, Kab. Banyuasin";"SUMATERA SELATAN";"30962";"Indonesia";"";"";"";"-2.8245125";"104.9900469";"https://maps.google.com/?cid=0x0:0x6e9850c508ed4ae3";""
"hotel";"Rumah wisata";"Rumah saya";"32H3+G62, Sidomulyo, Kec. Air Kumbang, Kab. Banyuasin, Sumatera Selatan 30962";"Sidomulyo, Kec. Air Kumbang, Kab. Banyuasin";"SUMATERA SELATAN";"30962";"Indonesia";"";"";"";"-2.921885";"105.003118";"https://maps.google.com/?cid=0x0:0x3c09c7a53d0ee8b0";""
"hotel";"Hotel";"Kaoooontol";"3233+V3, Sidomulyo, Kec. Air Kumbang, Kab. Banyuasin, Sumatera Selatan";"Kab. Banyuasin, Sumatera Selatan";"SUMATERA SELATAN";"";"Indonesia";"";"";"";"-2.9453697";"105.0027209";"https://maps.google.com/?cid=0x0:0x1f2c7f2fa12694ee";""
"hotel";"hotel";"Sumatera Selatan 30972";"Kec. Makarti Jaya, Kab. Banyuasin, Sumatera Selatan";"Kab. Banyuasin, Sumatera Selatan";"SUMATERA SELATAN";"";"Indonesia";"";"";"";"-2.5016317";"104.9505671";"https://maps.google.com/?cid=0x0:0x8dadb7aa5950616a";""
"hotel";"Rumah wisata";"HOUSE AJISE";"72X5+3Q3, Srikaton, Kec. Air Salek, Kab. Banyuasin, Sumatera Selatan";"Kab. Banyuasin, Sumatera Selatan";"SUMATERA SELATAN";"";"Indonesia";" 082299084722";"";"";"-2.7023737";"105.0094249";"https://maps.google.com/?cid=0x0:0x50018959410df66f";""
"hotel";"Hotel";"Wisma berkat Tabah";"8VGX+9FG, Upang Makmur, Kec. Makarti Jaya, Kab. Banyuasin, Sumatera Selatan";"Kab. Banyuasin, Sumatera Selatan";"SUMATERA SELATAN";"";"Indonesia";"";"";"";"-2.6740627";"104.8987099";"https://maps.google.com/?cid=0x0:0x3449c06c00614299";""
"hotel";"Motel";"Rumah UUN SUHARYANTO";"C2RX+WP, Damar Wulan, Kec. Air Salek, Kab. Banyuasin, Sumatera Selatan 30975";"Damar Wulan, Kec. Air Salek, Kab. Banyuasin";"SUMATERA SELATAN";"30975";"Indonesia";"";"";"";"-2.5577404";"105.0493206";"https://maps.google.com/?cid=0x0:0x87f19f91af4491b9";""
"hotel";"Rumah wisata";"bascam blok a2";"7XCJ+H86, Sri Mulyo, Kec. Air Salek, Kab. Banyuasin, Sumatera Selatan";"Kab. Banyuasin, Sumatera Selatan";"SUMATERA SELATAN";"";"Indonesia";" 088274348586";"";"";"-2.7285864";"104.9807505";"https://maps.google.com/?cid=0x0:0xb9e363221b2d4341";""
"hotel";"Apartemen sewa liburan";"Rumah rizqi";"8WFF+GC9, Upang Ceria, Kec. Makarti Jaya, Kab. Banyuasin, Sumatera Selatan 30972";"Upang Ceria, Kec. Makarti Jaya, Kab. Banyuasin";"SUMATERA SELATAN";"30972";"Indonesia";"";"";"";"-2.6762125";"104.9236094";"https://maps.google.com/?cid=0x0:0x964340665140f04d";""
"hotel";"Hostel";"Muhammad Kahfi Erdogan";"82F8+QX2, Sidoharjo, Kec. Air Salek, Kab. Banyuasin, Sumatera Selatan";"Kab. Banyuasin, Sumatera Selatan";"SUMATERA SELATAN";"";"Indonesia";"";"";"";"-2.6756119";"105.017399";"https://maps.google.com/?cid=0x0:0x77b7ab4b2bd67266";""
"hotel";"Hotel";"Agus sulaiman";"8V2M+G57, Mekar Mukti, Kec. Muara Telang, Kab. Banyuasin, Sumatera Selatan 30974";"Mekar Mukti, Kec. Muara Telang, Kab. Banyuasin";"SUMATERA SELATAN";"30974";"Indonesia";"";"";"";"-2.6995717";"104.8826602";"https://maps.google.com/?cid=0x0:0xf42be0df59d60ece";""
"hotel";"Apartemen sewa liburan";"Rumah Jenal KPI";"HX7J+H8F, Tirta Mulya, Kec. Makarti Jaya, Kab. Banyuasin, Sumatera Selatan 30972";"Tirta Mulya, Kec. Makarti Jaya, Kab. Banyuasin";"SUMATERA SELATAN";"30972";"Indonesia";"";"";"";"-2.4360601";"104.9808117";"https://maps.google.com/?cid=0x0:0x40827d0e77b30d07";""
"hotel";"Rumah berlibur";"Mbahe yuda";"8VVJ+38, Mekar Sari (Upt XII), Kec. Muara Telang, Kab. Banyuasin, Sumatera Selatan";"Kab. Banyuasin, Sumatera Selatan";"SUMATERA SELATAN";"";"Indonesia";" 085747416092";"";"";"-2.657328";"104.880872";"https://maps.google.com/?cid=0x0:0x16dd8c440e9460b5";""
"hotel";"Hotel";"Susilo Andri Yanto";"8VXH+3JX, Telang Jaya, Kec. Muara Telang, Kab. Banyuasin, Sumatera Selatan 30974";"Telang Jaya, Kec. Muara Telang, Kab. Banyuasin";"SUMATERA SELATAN";"30974";"Indonesia";"";"";"";"-2.653387";"104.878628";"https://maps.google.com/?cid=0x0:0xd86b7f64c6fc55d0";""
"hotel";"Motel";"Gubuk deni";"GX8F+P4P, Tirta Mulya, Kec. Makarti Jaya, Kab. Banyuasin, Sumatera Selatan";"Kab. Banyuasin, Sumatera Selatan";"SUMATERA SELATAN";"";"Indonesia";"";"";"";"-2.4831347";"104.9727571";"https://maps.google.com/?cid=0x0:0x47736790581cd780";""
"hotel";"Bed >>u0026 Breakfast";"Iqbal Tower";"6W25+MVJ, Upang Jaya, Kec. Makarti Jaya, Kab. Banyuasin, Sumatera Selatan 30974";"Upang Jaya, Kec. Makarti Jaya, Kab. Banyuasin";"SUMATERA SELATAN";"30974";"Indonesia";"";"";"";"-2.7977957";"104.9100345";"https://maps.google.com/?cid=0x0:0xaf960fcbf77ca0dd";""
"hotel";"Hotel";"Hotel Soenarto";"5XGR+52V, Padang Rejo, Kec. Air Kumbang, Kab. Banyuasin, Sumatera Selatan 30962";"Padang Rejo, Kec. Air Kumbang, Kab. Banyuasin";"SUMATERA SELATAN";"30962";"Indonesia";"";"";"";"-2.8248357";"104.9899501";"https://maps.google.com/?cid=0x0:0xfb2c5eb8d59f2783";""
"hotel";"hotel";"Sumatera Selatan 30975";"Kab. Banyuasin, Sumatera Selatan";"Kab. Banyuasin, Sumatera Selatan";"SUMATERA SELATAN";"";"Indonesia";"";"";"";"-2.6440214";"105.0791228";"https://maps.google.com/?cid=0x0:0x33c86caf8afa68e6";""
"hotel";"Motel";"Rumah UUN SUHARYANTO";"C2RX+WP, Damar Wulan, Kec. Air Salek, Kab. Banyuasin, Sumatera Selatan 30975";"Damar Wulan, Kec. Air Salek, Kab. Banyuasin";"SUMATERA SELATAN";"30975";"Indonesia";"";"";"";"-2.5577404";"105.0493206";"https://maps.google.com/?cid=0x0:0x87f19f91af4491b9";""
"hotel";"Rumah wisata";"HOUSE AJISE";"72X5+3Q3, Srikaton, Kec. Air Salek, Kab. Banyuasin, Sumatera Selatan";"Kab. Banyuasin, Sumatera Selatan";"SUMATERA SELATAN";"";"Indonesia";" 082299084722";"";"";"-2.7023737";"105.0094249";"https://maps.google.com/?cid=0x0:0x50018959410df66f";""
"hotel";"Kabin perkemahan";"Bpk Suwadi Ruly";"G6R6+XX, Argo Mulyo, Kec. Muara Sugihan, Kab. Banyuasin, Sumatera Selatan";"Kab. Banyuasin, Sumatera Selatan";"SUMATERA SELATAN";"";"Indonesia";"";"";"";"-2.4575794";"105.2123427";"https://maps.google.com/?cid=0x0:0x8f71b87a9b367baa";""
"hotel";"Rumah wisata";"bascam blok a2";"7XCJ+H86, Sri Mulyo, Kec. Air Salek, Kab. Banyuasin, Sumatera Selatan";"Kab. Banyuasin, Sumatera Selatan";"SUMATERA SELATAN";"";"Indonesia";" 088274348586";"";"";"-2.7285864";"104.9807505";"https://maps.google.com/?cid=0x0:0xb9e363221b2d4341";""
"hotel";"Rumah wisata";"Rumah Nenek";"G4GC+795, Marga Rukun, Kec. Muara Sugihan, Kab. Banyuasin, Sumatera Selatan";"Kab. Banyuasin, Sumatera Selatan";"SUMATERA SELATAN";"";"Indonesia";"";"";"";"-2.474174";"105.1205375";"https://maps.google.com/?cid=0x0:0xe879effd8db0ee98";""
"hotel";"Motel";"Azam";"C55F+HMH, Marga Sugihan, Kec. Muara Padang, Kab. Banyuasin, Sumatera Selatan 30975";"Marga Sugihan, Kec. Muara Padang, Kab. Banyuasin";"SUMATERA SELATAN";"30975";"Indonesia";"";"";"";"-2.5910672";"105.1742416";"https://maps.google.com/?cid=0x0:0x7b4b5435d3221f00";""
"hotel";"Motel";"Basecamp tim asinan muara padang";"84M5+54V, Sumber Makmur, Kec. Muara Padang, Kab. Banyuasin, Sumatera Selatan";"Kab. Banyuasin, Sumatera Selatan";"SUMATERA SELATAN";"";"Indonesia";"";"";"";"-2.6670012";"105.107786";"https://maps.google.com/?cid=0x0:0xdd1fc4c9608187e9";""
"hotel";"hotel";"Salatin Hotel Palembang";"Jl. Sultan M. Mansyur No.7, Bukit Lama, Kec. Ilir Bar. I, Kota Palembang, Sumatera Selatan 30136";"Bukit Lama, Kec. Ilir Bar. I, Kota Palembang";"SUMATERA SELATAN";"30136";"Indonesia";" 082188498845";"";"";"-2.9999991";"104.7313443";"https://maps.google.com/?cid=0x0:0x8802e85906e339d6";""
"hotel";"hotel";"Salvator Hotel Palembang";"Jl. Jend. Sudirman No.792-793, 24 Ilir, Kec. Bukit Kecil, Kota Palembang, Sumatera Selatan 30114";"24 Ilir, Kec. Bukit Kecil, Kota Palembang";"SUMATERA SELATAN";"30114";"Indonesia";" 0711310777";"";"";"-2.981829";"104.756592";"https://maps.google.com/?cid=0x0:0x5ecb62fab73fe21";""
"hotel";"hotel";"Hotel Sumatra";"Jl. Mayor Ruslan No.471, 20 Ilir D II, Kec. Ilir Tim. I, Kota Palembang, Sumatera Selatan 30129";"20 Ilir D II, Kec. Ilir Tim. I, Kota Palembang";"SUMATERA SELATAN";"30129";"Indonesia";" 0711352603";"";"";"-2.9732515";"104.7601432";"https://maps.google.com/?cid=0x0:0x541d2fe987e78bdd";""
"hotel";"Hotel";"Mas res Kaͥriͣnͫa";"G5J8+727, Desa Margorukun, Tirto Harjo, Muara Sugihan, Banyuasin Regency, South Sumatra 30975";"Desa Margorukun, Tirto Harjo, Muara Sugihan, Banyuasin Regency";"SUMATERA SELATAN";"30975";"Indonesia";"";"";"";"-2.4693353";"105.1650352";"https://maps.google.com/?cid=0x0:0x6dc90ac4ba15338c";""
"hotel";"hotel";"Kec. Banyuasin I";"Kab. Banyuasin, Sumatera Selatan";"Kab. Banyuasin, Sumatera Selatan";"SUMATERA SELATAN";"";"Indonesia";"";"";"";"-2.9468328";"104.8910428";"https://maps.google.com/?cid=0x0:0x4039d80b22100c0";""
"hotel";"hotel";"Grand Permata hotel";"Jl. May Zen No..88, RT.06/RW.02, Kalidoni, Kec. Kalidoni, Kota Palembang, Sumatera Selatan 30163";"RT.06/RW.02, Kalidoni, Kec. Kalidoni, Kota Palembang";"SUMATERA SELATAN";"30163";"Indonesia";"";"";"";"-2.9666846";"104.7996207";"https://maps.google.com/?cid=0x0:0xba697246af13caf0";""
"hotel";"hotel";"Sintesa Peninsula Hotel Palembang";"Jl. H. Abdul Rozak No.168, 2 Ilir, Kec. Ilir Tim. II, Kota Palembang, Sumatera Selatan 30163";"2 Ilir, Kec. Ilir Tim. II, Kota Palembang";"SUMATERA SELATAN";"30163";"Indonesia";" 07117826055";"";"";"-2.9509152";"104.7838524";"https://maps.google.com/?cid=0x0:0x41ec101707dcad0f";""
"hotel";"hotel";"Aston Palembang Hotel  Conference Center";"Jl. Jend. Basuki Rachmat No.189, Talang Aman, Kec. Kemuning, Kota Palembang, Sumatera Selatan 30126";"Talang Aman, Kec. Kemuning, Kota Palembang";"SUMATERA SELATAN";"30126";"Indonesia";" 082178332807";"";"";"-2.9547081";"104.7472687";"https://maps.google.com/?cid=0x0:0x29e8c12afb478592";""
"hotel";"hotel";"N/A";"";"";"SUMATERA SELATAN";"";"Indonesia";"";"";"";"";"";"https://maps.google.com/?cid=0x0:0x29e8c12afb478592%7C/g/1hc16z5mq%7Cen-ID";""
"hotel";"hotel";"The Arista Hotel Palembang";"Jl. Kapten A. Rivai, Sungai Pangeran, Kec. Ilir Tim. I, Kota Palembang, Sumatera Selatan 30129";"Sungai Pangeran, Kec. Ilir Tim. I, Kota Palembang";"SUMATERA SELATAN";"30129";"Indonesia";" 0711355000";"";"";"-2.9778309";"104.746474";"https://maps.google.com/?cid=0x0:0x1fa0a148089dd2c9";""
"hotel";"hotel";"N/A";"";"";"SUMATERA SELATAN";"";"Indonesia";"";"";"";"";"";"https://maps.google.com/?cid=0x0:0x1fa0a148089dd2c9%7C/g/1hdyy4nnd%7Cen-ID";""
"hotel";"hotel";"Algoritma Hotel Palembang";"Jl. Dr. M. Isa No.988, Duku, Kec. Ilir Tim. II, Kota Palembang, Sumatera Selatan 30114";"Duku, Kec. Ilir Tim. II, Kota Palembang";"SUMATERA SELATAN";"30114";"Indonesia";" 0711710800";"";"";"-2.9698461";"104.7700225";"https://maps.google.com/?cid=0x0:0x9ea040dd6379d66f";""
"hotel";"hotel";"N/A";"";"";"SUMATERA SELATAN";"";"Indonesia";"";"";"";"";"";"https://maps.google.com/?cid=0x0:0x9ea040dd6379d66f%7C/g/1tdjn7l4%7Cen-ID";""
"hotel";"hotel";"Luminor Hotel Palembang";"No.1111 A, Jl. Jend. Sudirman, Sungai Pangeran, Kec. Ilir Tim. I, Kota Palembang, Sumatera Selatan 30128";"Jl. Jend. Sudirman, Sungai Pangeran, Kec. Ilir Tim. I, Kota Palembang";"SUMATERA SELATAN";"30128";"Indonesia";" 0711371000";"";"";"-2.971717";"104.751077";"https://maps.google.com/?cid=0x0:0x7efa8db3b5dfd90a";""
"hotel";"hotel";"favehotel Palembang";"Jl. Jend. Basuki Rachmat No.1681, RT.: 15/RW.: 06, Pahlawan, Kec. Kemuning, Kota Palembang, Sumatera Selatan 30128";"RT.: 15/RW.: 06, Pahlawan, Kec. Kemuning, Kota Palembang";"SUMATERA SELATAN";"30128";"Indonesia";" 07115730000";"";"";"-2.9560163";"104.7460878";"https://maps.google.com/?cid=0x0:0x4cdbb4e45e58a0d6";""
"hotel";"hotel";"N/A";"";"";"SUMATERA SELATAN";"";"Indonesia";"";"";"";"";"";"https://maps.google.com/?cid=0x0:0x4cdbb4e45e58a0d6%7C/g/11btlnn8yz%7Cen-ID";""
"hotel";"hotel";"Hotel ibis Palembang Sanggar";"Jl. Letkol Iskandar No.1, 15 Ilir, Kec. Ilir Tim. I, Kota Palembang, Sumatera Selatan 30111";"15 Ilir, Kec. Ilir Tim. I, Kota Palembang";"SUMATERA SELATAN";"30111";"Indonesia";" 07117446888";"";"";"-2.982536";"104.7604773";"https://maps.google.com/?cid=0x0:0x869c0065cba1352";""
"hotel";"hotel";"N/A";"";"";"SUMATERA SELATAN";"";"Indonesia";"";"";"";"";"";"https://maps.google.com/?cid=0x0:0x869c0065cba1352%7C/g/11k4z6nlsb%7Cen-ID";""
"hotel";"hotel";"BATIQA Hotel Palembang";"Jl. Kapten A. Rivai No.219, 26 Ilir D. I, Kec. Ilir Bar. I, Kota Palembang, Sumatera Selatan 30121";"26 Ilir D. I, Kec. Ilir Bar. I, Kota Palembang";"SUMATERA SELATAN";"30121";"Indonesia";" 07115229600";"";"";"-2.9844169";"104.7442317";"https://maps.google.com/?cid=0x0:0x43e1b578db630da7";""
"hotel";"hotel";"N/A";"";"";"SUMATERA SELATAN";"";"Indonesia";"";"";"";"";"";"https://maps.google.com/?cid=0x0:0x43e1b578db630da7%7C/g/11ckvwgtl_%7Cen-ID";""
"hotel";"hotel";"Grand Daira Hotel Palembang";"Jl. Jend. Sudirman No.153, Sungai Pangeran, Kec. Ilir Tim. I, Kota Palembang, Sumatera Selatan 30114";"Sungai Pangeran, Kec. Ilir Tim. I, Kota Palembang";"SUMATERA SELATAN";"30114";"Indonesia";" 0711364222";"";"";"-2.9734879";"104.7521285";"https://maps.google.com/?cid=0x0:0x40e1ad22931861f7";""
"hotel";"hotel";"N/A";"";"";"SUMATERA SELATAN";"";"Indonesia";"";"";"";"";"";"https://maps.google.com/?cid=0x0:0x40e1ad22931861f7%7C/g/11f3bthdz5%7Cen-ID";""
"hotel";"hotel";"Harper Palembang";"Jl. R. Sukamto No.20, 20 Ilir D II, Kec. Kemuning, Kota Palembang, Sumatera Selatan 30128";"20 Ilir D II, Kec. Kemuning, Kota Palembang";"SUMATERA SELATAN";"30128";"Indonesia";" 07116208118";"";"";"-2.9523598";"104.7574019";"https://maps.google.com/?cid=0x0:0x533013ebd0e85cd5";""
"hotel";"hotel";"N/A";"";"";"SUMATERA SELATAN";"";"Indonesia";"";"";"";"";"";"https://maps.google.com/?cid=0x0:0x533013ebd0e85cd5%7C/g/11fhybvy61%7Cen-ID";""
"hotel";"hotel";"MaxOneHotels";"B1- B4, Jl. R. Sukamto, 8 Ilir, Ilir Timur II, Palembang City, South Sumatra 30164";"Jl. R. Sukamto, 8 Ilir, Ilir Timur II, Palembang City";"SUMATERA SELATAN";"30164";"Indonesia";" 0711817788";"";"";"-2.9516348";"104.7594031";"https://maps.google.com/?cid=0x0:0xa23b84c3ed052d27";""
"hotel";"hotel";"N/A";"";"";"SUMATERA SELATAN";"";"Indonesia";"";"";"";"";"";"https://maps.google.com/?cid=0x0:0xa23b84c3ed052d27%7C/g/12m92vyp6%7Cen-ID";""
"hotel";"hotel";"Parkside's Hotel Palembang";"Jl. Seroja No.H6 Kel, 20 Ilir D. III, Kec. Ilir Tim. I, Kota Palembang, Sumatera Selatan 30129";"20 Ilir D. III, Kec. Ilir Tim. I, Kota Palembang";"SUMATERA SELATAN";"30129";"Indonesia";" 07113001067";"";"";"-2.9720326";"104.7453565";"https://maps.google.com/?cid=0x0:0x29060a2ab3a536f4";""
"hotel";"hotel";"THE ALTS HOTEL";"Jl. Rajawali No.8, 9 Ilir, Ilir Timur III, Kota Palembang, Sumatera Selatan 30113";"9 Ilir, Ilir Timur III, Kota Palembang";"SUMATERA SELATAN";"30113";"Indonesia";" 0711313800";"";"";"-2.9709533";"104.7646873";"https://maps.google.com/?cid=0x0:0x3aea92f769041a7a";""
"hotel";"hotel";"N/A";"";"";"SUMATERA SELATAN";"";"Indonesia";"";"";"";"";"";"https://maps.google.com/?cid=0x0:0x3aea92f769041a7a%7C/g/1tg2h2wv%7Cen-ID";""
"hotel";"hotel";"Hayo Hotel Palembang";"Jl. Malaka IV No.16, Bukit Sangkal, Kec. Kalidoni, Kota Palembang, Sumatera Selatan 30114";"Bukit Sangkal, Kec. Kalidoni, Kota Palembang";"SUMATERA SELATAN";"30114";"Indonesia";" 081292957700";"";"";"-2.9410918";"104.7684504";"https://maps.google.com/?cid=0x0:0x24286fad5591bfd4";""
"hotel";"hotel";"N/A";"";"";"SUMATERA SELATAN";"";"Indonesia";"";"";"";"";"";"https://maps.google.com/?cid=0x0:0xc837c9f6bc780db5%7C/g/1z3t2dpgv%7Cen-ID";""
"hotel";"hotel";"Novotel Palembang Hotel  Residence";"Jl. R. Sukamto No.8A, 8 Ilir, Kec. Ilir Tim. II, Kota Palembang, Sumatera Selatan 30127";"8 Ilir, Kec. Ilir Tim. II, Kota Palembang";"SUMATERA SELATAN";"30127";"Indonesia";" 0711369777";"";"";"-2.9499047";"104.7644717";"https://maps.google.com/?cid=0x0:0xc837c9f6bc780db5";""
"hotel";"hotel";"Rumah 4 kamar w/ Wi-Fi 150Mbps  Home Theater";"Perumahan Graha Damai Lestari Jl. Lb. Jaya III No.B9, Sei Selayur, Kec. Kalidoni, Kota Palembang, Sumatera Selatan 30119";"Sei Selayur, Kec. Kalidoni, Kota Palembang";"SUMATERA SELATAN";"30119";"Indonesia";" 085322837377";"";"";"-2.9673507";"104.8053705";"https://maps.google.com/?cid=0x0:0x26dc2c9a8209b922";""
"hotel";"hotel";"Sumatera Selatan 30971";"Kec. Banyuasin II, Kab. Banyuasin, Sumatera Selatan";"Kab. Banyuasin, Sumatera Selatan";"SUMATERA SELATAN";"";"Indonesia";"";"";"";"-2.1504372";"104.7520939";"https://maps.google.com/?cid=0x0:0x5fe1362809f55e67";""
"hotel";"hotel";"Hotel Merah Putih";"Jl. Lintas Sumatra Jl. Raya Palembang - Jambi, Bentayan, Kec. Sungai Lilin, Kabupaten Musi Banyuasin, Sumatera Selatan 30755";"Bentayan, Kec. Sungai Lilin, Kabupaten Musi Banyuasin";"SUMATERA SELATAN";"30755";"Indonesia";" 081373211370";"";"";"-2.5352231";"104.113058";"https://maps.google.com/?cid=0x0:0x396617a5d656f60d";""
"hotel";"Tujuan Wisata";"Telaga Sena";"F458+JVQ, Mekar Jadi, Kec. Tungkal Ilir, Kabupaten Musi Banyuasin, Sumatera Selatan";"Kabupaten Musi Banyuasin, Sumatera Selatan";"SUMATERA SELATAN";"";"Indonesia";"";"";"";"-2.5409188";"104.1172301";"https://maps.google.com/?cid=0x0:0xe606da8fd30a093";""
"hotel";"hotel";"MESS PEMKAB BANYUASIN";"3CR5+RMP, Jl. Urip Sumoharjo, Pangkalan Balai, Kec. Banyuasin III, Kab. Banyuasin, Sumatera Selatan 30911";"Jl. Urip Sumoharjo, Pangkalan Balai, Kec. Banyuasin III, Kab. Banyuasin";"SUMATERA SELATAN";"30911";"Indonesia";" 07117692677";"";"";"-2.9079131";"104.4092025";"https://maps.google.com/?cid=0x0:0x3426abb213a4c1a3";""
"hotel";"Lapangan Sepak Bola";"Taman Kota Pangkalan Balai";"Pangkalan Balai, Kec. Banyuasin III, Kab. Banyuasin, Sumatera Selatan 30911";"Kec. Banyuasin III, Kab. Banyuasin";"SUMATERA SELATAN";"30911";"Indonesia";"";"";"";"-2.9050574";"104.4096261";"https://maps.google.com/?cid=0x0:0x6293b77f1a0de4bc";""
"hotel";"Hotel";"HOTEL QODRATULLAH";"3FHJ+6G6, Terlangu, Kec. Banyuasin III, Kab. Banyuasin, Sumatera Selatan 30953";"Terlangu, Kec. Banyuasin III, Kab. Banyuasin";"SUMATERA SELATAN";"30953";"Indonesia";" 081278967001";"";"";"-2.9219709";"104.4812554";"https://maps.google.com/?cid=0x0:0xba3d063de5784cd2";""
"hotel";"Hotel";"Hotel PPQ";"3FGJ+JFJ, Terlangu, Kec. Banyuasin III, Kab. Banyuasin, Sumatera Selatan 30953";"Terlangu, Kec. Banyuasin III, Kab. Banyuasin";"SUMATERA SELATAN";"30953";"Indonesia";"";"";"";"-2.9234215";"104.4811412";"https://maps.google.com/?cid=0x0:0x1410907b4afaa615";""
"hotel";"hotel";"SulthanHomeatay2";"XQCM+45G, 15 Ulu, Kecamatan Seberang Ulu I, Kota Palembang, Sumatera Selatan 30267";"15 Ulu, Kecamatan Seberang Ulu I, Kota Palembang";"SUMATERA SELATAN";"30267";"Indonesia";"";"";"";"-3.0296276";"104.7830362";"https://maps.google.com/?cid=0x0:0xced4a6891ee2bb38";""
"hotel";"Komplek perumahan";"sungsang 1";"HVHF+HV2, Sungsang I, Kec. Banyuasin II, Kab. Banyuasin, Sumatera Selatan 30971";"Sungsang I, Kec. Banyuasin II, Kab. Banyuasin";"SUMATERA SELATAN";"30971";"Indonesia";"";"";"";"-2.4211018";"104.8746508";"https://maps.google.com/?cid=0x0:0x436b415ffdb00696";""
"hotel";"Hotel";"Pondok Jasman";"JR88+JG2, Rimau Sungsang, Kec. Banyuasin II, Kab. Banyuasin, Sumatera Selatan 30971";"Rimau Sungsang, Kec. Banyuasin II, Kab. Banyuasin";"SUMATERA SELATAN";"30971";"Indonesia";"";"";"";"-2.3834847";"104.8162784";"https://maps.google.com/?cid=0x0:0x78f80b6ae3c6365e";""
"hotel";"hotel";"Pulau Obor";"JWH9+FRF, Lrg. Mawar, Sungsang IV, Kec. Banyuasin II, Kab. Banyuasin, Sumatera Selatan 30971";"Lrg. Mawar, Sungsang IV, Kec. Banyuasin II, Kab. Banyuasin";"SUMATERA SELATAN";"30971";"Indonesia";"";"";"";"-2.3713135";"104.9195426";"https://maps.google.com/?cid=0x0:0xff5cd91deca0d0fe";""
"hotel";"hotel";"Sumatera Selatan 30911";"Kec. Banyuasin III, Kab. Banyuasin, Sumatera Selatan";"Kab. Banyuasin, Sumatera Selatan";"SUMATERA SELATAN";"";"Indonesia";"";"";"";"-2.8889076";"104.4082908";"https://maps.google.com/?cid=0x0:0xb14bf42d4cbc7c18";""
"hotel";"hotel";"MESS PEMKAB BANYUASIN";"3CR5+RMP, Jl. Urip Sumoharjo, Pangkalan Balai, Kec. Banyuasin III, Kab. Banyuasin, Sumatera Selatan 30911";"Jl. Urip Sumoharjo, Pangkalan Balai, Kec. Banyuasin III, Kab. Banyuasin";"SUMATERA SELATAN";"30911";"Indonesia";" 07117692677";"";"";"-2.9079131";"104.4092025";"https://maps.google.com/?cid=0x0:0x3426abb213a4c1a3";""
"hotel";"Lapangan Sepak Bola";"Taman Kota Pangkalan Balai";"Pangkalan Balai, Kec. Banyuasin III, Kab. Banyuasin, Sumatera Selatan 30911";"Kec. Banyuasin III, Kab. Banyuasin";"SUMATERA SELATAN";"30911";"Indonesia";"";"";"";"-2.9050574";"104.4096261";"https://maps.google.com/?cid=0x0:0x6293b77f1a0de4bc";""
"hotel";"Pondok";"kemas";"Asian Highway No.25, Pangkalan Balai, Banyuasin III, Banyuasin Regency, South Sumatra 30913";"Pangkalan Balai, Banyuasin III, Banyuasin Regency";"SUMATERA SELATAN";"30913";"Indonesia";"";"";"";"-2.8863108";"104.3917823";"https://maps.google.com/?cid=0x0:0xb976511a7dc5ff0";""
"hotel";"Pondok";"Hotel perintis simpang PT sal";"5CH7+GQ, Sri Bandung, Kec. Banyuasin III, Kab. Banyuasin, Sumatera Selatan";"Kab. Banyuasin, Sumatera Selatan";"SUMATERA SELATAN";"";"Indonesia";"";"";"";"-2.8205307";"104.414139";"https://maps.google.com/?cid=0x0:0xb1efbdeb910a9e93";""
"hotel";"Motel";"Beskem 2 rombongan pengato";"5CHC+6M, Sri Bandung, Kec. Banyuasin III, Kab. Banyuasin, Sumatera Selatan";"Kab. Banyuasin, Sumatera Selatan";"SUMATERA SELATAN";"";"Indonesia";"";"";"";"-2.8215602";"104.4210218";"https://maps.google.com/?cid=0x0:0x443e5c17c3d181f1";""
"hotel";"hotel";"YantoFroza";"Jl. Bukit Indah No.25, Pangkalan Balai, Kec. Banyuasin III, Kab. Banyuasin, Sumatera Selatan 30911";"Pangkalan Balai, Kec. Banyuasin III, Kab. Banyuasin";"SUMATERA SELATAN";"30911";"Indonesia";" 081278862403";"";"";"-2.8961842";"104.4022578";"https://maps.google.com/?cid=0x0:0x6baf25b0aae88496";""
"hotel";"hotel";"Hotel Grand Lestari";"Taja Jaya Raya I, Kec. Betung, Kab. Banyuasin, Sumatera Selatan 30958";"Kec. Betung, Kab. Banyuasin";"SUMATERA SELATAN";"30958";"Indonesia";" 07118940193";"";"";"-2.8422067";"104.2234382";"https://maps.google.com/?cid=0x0:0x2592b020fb0e877e";""
"hotel";"hotel";"Sumatera Selatan 30912";"Seterio, Kec. Banyuasin III, Kab. Banyuasin, Sumatera Selatan";"Kab. Banyuasin, Sumatera Selatan";"SUMATERA SELATAN";"";"Indonesia";"";"";"";"-2.8699841";"104.373372";"https://maps.google.com/?cid=0x0:0xf3eea04bca8b073c";""
"hotel";"hotel";"Hotel Grand Lestari";"Taja Jaya Raya I, Kec. Betung, Kab. Banyuasin, Sumatera Selatan 30958";"Kec. Betung, Kab. Banyuasin";"SUMATERA SELATAN";"30958";"Indonesia";" 07118940193";"";"";"-2.8422067";"104.2234382";"https://maps.google.com/?cid=0x0:0x2592b020fb0e877e";""
"hotel";"hotel";"MESS PEMKAB BANYUASIN";"3CR5+RMP, Jl. Urip Sumoharjo, Pangkalan Balai, Kec. Banyuasin III, Kab. Banyuasin, Sumatera Selatan 30911";"Jl. Urip Sumoharjo, Pangkalan Balai, Kec. Banyuasin III, Kab. Banyuasin";"SUMATERA SELATAN";"30911";"Indonesia";" 07117692677";"";"";"-2.9079131";"104.4092025";"https://maps.google.com/?cid=0x0:0x3426abb213a4c1a3";""
"hotel";"hotel";"Sumatera Selatan 30913";"Kedondong Raye, Kec. Banyuasin III, Kab. Banyuasin, Sumatera Selatan";"Kab. Banyuasin, Sumatera Selatan";"SUMATERA SELATAN";"";"Indonesia";"";"";"";"-2.8988982";"104.3850107";"https://maps.google.com/?cid=0x0:0xd2bec0591a1b22eb";""
"hotel";"hotel";"MESS PEMKAB BANYUASIN";"3CR5+RMP, Jl. Urip Sumoharjo, Pangkalan Balai, Kec. Banyuasin III, Kab. Banyuasin, Sumatera Selatan 30911";"Jl. Urip Sumoharjo, Pangkalan Balai, Kec. Banyuasin III, Kab. Banyuasin";"SUMATERA SELATAN";"30911";"Indonesia";" 07117692677";"";"";"-2.9079131";"104.4092025";"https://maps.google.com/?cid=0x0:0x3426abb213a4c1a3";""
"hotel";"hotel";"Hotel Grand Lestari";"Taja Jaya Raya I, Kec. Betung, Kab. Banyuasin, Sumatera Selatan 30958";"Kec. Betung, Kab. Banyuasin";"SUMATERA SELATAN";"30958";"Indonesia";" 07118940193";"";"";"-2.8422067";"104.2234382";"https://maps.google.com/?cid=0x0:0x2592b020fb0e877e";""
"hotel";"hotel";"Hotel Palapa";"C446+JHW, Sungai Lilin, Kec. Sungai Lilin, Kabupaten Musi Banyuasin, Sumatera Selatan 30755";"Sungai Lilin, Kec. Sungai Lilin, Kabupaten Musi Banyuasin";"SUMATERA SELATAN";"30755";"Indonesia";"";"";"";"-2.5933948";"104.11146";"https://maps.google.com/?cid=0x0:0xb6dc457bfd6ed944";""
"hotel";"hotel";"Sumatera Selatan 30914";"Kec. Banyuasin III, Kab. Banyuasin, Sumatera Selatan";"Kab. Banyuasin, Sumatera Selatan";"SUMATERA SELATAN";"";"Indonesia";"";"";"";"-2.9275223";"104.4199322";"https://maps.google.com/?cid=0x0:0xc6fd8736badfa198";""
"hotel";"hotel";"MESS PEMKAB BANYUASIN";"3CR5+RMP, Jl. Urip Sumoharjo, Pangkalan Balai, Kec. Banyuasin III, Kab. Banyuasin, Sumatera Selatan 30911";"Jl. Urip Sumoharjo, Pangkalan Balai, Kec. Banyuasin III, Kab. Banyuasin";"SUMATERA SELATAN";"30911";"Indonesia";" 07117692677";"";"";"-2.9079131";"104.4092025";"https://maps.google.com/?cid=0x0:0x3426abb213a4c1a3";""
