Category;Real Category;Business Name;Address;City;State;Postal Code;Country;Phone;Email;Website;Latitude;Longitude;Map Link;Details Link
"restaurant";"Restoran";"Waroeng makan Akbar";"93H3+3JF, Jl. Tiara Citra, Damar Wulan, Kec. Air Salek, Kab. Banyuasin, Sumatera Selatan 30975";"Jl. Tiara Citra, Damar Wulan, Kec. Air Salek, Kab. Banyuasin";"SUMATERA SELATAN";"30975";"Indonesia";"";"";"";"-2.6220353";"105.054172";"https://maps.google.com/?cid=0x0:0xe1e99a75e3bb81d9";""
"restaurant";"Toko Daging";"Penggilingn Bakso Cak Gun";"saleh agung / cempakn petak 8, Saleh Jaya, Kec. Air Salek, Kab. Banyuasin, Sumatera Selatan 30962";"Saleh Jaya, Kec. Air Salek, Kab. Banyuasin";"SUMATERA SELATAN";"30962";"Indonesia";" 082387386530";"";"";"-2.624708";"105.0080575";"https://maps.google.com/?cid=0x0:0xf4675a63dc6fd6f5";""
"restaurant";"Toko";"JALOER DRINK";"C2MW+FPG, Jl. Pancasila, Damar Wulan, Kec. Air Salek, Kab. Banyuasin, Sumatera Selatan 30975";"Jl. Pancasila, Damar Wulan, Kec. Air Salek, Kab. Banyuasin";"SUMATERA SELATAN";"30975";"Indonesia";" 081373021717";"";"";"-2.5663173";"105.0468204";"https://maps.google.com/?cid=0x0:0xe9eb588072df058d";""
"restaurant";"Katering";"DAPOER MBAK SITI HABIBI";"92MM+66J, Enggal Rejo, Kec. Air Salek, Kab. Banyuasin, Sumatera Selatan 30975";"Enggal Rejo, Kec. Air Salek, Kab. Banyuasin";"SUMATERA SELATAN";"30975";"Indonesia";"";"";"";"-2.616954";"105.0330208";"https://maps.google.com/?cid=0x0:0x75663600fa7dc2f7";""
"restaurant";"Restoran";"Warung Sudi Mampir";"F3Q2+7WJ, Unnamed Road, Air Solok Batu, Kec. Air Salek, Kab. Banyuasin, Sumatera Selatan 30962";"Unnamed Road, Air Solok Batu, Kec. Air Salek, Kab. Banyuasin";"SUMATERA SELATAN";"30962";"Indonesia";"";"";"";"-2.5117974";"105.0522644";"https://maps.google.com/?cid=0x0:0xe49a3941364dac56";""
"restaurant";"Padang";"Rumah Makan Mbak Muk";"Jl. Paris, Jalur 10 Jembatan 2 Blok E, RT/RW 005 Kelurahan, Desa, Srikaton, Kec. Air Salek, Kab. Banyuasin, Sumatera Selatan 30975";"Jalur 10 Jembatan 2 Blok E, RT/RW 005 Kelurahan, Desa, Srikaton, Kec. Air Salek, Kab. Banyuasin";"SUMATERA SELATAN";"30975";"Indonesia";"";"";"";"-2.7068174";"105.0099688";"https://maps.google.com/?cid=0x0:0x4e00acb880da1228";""
"restaurant";"Restoran";"RM gelora indah masakan padang";"72W5+2G7, Srikaton, Kec. Air Salek, Kab. Banyuasin, Sumatera Selatan 30975";"Srikaton, Kec. Air Salek, Kab. Banyuasin";"SUMATERA SELATAN";"30975";"Indonesia";"";"";"";"-2.7054233";"105.0086427";"https://maps.google.com/?cid=0x0:0x372c59966ed136a4";""
"restaurant";"Brunch";"RM/BAKSO Mbak SEH";"Upt V. Jalur, 20, RW.Sidomuly, Upt V. Jalur 18/Sidomuly, Kec. Muara Padang, Kab. Banyuasin, Sumatera Selatan 30975";"20, RW.Sidomuly, Upt V. Jalur 18/Sidomuly, Kec. Muara Padang, Kab. Banyuasin";"SUMATERA SELATAN";"30975";"Indonesia";" 082371490972";"";"";"-2.6780051";"105.1476043";"https://maps.google.com/?cid=0x0:0xd796e5e1a157ece8";""
"restaurant";"Sate";"Warung sate pak tress";"94FR+FR3, Sidomulyo, Kec. Muara Padang, Kab. Banyuasin, Sumatera Selatan 30975";"Sidomulyo, Kec. Muara Padang, Kab. Banyuasin";"SUMATERA SELATAN";"30975";"Indonesia";" 081271148879";"";"";"-2.626353";"105.1420354";"https://maps.google.com/?cid=0x0:0x29638f53b6a465f";""
"restaurant";"Restoran";"Warung Makan Barokah Mbak Nanik";"Jl. Lintas Palembang Jalur 20 RT.09/RW.03, Margo Mulyo, Purwodadi, Kec. Muara Padang, Kab. Banyuasin, Sumatera Selatan 30975";"Margo Mulyo, Purwodadi, Kec. Muara Padang, Kab. Banyuasin";"SUMATERA SELATAN";"30975";"Indonesia";" 085366110077";"";"";"-2.6609848";"105.0889143";"https://maps.google.com/?cid=0x0:0x88adcedddff7a912";""
"restaurant";"Kolam Memancing";"Kolam Pemancingan Al Hikmah";"C3G8+P38, Jl. Tiara Citra, Damar Wulan, Kec. Air Salek, Kab. Banyuasin, Sumatera Selatan 30975";"Jl. Tiara Citra, Damar Wulan, Kec. Air Salek, Kab. Banyuasin";"SUMATERA SELATAN";"30975";"Indonesia";"";"";"";"-2.5732013";"105.0651992";"https://maps.google.com/?cid=0x0:0xb10dce1d53d05bab";""
"restaurant";"Indonesia";"Rumah Makan Pak Suganda";"Sumber Makmur, Kec. Muara Padang, Kab. Banyuasin, Sumatera Selatan 30975";"Kec. Muara Padang, Kab. Banyuasin";"SUMATERA SELATAN";"30975";"Indonesia";" 082184258141";"";"";"-2.6726297";"105.1276179";"https://maps.google.com/?cid=0x0:0x89bb7e73b3bf6b14";""
"restaurant";"Bakso";"Mie Ayam Bakso Moro Seneng Srikaton Jalur10 Marga Jaya";"8277+FQV, Srikaton, Kec. Air Salek, Kab. Banyuasin, Sumatera Selatan 30975";"Srikaton, Kec. Air Salek, Kab. Banyuasin";"SUMATERA SELATAN";"30975";"Indonesia";" 085213676669";"";"";"-2.6862689";"105.0144177";"https://maps.google.com/?cid=0x0:0x8938af8bf2607095";""
"restaurant";"Rumah Makan";"Mj food  drink";"Desa saleh mukti rt16 petak15, Kec. Air Salek, Kab. Banyuasin, Sumatera Selatan 30773";"Kec. Air Salek, Kab. Banyuasin";"SUMATERA SELATAN";"30773";"Indonesia";" 081333633354";"";"";"-2.6673934";"105.0194376";"https://maps.google.com/?cid=0x0:0x9c629d9c084559d1";""
"restaurant";"Rumah Makan";"Mie ayam  bakso cak gun 354";"927M+M29, saleh mukti, Kec. Air Salek, Kab. Banyuasin, Sumatera Selatan 30975";"saleh mukti, Kec. Air Salek, Kab. Banyuasin";"SUMATERA SELATAN";"30975";"Indonesia";"";"";"";"-2.6358375";"105.0326094";"https://maps.google.com/?cid=0x0:0x70e595eb1c3d882a";""
"restaurant";"Rumah Makan";"Warung mie ayam barokah ayah bunda 313";"925W+QW2, Jl. Tiara Citra, Bintaran, Kec. Air Salek, Kab. Banyuasin, Sumatera Selatan 30975";"Jl. Tiara Citra, Bintaran, Kec. Air Salek, Kab. Banyuasin";"SUMATERA SELATAN";"30975";"Indonesia";" 082280374210";"";"";"-2.6406322";"105.0472667";"https://maps.google.com/?cid=0x0:0x68d99aae9af380c0";""
"restaurant";"restaurant";"Kec. Banyuasin I";"Kab. Banyuasin, Sumatera Selatan";"Kab. Banyuasin, Sumatera Selatan";"SUMATERA SELATAN";"";"Indonesia";"";"";"";"-2.9468328";"104.8910428";"https://maps.google.com/?cid=0x0:0x4039d80b22100c0";""
"restaurant";"Dapur Umum";"༺Mkc༻";"3WG4+FC8, Duren Ijo, Kec. Banyuasin I, Kab. Banyuasin, Sumatera Selatan 30962";"Duren Ijo, Kec. Banyuasin I, Kab. Banyuasin";"SUMATERA SELATAN";"30962";"Indonesia";" 0821865125522";"";"";"-2.9238321";"104.9060851";"https://maps.google.com/?cid=0x0:0x1b3a4aa01e8529c9";""
"restaurant";"Padang";"RM. Rang Sikumbang";"Jl. Sabar Jaya Lr. Bungur, Mariana Ilir, Kec. Banyuasin I, Kab. Banyuasin, Sumatera Selatan 30967";"Mariana Ilir, Kec. Banyuasin I, Kab. Banyuasin";"SUMATERA SELATAN";"30967";"Indonesia";" 08127677309";"";"";"-2.9748495";"104.8690465";"https://maps.google.com/?cid=0x0:0x10128b721e8665f7";""
"restaurant";"Rumah Makan";"RUMAH MAKAN RINI";"3V3R+4PM, Jl. Inpres, Duren Ijo, Kec. Banyuasin I, Kab. Banyuasin, Sumatera Selatan 30962";"Jl. Inpres, Duren Ijo, Kec. Banyuasin I, Kab. Banyuasin";"SUMATERA SELATAN";"30962";"Indonesia";" 082178893037";"";"";"-2.9471721";"104.8919168";"https://maps.google.com/?cid=0x0:0x6c53f34a9e277ea8";""
"restaurant";"Rumah Makan";"Tekwan Bik Tena";"2VHC+532, Jl. Sabar Jaya Lrg. Kelumpang, Mariana Ilir, Kec. Banyuasin I, Kab. Banyuasin, Sumatera Selatan 30763";"Jl. Sabar Jaya Lrg. Kelumpang, Mariana Ilir, Kec. Banyuasin I, Kab. Banyuasin";"SUMATERA SELATAN";"30763";"Indonesia";"";"";"";"-2.9721108";"104.870151";"https://maps.google.com/?cid=0x0:0x2704fb1b473ad6c3";""
"restaurant";"Rumah Makan";"RM BAROKAH";"Sidomulyo, Kec. Banyuasin I, Kab. Banyuasin, Sumatera Selatan 30962";"Kec. Banyuasin I, Kab. Banyuasin";"SUMATERA SELATAN";"30962";"Indonesia";" 089523140600";"";"";"-2.9497437";"105.0025727";"https://maps.google.com/?cid=0x0:0x5c37e8f11c47a2c7";""
"restaurant";"Restoran";"Warung Makan Nuba";"Jl. Sabar Jaya lorong buntu No.30962, RT.17/RW.03, Duren Ijo, Kec. Banyuasin I, Kab. Banyuasin, Sumatera Selatan 30962";"RT.17/RW.03, Duren Ijo, Kec. Banyuasin I, Kab. Banyuasin";"SUMATERA SELATAN";"30962";"Indonesia";" 082371144007";"";"";"-2.9604229";"104.8786564";"https://maps.google.com/?cid=0x0:0xddb37c21f8d376cb";""
"restaurant";"Indonesia";"Bakso Amir";"2V38+F5R, Jl. Srinanti, Sungai Dua, Kec. Rambutan, Kab. Banyuasin, Sumatera Selatan 30967";"Jl. Srinanti, Sungai Dua, Kec. Rambutan, Kab. Banyuasin";"SUMATERA SELATAN";"30967";"Indonesia";" 082178868044";"";"";"-2.9962709";"104.865405";"https://maps.google.com/?cid=0x0:0xb0f50ce3cd3a3e1d";""
"restaurant";"Padang";"RM. Tiyok Dua Purti";"3VF5+3P6, Sidomulyo, Kec. Banyuasin I, Kab. Banyuasin, Sumatera Selatan 30962";"Sidomulyo, Kec. Banyuasin I, Kab. Banyuasin";"SUMATERA SELATAN";"30962";"Indonesia";" 0885832317240";"";"";"-2.9273389";"104.8592744";"https://maps.google.com/?cid=0x0:0x502547ce6d07fae1";""
"restaurant";"Padang";"Rumah Makan Jam Gadang";"2VJF+328, Jl. Sabar Jaya, Ilir, Kec. Banyuasin I, Kab. Banyuasin, Sumatera Selatan 30962";"Jl. Sabar Jaya, Ilir, Kec. Banyuasin I, Kab. Banyuasin";"SUMATERA SELATAN";"30962";"Indonesia";"";"";"";"-2.9698384";"104.8725923";"https://maps.google.com/?cid=0x0:0x228ecdb65cdbf0f8";""
"restaurant";"Padang";"Ampera Baru";"3QXC+JMR, Jl. Pangeran Ayin, Talang Buluh, Kec. Talang Klp., Kab. Banyuasin, Sumatera Selatan 30961";"Jl. Pangeran Ayin, Talang Buluh, Kec. Talang Klp., Kab. Banyuasin";"SUMATERA SELATAN";"30961";"Indonesia";"";"";"";"-2.9008783";"104.7716512";"https://maps.google.com/?cid=0x0:0xa65d8a91b1cdac25";""
"restaurant";"Mi";"BMJ "BLORA MULIA JAYA";"3VH6+VG6, Jl. KR Rojali Desa Merah Mata, Perajen, Kec. Banyuasin I, Kab. Banyuasin, Sumatera Selatan 30962";"Jl. KR Rojali Desa Merah Mata, Perajen, Kec. Banyuasin I, Kab. Banyuasin";"SUMATERA SELATAN";"30962";"Indonesia";" 08981155102";"";"";"-2.9203451";"104.8612573";"https://maps.google.com/?cid=0x0:0x25940bd68688cde0";""
"restaurant";"Toko bahan makanan";"RUMAH MAKAN TIGA BERSAUDARA GRUP";"2WPV+V9, Sebokor, Kec. Air Kumbang, Kab. Banyuasin, Sumatera Selatan 30962";"Sebokor, Kec. Air Kumbang, Kab. Banyuasin";"SUMATERA SELATAN";"30962";"Indonesia";" 081377959036";"";"";"-2.9616805";"104.943871";"https://maps.google.com/?cid=0x0:0x5d3bf7c1a742effe";""
"restaurant";"Nasi";"Warung Nasi Ibu Tira";"2VRH+FVV, Jl. Sabar Jaya, Sungai Gerong, Kec. Banyuasin I, Kab. Banyuasin, Sumatera Selatan 30763";"Jl. Sabar Jaya, Sungai Gerong, Kec. Banyuasin I, Kab. Banyuasin";"SUMATERA SELATAN";"30763";"Indonesia";" 081279029251";"";"";"-2.9587621";"104.8796823";"https://maps.google.com/?cid=0x0:0xf3a118d6c835f671";""
"restaurant";"Pemasok makanan dan minuman katering";"Catering bunda sri wahyuni";"3VG3+HCQ, Lorong Gotong Royong, Mariana Ilir, Kec. Banyuasin I, Kab. Banyuasin, Sumatera Selatan 30962";"Lorong Gotong Royong, Mariana Ilir, Kec. Banyuasin I, Kab. Banyuasin";"SUMATERA SELATAN";"30962";"Indonesia";"";"";"";"-2.9235424";"104.8536098";"https://maps.google.com/?cid=0x0:0x59b8ae8914ab446c";""
"restaurant";"Padang";"RM. Yuda Simpang Empat";"3VG5+GPG, Jl. KR Rojali Desa Merah Mata, Perajen, Kec. Banyuasin I, Kab. Banyuasin, Sumatera Selatan 30962";"Jl. KR Rojali Desa Merah Mata, Perajen, Kec. Banyuasin I, Kab. Banyuasin";"SUMATERA SELATAN";"30962";"Indonesia";" 082278386435";"";"";"-2.9236771";"104.8593279";"https://maps.google.com/?cid=0x0:0x744c1d16e66a8fdb";""
"restaurant";"Restoran";"Waroeng Model Bik Nurma";"3WM4+PMQ, Cinta Manis Lama, Kec. Banyuasin I, Kab. Banyuasin, Sumatera Selatan 30962";"Cinta Manis Lama, Kec. Banyuasin I, Kab. Banyuasin";"SUMATERA SELATAN";"30962";"Indonesia";" 082186334030";"";"";"-2.9156666";"104.9067256";"https://maps.google.com/?cid=0x0:0x7c96c50d5b2b9bba";""
"restaurant";"Bakso";"Bakso Annisa";"4W4R+8VJ, Perambahan, Kec. Banyuasin I, Kab. Banyuasin, Sumatera Selatan 30962";"Perambahan, Kec. Banyuasin I, Kab. Banyuasin";"SUMATERA SELATAN";"30962";"Indonesia";"";"";"";"-2.8941584";"104.9421315";"https://maps.google.com/?cid=0x0:0x115009ad12201c51";""
"restaurant";"Sesuai untuk keluarga";"Warung model  tekwan Bu Ima";"3VF5+R7Q, Sungai Rebo, Kec. Banyuasin I, Kab. Banyuasin, Sumatera Selatan 30962";"Sungai Rebo, Kec. Banyuasin I, Kab. Banyuasin";"SUMATERA SELATAN";"30962";"Indonesia";"";"";"";"-2.9254027";"104.858237";"https://maps.google.com/?cid=0x0:0x885d03264a961deb";""
"restaurant";"Nasi";"Warung Nasi Bu Siti";"2WV9+VJ2, Jl. Inpres, Duren Ijo, Kec. Banyuasin I, Kab. Banyuasin, Sumatera Selatan 30962";"Jl. Inpres, Duren Ijo, Kec. Banyuasin I, Kab. Banyuasin";"SUMATERA SELATAN";"30962";"Indonesia";" 081278660055";"";"";"-2.9553696";"104.9190209";"https://maps.google.com/?cid=0x0:0x2e0598a8f8436c61";""
"restaurant";"Dapur Umum";"Pindang Simpang Tiga";"32P2+47Q, Cinta Manis Baru, Kec. Air Kumbang, Kab. Banyuasin, Sumatera Selatan 30962";"Cinta Manis Baru, Kec. Air Kumbang, Kab. Banyuasin";"SUMATERA SELATAN";"30962";"Indonesia";" 082372922653";"";"";"-2.914657";"105.0007471";"https://maps.google.com/?cid=0x0:0x41435292385259b0";""
"restaurant";"Padang";"RM EMBUN PAGI";"Jl. Husin Basri, Mariana Ilir, Kec. Banyuasin I, Kab. Banyuasin, Sumatera Selatan 30962";"Mariana Ilir, Kec. Banyuasin I, Kab. Banyuasin";"SUMATERA SELATAN";"30962";"Indonesia";" 088272102272";"";"";"-2.9177228";"104.821074";"https://maps.google.com/?cid=0x0:0xd68717c09869c8fc";""
"restaurant";"Rumah Makan";"Rumah makan bintang";"2XWP+5PH, Jl. Inpres, Sidomulyo, Kec. Banyuasin I, Kab. Banyuasin, Sumatera Selatan 30962";"Jl. Inpres, Sidomulyo, Kec. Banyuasin I, Kab. Banyuasin";"SUMATERA SELATAN";"30962";"Indonesia";"";"";"";"-2.9545551";"104.9868566";"https://maps.google.com/?cid=0x0:0xec173d379ef82d1e";""
"restaurant";"Toko bahan makanan";"Toko Dua putra jaya";"4W5R+PWP, Tirta Sari, Kec. Banyuasin I, Kab. Banyuasin, Sumatera Selatan 30962";"Tirta Sari, Kec. Banyuasin I, Kab. Banyuasin";"SUMATERA SELATAN";"30962";"Indonesia";" 085268773689";"";"";"-2.890663";"104.9423159";"https://maps.google.com/?cid=0x0:0xbb06662641a9c2df";""
"restaurant";"Brunch";"WARUNG UMMA (JAJANAN UMMA)";"Jl. Griya Sukamulya Indah 7 Blok F12, RW.7, Mariana Ilir, Kec. Banyuasin I, Kab. Banyuasin, Sumatera Selatan 30962";"RW.7, Mariana Ilir, Kec. Banyuasin I, Kab. Banyuasin";"SUMATERA SELATAN";"30962";"Indonesia";" 082269706643";"";"";"-2.9269027";"104.820846";"https://maps.google.com/?cid=0x0:0x4496d58e08b6bcc4";""
"restaurant";"Restoran";"Warung khania n andini";"2VRH+CR3 iriana, Jl. Sabar Jaya Lrg. Manggis, Perajen, Kec. Banyuasin I, Kab. Banyuasin, Sumatera Selatan";"Kab. Banyuasin, Sumatera Selatan";"SUMATERA SELATAN";"";"Indonesia";"";"";"";"-2.9589845";"104.8795352";"https://maps.google.com/?cid=0x0:0x93ab85d93f1925d9";""
"restaurant";"Restoran";"Waroeng Model Cak Mena";"2VVM+6C9, Unnamed Road, Sungai Gerong, Kec. Banyuasin I, Kab. Banyuasin, Sumatera Selatan 30962";"Unnamed Road, Sungai Gerong, Kec. Banyuasin I, Kab. Banyuasin";"SUMATERA SELATAN";"30962";"Indonesia";" 0895621682337";"";"";"-2.9569603";"104.8835961";"https://maps.google.com/?cid=0x0:0x46b79c007774a121";""
"restaurant";"Bakso";"BAKSO  MIE AYAM "MOROSENENG"";"Jl. Inpres, Duren Ijo, Kec. Banyuasin I, Kab. Banyuasin, Sumatera Selatan 30962";"Duren Ijo, Kec. Banyuasin I, Kab. Banyuasin";"SUMATERA SELATAN";"30962";"Indonesia";" 081367333822";"";"";"-2.9474255";"104.8922263";"https://maps.google.com/?cid=0x0:0xd4298015ff8860cd";""
"restaurant";"Kedai Kopi";"WARUNG KOPI";"jl. inpres perumahan perajin trade center A18, Duren Ijo, Kec. Banyuasin I, Kab. Banyuasin, Sumatera Selatan 30962";"Duren Ijo, Kec. Banyuasin I, Kab. Banyuasin";"SUMATERA SELATAN";"30962";"Indonesia";" 089602666614";"";"";"-2.9492227";"104.9017184";"https://maps.google.com/?cid=0x0:0x85b29135dabfb261";""
"restaurant";"restaurant";"Sumatera Selatan 30971";"Kec. Banyuasin II, Kab. Banyuasin, Sumatera Selatan";"Kab. Banyuasin, Sumatera Selatan";"SUMATERA SELATAN";"";"Indonesia";"";"";"";"-2.1504372";"104.7520939";"https://maps.google.com/?cid=0x0:0x5fe1362809f55e67";""
"restaurant";"Padang";"Rumah makan singgah kudai";"HRWG+PMV, Marga Sungsang, Kec. Banyuasin II, Kab. Banyuasin, Sumatera Selatan 30971";"Marga Sungsang, Kec. Banyuasin II, Kab. Banyuasin";"SUMATERA SELATAN";"30971";"Indonesia";" 082176681368";"";"";"-2.4031412";"104.8266791";"https://maps.google.com/?cid=0x0:0xa0212aebe4bb243a";""
"restaurant";"Padang";"RM DUA PUTRA Z";"Jl. Tj. Api-Api, Marga Sungsang, Kec. Banyuasin II, Kab. Banyuasin, Sumatera Selatan 30971";"Marga Sungsang, Kec. Banyuasin II, Kab. Banyuasin";"SUMATERA SELATAN";"30971";"Indonesia";" 082376621473";"";"";"-2.3737649";"104.817678";"https://maps.google.com/?cid=0x0:0xfd2cf7de74d8717c";""
"restaurant";"Restoran";"Warung Citro Roso";"JVMW+M8W, Lorong Sederhana, RT.010/RW.005, Sungsang I, Kec. Banyuasin II, Kab. Banyuasin, Sumatera Selatan 30971";"Lorong Sederhana, RT.010/RW.005, Sungsang I, Kec. Banyuasin II, Kab. Banyuasin";"SUMATERA SELATAN";"30971";"Indonesia";"";"";"";"-2.3657651";"104.8958285";"https://maps.google.com/?cid=0x0:0xad00062d641f7071";""
"restaurant";"Restoran";"Rumah Makan "Sinar Rantau"";"JVMV+GJF, Sungsang IV, Kec. Banyuasin II, Kab. Banyuasin, Sumatera Selatan 30971";"Sungsang IV, Kec. Banyuasin II, Kab. Banyuasin";"SUMATERA SELATAN";"30971";"Indonesia";" 081224293410";"";"";"-2.3661855";"104.8940358";"https://maps.google.com/?cid=0x0:0x106c7e81ead2ebd2";""
"restaurant";"Restoran";"Rumah Makan Pak Haji";"JRG8+V7G, Rimau Sungsang, Kec. Banyuasin II, Kab. Banyuasin, Sumatera Selatan 30971";"Rimau Sungsang, Kec. Banyuasin II, Kab. Banyuasin";"SUMATERA SELATAN";"30971";"Indonesia";"";"";"";"-2.3728079";"104.8157049";"https://maps.google.com/?cid=0x0:0xfb85fc8b9697b0b";""
"restaurant";"Padang";"Rumah Makan Mbah Man";"PM6G+49Q, Tanah pilihan, Sumber Rejeki, Kec. Banyuasin II, Kab. Banyuasin, Sumatera Selatan 30971";"Tanah pilihan, Sumber Rejeki, Kec. Banyuasin II, Kab. Banyuasin";"SUMATERA SELATAN";"30971";"Indonesia";"";"";"";"-2.289658";"104.675986";"https://maps.google.com/?cid=0x0:0x28d7b6e6fd251d15";""
"restaurant";"Restoran";"Warung SHELLFII 21";"JVW3+742, Sungsang IV, Kec. Banyuasin II, Kab. Banyuasin, Sumatera Selatan 30971";"Sungsang IV, Kec. Banyuasin II, Kab. Banyuasin";"SUMATERA SELATAN";"30971";"Indonesia";" 081274216099";"";"";"-2.354364";"104.852774";"https://maps.google.com/?cid=0x0:0x449373557ea15009";""
"restaurant";"Padang";"Dapoer Mbah Uty(Kuliner khas Nusantara)";"QM3P+V64, Tanah Pilih, Kec. Banyuasin II, Kab. Banyuasin, Sumatera Selatan 30971";"Tanah Pilih, Kec. Banyuasin II, Kab. Banyuasin";"SUMATERA SELATAN";"30971";"Indonesia";" 082175176192";"";"";"-2.24536";"104.6855674";"https://maps.google.com/?cid=0x0:0xb82f91ead0db0723";""
"restaurant";"Brunch";"Rumah makan citra minang";"Jl. Tj. Api-Api, Rimau Sungsang, Kec. Banyuasin II, Kab. Banyuasin, Sumatera Selatan 30971";"Rimau Sungsang, Kec. Banyuasin II, Kab. Banyuasin";"SUMATERA SELATAN";"30971";"Indonesia";"";"";"";"-2.3825854";"104.8348609";"https://maps.google.com/?cid=0x0:0x783df631b010bd3b";""
"restaurant";"Pempek";"PEMPEK UDANG KARMILA";"Jln.Tpi samping penginapan seandainya 2, Sungsang IV, Kec. Banyuasin II, Kab. Banyuasin, Sumatera Selatan 30971";"Sungsang IV, Kec. Banyuasin II, Kab. Banyuasin";"SUMATERA SELATAN";"30971";"Indonesia";" 081278657196";"";"";"-2.3602157";"104.8896463";"https://maps.google.com/?cid=0x0:0xe0573b1e6e8fa435";""
"restaurant";"Restoran";"RM PARIT LIMA";"JRJR+QC2, Sungsang III, Kec. Banyuasin II, Kab. Banyuasin, Sumatera Selatan 30971";"Sungsang III, Kec. Banyuasin II, Kab. Banyuasin";"SUMATERA SELATAN";"30971";"Indonesia";"";"";"";"-2.368122";"104.8410078";"https://maps.google.com/?cid=0x0:0x65a0c56669a11e7a";""
"restaurant";"Restoran";"Pondok Mie "Cafe"";"JVMR+8RR, Marga Sungsang, Kec. Banyuasin II, Kab. Banyuasin, Sumatera Selatan 30971";"Marga Sungsang, Kec. Banyuasin II, Kab. Banyuasin";"SUMATERA SELATAN";"30971";"Indonesia";" 082380837331";"";"";"-2.366641";"104.8920038";"https://maps.google.com/?cid=0x0:0xa30e926c014ee995";""
"restaurant";"Rumah Makan";"Qlozi QD Cafe  Resto";"GQMX+JJ2, Jl. Tj. Api-Api, Tlk. Payo, Kec. Banyuasin II, Kab. Banyuasin, Sumatera Selatan";"Kab. Banyuasin, Sumatera Selatan";"SUMATERA SELATAN";"";"Indonesia";"";"";"";"-2.4659768";"104.7990128";"https://maps.google.com/?cid=0x0:0xb43e199361e2a3b1";""
"restaurant";"Rumah Makan";"Rumah makan DAHLIA";"PMF9+VMG, Tanah Pilih, Kec. Banyuasin II, Kab. Banyuasin, Sumatera Selatan 30971";"Tanah Pilih, Kec. Banyuasin II, Kab. Banyuasin";"SUMATERA SELATAN";"30971";"Indonesia";" 082289255508";"";"";"-2.2753124";"104.6692103";"https://maps.google.com/?cid=0x0:0xbb02f9792b471e2";""
"restaurant";"Brunch";"Cafe and Resto BE";"Jl. Tanjung Api-Api Parit 12 Desa Karang Anyar, Kec, Karang Anyar, Kec. Sumber Marga Telang, Kab. Banyuasin, Sumatera Selatan 30974";"Kec, Karang Anyar, Kec. Sumber Marga Telang, Kab. Banyuasin";"SUMATERA SELATAN";"30974";"Indonesia";" 081270600051";"";"";"-2.5440198";"104.7649591";"https://maps.google.com/?cid=0x0:0x6759a1b4fdf2bc88";""
"restaurant";"Rumah Makan";"Warung mbak indri";"MMQ3+VQ5, Tanah Pilih, Kec. Banyuasin II, Kab. Banyuasin, Sumatera Selatan 30758";"Tanah Pilih, Kec. Banyuasin II, Kab. Banyuasin";"SUMATERA SELATAN";"30758";"Indonesia";"";"";"";"-2.3103629";"104.654485";"https://maps.google.com/?cid=0x0:0x587e6d132f48c21";""
"restaurant";"Padang";"Kedai Namanami";"JRWW+HXQ, Jl. Tj. Api-Api, Marga Sungsang, Kec. Banyuasin II, Kab. Banyuasin, Sumatera Selatan 30971";"Jl. Tj. Api-Api, Marga Sungsang, Kec. Banyuasin II, Kab. Banyuasin";"SUMATERA SELATAN";"30971";"Indonesia";" 081273450255";"";"";"-2.3535299";"104.8474807";"https://maps.google.com/?cid=0x0:0x43ddbecb6ec8e160";""
"restaurant";"Restoran";"Mz Imoenk";"FVWP+C36, Tanjungbaru, Kec. Banyuasin II, Kab. Banyuasin, Sumatera Selatan 30974";"Tanjungbaru, Kec. Banyuasin II, Kab. Banyuasin";"SUMATERA SELATAN";"30974";"Indonesia";" 085268075154";"";"";"-2.5039633";"104.8851493";"https://maps.google.com/?cid=0x0:0xe26bc1d2021be7f0";""
"restaurant";"Restoran";"RM ERNA ARFA";"JR7M+RHX, Jl. Tj. Api-Api, Rimau Sungsang, Kec. Banyuasin II, Kab. Banyuasin, Sumatera Selatan 30971";"Jl. Tj. Api-Api, Rimau Sungsang, Kec. Banyuasin II, Kab. Banyuasin";"SUMATERA SELATAN";"30971";"Indonesia";" 082175809887";"";"";"-2.3853811";"104.8339939";"https://maps.google.com/?cid=0x0:0x673510f0dc62ff08";""
"restaurant";"Kafe";"Brownies Caffe";"Lorong Buyut, Sungsang I, Kec. Banyuasin II, Kab. Banyuasin, Sumatera Selatan 30971";"Sungsang I, Kec. Banyuasin II, Kab. Banyuasin";"SUMATERA SELATAN";"30971";"Indonesia";" 082269507668";"";"";"-2.3611576";"104.894542";"https://maps.google.com/?cid=0x0:0x8c9c63d8dc5d08e8";""
"restaurant";"Padang";"Rm. Minang MaimBau";"HRF8+4M6, Jl. Tj. Api-Api, Marga Sungsang, Kec. Banyuasin II, Kab. Banyuasin, Sumatera Selatan 30971";"Jl. Tj. Api-Api, Marga Sungsang, Kec. Banyuasin II, Kab. Banyuasin";"SUMATERA SELATAN";"30971";"Indonesia";"";"";"";"-2.4272191";"104.8166419";"https://maps.google.com/?cid=0x0:0xe9b58e6ed134358c";""
"restaurant";"Rumah Makan";"Warung Aulia  Dilla";"JVW2+GQC, Sungsang IV, Kec. Banyuasin II, Kab. Banyuasin, Sumatera Selatan 30971";"Sungsang IV, Kec. Banyuasin II, Kab. Banyuasin";"SUMATERA SELATAN";"30971";"Indonesia";" 081379123070";"";"";"-2.3536771";"104.851896";"https://maps.google.com/?cid=0x0:0x36865a5891b06923";""
"restaurant";"Restoran";"WARUNG MAK OSHI";"GVGJ+HQM, Unnamed Road, Tj. Mas, Kec. Banyuasin II, Kab. Banyuasin, Sumatera Selatan 30971";"Unnamed Road, Tj. Mas, Kec. Banyuasin II, Kab. Banyuasin";"SUMATERA SELATAN";"30971";"Indonesia";"";"";"";"-2.473538";"104.881914";"https://maps.google.com/?cid=0x0:0xb392329e5a85f033";""
"restaurant";"Masjid";"Pondok lesehan sungsang";"JVPM+R4, Sungsang IV, Kec. Banyuasin II, Kab. Banyuasin, Sumatera Selatan";"Kab. Banyuasin, Sumatera Selatan";"SUMATERA SELATAN";"";"Indonesia";"";"";"";"-2.3628825";"104.8828627";"https://maps.google.com/?cid=0x0:0xc53b1ce00a03144f";""
"restaurant";"Bakso";"Waroeng Gandrung MAS SISWO";"JX5Q+QM9, Pendowo Harjo, Kec. Makarti Jaya, Kab. Banyuasin, Sumatera Selatan 30972";"Pendowo Harjo, Kec. Makarti Jaya, Kab. Banyuasin";"SUMATERA SELATAN";"30972";"Indonesia";"";"";"";"-2.3905829";"104.9892324";"https://maps.google.com/?cid=0x0:0xad847ae9e0786882";""
"restaurant";"restaurant";"Sumatera Selatan 30911";"Kec. Banyuasin III, Kab. Banyuasin, Sumatera Selatan";"Kab. Banyuasin, Sumatera Selatan";"SUMATERA SELATAN";"";"Indonesia";"";"";"";"-2.8889076";"104.4082908";"https://maps.google.com/?cid=0x0:0xb14bf42d4cbc7c18";""
"restaurant";"Rumah Makan";"Pondok Pindang Rioseli";"496W+2VP, Pangkalan Balai, Kec. Banyuasin III, Kab. Banyuasin, Sumatera Selatan 30911";"Pangkalan Balai, Kec. Banyuasin III, Kab. Banyuasin";"SUMATERA SELATAN";"30911";"Indonesia";" 085367869755";"";"";"-2.8899012";"104.3972004";"https://maps.google.com/?cid=0x0:0xab87ff1d16491ec4";""
"restaurant";"Restoran";"Pusat Kuliner Pangkalan Balai";"3CW6+FHV, Pangkalan Balai, Kec. Banyuasin III, Kab. Banyuasin, Sumatera Selatan 30911";"Pangkalan Balai, Kec. Banyuasin III, Kab. Banyuasin";"SUMATERA SELATAN";"30911";"Indonesia";"";"";"";"-2.903767";"104.4114118";"https://maps.google.com/?cid=0x0:0xddfbf5bd8dd38ff3";""
"restaurant";"Bakso";"Bakso Sido Dadi";"496V+GX9, JL Merdeka, Pangkalan Balai, Kec. Banyuasin III, Kab. Banyuasin, Sumatera Selatan 30911";"JL Merdeka, Pangkalan Balai, Kec. Banyuasin III, Kab. Banyuasin";"SUMATERA SELATAN";"30911";"Indonesia";"";"";"";"-2.8887215";"104.3949752";"https://maps.google.com/?cid=0x0:0x26feafd706e35903";""
"restaurant";"Indonesia";"Rumah Makan Pindang Musi";"3CW6+6P8, Pangkalan Balai, Kec. Banyuasin III, Kab. Banyuasin, Sumatera Selatan 30911";"Pangkalan Balai, Kec. Banyuasin III, Kab. Banyuasin";"SUMATERA SELATAN";"30911";"Indonesia";"";"";"";"-2.9043618";"104.4117624";"https://maps.google.com/?cid=0x0:0xccb1363fa091d41d";""
"restaurant";"Restoran";"Pangkalan balai";"497R+J8F, Jl. Palembang - Betung, Mulya Agung, Kec. Banyuasin III, Kab. Banyuasin, Sumatera Selatan 30913";"Jl. Palembang - Betung, Mulya Agung, Kec. Banyuasin III, Kab. Banyuasin";"SUMATERA SELATAN";"30913";"Indonesia";" 085869514662";"";"";"-2.8859403";"104.3907843";"https://maps.google.com/?cid=0x0:0x1590ae829f1e5655";""
