Category;Real Category;Business Name;Address;City;State;Postal Code;Country;Phone;Email;Website;Latitude;Longitude;Map Link;Details Link
"restaurant";"Restoran";"Bakso Ojo Lali";"XRMG+2RP, Sungai Pinang, Kec. Rambutan, Kab. Banyuasin, Sumatera Selatan 30967";"Sungai Pinang, Kec. Rambutan, Kab. Banyuasin";"SUMATERA SELATAN";"30967";"Indonesia";"";"";"";"-3.0174234";"104.827067";"https://maps.google.com/?cid=0x0:0x902fddf8a9c7b326";""
"restaurant";"Restoran";"Rm. KeluargaMinang";"XR9P+23V, Jl. Kapten Robani Kadir, Pangkalan Gelebak, Kec. Rambutan, Kab. Banyuasin, Sumatera Selatan 30967";"Jl. Kapten Robani Kadir, Pangkalan Gelebak, Kec. Rambutan, Kab. Banyuasin";"SUMATERA SELATAN";"30967";"Indonesia";" 085272092383";"";"";"-3.0323941";"104.8352059";"https://maps.google.com/?cid=0x0:0x6c4df20f0a94b4cd";""
"restaurant";"Rumah Makan";"Rumah tris";"XRJC+HG8, Sungai Pinang, Kec. Rambutan, Kab. Banyuasin, Sumatera Selatan 30967";"Sungai Pinang, Kec. Rambutan, Kab. Banyuasin";"SUMATERA SELATAN";"30967";"Indonesia";" 082178910179";"";"";"-3.0185874";"104.8213323";"https://maps.google.com/?cid=0x0:0xf3e71394aed3c847";""
"restaurant";"Padang";"RM PAK CARMAN";"WVX6+47J, Jl. Raya Sungai Dua, Sako, Kec. Rambutan, Kab. Banyuasin, Sumatera Selatan 30967";"Jl. Raya Sungai Dua, Sako, Kec. Rambutan, Kab. Banyuasin";"SUMATERA SELATAN";"30967";"Indonesia";" 081279034747";"";"";"-3.052154";"104.8606266";"https://maps.google.com/?cid=0x0:0xc8857ee369fb07af";""
"restaurant";"Brunch";"Rumah Makan Cahaya Musi";"Jl. Srinanti Jl. Kp. Bali No.RT 07, Desa Sungai gerong, Kec. Rambutan, Kab. Banyuasin, Sumatera Selatan 30967";"Desa Sungai gerong, Kec. Rambutan, Kab. Banyuasin";"SUMATERA SELATAN";"30967";"Indonesia";"";"";"";"-2.9954512";"104.8652416";"https://maps.google.com/?cid=0x0:0x8749de312c6c18e5";""
"restaurant";"Rumah Makan";"Dapur Ami Falih";"Grand santika Regenci Blok B. No 04, Pangkalan Gelebak, Kec. Rambutan, Kab. Banyuasin, Sumatera Selatan 30967";"Pangkalan Gelebak, Kec. Rambutan, Kab. Banyuasin";"SUMATERA SELATAN";"30967";"Indonesia";" 081379296966";"";"";"-3.0480582";"104.8383448";"https://maps.google.com/?cid=0x0:0x44d98370d3d6842e";""
"restaurant";"Restoran";"RM. NGALIH RASA";"WRWC+RH9, Jl. Lkr. Selatan, Pangkalan Gelebak, Kec. Rambutan, Kab. Banyuasin, Sumatera Selatan 30967";"Jl. Lkr. Selatan, Pangkalan Gelebak, Kec. Rambutan, Kab. Banyuasin";"SUMATERA SELATAN";"30967";"Indonesia";" 081286289094";"";"";"-3.0529614";"104.8214723";"https://maps.google.com/?cid=0x0:0xda9b3466d8bfe62d";""
"restaurant";"Brunch";"Rumah Pindang Komring Singgai Pai";"WRR7+JJX, Jl. Pesantren, Pangkalan Gelebak, Kec. Rambutan, Kab. Banyuasin, Sumatera Selatan 30967";"Jl. Pesantren, Pangkalan Gelebak, Kec. Rambutan, Kab. Banyuasin";"SUMATERA SELATAN";"30967";"Indonesia";" 03178401951";"";"";"-3.0583858";"104.8141078";"https://maps.google.com/?cid=0x0:0xf118eff59d8d2ba";""
"restaurant";"Restoran";"RM. WARDAH";"Jl. Rambutan No.Kel, Pangkalan Gelebak, Kec. Rambutan, Kab. Banyuasin, Sumatera Selatan 30967";"Pangkalan Gelebak, Kec. Rambutan, Kab. Banyuasin";"SUMATERA SELATAN";"30967";"Indonesia";" 081929457419";"";"";"-3.0489769";"104.7831826";"https://maps.google.com/?cid=0x0:0x6ba327fd3f0ba9a7";""
"restaurant";"Rumah Makan";"Warung mama andin";"Lorong Keluarga No.RT 43, rw05, Kec. Rambutan, Kab. Banyuasin, Sumatera Selatan 30267";"rw05, Kec. Rambutan, Kab. Banyuasin";"SUMATERA SELATAN";"30267";"Indonesia";"";"";"";"-3.0288702";"104.8158836";"https://maps.google.com/?cid=0x0:0x490b89a78df5a75";""
"restaurant";"Makanan Kecil";"Pondok makan bude wati";"XRJF+J43, Sungai Pinang, Kec. Rambutan, Kab. Banyuasin, Sumatera Selatan 30967";"Sungai Pinang, Kec. Rambutan, Kab. Banyuasin";"SUMATERA SELATAN";"30967";"Indonesia";" 085783415253";"";"";"-3.0184878";"104.8227839";"https://maps.google.com/?cid=0x0:0xbfa27e861bb09da0";""
"restaurant";"Restoran";"Rumah Makan Pindang Burung wakman";"Sungai Pinang, Kec. Rambutan, Kab. Banyuasin, Sumatera Selatan 30967";"Kec. Rambutan, Kab. Banyuasin";"SUMATERA SELATAN";"30967";"Indonesia";" 081373643901";"";"";"-3.0377808";"104.837262";"https://maps.google.com/?cid=0x0:0xf34096b06e010d8f";""
"restaurant";"Bakso";"Ayam Penyet  Bakso "Cah Tole"";"XRJJ+2CX, Jl. Kapten Robani Kadir, Sungai Pinang, Kec. Rambutan, Kab. Banyuasin, Sumatera Selatan 30967";"Jl. Kapten Robani Kadir, Sungai Pinang, Kec. Rambutan, Kab. Banyuasin";"SUMATERA SELATAN";"30967";"Indonesia";" 082390107727";"";"";"-3.0198793";"104.831096";"https://maps.google.com/?cid=0x0:0x1e32b631a70993fb";""
"restaurant";"Rumah Makan";"Warung Rangkul";"XR3J+5FX, Jl. Lkr. Selatan, Pangkalan Gelebak, Kec. Rambutan, Kab. Banyuasin, Sumatera Selatan 30967";"Jl. Lkr. Selatan, Pangkalan Gelebak, Kec. Rambutan, Kab. Banyuasin";"SUMATERA SELATAN";"30967";"Indonesia";" 08111111011";"";"";"-3.0470217";"104.8312198";"https://maps.google.com/?cid=0x0:0xc795b9deba21e536";""
"restaurant";"Bakso";"Bakso Mas Agus Kalangan";"Pangkalan Gelebak, Kec. Rambutan, Kab. Banyuasin, Sumatera Selatan 30967";"Kec. Rambutan, Kab. Banyuasin";"SUMATERA SELATAN";"30967";"Indonesia";" 081388077703";"";"";"-3.0359233";"104.8363663";"https://maps.google.com/?cid=0x0:0xb3cf0b1c9ae3c02b";""
"restaurant";"Restoran";"Rumah Makan Mak Nyak";"XR7P+PGG, Pangkalan Gelebak, Kec. Rambutan, Kab. Banyuasin, Sumatera Selatan 30967";"Pangkalan Gelebak, Kec. Rambutan, Kab. Banyuasin";"SUMATERA SELATAN";"30967";"Indonesia";" 085377397048";"";"";"-3.0356816";"104.8363256";"https://maps.google.com/?cid=0x0:0xb0b1ba8c6853f84a";""
"restaurant";"Kedai Kopi";"Kedai Bismillah";"WVFH+66Q, Jl. Raya Rambutan, Gelebak Dalam, Kec. Rambutan, Kab. Banyuasin, Sumatera Selatan 30967";"Jl. Raya Rambutan, Gelebak Dalam, Kec. Rambutan, Kab. Banyuasin";"SUMATERA SELATAN";"30967";"Indonesia";" 085268907042";"";"";"-3.0769228";"104.8781037";"https://maps.google.com/?cid=0x0:0xf977518e3a16c245";""
"restaurant";"Rumah Makan";"RM DUA PUTRI";"WVW6+6VW, Jl. Raya Sungai Dua, Sako, Kec. Rambutan, Kab. Banyuasin, Sumatera Selatan 30967";"Jl. Raya Sungai Dua, Sako, Kec. Rambutan, Kab. Banyuasin";"SUMATERA SELATAN";"30967";"Indonesia";"";"";"";"-3.0543812";"104.8622099";"https://maps.google.com/?cid=0x0:0x4ee038ee5fdb5b70";""
"restaurant";"restaurant";"Bryans Road, Maryland 20616";"Bryans Road, Maryland, Amerika Serikat";"Bryans Road, Maryland, Amerika Serikat";"SUMATERA SELATAN";"";"Indonesia";"";"";"";"38.6551092";"-77.0909809";"https://maps.google.com/?cid=0x0:0x8ef06310fe6e66e0";""
"restaurant";"Indonesia";"DAPUR UNIEE";"Jl. Gn. Leuser No.164 Blok K, Tj. Marulak, Kec. Rambutan, Kota Tebing Tinggi, Sumatera Utara 20616";"Tj. Marulak, Kec. Rambutan, Kota Tebing Tinggi";"SUMATERA SELATAN";"20616";"Indonesia";" 081378598337";"";"";"3.3453006";"99.1624412";"https://maps.google.com/?cid=0x0:0x1c4f46637665303b";""
"restaurant";"restaurant";"Warteg Selera, Terminal Kampung Rambutan";"Jl. Bungur No.11, RT.11/RW.6, Rambutan, Kec. Ciracas, Kota Jakarta Timur, Daerah Khusus Ibukota Jakarta 13830";"RT.11/RW.6, Rambutan, Kec. Ciracas, Kota Jakarta Timur";"SUMATERA SELATAN";"13830";"Indonesia";"";"";"";"-6.3082008";"106.8816148";"https://maps.google.com/?cid=0x0:0xebcacde1548136fb";""
"restaurant";"restaurant";"Sumatera Selatan 30967";"Kec. Rambutan, Kab. Banyuasin, Sumatera Selatan";"Kab. Banyuasin, Sumatera Selatan";"SUMATERA SELATAN";"";"Indonesia";"";"";"";"-3.0516914";"104.9155243";"https://maps.google.com/?cid=0x0:0x95c4327726734308";""
"restaurant";"Restoran";"Rumah Makan Wahyu";"XR7P+RF3, Pangkalan Gelebak, Kec. Rambutan, Kab. Banyuasin, Sumatera Selatan 30967";"Pangkalan Gelebak, Kec. Rambutan, Kab. Banyuasin";"SUMATERA SELATAN";"30967";"Indonesia";" 085379411781";"";"";"-3.0354803";"104.8361752";"https://maps.google.com/?cid=0x0:0xfc4e59a053c0d682";""
"restaurant";"Ayam";"Bebek Mas Mun Palembang";"XQ7V+X3F, Jl. Gubernur H. A Bastari, 15 Ulu, Kec. Rambutan, Kab. Banyuasin, Sumatera Selatan 30967";"Jl. Gubernur H. A Bastari, 15 Ulu, Kec. Rambutan, Kab. Banyuasin";"SUMATERA SELATAN";"30967";"Indonesia";" 0887437587814";"";"";"-3.034651";"104.7928759";"https://maps.google.com/?cid=0x0:0xb81cf31485c551d6";""
"restaurant";"Padang";"RM SUNDA MANDIRI";"VWF3+879, Jl. Raya Propinsi, Rambutan, Kec. Rambutan, Kab. Banyuasin, Sumatera Selatan 30967";"Jl. Raya Propinsi, Rambutan, Kec. Rambutan, Kab. Banyuasin";"SUMATERA SELATAN";"30967";"Indonesia";"";"";"";"-3.1267116";"104.9032487";"https://maps.google.com/?cid=0x0:0xc467ca0c896e201b";""
"restaurant";"Restoran";"Rumah Makan Pindang Burung wakman";"Sungai Pinang, Kec. Rambutan, Kab. Banyuasin, Sumatera Selatan 30967";"Kec. Rambutan, Kab. Banyuasin";"SUMATERA SELATAN";"30967";"Indonesia";" 081373643901";"";"";"-3.0377808";"104.837262";"https://maps.google.com/?cid=0x0:0xf34096b06e010d8f";""
"restaurant";"Kedai Kopi";"W'CAFE";"WW5W+CGF, Rambutan, Kec. Rambutan, Kab. Banyuasin, Sumatera Selatan 30967";"Rambutan, Kec. Rambutan, Kab. Banyuasin";"SUMATERA SELATAN";"30967";"Indonesia";" 081377663344";"";"";"-3.0914614";"104.946293";"https://maps.google.com/?cid=0x0:0x15a9c3149a9016b6";""
"restaurant";"Indonesia";"Bakso Amir";"2V38+F5R, Jl. Srinanti, Sungai Dua, Kec. Rambutan, Kab. Banyuasin, Sumatera Selatan 30967";"Jl. Srinanti, Sungai Dua, Kec. Rambutan, Kab. Banyuasin";"SUMATERA SELATAN";"30967";"Indonesia";" 082178868044";"";"";"-2.9962709";"104.865405";"https://maps.google.com/?cid=0x0:0xb0f50ce3cd3a3e1d";""
"restaurant";"Rumah Makan";"Mustopa";"2V67+HM2, Lrg. Akasia 1, Sungai Dua, Kec. Rambutan, Kab. Banyuasin, Sumatera Selatan 30967";"Lrg. Akasia 1, Sungai Dua, Kec. Rambutan, Kab. Banyuasin";"SUMATERA SELATAN";"30967";"Indonesia";"";"";"";"-2.9886207";"104.8641386";"https://maps.google.com/?cid=0x0:0x72c557192f208cf8";""
"restaurant";"Brunch";"Rumah Makan Cahaya Musi";"Jl. Srinanti Jl. Kp. Bali No.RT 07, Desa Sungai gerong, Kec. Rambutan, Kab. Banyuasin, Sumatera Selatan 30967";"Desa Sungai gerong, Kec. Rambutan, Kab. Banyuasin";"SUMATERA SELATAN";"30967";"Indonesia";"";"";"";"-2.9954512";"104.8652416";"https://maps.google.com/?cid=0x0:0x8749de312c6c18e5";""
"restaurant";"Rumah Makan";"Warung Rangkul";"XR3J+5FX, Jl. Lkr. Selatan, Pangkalan Gelebak, Kec. Rambutan, Kab. Banyuasin, Sumatera Selatan 30967";"Jl. Lkr. Selatan, Pangkalan Gelebak, Kec. Rambutan, Kab. Banyuasin";"SUMATERA SELATAN";"30967";"Indonesia";" 08111111011";"";"";"-3.0470217";"104.8312198";"https://maps.google.com/?cid=0x0:0xc795b9deba21e536";""
"restaurant";"Makanan Kecil";"Pondok makan bude wati";"XRJF+J43, Sungai Pinang, Kec. Rambutan, Kab. Banyuasin, Sumatera Selatan 30967";"Sungai Pinang, Kec. Rambutan, Kab. Banyuasin";"SUMATERA SELATAN";"30967";"Indonesia";" 085783415253";"";"";"-3.0184878";"104.8227839";"https://maps.google.com/?cid=0x0:0xbfa27e861bb09da0";""
"restaurant";"Restoran";"Bakso Ojo Lali";"XRMG+2RP, Sungai Pinang, Kec. Rambutan, Kab. Banyuasin, Sumatera Selatan 30967";"Sungai Pinang, Kec. Rambutan, Kab. Banyuasin";"SUMATERA SELATAN";"30967";"Indonesia";"";"";"";"-3.0174234";"104.827067";"https://maps.google.com/?cid=0x0:0x902fddf8a9c7b326";""
"restaurant";"Rumah Makan";"Warung Ujuk Linda";"2V23+F8C, Sungai Dua, Kec. Rambutan, Kab. Banyuasin, Sumatera Selatan 30967";"Sungai Dua, Kec. Rambutan, Kab. Banyuasin";"SUMATERA SELATAN";"30967";"Indonesia";" 088269508522";"";"";"-2.9988183";"104.8532511";"https://maps.google.com/?cid=0x0:0x930b4079d6ea8dd8";""
"restaurant";"Restoran";"RM. WARDAH";"Jl. Rambutan No.Kel, Pangkalan Gelebak, Kec. Rambutan, Kab. Banyuasin, Sumatera Selatan 30967";"Pangkalan Gelebak, Kec. Rambutan, Kab. Banyuasin";"SUMATERA SELATAN";"30967";"Indonesia";" 081929457419";"";"";"-3.0489769";"104.7831826";"https://maps.google.com/?cid=0x0:0x6ba327fd3f0ba9a7";""
"restaurant";"Restoran";"RM. NGALIH RASA";"WRWC+RH9, Jl. Lkr. Selatan, Pangkalan Gelebak, Kec. Rambutan, Kab. Banyuasin, Sumatera Selatan 30967";"Jl. Lkr. Selatan, Pangkalan Gelebak, Kec. Rambutan, Kab. Banyuasin";"SUMATERA SELATAN";"30967";"Indonesia";" 081286289094";"";"";"-3.0529614";"104.8214723";"https://maps.google.com/?cid=0x0:0xda9b3466d8bfe62d";""
"restaurant";"Pempek";"PEMPEK MAMA2AHMED";"Perum. Ya Saman Cindo I No 5, Jl. Raya Propinsi, Rambutan, Kec. Rambutan, Kab. Banyuasin, Sumatera Selatan 30967";"Jl. Raya Propinsi, Rambutan, Kec. Rambutan, Kab. Banyuasin";"SUMATERA SELATAN";"30967";"Indonesia";" 081373627060";"";"";"-3.1273451";"104.9038051";"https://maps.google.com/?cid=0x0:0x833df9b494e9a752";""
"restaurant";"Kedai Kopi";"Kedai Bismillah";"WVFH+66Q, Jl. Raya Rambutan, Gelebak Dalam, Kec. Rambutan, Kab. Banyuasin, Sumatera Selatan 30967";"Jl. Raya Rambutan, Gelebak Dalam, Kec. Rambutan, Kab. Banyuasin";"SUMATERA SELATAN";"30967";"Indonesia";" 085268907042";"";"";"-3.0769228";"104.8781037";"https://maps.google.com/?cid=0x0:0xf977518e3a16c245";""
"restaurant";"Katering";"Catering Anggita";"jalan cendana no.1921 kampung bali, Mariana, Kec. Rambutan, Kab. Banyuasin, Sumatera Selatan 30967";"Mariana, Kec. Rambutan, Kab. Banyuasin";"SUMATERA SELATAN";"30967";"Indonesia";" 082282514395";"";"";"-2.9986209";"104.8692706";"https://maps.google.com/?cid=0x0:0x74578204c140603c";""
"restaurant";"Brunch";"Warung W.Z";"Jl. Lkr. Selatan No.Desa, Sungai Pinang, Kec. Rambutan, Kab. Banyuasin, Sumatera Selatan 30967";"Sungai Pinang, Kec. Rambutan, Kab. Banyuasin";"SUMATERA SELATAN";"30967";"Indonesia";" 081210633419";"";"";"-3.0406816";"104.8343875";"https://maps.google.com/?cid=0x0:0xd4198685d61f8b7";""
"restaurant";"Padang";"RM PAK CARMAN";"WVX6+47J, Jl. Raya Sungai Dua, Sako, Kec. Rambutan, Kab. Banyuasin, Sumatera Selatan 30967";"Jl. Raya Sungai Dua, Sako, Kec. Rambutan, Kab. Banyuasin";"SUMATERA SELATAN";"30967";"Indonesia";" 081279034747";"";"";"-3.052154";"104.8606266";"https://maps.google.com/?cid=0x0:0xc8857ee369fb07af";""
"restaurant";"Rumah Makan";"Rumah tris";"XRJC+HG8, Sungai Pinang, Kec. Rambutan, Kab. Banyuasin, Sumatera Selatan 30967";"Sungai Pinang, Kec. Rambutan, Kab. Banyuasin";"SUMATERA SELATAN";"30967";"Indonesia";" 082178910179";"";"";"-3.0185874";"104.8213323";"https://maps.google.com/?cid=0x0:0xf3e71394aed3c847";""
"restaurant";"Restoran";"TAS AYAM BAKAR KULINER";"VWP2+QWQ, Jl. Raya Propinsi, Rambutan, Kec. Rambutan, Kab. Banyuasin, Sumatera Selatan 30967";"Jl. Raya Propinsi, Rambutan, Kec. Rambutan, Kab. Banyuasin";"SUMATERA SELATAN";"30967";"Indonesia";" 082184774744";"";"";"-3.1130417";"104.9023496";"https://maps.google.com/?cid=0x0:0x2c4d477058052c93";""
"restaurant";"Pempek";"warung pempek arina";"VWWW+H2P, Jl. Kab., Rambutan, Kec. Rambutan, Kab. Banyuasin, Sumatera Selatan 30967";"Jl. Kab., Rambutan, Kec. Rambutan, Kab. Banyuasin";"SUMATERA SELATAN";"30967";"Indonesia";"";"";"";"-3.102953";"104.945805";"https://maps.google.com/?cid=0x0:0x662b22d32015ec61";""
"restaurant";"Toko";"Warung ivana";"WX3M+H2H, Jl. Raya Palembang, Tanah Lembak, Kec. Rambutan, Kab. Banyuasin, Sumatera Selatan 30967";"Jl. Raya Palembang, Tanah Lembak, Kec. Rambutan, Kab. Banyuasin";"SUMATERA SELATAN";"30967";"Indonesia";" 085223063387";"";"";"-3.0960557";"104.9826159";"https://maps.google.com/?cid=0x0:0x87e580e1de52845a";""
"restaurant";"Padang";"RM AMPERA MUSI";"WVQ6+X8P, Jl. Raya Sungai Dua, Sako, Kec. Rambutan, Kab. Banyuasin, Sumatera Selatan 30967";"Jl. Raya Sungai Dua, Sako, Kec. Rambutan, Kab. Banyuasin";"SUMATERA SELATAN";"30967";"Indonesia";" 085380757377";"";"";"-3.0600463";"104.8608328";"https://maps.google.com/?cid=0x0:0xc9085ceea7f39893";""
"restaurant";"Kedai Kopi";"cafe Rambutan";"duren seribu rt 01 rw 01, Duren Seribu, Kec. Bojongsari, Kota Depok, Jawa Barat 16518";"Duren Seribu, Kec. Bojongsari, Kota Depok";"SUMATERA SELATAN";"16518";"Indonesia";"";"";"";"-6.4299442";"106.7391491";"https://maps.google.com/?cid=0x0:0x35507832d923f6fc";""
"restaurant";"Restoran";"Rumah makan saung kebon rambutan";"Q32F+JJQ DS s, Jl. Sentosa Jl. Sasak Tiga, RT.01/RW.03, Tridaya Sakti, Kec. Tambun Sel., Kabupaten Bekasi, Jawa Barat 17510";"Jl. Sentosa Jl. Sasak Tiga, RT.01/RW.03, Tridaya Sakti, Kec. Tambun Sel., Kabupaten Bekasi";"SUMATERA SELATAN";"17510";"Indonesia";" 08568610910";"";"";"-6.2484057";"107.0741125";"https://maps.google.com/?cid=0x0:0x1deca808f796b828";""
"restaurant";"Kedai Kopi";"Pos Rambutan";"Jl. Rinjani No.20a, Bojong Nangka, Kec. Gn. Putri, Kabupaten Bogor, Jawa Barat 16962";"Bojong Nangka, Kec. Gn. Putri, Kabupaten Bogor";"SUMATERA SELATAN";"16962";"Indonesia";"";"";"";"-6.4337509";"106.9101944";"https://maps.google.com/?cid=0x0:0x48fc210801d6db50";""
"restaurant";"Padang";"PONDOK SALERO";"Jl. Tanah Merdeka No.Rt. 09, RT.9/RW.2, Rambutan, Kec. Ciracas, Kota Jakarta Timur, Daerah Khusus Ibukota Jakarta 13830";"RT.9/RW.2, Rambutan, Kec. Ciracas, Kota Jakarta Timur";"SUMATERA SELATAN";"13830";"Indonesia";" 081324262734";"";"";"-6.3037541";"106.869377";"https://maps.google.com/?cid=0x0:0xe90390a23dc576b5";""
"restaurant";"Padang";"Rm. Siran serba 10000ribu.masakan padang";"Lebung, Kec. Rantau Bayur, Kab. Banyuasin, Sumatera Selatan 30968";"Kec. Rantau Bayur, Kab. Banyuasin";"SUMATERA SELATAN";"30968";"Indonesia";" 085709848784";"";"";"-2.988094";"104.3948006";"https://maps.google.com/?cid=0x0:0xd38e17d4bd598418";""
"restaurant";"Makanan Kecil";"Bakso Santy";"2HG7+6RG, Talang Kemang, Kec. Rantau Bayur, Kab. Banyuasin, Sumatera Selatan 30968";"Talang Kemang, Kec. Rantau Bayur, Kab. Banyuasin";"SUMATERA SELATAN";"30968";"Indonesia";"";"";"";"-2.9744332";"104.564568";"https://maps.google.com/?cid=0x0:0x23245fff1b23b06c";""
"restaurant";"Rumah Makan";"Seblak  Suki bakar Hannayuri";"2HF6+VQ3, Talang Kemang, Kec. Rantau Bayur, Kab. Banyuasin, Sumatera Selatan 30968";"Talang Kemang, Kec. Rantau Bayur, Kab. Banyuasin";"SUMATERA SELATAN";"30968";"Indonesia";"";"";"";"-2.9753735";"104.5619227";"https://maps.google.com/?cid=0x0:0x154458dfcc4a8270";""
"restaurant";"Padang";"Rumah bpk Herli Mandala putra, S.Pd";"4642+GPX, Jl. Raya Purwosari, Paldas, Kec. Rantau Bayur, Kab. Banyuasin, Sumatera Selatan 30968";"Jl. Raya Purwosari, Paldas, Kec. Rantau Bayur, Kab. Banyuasin";"SUMATERA SELATAN";"30968";"Indonesia";" 082175097889";"";"";"-2.8936307";"104.2018733";"https://maps.google.com/?cid=0x0:0x7e58327b1c83efd1";""
"restaurant";"Bakso";"Gorengan Wati";"25JC+RJH, Paldas, Kec. Rantau Bayur, Kab. Banyuasin, Sumatera Selatan 30968";"Paldas, Kec. Rantau Bayur, Kab. Banyuasin";"SUMATERA SELATAN";"30968";"Indonesia";" 085789201864";"";"";"-2.9679464";"104.171596";"https://maps.google.com/?cid=0x0:0x7bf2f571d341d5d7";""
"restaurant";"Sarapan";"WARUNG PASUNDAN";"298X+954, Lebung, Kec. Rantau Bayur, Kab. Banyuasin, Sumatera Selatan 30968";"Lebung, Kec. Rantau Bayur, Kab. Banyuasin";"SUMATERA SELATAN";"30968";"Indonesia";"";"";"";"-2.9842222";"104.3979288";"https://maps.google.com/?cid=0x0:0xfbb90e10261afce6";""
"restaurant";"Sate";"Pondok sate mang yet";"4652+FM7, Paldas, Kec. Rantau Bayur, Kab. Banyuasin, Sumatera Selatan 30968";"Paldas, Kec. Rantau Bayur, Kab. Banyuasin";"SUMATERA SELATAN";"30968";"Indonesia";"";"";"";"-2.8913233";"104.2016698";"https://maps.google.com/?cid=0x0:0xb9a7f8adfa0e589f";""
"restaurant";"Restoran";"Sate kambing ujuk Anggi";"XH3V+PJQ, Sungai Pinang, Kec. Rantau Bayur, Kab. Banyuasin, Sumatera Selatan 30968";"Sungai Pinang, Kec. Rantau Bayur, Kab. Banyuasin";"SUMATERA SELATAN";"30968";"Indonesia";"";"";"";"-3.0456517";"104.5941232";"https://maps.google.com/?cid=0x0:0xf36f644464cbb86";""
"restaurant";"Bakso";"Warung bakso mbak puji";"Paldas, Kec. Rantau Bayur, Kab. Banyuasin, Sumatera Selatan 30968";"Kec. Rantau Bayur, Kab. Banyuasin";"SUMATERA SELATAN";"30968";"Indonesia";" 085367296932";"";"";"-2.9356566";"104.1982754";"https://maps.google.com/?cid=0x0:0xe17f56611d74daca";""
"restaurant";"Komplek perumahan";"Rumah gede rus";"275M+M6C, Jalan Pangeran Nuhasan, Tebing Abang, Kec. Rantau Bayur, Kab. Banyuasin, Sumatera Selatan 30968";"Jalan Pangeran Nuhasan, Tebing Abang, Kec. Rantau Bayur, Kab. Banyuasin";"SUMATERA SELATAN";"30968";"Indonesia";"";"";"";"-2.9908707";"104.2829521";"https://maps.google.com/?cid=0x0:0x8b2cfb2ade086ece";""
"restaurant";"Toko umum";"KEDAI SHAKA";"2874+RXG, Tebing Abang, Kec. Rantau Bayur, Kab. Banyuasin, Sumatera Selatan 30968";"Tebing Abang, Kec. Rantau Bayur, Kab. Banyuasin";"SUMATERA SELATAN";"30968";"Indonesia";"";"";"";"-2.9854319";"104.3074474";"https://maps.google.com/?cid=0x0:0xbb209018873228";""
"restaurant";"Toko Makanan";"Sarapan Pagi Dira desa lebung";"297W+49G, Rantau Harapan, Kec. Rantau Bayur, Kab. Banyuasin, Sumatera Selatan 30968";"Rantau Harapan, Kec. Rantau Bayur, Kab. Banyuasin";"SUMATERA SELATAN";"30968";"Indonesia";" 085268833136";"";"";"-2.9871949";"104.3959646";"https://maps.google.com/?cid=0x0:0x6fcc96d3684f7c52";""
"restaurant";"Padang";"RUMAH MAKAN SIMPANG EMPAT";"493W+MW7, ji, Jl. Lubuk Saung, Pangkalan Balai, Kec. Banyuasin III, Kab. Banyuasin, Sumatera Selatan 30913";"ji, Jl. Lubuk Saung, Pangkalan Balai, Kec. Banyuasin III, Kab. Banyuasin";"SUMATERA SELATAN";"30913";"Indonesia";"";"";"";"-2.8958339";"104.3973072";"https://maps.google.com/?cid=0x0:0x3b783775a44bb89e";""
"restaurant";"Restoran";"Warung Mila";"XJR7+FFW, Sementul, Kec. Rantau Bayur, Kab. Banyuasin, Sumatera Selatan 30968";"Sementul, Kec. Rantau Bayur, Kab. Banyuasin";"SUMATERA SELATAN";"30968";"Indonesia";"";"";"";"-3.0087625";"104.6137031";"https://maps.google.com/?cid=0x0:0xc8891c2161f382a7";""
"restaurant";"Bakso";"Warung bobot";"X786+8RH, Unnamed Road, Tj. Tiga, Kec. Rantau Bayur, Kab. Banyuasin, Sumatera Selatan 30968";"Unnamed Road, Tj. Tiga, Kec. Rantau Bayur, Kab. Banyuasin";"SUMATERA SELATAN";"30968";"Indonesia";" 082268150826";"";"";"-3.0341972";"104.2620983";"https://maps.google.com/?cid=0x0:0xff630446c2a915bb";""
"restaurant";"Restoran";"Rumah Makan Palapa";"3CJC+GXP, Pangkalan Balai, Kec. Banyuasin III, Kab. Banyuasin, Sumatera Selatan 30914";"Pangkalan Balai, Kec. Banyuasin III, Kab. Banyuasin";"SUMATERA SELATAN";"30914";"Indonesia";"";"";"";"-2.9186747";"104.4224559";"https://maps.google.com/?cid=0x0:0x6cab1cca0a2eeb60";""
"restaurant";"Nasi";"RM Serba 10 Ribu Kayuara Kuning";"3CHF+CGM, Jl. Raya Palembang - Jambi, Kayuara Kuning, Kec. Banyuasin III, Kab. Banyuasin, Sumatera Selatan 30914";"Jl. Raya Palembang - Jambi, Kayuara Kuning, Kec. Banyuasin III, Kab. Banyuasin";"SUMATERA SELATAN";"30914";"Indonesia";"";"";"";"-2.9214247";"104.4237845";"https://maps.google.com/?cid=0x0:0x4d5f43f5a22a94ed";""
"restaurant";"Indonesia";"Rumah Makan Pindang Musi";"3CW6+6P8, Pangkalan Balai, Kec. Banyuasin III, Kab. Banyuasin, Sumatera Selatan 30911";"Pangkalan Balai, Kec. Banyuasin III, Kab. Banyuasin";"SUMATERA SELATAN";"30911";"Indonesia";"";"";"";"-2.9043618";"104.4117624";"https://maps.google.com/?cid=0x0:0xccb1363fa091d41d";""
"restaurant";"Kedai Kopi";"Warung Bebek 08";"4C25+3CP, Jl. Raya Palembang - Jambi, Pangkalan Balai, Kec. Banyuasin III, Kab. Banyuasin, Sumatera Selatan 30911";"Jl. Raya Palembang - Jambi, Pangkalan Balai, Kec. Banyuasin III, Kab. Banyuasin";"SUMATERA SELATAN";"30911";"Indonesia";" 081374757174";"";"";"-2.8997926";"104.4085683";"https://maps.google.com/?cid=0x0:0x9d0f6d0394848ae6";""
"restaurant";"Ayam";"ayam geperek mbak tutut";"298X+7C, Rantau Harapan, Kec. Rantau Bayur, Kab. Banyuasin, Sumatera Selatan 30968";"Rantau Harapan, Kec. Rantau Bayur, Kab. Banyuasin";"SUMATERA SELATAN";"30968";"Indonesia";" 085366009229";"";"";"-2.984231";"104.3986441";"https://maps.google.com/?cid=0x0:0x27948b0ba259d6ab";""
"restaurant";"Restoran";"RM DUO AL";"R74G+WHH, Sukarami, Kec. Sungai Rotan, Kabupaten Muara Enim, Sumatera Selatan 31357";"Sukarami, Kec. Sungai Rotan, Kabupaten Muara Enim";"SUMATERA SELATAN";"31357";"Indonesia";" 085267383103";"";"";"-3.1926891";"104.2764789";"https://maps.google.com/?cid=0x0:0xa75ed8005bc19946";""
"restaurant";"Restoran";"Waroeng sultan";"Jl. Raya Palembang - Jambi, Kayuara Kuning, Kec. Banyuasin III, Kab. Banyuasin, Sumatera Selatan 30914";"Kayuara Kuning, Kec. Banyuasin III, Kab. Banyuasin";"SUMATERA SELATAN";"30914";"Indonesia";" 081367557346";"";"";"-2.920615";"104.4234838";"https://maps.google.com/?cid=0x0:0x2ed47979ed6f2f6";""
"restaurant";"restaurant";"Sumatera Selatan 30968";"Kab. Banyuasin, Sumatera Selatan";"Kab. Banyuasin, Sumatera Selatan";"SUMATERA SELATAN";"";"Indonesia";"";"";"";"-3.0378016";"104.5189214";"https://maps.google.com/?cid=0x0:0x2787661e3bc73d51";""
"restaurant";"Minimarket";"MM Resto Ratih  Alif";"3HC2+Q9G, Lalang Sembawa, Kec. Sembawa, Kab. Banyuasin, Sumatera Selatan 30953";"Lalang Sembawa, Kec. Sembawa, Kab. Banyuasin";"SUMATERA SELATAN";"30953";"Indonesia";"";"";"";"-2.9280747";"104.5509449";"https://maps.google.com/?cid=0x0:0xf791fe1addcf30e3";""
"restaurant";"Sate";"Rumah makan Kak Alvin";"XH4W+2FJ, Sungai Pinang, Kec. Rantau Bayur, Kab. Banyuasin, Sumatera Selatan 30968";"Sungai Pinang, Kec. Rantau Bayur, Kab. Banyuasin";"SUMATERA SELATAN";"30968";"Indonesia";"";"";"";"-3.0449054";"104.5961429";"https://maps.google.com/?cid=0x0:0xfc4975c968a428f";""
"restaurant";"Nasi";"RUMAH MAKAN SAHABAT PADANG";"Dusun 1 Desa, arisan musi, Kec. Rantau Bayur, Kabupaten Muara Enim, Sumatera Selatan 31171";"arisan musi, Kec. Rantau Bayur, Kabupaten Muara Enim";"SUMATERA SELATAN";"31171";"Indonesia";" 082387045158";"";"";"-3.0384856";"104.5579721";"https://maps.google.com/?cid=0x0:0xdd016d2f4b3b6a62";""
"restaurant";"Restoran";"RM Berokah";"3FFW+CC2, Terlangu, Kec. Banyuasin III, Kab. Banyuasin, Sumatera Selatan 30953";"Terlangu, Kec. Banyuasin III, Kab. Banyuasin";"SUMATERA SELATAN";"30953";"Indonesia";"";"";"";"-2.9264987";"104.4960073";"https://maps.google.com/?cid=0x0:0xd5e64ad9a4ec3b78";""
"restaurant";"Bakso";"Bakso, Mie Ayam, Siomai "BANDOENG"";"Talang Baru Sukarela, Sementul, Kec. Rantau Bayur, Kab. Banyuasin, Sumatera Selatan";"Kab. Banyuasin, Sumatera Selatan";"SUMATERA SELATAN";"";"Indonesia";"";"";"";"-3.011155";"104.6091524";"https://maps.google.com/?cid=0x0:0x17f7aca90059192";""
