Category;Real Category;Business Name;Address;City;State;Postal Code;Country;Phone;Email;Website;Latitude;Longitude;Map Link;Details Link
"hardware store";"Dealer mobil";"Semoga Jaya Ban Dan Spare Part Mobil";"Jl. Lintas Sumatra No.Km.46, Kedondong Raye, Kec. Banyuasin III, Kab. Banyuasin, Sumatera Selatan 30912";"Kedondong Raye, Kec. Banyuasin III, Kab. Banyuasin";"SUMATERA SELATAN";"30912";"Indonesia";" 081389997101";"";"";"-2.8810628";"104.3861231";"https://maps.google.com/?cid=0x0:0x45ecd715935e3d8a";""
"hardware store";"Toko Bahan Bangunan";"Toko Tiga S";"498R+322, Jl. Lintas Sumatra, Pangkalan Balai, Kec. Banyuasin III, Kab. Banyuasin, Sumatera Selatan 30913";"Jl. Lintas Sumatra, Pangkalan Balai, Kec. Banyuasin III, Kab. Banyuasin";"SUMATERA SELATAN";"30913";"Indonesia";" 087748469241";"";"";"-2.8848509";"104.3900254";"https://maps.google.com/?cid=0x0:0x40fdd7e0db67cbc3";""
"hardware store";"Toko Bahan Bangunan";"Toko Teknik Serba Guna";"Jl. Palembang - Betung No.228, Sukodadi, Kec. Sukarami, Kab. Banyuasin, Sumatera Selatan 30961";"Sukodadi, Kec. Sukarami, Kab. Banyuasin";"SUMATERA SELATAN";"30961";"Indonesia";" 0895327064947";"";"";"-2.9132459";"104.6788853";"https://maps.google.com/?cid=0x0:0x400fca7d517a7557";""
"hardware store";"Kantor Pemerintah";"Kantor Camat Sembawa";"3GQQ+MG2, Lalang Sembawa, Kec. Sembawa, Kab. Banyuasin, Sumatera Selatan 30953";"Lalang Sembawa, Kec. Sembawa, Kab. Banyuasin";"SUMATERA SELATAN";"30953";"Indonesia";"";"";"";"-2.9108679";"104.5387577";"https://maps.google.com/?cid=0x0:0x66805e1ce97cbcd4";""
"hardware store";"Toko Bahan Bangunan";"Tb. Sentosa Tanah Mas";"Jl. Tanah Mas Blok S No. 10, Tanah MAS, Kec. Talang Klp., Kab. Banyuasin, Sumatera Selatan 30961";"Tanah MAS, Kec. Talang Klp., Kab. Banyuasin";"SUMATERA SELATAN";"30961";"Indonesia";" 085367973362";"";"";"-2.9170267";"104.6667995";"https://maps.google.com/?cid=0x0:0x18ef3021836ea0b8";""
"hardware store";"Toko Alat Tulis";"Arteka Stationery";"Jalan printis no 16 rt 33 rw 07. kel. Sukamoro kec. Talang Kelapa Banyuasin, km19, Kab. Banyuasin, Sumatera Selatan 30961";"km19, Kab. Banyuasin";"SUMATERA SELATAN";"30961";"Indonesia";" 089603716715";"";"";"-2.9234212";"104.62927";"https://maps.google.com/?cid=0x0:0xaded4e23b78a9241";""
"hardware store";"Toko Bahan Bangunan";"TB ANUGRAH UTAMA";"Jl Palembang Betung KM 35 Desa Langkan, Terlangu, Kec. Banyuasin III, Banyuasin, Sumatera Selatan 30953";"Terlangu, Kec. Banyuasin III, Banyuasin";"SUMATERA SELATAN";"30953";"Indonesia";" 08127813990";"";"";"-2.9243787";"104.4943615";"https://maps.google.com/?cid=0x0:0xe785ad9f62810a94";""
"hardware store";"Toko Cat";"TOKO CAT CENTRAL WARNA";"depan amazy resto, Jl. Palembang - Betung No.km19, Sukamoro, Kec. Talang Klp., Kota Palembang, Sumatera Selatan";"Kota Palembang, Sumatera Selatan";"SUMATERA SELATAN";"";"Indonesia";" 082132313338";"";"";"-2.915482";"104.6281518";"https://maps.google.com/?cid=0x0:0xb8d3ddb8b4e19414";""
"hardware store";"Toko Alat Tulis";"PERCETAKAN AGRA";"Jalan Palembang - Betung, Langkan, Banyu Asin III, Lubuk Saung, Kec. Banyuasin III, Kab. Banyuasin, Sumatera Selatan 30375";"Langkan, Banyu Asin III, Lubuk Saung, Kec. Banyuasin III, Kab. Banyuasin";"SUMATERA SELATAN";"30375";"Indonesia";" 081367611125";"";"";"-2.9239643";"104.4521451";"https://maps.google.com/?cid=0x0:0x44e470575f561fb6";""
"hardware store";"Toko Bahan Bangunan";"TB. Lionel Jaya";"Jl. Raya Palembang - Jambi, Sukamoro, Kec. Talang Klp., Kab. Banyuasin, Sumatera Selatan 30196";"Sukamoro, Kec. Talang Klp., Kab. Banyuasin";"SUMATERA SELATAN";"30196";"Indonesia";" 081532701363";"";"";"-2.913322";"104.6496591";"https://maps.google.com/?cid=0x0:0xa435e7e63325711";""
"hardware store";"Toko";"TB Bernai Jaya";"494P+RX4, Jalan, Kedondong Raye, Banyuasin III, Banyuasin Regency, South Sumatra 30913";"Jalan, Kedondong Raye, Banyuasin III, Banyuasin Regency";"SUMATERA SELATAN";"30913";"Indonesia";" 081373266259";"";"";"-2.8929829";"104.38745";"https://maps.google.com/?cid=0x0:0xcf2c86ccdc8d4211";""
"hardware store";"hardware store";"Eka kentus";"Desa margorukun, Pangkalan Balai, Kec. Banyuasin III, Palembang, Sumatera Selatan 30911";"Pangkalan Balai, Kec. Banyuasin III, Palembang";"SUMATERA SELATAN";"30911";"Indonesia";" 082236517791";"";"";"-2.8889076";"104.4082908";"https://maps.google.com/?cid=0x0:0x35be8c4fe84e8781";""
"hardware store";"Toko Perlengkapan Rumah";"MR DIY PANGKALAN BALAI";"Pangkalan Balai, Kec. Banyuasin III, Kab. Banyuasin, Sumatera Selatan";"Kab. Banyuasin, Sumatera Selatan";"SUMATERA SELATAN";"";"Indonesia";"";"";"";"-2.8868131";"104.3917061";"https://maps.google.com/?cid=0x0:0x5a52c4a42dd1aedd";""
"hardware store";"Toko Peralatan Pangkas Rambut";"Toko ATK Zidan";"Jalan Limas, LK III Depan Masjid Al Muttaqin No.Kel, RT.13/RW.06, Air Batu, Kec. Talang Klp., Kab. Banyuasin, Sumatera Selatan 30961";"LK III Depan Masjid Al Muttaqin No.Kel, RT.13/RW.06, Air Batu, Kec. Talang Klp., Kab. Banyuasin";"SUMATERA SELATAN";"30961";"Indonesia";" 081273205707";"";"";"-2.909146";"104.6256804";"https://maps.google.com/?cid=0x0:0x8054a44e794756f5";""
"hardware store";"hardware store";"Kec. Suak Tapeh";"Kab. Banyuasin, Sumatera Selatan";"Kab. Banyuasin, Sumatera Selatan";"SUMATERA SELATAN";"";"Indonesia";"";"";"";"-2.8563812";"104.3385609";"https://maps.google.com/?cid=0x0:0xa34d34a7b370319d";""
"hardware store";"Toko Bahan Bangunan";"Toko Harapan Baru";"Lubuk Lancang, Kec. Suak Tapeh, Kab. Banyuasin, Sumatera Selatan 30958";"Kec. Suak Tapeh, Kab. Banyuasin";"SUMATERA SELATAN";"30958";"Indonesia";"";"";"";"-2.8563376";"104.3361403";"https://maps.google.com/?cid=0x0:0xb3f0683d1bcf4ba6";""
"hardware store";"Toko Alat Listrik";"TOKO BANGUNAN  ALAT LISTRIK WAWAN";"Jl. Palembang - Betung, RT.15/RW.004, Lingkungan 2, Pulau Rajak, Kec. Betung, Kab. Banyuasin, Sumatera Selatan 30958";"RT.15/RW.004, Lingkungan 2, Pulau Rajak, Kec. Betung, Kab. Banyuasin";"SUMATERA SELATAN";"30958";"Indonesia";" 0895636538291";"";"";"-2.8509619";"104.239982";"https://maps.google.com/?cid=0x0:0x45f0a902540b484";""
"hardware store";"Toko Perlengkapan Rumah";"MR. DIY Tana Jaya Betung";"567F+39P, Jl. Raya Palembang - Jambi, Taja Jaya Raya I, Kec. Betung, Kab. Banyuasin, Sumatera Selatan 30958";"Jl. Raya Palembang - Jambi, Taja Jaya Raya I, Kec. Betung, Kab. Banyuasin";"SUMATERA SELATAN";"30958";"Indonesia";"";"";"";"-2.8377905";"104.2228919";"https://maps.google.com/?cid=0x0:0xb6afff295ee02c79";""
"hardware store";"Toko Bahan Bangunan";"TB. Benggala";"46XJ+WH6, Jl. Raya Palembang - Jambi, Pulau Rajak, Kec. Betung, Kab. Banyuasin, Sumatera Selatan 30958";"Jl. Raya Palembang - Jambi, Pulau Rajak, Kec. Betung, Kab. Banyuasin";"SUMATERA SELATAN";"30958";"Indonesia";"";"";"";"-2.8502239";"104.2313974";"https://maps.google.com/?cid=0x0:0x8565be895a451013";""
"hardware store";"Toko Fotokopi";"SUARNA GRAFIKA Fotocopy";"Jalan Simpang Pasar Pagi, Rimba Asam, Kec. Betung, Kab. Banyuasin, Sumatera Selatan 30758";"Rimba Asam, Kec. Betung, Kab. Banyuasin";"SUMATERA SELATAN";"30758";"Indonesia";" 082184777711";"";"";"-2.8496964";"104.2303688";"https://maps.google.com/?cid=0x0:0xba12a644cca97747";""
"hardware store";"Toko Bahan Bangunan";"Tb. Barokah 313";"554V+FJR, Jl. Betung - Sekayu, Taja Jaya Raya I, Kec. Betung, Kab. Banyuasin, Sumatera Selatan 30958";"Jl. Betung - Sekayu, Taja Jaya Raya I, Kec. Betung, Kab. Banyuasin";"SUMATERA SELATAN";"30958";"Indonesia";"";"";"";"-2.8437679";"104.194025";"https://maps.google.com/?cid=0x0:0xf6ed0582a45da7b9";""
"hardware store";"Toko Bahan Bangunan";"Depot Anton Jaya";"Jl. Palembang - Betung No.KM 13, RW.5, Sukamoro, Kec. Talang Klp., Kab. Banyuasin, Sumatera Selatan 30961";"RW.5, Sukamoro, Kec. Talang Klp., Kab. Banyuasin";"SUMATERA SELATAN";"30961";"Indonesia";" 081271381888";"";"";"-2.9134412";"104.670715";"https://maps.google.com/?cid=0x0:0xede0738cdd4cba38";""
"hardware store";"Toko Bahan Bangunan";"Tb. Anggun";"563F+GPM, Jl. Raya Palembang - Jambi, Taja Jaya Raya I, Kec. Betung, Kab. Banyuasin, Sumatera Selatan 30958";"Jl. Raya Palembang - Jambi, Taja Jaya Raya I, Kec. Betung, Kab. Banyuasin";"SUMATERA SELATAN";"30958";"Indonesia";" 082176254725";"";"";"-2.8461678";"104.2242885";"https://maps.google.com/?cid=0x0:0xde769efc749064e9";""
"hardware store";"Toko Elektronik";"Toko Talita Elektronik";"jl.betung jambi sebelah sekolah, Blok SN, Taja Jaya Raya I, Kec. Betung, Kab. Banyuasin, Sumatera Selatan 30958";"Blok SN, Taja Jaya Raya I, Kec. Betung, Kab. Banyuasin";"SUMATERA SELATAN";"30958";"Indonesia";" 085267903887";"";"";"-2.843476";"104.2236786";"https://maps.google.com/?cid=0x0:0x2a942ab8a30f15fe";""
"hardware store";"Toko Bahan Bangunan";"Toko Tiga S";"498R+322, Jl. Lintas Sumatra, Pangkalan Balai, Kec. Banyuasin III, Kab. Banyuasin, Sumatera Selatan 30913";"Jl. Lintas Sumatra, Pangkalan Balai, Kec. Banyuasin III, Kab. Banyuasin";"SUMATERA SELATAN";"30913";"Indonesia";" 087748469241";"";"";"-2.8848509";"104.3900254";"https://maps.google.com/?cid=0x0:0x40fdd7e0db67cbc3";""
"hardware store";"Toko Perlengkapan Rumah";"MR DIY PANGKALAN BALAI";"Pangkalan Balai, Kec. Banyuasin III, Kab. Banyuasin, Sumatera Selatan";"Kab. Banyuasin, Sumatera Selatan";"SUMATERA SELATAN";"";"Indonesia";"";"";"";"-2.8868131";"104.3917061";"https://maps.google.com/?cid=0x0:0x5a52c4a42dd1aedd";""
"hardware store";"Dealer mobil";"Semoga Jaya Ban Dan Spare Part Mobil";"Jl. Lintas Sumatra No.Km.46, Kedondong Raye, Kec. Banyuasin III, Kab. Banyuasin, Sumatera Selatan 30912";"Kedondong Raye, Kec. Banyuasin III, Kab. Banyuasin";"SUMATERA SELATAN";"30912";"Indonesia";" 081389997101";"";"";"-2.8810628";"104.3861231";"https://maps.google.com/?cid=0x0:0x45ecd715935e3d8a";""
"hardware store";"hardware store";"Eka kentus";"Desa margorukun, Pangkalan Balai, Kec. Banyuasin III, Palembang, Sumatera Selatan 30911";"Pangkalan Balai, Kec. Banyuasin III, Palembang";"SUMATERA SELATAN";"30911";"Indonesia";" 082236517791";"";"";"-2.8889076";"104.4082908";"https://maps.google.com/?cid=0x0:0x35be8c4fe84e8781";""
"hardware store";"Toko";"TB Bernai Jaya";"494P+RX4, Jalan, Kedondong Raye, Banyuasin III, Banyuasin Regency, South Sumatra 30913";"Jalan, Kedondong Raye, Banyuasin III, Banyuasin Regency";"SUMATERA SELATAN";"30913";"Indonesia";" 081373266259";"";"";"-2.8929829";"104.38745";"https://maps.google.com/?cid=0x0:0xcf2c86ccdc8d4211";""
"hardware store";"Toko Perlengkapan Rumah";"Depot Kayu Slamet";"5645+3JH, Jl. Betung - Sekayu, Taja Jaya Raya I, Kec. Betung, Kab. Banyuasin, Sumatera Selatan 30958";"Jl. Betung - Sekayu, Taja Jaya Raya I, Kec. Betung, Kab. Banyuasin";"SUMATERA SELATAN";"30958";"Indonesia";" 085366749387";"";"";"-2.8447594";"104.209132";"https://maps.google.com/?cid=0x0:0x56d6c8c6da0e332f";""
"hardware store";"Toko Alat Tulis";"Toko Sejahtera";"496W+859, Pangkalan Balai, Kec. Banyuasin III, Kab. Banyuasin, Sumatera Selatan 30911";"Pangkalan Balai, Kec. Banyuasin III, Kab. Banyuasin";"SUMATERA SELATAN";"30911";"Indonesia";" 085367023380";"";"";"-2.8892111";"104.3954982";"https://maps.google.com/?cid=0x0:0xfe06db18cdd8b5e5";""
"hardware store";"Toko";"RAHMY COPY CENTER";"Jalan Merdeka No.KM.45, Pangkalan Balai, Banyu Asin, Kab. Banyuasin, Sumatera Selatan 30914";"Pangkalan Balai, Banyu Asin, Kab. Banyuasin";"SUMATERA SELATAN";"30914";"Indonesia";" 081314277107";"";"";"-2.8895847";"104.3963148";"https://maps.google.com/?cid=0x0:0x338414e355667f9c";""
"hardware store";"Toko Alat Tulis Kantor";"Toko Alat Tulis "Padma"";"Taja Jaya Raya I, Kec. Betung, Kab. Banyuasin, Sumatera Selatan 30958";"Kec. Betung, Kab. Banyuasin";"SUMATERA SELATAN";"30958";"Indonesia";"";"";"";"-2.8342456";"104.2233675";"https://maps.google.com/?cid=0x0:0xbfa572a193493053";""
"hardware store";"Toko Fotokopi";"FOTOCOPY 3 UTAMI";"Jl. Raya Palembang - Jambi No.KM 67, Taja Jaya Raya I, Kec. Betung, Kab. Banyuasin, Sumatera Selatan 30958";"Taja Jaya Raya I, Kec. Betung, Kab. Banyuasin";"SUMATERA SELATAN";"30958";"Indonesia";" 088220143035";"";"";"-2.8440112";"104.2232716";"https://maps.google.com/?cid=0x0:0x8a04e2caafe0ddef";""
"hardware store";"Toko Bahan Bangunan";"Toko Bangunan Anugerah Bersama";"564F+M9H, Jl. Raya Palembang - Jambi, Taja Jaya Raya I, Kec. Betung, Kab. Banyuasin, Sumatera Selatan 30958";"Jl. Raya Palembang - Jambi, Taja Jaya Raya I, Kec. Betung, Kab. Banyuasin";"SUMATERA SELATAN";"30958";"Indonesia";"";"";"";"-2.8433225";"104.2234701";"https://maps.google.com/?cid=0x0:0xb6cc4894720ba4c3";""
"hardware store";"Sekolah menengah";"SMKN 1 SUAK TAPEH";"Sukaraja Baru, Kec. Banyuasin III, Kab. Banyuasin, Sumatera Selatan 30958";"Kec. Banyuasin III, Kab. Banyuasin";"SUMATERA SELATAN";"30958";"Indonesia";"";"";"";"-2.8568677";"104.3467747";"https://maps.google.com/?cid=0x0:0x8a35345688d522a8";""
"hardware store";"hardware store";"Sumatera Selatan 30974";"Kab. Banyuasin, Sumatera Selatan";"Kab. Banyuasin, Sumatera Selatan";"SUMATERA SELATAN";"";"Indonesia";"";"";"";"-2.5889459";"104.8688126";"https://maps.google.com/?cid=0x0:0xc631707b06b6e3ea";""
"hardware store";"Toko Bahan Bangunan";"TB. Griya Bintang Surya";"3QW9+RV8, Talang Buluh, Kec. Talang Klp., Kab. Banyuasin, Sumatera Selatan 30961";"Talang Buluh, Kec. Talang Klp., Kab. Banyuasin";"SUMATERA SELATAN";"30961";"Indonesia";" 081369098979";"";"";"-2.9029502";"104.7696937";"https://maps.google.com/?cid=0x0:0x5bb3033b3fc324f0";""
"hardware store";"Toko Perkakas";"Sukses Sejahtera";"04, Jl. Sultan Mahmud Badaruddin II No.06, 02, Kec. Alang-Alang Lebar, Kota Palembang, Sumatera Selatan 30153";"Jl. Sultan Mahmud Badaruddin II No.06, 02, Kec. Alang-Alang Lebar, Kota Palembang";"SUMATERA SELATAN";"30153";"Indonesia";" 0711431516";"";"";"-2.917948";"104.7038879";"https://maps.google.com/?cid=0x0:0x955a4e1214e41639";""
"hardware store";"Toko Bahan Bangunan";"Toko Tunas Sejahtera";"Jl. Talang Keramat No.Raya, RT.9/RW.9, Talang Buluh, Kec. Talang Klp., Kab. Banyuasin, Sumatera Selatan 30961";"RT.9/RW.9, Talang Buluh, Kec. Talang Klp., Kab. Banyuasin";"SUMATERA SELATAN";"30961";"Indonesia";" 082175740727";"";"";"-2.8960128";"104.7496329";"https://maps.google.com/?cid=0x0:0x9c2cab8aa66da4de";""
"hardware store";"Toko Bahan Bangunan";"Depot Anton Jaya";"Jl. Palembang - Betung No.KM 13, RW.5, Sukamoro, Kec. Talang Klp., Kab. Banyuasin, Sumatera Selatan 30961";"RW.5, Sukamoro, Kec. Talang Klp., Kab. Banyuasin";"SUMATERA SELATAN";"30961";"Indonesia";" 081271381888";"";"";"-2.9134412";"104.670715";"https://maps.google.com/?cid=0x0:0xede0738cdd4cba38";""
"hardware store";"Toko Bahan Bangunan";"TB.LOGAM MULIA";"Pasar Rakyat, Mariana Ilir, Kec. Banyuasin I, Kab. Banyuasin, Sumatera Selatan";"Kab. Banyuasin, Sumatera Selatan";"SUMATERA SELATAN";"";"Indonesia";" 089671680168";"";"";"-2.9166148";"104.8192524";"https://maps.google.com/?cid=0x0:0x85128718626e3532";""
"hardware store";"Toko";"Toko ABID";"jalur 10, Sumber Hidup, Kec. Muara Telang, Kab. Banyuasin, Sumatera Selatan 30974";"Sumber Hidup, Kec. Muara Telang, Kab. Banyuasin";"SUMATERA SELATAN";"30974";"Indonesia";" 085287817007";"";"";"-2.6279505";"104.8221147";"https://maps.google.com/?cid=0x0:0xf47ac45a63c0e1fb";""
"hardware store";"Toko Bahan Bangunan";"Toko Teknik Serba Guna";"Jl. Palembang - Betung No.228, Sukodadi, Kec. Sukarami, Kab. Banyuasin, Sumatera Selatan 30961";"Sukodadi, Kec. Sukarami, Kab. Banyuasin";"SUMATERA SELATAN";"30961";"Indonesia";" 0895327064947";"";"";"-2.9132459";"104.6788853";"https://maps.google.com/?cid=0x0:0x400fca7d517a7557";""
"hardware store";"Toko Perlengkapan Rumah";"Toko Surya Bangunan";"5PWQ+WPC, Jl. Tj. Api-Api, Gasing, Laut, Kab. Banyuasin, Sumatera Selatan 30961";"Jl. Tj. Api-Api, Gasing, Laut, Kab. Banyuasin";"SUMATERA SELATAN";"30961";"Indonesia";" 08194849133";"";"";"-2.8026949";"104.7392723";"https://maps.google.com/?cid=0x0:0x3eff241a54b00bce";""
"hardware store";"Toko";"Toko pak Holman";"Sp 2 pasar, air kumbang, Kec. Banyuasin I, padang, Sumatera Selatan";"padang, Sumatera Selatan";"SUMATERA SELATAN";"";"Indonesia";" 085381506341";"";"";"-2.8402465";"105.0427455";"https://maps.google.com/?cid=0x0:0xb9573c5158799f38";""
"hardware store";"Toko Perkakas";"Toko Panca Warna";"7, Jl. R. Nangling No.Muhamad, 24 Ilir, Kec. Bukit Kecil, Kota Palembang, Sumatera Selatan 30134";"Jl. R. Nangling No.Muhamad, 24 Ilir, Kec. Bukit Kecil, Kota Palembang";"SUMATERA SELATAN";"30134";"Indonesia";" 0711371125";"";"";"-2.9822369";"104.755352";"https://maps.google.com/?cid=0x0:0x47e556c917ff1734";""
"hardware store";"Toko Bahan Bangunan";"Toko Bangunan Makmur Maju";"Jl. Taqwa Mata Merah sebelah lorong bersama, Sei Selincah, Kec. Kalidoni, Kota Palembang, Sumatera Selatan 30118";"Sei Selincah, Kec. Kalidoni, Kota Palembang";"SUMATERA SELATAN";"30118";"Indonesia";" 082181777938";"";"";"-2.9574004";"104.8266377";"https://maps.google.com/?cid=0x0:0x18b66dcf4a55de76";""
"hardware store";"Toko Bahan Bangunan";"Depot asri abadi";"Upang Makmur, Kec. Makarti Jaya, Kab. Banyuasin, Sumatera Selatan 30972";"Kec. Makarti Jaya, Kab. Banyuasin";"SUMATERA SELATAN";"30972";"Indonesia";"";"";"";"-2.4845519";"104.9754005";"https://maps.google.com/?cid=0x0:0xca064dda553b2eb4";""
"hardware store";"Toko Bahan Bangunan";"TB.MAJU LANCAR MAKMUR";"3QW5+RGV, Jl. Talang Keramat, Talang Buluh, Kec. Talang Klp., Kab. Banyuasin, Sumatera Selatan 30961";"Jl. Talang Keramat, Talang Buluh, Kec. Talang Klp., Kab. Banyuasin";"SUMATERA SELATAN";"30961";"Indonesia";" 083140420976";"";"";"-2.902913";"104.758778";"https://maps.google.com/?cid=0x0:0x62c4908136aaff0e";""
"hardware store";"Toko Alat-Alat";"Sumber Bahagia Abadi/Altama Primachindo";"Jl. Ps. 16 Ilir No.659, 16 Ilir, Kec. Ilir Tim. I, Kota Palembang, Sumatera Selatan 30122";"16 Ilir, Kec. Ilir Tim. I, Kota Palembang";"SUMATERA SELATAN";"30122";"Indonesia";" 081293056855";"";"";"-2.9875045";"104.7650685";"https://maps.google.com/?cid=0x0:0xfd66b6719b3dc15e";""
"hardware store";"Toko Bahan Bangunan";"TB Suparlan 20";"84Q5+CP4, Purwodadi, Kec. Muara Padang, Kab. Banyuasin, Sumatera Selatan 30975";"Purwodadi, Kec. Muara Padang, Kab. Banyuasin";"SUMATERA SELATAN";"30975";"Indonesia";"";"";"";"-2.66229";"105.1087952";"https://maps.google.com/?cid=0x0:0x169a58048133783c";""
"hardware store";"Toko Perlengkapan Rumah";"Toko Kunci  Handle Pinangsia";"Duku, Jl. Dr. M. Isa No.14 A - B, Duku, Ilir Timur II, Palembang City, South Sumatra 30114";"Jl. Dr. M. Isa No.14 A - B, Duku, Ilir Timur II, Palembang City";"SUMATERA SELATAN";"30114";"Indonesia";" 085282824588";"";"";"-2.9645473";"104.7699492";"https://maps.google.com/?cid=0x0:0x3146c0aed215edba";""
"hardware store";"Grosir";"jun metalindo";"Jl. Letnan Jaimas No.327, Sungai Pangeran, Kec. Ilir Tim. I, Kota Palembang, Sumatera Selatan 30125";"Sungai Pangeran, Kec. Ilir Tim. I, Kota Palembang";"SUMATERA SELATAN";"30125";"Indonesia";"";"";"";"-2.9817977";"104.7518691";"https://maps.google.com/?cid=0x0:0x4aec2885bd48562d";""
"hardware store";"Toko Bahan Bangunan";"TB RICOH";"Jl.Tanjung Siapi Api Km 34 Ds, Suka Damai, Kec. Tj. Lago, Kab. Banyuasin, Sumatera Selatan 30961";"Suka Damai, Kec. Tj. Lago, Kab. Banyuasin";"SUMATERA SELATAN";"30961";"Indonesia";" 082269454496";"";"";"-2.6493744";"104.7293671";"https://maps.google.com/?cid=0x0:0x1bcd34fbbce33e5a";""
"hardware store";"Toko Bahan Bangunan";"TB CAHAYA GEMILANG";"Jl. Pangkalan Benteng, Sukamoro, Kec. Talang Klp., Kab. Banyuasin, Sumatera Selatan 30961";"Sukamoro, Kec. Talang Klp., Kab. Banyuasin";"SUMATERA SELATAN";"30961";"Indonesia";" 082185518661";"";"";"-2.8893653";"104.6656465";"https://maps.google.com/?cid=0x0:0x133ec4ac5d5035fb";""
"hardware store";"Jembatan";"Jalur 8 Telang Jembatan 1";"Jalur 8 Telang Jembatan 1, Upang Ceria, Kec. Muara Telang, Kab. Banyuasin, Sumatera Selatan 30765";"Upang Ceria, Kec. Muara Telang, Kab. Banyuasin";"SUMATERA SELATAN";"30765";"Indonesia";"";"";"";"-2.6854996";"104.9243833";"https://maps.google.com/?cid=0x0:0x48358f6d60303c6a";""
"hardware store";"Toko Bahan Bangunan";"Toko Bangunan Bangun Indah";"NO WA OI54O54249, Jl. TPA Sukawinatan No.36, RT.7/RW.7, Sukajaya, Kec. Sukarami, Kota Palembang, Sumatera Selatan 30163";"Jl. TPA Sukawinatan No.36, RT.7/RW.7, Sukajaya, Kec. Sukarami, Kota Palembang";"SUMATERA SELATAN";"30163";"Indonesia";" 07115610565";"";"";"-2.9228449";"104.747322";"https://maps.google.com/?cid=0x0:0xe543fc6d8d79f078";""
"hardware store";"Toko Bahan Bangunan";"TB ST JAYA";"3RCF+6H5, Jl. Husin Basri, Suka Mulya, Kec. Banyuasin I, Kab. Banyuasin, Sumatera Selatan 30962";"Jl. Husin Basri, Suka Mulya, Kec. Banyuasin I, Kab. Banyuasin";"SUMATERA SELATAN";"30962";"Indonesia";" 082376052296";"";"";"-2.9294842";"104.823993";"https://maps.google.com/?cid=0x0:0x7f91a33d7ee2c7a3";""
"hardware store";"hardware store";"Sumatera Selatan 30961";"Kab. Banyuasin, Sumatera Selatan";"Kab. Banyuasin, Sumatera Selatan";"SUMATERA SELATAN";"";"Indonesia";"";"";"";"-2.725669";"104.705431";"https://maps.google.com/?cid=0x0:0xfe621f2397c4dea7";""
"hardware store";"Toko Bahan Bangunan";"TB. Griya Bintang Surya";"3QW9+RV8, Talang Buluh, Kec. Talang Klp., Kab. Banyuasin, Sumatera Selatan 30961";"Talang Buluh, Kec. Talang Klp., Kab. Banyuasin";"SUMATERA SELATAN";"30961";"Indonesia";" 081369098979";"";"";"-2.9029502";"104.7696937";"https://maps.google.com/?cid=0x0:0x5bb3033b3fc324f0";""
"hardware store";"Toko Bahan Bangunan";"TB SUMBER ACUAN JAYA";"3P33+993, Jl. Kolonel Sulaiman Amin, Talang Klp., Kec. Alang-Alang Lebar, Kota Palembang, Sumatera Selatan 30151";"Jl. Kolonel Sulaiman Amin, Talang Klp., Kec. Alang-Alang Lebar, Kota Palembang";"SUMATERA SELATAN";"30151";"Indonesia";" 081271567707";"";"";"-2.9466084";"104.7034107";"https://maps.google.com/?cid=0x0:0xb73868b77cc6ffc4";""
"hardware store";"Pusat Perbelanjaan";"MR.DIY";"Jl. Sultan Mahmud Badaruddin II No.4, Sukodadi, Kec. Alang-Alang Lebar, Kota Palembang, Sumatera Selatan 30961";"Sukodadi, Kec. Alang-Alang Lebar, Kota Palembang";"SUMATERA SELATAN";"30961";"Indonesia";"";"";"";"-2.9137036";"104.6851725";"https://maps.google.com/?cid=0x0:0xd018e8c6966371e7";""
"hardware store";"Toko Bahan Bangunan";"Distributor Semen Baturaja";"JL. Kol. H. Burlian, No. 3A RT. 01 RW. 01, Kebun Bunga, Sukarami, Sukarami, Kec. Sukarami, Kota Palembang, Sumatera Selatan 30961";"No. 3A RT. 01 RW. 01, Kebun Bunga, Sukarami, Sukarami, Kec. Sukarami, Kota Palembang";"SUMATERA SELATAN";"30961";"Indonesia";" 081703453355";"";"";"-2.9367194";"104.7202851";"https://maps.google.com/?cid=0x0:0x11dc9f7af594b496";""
"hardware store";"Toko Swalayan";"Pasar Perumnas Sako";"3Q9Q+VGF, Jl. Siaran No.3, Sialang, Kec. Sako, Kota Palembang, Sumatera Selatan 30961";"Jl. Siaran No.3, Sialang, Kec. Sako, Kota Palembang";"SUMATERA SELATAN";"30961";"Indonesia";"";"";"";"-2.9304215";"104.7892414";"https://maps.google.com/?cid=0x0:0x586b1331611fec7e";""
"hardware store";"Dealer Sepeda Motor";"Honda Dealership";"Jl. Raya Palembang - Jambi No.25, Sukamoro, Kec. Talang Klp., Kab. Banyuasin, Sumatera Selatan 30961";"Sukamoro, Kec. Talang Klp., Kab. Banyuasin";"SUMATERA SELATAN";"30961";"Indonesia";"";"";"";"-2.9130393";"104.6649923";"https://maps.google.com/?cid=0x0:0xc84d86396522e629";""
"hardware store";"Toko Cat";"Tb. Bintang Timur";"jl. kelapa sawit raya perumnas talang kelapa no 15/16, Talang Klp., Kec. Alang-Alang Lebar, Kota Palembang, Sumatera Selatan 30961";"Talang Klp., Kec. Alang-Alang Lebar, Kota Palembang";"SUMATERA SELATAN";"30961";"Indonesia";" 08127815954";"";"";"-2.9355948";"104.6917596";"https://maps.google.com/?cid=0x0:0xe0f2944fabbe3031";""
"hardware store";"Toko Bahan Bangunan";"TB Suka Makmur";"Jl. Sukamakmur, Air Batu, Kec. Talang Klp., Kab. Banyuasin, Sumatera Selatan 30961";"Air Batu, Kec. Talang Klp., Kab. Banyuasin";"SUMATERA SELATAN";"30961";"Indonesia";" 082372521111";"";"";"-2.8674254";"104.63015";"https://maps.google.com/?cid=0x0:0xfe8d2a7fa4505825";""
"hardware store";"Toko";"Toko Tunas Makmur";"Jl. Raya Palembang - Jambi No.38, Sukamoro, Kec. Talang Klp., Kab. Banyuasin, Sumatera Selatan 30196";"Sukamoro, Kec. Talang Klp., Kab. Banyuasin";"SUMATERA SELATAN";"30196";"Indonesia";" 0711430068";"";"";"-2.9130352";"104.6595029";"https://maps.google.com/?cid=0x0:0xc7cbabb102cea71f";""
"hardware store";"Toko Bahan Bangunan";"Sentral Bangunan";"Jalan Camat II No.091, RT.008/RW.002, Kel. Sukajadi, Kec. Talang Klp., Kab. Banyuasin, Sumatera Selatan 30961";"RT.008/RW.002, Kel. Sukajadi, Kec. Talang Klp., Kab. Banyuasin";"SUMATERA SELATAN";"30961";"Indonesia";" 082180031228";"";"";"-2.9104777";"104.6513435";"https://maps.google.com/?cid=0x0:0xcc662077d626b35b";""
"hardware store";"Toko Bahan Bangunan";"Toko Tunas Sejahtera";"Jl. Talang Keramat No.Raya, RT.9/RW.9, Talang Buluh, Kec. Talang Klp., Kab. Banyuasin, Sumatera Selatan 30961";"RT.9/RW.9, Talang Buluh, Kec. Talang Klp., Kab. Banyuasin";"SUMATERA SELATAN";"30961";"Indonesia";" 082175740727";"";"";"-2.8960128";"104.7496329";"https://maps.google.com/?cid=0x0:0x9c2cab8aa66da4de";""
"hardware store";"Toko Bahan Bangunan";"TB Maju Jaya";"3PC3+P29, Jl. Hasanudin, Talang Klp., Kec. Alang-Alang Lebar, Kota Palembang, Sumatera Selatan 30124";"Jl. Hasanudin, Talang Klp., Kec. Alang-Alang Lebar, Kota Palembang";"SUMATERA SELATAN";"30124";"Indonesia";" 07117423562";"";"";"-2.9282109";"104.702608";"https://maps.google.com/?cid=0x0:0xdd98ffd19028c180";""
"hardware store";"Toko Bahan Bangunan";"TB CAHAYA GEMILANG";"Jl. Pangkalan Benteng, Sukamoro, Kec. Talang Klp., Kab. Banyuasin, Sumatera Selatan 30961";"Sukamoro, Kec. Talang Klp., Kab. Banyuasin";"SUMATERA SELATAN";"30961";"Indonesia";" 082185518661";"";"";"-2.8893653";"104.6656465";"https://maps.google.com/?cid=0x0:0x133ec4ac5d5035fb";""
