Category;Real Category;Business Name;Address;City;State;Postal Code;Country;Phone;Email;Website;Latitude;Longitude;Map Link;Details Link
"building materials";"Toko Bahan Bangunan";"TB. Sumber Rizki Barokah";"Jl. Desa Mulyorejo, Bukit Jaya, Kec. Sungai Lilin, Kabupaten Musi Banyuasin, Sumatera Selatan 30755";"Bukit Jaya, Kec. Sungai Lilin, Kabupaten Musi Banyuasin";"SUMATERA SELATAN";"30755";"Indonesia";" 081323007822";"";"";"-2.5106215";"104.0448081";"https://maps.google.com/?cid=0x0:0x18885b2d5227f076";""
"building materials";"Toko Bahan Bangunan";"tb.sumber agung";"Tabuan Asri (Sp VI), Kec. Pulau Rimau, Kab. Banyuasin, Sumatera Selatan 30958";"Kec. Pulau Rimau, Kab. Banyuasin";"SUMATERA SELATAN";"30958";"Indonesia";"";"";"";"-2.6563674";"104.3273621";"https://maps.google.com/?cid=0x0:0xb45e4443d5ce234";""
"building materials";"Toko Bahan Bangunan";"Gudang batu koral dan pasir TB.MANDIRI";"94F3+HH9, Pinang Banjar, Kec. Sungai Lilin, Kabupaten Musi Banyuasin, Sumatera Selatan";"Kabupaten Musi Banyuasin, Sumatera Selatan";"SUMATERA SELATAN";"";"Indonesia";"";"";"";"-2.6261073";"104.1039863";"https://maps.google.com/?cid=0x0:0xbbbbed742389afbf";""
"building materials";"Toko Bahan Bangunan";"Tb Duta Keramik";"C446+PRM, Sungai Lilin, Kec. Sungai Lilin, Kabupaten Musi Banyuasin, Sumatera Selatan 30755";"Sungai Lilin, Kec. Sungai Lilin, Kabupaten Musi Banyuasin";"SUMATERA SELATAN";"30755";"Indonesia";" 08127867422";"";"";"-2.5931594";"104.1120367";"https://maps.google.com/?cid=0x0:0x3ffd05853db73d68";""
"building materials";"Pusat Perbelanjaan";"Jaya Mulya Batako Ds. Sidomulyo";"G67V+W4W, Ds. sidomulyo, Karang Agung, Kec. Tungkal Ilir, Kab. Banyuasin, Sumatera Selatan 30758";"Ds. sidomulyo, Karang Agung, Kec. Tungkal Ilir, Kab. Banyuasin";"SUMATERA SELATAN";"30758";"Indonesia";" 082281857837";"";"";"-2.4851383";"104.2428149";"https://maps.google.com/?cid=0x0:0x592dd8f94145102c";""
"building materials";"Toko";"Toko bahan bangunan";"Jl. Raya Palembang - Jambi, km110, Kec. Sungai Lilin, Kabupaten Musi Banyuasin, Sumatera Selatan 30755";"km110, Kec. Sungai Lilin, Kabupaten Musi Banyuasin";"SUMATERA SELATAN";"30755";"Indonesia";" 08127867422";"";"";"-2.593207";"104.1119327";"https://maps.google.com/?cid=0x0:0xf794555e6beab40c";""
"building materials";"Toko Bahan Bangunan";"Mudung jaya sungai lilin";"Jl. Lintas Sumatra Jl. Raya Palembang - Jambi No.Km.117, Mekar Jadi, Kec. Sungai Lilin, Kabupaten Musi Banyuasin, Sumatera Selatan 30755";"Mekar Jadi, Kec. Sungai Lilin, Kabupaten Musi Banyuasin";"SUMATERA SELATAN";"30755";"Indonesia";" 08127897662";"";"";"-2.5558273";"104.109856";"https://maps.google.com/?cid=0x0:0x5c61d94d88e9f8f0";""
"building materials";"Toko Bahan Bangunan";"TB DAMAI SEJAHTERA";"Unnamed Road, Simpang Tungkal, Kec. Bayung Lencir, Kabupaten Musi Banyuasin, Sumatera Selatan 30756";"Simpang Tungkal, Kec. Bayung Lencir, Kabupaten Musi Banyuasin";"SUMATERA SELATAN";"30756";"Indonesia";" 081287442311";"";"";"-2.2614514";"103.9057512";"https://maps.google.com/?cid=0x0:0xe951a5c14359199e";""
"building materials";"Toko";"Toko Material Manunggal";"Jl. Manunggal II, Tungkal II, Kec. Tungkal Ilir, Kabupaten Tanjung Jabung Barat, Jambi 36514";"Tungkal II, Kec. Tungkal Ilir, Kabupaten Tanjung Jabung Barat";"SUMATERA SELATAN";"36514";"Indonesia";" 085198498282";"";"";"-0.8222643";"103.4725847";"https://maps.google.com/?cid=0x0:0x17c442a1ca3ec449";""
"building materials";"Toko Bahan Bangunan";"ENO GYPSUM";"5FH9+435, Tungkal II, Kec. Tungkal Ilir, Kabupaten Tanjung Jabung Barat, Jambi 36514";"Tungkal II, Kec. Tungkal Ilir, Kabupaten Tanjung Jabung Barat";"SUMATERA SELATAN";"36514";"Indonesia";" 082375112012";"";"";"-0.8222359";"103.4677331";"https://maps.google.com/?cid=0x0:0x5f64d1055647b177";""
"building materials";"Toko Bahan Bangunan";"TB Balqis";"4CW8+J8W, Jl. Lintas Kuala Tungkal, Pembengis, Kec. Bram Itam, Kabupaten Tanjung Jabung Barat, Jambi 36514";"Jl. Lintas Kuala Tungkal, Pembengis, Kec. Bram Itam, Kabupaten Tanjung Jabung Barat";"SUMATERA SELATAN";"36514";"Indonesia";" 085273999309";"";"";"-0.853391";"103.4158437";"https://maps.google.com/?cid=0x0:0x53997e0bb703e9ab";""
"building materials";"Toko Bahan Bangunan";"Toko Pasir";"5FM8+2V2, JL. Syarif Hidayatullah, Tungkal Dua, Tungkal Ilir, Tanjung Jabung Barat, Tungkal II, Kec. Tungkal Ilir, Kabupaten Tanjung Jabung Barat, Jambi 36514";"JL. Syarif Hidayatullah, Tungkal Dua, Tungkal Ilir, Tanjung Jabung Barat, Tungkal II, Kec. Tungkal Ilir, Kabupaten Tanjung Jabung Barat";"SUMATERA SELATAN";"36514";"Indonesia";" 085266023572";"";"";"-0.817488";"103.467154";"https://maps.google.com/?cid=0x0:0x62687604633e2e03";""
"building materials";"Toko Bahan Bangunan";"Toko Bangunan RN Jaya";"5FG5+CM5, Tungkal Harapan, Kec. Tungkal Ilir, Kabupaten Tanjung Jabung Barat, Jambi 36514";"Tungkal Harapan, Kec. Tungkal Ilir, Kabupaten Tanjung Jabung Barat";"SUMATERA SELATAN";"36514";"Indonesia";"";"";"";"-0.8239938";"103.4592417";"https://maps.google.com/?cid=0x0:0x7de781c04ccfdd37";""
"building materials";"Toko Bahan Bangunan";"Toko Bangunan, Material, Kayu H.Parto";"5FJ9+67G, Tungkal II, Kec. Tungkal Ilir, Kabupaten Tanjung Jabung Barat, Jambi 36514";"Tungkal II, Kec. Tungkal Ilir, Kabupaten Tanjung Jabung Barat";"SUMATERA SELATAN";"36514";"Indonesia";"";"";"";"-0.8194605";"103.4680143";"https://maps.google.com/?cid=0x0:0x31a8948c5193afc";""
"building materials";"Toko Bahan Bangunan";"Tb.Jaya Murni";"Kemakmuran no.19 rt.05 Kuala tungkal, Tungkal IV Desa, Kec. Tungkal Ilir, Kabupaten Tanjung Jabung Barat, Jambi 36512";"Tungkal IV Desa, Kec. Tungkal Ilir, Kabupaten Tanjung Jabung Barat";"SUMATERA SELATAN";"36512";"Indonesia";" 082180177545";"";"";"-0.8132201";"103.4611369";"https://maps.google.com/?cid=0x0:0x7f95bd635e8752bd";""
"building materials";"Kantor Pemerintah";"Kecamatan";"5FH7+2MG, Tungkal IV Desa, Kec. Tungkal Ilir, Kabupaten Tanjung Jabung Barat, Jambi";"Kabupaten Tanjung Jabung Barat, Jambi";"SUMATERA SELATAN";"";"Indonesia";"";"";"";"-0.82243";"103.4641975";"https://maps.google.com/?cid=0x0:0x7c1eb86f645d1761";""
"building materials";"Minimarket";"Material akbar";"5F69+VPH, Jl. Ki Hajar Dewantara Parit 2, Tungkal III, Kec. Tungkal Ilir, Kabupaten Tanjung Jabung Barat, Jambi 36514";"Jl. Ki Hajar Dewantara Parit 2, Tungkal III, Kec. Tungkal Ilir, Kabupaten Tanjung Jabung Barat";"SUMATERA SELATAN";"36514";"Indonesia";"";"";"";"-0.837825";"103.4693555";"https://maps.google.com/?cid=0x0:0xbf5c173fd1f269a4";""
"building materials";"Toko";"Toko Bangunan Edi R.";"Bram Itam Kiri, Kec. Bram Itam, Kabupaten Tanjung Jabung Barat, Jambi 36514";"Kec. Bram Itam, Kabupaten Tanjung Jabung Barat";"SUMATERA SELATAN";"36514";"Indonesia";"";"";"";"-0.8754269";"103.3991482";"https://maps.google.com/?cid=0x0:0x1cb588a05c1e4b6e";""
"building materials";"Toko Bahan Bangunan";"TB.PUTRA MATERIAL";"Jl. Jambi-Kuala Tungkal, Mekar Jaya, Kec. Betara, Kabupaten Tanjung Jabung Barat, Jambi 36514";"Mekar Jaya, Kec. Betara, Kabupaten Tanjung Jabung Barat";"SUMATERA SELATAN";"36514";"Indonesia";" 082286666904";"";"";"-0.9525496";"103.376841";"https://maps.google.com/?cid=0x0:0xdf6c1ea22cbb2abc";""
"building materials";"Toko Bahan Bangunan";"Sandi";"5FJ4+VJ6, Pasar Parit III, JL. Simpang SD Nasional, Tungkal Harapan, Tungkal ilir, Tungkal Harapan, Kuala Tungkal, Kabupaten Tanjung Jabung Barat, Jambi 36514";"Pasar Parit III, JL. Simpang SD Nasional, Tungkal Harapan, Tungkal ilir, Tungkal Harapan, Kuala Tungkal, Kabupaten Tanjung Jabung Barat";"SUMATERA SELATAN";"36514";"Indonesia";" 08789656509";"";"";"-0.817847";"103.456503";"https://maps.google.com/?cid=0x0:0xf2aaa941711fc740";""
"building materials";"Toko Bahan Bangunan";"Tb.Bin Amin";"39QQ+W47, Jl. Lintas Kuala Tungkal, Bram Itam Kiri, Kec. Bram Itam, Kabupaten Tanjung Jabung Barat, Jambi 36514";"Jl. Lintas Kuala Tungkal, Bram Itam Kiri, Kec. Bram Itam, Kabupaten Tanjung Jabung Barat";"SUMATERA SELATAN";"36514";"Indonesia";"";"";"";"-0.9102028";"103.3877859";"https://maps.google.com/?cid=0x0:0xe7f526adb50f08f6";""
"toko bangunan";"toko bangunan";"Kec. Air Kumbang";"Kab. Banyuasin, Sumatera Selatan";"Kab. Banyuasin, Sumatera Selatan";"SUMATERA SELATAN";"";"Indonesia";"";"";"";"-2.9142489";"105.0024809";"https://maps.google.com/?cid=0x0:0xf89e86de3e805e52";""
"toko bangunan";"Toko Bahan Bangunan";"Toko Bangunan BM JAYA";"2WMR+M8X, Jl. Inpres, Mariana, Kec. Air Kumbang, Kab. Banyuasin, Sumatera Selatan 30763";"Jl. Inpres, Mariana, Kec. Air Kumbang, Kab. Banyuasin";"SUMATERA SELATAN";"30763";"Indonesia";" 081377767777";"";"";"-2.9657744";"104.9408638";"https://maps.google.com/?cid=0x0:0x8c0957cb41f86745";""
"toko bangunan";"Toko";"TB. Bangun Perkasa";"Jl. Inpres XI, Cinta Manis Baru, Kec. Air Kumbang, Kab. Banyuasin, Sumatera Selatan 30962";"Cinta Manis Baru, Kec. Air Kumbang, Kab. Banyuasin";"SUMATERA SELATAN";"30962";"Indonesia";" 08122627374";"";"";"-2.9264628";"105.0017989";"https://maps.google.com/?cid=0x0:0x6731a4fc1930ea43";""
"toko bangunan";"Pemasok Bahan Bangunan";"Toko Bangunan Ana";"Desa, sebokor, Kec. Air Kumbang, Kab. Banyuasin, Sumatera Selatan";"Kab. Banyuasin, Sumatera Selatan";"SUMATERA SELATAN";"";"Indonesia";"";"";"";"-2.9070507";"105.0614887";"https://maps.google.com/?cid=0x0:0xc7b24f9ad05355dd";""
"toko bangunan";"Kantor Perusahaan";"TB. H. TIONO";"3263+4J9, Jl. Inpres, Sidomulyo, Kec. Air Kumbang, Kab. Banyuasin, Sumatera Selatan 30966";"Jl. Inpres, Sidomulyo, Kec. Air Kumbang, Kab. Banyuasin";"SUMATERA SELATAN";"30966";"Indonesia";" 085764813731";"";"";"-2.939701";"105.0041162";"https://maps.google.com/?cid=0x0:0xd6861a0ab0bd1a73";""
"toko bangunan";"Toko Bahan Bangunan";"Toko bangunan Gemilang Jaya B.2";"32Q6+3QJ, Cinta Manis Baru, Kec. Air Kumbang, Kab. Banyuasin, Sumatera Selatan 30962";"Cinta Manis Baru, Kec. Air Kumbang, Kab. Banyuasin";"SUMATERA SELATAN";"30962";"Indonesia";"";"";"";"-2.9122949";"105.0118867";"https://maps.google.com/?cid=0x0:0x2341ad5e424e555c";""
"toko bangunan";"Toko Bahan Bangunan";"TB. Alfadilah";"533V+WH4, Kumbang Padang Permata, Kec. Air Sugihan, Kab. Banyuasin, Sumatera Selatan";"Kab. Banyuasin, Sumatera Selatan";"SUMATERA SELATAN";"";"Indonesia";" 082185291175";"";"";"-2.8452406";"105.0939668";"https://maps.google.com/?cid=0x0:0x488c557af1d6884d";""
"toko bangunan";"Kantor Perusahaan";"Toko Bangunan ADM";"Jl. Inpres No.B 9, Sidomulyo, Kec. Air Kumbang, Kab. Banyuasin, Sumatera Selatan";"Kab. Banyuasin, Sumatera Selatan";"SUMATERA SELATAN";"";"Indonesia";" 082177934318";"";"";"-2.9500833";"105.0030541";"https://maps.google.com/?cid=0x0:0xf1a61c117c157d25";""
"toko bangunan";"Toko";"Toko pak Holman";"Sp 2 pasar, air kumbang, Kec. Banyuasin I, padang, Sumatera Selatan";"padang, Sumatera Selatan";"SUMATERA SELATAN";"";"Indonesia";" 085381506341";"";"";"-2.8402465";"105.0427455";"https://maps.google.com/?cid=0x0:0xb9573c5158799f38";""
"toko bangunan";"Toko Bahan Bangunan";"Berkah jaya beton";"535J+G2G, Kumbang Padang Permata, Kec. Air Kumbang, Kab. Banyuasin, Sumatera Selatan 30967";"Kumbang Padang Permata, Kec. Air Kumbang, Kab. Banyuasin";"SUMATERA SELATAN";"30967";"Indonesia";"";"";"";"-2.8411875";"105.0800781";"https://maps.google.com/?cid=0x0:0x6086271f5e9282df";""
"toko bangunan";"Toko Bahan Bangunan";"TB Lilis";"Nusa Makmur, Kec. Air Kumbang, Palembang, Sumatera Selatan";"Palembang, Sumatera Selatan";"SUMATERA SELATAN";"";"Indonesia";" 087897302862";"";"";"-2.9349977";"105.0478279";"https://maps.google.com/?cid=0x0:0x99dcd966ec781eba";""
"toko bangunan";"Kantor Perusahaan";"Toko Bangunan";"2XVC+57H, Sidomulyo, Kec. Banyuasin I, Kab. Banyuasin, Sumatera Selatan 30962";"Sidomulyo, Kec. Banyuasin I, Kab. Banyuasin";"SUMATERA SELATAN";"30962";"Indonesia";"";"";"";"-2.957059";"104.9707399";"https://maps.google.com/?cid=0x0:0x2e579760acb2f6b3";""
"toko bangunan";"Pemasok Bahan Bangunan";"Toko Pardan B.2";"32G2+XQM, Jl. Inpres, Cinta Manis Baru, Banyuasin I, Sidomulyo, Kec. Air Kumbang, Kab. Banyuasin, Sumatera Selatan 30962";"Jl. Inpres, Cinta Manis Baru, Banyuasin I, Sidomulyo, Kec. Air Kumbang, Kab. Banyuasin";"SUMATERA SELATAN";"30962";"Indonesia";"";"";"";"-2.922536";"105.0019254";"https://maps.google.com/?cid=0x0:0xcd03a2c84b64a65f";""
"toko bangunan";"Toko Bahan Bangunan";"TB Samudra Mariana duren ijo";"2WMQ+69Q, Jl. Inpres, Duren Ijo, Kec. Air Kumbang, Kab. Banyuasin, Sumatera Selatan";"Kab. Banyuasin, Sumatera Selatan";"SUMATERA SELATAN";"";"Indonesia";"";"";"";"-2.9669026";"104.9384937";"https://maps.google.com/?cid=0x0:0xddd5a479a0c2fdbf";""
"toko bangunan";"Toko Bahan Bangunan";"Toko Bangunan MM JAYA ABADI";"WRQ5+JQX, Jl. Gubernur H. A Bastari, Pangkalan Gelebak, Kec. Rambutan, Kab. Banyuasin, Sumatera Selatan 30967";"Jl. Gubernur H. A Bastari, Pangkalan Gelebak, Kec. Rambutan, Kab. Banyuasin";"SUMATERA SELATAN";"30967";"Indonesia";" 081274429083";"";"";"-3.0608995";"104.8094822";"https://maps.google.com/?cid=0x0:0xb3697ae1d5ed3c53";""
"toko bangunan";"Toko Bahan Bangunan";"Rumah Taryono";"52G7+RW8, Budi Mulya, Kec. Air Kumbang, Kab. Banyuasin, Sumatera Selatan 30962";"Budi Mulya, Kec. Air Kumbang, Kab. Banyuasin";"SUMATERA SELATAN";"30962";"Indonesia";"";"";"";"-2.8229728";"105.0148322";"https://maps.google.com/?cid=0x0:0x1bd01fca2f69cc19";""
"toko bangunan";"Toko Bahan Bangunan";"Tb.bintang mas jaya";"32G2+M9F, Sidomulyo, Kec. Banyuasin I, Kab. Banyuasin, Sumatera Selatan";"Kab. Banyuasin, Sumatera Selatan";"SUMATERA SELATAN";"";"Indonesia";" 085367833002";"";"";"-2.923304";"105.0009351";"https://maps.google.com/?cid=0x0:0xff39aada2ba3540f";""
"toko bangunan";"Toko Perlengkapan Rumah";"Depot Kusen ABDI JAYA";"3V5V+59Q, Desa Perajin, Duren Ijo, Kec. Banyuasin I, Kab. Banyuasin, Sumatera Selatan 30962";"Desa Perajin, Duren Ijo, Kec. Banyuasin I, Kab. Banyuasin";"SUMATERA SELATAN";"30962";"Indonesia";" 081373377864";"";"";"-2.9420465";"104.8934832";"https://maps.google.com/?cid=0x0:0x8bd1ee3723fbd755";""
"toko bangunan";"Toko Bahan Bangunan";"TB. MAKMUR JAYA";"2VF9+645, Jl. Sabar Jaya, Sungai Kedukan, Kec. Rambutan, Kab. Banyuasin, Sumatera Selatan 30967";"Jl. Sabar Jaya, Sungai Kedukan, Kec. Rambutan, Kab. Banyuasin";"SUMATERA SELATAN";"30967";"Indonesia";" 081278900485";"";"";"-2.9769757";"104.8678739";"https://maps.google.com/?cid=0x0:0x3d4a749d386dcfb9";""
"toko bangunan";"Kantor Perusahaan";"Bangsal Saefuna";"2XVX+9GQ, Sidomulyo, Kec. Air Kumbang, Kab. Banyuasin, Sumatera Selatan 30962";"Sidomulyo, Kec. Air Kumbang, Kab. Banyuasin";"SUMATERA SELATAN";"30962";"Indonesia";" 08127322866";"";"";"-2.956541";"104.99887";"https://maps.google.com/?cid=0x0:0x44c8be89b0367954";""
"toko bangunan";"toko bangunan";"Sumatera Selatan 30972";"Kec. Makarti Jaya, Kab. Banyuasin, Sumatera Selatan";"Kab. Banyuasin, Sumatera Selatan";"SUMATERA SELATAN";"";"Indonesia";"";"";"";"-2.5016317";"104.9505671";"https://maps.google.com/?cid=0x0:0x8dadb7aa5950616a";""
"toko bangunan";"Toko Bahan Bangunan";"Toko Bangunan ANDALAS (CAK UK)";"GX9F+GVP, Jl. Pelita, Upang Makmur, Kec. Makarti Jaya, Kab. Banyuasin, Sumatera Selatan 30972";"Jl. Pelita, Upang Makmur, Kec. Makarti Jaya, Kab. Banyuasin";"SUMATERA SELATAN";"30972";"Indonesia";" 081222540005";"";"";"-2.4811559";"104.9747";"https://maps.google.com/?cid=0x0:0x1280436b929a6849";""
"toko bangunan";"Toko Bahan Bangunan";"Depot asri abadi";"Upang Makmur, Kec. Makarti Jaya, Kab. Banyuasin, Sumatera Selatan 30972";"Kec. Makarti Jaya, Kab. Banyuasin";"SUMATERA SELATAN";"30972";"Indonesia";"";"";"";"-2.4845519";"104.9754005";"https://maps.google.com/?cid=0x0:0xca064dda553b2eb4";""
"toko bangunan";"Kantor Perusahaan";"Toko Algroup";"Saleh Makmur, Kec. Air Salek, Kab. Banyuasin, Sumatera Selatan 30962";"Kec. Air Salek, Kab. Banyuasin";"SUMATERA SELATAN";"30962";"Indonesia";" 085357106838";"";"";"-2.6382216";"104.9651706";"https://maps.google.com/?cid=0x0:0x91ac569948d9a466";""
"toko bangunan";"Toko Bahan Bangunan";"Toko bangunan sumber jaya";"GX8F+4CV, Upang Makmur, Kec. Makarti Jaya, Kab. Banyuasin, Sumatera Selatan 30972";"Upang Makmur, Kec. Makarti Jaya, Kab. Banyuasin";"SUMATERA SELATAN";"30972";"Indonesia";"";"";"";"-2.4846841";"104.9734807";"https://maps.google.com/?cid=0x0:0x3d73fb0721aa2007";""
"toko bangunan";"Toko umum";"Toko Bahan Bangunan H. AMIR";"925W+RJR, Bintaran, Kec. Air Salek, Kab. Banyuasin, Sumatera Selatan 30975";"Bintaran, Kec. Air Salek, Kab. Banyuasin";"SUMATERA SELATAN";"30975";"Indonesia";"";"";"";"-2.6403799";"105.046528";"https://maps.google.com/?cid=0x0:0xda873c1f759c8f7b";""
"toko bangunan";"Toko Bahan Bangunan";"Avatar Jaya";"927J+J34, Sidoharjo, Kec. Air Salek, Kab. Banyuasin, Sumatera Selatan 30975";"Sidoharjo, Kec. Air Salek, Kab. Banyuasin";"SUMATERA SELATAN";"30975";"Indonesia";"";"";"";"-2.6359942";"105.0301968";"https://maps.google.com/?cid=0x0:0x3b198b66b053d1cf";""
"toko bangunan";"Toko Bahan Bangunan";"Toko Bangunan BM JAYA";"2WMR+M8X, Jl. Inpres, Mariana, Kec. Air Kumbang, Kab. Banyuasin, Sumatera Selatan 30763";"Jl. Inpres, Mariana, Kec. Air Kumbang, Kab. Banyuasin";"SUMATERA SELATAN";"30763";"Indonesia";" 081377767777";"";"";"-2.9657744";"104.9408638";"https://maps.google.com/?cid=0x0:0x8c0957cb41f86745";""
"toko bangunan";"Toko Swalayan";"Toko Bahtera Tani";"marga, GV6M+9P3, Muara telang, Tanjungbaru, Kec. Banyuasin II, Kab. Banyuasin, Sumatera Selatan";"Kab. Banyuasin, Sumatera Selatan";"SUMATERA SELATAN";"";"Indonesia";" 081367770355";"";"";"-2.4888366";"104.883902";"https://maps.google.com/?cid=0x0:0xa0619dc4edf5a058";""
"toko bangunan";"Toko";"Bansal batu bata";"7XRP+9FP, Sri Mulyo, Kec. Air Salek, Kab. Banyuasin, Sumatera Selatan 30975";"Sri Mulyo, Kec. Air Salek, Kab. Banyuasin";"SUMATERA SELATAN";"30975";"Indonesia";" 081278016978";"";"";"-2.7090234";"104.9862274";"https://maps.google.com/?cid=0x0:0x81b7f7ce10fcf640";""
"toko bangunan";"Toko Bahan Bangunan";"Abu yasik tukang pasir";"CXGH+XCG, Upang Marga, Kec. Makarti Jaya, Kab. Banyuasin, Sumatera Selatan 30962";"Upang Marga, Kec. Makarti Jaya, Kab. Banyuasin";"SUMATERA SELATAN";"30962";"Indonesia";" 081271465413";"";"";"-2.5725682";"104.978575";"https://maps.google.com/?cid=0x0:0x9e58ff3333d551d8";""
"toko bangunan";"Toko Bahan Bangunan";"TOKO ALDO JAYA";"3QV7+F8P, Jl. Talang Keramat, Talang Buluh, Kec. Talang Klp., Kab. Banyuasin, Sumatera Selatan 30961";"Jl. Talang Keramat, Talang Buluh, Kec. Talang Klp., Kab. Banyuasin";"SUMATERA SELATAN";"30961";"Indonesia";" 0711821301";"";"";"-2.9062759";"104.7633322";"https://maps.google.com/?cid=0x0:0xdc532577b7cb407e";""
"toko bangunan";"Toko Bahan Bangunan";"Toko Bangunan Berkah Abadi";"Jalan Inpres, Tirto Sari ,Pal 7, Banyuasin 1,, Sidomulyo, Kec. Air Kumbang, Banyuasin, Sumatera Selatan 30962";"Tirto Sari ,Pal 7, Banyuasin 1,, Sidomulyo, Kec. Air Kumbang, Banyuasin";"SUMATERA SELATAN";"30962";"Indonesia";" 082186489596";"";"";"-2.950016";"104.9653531";"https://maps.google.com/?cid=0x0:0x22431fba99d740cd";""
"toko bangunan";"Toko Perlengkapan Rumah";"Toko Surya Bangunan";"5PWQ+WPC, Jl. Tj. Api-Api, Gasing, Laut, Kab. Banyuasin, Sumatera Selatan 30961";"Jl. Tj. Api-Api, Gasing, Laut, Kab. Banyuasin";"SUMATERA SELATAN";"30961";"Indonesia";" 08194849133";"";"";"-2.8026949";"104.7392723";"https://maps.google.com/?cid=0x0:0x3eff241a54b00bce";""
"toko bangunan";"Toko Bahan Bangunan";"Toko Bangunan Lis Dea";"Jl. Banyuasin III Jl. Pasar Baru No.40, Pangkalan Balai, Kec. Banyuasin III, Kab. Banyuasin, Sumatera Selatan 30913";"Pangkalan Balai, Kec. Banyuasin III, Kab. Banyuasin";"SUMATERA SELATAN";"30913";"Indonesia";" 0711891257";"";"";"-2.889607";"104.3940413";"https://maps.google.com/?cid=0x0:0x825164f97a2c97ca";""
"toko bangunan";"Toko Bahan Bangunan";"Toko MUHLIS";"Damar Wulan, Kec. Air Salek, Kab. Banyuasin, Sumatera Selatan 30975";"Kec. Air Salek, Kab. Banyuasin";"SUMATERA SELATAN";"30975";"Indonesia";" 082282622223";"";"";"-2.5746041";"105.0665319";"https://maps.google.com/?cid=0x0:0x96419384e26b65f6";""
"toko bangunan";"Toko Bahan Bangunan";"TOKO BANGUNAN ADM 3";"6P5V+M4Q, Jl. Tj. Api-Api, Kenten Laut, Muara Sugih, Kab. Banyuasin, Sumatera Selatan";"Kab. Banyuasin, Sumatera Selatan";"SUMATERA SELATAN";"";"Indonesia";"";"";"";"-2.790784";"104.7428658";"https://maps.google.com/?cid=0x0:0x3d13889b2273deab";""
"toko bangunan";"Produsen";"Toko Besi Candra";"JWP2+8P7, Sungsang IV, Kec. Banyuasin II, Kab. Banyuasin, Sumatera Selatan 30971";"Sungsang IV, Kec. Banyuasin II, Kab. Banyuasin";"SUMATERA SELATAN";"30971";"Indonesia";" 081279778469";"";"";"-2.3642238";"104.901785";"https://maps.google.com/?cid=0x0:0x3116bb86ed0387b3";""
"toko bangunan";"Toko Bahan Bangunan";"TB. PUTRI DS";"Desa saleh agung, Saleh Jaya, Kec. Air Salek, Palembang, Sumatera Selatan 30773";"Saleh Jaya, Kec. Air Salek, Palembang";"SUMATERA SELATAN";"30773";"Indonesia";" 082175958311";"";"";"-2.6316891";"105.0126627";"https://maps.google.com/?cid=0x0:0xca290042532f3960";""
"toko bangunan";"Toko Bahan Bangunan";"Toko Bangunan Kenten SA";"Jl. Kenten Permai II, Bukit Sangkal, Kec. Ilir Tim. II, Kota Palembang, Sumatera Selatan 30114";"Bukit Sangkal, Kec. Ilir Tim. II, Kota Palembang";"SUMATERA SELATAN";"30114";"Indonesia";" 085105312211";"";"";"-2.9381881";"104.7683231";"https://maps.google.com/?cid=0x0:0x474d42e7293f4924";""
"toko bangunan";"toko bangunan";"Toko material";"72V5+FC8, Sidoharjo, Kec. Air Salek, Kab. Banyuasin, Sumatera Selatan";"Kab. Banyuasin, Sumatera Selatan";"SUMATERA SELATAN";"";"Indonesia";"";"";"";"-2.7063344";"105.0085752";"https://maps.google.com/?cid=0x0:0xff00db17131d4706";""
"toko bangunan";"toko bangunan";"Kec. Air Salek";"Kab. Banyuasin, Sumatera Selatan";"Kab. Banyuasin, Sumatera Selatan";"SUMATERA SELATAN";"";"Indonesia";"";"";"";"-2.7063344";"105.0085752";"https://maps.google.com/?cid=0x0:0xf090fd2b5696b0d5";""
"toko bangunan";"toko bangunan";"Sumatera Selatan 30975";"Kab. Banyuasin, Sumatera Selatan";"Kab. Banyuasin, Sumatera Selatan";"SUMATERA SELATAN";"";"Indonesia";"";"";"";"-2.6440214";"105.0791228";"https://maps.google.com/?cid=0x0:0x33c86caf8afa68e6";""
"toko bangunan";"Toko umum";"Toko Bahan Bangunan H. AMIR";"925W+RJR, Bintaran, Kec. Air Salek, Kab. Banyuasin, Sumatera Selatan 30975";"Bintaran, Kec. Air Salek, Kab. Banyuasin";"SUMATERA SELATAN";"30975";"Indonesia";"";"";"";"-2.6403799";"105.046528";"https://maps.google.com/?cid=0x0:0xda873c1f759c8f7b";""
"toko bangunan";"Toko Bahan Bangunan";"Avatar Jaya";"927J+J34, Sidoharjo, Kec. Air Salek, Kab. Banyuasin, Sumatera Selatan 30975";"Sidoharjo, Kec. Air Salek, Kab. Banyuasin";"SUMATERA SELATAN";"30975";"Indonesia";"";"";"";"-2.6359942";"105.0301968";"https://maps.google.com/?cid=0x0:0x3b198b66b053d1cf";""
"toko bangunan";"Toko Bahan Bangunan";"TB.Sumber Bangunan";"F56R+FQ6, Indrapura, Kec. Muara Sugihan, Kab. Banyuasin, Sumatera Selatan 30975";"Indrapura, Kec. Muara Sugihan, Kab. Banyuasin";"SUMATERA SELATAN";"30975";"Indonesia";"";"";"";"-2.538825";"105.1919";"https://maps.google.com/?cid=0x0:0xfeaeafa1b9a5e9d3";""
"toko bangunan";"Toko Bahan Bangunan";"Toko MUHLIS";"Damar Wulan, Kec. Air Salek, Kab. Banyuasin, Sumatera Selatan 30975";"Kec. Air Salek, Kab. Banyuasin";"SUMATERA SELATAN";"30975";"Indonesia";" 082282622223";"";"";"-2.5746041";"105.0665319";"https://maps.google.com/?cid=0x0:0x96419384e26b65f6";""
"toko bangunan";"Toko Bahan Bangunan";"TB. PUTRI DS";"Desa saleh agung, Saleh Jaya, Kec. Air Salek, Palembang, Sumatera Selatan 30773";"Saleh Jaya, Kec. Air Salek, Palembang";"SUMATERA SELATAN";"30773";"Indonesia";" 082175958311";"";"";"-2.6316891";"105.0126627";"https://maps.google.com/?cid=0x0:0xca290042532f3960";""
"toko bangunan";"Toko Bahan Bangunan";"Sumber Makmur";"84GG+QWP, Sumber Makmur, Kec. Muara Padang, Kab. Banyuasin, Sumatera Selatan 30975";"Sumber Makmur, Kec. Muara Padang, Kab. Banyuasin";"SUMATERA SELATAN";"30975";"Indonesia";" 081373218450";"";"";"-2.6730341";"105.1273198";"https://maps.google.com/?cid=0x0:0x3a4ff95e53a9fca6";""
"toko bangunan";"Kantor Perusahaan";"Toko Algroup";"Saleh Makmur, Kec. Air Salek, Kab. Banyuasin, Sumatera Selatan 30962";"Kec. Air Salek, Kab. Banyuasin";"SUMATERA SELATAN";"30962";"Indonesia";" 085357106838";"";"";"-2.6382216";"104.9651706";"https://maps.google.com/?cid=0x0:0x91ac569948d9a466";""
"toko bangunan";"Toko Swalayan";"Toko H Asse";"G5VC+F9R, Margo Rukun, Kec. Muara Sugihan, Kab. Banyuasin, Sumatera Selatan";"Kab. Banyuasin, Sumatera Selatan";"SUMATERA SELATAN";"";"Indonesia";" 085378281357";"";"";"-2.4562554";"105.1709054";"https://maps.google.com/?cid=0x0:0x67aace903d162b16";""
"toko bangunan";"Toko Bahan Bangunan";"TB.Afandi Jaya";"94VF+RW4, Daya Makmur, Kec. Muara Padang, Kab. Banyuasin, Sumatera Selatan 30975";"Daya Makmur, Kec. Muara Padang, Kab. Banyuasin";"SUMATERA SELATAN";"30975";"Indonesia";" 085211706383";"";"";"-2.6054852";"105.1248219";"https://maps.google.com/?cid=0x0:0xfb7bd6c430922d15";""
"toko bangunan";"Toko Bahan Bangunan";"TB Suparlan 20";"84Q5+CP4, Purwodadi, Kec. Muara Padang, Kab. Banyuasin, Sumatera Selatan 30975";"Purwodadi, Kec. Muara Padang, Kab. Banyuasin";"SUMATERA SELATAN";"30975";"Indonesia";"";"";"";"-2.66229";"105.1087952";"https://maps.google.com/?cid=0x0:0x169a58048133783c";""
"toko bangunan";"Toko Bahan Bangunan";"Toko Bangunan ANDALAS (CAK UK)";"GX9F+GVP, Jl. Pelita, Upang Makmur, Kec. Makarti Jaya, Kab. Banyuasin, Sumatera Selatan 30972";"Jl. Pelita, Upang Makmur, Kec. Makarti Jaya, Kab. Banyuasin";"SUMATERA SELATAN";"30972";"Indonesia";" 081222540005";"";"";"-2.4811559";"104.9747";"https://maps.google.com/?cid=0x0:0x1280436b929a6849";""
"toko bangunan";"Toko Bahan Bangunan";"TB wahyuilahi";"85HC+C6P, Air Gading, Kec. Muara Padang, Kab. Banyuasin, Sumatera Selatan 30975";"Air Gading, Kec. Muara Padang, Kab. Banyuasin";"SUMATERA SELATAN";"30975";"Indonesia";"";"";"";"-2.671409";"105.1705759";"https://maps.google.com/?cid=0x0:0xb160bd16ee08ba1";""
