Category;Real Category;Business Name;Address;City;State;Postal Code;Country;Phone;Email;Website;Latitude;Longitude;Map Link;Details Link
"toko bangunan";"Toko Bahan Bangunan";"TB MEKAR SARI";"Jl. Limas, Air Batu, Kec. Talang Klp., Kab. Banyuasin, Sumatera Selatan 30961";"Air Batu, Kec. Talang Klp., Kab. Banyuasin";"SUMATERA SELATAN";"30961";"Indonesia";"";"";"";"-2.9079168";"104.6260393";"https://maps.google.com/?cid=0x0:0x842c48ec8a30779";""
"toko bangunan";"Toko Bahan Bangunan";"TB SUMBER ACUAN JAYA";"3P33+993, Jl. Kolonel Sulaiman Amin, Talang Klp., Kec. Alang-Alang Lebar, Kota Palembang, Sumatera Selatan 30151";"Jl. Kolonel Sulaiman Amin, Talang Klp., Kec. Alang-Alang Lebar, Kota Palembang";"SUMATERA SELATAN";"30151";"Indonesia";" 081271567707";"";"";"-2.9466084";"104.7034107";"https://maps.google.com/?cid=0x0:0xb73868b77cc6ffc4";""
"toko bangunan";"Toko Bahan Bangunan";"TB Maju Jaya";"3PC3+P29, Jl. Hasanudin, Talang Klp., Kec. Alang-Alang Lebar, Kota Palembang, Sumatera Selatan 30124";"Jl. Hasanudin, Talang Klp., Kec. Alang-Alang Lebar, Kota Palembang";"SUMATERA SELATAN";"30124";"Indonesia";" 07117423562";"";"";"-2.9282109";"104.702608";"https://maps.google.com/?cid=0x0:0xdd98ffd19028c180";""
"toko bangunan";"Toko Bahan Bangunan";"Toko Terus Jaya";"Jl. Rama Raya Jl. Klp. Gading No.40, Talang Klp., Kec. Alang-Alang Lebar, Kota Palembang, Sumatera Selatan 30151";"Talang Klp., Kec. Alang-Alang Lebar, Kota Palembang";"SUMATERA SELATAN";"30151";"Indonesia";" 07115612051";"";"";"-2.9434665";"104.687622";"https://maps.google.com/?cid=0x0:0x6fcf0ad6baa7b49e";""
"toko bangunan";"toko bangunan";"Tj. Lago";"Kec. Tj. Lago, Kab. Banyuasin, Sumatera Selatan";"Kab. Banyuasin, Sumatera Selatan";"SUMATERA SELATAN";"";"Indonesia";"";"";"";"-2.668143";"104.6821048";"https://maps.google.com/?cid=0x0:0x91a0fe3a91d2df09";""
"toko bangunan";"Toko Bahan Bangunan";"tb.Surya bangunan 3";"8PX3+339, Jalur 17, Tj. Lago, Kec. Tj. Lago, Kab. Banyuasin, Sumatera Selatan 30961";"Jalur 17, Tj. Lago, Kec. Tj. Lago, Kab. Banyuasin";"SUMATERA SELATAN";"30961";"Indonesia";" 082181724389";"";"";"-2.6523254";"104.7027336";"https://maps.google.com/?cid=0x0:0xef8d5cb2e02a3bec";""
"toko bangunan";"Toko Bahan Bangunan";"TB RICOH";"Jl.Tanjung Siapi Api Km 34 Ds, Suka Damai, Kec. Tj. Lago, Kab. Banyuasin, Sumatera Selatan 30961";"Suka Damai, Kec. Tj. Lago, Kab. Banyuasin";"SUMATERA SELATAN";"30961";"Indonesia";" 082269454496";"";"";"-2.6493744";"104.7293671";"https://maps.google.com/?cid=0x0:0x1bcd34fbbce33e5a";""
"toko bangunan";"Toko Bahan Bangunan";"TB. Makmur Jaya Indah";"8PXM+Q94, Jl. Tj. Api-Api, Muara Sugih, Kec. Tj. Lago, Kab. Banyuasin, Sumatera Selatan 30961";"Jl. Tj. Api-Api, Muara Sugih, Kec. Tj. Lago, Kab. Banyuasin";"SUMATERA SELATAN";"30961";"Indonesia";"";"";"";"-2.6506134";"104.7334392";"https://maps.google.com/?cid=0x0:0xaaa5666aabd398b2";""
"toko bangunan";"Toko Perlengkapan Rumah";"TB.surya bangunan 3 cabang Heri gasing dan Wendy 19";"9PFJ+87V, Seri Menanti, Kec. Tj. Lago, Kab. Banyuasin, Sumatera Selatan 30961";"Seri Menanti, Kec. Tj. Lago, Kab. Banyuasin";"SUMATERA SELATAN";"30961";"Indonesia";" 082181724389";"";"";"-2.6266475";"104.7306772";"https://maps.google.com/?cid=0x0:0x858a0093690112bc";""
"toko bangunan";"Toko Bahan Bangunan";"SUKSES JAYA";"Simpang Ktm, Jalur 17, Desa, Jl. Tj. Api-Api, Banyu Urip, Kec. Tj. Lago, Kab. Banyuasin, Sumatera Selatan 30961";"Jalur 17, Desa, Jl. Tj. Api-Api, Banyu Urip, Kec. Tj. Lago, Kab. Banyuasin";"SUMATERA SELATAN";"30961";"Indonesia";" 082184002017";"";"";"-2.6581792";"104.7344611";"https://maps.google.com/?cid=0x0:0xee81307045e2d6ac";""
"toko bangunan";"Toko Bahan Bangunan";"TB.PELITA JAYA";"Jalan Tanjung Api Api, Jalur 17, Simpang Ktm, Muara Sugih, Kec. Tj. Lago, Palembang, Sumatera Selatan 30961";"Jalur 17, Simpang Ktm, Muara Sugih, Kec. Tj. Lago, Palembang";"SUMATERA SELATAN";"30961";"Indonesia";" 081271119910";"";"";"-2.6498897";"104.7358696";"https://maps.google.com/?cid=0x0:0xdf68fa66e28d7116";""
"toko bangunan";"Toko Bahan Bangunan";"TOKO SURYA BANGUNAN";"Jl.Tanjung Api Api, Ktm km 41, Tanjung Lago, Muara Sugih, Kec. Tj. Lago, Palembang, Sumatera Selatan 30961";"Ktm km 41, Tanjung Lago, Muara Sugih, Kec. Tj. Lago, Palembang";"SUMATERA SELATAN";"30961";"Indonesia";" 082181724389";"";"";"-2.6504872";"104.7334812";"https://maps.google.com/?cid=0x0:0xf973fc897701cf5b";""
"toko bangunan";"Toko Bahan Bangunan";"BAJA BINTANG SAKTI";"Jalur Jalan Tanjung Api-Api No.17, Mulya Sari, Kec. Tj. Lago, Kab. Banyuasin, Sumatera Selatan 30961";"Mulya Sari, Kec. Tj. Lago, Kab. Banyuasin";"SUMATERA SELATAN";"30961";"Indonesia";" 082282041100";"";"";"-2.6574491";"104.733985";"https://maps.google.com/?cid=0x0:0xcf0f18a4db8e2320";""
"toko bangunan";"Toko Bahan Bangunan";"Toko Makmur";"Jl. Tj. Api-Api No.Jalur 17, Telang Jembatan 4Suka TaniKec, Kec. Tj. Lago, Kota Palembang, Sumatera Selatan 30961";"Telang Jembatan 4Suka TaniKec, Kec. Tj. Lago, Kota Palembang";"SUMATERA SELATAN";"30961";"Indonesia";"";"";"";"-2.6490199";"104.7234848";"https://maps.google.com/?cid=0x0:0x6f7c89269d0cd554";""
"toko bangunan";"Toko Bahan Bangunan";"Gautama Jaya";"Jalan Tanjung api Api, Jalur 17, Banyu Urip, Muara Sugih, Kec. Tj. Lago, Palembang, Sumatera Selatan 30961";"Jalur 17, Banyu Urip, Muara Sugih, Kec. Tj. Lago, Palembang";"SUMATERA SELATAN";"30961";"Indonesia";" 081369094745";"";"";"-2.6551145";"104.733993";"https://maps.google.com/?cid=0x0:0xb086dab8e52b1fc7";""
"toko bangunan";"Toko Bahan Bangunan";"Toko Bahan Bangunan Ekstra";"Jalan Tanjung Siapi Api, Kompleks Pergudangan Griya Bandara Indah Blok A-22, Blok A22, Talang Jambe, Kec. Sukarami, Kota Palembang, Sumatera Selatan 30961";"Kompleks Pergudangan Griya Bandara Indah Blok A-22, Blok A22, Talang Jambe, Kec. Sukarami, Kota Palembang";"SUMATERA SELATAN";"30961";"Indonesia";" 081377594992";"";"";"-2.899781";"104.7254576";"https://maps.google.com/?cid=0x0:0x9e2275025b0ba8b3";""
"toko bangunan";"Toko Perlengkapan Rumah";"Toko Surya Bangunan";"5PWQ+WPC, Jl. Tj. Api-Api, Gasing, Laut, Kab. Banyuasin, Sumatera Selatan 30961";"Jl. Tj. Api-Api, Gasing, Laut, Kab. Banyuasin";"SUMATERA SELATAN";"30961";"Indonesia";" 08194849133";"";"";"-2.8026949";"104.7392723";"https://maps.google.com/?cid=0x0:0x3eff241a54b00bce";""
"toko bangunan";"Toko Bahan Bangunan";"TB Maju Utama";"3MP9+F2W, Jalan Palembang Betung Sukajadi Tanah Mas, Sukamoro, Talang Kelapa, Sukamoro, Kec. Talang Klp., Kab. Banyuasin, Sumatera Selatan 30961";"Jalan Palembang Betung Sukajadi Tanah Mas, Sukamoro, Talang Kelapa, Sukamoro, Kec. Talang Klp., Kab. Banyuasin";"SUMATERA SELATAN";"30961";"Indonesia";" 0711432306";"";"";"-2.9137707";"104.6675701";"https://maps.google.com/?cid=0x0:0xa4a5a88670af1a96";""
"toko bangunan";"Toko Bahan Bangunan";"Toko Tunas Sejahtera";"Jl. Talang Keramat No.Raya, RT.9/RW.9, Talang Buluh, Kec. Talang Klp., Kab. Banyuasin, Sumatera Selatan 30961";"RT.9/RW.9, Talang Buluh, Kec. Talang Klp., Kab. Banyuasin";"SUMATERA SELATAN";"30961";"Indonesia";" 082175740727";"";"";"-2.8960128";"104.7496329";"https://maps.google.com/?cid=0x0:0x9c2cab8aa66da4de";""
"toko bangunan";"Toko Bahan Bangunan";"TB. Griya Bintang Surya";"3QW9+RV8, Talang Buluh, Kec. Talang Klp., Kab. Banyuasin, Sumatera Selatan 30961";"Talang Buluh, Kec. Talang Klp., Kab. Banyuasin";"SUMATERA SELATAN";"30961";"Indonesia";" 081369098979";"";"";"-2.9029502";"104.7696937";"https://maps.google.com/?cid=0x0:0x5bb3033b3fc324f0";""
"toko bangunan";"Toko Bahan Bangunan";"Toko Bahan Bangunan Jaya Mas Sentosa";"9P4J+8X5, Jl. Tj. Api-Api, Muara Sugih, Kec. Tj. Lago, Kab. Banyuasin, Sumatera Selatan 30961";"Jl. Tj. Api-Api, Muara Sugih, Kec. Tj. Lago, Kab. Banyuasin";"SUMATERA SELATAN";"30961";"Indonesia";"";"";"";"-2.644229";"104.7324979";"https://maps.google.com/?cid=0x0:0xb0c2a8ff1f1afa9a";""
"toko bangunan";"Toko Bahan Bangunan";"Toko Bangunan Satu Putri";"4P3X+MH8, Jl. Talang Keramat, Talang Buluh, Kec. Talang Klp., Kab. Banyuasin, Sumatera Selatan 30961";"Jl. Talang Keramat, Talang Buluh, Kec. Talang Klp., Kab. Banyuasin";"SUMATERA SELATAN";"30961";"Indonesia";" 082179157415";"";"";"-2.8958252";"104.7489634";"https://maps.google.com/?cid=0x0:0x42bd5903a29fa716";""
"toko bangunan";"Toko Bahan Bangunan";"Toko Bangunan Amel Jaya - Semen Baturaja";"4M68+QJ8, Jl. Pangkalan Benteng, Sukamoro, Kec. Talang Klp., Kab. Banyuasin, Sumatera Selatan 30961";"Jl. Pangkalan Benteng, Sukamoro, Kec. Talang Klp., Kab. Banyuasin";"SUMATERA SELATAN";"30961";"Indonesia";" 082181888144";"";"";"-2.8880795";"104.6665864";"https://maps.google.com/?cid=0x0:0xa360b86bdf540acd";""
"toko bangunan";"Toko Bahan Bangunan";"Toko Bangunan MM JAYA ABADI";"WRQ5+JQX, Jl. Gubernur H. A Bastari, Pangkalan Gelebak, Kec. Rambutan, Kab. Banyuasin, Sumatera Selatan 30967";"Jl. Gubernur H. A Bastari, Pangkalan Gelebak, Kec. Rambutan, Kab. Banyuasin";"SUMATERA SELATAN";"30967";"Indonesia";" 081274429083";"";"";"-3.0608995";"104.8094822";"https://maps.google.com/?cid=0x0:0xb3697ae1d5ed3c53";""
"toko bangunan";"Toko Bahan Bangunan";"TB HARAPAN JAYA";"8PQP+P4G, Muara Sugih, Kec. Tj. Lago, Kab. Banyuasin, Sumatera Selatan 30961";"Muara Sugih, Kec. Tj. Lago, Kab. Banyuasin";"SUMATERA SELATAN";"30961";"Indonesia";" 082178335544";"";"";"-2.6606813";"104.7353213";"https://maps.google.com/?cid=0x0:0x8ea9b5173ff78d40";""
"toko bangunan";"Toko Bahan Bangunan";"Tb Sejahtera Makmur Taa";"4P4H+F8C, Jl. Palembang- Tj. Api Api, Kenten Laut, Kec. Talang Klp., Kab. Banyuasin, Sumatera Selatan 30961";"Jl. Palembang- Tj. Api Api, Kenten Laut, Kec. Talang Klp., Kab. Banyuasin";"SUMATERA SELATAN";"30961";"Indonesia";" 082178757886";"";"";"-2.8938063";"104.7282594";"https://maps.google.com/?cid=0x0:0x2b63f4a1dd14ea15";""
"toko bangunan";"Toko Bahan Bangunan";"TB Suka Makmur";"Jl. Sukamakmur, Air Batu, Kec. Talang Klp., Kab. Banyuasin, Sumatera Selatan 30961";"Air Batu, Kec. Talang Klp., Kab. Banyuasin";"SUMATERA SELATAN";"30961";"Indonesia";" 082372521111";"";"";"-2.8674254";"104.63015";"https://maps.google.com/?cid=0x0:0xfe8d2a7fa4505825";""
"toko bangunan";"Toko Bahan Bangunan";"TB GIO";"4MJ4+34F, Jl. Desa Pangkalan Benteng, Sukamoro, Kec. Talang Klp., Kab. Banyuasin, Sumatera Selatan 30961";"Jl. Desa Pangkalan Benteng, Sukamoro, Kec. Talang Klp., Kab. Banyuasin";"SUMATERA SELATAN";"30961";"Indonesia";" 082179914778";"";"";"-2.8698081";"104.6552916";"https://maps.google.com/?cid=0x0:0x5eb90f1d9b3b172a";""
"toko bangunan";"Toko Bahan Bangunan";"Toko DR Baja Jaya";"Jl. Tj. Sari, Sukamoro, Kec. Talang Klp., Kab. Banyuasin, Sumatera Selatan 30961";"Sukamoro, Kec. Talang Klp., Kab. Banyuasin";"SUMATERA SELATAN";"30961";"Indonesia";" 085384669589";"";"";"-2.9292477";"104.6476506";"https://maps.google.com/?cid=0x0:0x53fa77d52f1c8b10";""
"toko bangunan";"Toko Bahan Bangunan";"TB CAHAYA GEMILANG";"Jl. Pangkalan Benteng, Sukamoro, Kec. Talang Klp., Kab. Banyuasin, Sumatera Selatan 30961";"Sukamoro, Kec. Talang Klp., Kab. Banyuasin";"SUMATERA SELATAN";"30961";"Indonesia";" 082185518661";"";"";"-2.8893653";"104.6656465";"https://maps.google.com/?cid=0x0:0x133ec4ac5d5035fb";""
"toko bangunan";"Toko Bahan Bangunan";"TB Bintang Jaya";"Jl. Pangeran Ayin, Talang Buluh, Kec. Talang Klp., Kab. Banyuasin, Sumatera Selatan 30961";"Talang Buluh, Kec. Talang Klp., Kab. Banyuasin";"SUMATERA SELATAN";"30961";"Indonesia";" 0711814003";"";"";"-2.9037769";"104.7712095";"https://maps.google.com/?cid=0x0:0x3e8d683fb5102142";""
"toko bangunan";"toko bangunan";"Sumatera Selatan 30974";"Kab. Banyuasin, Sumatera Selatan";"Kab. Banyuasin, Sumatera Selatan";"SUMATERA SELATAN";"";"Indonesia";"";"";"";"-2.5889459";"104.8688126";"https://maps.google.com/?cid=0x0:0xc631707b06b6e3ea";""
"toko bangunan";"Toko Bahan Bangunan";"tb.Surya bangunan 3";"8PX3+339, Jalur 17, Tj. Lago, Kec. Tj. Lago, Kab. Banyuasin, Sumatera Selatan 30961";"Jalur 17, Tj. Lago, Kec. Tj. Lago, Kab. Banyuasin";"SUMATERA SELATAN";"30961";"Indonesia";" 082181724389";"";"";"-2.6523254";"104.7027336";"https://maps.google.com/?cid=0x0:0xef8d5cb2e02a3bec";""
"toko bangunan";"Toko Swalayan";"Toko Bahtera Tani";"marga, GV6M+9P3, Muara telang, Tanjungbaru, Kec. Banyuasin II, Kab. Banyuasin, Sumatera Selatan";"Kab. Banyuasin, Sumatera Selatan";"SUMATERA SELATAN";"";"Indonesia";" 081367770355";"";"";"-2.4888366";"104.883902";"https://maps.google.com/?cid=0x0:0xa0619dc4edf5a058";""
"toko bangunan";"Toko Bahan Bangunan";"Toko Bangunan ANDALAS (CAK UK)";"GX9F+GVP, Jl. Pelita, Upang Makmur, Kec. Makarti Jaya, Kab. Banyuasin, Sumatera Selatan 30972";"Jl. Pelita, Upang Makmur, Kec. Makarti Jaya, Kab. Banyuasin";"SUMATERA SELATAN";"30972";"Indonesia";" 081222540005";"";"";"-2.4811559";"104.9747";"https://maps.google.com/?cid=0x0:0x1280436b929a6849";""
"toko bangunan";"Toko Perlengkapan Rumah";"TB.surya bangunan 3 cabang Heri gasing dan Wendy 19";"9PFJ+87V, Seri Menanti, Kec. Tj. Lago, Kab. Banyuasin, Sumatera Selatan 30961";"Seri Menanti, Kec. Tj. Lago, Kab. Banyuasin";"SUMATERA SELATAN";"30961";"Indonesia";" 082181724389";"";"";"-2.6266475";"104.7306772";"https://maps.google.com/?cid=0x0:0x858a0093690112bc";""
"toko bangunan";"Toko Suku Cadang Mobil Balap";"ANDIRIN JAYA TEKNIK";"Jl. Tj. Api-Api No.Km 34 Ds, Suka Damai, Kec. Tj. Lago, Kab. Banyuasin, Sumatera Selatan 30961";"Suka Damai, Kec. Tj. Lago, Kab. Banyuasin";"SUMATERA SELATAN";"30961";"Indonesia";" 082280153547";"";"";"-2.4971969";"104.785823";"https://maps.google.com/?cid=0x0:0x1799b27e9c31b478";""
"toko bangunan";"Toko Bahan Bangunan";"TOKO BANGUNAN DAN RACUN HAJI WARNO(Nur Anwar)";"GXGG+39, Tirta Mulya, Kec. Makarti Jaya, Kab. Banyuasin, Sumatera Selatan 30972";"Tirta Mulya, Kec. Makarti Jaya, Kab. Banyuasin";"SUMATERA SELATAN";"30972";"Indonesia";" 089632989500";"";"";"-2.4748011";"104.9759751";"https://maps.google.com/?cid=0x0:0x5c60c233121abdd";""
"toko bangunan";"Toko Bahan Bangunan";"Tokoo bangunan hafidz";"FVR7+XQF, Sumber Jaya, Kec. Sumber Marga Telang, Kab. Banyuasin, Sumatera Selatan 30974";"Sumber Jaya, Kec. Sumber Marga Telang, Kab. Banyuasin";"SUMATERA SELATAN";"30974";"Indonesia";"";"";"";"-2.5075514";"104.8644111";"https://maps.google.com/?cid=0x0:0x42a0a68e4382d268";""
"toko bangunan";"Toko Bahan Bangunan";"TB SURYA BANGUNAN 2";"Desa, Jalur 17, Jl. Tj. Api-Api, Suka Damai, Kec. Tj. Lago, Kab. Banyuasin, Sumatera Selatan 30961";"Jalur 17, Jl. Tj. Api-Api, Suka Damai, Kec. Tj. Lago, Kab. Banyuasin";"SUMATERA SELATAN";"30961";"Indonesia";" 082375790888";"";"";"-2.6499714";"104.7297547";"https://maps.google.com/?cid=0x0:0xa170e447a9ea60be";""
"toko bangunan";"Toko Bahan Bangunan";"TB. Makmur Jaya Indah";"8PXM+Q94, Jl. Tj. Api-Api, Muara Sugih, Kec. Tj. Lago, Kab. Banyuasin, Sumatera Selatan 30961";"Jl. Tj. Api-Api, Muara Sugih, Kec. Tj. Lago, Kab. Banyuasin";"SUMATERA SELATAN";"30961";"Indonesia";"";"";"";"-2.6506134";"104.7334392";"https://maps.google.com/?cid=0x0:0xaaa5666aabd398b2";""
"toko bangunan";"Toko Bahan Bangunan";"TOKO SURYA BANGUNAN";"Jl.Tanjung Api Api, Ktm km 41, Tanjung Lago, Muara Sugih, Kec. Tj. Lago, Palembang, Sumatera Selatan 30961";"Ktm km 41, Tanjung Lago, Muara Sugih, Kec. Tj. Lago, Palembang";"SUMATERA SELATAN";"30961";"Indonesia";" 082181724389";"";"";"-2.6504872";"104.7334812";"https://maps.google.com/?cid=0x0:0xf973fc897701cf5b";""
"toko bangunan";"Toko Perlengkapan Rumah";"Toko Surya Bangunan";"5PWQ+WPC, Jl. Tj. Api-Api, Gasing, Laut, Kab. Banyuasin, Sumatera Selatan 30961";"Jl. Tj. Api-Api, Gasing, Laut, Kab. Banyuasin";"SUMATERA SELATAN";"30961";"Indonesia";" 08194849133";"";"";"-2.8026949";"104.7392723";"https://maps.google.com/?cid=0x0:0x3eff241a54b00bce";""
"toko bangunan";"Toko Bahan Bangunan";"SUKSES JAYA";"Simpang Ktm, Jalur 17, Desa, Jl. Tj. Api-Api, Banyu Urip, Kec. Tj. Lago, Kab. Banyuasin, Sumatera Selatan 30961";"Jalur 17, Desa, Jl. Tj. Api-Api, Banyu Urip, Kec. Tj. Lago, Kab. Banyuasin";"SUMATERA SELATAN";"30961";"Indonesia";" 082184002017";"";"";"-2.6581792";"104.7344611";"https://maps.google.com/?cid=0x0:0xee81307045e2d6ac";""
"toko bangunan";"Toko Bahan Bangunan";"TB.PELITA JAYA";"Jalan Tanjung Api Api, Jalur 17, Simpang Ktm, Muara Sugih, Kec. Tj. Lago, Palembang, Sumatera Selatan 30961";"Jalur 17, Simpang Ktm, Muara Sugih, Kec. Tj. Lago, Palembang";"SUMATERA SELATAN";"30961";"Indonesia";" 081271119910";"";"";"-2.6498897";"104.7358696";"https://maps.google.com/?cid=0x0:0xdf68fa66e28d7116";""
"toko bangunan";"Toko Bahan Bangunan";"Toko Bangunan MM JAYA ABADI";"WRQ5+JQX, Jl. Gubernur H. A Bastari, Pangkalan Gelebak, Kec. Rambutan, Kab. Banyuasin, Sumatera Selatan 30967";"Jl. Gubernur H. A Bastari, Pangkalan Gelebak, Kec. Rambutan, Kab. Banyuasin";"SUMATERA SELATAN";"30967";"Indonesia";" 081274429083";"";"";"-3.0608995";"104.8094822";"https://maps.google.com/?cid=0x0:0xb3697ae1d5ed3c53";""
"toko bangunan";"Toko Bahan Bangunan";"Toko bngunan pak pur";"FH4X+68, Bunga Karang, Kec. Tj. Lago, Kab. Banyuasin, Sumatera Selatan";"Kab. Banyuasin, Sumatera Selatan";"SUMATERA SELATAN";"";"Indonesia";"";"";"";"-2.544393";"104.598277";"https://maps.google.com/?cid=0x0:0x6281d3b3c64f640a";""
"toko bangunan";"Toko Bahan Bangunan";"Toko Tunas Sejahtera";"Jl. Talang Keramat No.Raya, RT.9/RW.9, Talang Buluh, Kec. Talang Klp., Kab. Banyuasin, Sumatera Selatan 30961";"RT.9/RW.9, Talang Buluh, Kec. Talang Klp., Kab. Banyuasin";"SUMATERA SELATAN";"30961";"Indonesia";" 082175740727";"";"";"-2.8960128";"104.7496329";"https://maps.google.com/?cid=0x0:0x9c2cab8aa66da4de";""
"toko bangunan";"Kantor Perusahaan";"Toko Algroup";"Saleh Makmur, Kec. Air Salek, Kab. Banyuasin, Sumatera Selatan 30962";"Kec. Air Salek, Kab. Banyuasin";"SUMATERA SELATAN";"30962";"Indonesia";" 085357106838";"";"";"-2.6382216";"104.9651706";"https://maps.google.com/?cid=0x0:0x91ac569948d9a466";""
"toko bangunan";"Toko Bahan Bangunan";"Toko Bangunan BM JAYA";"2WMR+M8X, Jl. Inpres, Mariana, Kec. Air Kumbang, Kab. Banyuasin, Sumatera Selatan 30763";"Jl. Inpres, Mariana, Kec. Air Kumbang, Kab. Banyuasin";"SUMATERA SELATAN";"30763";"Indonesia";" 081377767777";"";"";"-2.9657744";"104.9408638";"https://maps.google.com/?cid=0x0:0x8c0957cb41f86745";""
"toko bangunan";"Toko Bahan Bangunan";"Toko bangunan sumber jaya";"GX8F+4CV, Upang Makmur, Kec. Makarti Jaya, Kab. Banyuasin, Sumatera Selatan 30972";"Upang Makmur, Kec. Makarti Jaya, Kab. Banyuasin";"SUMATERA SELATAN";"30972";"Indonesia";"";"";"";"-2.4846841";"104.9734807";"https://maps.google.com/?cid=0x0:0x3d73fb0721aa2007";""
"toko bangunan";"Toko Bahan Bangunan";"Depot asri abadi";"Upang Makmur, Kec. Makarti Jaya, Kab. Banyuasin, Sumatera Selatan 30972";"Kec. Makarti Jaya, Kab. Banyuasin";"SUMATERA SELATAN";"30972";"Indonesia";"";"";"";"-2.4845519";"104.9754005";"https://maps.google.com/?cid=0x0:0xca064dda553b2eb4";""
"toko bangunan";"Toko Bahan Bangunan";"Toko Bahan Bangunan Jaya Mas Sentosa";"9P4J+8X5, Jl. Tj. Api-Api, Muara Sugih, Kec. Tj. Lago, Kab. Banyuasin, Sumatera Selatan 30961";"Jl. Tj. Api-Api, Muara Sugih, Kec. Tj. Lago, Kab. Banyuasin";"SUMATERA SELATAN";"30961";"Indonesia";"";"";"";"-2.644229";"104.7324979";"https://maps.google.com/?cid=0x0:0xb0c2a8ff1f1afa9a";""
"toko bangunan";"Toko Bahan Bangunan";"Gautama Jaya";"Jalan Tanjung api Api, Jalur 17, Banyu Urip, Muara Sugih, Kec. Tj. Lago, Palembang, Sumatera Selatan 30961";"Jalur 17, Banyu Urip, Muara Sugih, Kec. Tj. Lago, Palembang";"SUMATERA SELATAN";"30961";"Indonesia";" 081369094745";"";"";"-2.6551145";"104.733993";"https://maps.google.com/?cid=0x0:0xb086dab8e52b1fc7";""
"toko bangunan";"Toko Bahan Bangunan";"TB. Griya Bintang Surya";"3QW9+RV8, Talang Buluh, Kec. Talang Klp., Kab. Banyuasin, Sumatera Selatan 30961";"Talang Buluh, Kec. Talang Klp., Kab. Banyuasin";"SUMATERA SELATAN";"30961";"Indonesia";" 081369098979";"";"";"-2.9029502";"104.7696937";"https://maps.google.com/?cid=0x0:0x5bb3033b3fc324f0";""
"toko bangunan";"Toko Bahan Bangunan";"Toko Bangunan Lis Dea";"Jl. Banyuasin III Jl. Pasar Baru No.40, Pangkalan Balai, Kec. Banyuasin III, Kab. Banyuasin, Sumatera Selatan 30913";"Pangkalan Balai, Kec. Banyuasin III, Kab. Banyuasin";"SUMATERA SELATAN";"30913";"Indonesia";" 0711891257";"";"";"-2.889607";"104.3940413";"https://maps.google.com/?cid=0x0:0x825164f97a2c97ca";""
"toko bangunan";"Toko Bahan Bangunan";"Toko Bangunan Tanjung Raya";"Jl. AMD No.2225, Talang Jambe, Kec. Sukarami, Kota Palembang, Sumatera Selatan 30152";"Talang Jambe, Kec. Sukarami, Kota Palembang";"SUMATERA SELATAN";"30152";"Indonesia";" 08156081598";"";"";"-2.8958856";"104.7257057";"https://maps.google.com/?cid=0x0:0xc509ba44bcd93b85";""
"toko bangunan";"Toko Bahan Bangunan";"Toko Bangunan Satu Putri";"4P3X+MH8, Jl. Talang Keramat, Talang Buluh, Kec. Talang Klp., Kab. Banyuasin, Sumatera Selatan 30961";"Jl. Talang Keramat, Talang Buluh, Kec. Talang Klp., Kab. Banyuasin";"SUMATERA SELATAN";"30961";"Indonesia";" 082179157415";"";"";"-2.8958252";"104.7489634";"https://maps.google.com/?cid=0x0:0x42bd5903a29fa716";""
"toko bangunan";"Toko Bahan Bangunan";"Tb Sejahtera Makmur Taa";"4P4H+F8C, Jl. Palembang- Tj. Api Api, Kenten Laut, Kec. Talang Klp., Kab. Banyuasin, Sumatera Selatan 30961";"Jl. Palembang- Tj. Api Api, Kenten Laut, Kec. Talang Klp., Kab. Banyuasin";"SUMATERA SELATAN";"30961";"Indonesia";" 082178757886";"";"";"-2.8938063";"104.7282594";"https://maps.google.com/?cid=0x0:0x2b63f4a1dd14ea15";""
"toko bangunan";"";"TB.KUMALA JAYA";"Jl. Tj. Api-Api suka damai jalur 19 No.de0sa, Kenten Laut, Kec. Talang Klp., Kab. Banyuasin, Sumatera Selatan 30961";"Kenten Laut, Kec. Talang Klp., Kab. Banyuasin";"SUMATERA SELATAN";"30961";"Indonesia";" 085240472345";"";"";"-2.7191251";"104.7327837";"https://maps.google.com/?cid=0x0:0x51658728b9f37e6f";""
"toko bangunan";"toko bangunan";"Sumatera Selatan 30959";"Kec. Pulau Rimau, Kab. Banyuasin, Sumatera Selatan";"Kab. Banyuasin, Sumatera Selatan";"SUMATERA SELATAN";"";"Indonesia";"";"";"";"-2.4980325";"104.4257533";"https://maps.google.com/?cid=0x0:0xe0800df676caa6b1";""
"toko bangunan";"Toko Bahan Bangunan";"Toko bangunan usaha baru";"Asian Highway No.25, Bentayan, Tungkal Ilir, Banyuasin Regency, South Sumatra 30755";"Bentayan, Tungkal Ilir, Banyuasin Regency";"SUMATERA SELATAN";"30755";"Indonesia";" 082325155885";"";"";"-2.5429018";"104.1118432";"https://maps.google.com/?cid=0x0:0xb1efaafde526dc20";""
"toko bangunan";"Toko Bahan Bangunan";"Tb.Lancar Jaya";"RT.004/RW.018 Desa Nusa Serasan, Kec. Sungai Lilin, Kab, Bentayan, Kec. Tungkal Ilir, Kabupaten Musi Banyuasin, Sumatera Selatan 30755";"Kec. Sungai Lilin, Kab, Bentayan, Kec. Tungkal Ilir, Kabupaten Musi Banyuasin";"SUMATERA SELATAN";"30755";"Indonesia";" 085381765934";"";"";"-2.4935885";"104.1014239";"https://maps.google.com/?cid=0x0:0x881ea0cf93a8bb13";""
"toko bangunan";"Toko";"Toko Sinar Rizki";"F3HV+GF8, Bentayan, Kec. Tungkal Ilir, Kab. Banyuasin, Sumatera Selatan 30755";"Bentayan, Kec. Tungkal Ilir, Kab. Banyuasin";"SUMATERA SELATAN";"30755";"Indonesia";"";"";"";"-2.5212098";"104.0936971";"https://maps.google.com/?cid=0x0:0xb7364479e42e2991";""
"toko bangunan";"Toko Bahan Bangunan";"Toko Bangunan Farid Firdaus";"F3HW+93G, Bentayan, Kec. Tungkal Ilir, Kab. Banyuasin, Sumatera Selatan 30755";"Bentayan, Kec. Tungkal Ilir, Kab. Banyuasin";"SUMATERA SELATAN";"30755";"Indonesia";" 082282306665";"";"";"-2.5215745";"104.0952173";"https://maps.google.com/?cid=0x0:0xa1c9bd7703b51c46";""
"toko bangunan";"Toko Perlengkapan Rumah";"Depot Gemilang Jaya";"Bentayan, Kec. Tungkal Ilir, Kab. Banyuasin, Sumatera Selatan 30755";"Kec. Tungkal Ilir, Kab. Banyuasin";"SUMATERA SELATAN";"30755";"Indonesia";" 085377890605";"";"";"-2.5355771";"104.1126023";"https://maps.google.com/?cid=0x0:0xcbc2a5154bf18390";""
"toko bangunan";"Toko Bahan Bangunan";"Toko Bangunan Makmur Jaya Abadi";"F5M7+VJ3, RT.01/RW.Dusun 05, Sidomulyo, Kec. Tungkal Ilir, Kab. Banyuasin, Sumatera Selatan";"Kab. Banyuasin, Sumatera Selatan";"SUMATERA SELATAN";"";"Indonesia";" 082377372254";"";"";"-2.5153632";"104.1640355";"https://maps.google.com/?cid=0x0:0xedd818bf3296af68";""
"toko bangunan";"Toko Bahan Bangunan";"Toko bangunan bunda jaya";"Bentayan, Kec. Tungkal Ilir, Kab. Banyuasin, Sumatera Selatan 30755";"Kec. Tungkal Ilir, Kab. Banyuasin";"SUMATERA SELATAN";"30755";"Indonesia";" 081271879262";"";"";"-2.543349";"104.1120293";"https://maps.google.com/?cid=0x0:0x15849bbe5a2b56b2";""
"toko bangunan";"Toko Bahan Bangunan";"TOKO TUNAS MANDIRI BANGUNAN";"Jl. Trans Pulau Rimau, Tabuan Asri (Sp VI), Kec. Pulau Rimau, Kab. Banyuasin, Sumatera Selatan 30958";"Tabuan Asri (Sp VI), Kec. Pulau Rimau, Kab. Banyuasin";"SUMATERA SELATAN";"30958";"Indonesia";" 081564643364";"";"";"-2.6628868";"104.3285993";"https://maps.google.com/?cid=0x0:0xb8a42753e2e8370a";""
"toko bangunan";"Toko Bahan Bangunan";"Toko bangunan mumtaz";"Tb.mumtaz, Peninggalan, Tungkal Jaya, Kabupaten Musi Banyuasin, Sumatera Selatan 30756";"Peninggalan, Tungkal Jaya, Kabupaten Musi Banyuasin";"SUMATERA SELATAN";"30756";"Indonesia";" 085267533549";"";"";"-2.3961067";"103.9410503";"https://maps.google.com/?cid=0x0:0x412adaf495a39307";""
"toko bangunan";"Toko Bahan Bangunan";"tb.sumber agung";"Tabuan Asri (Sp VI), Kec. Pulau Rimau, Kab. Banyuasin, Sumatera Selatan 30958";"Kec. Pulau Rimau, Kab. Banyuasin";"SUMATERA SELATAN";"30958";"Indonesia";"";"";"";"-2.6563674";"104.3273621";"https://maps.google.com/?cid=0x0:0xb45e4443d5ce234";""
"toko bangunan";"Toko Bahan Bangunan";"TOKO MAULANA JAYA";"Jl.PASAR BARU No.C1, Senda Mukti (Air Senda II), Kec. Pulau Rimau, Kab. Banyuasin, Sumatera Selatan 30958";"Senda Mukti (Air Senda II), Kec. Pulau Rimau, Kab. Banyuasin";"SUMATERA SELATAN";"30958";"Indonesia";" 081367645813";"";"";"-2.6873402";"104.3797938";"https://maps.google.com/?cid=0x0:0xca75c64827a8b1a3";""
