Category,Real Category,Business Name,Address,City,State,Postal Code,Country,Phone,Email,Website,Latitude,Longitude,Map Link,Details Link
supermarket,Toko Swalayan,Indomaret Tulamben,"PHFR+W3H, Jalan, Tulamben, Kubu, Karangasem Regency, Bali 80852","Jalan, Tulamben, Kubu, Karangasem Regency",BALI,80852.0,Indonesia,,,,-8.2751961,115.5902454,https://maps.google.com/?cid=0x0:0xdfc7bde652c254c5,
supermarket,Toko,MULYA MART,"PHPM+F42, Tulamben, Kec. Kubu, Kabupaten Karangasem, Bali 80853","Tulamben, Kec. Kubu, Kabupaten Karangasem",BALI,80853.0,Indonesia,85238039036.0,,,-8.263852,115.582752,https://maps.google.com/?cid=0x0:0xd3654d8e3724a38e,
supermarket,Toko,Kresna Collection kubu,"PHWC+M55, Jalan, Kubu, Karangasem Regency, Bali 80853","Jalan, Kubu, Karangasem Regency",BALI,80853.0,Indonesia,81806450035.0,,,-8.2533695,115.5704712,https://maps.google.com/?cid=0x0:0xcda19c9b36c49c19,
supermarket,Toko bahan makanan,UD WAHYUDI,"PHMM+HXR, Jl. Kubu, Tulamben, Kec. Kubu, Kabupaten Karangasem, Bali 80853","Jl. Kubu, Tulamben, Kec. Kubu, Kabupaten Karangasem",BALI,80853.0,Indonesia,87861719166.0,,,-8.2660037,115.5848912,https://maps.google.com/?cid=0x0:0x8e8602feac1493ed,
supermarket,,Toko Sembako,"PHR9+V6P Br dinas Karanganyar, Kubu, Kec. Kubu, Kabupaten Karangasem, Bali","Kabupaten Karangasem, Bali",BALI,,Indonesia,81236333187.0,,,-8.2577796,115.5680425,https://maps.google.com/?cid=0x0:0xc00cae0825d5f620,
supermarket,Toko Buah dan Sayuran,TULAMBEN fresh mart,"PHFR+5XC, Jl. Kubu, Tulamben, Kec. Kubu, Kabupaten Karangasem, Bali 80852","Jl. Kubu, Tulamben, Kec. Kubu, Kabupaten Karangasem",BALI,80852.0,Indonesia,,,,-8.277074,115.5923871,https://maps.google.com/?cid=0x0:0xbe706da7efd5c511,
supermarket,Toko bahan makanan,Warung Ayu Shop (1),"PHXF+Q4H, jalan relax, Kubu, Kec. Kubu, Kabupaten Karangasem, Bali 80853","jalan relax, Kubu, Kec. Kubu, Kabupaten Karangasem",BALI,80853.0,Indonesia,85238091388.0,,,-8.2505694,115.5728587,https://maps.google.com/?cid=0x0:0x4b8b54e2d5b07935,
supermarket,Minimarket,Indomart Raya Kubu,"PHVF+GM9, Jalan, Tulamben, Kubu, Karangasem Regency, Bali 80853","Jalan, Tulamben, Kubu, Karangasem Regency",BALI,80853.0,Indonesia,,,,-8.2562138,115.574242,https://maps.google.com/?cid=0x0:0xe77ac610569abdae,
supermarket,Toko,Toko Surya Buah,"Tianyar, Kec. Kubu, Kabupaten Karangasem, Bali 80853","Kec. Kubu, Kabupaten Karangasem",BALI,80853.0,Indonesia,,,,-8.2064394,115.5020665,https://maps.google.com/?cid=0x0:0xd654b69097d8adbe,
supermarket,Toko bahan makanan,egiapriani,"PHVF+W93, Jl. Kubu, Kubu, Kec. Kubu, Kabupaten Karangasem, Bali 80853","Jl. Kubu, Kubu, Kec. Kubu, Kabupaten Karangasem",BALI,80853.0,Indonesia,,,,-8.2552281,115.5734327,https://maps.google.com/?cid=0x0:0xcf57c70464f2ffc3,
supermarket,Toko,Warung OKA ARDANI,"QGV4+JPP, Tianyar, Kec. Kubu, Kabupaten Karangasem, Bali 80853","Tianyar, Kec. Kubu, Kabupaten Karangasem",BALI,80853.0,Indonesia,85829006177.0,,,-8.2059065,115.5068279,https://maps.google.com/?cid=0x0:0x132cba5c78ae49db,
supermarket,Toko umum,UD.GIANYAR,"QFQW+6G, Tianyar, Kec. Kubu, Kabupaten Karangasem, Bali","Kabupaten Karangasem, Bali",BALI,,Indonesia,,,,-8.2119536,115.4963299,https://maps.google.com/?cid=0x0:0x22a29fe97fe5ce73,
supermarket,Toko bahan makanan,Warung Buk Ukir,"RF7J+RF5, Bar, Tianyar Bar., Kec. Kubu, Kabupaten Karangasem, Bali 80853","Bar, Tianyar Bar., Kec. Kubu, Kabupaten Karangasem",BALI,80853.0,Indonesia,,,,-8.18549,115.481246,https://maps.google.com/?cid=0x0:0x31d3c86964a8927d,
supermarket,supermarket,Toko adya utama,"PHV7+J3W, Jl. Amlapura Singaraja, sukadana, Kec. Kubu, Kabupaten Karangasem, Bali 80853","Jl. Amlapura Singaraja, sukadana, Kec. Kubu, Kabupaten Karangasem",BALI,80853.0,Indonesia,85829008296.0,,,-8.2558758,115.562705,https://maps.google.com/?cid=0x0:0xa20e4c02e4367135,
supermarket,Toko bahan makanan,Warung Minggu,"QGH7+776, Tianyar, Kec. Kubu, Kabupaten Karangasem, Bali 80853","Tianyar, Kec. Kubu, Kabupaten Karangasem",BALI,80853.0,Indonesia,,,,-8.2218436,115.513146,https://maps.google.com/?cid=0x0:0x4c38af0f7524d078,
supermarket,Toko bahan makanan,sari Rezeki,"QGG5+X53, Jl. Segara Agung, Tianyar, Kec. Kubu, Kabupaten Karangasem, Bali 80853","Jl. Segara Agung, Tianyar, Kec. Kubu, Kabupaten Karangasem",BALI,80853.0,Indonesia,,,,-8.222613,115.507917,https://maps.google.com/?cid=0x0:0x9b3c128a4e057af3,
supermarket,Toko bahan makanan,Toko Gunung Sari,"QFJX+CRW, Jl. Buluh Winangun, Tianyar, Kec. Kubu, Kabupaten Karangasem, Bali 80853","Jl. Buluh Winangun, Tianyar, Kec. Kubu, Kabupaten Karangasem",BALI,80853.0,Indonesia,81558780650.0,,,-8.2188999,115.499571,https://maps.google.com/?cid=0x0:0x6fa88aab5319f2fc,
supermarket,Toko Pakaian,Minimarket Kubu,"3J2C+PJ6, Unnamed Road, Rantau Panjang Kiri, Kubu, Kabupaten Rokan Hilir, Riau 28991","Unnamed Road, Rantau Panjang Kiri, Kubu, Kabupaten Rokan Hilir",BALI,28991.0,Indonesia,,,,2.0517966,100.6215028,https://maps.google.com/?cid=0x0:0x1bf97ed7d3c034a2,
supermarket,Toko bahan makanan,KEDAI EMPAT PUTRI,"3J5G+859, Jl. Jend. Sudirman, Sungai Kubu, Kubu, Kabupaten Rokan Hilir, Riau 28991","Jl. Jend. Sudirman, Sungai Kubu, Kubu, Kabupaten Rokan Hilir",BALI,28991.0,Indonesia,82128994284.0,,,2.0582997,100.6254788,https://maps.google.com/?cid=0x0:0x30b53ff9fead6d48,
supermarket,Toko bahan makanan,Toko Pak Misran,"3JWG+9VV, Tlk. Piyai, Kubu, Kabupaten Rokan Hilir, Riau 28991","Tlk. Piyai, Kubu, Kabupaten Rokan Hilir",BALI,28991.0,Indonesia,,,,2.0959903,100.6271747,https://maps.google.com/?cid=0x0:0x1951547580fc5d81,
supermarket,Toko bahan makanan,Toko Arrah Mart,"Jl. Jend. Sudirman Simpang Pelita, Rantau Panjang Kiri, Kubu, Kabupaten Rokan Hilir, Riau 28991","Rantau Panjang Kiri, Kubu, Kabupaten Rokan Hilir",BALI,28991.0,Indonesia,,,,2.0415418,100.6291407,https://maps.google.com/?cid=0x0:0x9a3dc0192536998e,
supermarket,Minimarket,FAUZAN MART,"2JGJ+M4X, Tlk. Nilap, Kec. Kubu Babussalam, Kabupaten Rokan Hilir, Riau 28991","Tlk. Nilap, Kec. Kubu Babussalam, Kabupaten Rokan Hilir",BALI,28991.0,Indonesia,,,,2.02674,100.6303617,https://maps.google.com/?cid=0x0:0x544cfd516f3dc01f,
supermarket,Toko bahan makanan,Warung buk merta,"PGMW+6X6, Baturinggit, Kec. Kubu, Kabupaten Karangasem, Bali 80853","Baturinggit, Kec. Kubu, Kabupaten Karangasem",BALI,80853.0,Indonesia,,,,-8.2669514,115.5473838,https://maps.google.com/?cid=0x0:0x9c39de40a42af1f,
supermarket,Kompleks Apartemen,YanDeTangkas iZaura,"PHR9+G34, Kubu, Kec. Kubu, Kabupaten Karangasem, Bali 80853","Kubu, Kec. Kubu, Kabupaten Karangasem",BALI,80853.0,Indonesia,,,,-8.2587467,115.5677182,https://maps.google.com/?cid=0x0:0xe0aa6e706394eb4c,
supermarket,supermarket,Kubu,"Kubu, Kec. Kubu, Kabupaten Karangasem, Bali","Kabupaten Karangasem, Bali",BALI,,Indonesia,,,,-8.25944,115.566002,https://maps.google.com/?cid=0x0:0x7361d170964b4850,
supermarket,Toko Swalayan,Sila kubu bali,"FFQJ+6X3, Gegelang, Kec. Manggis, Kabupaten Karangasem, Bali 80871","Gegelang, Kec. Manggis, Kabupaten Karangasem",BALI,80871.0,Indonesia,,,,-8.5119925,115.482424,https://maps.google.com/?cid=0x0:0x18db2d42c1c051ef,
supermarket,Toko Bunga,Anty Business Shop,"PHQ8+VC8, Kubu, Kec. Kubu, Kabupaten Karangasem, Bali 80853","Kubu, Kec. Kubu, Kabupaten Karangasem",BALI,80853.0,Indonesia,,,,-8.2603258,115.5660715,https://maps.google.com/?cid=0x0:0x95c36e200e160b85,
supermarket,Toko Swalayan,UD. Mariati,"PHVF+W6G, Jl. Kubu, Kubu, Kec. Kubu, Kabupaten Karangasem, Bali 80853","Jl. Kubu, Kubu, Kec. Kubu, Kabupaten Karangasem",BALI,80853.0,Indonesia,,,,-8.255182,115.5730896,https://maps.google.com/?cid=0x0:0xd4a825326c5a6be6,
supermarket,Toko Swalayan,"INDOMARET KUBU, Karangasem","QGW3+G5G, Jalan, Tianyar, Kubu, Karangasem Regency, Bali 80853","Jalan, Tianyar, Kubu, Karangasem Regency",BALI,80853.0,Indonesia,,,,-8.203676,115.5029384,https://maps.google.com/?cid=0x0:0x923bf30c3138e653,
supermarket,Toko Swalayan,Toko sembako Asnur,"Tr IX, Sungai Terus, Kec. Kubu, Kabupaten Kubu Raya, Kalimantan Barat 78384","Sungai Terus, Kec. Kubu, Kabupaten Kubu Raya",BALI,78384.0,Indonesia,85332174407.0,,,-0.4977401,109.416882,https://maps.google.com/?cid=0x0:0x705547718f552549,
supermarket,Toserba,Toko Simpang Berkah,"GC68+FP8, Sungai Terus, Kec. Kubu, Kabupaten Kubu Raya, Kalimantan Barat 78384","Sungai Terus, Kec. Kubu, Kabupaten Kubu Raya",BALI,78384.0,Indonesia,,,,-0.4888314,109.4168128,https://maps.google.com/?cid=0x0:0x19f47cd427ad45bb,
supermarket,supermarket,Kubu,"Kubu, Kec. Kubu, Kabupaten Karangasem, Bali","Kabupaten Karangasem, Bali",BALI,,Indonesia,,,,-8.25944,115.566002,https://maps.google.com/?cid=0x0:0x7361d170964b4850,
supermarket,Toko Swalayan,Indomaret Tulamben,"PHFR+W3H, Jalan, Tulamben, Kubu, Karangasem Regency, Bali 80852","Jalan, Tulamben, Kubu, Karangasem Regency",BALI,80852.0,Indonesia,,,,-8.2751961,115.5902454,https://maps.google.com/?cid=0x0:0xdfc7bde652c254c5,
supermarket,Toko Swalayan,UD. Mariati,"PHVF+W6G, Jl. Kubu, Kubu, Kec. Kubu, Kabupaten Karangasem, Bali 80853","Jl. Kubu, Kubu, Kec. Kubu, Kabupaten Karangasem",BALI,80853.0,Indonesia,,,,-8.255182,115.5730896,https://maps.google.com/?cid=0x0:0xd4a825326c5a6be6,
supermarket,Toko Swalayan,"INDOMARET KUBU, Karangasem","QGW3+G5G, Jalan, Tianyar, Kubu, Karangasem Regency, Bali 80853","Jalan, Tianyar, Kubu, Karangasem Regency",BALI,80853.0,Indonesia,,,,-8.203676,115.5029384,https://maps.google.com/?cid=0x0:0x923bf30c3138e653,
supermarket,Toko Swalayan,Sila kubu bali,"FFQJ+6X3, Gegelang, Kec. Manggis, Kabupaten Karangasem, Bali 80871","Gegelang, Kec. Manggis, Kabupaten Karangasem",BALI,80871.0,Indonesia,,,,-8.5119925,115.482424,https://maps.google.com/?cid=0x0:0x18db2d42c1c051ef,
supermarket,Toko bahan makanan,Warung Minggu,"QGH7+776, Tianyar, Kec. Kubu, Kabupaten Karangasem, Bali 80853","Tianyar, Kec. Kubu, Kabupaten Karangasem",BALI,80853.0,Indonesia,,,,-8.2218436,115.513146,https://maps.google.com/?cid=0x0:0x4c38af0f7524d078,
supermarket,Kompleks Apartemen,YanDeTangkas iZaura,"PHR9+G34, Kubu, Kec. Kubu, Kabupaten Karangasem, Bali 80853","Kubu, Kec. Kubu, Kabupaten Karangasem",BALI,80853.0,Indonesia,,,,-8.2587467,115.5677182,https://maps.google.com/?cid=0x0:0xe0aa6e706394eb4c,
supermarket,Toko Bunga,Anty Business Shop,"PHQ8+VC8, Kubu, Kec. Kubu, Kabupaten Karangasem, Bali 80853","Kubu, Kec. Kubu, Kabupaten Karangasem",BALI,80853.0,Indonesia,,,,-8.2603258,115.5660715,https://maps.google.com/?cid=0x0:0x95c36e200e160b85,
supermarket,Toko Swalayan,Grand Lucky Supermarket,"Jl. Sunset Road No.29, Kuta, Kec. Kuta, Kabupaten Badung, Bali 80361","Kuta, Kec. Kuta, Kabupaten Badung",BALI,80361.0,Indonesia,361762308.0,,,-8.7071714,115.1837175,https://maps.google.com/?cid=0x0:0xf625ece1b610a74c,
supermarket,Toko Pakaian,BALILIVIN,"PHWC+4V7, Jl. Kubu, Sukadana, Kec. Kubu, Kabupaten Karangasem, Bali 80853","Jl. Kubu, Sukadana, Kec. Kubu, Kabupaten Karangasem",BALI,80853.0,Indonesia,81944240082.0,,,-8.2547169,115.5721826,https://maps.google.com/?cid=0x0:0x4036d5414e879e3,
supermarket,Toko bahan makanan,Kios Dewi,"RFH4+3HQ, Tianyar Bar., Kec. Kubu, Kabupaten Karangasem, Bali 80853","Tianyar Bar., Kec. Kubu, Kabupaten Karangasem",BALI,80853.0,Indonesia,,,,-8.1722906,115.4564947,https://maps.google.com/?cid=0x0:0x9596f301d3750bf2,
supermarket,supermarket,GIRI MART,"PHWC+G7R, Kubu, Kec. Kubu, Kabupaten Karangasem, Bali 80853","Kubu, Kec. Kubu, Kabupaten Karangasem",BALI,80853.0,Indonesia,,,,-8.2536413,115.5706256,https://maps.google.com/?cid=0x0:0x83b8288f039f57d4,
supermarket,Toko Buah dan Sayuran,TULAMBEN fresh mart,"PHFR+5XC, Jl. Kubu, Tulamben, Kec. Kubu, Kabupaten Karangasem, Bali 80852","Jl. Kubu, Tulamben, Kec. Kubu, Kabupaten Karangasem",BALI,80852.0,Indonesia,,,,-8.277074,115.5923871,https://maps.google.com/?cid=0x0:0xbe706da7efd5c511,
supermarket,Toko bahan makanan,Mawar Sari Bali Fresh Mart Subagan,"Jl. Achmad Yani No.5, Subagan, Kec. Karangasem, Kabupaten Karangasem, Bali 80813","Subagan, Kec. Karangasem, Kabupaten Karangasem",BALI,80813.0,Indonesia,,,,-8.4551092,115.6011145,https://maps.google.com/?cid=0x0:0xdb0c8004e104d742,
supermarket,Kios,Mini Market Cantik,"RF9F+69X, Unnamed Road, Tianyar Bar., Kec. Kubu, Kabupaten Karangasem, Bali 80853","Unnamed Road, Tianyar Bar., Kec. Kubu, Kabupaten Karangasem",BALI,80853.0,Indonesia,,,,-8.1818797,115.4734844,https://maps.google.com/?cid=0x0:0x476dc0e2f02a3a27,
supermarket,Toko Swalayan,Sila kubu bali,"FFQJ+6X3, Gegelang, Kec. Manggis, Kabupaten Karangasem, Bali 80871","Gegelang, Kec. Manggis, Kabupaten Karangasem",BALI,80871.0,Indonesia,,,,-8.5119925,115.482424,https://maps.google.com/?cid=0x0:0x18db2d42c1c051ef,
supermarket,supermarket,Kubu,"Kubu, Kec. Kubu, Kabupaten Karangasem, Bali","Kabupaten Karangasem, Bali",BALI,,Indonesia,,,,-8.25944,115.566002,https://maps.google.com/?cid=0x0:0x7361d170964b4850,
supermarket,Kompleks Apartemen,YanDeTangkas iZaura,"PHR9+G34, Kubu, Kec. Kubu, Kabupaten Karangasem, Bali 80853","Kubu, Kec. Kubu, Kabupaten Karangasem",BALI,80853.0,Indonesia,,,,-8.2587467,115.5677182,https://maps.google.com/?cid=0x0:0xe0aa6e706394eb4c,
supermarket,Supermarket Industri,Bintang Supermarket Seminyak,"Jl. Raya Seminyak No.17, Seminyak, Kec. Kuta Utara, Kabupaten Badung, Bali 80361","Seminyak, Kec. Kuta Utara, Kabupaten Badung",BALI,80361.0,Indonesia,361730552.0,,,-8.6941736,115.1678886,https://maps.google.com/?cid=0x0:0x3582fbdbb0c18258,
supermarket,Toko Bunga,Anty Business Shop,"PHQ8+VC8, Kubu, Kec. Kubu, Kabupaten Karangasem, Bali 80853","Kubu, Kec. Kubu, Kabupaten Karangasem",BALI,80853.0,Indonesia,,,,-8.2603258,115.5660715,https://maps.google.com/?cid=0x0:0x95c36e200e160b85,
supermarket,Toko bahan makanan,Coco Supermarket Seminyak,"Jl. Laksamana No. 65-67 Kuta Selatan, Kerobokan Kelod, Kec. Kuta Utara, Kabupaten Badung, Bali 80361","Kerobokan Kelod, Kec. Kuta Utara, Kabupaten Badung",BALI,80361.0,Indonesia,8563717787.0,,,-8.6835849,115.1629226,https://maps.google.com/?cid=0x0:0xc9e8bcfdf0420185,
supermarket,Toko Swalayan,Bintang Supermarket Ubud,"Jl. Raya Sanggingan No.45, Sayan, Kecamatan Ubud, Kabupaten Gianyar, Bali 80515","Sayan, Kecamatan Ubud, Kabupaten Gianyar",BALI,80515.0,Indonesia,361972972.0,,,-8.4997384,115.2523733,https://maps.google.com/?cid=0x0:0xedf5038642b75298,
supermarket,Toko Swalayan,Bintang Supermarket - Hayam Wuruk Denpasar,"Jl. Hayam Wuruk No.177, Sumerta Kelod, Kec. Denpasar Tim., Kota Denpasar, Bali 80239","Sumerta Kelod, Kec. Denpasar Tim., Kota Denpasar",BALI,80239.0,Indonesia,361252680.0,,,-8.6608309,115.2398343,https://maps.google.com/?cid=0x0:0x3f67942d46cc7299,
supermarket,Toko Swalayan,LOTTE MART Wholesale Bali,"Jl. Bypass Ngurah Rai No.222X, Sesetan, Denpasar Selatan, Kabupaten Badung, Bali 80223","Sesetan, Denpasar Selatan, Kabupaten Badung",BALI,80223.0,Indonesia,361723222.0,,,-8.7147651,115.2215463,https://maps.google.com/?cid=0x0:0x42d1906031e873cb,
supermarket,Toko Swalayan,Foodmart Primo Kuta,"Lippo Mall Kuta LG Floor, Jl. Kartika Plaza, Lingkungan Segara, Kuta, Badung Regency, Bali 80361","Jl. Kartika Plaza, Lingkungan Segara, Kuta, Badung Regency",BALI,80361.0,Indonesia,3618469470.0,,,-8.735421,115.1665878,https://maps.google.com/?cid=0x0:0xb2b930f0897dc399,
supermarket,Toko bahan makanan,Bali Jaya Mart,"Jl. Raya Kuta No.132, Kuta, Kec. Kuta, Kabupaten Badung, Bali 80361","Kuta, Kec. Kuta, Kabupaten Badung",BALI,80361.0,Indonesia,361751949.0,,,-8.7229568,115.176559,https://maps.google.com/?cid=0x0:0x44b4f2c68071fb3b,
supermarket,Toko Swalayan,Pepito Market Canggu,"Jl. Raya Canggu No.101X, Kerobokan, Kec. Kuta Utara, Kabupaten Badung, Bali 80361","Kerobokan, Kec. Kuta Utara, Kabupaten Badung",BALI,80361.0,Indonesia,8174871289.0,,,-8.643591,115.1577432,https://maps.google.com/?cid=0x0:0x4290c0781faf6289,
supermarket,Toko Swalayan,Pepito Market Nusa Dua,"Jl. Bypass Ngurah Rai, Benoa, Kec. Kuta Sel., Kabupaten Badung, Bali 80363","Benoa, Kec. Kuta Sel., Kabupaten Badung",BALI,80363.0,Indonesia,8174871301.0,,,-8.7893209,115.2110953,https://maps.google.com/?cid=0x0:0xb7f1b26e1df21ecc,
supermarket,Toko Swalayan,Pepito Market Seminyak,"Jl. Raya Kerobokan, Kerobokan Kelod, Kec. Kuta Utara, Kabupaten Badung, Bali 80361","Kerobokan Kelod, Kec. Kuta Utara, Kabupaten Badung",BALI,80361.0,Indonesia,87700032888.0,,,-8.6732453,115.1651277,https://maps.google.com/?cid=0x0:0x4cd6c77b12aeb8bb,
supermarket,supermarket,Foodmart Supermarket Beachwalk,"Jl. Pantai Kuta, Kuta, Kec. Kuta, Kabupaten Badung, Bali 80361","Kuta, Kec. Kuta, Kabupaten Badung",BALI,80361.0,Indonesia,81237922593.0,,,-8.7164477,115.1691307,https://maps.google.com/?cid=0x0:0x44f505f1235b2398,
supermarket,Toko Swalayan,Pepito Market Petitenget,"Jl. Petitenget No.18, Kerobokan Kelod, Kuta Utara, Kerobokan Kelod, Kec. Kuta Utara, Kabupaten Badung, Bali 80361","Kerobokan Kelod, Kuta Utara, Kerobokan Kelod, Kec. Kuta Utara, Kabupaten Badung",BALI,80361.0,Indonesia,87700021888.0,,,-8.6735672,115.1578147,https://maps.google.com/?cid=0x0:0x63763bb525319cbf,
supermarket,Toko Swalayan,Pepito Market Dewi Sri,"Jl. Dewi Sri No.9B, Legian, Kec. Kuta, Kabupaten Badung, Bali 80361","Legian, Kec. Kuta, Kabupaten Badung",BALI,80361.0,Indonesia,87841197770.0,,,-8.7087472,115.1788801,https://maps.google.com/?cid=0x0:0x15ffaaeb77089851,
supermarket,Toko Swalayan,Papaya Fresh Gallery - Kuta,"Jalan Merta Nadi No.Banjar, Abian Base, Kec. Kuta, Kabupaten Badung, Bali 80361","Abian Base, Kec. Kuta, Kabupaten Badung",BALI,80361.0,Indonesia,361759222.0,,,-8.7098685,115.1829325,https://maps.google.com/?cid=0x0:0xb20273175e52a48,
supermarket,Toko bahan makanan,Frestive Kerobokan - Supermarket,"Jl. Raya Kerobokan, Banjar, Taman, Kabupaten Badung, Bali 80361","Banjar, Taman, Kabupaten Badung",BALI,80361.0,Indonesia,87861718854.0,,,-8.6733495,115.1650827,https://maps.google.com/?cid=0x0:0x6f83634b6a7faaba,
supermarket,Toko Makanan Sehat,Alive Wholefoods Store Canggu,"Jl. Canggu Padang Linjong No.14a, Canggu, Kec. Kuta Utara, Kabupaten Badung, Bali 80351","Canggu, Kec. Kuta Utara, Kabupaten Badung",BALI,80351.0,Indonesia,82146165452.0,,,-8.641887,115.139118,https://maps.google.com/?cid=0x0:0xc86a09ca901b192f,
supermarket,Toko Kelontong Korea,Mu Gung Hwa Korean Supermarket Bali,"Jl. Sunset Road No.6, Seminyak, Kec. Kuta, Kabupaten Badung, Bali 80361","Seminyak, Kec. Kuta, Kabupaten Badung",BALI,80361.0,Indonesia,81337030939.0,,,-8.7144536,115.186461,https://maps.google.com/?cid=0x0:0xfcc6a5701f84d812,
supermarket,Pusat Perbelanjaan,Saren Kubu Kios IBE,"6GV7+337, Jl. Saren Kauh, Batumadeg, Kec. Nusa Penida, Kabupaten Klungkung, Bali 80771","Jl. Saren Kauh, Batumadeg, Kec. Nusa Penida, Kabupaten Klungkung",BALI,80771.0,Indonesia,85338880222.0,,,-8.7573466,115.512687,https://maps.google.com/?cid=0x0:0xa1f124f6147b923f,
supermarket,Toko Swalayan,Toko Balikita Kuta,"Jl. Patih Jelantik, Komp. Istana Kuta Galeria, Kuta, Kec. Kuta, Kabupaten Badung, Bali 80361","Komp. Istana Kuta Galeria, Kuta, Kec. Kuta, Kabupaten Badung",BALI,80361.0,Indonesia,,,,-8.7112851,115.180133,https://maps.google.com/?cid=0x0:0xeb3dc976f870494,
supermarket,Produsen Makanan Beku,Umar Frozen Food Jembatan Lima,"Gang Musholla Al-Jihad No.22, RT.14/RW.6, Jemb. Lima, Kec. Tambora, Kota Jakarta Barat, Daerah Khusus Ibukota Jakarta 11250","RT.14/RW.6, Jemb. Lima, Kec. Tambora, Kota Jakarta Barat",BALI,11250.0,Indonesia,82210332600.0,,,-6.1458901,106.8040754,https://maps.google.com/?cid=0x0:0x74275489e06c0c28,
supermarket,Toko makanan beku,Mugie frozen,"Jl. Sawah Lio No.I, RT.11/RW.1, Jemb. Lima, Kec. Tambora, Kota Jakarta Barat, Daerah Khusus Ibukota Jakarta 11250","RT.11/RW.1, Jemb. Lima, Kec. Tambora, Kota Jakarta Barat",BALI,11250.0,Indonesia,85814561987.0,,,-6.1466015,106.8060013,https://maps.google.com/?cid=0x0:0x6b272c8d9ccd891a,
supermarket,Pusat Perbelanjaan,Pasar Mitra,"Jl. KH.Moh.Mansyur No.1, RT.1/RW.11, Tanah Sereal, Kec. Tambora, Kota Jakarta Barat, Daerah Khusus Ibukota Jakarta 11250","RT.1/RW.11, Tanah Sereal, Kec. Tambora, Kota Jakarta Barat",BALI,11250.0,Indonesia,,,,-6.1450087,106.8068487,https://maps.google.com/?cid=0x0:0x93f33dfc242a487a,
supermarket,Toko,AD MART,"GG4G+68V, Jl. Raya Manggis, Manggis, Kec. Manggis, Kabupaten Karangasem, Bali 80871","Jl. Raya Manggis, Manggis, Kec. Manggis, Kabupaten Karangasem",BALI,80871.0,Indonesia,81338769473.0,,,-8.4926779,115.5240172,https://maps.google.com/?cid=0x0:0x6fc8edbb87a797d7,
supermarket,supermarket,Manggis,"Manggis, Kec. Manggis, Kabupaten Karangasem, Bali","Kabupaten Karangasem, Bali",BALI,,Indonesia,,,,-8.492179,115.5252,https://maps.google.com/?cid=0x0:0xe8cfc3ff76ecc7c4,
supermarket,Minimarket,Di MART,"FHW2+PH4, Jl. Mendira, Sengkidu, Kec. Manggis, Kabupaten Karangasem, Bali 80871","Jl. Mendira, Sengkidu, Kec. Manggis, Kabupaten Karangasem",BALI,80871.0,Indonesia,81993998660.0,,,-8.5032489,115.5514402,https://maps.google.com/?cid=0x0:0x899791e7aded045c,
supermarket,Minimarket,Toko Ary Jaya,"GG27+M7W, Manggis, Kec. Manggis, Kabupaten Karangasem, Bali 80871","Manggis, Kec. Manggis, Kabupaten Karangasem",BALI,80871.0,Indonesia,81237963334.0,,,-8.4982561,115.5131889,https://maps.google.com/?cid=0x0:0xa255ad25c2c89ad6,
supermarket,Minimarket,Alfamart,"Jl. Raya Candidasa, Sengkidu, Kec. Manggis, Kabupaten Karangasem, Bali 80871","Sengkidu, Kec. Manggis, Kabupaten Karangasem",BALI,80871.0,Indonesia,1500959.0,,,-8.5083019,115.566081,https://maps.google.com/?cid=0x0:0xacf628ff3935ce12,
supermarket,Toko Swalayan,Toko Bersama,"FHX4+8XC, Sengkidu, Kec. Manggis, Kabupaten Karangasem, Bali","Kabupaten Karangasem, Bali",BALI,,Indonesia,,,,-8.5016857,115.5573848,https://maps.google.com/?cid=0x0:0x36ef20a754aaf4cf,
supermarket,Toko Swalayan,Sila kubu bali,"FFQJ+6X3, Gegelang, Kec. Manggis, Kabupaten Karangasem, Bali 80871","Gegelang, Kec. Manggis, Kabupaten Karangasem",BALI,80871.0,Indonesia,,,,-8.5119925,115.482424,https://maps.google.com/?cid=0x0:0x18db2d42c1c051ef,
supermarket,Toko,As warung,"GG4F+PX6, Jl. Raya Manggis, Manggis, Kec. Manggis, Kabupaten Karangasem, Bali 80871","Jl. Raya Manggis, Manggis, Kec. Manggis, Kabupaten Karangasem",BALI,80871.0,Indonesia,,,,-8.4932643,115.5248914,https://maps.google.com/?cid=0x0:0xd037695e61e9a160,
supermarket,Toko,Kios Maharani,"GG4F+WQ5, Jl. Raya Manggis, Manggis, Kec. Manggis, Kabupaten Karangasem, Bali 80871","Jl. Raya Manggis, Manggis, Kec. Manggis, Kabupaten Karangasem",BALI,80871.0,Indonesia,87761823873.0,,,-8.4927411,115.5244711,https://maps.google.com/?cid=0x0:0x9d8562c3142a5d4d,
supermarket,Toko,Warung Indrakila,"GG4G+68V, Jl. Raya Manggis, Manggis, Kec. Manggis, Kabupaten Karangasem, Bali 80871","Jl. Raya Manggis, Manggis, Kec. Manggis, Kabupaten Karangasem",BALI,80871.0,Indonesia,81318792477.0,,,-8.4943907,115.5257987,https://maps.google.com/?cid=0x0:0xac5d1e3a3652f732,
supermarket,Toko Perlengkapan Rumah,Warung Gisu,"FG95+R2M, Jl. Silayukti, Padangbai, Kec. Manggis, Kabupaten Karangasem, Bali 08072","Jl. Silayukti, Padangbai, Kec. Manggis, Kabupaten Karangasem",BALI,8072.0,Indonesia,,,,-8.5304004,115.5075436,https://maps.google.com/?cid=0x0:0x3072b68f3379f96f,
supermarket,Toko,TOKO NI NYOMAN SUSWENI,"GG4F+WP7, Jl. Raya Manggis, Manggis, Kec. Manggis, Kabupaten Karangasem, Bali 80871","Jl. Raya Manggis, Manggis, Kec. Manggis, Kabupaten Karangasem",BALI,80871.0,Indonesia,85337956464.0,,,-8.492707,115.5242953,https://maps.google.com/?cid=0x0:0xe0e75d5f9f3131a8,
supermarket,Toko,Toko Bu Sumardika,"GG5F+3P9, Jl. Raya Manggis, Manggis, Kec. Karangasem, Kabupaten Karangasem, Bali 80871","Jl. Raya Manggis, Manggis, Kec. Karangasem, Kabupaten Karangasem",BALI,80871.0,Indonesia,82236110995.0,,,-8.4923486,115.5243712,https://maps.google.com/?cid=0x0:0xb526216381153cbe,
supermarket,Toko Ponsel,Enteg Cell,"GG4F+VGR, Manggis, Kec. Manggis, Kabupaten Karangasem, Bali 80871","Manggis, Kec. Manggis, Kabupaten Karangasem",BALI,80871.0,Indonesia,,,,-8.4927529,115.5237625,https://maps.google.com/?cid=0x0:0xac7462a597955d23,
supermarket,Toko Aksesori Pakaian,UTAMA SILVER,"Jl. Raya Manggis, Manggis, Kec. Manggis, Kabupaten Karangasem, Bali","Kabupaten Karangasem, Bali",BALI,,Indonesia,85237855325.0,,,-8.4927982,115.5240116,https://maps.google.com/?cid=0x0:0x67bc7d6e5d1b00a5,
supermarket,Komplek perumahan,Mendira House,"Jl. Mendira, Sengkidu, Kec. Manggis, Kabupaten Karangasem, Bali","Kabupaten Karangasem, Bali",BALI,,Indonesia,3634381019.0,,,-8.502741,115.552518,https://maps.google.com/?cid=0x0:0x624e4521f7f4a693,
supermarket,supermarket,,,,BALI,,Indonesia,,,,,,https://maps.google.com/?cid=0x0:0xb2a608415b848e70%7C/g/1t_gbkxt%7Cid-ID,
supermarket,supermarket,Alila Manggis,"Desa Buitan, Manggis, Karangasem Regency, Bali 80871","Manggis, Karangasem Regency",BALI,80871.0,Indonesia,36341011.0,,,-8.49961,115.5381197,https://maps.google.com/?cid=0x0:0xb2a608415b848e70,
supermarket,supermarket,Nirwana Beach  Resort Candidasa,"Jalan Sengkidu, Jl. Raya Candidasa, Sengkidu, Kec. Manggis, Kabupaten Karangasem, Bali 80871","Jl. Raya Candidasa, Sengkidu, Kec. Manggis, Kabupaten Karangasem",BALI,80871.0,Indonesia,85829334600.0,,,-8.5049639,115.5565993,https://maps.google.com/?cid=0x0:0xc5a727787a4f33b8,
supermarket,supermarket,Villa Gita Segara,"FHV5+GGF, Jl. Raya Candidasa, Nyuh Tebel, Kec. Manggis, Kabupaten Karangasem, Bali 80361","Jl. Raya Candidasa, Nyuh Tebel, Kec. Manggis, Kabupaten Karangasem",BALI,80361.0,Indonesia,82266576119.0,,,-8.50619,115.558796,https://maps.google.com/?cid=0x0:0x55ffccbfa62de9af,
supermarket,supermarket,Ramayana Candidasa Beach Resort,"Jl. Raya Sengkidu, Sengkidu, Kec. Manggis, Kabupaten Karangasem, Bali 80871","Sengkidu, Kec. Manggis, Kabupaten Karangasem",BALI,80871.0,Indonesia,36341974.0,,,-8.5049584,115.5577108,https://maps.google.com/?cid=0x0:0x3342dfe2744bae02,
supermarket,supermarket,Neano Escape,"Jalan Bukit Meluang Desa Adat Apit Yeh, Manggis, Kec. Manggis, Kabupaten Karangasem, Bali 80871","Manggis, Kec. Manggis, Kabupaten Karangasem",BALI,80871.0,Indonesia,81818882223.0,,,-8.4909734,115.5343435,https://maps.google.com/?cid=0x0:0x466678b0602a682d,
