Category,Real Category,Business Name,Address,City,State,Postal Code,Country,Phone,Email,Website,Latitude,Longitude,Map Link,Details Link
supermarket,supermarket,Kimana Villa,"Jl. Raya Sengkidu, Sengkidu, Kec. Manggis, Kabupaten Karangasem, Bali","Kabupaten Karangasem, Bali",BALI,,Indonesia,361970980.0,,,-8.5009855,115.541052,https://maps.google.com/?cid=0x0:0x195a2e2f769729c2,
supermarket,supermarket,Villa Candi,"Jl. Pura Segara, Sengkidu, Kec. Manggis, Kabupaten Karangasem, Bali","Kabupaten Karangasem, Bali",BALI,,Indonesia,818865742.0,,,-8.5045832,115.5541697,https://maps.google.com/?cid=0x0:0x3de2542055f3ebfc,
supermarket,supermarket,Pondok Carik,"Selumbung, Kec. Manggis, Kabupaten Karangasem, Bali","Kabupaten Karangasem, Bali",BALI,,Indonesia,81239128210.0,,,-8.4809194,115.527146,https://maps.google.com/?cid=0x0:0x93983e81d48abc74,
supermarket,Terminal kapal pesiar,Padang Bai Fast Boat Harbour,"Padangbai, Kec. Manggis, Kabupaten Karangasem, Bali","Kabupaten Karangasem, Bali",BALI,,Indonesia,,,,-8.5309919,115.5090845,https://maps.google.com/?cid=0x0:0x52bbbdd0b3b9383f,
supermarket,Pemandian Umum,Tirta Gangga,"HHQQ+836, Jalan Raya Abang Desa Adat Jl. Raya Tirta Gangga, Ababi, Kec. Abang, Kabupaten Karangasem, Bali 80852","Jalan Raya Abang Desa Adat Jl. Raya Tirta Gangga, Ababi, Kec. Abang, Kabupaten Karangasem",BALI,80852.0,Indonesia,36321697.0,,,-8.4123473,115.5872919,https://maps.google.com/?cid=0x0:0x65af03b0d108a7d1,
supermarket,supermarket,Candi Dasa,"Nyuh Tebel, Kec. Manggis, Kabupaten Karangasem, Bali","Kabupaten Karangasem, Bali",BALI,,Indonesia,,,,-8.4995354,115.5555238,https://maps.google.com/?cid=0x0:0x1eb0ffc994219401,
supermarket,Toko Ponsel,G-Cell,"GG4G+J2V, Jl. Raya Manggis, Manggis, Kec. Manggis, Kabupaten Karangasem, Bali 80817","Jl. Raya Manggis, Manggis, Kec. Manggis, Kabupaten Karangasem",BALI,80817.0,Indonesia,85238299000.0,,,-8.4933794,115.5250328,https://maps.google.com/?cid=0x0:0xe100391710a24e29,
supermarket,supermarket,Bali 80863,"Kec. Rendang, Kabupaten Karangasem, Bali","Kabupaten Karangasem, Bali",BALI,,Indonesia,,,,-8.3623262,115.4378152,https://maps.google.com/?cid=0x0:0x1c00c5eb6016c0a0,
supermarket,Minimarket,Alfamart Raya Besakih Rendang,"Jl. Raya Besakih Lingk, Griya, Rendang, Kec. Rendang, Kabupaten Karangasem, Bali 80863","Griya, Rendang, Kec. Rendang, Kabupaten Karangasem",BALI,80863.0,Indonesia,211500959.0,,,-8.4220388,115.4198102,https://maps.google.com/?cid=0x0:0x7732e6a472706a6f,
supermarket,Pasar,Pasar Rendang,"HCCH+JJH, Rendang, Kec. Rendang, Kabupaten Karangasem, Bali 80863","Rendang, Kec. Rendang, Kabupaten Karangasem",BALI,80863.0,Indonesia,,,,-8.4284412,115.4291175,https://maps.google.com/?cid=0x0:0x1f283f3aa201ac6f,
supermarket,Toko Kelontong Asia,SRC SURYA,"Jl. Raya Besakih, Nongan, Kec. Rendang, Kabupaten Karangasem, Bali 80863","Nongan, Kec. Rendang, Kabupaten Karangasem",BALI,80863.0,Indonesia,,,,-8.4340036,115.4166338,https://maps.google.com/?cid=0x0:0x303595ce3ef62f9d,
supermarket,Minimarket,RENDANG BEER STORE,"Rendang, Kec. Rendang, Kabupaten Karangasem, Bali 80863","Kec. Rendang, Kabupaten Karangasem",BALI,80863.0,Indonesia,87858745285.0,,,-8.4276315,115.418341,https://maps.google.com/?cid=0x0:0x6bc89c6b8af76c4a,
supermarket,Toko bahan makanan,Ayu House,"HCCH+H63, Jl. Dewa Anom, Rendang, Kec. Rendang, Kabupaten Karangasem, Bali 80863","Jl. Dewa Anom, Rendang, Kec. Rendang, Kabupaten Karangasem",BALI,80863.0,Indonesia,,,,-8.4286109,115.4280594,https://maps.google.com/?cid=0x0:0x20b547522edd125e,
supermarket,Toko bahan makanan,WARUNG TEKA SRC,"Jl. Dewa Anom No.103, Rendang, Kec. Rendang, Kabupaten Karangasem, Bali 80863","Rendang, Kec. Rendang, Kabupaten Karangasem",BALI,80863.0,Indonesia,87861355717.0,,,-8.4281666,115.4338987,https://maps.google.com/?cid=0x0:0x15e3170b604e3461,
supermarket,Toko Buah dan Sayuran,BALI BUAH SEGAR,"HCPQ+X73, Jl. Tubuh, Menanga, Kec. Rendang, Kabupaten Karangasem, Bali 80863","Jl. Tubuh, Menanga, Kec. Rendang, Kabupaten Karangasem",BALI,80863.0,Indonesia,82247985323.0,,,-8.4126199,115.4381779,https://maps.google.com/?cid=0x0:0x190136a14d5198b9,
supermarket,Gudang,Depo Pakan - Gudang Biru Rendang,"Jl. Gn. Agung Besakih, Rendang, Kec. Rendang, Kabupaten Karangasem, Bali 80863","Rendang, Kec. Rendang, Kabupaten Karangasem",BALI,80863.0,Indonesia,,,,-8.4170811,115.4205852,https://maps.google.com/?cid=0x0:0xe68ee0274b36b752,
supermarket,Toko Swalayan,Warung Sakbyang Merta,"HC78+WFV, depan kuburan manggaan, Nongan, Kec. Rendang, Kabupaten Karangasem, Bali 80863","depan kuburan manggaan, Nongan, Kec. Rendang, Kabupaten Karangasem",BALI,80863.0,Indonesia,,,,-8.4351267,115.4161641,https://maps.google.com/?cid=0x0:0x5d4bf21963105863,
supermarket,Toko Swalayan,WR. Sida Arta,"Jl. Ksatria No.18, Rendang, Kec. Rendang, Kabupaten Karangasem, Bali 80863","Rendang, Kec. Rendang, Kabupaten Karangasem",BALI,80863.0,Indonesia,81238330260.0,,,-8.4312918,115.4291007,https://maps.google.com/?cid=0x0:0x6e4debcea8d174ce,
supermarket,Minimarket,Warung Me Nujati,"Jl. Langsat, Rendang, Kec. Rendang, Kabupaten Karangasem, Bali 80863","Rendang, Kec. Rendang, Kabupaten Karangasem",BALI,80863.0,Indonesia,83116048140.0,,,-8.4295336,115.4376777,https://maps.google.com/?cid=0x0:0xb4d4ae38fc2b2754,
supermarket,Toko umum,SRI MANDIRI MINIMARKET,"HCJP+CJH, Unnamed Road, Menanga, Kec. Rendang, Kabupaten Karangasem, Bali 80863","Unnamed Road, Menanga, Kec. Rendang, Kabupaten Karangasem",BALI,80863.0,Indonesia,82147335377.0,,,-8.4189324,115.4365984,https://maps.google.com/?cid=0x0:0x3bd5e6c94ddb9f96,
supermarket,Toko Swalayan,BAKTI RAHAYU,"JC6Q+372, Jl. Kedugung Besakih, Menanga, Kec. Rendang, Kabupaten Karangasem, Bali 80863","Jl. Kedugung Besakih, Menanga, Kec. Rendang, Kabupaten Karangasem",BALI,80863.0,Indonesia,,,,-8.3898674,115.4381306,https://maps.google.com/?cid=0x0:0x64f362474b97983,
supermarket,Toko,Toko Kaia,"Jl. Dewa Anom No.52, Rendang, Kec. Rendang, Kabupaten Karangasem, Bali 80863","Rendang, Kec. Rendang, Kabupaten Karangasem",BALI,80863.0,Indonesia,,,,-8.4286339,115.4282252,https://maps.google.com/?cid=0x0:0x7a82e389ab22fa80,
supermarket,Gudang,Sadpala SP . Gudang Rendang,"Jl. Dewa Anom No.81, Rendang, Kec. Rendang, Kabupaten Karangasem, Bali 80863","Rendang, Kec. Rendang, Kabupaten Karangasem",BALI,80863.0,Indonesia,81338318444.0,,,-8.4284194,115.4303304,https://maps.google.com/?cid=0x0:0xcac8fcb10f7f691a,
supermarket,Toko bahan makanan,Warung Arya Waringin (WAW),"jl. Teges Waringin, Pempatan, Kec. Rendang, Kabupaten Karangasem, Bali 80863","Pempatan, Kec. Rendang, Kabupaten Karangasem",BALI,80863.0,Indonesia,,,,-8.3523024,115.4141486,https://maps.google.com/?cid=0x0:0xc17d725010f21594,
supermarket,Toko bahan makanan,warung cantik veronika,"HCFC+562, Rendang, Kec. Rendang, Kabupaten Karangasem, Bali 80863","Rendang, Kec. Rendang, Kabupaten Karangasem",BALI,80863.0,Indonesia,,,,-8.4271175,115.4205085,https://maps.google.com/?cid=0x0:0x183c792303758749,
supermarket,Toko Swalayan,Warung Buk Murti,"JCX8+83W, Pempatan, Kec. Rendang, Kabupaten Karangasem, Bali 80863","Pempatan, Kec. Rendang, Kabupaten Karangasem",BALI,80863.0,Indonesia,85792819532.0,,,-8.3516455,115.4152077,https://maps.google.com/?cid=0x0:0xe476319b697d0ff8,
supermarket,Toko Swalayan,Wr. Winangun,"JC8R+GV2, Jl. Kedugung Besakih, Besakih, Kec. Rendang, Kabupaten Karangasem, Bali 80863","Jl. Kedugung Besakih, Besakih, Kec. Rendang, Kabupaten Karangasem",BALI,80863.0,Indonesia,,,,-8.3834123,115.4425452,https://maps.google.com/?cid=0x0:0x7108c15f82feda40,
supermarket,Toko bahan makanan,Wr me Ar 01,"MC56+7HF, Jl. Batur Tengah, Pempatan, Kec. Rendang, Kabupaten Karangasem, Bali 80863","Jl. Batur Tengah, Pempatan, Kec. Rendang, Kabupaten Karangasem",BALI,80863.0,Indonesia,,,,-8.3418118,115.4114139,https://maps.google.com/?cid=0x0:0xae33c1c4d883ed3c,
supermarket,Toko Suvenir,Toko Amertha Jati,"Br. Dinas Keladian, Pempatan, Kec. Rendang, Kabupaten Karangasem, Bali 80863","Pempatan, Kec. Rendang, Kabupaten Karangasem",BALI,80863.0,Indonesia,85333569808.0,,,-8.3651011,115.4255623,https://maps.google.com/?cid=0x0:0x393a038949032bf3,
supermarket,Toko Swalayan,Warung suarta,"JCQ8+CXP, Jl. Besakih, Pempatan, Kec. Rendang, Kabupaten Karangasem, Bali 80863","Jl. Besakih, Pempatan, Kec. Rendang, Kabupaten Karangasem",BALI,80863.0,Indonesia,82237407428.0,,,-8.3614059,115.4174479,https://maps.google.com/?cid=0x0:0x9435d26e0dd1059e,
supermarket,Minimarket,Toko.Mega Pratama,"JCVG+J98, Pempatan, Kec. Rendang, Kabupaten Karangasem, Bali 80863","Pempatan, Kec. Rendang, Kabupaten Karangasem",BALI,80863.0,Indonesia,,,,-8.3559726,115.4259589,https://maps.google.com/?cid=0x0:0x11c81202dc753e34,
supermarket,Toko umum,Warung Bu Ketut,"MC9P+JQP, Unnamed Road, Pempatan, Kec. Rendang, Kabupaten Karangasem, Bali 80863","Unnamed Road, Pempatan, Kec. Rendang, Kabupaten Karangasem",BALI,80863.0,Indonesia,,,,-8.3309195,115.4369385,https://maps.google.com/?cid=0x0:0x155c558e9a7f8ce2,
supermarket,Toko bahan makanan,"WARUNG,MANG KLEMPING","JF72+F97, Besakih, Kec. Rendang, Kabupaten Karangasem, Bali 80863","Besakih, Kec. Rendang, Kabupaten Karangasem",BALI,80863.0,Indonesia,,,,-8.3863387,115.4509194,https://maps.google.com/?cid=0x0:0x2e9b27e1728c99d3,
supermarket,Toko,WARUNG SEDERHANA,"MC2H+XGM, Pempatan, Kec. Rendang, Kabupaten Karangasem, Bali 80863","Pempatan, Kec. Rendang, Kabupaten Karangasem",BALI,80863.0,Indonesia,,,,-8.3473886,115.4286312,https://maps.google.com/?cid=0x0:0xd0ee9eb76dbec30,
supermarket,Toko bahan makanan,Warung arma,"Jl. Raya Besakih No.117, Nongan, Kec. Rendang, Kabupaten Karangasem, Bali 80863","Nongan, Kec. Rendang, Kabupaten Karangasem",BALI,80863.0,Indonesia,,,,-8.4516504,115.4097682,https://maps.google.com/?cid=0x0:0x78d54e5027a671bf,
supermarket,Minimarket,Toko Rahayu Menanga,"Jl. Gn. Agung Besakih, Rendang, Kec. Rendang, Kabupaten Karangasem, Bali 80863","Rendang, Kec. Rendang, Kabupaten Karangasem",BALI,80863.0,Indonesia,81937068622.0,,,-8.4169506,115.4208513,https://maps.google.com/?cid=0x0:0x5c735f2045c0af56,
supermarket,supermarket,Selat,"Pering Sari, Kec. Selat, Kabupaten Karangasem, Bali","Kabupaten Karangasem, Bali",BALI,,Indonesia,,,,-8.437853,115.465897,https://maps.google.com/?cid=0x0:0x22f53a4a73abc935,
supermarket,Toko Swalayan,Kemari Super store,"Jl. Hang Tuah No.35 no 35, Sanur Kaja, Denpasar Selatan, Denpasar City, Bali 80227","Sanur Kaja, Denpasar Selatan, Denpasar City",BALI,80227.0,Indonesia,361282238.0,,,-8.674005,115.2609251,https://maps.google.com/?cid=0x0:0x34210ca18c7b05a0,
supermarket,Supermarket Industri,Bintang Supermarket Seminyak,"Jl. Raya Seminyak No.17, Seminyak, Kec. Kuta Utara, Kabupaten Badung, Bali 80361","Seminyak, Kec. Kuta Utara, Kabupaten Badung",BALI,80361.0,Indonesia,361730552.0,,,-8.6941736,115.1678886,https://maps.google.com/?cid=0x0:0x3582fbdbb0c18258,
supermarket,Toko bahan makanan,Coco Supermarket Seminyak,"Jl. Laksamana No. 65-67 Kuta Selatan, Kerobokan Kelod, Kec. Kuta Utara, Kabupaten Badung, Bali 80361","Kerobokan Kelod, Kec. Kuta Utara, Kabupaten Badung",BALI,80361.0,Indonesia,8563717787.0,,,-8.6835849,115.1629226,https://maps.google.com/?cid=0x0:0xc9e8bcfdf0420185,
supermarket,Toko bahan makanan,Frestive Kerobokan - Supermarket,"Jl. Raya Kerobokan, Banjar, Taman, Kabupaten Badung, Bali 80361","Banjar, Taman, Kabupaten Badung",BALI,80361.0,Indonesia,87861718854.0,,,-8.6733495,115.1650827,https://maps.google.com/?cid=0x0:0x6f83634b6a7faaba,
supermarket,Toko Bahan Bangunan,Mekar Indah,"HF78+4F8, Pering Sari, Kec. Selat, Kabupaten Karangasem, Bali 80862","Pering Sari, Kec. Selat, Kabupaten Karangasem",BALI,80862.0,Indonesia,36622860.0,,,-8.437225,115.466216,https://maps.google.com/?cid=0x0:0x7c2ef6ca377f81e4,
supermarket,Toko Swalayan,Gourmet Market Bali by Pepito,"Sidewalk Jimbaran, Jl. Raya Uluwatu No.138, Jimbaran, Kec. Kuta Sel., Kabupaten Badung, Bali 80361","Jl. Raya Uluwatu No.138, Jimbaran, Kec. Kuta Sel., Kabupaten Badung",BALI,80361.0,Indonesia,8174871288.0,,,-8.796546,115.1611734,https://maps.google.com/?cid=0x0:0xdc415049546c11d3,
supermarket,Toko Swalayan,Papaya Fresh Gallery - Kuta,"Jalan Merta Nadi No.Banjar, Abian Base, Kec. Kuta, Kabupaten Badung, Bali 80361","Abian Base, Kec. Kuta, Kabupaten Badung",BALI,80361.0,Indonesia,361759222.0,,,-8.7098685,115.1829325,https://maps.google.com/?cid=0x0:0xb20273175e52a48,
supermarket,Toko Swalayan,Pepito Market Petitenget,"Jl. Petitenget No.18, Kerobokan Kelod, Kuta Utara, Kerobokan Kelod, Kec. Kuta Utara, Kabupaten Badung, Bali 80361","Kerobokan Kelod, Kuta Utara, Kerobokan Kelod, Kec. Kuta Utara, Kabupaten Badung",BALI,80361.0,Indonesia,87700021888.0,,,-8.6735672,115.1578147,https://maps.google.com/?cid=0x0:0x63763bb525319cbf,
supermarket,Toko Makanan Sehat,Alive Wholefoods Store Canggu,"Jl. Canggu Padang Linjong No.14a, Canggu, Kec. Kuta Utara, Kabupaten Badung, Bali 80351","Canggu, Kec. Kuta Utara, Kabupaten Badung",BALI,80351.0,Indonesia,82146165452.0,,,-8.641887,115.139118,https://maps.google.com/?cid=0x0:0xc86a09ca901b192f,
supermarket,Toko Alat Listrik,Purnama Listrik,"HF67+JQ9, br lusuh kangin, Pering Sari, Kec. Selat, Kabupaten Karangasem, Bali 80862","br lusuh kangin, Pering Sari, Kec. Selat, Kabupaten Karangasem",BALI,80862.0,Indonesia,85847216979.0,,,-8.4384675,115.4644708,https://maps.google.com/?cid=0x0:0xc068a7e935423ed7,
supermarket,Toko Pakaian,puji shoop,"abian tiing, Kec. Selat, Kabupaten Karangasem, Bali 80862","Kec. Selat, Kabupaten Karangasem",BALI,80862.0,Indonesia,82144931857.0,,,-8.437853,115.465897,https://maps.google.com/?cid=0x0:0x43989ad4f28d5099,
supermarket,Gudang,Gede game farm,"HF68+Q77, Br.Umasari Kangin, Pering Sari, Kec. Selat, Kabupaten Karangasem, Bali 80862","Br.Umasari Kangin, Pering Sari, Kec. Selat, Kabupaten Karangasem",BALI,80862.0,Indonesia,85738888427.0,,,-8.438088,115.4656633,https://maps.google.com/?cid=0x0:0x5b1863ab87bbe6de,
supermarket,Toko,Mr. G Mini Market,"Jl. Raya Keliki, Keliki, Kec. Tegallalang, Kabupaten Gianyar, Bali 80561","Keliki, Kec. Tegallalang, Kabupaten Gianyar",BALI,80561.0,Indonesia,361981405.0,,,-8.4474851,115.2630197,https://maps.google.com/?cid=0x0:0xb00505f357496d8a,
supermarket,Pujasera,Taman Sari Market,"Jl. Gn. Tangkuban Perahu No.1, Kerobokan Kelod, Kec. Kuta Utara, Kabupaten Badung, Bali 80361","Kerobokan Kelod, Kec. Kuta Utara, Kabupaten Badung",BALI,80361.0,Indonesia,,,,-8.6721826,115.1651845,https://maps.google.com/?cid=0x0:0xf3a99a5d4388a966,
supermarket,Toko Bahan Bangunan,Puspa Reni. UD,"HF68+WCX, JL. Gunung Agung, Banjar Selat Kelod, Selat, Pering Sari, Karangasem, Kabupaten Karangasem, Bali 80862","JL. Gunung Agung, Banjar Selat Kelod, Selat, Pering Sari, Karangasem, Kabupaten Karangasem",BALI,80862.0,Indonesia,82144533595.0,,,-8.437634,115.4661243,https://maps.google.com/?cid=0x0:0x6ab361bd12c357ac,
supermarket,Pusat Perbelanjaan,Samasta Lifestyle Village,"Jl. Wanagiri No.1, Jimbaran, Kec. Kuta Sel., Kabupaten Badung, Bali 80364","Jimbaran, Kec. Kuta Sel., Kabupaten Badung",BALI,80364.0,Indonesia,3614468600.0,,,-8.7854194,115.1646306,https://maps.google.com/?cid=0x0:0xdf163c083d2953e7,
supermarket,Kerajinan,Adi Antiques,"HF78+88M, Dusun Muncan, Selat Karang Asem, Pering Sari, Bangli, Kabupaten Karangasem, Bali 80862","Dusun Muncan, Selat Karang Asem, Pering Sari, Bangli, Kabupaten Karangasem",BALI,80862.0,Indonesia,823612928.0,,,-8.436673,115.465786,https://maps.google.com/?cid=0x0:0x1b84108f00eff387,
supermarket,Pusat Perbelanjaan,Seminyak Square,"Jl. Kayu Aya No.1, Seminyak, Kec. Kuta, Kabupaten Badung, Bali 80361","Seminyak, Kec. Kuta, Kabupaten Badung",BALI,80361.0,Indonesia,81337212337.0,,,-8.6838546,115.1571397,https://maps.google.com/?cid=0x0:0xd960b2362f7999e9,
supermarket,Toko Gadai,Pegadaian UPC Selat,"Jl. Pasar Pesangkan, Pering Sari, Karangasem, Kabupaten Karangasem, Bali 80862","Pering Sari, Karangasem, Kabupaten Karangasem",BALI,80862.0,Indonesia,36321020.0,,,-8.437853,115.465897,https://maps.google.com/?cid=0x0:0xfb1dbfa7b4e7fe1e,
supermarket,Minimarket,Alfamart,"Jl. Patih Rumbih Kel No.13-14, RT.040/RW.004, Selat Tengah, Kec. Selat, Kabupaten Kapuas, Kalimantan Tengah 73514","RT.040/RW.004, Selat Tengah, Kec. Selat, Kabupaten Kapuas",BALI,73514.0,Indonesia,1500959.0,,,-3.0067536,114.3843422,https://maps.google.com/?cid=0x0:0x4778d32d37417c91,
supermarket,supermarket,Selat Bali,,,BALI,,Indonesia,,,,-8.1,114.425,https://maps.google.com/?cid=0x0:0x2a027a7715df34d0,
supermarket,Minimarket,Alfamart,"Jl. Patih Rumbih Kel, RT.004/RW.004, Selat Tengah, Kec. Selat, Kabupaten Kapuas, Kalimantan Tengah 73514","RT.004/RW.004, Selat Tengah, Kec. Selat, Kabupaten Kapuas",BALI,73514.0,Indonesia,1500959.0,,,-2.998047,114.3686888,https://maps.google.com/?cid=0x0:0xb637ef3cf4e8b622,
supermarket,Minimarket,Alfamart,"Jl. Cilik Riwut Kel No.Rt 19, Selat Dalam, Kec. Selat, Kabupaten Kapuas, Kalimantan Tengah 73516","Selat Dalam, Kec. Selat, Kabupaten Kapuas",BALI,73516.0,Indonesia,1500959.0,,,-3.0021867,114.3930721,https://maps.google.com/?cid=0x0:0x9c4773ec7277b7a8,
supermarket,Minimarket,Adi mart,"Jl. Seroja, Selat Hilir, Kec. Selat, Kabupaten Kapuas, Kalimantan Tengah 73516","Selat Hilir, Kec. Selat, Kabupaten Kapuas",BALI,73516.0,Indonesia,81257975142.0,,,-3.0167366,114.394553,https://maps.google.com/?cid=0x0:0x49072dc4963b6df0,
supermarket,Toko bahan makanan,Toko GERSON,"X9MJ+4C2, Selat Hilir, Kec. Selat, Kabupaten Kapuas, Kalimantan Tengah 73516","Selat Hilir, Kec. Selat, Kabupaten Kapuas",BALI,73516.0,Indonesia,,,,-3.0172472,114.3810275,https://maps.google.com/?cid=0x0:0xbfda92d9785fec8a,
supermarket,Toko bahan makanan,Toko Fitri,"Jl. Patih Rumbih Jl. Pilau Gg. VII No.19, Selat Tengah, Kec. Selat, Kabupaten Kapuas, Kalimantan Tengah 73516","Selat Tengah, Kec. Selat, Kabupaten Kapuas",BALI,73516.0,Indonesia,,,,-3.0040691,114.3778849,https://maps.google.com/?cid=0x0:0x6524ad6010bcdd1c,
supermarket,Minimarket,Alfamart,"Jl. Pemuda No.Rt.2, Kel.Selat Dalam, Kec. Selat, Kabupaten Kapuas, Kalimantan Tengah 73516","Kel.Selat Dalam, Kec. Selat, Kabupaten Kapuas",BALI,73516.0,Indonesia,,,,-3.0005355,114.3924626,https://maps.google.com/?cid=0x0:0xbc0559e1f06ce117,
supermarket,Minimarket,Alfamart,"Selat Hilir, Kec. Selat, Kabupaten Kapuas, Kalimantan Tengah 73516","Kec. Selat, Kabupaten Kapuas",BALI,73516.0,Indonesia,,,,-3.0183616,114.3877799,https://maps.google.com/?cid=0x0:0xe3c9cab6ec4fd720,
supermarket,supermarket,Selat,"Pering Sari, Kec. Selat, Kabupaten Karangasem, Bali","Kabupaten Karangasem, Bali",BALI,,Indonesia,,,,-8.437853,115.465897,https://maps.google.com/?cid=0x0:0x22f53a4a73abc935,
supermarket,Toko Swalayan,Grand Lucky Supermarket,"Jl. Sunset Road No.29, Kuta, Kec. Kuta, Kabupaten Badung, Bali 80361","Kuta, Kec. Kuta, Kabupaten Badung",BALI,80361.0,Indonesia,361762308.0,,,-8.7071714,115.1837175,https://maps.google.com/?cid=0x0:0xf625ece1b610a74c,
supermarket,Toko Bahan Bangunan,Mekar Indah,"HF78+4F8, Pering Sari, Kec. Selat, Kabupaten Karangasem, Bali 80862","Pering Sari, Kec. Selat, Kabupaten Karangasem",BALI,80862.0,Indonesia,36622860.0,,,-8.437225,115.466216,https://maps.google.com/?cid=0x0:0x7c2ef6ca377f81e4,
supermarket,Toko bahan makanan,Frestive Kerobokan - Supermarket,"Jl. Raya Kerobokan, Banjar, Taman, Kabupaten Badung, Bali 80361","Banjar, Taman, Kabupaten Badung",BALI,80361.0,Indonesia,87861718854.0,,,-8.6733495,115.1650827,https://maps.google.com/?cid=0x0:0x6f83634b6a7faaba,
supermarket,Toko Swalayan,Papaya Fresh Gallery - Kuta,"Jalan Merta Nadi No.Banjar, Abian Base, Kec. Kuta, Kabupaten Badung, Bali 80361","Abian Base, Kec. Kuta, Kabupaten Badung",BALI,80361.0,Indonesia,361759222.0,,,-8.7098685,115.1829325,https://maps.google.com/?cid=0x0:0xb20273175e52a48,
supermarket,Toko Alat Listrik,Purnama Listrik,"HF67+JQ9, br lusuh kangin, Pering Sari, Kec. Selat, Kabupaten Karangasem, Bali 80862","br lusuh kangin, Pering Sari, Kec. Selat, Kabupaten Karangasem",BALI,80862.0,Indonesia,85847216979.0,,,-8.4384675,115.4644708,https://maps.google.com/?cid=0x0:0xc068a7e935423ed7,
supermarket,Toko Swalayan,Pepito Market Petitenget,"Jl. Petitenget No.18, Kerobokan Kelod, Kuta Utara, Kerobokan Kelod, Kec. Kuta Utara, Kabupaten Badung, Bali 80361","Kerobokan Kelod, Kuta Utara, Kerobokan Kelod, Kec. Kuta Utara, Kabupaten Badung",BALI,80361.0,Indonesia,87700021888.0,,,-8.6735672,115.1578147,https://maps.google.com/?cid=0x0:0x63763bb525319cbf,
supermarket,Toko Pakaian,puji shoop,"abian tiing, Kec. Selat, Kabupaten Karangasem, Bali 80862","Kec. Selat, Kabupaten Karangasem",BALI,80862.0,Indonesia,82144931857.0,,,-8.437853,115.465897,https://maps.google.com/?cid=0x0:0x43989ad4f28d5099,
supermarket,Gudang,Gede game farm,"HF68+Q77, Br.Umasari Kangin, Pering Sari, Kec. Selat, Kabupaten Karangasem, Bali 80862","Br.Umasari Kangin, Pering Sari, Kec. Selat, Kabupaten Karangasem",BALI,80862.0,Indonesia,85738888427.0,,,-8.438088,115.4656633,https://maps.google.com/?cid=0x0:0x5b1863ab87bbe6de,
supermarket,Toko Bahan Bangunan,Puspa Reni. UD,"HF68+WCX, JL. Gunung Agung, Banjar Selat Kelod, Selat, Pering Sari, Karangasem, Kabupaten Karangasem, Bali 80862","JL. Gunung Agung, Banjar Selat Kelod, Selat, Pering Sari, Karangasem, Kabupaten Karangasem",BALI,80862.0,Indonesia,82144533595.0,,,-8.437634,115.4661243,https://maps.google.com/?cid=0x0:0x6ab361bd12c357ac,
supermarket,Kerajinan,Adi Antiques,"HF78+88M, Dusun Muncan, Selat Karang Asem, Pering Sari, Bangli, Kabupaten Karangasem, Bali 80862","Dusun Muncan, Selat Karang Asem, Pering Sari, Bangli, Kabupaten Karangasem",BALI,80862.0,Indonesia,823612928.0,,,-8.436673,115.465786,https://maps.google.com/?cid=0x0:0x1b84108f00eff387,
supermarket,Toko Gadai,Pegadaian UPC Selat,"Jl. Pasar Pesangkan, Pering Sari, Karangasem, Kabupaten Karangasem, Bali 80862","Pering Sari, Karangasem, Kabupaten Karangasem",BALI,80862.0,Indonesia,36321020.0,,,-8.437853,115.465897,https://maps.google.com/?cid=0x0:0xfb1dbfa7b4e7fe1e,
supermarket,Toko,Toko Mini Market  frozen food Lina,"X9MR+59C, Selat Hilir, Kec. Selat, Kabupaten Kapuas, Kalimantan Tengah 73516","Selat Hilir, Kec. Selat, Kabupaten Kapuas",BALI,73516.0,Indonesia,89691377102.0,,,-3.0170611,114.3909047,https://maps.google.com/?cid=0x0:0x8b2cbe6449ef714b,
supermarket,supermarket,UD MULIA MANDIRI,"Pering Sari, Kec. Selat, Kabupaten Karangasem, Bali 80862","Kec. Selat, Kabupaten Karangasem",BALI,80862.0,Indonesia,,,,-8.438058,115.4654979,https://maps.google.com/?cid=0x0:0x688684ceaff05893,
supermarket,supermarket,Selat Bali,,,BALI,,Indonesia,,,,-8.1,114.425,https://maps.google.com/?cid=0x0:0x2a027a7715df34d0,
supermarket,Toko bahan makanan,Toko GERSON,"X9MJ+4C2, Selat Hilir, Kec. Selat, Kabupaten Kapuas, Kalimantan Tengah 73516","Selat Hilir, Kec. Selat, Kabupaten Kapuas",BALI,73516.0,Indonesia,,,,-3.0172472,114.3810275,https://maps.google.com/?cid=0x0:0xbfda92d9785fec8a,
supermarket,Minimarket,Adi mart,"Jl. Seroja, Selat Hilir, Kec. Selat, Kabupaten Kapuas, Kalimantan Tengah 73516","Selat Hilir, Kec. Selat, Kabupaten Kapuas",BALI,73516.0,Indonesia,81257975142.0,,,-3.0167366,114.394553,https://maps.google.com/?cid=0x0:0x49072dc4963b6df0,
supermarket,Minimarket,Alfamart,"Jl. Pemuda No.Rt.2, Kel.Selat Dalam, Kec. Selat, Kabupaten Kapuas, Kalimantan Tengah 73516","Kel.Selat Dalam, Kec. Selat, Kabupaten Kapuas",BALI,73516.0,Indonesia,,,,-3.0005355,114.3924626,https://maps.google.com/?cid=0x0:0xbc0559e1f06ce117,
supermarket,Toko bahan makanan,Toko Fitri,"Jl. Patih Rumbih Jl. Pilau Gg. VII No.19, Selat Tengah, Kec. Selat, Kabupaten Kapuas, Kalimantan Tengah 73516","Selat Tengah, Kec. Selat, Kabupaten Kapuas",BALI,73516.0,Indonesia,,,,-3.0040691,114.3778849,https://maps.google.com/?cid=0x0:0x6524ad6010bcdd1c,
supermarket,Minimarket,Alfamart,"Jl. Cilik Riwut Kel No.Rt 19, Selat Dalam, Kec. Selat, Kabupaten Kapuas, Kalimantan Tengah 73516","Selat Dalam, Kec. Selat, Kabupaten Kapuas",BALI,73516.0,Indonesia,1500959.0,,,-3.0021867,114.3930721,https://maps.google.com/?cid=0x0:0x9c4773ec7277b7a8,
supermarket,Toko Peralatan dan Bahan Kue,Aisya Mart,"Jl. Teratai No..03, Selat Hilir, Kec. Selat, Kabupaten Kapuas, Kalimantan Tengah 73516","Selat Hilir, Kec. Selat, Kabupaten Kapuas",BALI,73516.0,Indonesia,85828511599.0,,,-3.017963,114.3901269,https://maps.google.com/?cid=0x0:0xc1eba43c150d76d8,
supermarket,supermarket,Selat,"Pering Sari, Kec. Selat, Kabupaten Karangasem, Bali","Kabupaten Karangasem, Bali",BALI,,Indonesia,,,,-8.437853,115.465897,https://maps.google.com/?cid=0x0:0x22f53a4a73abc935,
supermarket,Restoran,Toko Perdanamart,"Selat Hilir, Kec. Selat, Kabupaten Kapuas, Kalimantan Tengah 73516","Kec. Selat, Kabupaten Kapuas",BALI,73516.0,Indonesia,82157318943.0,,,-3.0185041,114.388203,https://maps.google.com/?cid=0x0:0x1e0fb53e8f9bd1ee,
supermarket,Toko Pakaian,puji shoop,"abian tiing, Kec. Selat, Kabupaten Karangasem, Bali 80862","Kec. Selat, Kabupaten Karangasem",BALI,80862.0,Indonesia,82144931857.0,,,-8.437853,115.465897,https://maps.google.com/?cid=0x0:0x43989ad4f28d5099,
supermarket,supermarket,UD MULIA MANDIRI,"Pering Sari, Kec. Selat, Kabupaten Karangasem, Bali 80862","Kec. Selat, Kabupaten Karangasem",BALI,80862.0,Indonesia,,,,-8.438058,115.4654979,https://maps.google.com/?cid=0x0:0x688684ceaff05893,
supermarket,Toko Bahan Bangunan,Mekar Indah,"HF78+4F8, Pering Sari, Kec. Selat, Kabupaten Karangasem, Bali 80862","Pering Sari, Kec. Selat, Kabupaten Karangasem",BALI,80862.0,Indonesia,36622860.0,,,-8.437225,115.466216,https://maps.google.com/?cid=0x0:0x7c2ef6ca377f81e4,
supermarket,Toko,Toko Mini Market  frozen food Lina,"X9MR+59C, Selat Hilir, Kec. Selat, Kabupaten Kapuas, Kalimantan Tengah 73516","Selat Hilir, Kec. Selat, Kabupaten Kapuas",BALI,73516.0,Indonesia,89691377102.0,,,-3.0170611,114.3909047,https://maps.google.com/?cid=0x0:0x8b2cbe6449ef714b,
supermarket,supermarket,Selat Bali,,,BALI,,Indonesia,,,,-8.1,114.425,https://maps.google.com/?cid=0x0:0x2a027a7715df34d0,
