Category;Real Category;Business Name;Address;City;State;Postal Code;Country;Phone;Email;Website;Latitude;Longitude;Map Link;Details Link
"perumahan";"Komplek perumahan";"Desa Suwio";"MRH9+F7 Taim, Taim/Pasue, Kec. Passue, Kabupaten Mappi, Papua";"Kabupaten Mappi, Papua";"PAPUA";"";"Indonesia";"";"";"";"-6.32128";"139.818147";"https://maps.google.com/?cid=0x0:0x2889fd0791f13c49";""
"perumahan";"Komplek perumahan";"Perumahan Pemda Mappi";"C7VW+X6W, Jl. Saham Kepi, Kepi, Kec. Obaa, Kabupaten Mappi, Papua 99881";"Jl. Saham Kepi, Kepi, Kec. Obaa, Kabupaten Mappi";"PAPUA";"99881";"Indonesia";"";"";"";"-6.5550093";"139.2955735";"https://maps.google.com/?cid=0x0:0xe4845fe803afb2ad";""
"perumahan";"Komplek perumahan";"Mappi";"Jl. Irian Kepi, Kepi, Kec. Obaa, Kabupaten Mappi, Papua 99881";"Kepi, Kec. Obaa, Kabupaten Mappi";"PAPUA";"99881";"Indonesia";"";"";"";"-6.5608648";"139.2867347";"https://maps.google.com/?cid=0x0:0x3fcf2f573baee07";""
"perumahan";"Komplek perumahan";"Rumah";"C7QP+MM5, Jl. Irian Kepi, Kepi, Kec. Obaa, Kabupaten Mappi, Papua 99881";"Jl. Irian Kepi, Kepi, Kec. Obaa, Kabupaten Mappi";"PAPUA";"99881";"Indonesia";" 082191754441";"";"";"-6.5608648";"139.2867347";"https://maps.google.com/?cid=0x0:0xe67a5786c761c9f7";""
"perumahan";"Komplek perumahan";"Rumah Keluarga Tuamely Letsoin";"F877+2J, Obaa, Kec. Obaa, Kabupaten Mappi, Papua 99881";"Obaa, Kec. Obaa, Kabupaten Mappi";"PAPUA";"99881";"Indonesia";" 081247776550";"";"";"-6.5374428";"139.3140207";"https://maps.google.com/?cid=0x0:0xa1436a2cfa71f4b4";""
"perumahan";"Komplek perumahan";"Tampang home";"C8X4+29J, Jl. Kak, Kepi, Kec. Obaa, Kabupaten Mappi, Papua 99881";"Jl. Kak, Kepi, Kec. Obaa, Kabupaten Mappi";"PAPUA";"99881";"Indonesia";"";"";"";"-6.5524079";"139.3058933";"https://maps.google.com/?cid=0x0:0x1125d86d34a540b5";""
"perumahan";"perumahan";"Tanah Azhka Siregar";"C7PQ+QF3, Kepi, Kec. Obaa, Kabupaten Mappi, Papua";"Kabupaten Mappi, Papua";"PAPUA";"";"Indonesia";"";"";"";"-6.564387";"139.288543";"https://maps.google.com/?cid=0x0:0xb542887ef44d2b37";""
"perumahan";"Perhimpunan Pengembang Perumahan";"Simpang 3 Saham";"C7VX+9M7, Jl. Saham Kepi, Kepi, Kec. Obaa, Kabupaten Mappi, Papua 99881";"Jl. Saham Kepi, Kepi, Kec. Obaa, Kabupaten Mappi";"PAPUA";"99881";"Indonesia";"";"";"";"-6.5570601";"139.2995301";"https://maps.google.com/?cid=0x0:0xf7aa01911e278cf7";""
"perumahan";"Komplek perumahan";"Elmas Home";"C7VW+CXH, Jl. Saham Kepi, Kepi, Kec. Obaa, Kabupaten Mappi, Papua 99881";"Jl. Saham Kepi, Kepi, Kec. Obaa, Kabupaten Mappi";"PAPUA";"99881";"Indonesia";"";"";"";"-6.5564283";"139.2974797";"https://maps.google.com/?cid=0x0:0x5b9f7718cceb6b4c";""
"perumahan";"perumahan";"Kec. Passue";"Kabupaten Mappi, Papua";"Kabupaten Mappi, Papua";"PAPUA";"";"Indonesia";"";"";"";"-6.3845424";"139.6503106";"https://maps.google.com/?cid=0x0:0x72dcf77146b3adf7";""
"perumahan";"Pembangunan Perumahan";"Cabang 3";"HHW5+JQF, Nohon, Kec. Passue, Kabupaten Mappi, Papua 99871";"Nohon, Kec. Passue, Kabupaten Mappi";"PAPUA";"99871";"Indonesia";"";"";"";"-6.4034317";"139.5594157";"https://maps.google.com/?cid=0x0:0x73a684054156303e";""
"perumahan";"perumahan";"Rumah Saleh";"C8W4+P6J, Jl. Irian Kepi, Obaa, Kec. Obaa, Kabupaten Mappi, Papua 99881";"Jl. Irian Kepi, Obaa, Kec. Obaa, Kabupaten Mappi";"PAPUA";"99881";"Indonesia";"";"";"";"-6.5531598";"139.3055234";"https://maps.google.com/?cid=0x0:0x582293d286c67fe3";""
"perumahan";"Komplek perumahan";"Rumah sewah";"F8M8+5RG, Obaa, Kec. Obaa, Kabupaten Mappi, Papua";"Kabupaten Mappi, Papua";"PAPUA";"";"Indonesia";"";"";"";"-6.517057";"139.317093";"https://maps.google.com/?cid=0x0:0x64e3c995af36c14e";""
"perumahan";"perumahan";"Distrik Minyamur";"Kabupaten Mappi, Papua";"Kabupaten Mappi, Papua";"PAPUA";"";"Indonesia";"";"";"";"-6.5749178";"138.8397403";"https://maps.google.com/?cid=0x0:0xaf9d6fba8ca5978b";""
"perumahan";"Perhimpunan Pengembang Perumahan";"Pemukiman warga";"CRGQ+2VQ, Taragae, Distrik Minyamur, Kabupaten Mappi, Papua";"Kabupaten Mappi, Papua";"PAPUA";"";"Indonesia";"";"";"";"-6.5749178";"138.8397403";"https://maps.google.com/?cid=0x0:0x687b73d171c6e062";""
"perumahan";"perumahan";"Kampung Kofar";"FP94+567, Kofar, Distrik Minyamur, Kabupaten Mappi, Papua";"Kabupaten Mappi, Papua";"PAPUA";"";"Indonesia";"";"";"";"-6.5320932";"138.7055395";"https://maps.google.com/?cid=0x0:0x702d0e15a072ecf2";""
"perumahan";"Perhimpunan Pengembang Perumahan";"Koba, kabupaten MAPPI, Papua-Indonesia";"928F+WQP, Khaumi, Kec. Mambioman Bapai, Kabupaten Mappi, Papua";"Kabupaten Mappi, Papua";"PAPUA";"";"Indonesia";"";"";"";"-6.6326585";"139.0244685";"https://maps.google.com/?cid=0x0:0x633d419d7764079";""
"perumahan";"perumahan";"Papua 99853";"Kabupaten Mappi, Papua";"Kabupaten Mappi, Papua";"PAPUA";"";"Indonesia";"";"";"";"-7.1527149";"139.5279996";"https://maps.google.com/?cid=0x0:0x8030f37c187cbb11";""
"perumahan";"Pembangunan Perumahan";"Kampung harapan";"5WF7+X5, Harapan, Venaha, Kabupaten Mappi, Papua";"Kabupaten Mappi, Papua";"PAPUA";"";"Indonesia";"";"";"";"-6.8250462";"139.9129838";"https://maps.google.com/?cid=0x0:0x3ef65292a4c275c3";""
"perumahan";"Pusat Kesehatan Masyarakat";"PKM Sahapikiya";"4VPP+R99, Unnamed Road, Sahapikia, Venaha, Kabupaten Mappi, Papua 99853";"Unnamed Road, Sahapikia, Venaha, Kabupaten Mappi";"PAPUA";"99853";"Indonesia";"";"";"";"-6.8629607";"139.8859941";"https://maps.google.com/?cid=0x0:0xfbaad3b8aded8b3b";""
"perumahan";"Pembangunan Perumahan";"KAMPUNG YODOM";"PFX8+28W, Yodom, Edera, Kabupaten Mappi, Papua 99853";"Yodom, Edera, Kabupaten Mappi";"PAPUA";"99853";"Indonesia";"";"";"";"-7.2523985";"139.4658411";"https://maps.google.com/?cid=0x0:0x14d3cc1d1a34a6f8";""
"perumahan";"Komplek perumahan";"KAMPUNG KONEBI";"XFG8+J3G, Konebi, Edera, Kabupaten Mappi, Papua 99853";"Konebi, Edera, Kabupaten Mappi";"PAPUA";"99853";"Indonesia";"";"";"";"-7.0234392";"139.4652095";"https://maps.google.com/?cid=0x0:0x519f5dbff94b7137";""
"perumahan";"Pembangunan Perumahan";"Kampung yibin";"5VQV+2H, Yibin, Venaha, Kabupaten Mappi, Papua";"Kabupaten Mappi, Papua";"PAPUA";"";"Indonesia";"";"";"";"-6.8124228";"139.8938815";"https://maps.google.com/?cid=0x0:0x68f14e4601529a55";""
"perumahan";"Komplek perumahan";"Perumahan guru (Emzon)";"VH7P+3V, Mememu, Edera, Kabupaten Mappi, Papua";"Kabupaten Mappi, Papua";"PAPUA";"";"Indonesia";" 082272222316";"";"";"-7.1372788";"139.5871548";"https://maps.google.com/?cid=0x0:0x2ae733fcdf177312";""
"perumahan";"Kantor Perusahaan";"Divisi 3";"MQ54+VP, Banamepe, Edera, Kabupaten Mappi, Papua";"Kabupaten Mappi, Papua";"PAPUA";"";"Indonesia";"";"";"";"-7.34031";"139.7567761";"https://maps.google.com/?cid=0x0:0x101e8ca27fb89f1b";""
"perumahan";"perumahan";"Rumah radiografer";"6MQR+PFR, Sibi, Edera, Kabupaten Mappi, Papua";"Kabupaten Mappi, Papua";"PAPUA";"";"Indonesia";"";"";"";"-6.7606468";"139.6911374";"https://maps.google.com/?cid=0x0:0xb0aadcbfa3d22b98";""
"perumahan";"Perumahan guru";"Rumah Mutiara";"RHPQ+3W, Bade, Edera, Kabupaten Mappi, Papua";"Kabupaten Mappi, Papua";"PAPUA";"";"Indonesia";"";"";"";"-7.1648557";"139.590942";"https://maps.google.com/?cid=0x0:0x1b3002a44b81b803";""
"perumahan";"Perumahan guru";"Janjaan Watuar";"VH7P+3V, Mememu, Edera, Kabupaten Mappi, Papua";"Kabupaten Mappi, Papua";"PAPUA";"";"Indonesia";"";"";"";"-7.1379974";"139.5871604";"https://maps.google.com/?cid=0x0:0xe22bed2a1b4247fe";""
"perumahan";"perumahan";"Kampung yare/afu";"JR7G+F3, Hello, Distrik Fofi, Kabupaten Boven Digoel, Papua";"Kabupaten Boven Digoel, Papua";"PAPUA";"";"Indonesia";"";"";"";"-6.3862598";"139.825179";"https://maps.google.com/?cid=0x0:0x47eef3653f336eba";""
"perumahan";"perumahan";"Kontrakan mas pur";"Bade, Edera, Kabupaten Mappi, Papua";"Kabupaten Mappi, Papua";"PAPUA";"";"Indonesia";" 085259809593";"";"";"-7.1564709";"139.5801508";"https://maps.google.com/?cid=0x0:0x1fe8903938d3e35";""
"perumahan";"perumahan";"kampu";"WM9C+475, Gimikia, Edera, Kabupaten Mappi, Papua 99853";"Gimikia, Edera, Kabupaten Mappi";"PAPUA";"99853";"Indonesia";"";"";"";"-7.0822391";"139.6707205";"https://maps.google.com/?cid=0x0:0x9c6258ad28ea77f7";""
"perumahan";"Pembangunan Perumahan";"Faiq Home";"6MQR+PFR, Jl.bahtera, Sibi, km5Kepi, Kabupaten Mappi, Papua";"Kabupaten Mappi, Papua";"PAPUA";"";"Indonesia";"";"";"";"-6.7606468";"139.6911374";"https://maps.google.com/?cid=0x0:0xd4126290a6050833";""
"perumahan";"Pembangunan Perumahan";"Kampung chasto";"VCM5+9C, Isyaman, Edera, Kabupaten Mappi, Papua";"Kabupaten Mappi, Papua";"PAPUA";"";"Indonesia";"";"";"";"-7.1165483";"139.4085233";"https://maps.google.com/?cid=0x0:0x6681501163f4bbe6";""
"perumahan";"Kantor Perusahaan";"Div. 2 PT. Dongin Prabawa";"MP8F+84, Banamepe, Edera, Kabupaten Mappi, Papua";"Kabupaten Mappi, Papua";"PAPUA";"";"Indonesia";"";"";"";"-7.3342291";"139.7228175";"https://maps.google.com/?cid=0x0:0x1ccb84847c69398";""
"perumahan";"Kantor Pemerintah";"Kampung Bade";"RHPV+GX, Bade, Edera, Kabupaten Mappi, Papua";"Kabupaten Mappi, Papua";"PAPUA";"";"Indonesia";"";"";"";"-7.1634372";"139.5942311";"https://maps.google.com/?cid=0x0:0x29ec5a48d3c8d622";""
"perumahan";"Pembangunan Perumahan";"Triple J";"6MQR+PFR, Sibi, Edera, Kabupaten Mappi, Papua";"Kabupaten Mappi, Papua";"PAPUA";"";"Indonesia";"";"";"";"-6.7606468";"139.6911374";"https://maps.google.com/?cid=0x0:0xcc3a56b6acc52f62";""
"perumahan";"Balai Pertemuan Desa";"Wanggate";"FGJ5+Q6X, Wanggate, Kec. Obaa, Kabupaten Mappi, Papua 99871";"Wanggate, Kec. Obaa, Kabupaten Mappi";"PAPUA";"99871";"Indonesia";"";"";"";"-6.518022";"139.508102";"https://maps.google.com/?cid=0x0:0x983a24cf60bde13c";""
"perumahan";"Komplek perumahan";"Rumah Bpk. Yusmadi Dalan";"36VF+587, Mur, Kec. Mambioman Bapai, Kabupaten Mappi, Papua";"Kabupaten Mappi, Papua";"PAPUA";"";"Indonesia";"";"";"";"-6.9070934";"139.2232819";"https://maps.google.com/?cid=0x0:0x68af5503f5d71433";""
"perumahan";"perumahan";"Yakomi";"Kabupaten Mappi, Papua";"Kabupaten Mappi, Papua";"PAPUA";"";"Indonesia";"";"";"";"-7.0968657";"139.9777136";"https://maps.google.com/?cid=0x0:0x53b07922dc974e00";""
"perumahan";"Kantor Pemerintah";"Kampung Muya";"WX3H+734, Yame, Yakomi, Kabupaten Mappi, Papua";"Kabupaten Mappi, Papua";"PAPUA";"";"Indonesia";"";"";"";"-7.0968657";"139.9777136";"https://maps.google.com/?cid=0x0:0x4a1b9afc62a04db2";""
"perumahan";"Pusat Kesehatan Masyarakat";"PKM Sahapikiya";"4VPP+R99, Unnamed Road, Sahapikia, Venaha, Kabupaten Mappi, Papua 99853";"Unnamed Road, Sahapikia, Venaha, Kabupaten Mappi";"PAPUA";"99853";"Indonesia";"";"";"";"-6.8629607";"139.8859941";"https://maps.google.com/?cid=0x0:0xfbaad3b8aded8b3b";""
"perumahan";"perumahan";"kampu";"WM9C+475, Gimikia, Edera, Kabupaten Mappi, Papua 99853";"Gimikia, Edera, Kabupaten Mappi";"PAPUA";"99853";"Indonesia";"";"";"";"-7.0822391";"139.6707205";"https://maps.google.com/?cid=0x0:0x9c6258ad28ea77f7";""
"perumahan";"perumahan";"Distrik Bamgi";"Kabupaten Mappi, Papua";"Kabupaten Mappi, Papua";"PAPUA";"";"Indonesia";"";"";"";"-6.9040338";"139.5081534";"https://maps.google.com/?cid=0x0:0xf07d873e100723e1";""
"perumahan";"Komplek perumahan";"KAMPUNG KONEBI";"XFG8+J3G, Konebi, Edera, Kabupaten Mappi, Papua 99853";"Konebi, Edera, Kabupaten Mappi";"PAPUA";"99853";"Indonesia";"";"";"";"-7.0234392";"139.4652095";"https://maps.google.com/?cid=0x0:0x519f5dbff94b7137";""
"perumahan";"Balai masyarakat";"Kampung Mur";"4664+3M7, Mur, Kec. Mambioman Bapai, Kabupaten Mappi, Papua";"Kabupaten Mappi, Papua";"PAPUA";"";"Indonesia";"";"";"";"-6.8898397";"139.206684";"https://maps.google.com/?cid=0x0:0x34022a509476e650";""
"perumahan";"Balai masyarakat";"BeLdis Area(Belakang Distrik)";"36W9+27H, Mur, Kec. Mambioman Bapai, Kabupaten Mappi, Papua 99872";"Mur, Kec. Mambioman Bapai, Kabupaten Mappi";"PAPUA";"99872";"Indonesia";"";"";"";"-6.9051739";"139.2191205";"https://maps.google.com/?cid=0x0:0x4ce19bcf966bc6db";""
"perumahan";"Kantor Pemerintah";"Kampung Bade";"RHPV+GX, Bade, Edera, Kabupaten Mappi, Papua";"Kabupaten Mappi, Papua";"PAPUA";"";"Indonesia";"";"";"";"-7.1634372";"139.5942311";"https://maps.google.com/?cid=0x0:0x29ec5a48d3c8d622";""
"perumahan";"perumahan";"Distrik Syahcame";"Kabupaten Mappi, Papua";"Kabupaten Mappi, Papua";"PAPUA";"";"Indonesia";"";"";"";"-6.92665";"139.6493658";"https://maps.google.com/?cid=0x0:0x731f2b6c588c36e1";""
"perumahan";"perumahan";"kampu";"WM9C+475, Gimikia, Edera, Kabupaten Mappi, Papua 99853";"Gimikia, Edera, Kabupaten Mappi";"PAPUA";"99853";"Indonesia";"";"";"";"-7.0822391";"139.6707205";"https://maps.google.com/?cid=0x0:0x9c6258ad28ea77f7";""
"perumahan";"Pembangunan Perumahan";"Triple J";"6MQR+PFR, Sibi, Edera, Kabupaten Mappi, Papua";"Kabupaten Mappi, Papua";"PAPUA";"";"Indonesia";"";"";"";"-6.7606468";"139.6911374";"https://maps.google.com/?cid=0x0:0xcc3a56b6acc52f62";""
"perumahan";"Komplek perumahan";"Perumahan guru (Emzon)";"VH7P+3V, Mememu, Edera, Kabupaten Mappi, Papua";"Kabupaten Mappi, Papua";"PAPUA";"";"Indonesia";" 082272222316";"";"";"-7.1372788";"139.5871548";"https://maps.google.com/?cid=0x0:0x2ae733fcdf177312";""
"perumahan";"perumahan";"Rumah radiografer";"6MQR+PFR, Sibi, Edera, Kabupaten Mappi, Papua";"Kabupaten Mappi, Papua";"PAPUA";"";"Indonesia";"";"";"";"-6.7606468";"139.6911374";"https://maps.google.com/?cid=0x0:0xb0aadcbfa3d22b98";""
"perumahan";"Pembangunan Perumahan";"Faiq Home";"6MQR+PFR, Jl.bahtera, Sibi, km5Kepi, Kabupaten Mappi, Papua";"Kabupaten Mappi, Papua";"PAPUA";"";"Indonesia";"";"";"";"-6.7606468";"139.6911374";"https://maps.google.com/?cid=0x0:0xd4126290a6050833";""
"perumahan";"Komplek perumahan";"PERUM SMADER";"RHVH+95, Bade, Edera, Kabupaten Mappi, Papua";"Kabupaten Mappi, Papua";"PAPUA";"";"Indonesia";"";"";"";"-7.1564283";"139.5776007";"https://maps.google.com/?cid=0x0:0xbcc0a82d5036c69f";""
"perumahan";"Perumahan guru";"Janjaan Watuar";"VH7P+3V, Mememu, Edera, Kabupaten Mappi, Papua";"Kabupaten Mappi, Papua";"PAPUA";"";"Indonesia";"";"";"";"-7.1379974";"139.5871604";"https://maps.google.com/?cid=0x0:0xe22bed2a1b4247fe";""
"perumahan";"Toko umum";"Kios ACHO";"VH9P+7V, Mememu, Edera, Kabupaten Mappi, Papua";"Kabupaten Mappi, Papua";"PAPUA";"";"Indonesia";"";"";"";"-7.1327008";"139.5867796";"https://maps.google.com/?cid=0x0:0xe42c04b146a6398b";""
"perumahan";"perumahan";"Papua 99875";"Kabupaten Mappi, Papua";"Kabupaten Mappi, Papua";"PAPUA";"";"Indonesia";"";"";"";"-5.8045486";"139.5279996";"https://maps.google.com/?cid=0x0:0x3c002283937ac804";""
"perumahan";"Perhimpunan Pengembang Perumahan";"Distrik Passue Bawah";"WGP7+RWC, Keta, Passue Bawah, Kabupaten Mappi, Papua";"Kabupaten Mappi, Papua";"PAPUA";"";"Indonesia";"";"";"";"-6.062941";"139.514775";"https://maps.google.com/?cid=0x0:0x7fb25b4eb0e7694b";""
"perumahan";"Komplek perumahan";"Busiri";"W9RQ+38, Busiri, Passue Bawah, Kabupaten Mappi, Papua";"Kabupaten Mappi, Papua";"PAPUA";"";"Indonesia";"";"";"";"-6.05979";"139.3883524";"https://maps.google.com/?cid=0x0:0x5bc2e4893a64a3e6";""
"perumahan";"Komplek perumahan";"Perumahan Dinas ibu Ella";"8962+6H9, Senggo, Citakmitak, Kabupaten Mappi, Papua 99875";"Senggo, Citakmitak, Kabupaten Mappi";"PAPUA";"99875";"Indonesia";"";"";"";"-5.6894643";"139.3514922";"https://maps.google.com/?cid=0x0:0x4e6813d2a2c84610";""
"perumahan";"Komplek perumahan";"Kampung Bivo";"VGX5+PPM, Keta, Passue Bawah, Kabupaten Mappi, Papua";"Kabupaten Mappi, Papua";"PAPUA";"";"Indonesia";"";"";"";"-6.100664";"139.509308";"https://maps.google.com/?cid=0x0:0xc8066b15610df4b5";""
"perumahan";"Komplek perumahan";"Kampung Tiau dan Tayau";"9H5M+G97, Amasu, Kaibar, Kabupaten Mappi, Papua 99875";"Amasu, Kaibar, Kabupaten Mappi";"PAPUA";"99875";"Indonesia";"";"";"";"-5.6412212";"139.5834074";"https://maps.google.com/?cid=0x0:0xa4bf833ad23ce017";""
"perumahan";"Perhimpunan Pengembang Perumahan";"Kampung Wowi";"F689+7P, Wowi, Suator, Kabupaten Asmat, Papua";"Kabupaten Asmat, Papua";"PAPUA";"";"Indonesia";"";"";"";"-5.5343065";"139.2193176";"https://maps.google.com/?cid=0x0:0x7f8af7fbce722bb3";""
"perumahan";"Pembangunan Perumahan";"Vakam Distrik Joutu Kab. Asmat";"FCV6+XC8, Imembi, Kaibar, Kabupaten Mappi, Papua 99875";"Imembi, Kaibar, Kabupaten Mappi";"PAPUA";"99875";"Indonesia";"";"";"";"-5.505088";"139.411064";"https://maps.google.com/?cid=0x0:0x7cf00b17ac9a10bd";""
"perumahan";"Komplek perumahan";"Kampung Bidnew";"58HF+WV8, Bidnew, Citakmitak, Kabupaten Mappi, Papua";"Kabupaten Mappi, Papua";"PAPUA";"";"Indonesia";"";"";"";"-5.8202155";"139.3247147";"https://maps.google.com/?cid=0x0:0xa0c4652b54a6fe48";""
"perumahan";"perumahan";"Passue Bawah";"Kabupaten Mappi, Papua";"Kabupaten Mappi, Papua";"PAPUA";"";"Indonesia";"";"";"";"-5.9971952";"139.4466005";"https://maps.google.com/?cid=0x0:0xb9529682c70eee4a";""
"perumahan";"Taman";"Kampung Womin";"5HFQ+CJH, Womin, Citakmitak, Kabupaten Mappi, Papua";"Kabupaten Mappi, Papua";"PAPUA";"";"Indonesia";"";"";"";"-5.8264318";"139.5891233";"https://maps.google.com/?cid=0x0:0xd3fd82cce8b196eb";""
"perumahan";"perumahan";"Keluarga Emenu";"886X+MJ, Senggo, Citakmitak, Kabupaten Mappi, Papua";"Kabupaten Mappi, Papua";"PAPUA";"";"Indonesia";"";"";"";"-5.6883236";"139.3490028";"https://maps.google.com/?cid=0x0:0xcfcf1865c2873b4d";""
"perumahan";"perumahan";"Distrik Ti Zain";"Kabupaten Mappi, Papua";"Kabupaten Mappi, Papua";"PAPUA";"";"Indonesia";"";"";"";"-5.4019657";"139.7132729";"https://maps.google.com/?cid=0x0:0xd1cf1b07f8359ef9";""
"perumahan";"Komplek perumahan";"BASMAN";"FJWH+29, Basman, Distrik Ti Zain, Kabupaten Mappi, Papua";"Kabupaten Mappi, Papua";"PAPUA";"";"Indonesia";"";"";"";"-5.5049375";"139.6284375";"https://maps.google.com/?cid=0x0:0xbac2e9621f6ea5b0";""
"perumahan";"perumahan";"Alfons'Home";"MJ4R+9G, Fomu, Distrik Ti Zain, Kabupaten Mappi, Papua";"Kabupaten Mappi, Papua";"PAPUA";"";"Indonesia";"";"";"";"-5.3429513";"139.6406956";"https://maps.google.com/?cid=0x0:0x8eb628a50efbb59d";""
"perumahan";"Komplek perumahan";"Zain house Papua";"Jl. H. Saenan No.16, RT.2/RW.9, Bedahan, Kec. Sawangan, Kota Depok, Jawa Barat 16519";"RT.2/RW.9, Bedahan, Kec. Sawangan, Kota Depok";"PAPUA";"16519";"Indonesia";"";"";"";"-6.4232107";"106.7610643";"https://maps.google.com/?cid=0x0:0x23ba8aad60645e09";""
"perumahan";"Komplek perumahan";"Kampung Tiau dan Tayau";"9H5M+G97, Amasu, Kaibar, Kabupaten Mappi, Papua 99875";"Amasu, Kaibar, Kabupaten Mappi";"PAPUA";"99875";"Indonesia";"";"";"";"-5.6412212";"139.5834074";"https://maps.google.com/?cid=0x0:0xa4bf833ad23ce017";""
"perumahan";"Balai masyarakat";"KAMPUNG AIFA";"7PQV+83X, Aifo, Distrik Bomakia, Kabupaten Boven Digoel, Papua";"Kabupaten Boven Digoel, Papua";"PAPUA";"";"Indonesia";"";"";"";"-5.7116281";"139.742726";"https://maps.google.com/?cid=0x0:0xe376516d868bb160";""
