Category;Real Category;Business Name;Address;City;State;Postal Code;Country;Phone;Email;Website;Latitude;Longitude;Map Link;Details Link
"hardware store";"Toko Bahan Bangunan";"IMMANUEL RITAIL - UD IMMANUEL";"Jl. Kemenyan No.16, Kota Sidikalang, Kec. Sidikalang, Kabupaten Dairi, Sumatera Utara 22211";"Kota Sidikalang, Kec. Sidikalang, Kabupaten Dairi";"SUMATERA UTARA";"22211";"Indonesia";" 081376226177";"";"";"2.7542408";"98.3069423";"https://maps.google.com/?cid=0x0:0xef296ca168afd178";""
"hardware store";"Toko Bahan Bangunan";"Toko Bangunan Joyce";"Jl. Air Bersih No.279, Sidiangkat, Kec. Sidikalang, Kabupaten Dairi, Sumatera Utara 22216";"Sidiangkat, Kec. Sidikalang, Kabupaten Dairi";"SUMATERA UTARA";"22216";"Indonesia";" 082297952223";"";"";"2.7130418";"98.3343563";"https://maps.google.com/?cid=0x0:0x68e111d8b15562af";""
"hardware store";"Toko Bahan Bangunan";"Toko Bangunan Semangat";"Jl. Sisingamangaraja No.268, Kota Sidikalang, Kec. Sidikalang, Kabupaten Dairi, Sumatera Utara 22219";"Kota Sidikalang, Kec. Sidikalang, Kabupaten Dairi";"SUMATERA UTARA";"22219";"Indonesia";" 082297952223";"";"";"2.7530175";"98.3094409";"https://maps.google.com/?cid=0x0:0x439881f410e4b147";""
"hardware store";"Toko Buku >>u0026 Alat Sekolah";"TOKO UD. ROHITA";"Jl. Simsim, Kota Sidikalang, Kec. Sidikalang, Kabupaten Dairi, Sumatera Utara 22219";"Kota Sidikalang, Kec. Sidikalang, Kabupaten Dairi";"SUMATERA UTARA";"22219";"Indonesia";" 081213441899";"";"";"2.7519963";"98.3093708";"https://maps.google.com/?cid=0x0:0xfd52f0c9b1907df3";""
"hardware store";"Toko";"Toko Cahaya Elektronik";"Q835+5H7, Kota Sidikalang, Kec. Sidikalang, Kabupaten Dairi, Sumatera Utara 22219";"Kota Sidikalang, Kec. Sidikalang, Kabupaten Dairi";"SUMATERA UTARA";"22219";"Indonesia";" 062721058";"";"";"2.7529202";"98.308923";"https://maps.google.com/?cid=0x0:0x302688ecfc9f2db5";""
"hardware store";"Toko Elektronik";"Bintang terang electronic sejak 1990";"Jl. Kopi No.02, Kota Sidikalang, Kec. Sidikalang, Kabupaten Dairi, Sumatera Utara 22211";"Kota Sidikalang, Kec. Sidikalang, Kabupaten Dairi";"SUMATERA UTARA";"22211";"Indonesia";" 085275192989";"";"";"2.7535519";"98.3070994";"https://maps.google.com/?cid=0x0:0x3e27d8aa550f1c1e";""
"hardware store";"Toko";"Sinar Bintang";"Jalan Dairi No.63C, Kota Sidikalang, Kec. Sidikalang, Kabupaten Dairi, Sumatera Utara 22219";"Kota Sidikalang, Kec. Sidikalang, Kabupaten Dairi";"SUMATERA UTARA";"22219";"Indonesia";" 081288288826";"";"";"2.753185";"98.306384";"https://maps.google.com/?cid=0x0:0x69690a51fa969373";""
"hardware store";"";"TB BORSAK M";"Jl. Lestari No.25, Kalang, Kec. Sidikalang, Kabupaten Dairi, Sumatera Utara 22219";"Kalang, Kec. Sidikalang, Kabupaten Dairi";"SUMATERA UTARA";"22219";"Indonesia";" 085222409395";"";"";"2.7583781";"98.3042218";"https://maps.google.com/?cid=0x0:0x30e9ec2195ddb2ff";""
"hardware store";"Toko Buku >>u0026 Alat Sekolah";"Sehat Bersaudara";"Jl. Merga Silima No.65, Kota Sidikalang, Kec. Sidikalang, Kabupaten Dairi, Sumatera Utara 22219";"Kota Sidikalang, Kec. Sidikalang, Kabupaten Dairi";"SUMATERA UTARA";"22219";"Indonesia";"";"";"";"2.7531744";"98.3064418";"https://maps.google.com/?cid=0x0:0x5f8a5298cdac6888";""
"hardware store";"Toko Pakaian Wanita";"Toko Tambahna";"Jl. Damar No.12, Kota Sidikalang, Kec. Sidikalang, Kabupaten Dairi, Sumatera Utara 22211";"Kota Sidikalang, Kec. Sidikalang, Kabupaten Dairi";"SUMATERA UTARA";"22211";"Indonesia";" 085372352158";"";"";"2.7530561";"98.3080836";"https://maps.google.com/?cid=0x0:0x81f1f383be4a90dc";""
"hardware store";"Toko Perlengkapan Rumah";"Toko Nasional Perabot";"Jl. Sitellu Nempu No.15, Kota Sidikalang, Kec. Sidikalang, Kabupaten Dairi, Sumatera Utara 22219";"Kota Sidikalang, Kec. Sidikalang, Kabupaten Dairi";"SUMATERA UTARA";"22219";"Indonesia";"";"";"";"2.7527846";"98.3087953";"https://maps.google.com/?cid=0x0:0x989a52c825a71cd6";""
"hardware store";"Toko Komputer";"Sinar Computer";"Jl. F. L Tobing No.36, Batang Beruh, Kec. Sidikalang, Kabupaten Dairi, Sumatera Utara 22212";"Batang Beruh, Kec. Sidikalang, Kabupaten Dairi";"SUMATERA UTARA";"22212";"Indonesia";" 082165034646";"";"";"2.7422236";"98.3194355";"https://maps.google.com/?cid=0x0:0xd8cc1e67ee1c1e66";""
"hardware store";"Toko";"Dirga Putra Elektronik";"Q835+4HR, Kota Sidikalang, Kec. Sidikalang, Kabupaten Dairi, Sumatera Utara 22219";"Kota Sidikalang, Kec. Sidikalang, Kabupaten Dairi";"SUMATERA UTARA";"22219";"Indonesia";"";"";"";"2.7528716";"98.3088858";"https://maps.google.com/?cid=0x0:0x1da97f669993a3fa";""
"hardware store";"Toko Elektronik";"Matahari Elektronik";"Q835+55R, Jl. Damar, Kota Sidikalang, Kec. Sidikalang, Kabupaten Dairi, Sumatera Utara 22219";"Jl. Damar, Kota Sidikalang, Kec. Sidikalang, Kabupaten Dairi";"SUMATERA UTARA";"22219";"Indonesia";" 062722334";"";"";"2.7529995";"98.3079021";"https://maps.google.com/?cid=0x0:0xe57b4ba19e8d6769";""
"hardware store";"Toko Bahan Bangunan";"Nitawati sitohang";"P9F3+524, Sitinjo II, Kec. Sitinjo, Kabupaten Dairi, Sumatera Utara 22219";"Sitinjo II, Kec. Sitinjo, Kabupaten Dairi";"SUMATERA UTARA";"22219";"Indonesia";"";"";"";"2.7228952";"98.3525712";"https://maps.google.com/?cid=0x0:0xe570aa40c7e472ca";""
"hardware store";"Bengkel Kaca";"LIA KACA SIDIKALANG";"Jln kapur Barus No.3, Kota Sidikalang, Kec. Sidikalang, Kabupaten Dairi, Sumatera Utara 22211";"Kota Sidikalang, Kec. Sidikalang, Kabupaten Dairi";"SUMATERA UTARA";"22211";"Indonesia";" 081361602449";"";"";"2.7532172";"98.3083316";"https://maps.google.com/?cid=0x0:0x6be3a8436f6127e4";""
"hardware store";"Koperasi";"Koperasi Sumber Daya Sidikalang";"Jl. Kepas No.14, Kota Sidikalang, Kec. Sidikalang, Kabupaten Dairi, Sumatera Utara 22219";"Kota Sidikalang, Kec. Sidikalang, Kabupaten Dairi";"SUMATERA UTARA";"22219";"Indonesia";"";"";"";"2.7517364";"98.309565";"https://maps.google.com/?cid=0x0:0x35e1c87f9437b35f";""
"hardware store";"Toko Buku >>u0026 Alat Sekolah";"Toko Alvaro";"Jl. Pahlawan No.99, Batang Beruh, Kec. Sidikalang, Kabupaten Dairi, Sumatera Utara 22217";"Batang Beruh, Kec. Sidikalang, Kabupaten Dairi";"SUMATERA UTARA";"22217";"Indonesia";"";"";"";"2.7340813";"98.3368473";"https://maps.google.com/?cid=0x0:0xf940247b87c080b4";""
"hardware store";"Toko Suku Cadang Mobil";"Setia Mobil";"Jl. Sulang Silima No.6, Kota Sidikalang, Kec. Sidikalang, Kabupaten Dairi, Sumatera Utara 22219";"Kota Sidikalang, Kec. Sidikalang, Kabupaten Dairi";"SUMATERA UTARA";"22219";"Indonesia";" 06272520382";"";"";"2.7534629";"98.3078836";"https://maps.google.com/?cid=0x0:0xd4be82763f9b0488";""
"hardware store";"Area Mendaki";"CV. AEK BOLON";"Jl. Runding No.81, Sidiangkat, Kec. Sidikalang, Kabupaten Dairi, Sumatera Utara 22216";"Sidiangkat, Kec. Sidikalang, Kabupaten Dairi";"SUMATERA UTARA";"22216";"Indonesia";" 081265184123";"";"";"2.7199953";"98.3141309";"https://maps.google.com/?cid=0x0:0xee142fd676bd1452";""
"hardware store";"hardware store";"Toko Serbaguna";"Q834+HPQ, Kota Sidikalang, Kec. Sidikalang, Kabupaten Dairi, Sumatera Utara 22219";"Kota Sidikalang, Kec. Sidikalang, Kabupaten Dairi";"SUMATERA UTARA";"22219";"Indonesia";"";"";"";"2.7539721";"98.3068526";"https://maps.google.com/?cid=0x0:0xfdd894f3ddbac5e3";""
"hardware store";"Pemasok produk gipsum";"UD.BAGUS MURAH (IMAS Group)";"Jl. Ahmad Yani No.114, Batang Beruh, Kec. Sidikalang, Kabupaten Dairi, Sumatera Utara 22212";"Batang Beruh, Kec. Sidikalang, Kabupaten Dairi";"SUMATERA UTARA";"22212";"Indonesia";" 062723438";"";"";"2.7390102";"98.3253835";"https://maps.google.com/?cid=0x0:0x3166a28656c6e44d";""
"hardware store";"Toko Elektronik";"METRO SIDIKALANG";"Jl. Kepas No.22, Kota Sidikalang, Kec. Sidikalang, Kabupaten Dairi, Sumatera Utara 22219";"Kota Sidikalang, Kec. Sidikalang, Kabupaten Dairi";"SUMATERA UTARA";"22219";"Indonesia";" 081362379221";"";"";"2.7516096";"98.309516";"https://maps.google.com/?cid=0x0:0x1e5c27a09953d2e6";""
"hardware store";"hardware store";"Sumatera Utara 22261";"Kec. Siempat Nempu, Kabupaten Dairi, Sumatera Utara";"Kabupaten Dairi, Sumatera Utara";"SUMATERA UTARA";"";"Indonesia";"";"";"";"2.838653";"98.1666344";"https://maps.google.com/?cid=0x0:0xc2c3a0bf6eb1765c";""
"hardware store";"Toko Bahan Bangunan";"UD. ASI";"W342+PP3, Unnamed Road, Pardomuan, Kec. Siempat Nempu Hilir, Kabupaten Dairi, Sumatera Utara 22263";"Unnamed Road, Pardomuan, Kec. Siempat Nempu Hilir, Kabupaten Dairi";"SUMATERA UTARA";"22263";"Indonesia";" 082160309088";"";"";"2.9067701";"98.0518094";"https://maps.google.com/?cid=0x0:0x10df68fbb6161910";""
"hardware store";"Toko Perlengkapan Rumah";"MR DIY Sidikalang";"Jl. Sisingamangaraja No.4, Kota Sidikalang, Kec. Sidikalang, Kabupaten Dairi, Sumatera Utara 22219";"Kota Sidikalang, Kec. Sidikalang, Kabupaten Dairi";"SUMATERA UTARA";"22219";"Indonesia";"";"";"";"2.7574646";"98.3072229";"https://maps.google.com/?cid=0x0:0xa0f48796700b9295";""
"hardware store";"Toko Bahan Bangunan";"CV MPJ";"R5JC+PPQ, Sihorbo, Kec. Siempat Nempu, Kabupaten Dairi, Sumatera Utara";"Kabupaten Dairi, Sumatera Utara";"SUMATERA UTARA";"";"Indonesia";" 081376164114";"";"";"2.8318361";"98.171851";"https://maps.google.com/?cid=0x0:0x28ec94e758ac43eb";""
"hardware store";"Toko Bahan Bangunan";"IMMANUEL RITAIL - UD IMMANUEL";"Jl. Kemenyan No.16, Kota Sidikalang, Kec. Sidikalang, Kabupaten Dairi, Sumatera Utara 22211";"Kota Sidikalang, Kec. Sidikalang, Kabupaten Dairi";"SUMATERA UTARA";"22211";"Indonesia";" 081376226177";"";"";"2.7542408";"98.3069423";"https://maps.google.com/?cid=0x0:0xef296ca168afd178";""
"hardware store";"hardware store";"OndiNapit";"R5CX+V3J, Jl. Buntu Raja, Adian Nangka, Kec. Siempat Nempu, Kabupaten Dairi, Sumatera Utara 22261";"Jl. Buntu Raja, Adian Nangka, Kec. Siempat Nempu, Kabupaten Dairi";"SUMATERA UTARA";"22261";"Indonesia";"";"";"";"2.8223734";"98.1972978";"https://maps.google.com/?cid=0x0:0x60b4402e865c9bc0";""
"hardware store";"hardware store";"Kec. Siempat Nempu";"Kabupaten Dairi, Sumatera Utara";"Kabupaten Dairi, Sumatera Utara";"SUMATERA UTARA";"";"Indonesia";"";"";"";"2.7959657";"98.2257096";"https://maps.google.com/?cid=0x0:0xa67ebda917c8873d";""
"hardware store";"Toko Bahan Bangunan";"UD. ASI";"W342+PP3, Unnamed Road, Pardomuan, Kec. Siempat Nempu Hilir, Kabupaten Dairi, Sumatera Utara 22263";"Unnamed Road, Pardomuan, Kec. Siempat Nempu Hilir, Kabupaten Dairi";"SUMATERA UTARA";"22263";"Indonesia";" 082160309088";"";"";"2.9067701";"98.0518094";"https://maps.google.com/?cid=0x0:0x10df68fbb6161910";""
"hardware store";"";"UD.ASIONG";"W688+3X2, Jl. Sidikalang - Kutabuluh, Tigalingga, Kec. Tigalingga, Kabupaten Dairi, Sumatera Utara 22253";"Jl. Sidikalang - Kutabuluh, Tigalingga, Kec. Tigalingga, Kabupaten Dairi";"SUMATERA UTARA";"22253";"Indonesia";" 081375694568";"";"";"2.9151357";"98.2173964";"https://maps.google.com/?cid=0x0:0x2f3672d93c07fb0";""
"hardware store";"Toko Bahan Bangunan";"CV MPJ";"R5JC+PPQ, Sihorbo, Kec. Siempat Nempu, Kabupaten Dairi, Sumatera Utara";"Kabupaten Dairi, Sumatera Utara";"SUMATERA UTARA";"";"Indonesia";" 081376164114";"";"";"2.8318361";"98.171851";"https://maps.google.com/?cid=0x0:0x28ec94e758ac43eb";""
"hardware store";"hardware store";"Sumatera Utara 22254";"Kabupaten Dairi, Sumatera Utara";"Kabupaten Dairi, Sumatera Utara";"SUMATERA UTARA";"";"Indonesia";"";"";"";"2.7983952";"98.2760021";"https://maps.google.com/?cid=0x0:0xa5515747a1b84388";""
"hardware store";"Toko Bahan Bangunan";"IMMANUEL RITAIL - UD IMMANUEL";"Jl. Kemenyan No.16, Kota Sidikalang, Kec. Sidikalang, Kabupaten Dairi, Sumatera Utara 22211";"Kota Sidikalang, Kec. Sidikalang, Kabupaten Dairi";"SUMATERA UTARA";"22211";"Indonesia";" 081376226177";"";"";"2.7542408";"98.3069423";"https://maps.google.com/?cid=0x0:0xef296ca168afd178";""
"hardware store";"hardware store";"Kec. Siempat Nempu Hulu";"Kabupaten Dairi, Sumatera Utara";"Kabupaten Dairi, Sumatera Utara";"SUMATERA UTARA";"";"Indonesia";"";"";"";"2.844543";"98.2498248";"https://maps.google.com/?cid=0x0:0x5929b6b0e31f4fc9";""
"hardware store";"hardware store";"Sumatera Utara 22281";"Kabupaten Dairi, Sumatera Utara";"Kabupaten Dairi, Sumatera Utara";"SUMATERA UTARA";"";"Indonesia";"";"";"";"2.6986375";"98.4513272";"https://maps.google.com/?cid=0x0:0x3e94b4fe24e3cfb2";""
"hardware store";"Toko Perlengkapan Rumah";"MR DIY Sidikalang";"Jl. Sisingamangaraja No.4, Kota Sidikalang, Kec. Sidikalang, Kabupaten Dairi, Sumatera Utara 22219";"Kota Sidikalang, Kec. Sidikalang, Kabupaten Dairi";"SUMATERA UTARA";"22219";"Indonesia";"";"";"";"2.7574646";"98.3072229";"https://maps.google.com/?cid=0x0:0xa0f48796700b9295";""
"hardware store";"Toko Bahan Bangunan";"Panglong S. Girsang";"JL Sidikalang - Medan, Gunung Selamat 1, Tanjung Beringin 1, Sumbul, Dairi, Tj. Beringin, Sidikalang, Kabupaten Dairi, Sumatera Utara 22281";"Gunung Selamat 1, Tanjung Beringin 1, Sumbul, Dairi, Tj. Beringin, Sidikalang, Kabupaten Dairi";"SUMATERA UTARA";"22281";"Indonesia";" 08126414210";"";"";"2.76158";"98.47067";"https://maps.google.com/?cid=0x0:0x8ce1338128908618";""
"hardware store";"Toko Bahan Bangunan";"Toko Bangunan Semangat";"Jl. Sisingamangaraja No.268, Kota Sidikalang, Kec. Sidikalang, Kabupaten Dairi, Sumatera Utara 22219";"Kota Sidikalang, Kec. Sidikalang, Kabupaten Dairi";"SUMATERA UTARA";"22219";"Indonesia";" 082297952223";"";"";"2.7530175";"98.3094409";"https://maps.google.com/?cid=0x0:0x439881f410e4b147";""
"hardware store";"Toko Bahan Bangunan";"Toko bangunan AVE Sigalingging";"MC9R+MH2, Jl. Dolok Sanggul - Sidikalang, Parbuluan IV, Kec. Parbuluan, Kabupaten Dairi, Sumatera Utara 22282";"Jl. Dolok Sanggul - Sidikalang, Parbuluan IV, Kec. Parbuluan, Kabupaten Dairi";"SUMATERA UTARA";"22282";"Indonesia";" 081270000844";"";"";"2.6691149";"98.4413803";"https://maps.google.com/?cid=0x0:0x345d657f98d8641a";""
"hardware store";"Toko Bahan Bangunan";"UD. ASI";"W342+PP3, Unnamed Road, Pardomuan, Kec. Siempat Nempu Hilir, Kabupaten Dairi, Sumatera Utara 22263";"Unnamed Road, Pardomuan, Kec. Siempat Nempu Hilir, Kabupaten Dairi";"SUMATERA UTARA";"22263";"Indonesia";" 082160309088";"";"";"2.9067701";"98.0518094";"https://maps.google.com/?cid=0x0:0x10df68fbb6161910";""
"hardware store";"Toko Bahan Bangunan";"Nitawati sitohang";"P9F3+524, Sitinjo II, Kec. Sitinjo, Kabupaten Dairi, Sumatera Utara 22219";"Sitinjo II, Kec. Sitinjo, Kabupaten Dairi";"SUMATERA UTARA";"22219";"Indonesia";"";"";"";"2.7228952";"98.3525712";"https://maps.google.com/?cid=0x0:0xe570aa40c7e472ca";""
"hardware store";"Toko Bahan Bangunan";"Toko Bangunan Joyce";"Jl. Air Bersih No.279, Sidiangkat, Kec. Sidikalang, Kabupaten Dairi, Sumatera Utara 22216";"Sidiangkat, Kec. Sidikalang, Kabupaten Dairi";"SUMATERA UTARA";"22216";"Indonesia";" 082297952223";"";"";"2.7130418";"98.3343563";"https://maps.google.com/?cid=0x0:0x68e111d8b15562af";""
"hardware store";"Toko Bahan Bangunan";"CV MPJ";"R5JC+PPQ, Sihorbo, Kec. Siempat Nempu, Kabupaten Dairi, Sumatera Utara";"Kabupaten Dairi, Sumatera Utara";"SUMATERA UTARA";"";"Indonesia";" 081376164114";"";"";"2.8318361";"98.171851";"https://maps.google.com/?cid=0x0:0x28ec94e758ac43eb";""
"hardware store";"Tujuan Wisata";"Tugu Makam Raja Silahisabungan";"RG7H+29V, Jalan Tugu Makam Raja Desa, Silalahi III, Kec. Silahsabungan, Kabupaten Dairi, Sumatera Utara 22284";"Jalan Tugu Makam Raja Desa, Silalahi III, Kec. Silahsabungan, Kabupaten Dairi";"SUMATERA UTARA";"22284";"Indonesia";" 081380986099";"";"";"2.8126211";"98.5284213";"https://maps.google.com/?cid=0x0:0x1b51dbcc5b7d70b8";""
"hardware store";"Pantai Umum";"Silalahi 1";"QG6M+RF6, Silalahi I, Kec. Silahsabungan, Kabupaten Dairi, Sumatera Utara";"Kabupaten Dairi, Sumatera Utara";"SUMATERA UTARA";"";"Indonesia";"";"";"";"2.7620477";"98.5336525";"https://maps.google.com/?cid=0x0:0x19c904a3cc337d3f";""
"hardware store";"Tujuan Wisata";"Pos Bukit siattaratas 1";"RG7G+MH5, Paropo, Kec. Silahsabungan, Kabupaten Dairi, Sumatera Utara";"Kabupaten Dairi, Sumatera Utara";"SUMATERA UTARA";"";"Indonesia";"";"";"";"2.8141366";"98.5264933";"https://maps.google.com/?cid=0x0:0xe68590ba3b68287f";""
"hardware store";"hardware store";"Sumatera Utara 22262";"Kec. Silima Pungga-Pungga, Kabupaten Dairi, Sumatera Utara";"Kabupaten Dairi, Sumatera Utara";"SUMATERA UTARA";"";"Indonesia";"";"";"";"2.8192125";"98.1229329";"https://maps.google.com/?cid=0x0:0x8b037dfe3a37e982";""
"hardware store";"Sekolah Menengah Atas";"SMA NEGERI 1 SILIMA PUNGGA PUNGGA";"Parongil, Kec. Silima Pungga-Pungga, Kabupaten Dairi, Sumatera Utara 22262";"Kec. Silima Pungga-Pungga, Kabupaten Dairi";"SUMATERA UTARA";"22262";"Indonesia";" 087747461412";"";"";"2.8318686";"98.1424778";"https://maps.google.com/?cid=0x0:0x6ac63395b9b26e81";""
"hardware store";"Toko";"Toko RAJA";"R4HR+6F4, Palipi, Kec. Silima Pungga-Pungga, Kabupaten Dairi, Sumatera Utara";"Kabupaten Dairi, Sumatera Utara";"SUMATERA UTARA";"";"Indonesia";"";"";"";"2.8280152";"98.1412014";"https://maps.google.com/?cid=0x0:0xf0490c30e50b0bca";""
"hardware store";"Toko Bahan Bangunan";"Panglong S. Girsang";"JL Sidikalang - Medan, Gunung Selamat 1, Tanjung Beringin 1, Sumbul, Dairi, Tj. Beringin, Sidikalang, Kabupaten Dairi, Sumatera Utara 22281";"Gunung Selamat 1, Tanjung Beringin 1, Sumbul, Dairi, Tj. Beringin, Sidikalang, Kabupaten Dairi";"SUMATERA UTARA";"22281";"Indonesia";" 08126414210";"";"";"2.76158";"98.47067";"https://maps.google.com/?cid=0x0:0x8ce1338128908618";""
"hardware store";"Toko Bahan Bangunan";"CV MPJ";"R5JC+PPQ, Sihorbo, Kec. Siempat Nempu, Kabupaten Dairi, Sumatera Utara";"Kabupaten Dairi, Sumatera Utara";"SUMATERA UTARA";"";"Indonesia";" 081376164114";"";"";"2.8318361";"98.171851";"https://maps.google.com/?cid=0x0:0x28ec94e758ac43eb";""
"hardware store";"Toko Bahan Bangunan";"IMMANUEL RITAIL - UD IMMANUEL";"Jl. Kemenyan No.16, Kota Sidikalang, Kec. Sidikalang, Kabupaten Dairi, Sumatera Utara 22211";"Kota Sidikalang, Kec. Sidikalang, Kabupaten Dairi";"SUMATERA UTARA";"22211";"Indonesia";" 081376226177";"";"";"2.7542408";"98.3069423";"https://maps.google.com/?cid=0x0:0xef296ca168afd178";""
"hardware store";"Toko Perlengkapan Rumah";"MR DIY Sidikalang";"Jl. Sisingamangaraja No.4, Kota Sidikalang, Kec. Sidikalang, Kabupaten Dairi, Sumatera Utara 22219";"Kota Sidikalang, Kec. Sidikalang, Kabupaten Dairi";"SUMATERA UTARA";"22219";"Indonesia";"";"";"";"2.7574646";"98.3072229";"https://maps.google.com/?cid=0x0:0xa0f48796700b9295";""
"hardware store";"Toko Bahan Bangunan";"Toko Bangunan Joyce";"Jl. Air Bersih No.279, Sidiangkat, Kec. Sidikalang, Kabupaten Dairi, Sumatera Utara 22216";"Sidiangkat, Kec. Sidikalang, Kabupaten Dairi";"SUMATERA UTARA";"22216";"Indonesia";" 082297952223";"";"";"2.7130418";"98.3343563";"https://maps.google.com/?cid=0x0:0x68e111d8b15562af";""
"hardware store";"Toko Bahan Bangunan";"TB. Marni";"Jl. Air Bersih No.30B, Batang Beruh, Kec. Sidikalang, Kabupaten Dairi, Sumatera Utara 22219";"Batang Beruh, Kec. Sidikalang, Kabupaten Dairi";"SUMATERA UTARA";"22219";"Indonesia";" 08111234467";"";"";"2.731299";"98.3290573";"https://maps.google.com/?cid=0x0:0x5c58f95d4c530fa9";""
"hardware store";"Toko Bahan Bangunan";"Nitawati sitohang";"P9F3+524, Sitinjo II, Kec. Sitinjo, Kabupaten Dairi, Sumatera Utara 22219";"Sitinjo II, Kec. Sitinjo, Kabupaten Dairi";"SUMATERA UTARA";"22219";"Indonesia";"";"";"";"2.7228952";"98.3525712";"https://maps.google.com/?cid=0x0:0xe570aa40c7e472ca";""
"hardware store";"hardware store";"Sumatera Utara 22219";"Kabupaten Dairi, Sumatera Utara";"Kabupaten Dairi, Sumatera Utara";"SUMATERA UTARA";"";"Indonesia";"";"";"";"2.7189352";"98.3636131";"https://maps.google.com/?cid=0x0:0xce5e288aa02beb8a";""
"hardware store";"Toko Bahan Bangunan";"Nitawati sitohang";"P9F3+524, Sitinjo II, Kec. Sitinjo, Kabupaten Dairi, Sumatera Utara 22219";"Sitinjo II, Kec. Sitinjo, Kabupaten Dairi";"SUMATERA UTARA";"22219";"Indonesia";"";"";"";"2.7228952";"98.3525712";"https://maps.google.com/?cid=0x0:0xe570aa40c7e472ca";""
"hardware store";"Toko Perlengkapan Rumah";"MR DIY Sidikalang";"Jl. Sisingamangaraja No.4, Kota Sidikalang, Kec. Sidikalang, Kabupaten Dairi, Sumatera Utara 22219";"Kota Sidikalang, Kec. Sidikalang, Kabupaten Dairi";"SUMATERA UTARA";"22219";"Indonesia";"";"";"";"2.7574646";"98.3072229";"https://maps.google.com/?cid=0x0:0xa0f48796700b9295";""
"hardware store";"Toko Bahan Bangunan";"GOLDEN HARDWARE - Toko Kunci  Keran (Pinangsia)";"Jl. Pinangsia Raya No.57, Pinangsia, Kec. Taman Sari, Kota Jakarta Barat, Daerah Khusus Ibukota Jakarta 11110";"Pinangsia, Kec. Taman Sari, Kota Jakarta Barat";"SUMATERA UTARA";"11110";"Indonesia";" 087772726357";"";"";"-6.141081";"106.815394";"https://maps.google.com/?cid=0x0:0x4311d9981de91e69";""
"hardware store";"hardware store";"Sumatera Utara 22281";"Kabupaten Dairi, Sumatera Utara";"Kabupaten Dairi, Sumatera Utara";"SUMATERA UTARA";"";"Indonesia";"";"";"";"2.6986375";"98.4513272";"https://maps.google.com/?cid=0x0:0x3e94b4fe24e3cfb2";""
"hardware store";"Toko Bahan Bangunan";"Panglong S. Girsang";"JL Sidikalang - Medan, Gunung Selamat 1, Tanjung Beringin 1, Sumbul, Dairi, Tj. Beringin, Sidikalang, Kabupaten Dairi, Sumatera Utara 22281";"Gunung Selamat 1, Tanjung Beringin 1, Sumbul, Dairi, Tj. Beringin, Sidikalang, Kabupaten Dairi";"SUMATERA UTARA";"22281";"Indonesia";" 08126414210";"";"";"2.76158";"98.47067";"https://maps.google.com/?cid=0x0:0x8ce1338128908618";""
"hardware store";"Toko Bahan Bangunan";"IMMANUEL RITAIL - UD IMMANUEL";"Jl. Kemenyan No.16, Kota Sidikalang, Kec. Sidikalang, Kabupaten Dairi, Sumatera Utara 22211";"Kota Sidikalang, Kec. Sidikalang, Kabupaten Dairi";"SUMATERA UTARA";"22211";"Indonesia";" 081376226177";"";"";"2.7542408";"98.3069423";"https://maps.google.com/?cid=0x0:0xef296ca168afd178";""
"hardware store";"Toko Perlengkapan Rumah";"MR DIY Sidikalang";"Jl. Sisingamangaraja No.4, Kota Sidikalang, Kec. Sidikalang, Kabupaten Dairi, Sumatera Utara 22219";"Kota Sidikalang, Kec. Sidikalang, Kabupaten Dairi";"SUMATERA UTARA";"22219";"Indonesia";"";"";"";"2.7574646";"98.3072229";"https://maps.google.com/?cid=0x0:0xa0f48796700b9295";""
"hardware store";"Toko Bahan Bangunan";"UD. ASI";"W342+PP3, Unnamed Road, Pardomuan, Kec. Siempat Nempu Hilir, Kabupaten Dairi, Sumatera Utara 22263";"Unnamed Road, Pardomuan, Kec. Siempat Nempu Hilir, Kabupaten Dairi";"SUMATERA UTARA";"22263";"Indonesia";" 082160309088";"";"";"2.9067701";"98.0518094";"https://maps.google.com/?cid=0x0:0x10df68fbb6161910";""
"hardware store";"Toko Bahan Bangunan";"Nitawati sitohang";"P9F3+524, Sitinjo II, Kec. Sitinjo, Kabupaten Dairi, Sumatera Utara 22219";"Sitinjo II, Kec. Sitinjo, Kabupaten Dairi";"SUMATERA UTARA";"22219";"Indonesia";"";"";"";"2.7228952";"98.3525712";"https://maps.google.com/?cid=0x0:0xe570aa40c7e472ca";""
"hardware store";"Toko Bahan Bangunan";"Toko Bangunan Semangat";"Jl. Sisingamangaraja No.268, Kota Sidikalang, Kec. Sidikalang, Kabupaten Dairi, Sumatera Utara 22219";"Kota Sidikalang, Kec. Sidikalang, Kabupaten Dairi";"SUMATERA UTARA";"22219";"Indonesia";" 082297952223";"";"";"2.7530175";"98.3094409";"https://maps.google.com/?cid=0x0:0x439881f410e4b147";""
"hardware store";"Toko Elektronik";"Bintang terang electronic sejak 1990";"Jl. Kopi No.02, Kota Sidikalang, Kec. Sidikalang, Kabupaten Dairi, Sumatera Utara 22211";"Kota Sidikalang, Kec. Sidikalang, Kabupaten Dairi";"SUMATERA UTARA";"22211";"Indonesia";" 085275192989";"";"";"2.7535519";"98.3070994";"https://maps.google.com/?cid=0x0:0x3e27d8aa550f1c1e";""
"hardware store";"Toko Bahan Bangunan";"TB. Marni";"Jl. Air Bersih No.30B, Batang Beruh, Kec. Sidikalang, Kabupaten Dairi, Sumatera Utara 22219";"Batang Beruh, Kec. Sidikalang, Kabupaten Dairi";"SUMATERA UTARA";"22219";"Indonesia";" 08111234467";"";"";"2.731299";"98.3290573";"https://maps.google.com/?cid=0x0:0x5c58f95d4c530fa9";""
"hardware store";"Toko";"TB. Mangara";"Jl. Dolok Sanggul - Sidikalang Pangiringan, Parbuluan V, Kec. Parbuluan, Kabupaten Dairi, Sumatera Utara";"Kabupaten Dairi, Sumatera Utara";"SUMATERA UTARA";"";"Indonesia";" 081219253315";"";"";"2.6256012";"98.482719";"https://maps.google.com/?cid=0x0:0xc63290d5e3d65a37";""
"hardware store";"Toko Bahan Bangunan";"Toko Bangunan Joyce";"Jl. Air Bersih No.279, Sidiangkat, Kec. Sidikalang, Kabupaten Dairi, Sumatera Utara 22216";"Sidiangkat, Kec. Sidikalang, Kabupaten Dairi";"SUMATERA UTARA";"22216";"Indonesia";" 082297952223";"";"";"2.7130418";"98.3343563";"https://maps.google.com/?cid=0x0:0x68e111d8b15562af";""
"hardware store";"Toko Bahan Bangunan";"Toko bangunan AVE Sigalingging";"MC9R+MH2, Jl. Dolok Sanggul - Sidikalang, Parbuluan IV, Kec. Parbuluan, Kabupaten Dairi, Sumatera Utara 22282";"Jl. Dolok Sanggul - Sidikalang, Parbuluan IV, Kec. Parbuluan, Kabupaten Dairi";"SUMATERA UTARA";"22282";"Indonesia";" 081270000844";"";"";"2.6691149";"98.4413803";"https://maps.google.com/?cid=0x0:0x345d657f98d8641a";""
"hardware store";"Toko Bahan Bangunan";"CV MPJ";"R5JC+PPQ, Sihorbo, Kec. Siempat Nempu, Kabupaten Dairi, Sumatera Utara";"Kabupaten Dairi, Sumatera Utara";"SUMATERA UTARA";"";"Indonesia";" 081376164114";"";"";"2.8318361";"98.171851";"https://maps.google.com/?cid=0x0:0x28ec94e758ac43eb";""
"hardware store";"";"TB BORSAK M";"Jl. Lestari No.25, Kalang, Kec. Sidikalang, Kabupaten Dairi, Sumatera Utara 22219";"Kalang, Kec. Sidikalang, Kabupaten Dairi";"SUMATERA UTARA";"22219";"Indonesia";" 085222409395";"";"";"2.7583781";"98.3042218";"https://maps.google.com/?cid=0x0:0x30e9ec2195ddb2ff";""
"hardware store";"Toko Buku >>u0026 Alat Sekolah";"TOKO UD. ROHITA";"Jl. Simsim, Kota Sidikalang, Kec. Sidikalang, Kabupaten Dairi, Sumatera Utara 22219";"Kota Sidikalang, Kec. Sidikalang, Kabupaten Dairi";"SUMATERA UTARA";"22219";"Indonesia";" 081213441899";"";"";"2.7519963";"98.3093708";"https://maps.google.com/?cid=0x0:0xfd52f0c9b1907df3";""
