Category,Real Category,Business Name,Address,City,State,Postal Code,Country,Phone,Email,Website,Latitude,Longitude,Map Link,Details Link
hardware store,Toko Bahan Bangunan,Tb. Gunung MAS,"PV76+F3J, Jl. Raya Tengah, RT.2/RW.3, Batu Ampar, Kec. Kramat jati, Kota Jakarta Timur, Daerah Khusus Ibukota Jakarta 13510","Jl. Raya Tengah, RT.2/RW.3, Batu Ampar, Kec. Kramat jati, Kota Jakarta Timur",KALIMANTAN TENGAH,13510.0,Indonesia,,,,-6.2862904,106.8601314,https://maps.google.com/?cid=0x0:0xb0c65387bac14fd5,
hardware store,Toko Bahan Bangunan,Toko BESI PERMATA CONDET,"Jl. Raya Condet No.35, Batu Ampar, Kec. Kramat jati, Kota Jakarta Timur, Daerah Khusus Ibukota Jakarta 13520","Batu Ampar, Kec. Kramat jati, Kota Jakarta Timur",KALIMANTAN TENGAH,13520.0,Indonesia,82280327716.0,,,-6.2724959,106.8575345,https://maps.google.com/?cid=0x0:0xcc0908f737dd2fc9,
hardware store,Toko Bahan Bangunan,Roster Sinar Terlengkap,"Jl. Raya Jakarta-Bogor No.35, Kp. Tengah, Kec. Kramat jati, Kota Jakarta Timur, Daerah Khusus Ibukota Jakarta 13510","Kp. Tengah, Kec. Kramat jati, Kota Jakarta Timur",KALIMANTAN TENGAH,13510.0,Indonesia,85934423610.0,,,-6.2779599,106.8694233,https://maps.google.com/?cid=0x0:0xc0b9673e1ab393a9,
hardware store,Toko Bahan Bangunan,TB. Mawar Abadi I,"8, RT.8/RW.3, Kramat Jati, Kec. Kramat jati, Kota Jakarta Timur, Daerah Khusus Ibukota Jakarta 13510","RT.8/RW.3, Kramat Jati, Kec. Kramat jati, Kota Jakarta Timur",KALIMANTAN TENGAH,13510.0,Indonesia,82148467360.0,,,-6.2645994,106.8714385,https://maps.google.com/?cid=0x0:0x6dff89fac5e03eab,
hardware store,hardware store,Kec. Batu Ampar,"Kabupaten Seruyan, Kalimantan Tengah","Kabupaten Seruyan, Kalimantan Tengah",KALIMANTAN TENGAH,,Indonesia,,,,-2.2108114,112.2371387,https://maps.google.com/?cid=0x0:0xbbfed576e16870be,
hardware store,Toko Aksesori Ponsel,"ADWA' CELL (Selular, Aksesoris dan Alat Rumah Tangga)","Q922+462, Rungau Raya, Hanau, Kabupaten Seruyan, Kalimantan Tengah 74271","Rungau Raya, Hanau, Kabupaten Seruyan",KALIMANTAN TENGAH,74271.0,Indonesia,81251338913.0,,,-2.24973,112.3505217,https://maps.google.com/?cid=0x0:0x3499187fdd4c73d5,
hardware store,Toko bahan makanan,"NUHA Store, Rungau raya km.107","M857+5WH, Rungau Raya, Hanau, Kabupaten Seruyan, Kalimantan Tengah 74271","Rungau Raya, Hanau, Kabupaten Seruyan",KALIMANTAN TENGAH,74271.0,Indonesia,85251815875.0,,,-2.3420703,112.3148444,https://maps.google.com/?cid=0x0:0xba5cb7dc40738ff7,
hardware store,Toko Perlengkapan Rumah,"RumahPlus Condet , Toko Cat, Toko Bangunan, Hardware Tools Listrik, Plumbing","Jl. Raya Tengah No.61, RT.4/RW.9, Kp. Tengah, Kec. Kramat jati, Kota Jakarta Timur, Daerah Khusus Ibukota Jakarta 13540","RT.4/RW.9, Kp. Tengah, Kec. Kramat jati, Kota Jakarta Timur",KALIMANTAN TENGAH,13540.0,Indonesia,811956062.0,,,-6.289003,106.8593254,https://maps.google.com/?cid=0x0:0xc160a97d0585261e,
hardware store,Toko Bahan Bangunan,TB. TUNGGAL,"Jl. Batu Ampar 1 No.9, RT.11/RW.2, Batu Ampar, Kec. Kramat jati, Kota Jakarta Timur, Daerah Khusus Ibukota Jakarta 13520","RT.11/RW.2, Batu Ampar, Kec. Kramat jati, Kota Jakarta Timur",KALIMANTAN TENGAH,13520.0,Indonesia,8127127400.0,,,-6.2726838,106.8613857,https://maps.google.com/?cid=0x0:0xe19cbae3fea5fef7,
hardware store,Toko Bahan Bangunan,Tamako Teknik,"Jl. Raya Condet No.mor 52 10, RT.10/RW.3, Batu Ampar, Kec. Kramat jati, Kota Jakarta Timur, Daerah Khusus Ibukota Jakarta 13520","RT.10/RW.3, Batu Ampar, Kec. Kramat jati, Kota Jakarta Timur",KALIMANTAN TENGAH,13520.0,Indonesia,85102552073.0,,,-6.2871069,106.8556822,https://maps.google.com/?cid=0x0:0x4afbc972f4c7dcec,
hardware store,Toko Bahan Bangunan,Toko Bangunan Timbul Jaya,"Jl. Batu Ampar 3 No.12, RT.1/RW.4, Batu Ampar, Kec. Kramat jati, Kota Jakarta Timur, Daerah Khusus Ibukota Jakarta 13520","RT.1/RW.4, Batu Ampar, Kec. Kramat jati, Kota Jakarta Timur",KALIMANTAN TENGAH,13520.0,Indonesia,82180725332.0,,,-6.2780914,106.8602823,https://maps.google.com/?cid=0x0:0xd5c20a3d01598dca,
hardware store,Toko Pakaian Wanita,MR.DIY Ruko Condet Batu Ampar Kramatjati,"Jl. Raya Condet No.11, RT.3/RW.4, Batu Ampar, Kec. Kramat jati, Jakata Timur, Daerah Khusus Ibukota Jakarta 13520","RT.3/RW.4, Batu Ampar, Kec. Kramat jati, Jakata Timur",KALIMANTAN TENGAH,13520.0,Indonesia,,,,-6.2757644,106.8559761,https://maps.google.com/?cid=0x0:0x8a6d05bf44339ebf,
hardware store,Toko Bahan Bangunan,Harapan Jaya I,"Jl. Raya Condet No.15A 003, RT.15/RW.3, Batu Ampar, Kramat Jati, East Jakarta City, Jakarta 13520","RT.15/RW.3, Batu Ampar, Kramat Jati, East Jakarta City",KALIMANTAN TENGAH,13520.0,Indonesia,817217890.0,,,-6.2781553,106.8550535,https://maps.google.com/?cid=0x0:0x11dc77d51d8f8213,
hardware store,Toko Bahan Bangunan,TB. Anugrah Bersama,"No. 26, Jl. H. Hasan, RT.3/RW.1, Baru, Kec. Ps. Rebo, Kota Jakarta Timur, Daerah Khusus Ibukota Jakarta 13780","Jl. H. Hasan, RT.3/RW.1, Baru, Kec. Ps. Rebo, Kota Jakarta Timur",KALIMANTAN TENGAH,13780.0,Indonesia,8121399139.0,,,-6.3282033,106.8501213,https://maps.google.com/?cid=0x0:0x413f868700f0312c,
hardware store,Toko Perlengkapan Rumah,TB. Ampar Jaya,"Jl. Batu Ampar 3 No.5A, RT.12/RW.2, Batu Ampar, Kec. Kramat jati, Kota Jakarta Timur, Daerah Khusus Ibukota Jakarta 13520","RT.12/RW.2, Batu Ampar, Kec. Kramat jati, Kota Jakarta Timur",KALIMANTAN TENGAH,13520.0,Indonesia,85219220058.0,,,-6.2751506,106.8607495,https://maps.google.com/?cid=0x0:0xc3b53ed057fbd18a,
hardware store,Toko Batu,Batu Alam Depok - Batu Alam Jakarta - Jembar Mulia (2),"Jl. Raya Lenteng Agung Utara Kampus UI, arah, Ps. Minggu, Kota Jakarta Selatan, Daerah Khusus Ibukota Jakarta 12630","arah, Ps. Minggu, Kota Jakarta Selatan",KALIMANTAN TENGAH,12630.0,Indonesia,85210732329.0,,,-6.3271261,106.8335724,https://maps.google.com/?cid=0x0:0xd26a0718b78e3010,
hardware store,Toko Bahan Bangunan,TB. Makmur Jaya,"Jl. Batu Ampar 3 No.29, Batu Ampar, Kec. Kramat jati, Kota Jakarta Timur, Daerah Khusus Ibukota Jakarta 13520","Batu Ampar, Kec. Kramat jati, Kota Jakarta Timur",KALIMANTAN TENGAH,13520.0,Indonesia,81389442888.0,,,-6.2849006,106.8603317,https://maps.google.com/?cid=0x0:0x280489a80b6bebe2,
hardware store,Toko Bahan Bangunan,PD. Surya Jaya H. Hasan,"Jl. H. Hasan No.15, RT.4/RW.2, Baru, Kec. Ps. Rebo, Kota Jakarta Timur, Daerah Khusus Ibukota Jakarta 13780","RT.4/RW.2, Baru, Kec. Ps. Rebo, Kota Jakarta Timur",KALIMANTAN TENGAH,13780.0,Indonesia,2191017213.0,,,-6.3229455,106.8487722,https://maps.google.com/?cid=0x0:0xdb0268a5b91fb602,
hardware store,Toko Bahan Bangunan,Toko Jaya Remaja,"Jl. Batu Ampar 1 No.RT.11 11, RT.11/RW.2, Batu Ampar, Kec. Kramat jati, Kota Jakarta Timur, Daerah Khusus Ibukota Jakarta 13520","RT.11/RW.2, Batu Ampar, Kec. Kramat jati, Kota Jakarta Timur",KALIMANTAN TENGAH,13520.0,Indonesia,88975038755.0,,,-6.2726094,106.8613057,https://maps.google.com/?cid=0x0:0x21b881a240b9ebac,
hardware store,Toko Bahan Bangunan,TB. M HARRIS,"Gg. Masjid Nurul Islam No.25 5, RT.5/RW.6, Tj. Bar., Kec. Jagakarsa, Kota Jakarta Selatan, Daerah Khusus Ibukota Jakarta 12530","RT.5/RW.6, Tj. Bar., Kec. Jagakarsa, Kota Jakarta Selatan",KALIMANTAN TENGAH,12530.0,Indonesia,2178844470.0,,,-6.3109291,106.8489098,https://maps.google.com/?cid=0x0:0xe1bfd21b602e6daa,
hardware store,Toko Bahan Bangunan,Sampurna Agung,"Jl. Raya Lenteng Agung No.58A 5, RT.5/RW.2, Lenteng Agung, Kec. Jagakarsa, Kota Jakarta Selatan, Daerah Khusus Ibukota Jakarta 12610","RT.5/RW.2, Lenteng Agung, Kec. Jagakarsa, Kota Jakarta Selatan",KALIMANTAN TENGAH,12610.0,Indonesia,8129550161.0,,,-6.3169821,106.8376807,https://maps.google.com/?cid=0x0:0x5c63f3f16e3f2d83,
hardware store,Toko Bahan Bangunan,Tb. Gunung MAS,"PV76+F3J, Jl. Raya Tengah, RT.2/RW.3, Batu Ampar, Kec. Kramat jati, Kota Jakarta Timur, Daerah Khusus Ibukota Jakarta 13510","Jl. Raya Tengah, RT.2/RW.3, Batu Ampar, Kec. Kramat jati, Kota Jakarta Timur",KALIMANTAN TENGAH,13510.0,Indonesia,,,,-6.2862904,106.8601314,https://maps.google.com/?cid=0x0:0xb0c65387bac14fd5,
hardware store,Toko Bahan Bangunan,TB Sinar Mandiri,"Jl. Raya Tengah No.5A, RT.10/RW.8, Gedong, Kec. Ps. Rebo, Kota Jakarta Timur, Daerah Khusus Ibukota Jakarta 13760","RT.10/RW.8, Gedong, Kec. Ps. Rebo, Kota Jakarta Timur",KALIMANTAN TENGAH,13760.0,Indonesia,89669687149.0,,,-6.2980067,106.8614481,https://maps.google.com/?cid=0x0:0x71ad9d187188bef1,
hardware store,Toko Game,TRIOSLOT,"Jl. H. Hasan No.1, RT.1/RW.9, Baru, Kec. Ps. Rebo, Kota Jakarta Timur, Jakarta, Daerah Khusus Ibukota Jakarta 13780","RT.1/RW.9, Baru, Kec. Ps. Rebo, Kota Jakarta Timur, Jakarta",KALIMANTAN TENGAH,13780.0,Indonesia,81211722273.0,,,-6.3269706,106.8503318,https://maps.google.com/?cid=0x0:0xcf36c6cc96f74669,
hardware store,Toko Bahan Bangunan,Toko bambu udin,"Jl. Batu Ampar II No.2 blok B1, Batu Ampar, Kec. Kramat jati, Kota Jakarta Timur, Daerah Khusus Ibukota Jakarta 13520","Batu Ampar, Kec. Kramat jati, Kota Jakarta Timur",KALIMANTAN TENGAH,13520.0,Indonesia,,,,-6.2839441,106.8557772,https://maps.google.com/?cid=0x0:0xcb77731af217f88b,
hardware store,Toko Bahan Bangunan,TB. Mawar Abadi I,"8, RT.8/RW.3, Kramat Jati, Kec. Kramat jati, Kota Jakarta Timur, Daerah Khusus Ibukota Jakarta 13510","RT.8/RW.3, Kramat Jati, Kec. Kramat jati, Kota Jakarta Timur",KALIMANTAN TENGAH,13510.0,Indonesia,82148467360.0,,,-6.2645994,106.8714385,https://maps.google.com/?cid=0x0:0x6dff89fac5e03eab,
hardware store,hardware store,Kec. Batu Ampar,"Kabupaten Seruyan, Kalimantan Tengah","Kabupaten Seruyan, Kalimantan Tengah",KALIMANTAN TENGAH,,Indonesia,,,,-2.2108114,112.2371387,https://maps.google.com/?cid=0x0:0xbbfed576e16870be,
hardware store,hardware store,Batu Ampar,"Kec. Menthobi Raya, Kabupaten Lamandau, Kalimantan Tengah","Kabupaten Lamandau, Kalimantan Tengah",KALIMANTAN TENGAH,,Indonesia,,,,-1.9650897,111.7495419,https://maps.google.com/?cid=0x0:0xaeda1b717802bcd4,
hardware store,Toko bahan makanan,"NUHA Store, Rungau raya km.107","M857+5WH, Rungau Raya, Hanau, Kabupaten Seruyan, Kalimantan Tengah 74271","Rungau Raya, Hanau, Kabupaten Seruyan",KALIMANTAN TENGAH,74271.0,Indonesia,85251815875.0,,,-2.3420703,112.3148444,https://maps.google.com/?cid=0x0:0xba5cb7dc40738ff7,
hardware store,hardware store,Batu Ampar,"Kec. Kramat jati, Kota Jakarta Timur, Daerah Khusus Ibukota Jakarta","Kota Jakarta Timur, Daerah Khusus Ibukota Jakarta",KALIMANTAN TENGAH,,Indonesia,,,,-6.2748193,106.8620891,https://maps.google.com/?cid=0x0:0xfd4d6c4bf0ce7469,
hardware store,Toko Perlengkapan Rumah,"RumahPlus Condet , Toko Cat, Toko Bangunan, Hardware Tools Listrik, Plumbing","Jl. Raya Tengah No.61, RT.4/RW.9, Kp. Tengah, Kec. Kramat jati, Kota Jakarta Timur, Daerah Khusus Ibukota Jakarta 13540","RT.4/RW.9, Kp. Tengah, Kec. Kramat jati, Kota Jakarta Timur",KALIMANTAN TENGAH,13540.0,Indonesia,811956062.0,,,-6.289003,106.8593254,https://maps.google.com/?cid=0x0:0xc160a97d0585261e,
hardware store,Toko Bahan Bangunan,TB. TUNGGAL,"Jl. Batu Ampar 1 No.9, RT.11/RW.2, Batu Ampar, Kec. Kramat jati, Kota Jakarta Timur, Daerah Khusus Ibukota Jakarta 13520","RT.11/RW.2, Batu Ampar, Kec. Kramat jati, Kota Jakarta Timur",KALIMANTAN TENGAH,13520.0,Indonesia,8127127400.0,,,-6.2726838,106.8613857,https://maps.google.com/?cid=0x0:0xe19cbae3fea5fef7,
hardware store,Toko Bahan Bangunan,GA Materials,"Jl. Raya Condet No.12 A, RT.3/RW.4, Batu Ampar, Kec. Kramat jati, Kota Jakarta Timur, Daerah Khusus Ibukota Jakarta 13520","RT.3/RW.4, Batu Ampar, Kec. Kramat jati, Kota Jakarta Timur",KALIMANTAN TENGAH,13520.0,Indonesia,85811464789.0,,,-6.2758112,106.8559176,https://maps.google.com/?cid=0x0:0xb0fcbed69a555215,
hardware store,Toko Bahan Bangunan,Tamako Teknik,"Jl. Raya Condet No.mor 52 10, RT.10/RW.3, Batu Ampar, Kec. Kramat jati, Kota Jakarta Timur, Daerah Khusus Ibukota Jakarta 13520","RT.10/RW.3, Batu Ampar, Kec. Kramat jati, Kota Jakarta Timur",KALIMANTAN TENGAH,13520.0,Indonesia,85102552073.0,,,-6.2871069,106.8556822,https://maps.google.com/?cid=0x0:0x4afbc972f4c7dcec,
hardware store,Toko Bahan Bangunan,Toko Bangunan Timbul Jaya,"Jl. Batu Ampar 3 No.12, RT.1/RW.4, Batu Ampar, Kec. Kramat jati, Kota Jakarta Timur, Daerah Khusus Ibukota Jakarta 13520","RT.1/RW.4, Batu Ampar, Kec. Kramat jati, Kota Jakarta Timur",KALIMANTAN TENGAH,13520.0,Indonesia,82180725332.0,,,-6.2780914,106.8602823,https://maps.google.com/?cid=0x0:0xd5c20a3d01598dca,
hardware store,Toko Pakaian Wanita,MR.DIY Ruko Condet Batu Ampar Kramatjati,"Jl. Raya Condet No.11, RT.3/RW.4, Batu Ampar, Kec. Kramat jati, Jakata Timur, Daerah Khusus Ibukota Jakarta 13520","RT.3/RW.4, Batu Ampar, Kec. Kramat jati, Jakata Timur",KALIMANTAN TENGAH,13520.0,Indonesia,,,,-6.2757644,106.8559761,https://maps.google.com/?cid=0x0:0x8a6d05bf44339ebf,
hardware store,Toko Cat,"Toko Cat,Keramik  Listrik Sumber Jaya","Jalan Raya Tengah, Samping Jl. Swadaya No.136, RT.3/RW.9, Kp. Tengah, Kec. Kramat jati, Kota Jakarta Timur, Daerah Khusus Ibukota Jakarta 13540","Samping Jl. Swadaya No.136, RT.3/RW.9, Kp. Tengah, Kec. Kramat jati, Kota Jakarta Timur",KALIMANTAN TENGAH,13540.0,Indonesia,87888105650.0,,,-6.2898964,106.8599931,https://maps.google.com/?cid=0x0:0xc7867cd2b3fc800d,
hardware store,Toko Bahan Bangunan,Harapan Jaya I,"Jl. Raya Condet No.15A 003, RT.15/RW.3, Batu Ampar, Kramat Jati, East Jakarta City, Jakarta 13520","RT.15/RW.3, Batu Ampar, Kramat Jati, East Jakarta City",KALIMANTAN TENGAH,13520.0,Indonesia,817217890.0,,,-6.2781553,106.8550535,https://maps.google.com/?cid=0x0:0x11dc77d51d8f8213,
hardware store,Toko Perlengkapan Rumah,TB. Ampar Jaya,"Jl. Batu Ampar 3 No.5A, RT.12/RW.2, Batu Ampar, Kec. Kramat jati, Kota Jakarta Timur, Daerah Khusus Ibukota Jakarta 13520","RT.12/RW.2, Batu Ampar, Kec. Kramat jati, Kota Jakarta Timur",KALIMANTAN TENGAH,13520.0,Indonesia,85219220058.0,,,-6.2751506,106.8607495,https://maps.google.com/?cid=0x0:0xc3b53ed057fbd18a,
hardware store,Toko Bahan Bangunan,Batu alam Roster beton,"Jl. Raya Condet Jl. Datuk Ibrahim, Batu Ampar, Kec. Kramat jati, Kota Jakarta Timur, Daerah Khusus Ibukota Jakarta 13530","Batu Ampar, Kec. Kramat jati, Kota Jakarta Timur",KALIMANTAN TENGAH,13530.0,Indonesia,81808896362.0,,,-6.2767758,106.8554537,https://maps.google.com/?cid=0x0:0x65b92ad1cc10e126,
hardware store,Toko Bahan Bangunan,Toko Besi Kembar Jaya Steel (KJS),"7, Jl. Raya Tengah No.23, RT.7/RW.3, Batu Ampar, Kec. Kramat jati, Kota Jakarta Timur, Daerah Khusus Ibukota Jakarta 13520","Jl. Raya Tengah No.23, RT.7/RW.3, Batu Ampar, Kec. Kramat jati, Kota Jakarta Timur",KALIMANTAN TENGAH,13520.0,Indonesia,85778820700.0,,,-6.2876746,106.8589889,https://maps.google.com/?cid=0x0:0xb8596f8ff0201999,
hardware store,Toko Bahan Bangunan,TB. Makmur Jaya,"Jl. Batu Ampar 3 No.29, Batu Ampar, Kec. Kramat jati, Kota Jakarta Timur, Daerah Khusus Ibukota Jakarta 13520","Batu Ampar, Kec. Kramat jati, Kota Jakarta Timur",KALIMANTAN TENGAH,13520.0,Indonesia,81389442888.0,,,-6.2849006,106.8603317,https://maps.google.com/?cid=0x0:0x280489a80b6bebe2,
hardware store,Toko Bahan Bangunan,Paving Block Hidrolik,"Jl. Raya Condet No.20, Batu Ampar, Kec. Kramat jati, Kota Jakarta Timur, Daerah Khusus Ibukota Jakarta 13510","Batu Ampar, Kec. Kramat jati, Kota Jakarta Timur",KALIMANTAN TENGAH,13510.0,Indonesia,81295991508.0,,,-6.276728,106.8555881,https://maps.google.com/?cid=0x0:0xdf222c5f37b8efe9,
hardware store,Toko Bahan Bangunan,Toko bambu udin,"Jl. Batu Ampar II No.2 blok B1, Batu Ampar, Kec. Kramat jati, Kota Jakarta Timur, Daerah Khusus Ibukota Jakarta 13520","Batu Ampar, Kec. Kramat jati, Kota Jakarta Timur",KALIMANTAN TENGAH,13520.0,Indonesia,,,,-6.2839441,106.8557772,https://maps.google.com/?cid=0x0:0xcb77731af217f88b,
hardware store,Toko Bahan Bangunan,Toko Jaya Remaja,"Jl. Batu Ampar 1 No.RT.11 11, RT.11/RW.2, Batu Ampar, Kec. Kramat jati, Kota Jakarta Timur, Daerah Khusus Ibukota Jakarta 13520","RT.11/RW.2, Batu Ampar, Kec. Kramat jati, Kota Jakarta Timur",KALIMANTAN TENGAH,13520.0,Indonesia,88975038755.0,,,-6.2726094,106.8613057,https://maps.google.com/?cid=0x0:0x21b881a240b9ebac,
hardware store,Toko Bahan Bangunan,TB. Usaha Baru,"Jl. Raya Inpres, RT.2/RW.3, Batu Ampar, Kec. Kramat jati, Kota Jakarta Timur, Daerah Khusus Ibukota Jakarta 13520","RT.2/RW.3, Batu Ampar, Kec. Kramat jati, Kota Jakarta Timur",KALIMANTAN TENGAH,13520.0,Indonesia,218096294.0,,,-6.2866121,106.8612461,https://maps.google.com/?cid=0x0:0x24597c354880e613,
hardware store,Toko Bahan Bangunan,TB Sinar Mandiri,"Jl. Raya Tengah No.5A, RT.10/RW.8, Gedong, Kec. Ps. Rebo, Kota Jakarta Timur, Daerah Khusus Ibukota Jakarta 13760","RT.10/RW.8, Gedong, Kec. Ps. Rebo, Kota Jakarta Timur",KALIMANTAN TENGAH,13760.0,Indonesia,89669687149.0,,,-6.2980067,106.8614481,https://maps.google.com/?cid=0x0:0x71ad9d187188bef1,
hardware store,Toko Bahan Bangunan,Toko BESI PERMATA CONDET,"Jl. Raya Condet No.35, Batu Ampar, Kec. Kramat jati, Kota Jakarta Timur, Daerah Khusus Ibukota Jakarta 13520","Batu Ampar, Kec. Kramat jati, Kota Jakarta Timur",KALIMANTAN TENGAH,13520.0,Indonesia,82280327716.0,,,-6.2724959,106.8575345,https://maps.google.com/?cid=0x0:0xcc0908f737dd2fc9,
hardware store,Toko Bahan Bangunan,Roster Sinar Terlengkap,"Jl. Raya Jakarta-Bogor No.35, Kp. Tengah, Kec. Kramat jati, Kota Jakarta Timur, Daerah Khusus Ibukota Jakarta 13510","Kp. Tengah, Kec. Kramat jati, Kota Jakarta Timur",KALIMANTAN TENGAH,13510.0,Indonesia,85934423610.0,,,-6.2779599,106.8694233,https://maps.google.com/?cid=0x0:0xc0b9673e1ab393a9,
hardware store,Toko Bahan Bangunan,Tb. Gunung MAS,"PV76+F3J, Jl. Raya Tengah, RT.2/RW.3, Batu Ampar, Kec. Kramat jati, Kota Jakarta Timur, Daerah Khusus Ibukota Jakarta 13510","Jl. Raya Tengah, RT.2/RW.3, Batu Ampar, Kec. Kramat jati, Kota Jakarta Timur",KALIMANTAN TENGAH,13510.0,Indonesia,,,,-6.2862904,106.8601314,https://maps.google.com/?cid=0x0:0xb0c65387bac14fd5,
hardware store,Toko bahan makanan,"NUHA Store, Rungau raya km.107","M857+5WH, Rungau Raya, Hanau, Kabupaten Seruyan, Kalimantan Tengah 74271","Rungau Raya, Hanau, Kabupaten Seruyan",KALIMANTAN TENGAH,74271.0,Indonesia,85251815875.0,,,-2.3420703,112.3148444,https://maps.google.com/?cid=0x0:0xba5cb7dc40738ff7,
hardware store,Toko bahan makanan,Toko bahan makanan,"Desa rungau raya km 107, Kalimantan Tengah","Kabupaten Seruyan, Kalimantan Tengah",KALIMANTAN TENGAH,,Indonesia,85828288876.0,,,-2.3425611,112.3125377,https://maps.google.com/?cid=0x0:0x5c105afc18c5217,
hardware store,hardware store,Kalimantan Tengah,,Kalimantan Tengah,KALIMANTAN TENGAH,,Indonesia,,,,-1.6814878,113.3823545,https://maps.google.com/?cid=0x0:0xcfdbd56783f56bae,
hardware store,Toko Elektronik,Toko Wahyu,"G45C+F3H, Unnamed Road, Pembuang Hulu I, Kec. Hanau, Kabupaten Seruyan, Kalimantan Tengah 74271","Unnamed Road, Pembuang Hulu I, Kec. Hanau, Kabupaten Seruyan",KALIMANTAN TENGAH,74271.0,Indonesia,82253581605.0,,,-2.4913033,112.12022,https://maps.google.com/?cid=0x0:0x625837a556531f17,
hardware store,Toko Elektronik,Toko Elektro  Laras Shop,"JHC3+H8J, Kuala Pembuang Satu, Kec. Seruyan Hilir, Kabupaten Seruyan, Kalimantan Tengah 74215","Kuala Pembuang Satu, Kec. Seruyan Hilir, Kabupaten Seruyan",KALIMANTAN TENGAH,74215.0,Indonesia,85245589500.0,,,-3.3785384,112.5532801,https://maps.google.com/?cid=0x0:0xbd6e651fa8f903f4,
hardware store,Servis Komputer,AWANComputer,"JH92+497, Kuala Pembuang Satu, Kec. Seruyan Hilir, Kabupaten Seruyan, Kalimantan Tengah 74215","Kuala Pembuang Satu, Kec. Seruyan Hilir, Kabupaten Seruyan",KALIMANTAN TENGAH,74215.0,Indonesia,53821324.0,,,-3.3822078,112.5509265,https://maps.google.com/?cid=0x0:0xf755e80e5c82fb7,
hardware store,Toko Elektronik,NG2N_SERVICE ELECTRONICS,"Jl. Jenderal Sudirman Kalimantan No.KM69, Tengah, Kec. Seruyan Raya, Kabupaten Seruyan, Kalimantan Tengah 74271","Tengah, Kec. Seruyan Raya, Kabupaten Seruyan",KALIMANTAN TENGAH,74271.0,Indonesia,81370050075.0,,,-2.3677395,112.3634886,https://maps.google.com/?cid=0x0:0x8bcb66bfe20e199b,
hardware store,Toko bahan makanan,TB. Pak Jusman,"Padang Tikar II, Jl. Baburazak Barat No.Timur, Kalimantan Barat 78385",Jl. Baburazak Barat No.Timur,KALIMANTAN TENGAH,78385.0,Indonesia,83151194446.0,,,-0.7020825,109.2649763,https://maps.google.com/?cid=0x0:0x5a4335ae4935250f,
hardware store,Toko Ponsel,Latansa Ponsel,"JH83+469, Kuala Pembuang Satu, Kec. Seruyan Hilir, Kabupaten Seruyan, Kalimantan Tengah 74215","Kuala Pembuang Satu, Kec. Seruyan Hilir, Kabupaten Seruyan",KALIMANTAN TENGAH,74215.0,Indonesia,,,,-3.3847188,112.5531087,https://maps.google.com/?cid=0x0:0xf8ac28665a14c8b1,
hardware store,hardware store,TB. Batam Jaya,"Jl.Haji Bujang Atim,RT/RW. 05/02, Batu Ampar, Kec. Batu Ampar, Kabupaten Kubu Raya, Kalimantan Barat 78385","Batu Ampar, Kec. Batu Ampar, Kabupaten Kubu Raya",KALIMANTAN TENGAH,78385.0,Indonesia,82156644867.0,,,-0.743566,109.5371302,https://maps.google.com/?cid=0x0:0xf6305ec3e007a4b2,
hardware store,Toko Elektronik,Zexel Computer,"JHF2+3G9, Kuala Pembuang Satu, Kec. Seruyan Hilir, Kabupaten Seruyan, Kalimantan Tengah 74215","Kuala Pembuang Satu, Kec. Seruyan Hilir, Kabupaten Seruyan",KALIMANTAN TENGAH,74215.0,Indonesia,81230351487.0,,,-3.3773289,112.5513488,https://maps.google.com/?cid=0x0:0x645d635ee5d8b1c4,
hardware store,Toko Bahan Bangunan,GA Materials,"Jl. Raya Condet No.12 A, RT.3/RW.4, Batu Ampar, Kec. Kramat jati, Kota Jakarta Timur, Daerah Khusus Ibukota Jakarta 13520","RT.3/RW.4, Batu Ampar, Kec. Kramat jati, Kota Jakarta Timur",KALIMANTAN TENGAH,13520.0,Indonesia,85811464789.0,,,-6.2758112,106.8559176,https://maps.google.com/?cid=0x0:0xb0fcbed69a555215,
hardware store,Toko Perlengkapan Rumah,"RumahPlus Condet , Toko Cat, Toko Bangunan, Hardware Tools Listrik, Plumbing","Jl. Raya Tengah No.61, RT.4/RW.9, Kp. Tengah, Kec. Kramat jati, Kota Jakarta Timur, Daerah Khusus Ibukota Jakarta 13540","RT.4/RW.9, Kp. Tengah, Kec. Kramat jati, Kota Jakarta Timur",KALIMANTAN TENGAH,13540.0,Indonesia,811956062.0,,,-6.289003,106.8593254,https://maps.google.com/?cid=0x0:0xc160a97d0585261e,
hardware store,Toko Bahan Bangunan,TB. TUNGGAL,"Jl. Batu Ampar 1 No.9, RT.11/RW.2, Batu Ampar, Kec. Kramat jati, Kota Jakarta Timur, Daerah Khusus Ibukota Jakarta 13520","RT.11/RW.2, Batu Ampar, Kec. Kramat jati, Kota Jakarta Timur",KALIMANTAN TENGAH,13520.0,Indonesia,8127127400.0,,,-6.2726838,106.8613857,https://maps.google.com/?cid=0x0:0xe19cbae3fea5fef7,
hardware store,Toko Bahan Bangunan,Toko Bangunan Timbul Jaya,"Jl. Batu Ampar 3 No.12, RT.1/RW.4, Batu Ampar, Kec. Kramat jati, Kota Jakarta Timur, Daerah Khusus Ibukota Jakarta 13520","RT.1/RW.4, Batu Ampar, Kec. Kramat jati, Kota Jakarta Timur",KALIMANTAN TENGAH,13520.0,Indonesia,82180725332.0,,,-6.2780914,106.8602823,https://maps.google.com/?cid=0x0:0xd5c20a3d01598dca,
hardware store,Toko Bahan Bangunan,Tamako Teknik,"Jl. Raya Condet No.mor 52 10, RT.10/RW.3, Batu Ampar, Kec. Kramat jati, Kota Jakarta Timur, Daerah Khusus Ibukota Jakarta 13520","RT.10/RW.3, Batu Ampar, Kec. Kramat jati, Kota Jakarta Timur",KALIMANTAN TENGAH,13520.0,Indonesia,85102552073.0,,,-6.2871069,106.8556822,https://maps.google.com/?cid=0x0:0x4afbc972f4c7dcec,
hardware store,Toko Pakaian Wanita,MR.DIY Ruko Condet Batu Ampar Kramatjati,"Jl. Raya Condet No.11, RT.3/RW.4, Batu Ampar, Kec. Kramat jati, Jakata Timur, Daerah Khusus Ibukota Jakarta 13520","RT.3/RW.4, Batu Ampar, Kec. Kramat jati, Jakata Timur",KALIMANTAN TENGAH,13520.0,Indonesia,,,,-6.2757644,106.8559761,https://maps.google.com/?cid=0x0:0x8a6d05bf44339ebf,
hardware store,Toko Bahan Bangunan,TB. Anugrah Bersama,"No. 26, Jl. H. Hasan, RT.3/RW.1, Baru, Kec. Ps. Rebo, Kota Jakarta Timur, Daerah Khusus Ibukota Jakarta 13780","Jl. H. Hasan, RT.3/RW.1, Baru, Kec. Ps. Rebo, Kota Jakarta Timur",KALIMANTAN TENGAH,13780.0,Indonesia,8121399139.0,,,-6.3282033,106.8501213,https://maps.google.com/?cid=0x0:0x413f868700f0312c,
hardware store,Toko Perlengkapan Rumah,TB. Ampar Jaya,"Jl. Batu Ampar 3 No.5A, RT.12/RW.2, Batu Ampar, Kec. Kramat jati, Kota Jakarta Timur, Daerah Khusus Ibukota Jakarta 13520","RT.12/RW.2, Batu Ampar, Kec. Kramat jati, Kota Jakarta Timur",KALIMANTAN TENGAH,13520.0,Indonesia,85219220058.0,,,-6.2751506,106.8607495,https://maps.google.com/?cid=0x0:0xc3b53ed057fbd18a,
hardware store,Toko Batu,Batu Alam Depok - Batu Alam Jakarta - Jembar Mulia (2),"Jl. Raya Lenteng Agung Utara Kampus UI, arah, Ps. Minggu, Kota Jakarta Selatan, Daerah Khusus Ibukota Jakarta 12630","arah, Ps. Minggu, Kota Jakarta Selatan",KALIMANTAN TENGAH,12630.0,Indonesia,85210732329.0,,,-6.3271261,106.8335724,https://maps.google.com/?cid=0x0:0xd26a0718b78e3010,
hardware store,Toko Bahan Bangunan,PD. Surya Jaya H. Hasan,"Jl. H. Hasan No.15, RT.4/RW.2, Baru, Kec. Ps. Rebo, Kota Jakarta Timur, Daerah Khusus Ibukota Jakarta 13780","RT.4/RW.2, Baru, Kec. Ps. Rebo, Kota Jakarta Timur",KALIMANTAN TENGAH,13780.0,Indonesia,2191017213.0,,,-6.3229455,106.8487722,https://maps.google.com/?cid=0x0:0xdb0268a5b91fb602,
hardware store,Toko Bahan Bangunan,TB. Makmur Jaya,"Jl. Batu Ampar 3 No.29, Batu Ampar, Kec. Kramat jati, Kota Jakarta Timur, Daerah Khusus Ibukota Jakarta 13520","Batu Ampar, Kec. Kramat jati, Kota Jakarta Timur",KALIMANTAN TENGAH,13520.0,Indonesia,81389442888.0,,,-6.2849006,106.8603317,https://maps.google.com/?cid=0x0:0x280489a80b6bebe2,
hardware store,Toko Bahan Bangunan,Toko Jaya Remaja,"Jl. Batu Ampar 1 No.RT.11 11, RT.11/RW.2, Batu Ampar, Kec. Kramat jati, Kota Jakarta Timur, Daerah Khusus Ibukota Jakarta 13520","RT.11/RW.2, Batu Ampar, Kec. Kramat jati, Kota Jakarta Timur",KALIMANTAN TENGAH,13520.0,Indonesia,88975038755.0,,,-6.2726094,106.8613057,https://maps.google.com/?cid=0x0:0x21b881a240b9ebac,
hardware store,Toko Bahan Bangunan,TB. M HARRIS,"Gg. Masjid Nurul Islam No.25 5, RT.5/RW.6, Tj. Bar., Kec. Jagakarsa, Kota Jakarta Selatan, Daerah Khusus Ibukota Jakarta 12530","RT.5/RW.6, Tj. Bar., Kec. Jagakarsa, Kota Jakarta Selatan",KALIMANTAN TENGAH,12530.0,Indonesia,2178844470.0,,,-6.3109291,106.8489098,https://maps.google.com/?cid=0x0:0xe1bfd21b602e6daa,
