Category;Real Category;Business Name;Address;City;State;Postal Code;Country;Phone;Latitude;Longitude;Map Link
"perumahan";"Komplek perumahan";"Uyut home";"9CP8+F6M, Jl. Raya Pesantren, Pesantren, Kec. Tambak, Kabupaten Banyumas, Jawa Tengah 53196";"Jl. Raya Pesantren, Pesantren, Kec. Tambak, Kabupaten Banyumas";"JAWA TENGAH";"53196";"Indonesia";"";"-7.6137984";"109.415553";"https://maps.google.com/?cid=0x0:0x86909772a4bad9c1"
"perumahan";"Komplek perumahan";"Rumah reuni";"9C86+XC7, Jl. Tambak - Bayawulung, Sigigil, Karangpucung, Kec. Tambak, Kabupaten Banyumas, Jawa Tengah 53196";"Jl. Tambak - Bayawulung, Sigigil, Karangpucung, Kec. Tambak, Kabupaten Banyumas";"JAWA TENGAH";"53196";"Indonesia";" 087848206012";"-7.6316674";"109.410957";"https://maps.google.com/?cid=0x0:0x530ca017e67aa5e5"
"perumahan";"perumahan";"Rumah Vicky";"99GQ+WF5, Gg. RT, RW.01, Sawah, Gumelar Kidul, Kec. Tambak, Kabupaten Banyumas, Jawa Tengah 53196";"Gg. RT, RW.01, Sawah, Gumelar Kidul, Kec. Tambak, Kabupaten Banyumas";"JAWA TENGAH";"53196";"Indonesia";"";"-7.622749";"109.3887307";"https://maps.google.com/?cid=0x0:0x2a0adfda9e0d8019"
"perumahan";"perumahan";"Rumah charisatun mutoharoh";"99QJ+P4C, Karangturi, Gumelar Lor, Kec. Tambak, Kabupaten Banyumas, Jawa Tengah 53196";"Karangturi, Gumelar Lor, Kec. Tambak, Kabupaten Banyumas";"JAWA TENGAH";"53196";"Indonesia";"";"-7.6106959";"109.3802568";"https://maps.google.com/?cid=0x0:0x29c7181602530ec0"
"perumahan";"Komplek perumahan";"Pulang kampung";"9CMF+35M, Sawah, Pesantren, Kec. Tambak, Kabupaten Banyumas, Jawa Tengah 53196";"Sawah, Pesantren, Kec. Tambak, Kabupaten Banyumas";"JAWA TENGAH";"53196";"Indonesia";"";"-7.6172964";"109.4229368";"https://maps.google.com/?cid=0x0:0xfcc708a08a579c68"
"perumahan";"Komplek perumahan";"Rumah tinggal";"C92W+M6Q, RT.4b/RW.1, Gedang Kulon, Watuagung, Kec. Tambak, Kabupaten Banyumas, Jawa Tengah 53196";"RT.4b/RW.1, Gedang Kulon, Watuagung, Kec. Tambak, Kabupaten Banyumas";"JAWA TENGAH";"53196";"Indonesia";"";"-7.5982751";"109.3956086";"https://maps.google.com/?cid=0x0:0x394c34b0a8571520"
"perumahan";"perumahan";"Rumah roin";"Jl. Ampera, Sawah, Gumelar Kidul, Kec. Tambak, Kabupaten Banyumas, Jawa Tengah 53196";"Sawah, Gumelar Kidul, Kec. Tambak, Kabupaten Banyumas";"JAWA TENGAH";"53196";"Indonesia";"";"-7.6291437";"109.3902918";"https://maps.google.com/?cid=0x0:0x17031d9d641b740b"
"perumahan";"Perumahan";"Pak M. SAIDI";"997X+CQH Era Kidul, RT.03/RW.04, Sawah, Karangpetir, Kec. Tambak, Kabupaten Banyumas, Jawa Tengah 53196";"RT.03/RW.04, Sawah, Karangpetir, Kec. Tambak, Kabupaten Banyumas";"JAWA TENGAH";"53196";"Indonesia";"";"-7.6364411";"109.3994901";"https://maps.google.com/?cid=0x0:0xed80afbe865f56dc"
"perumahan";"Komplek perumahan";"rumah pangat";"99QX+5R3, Lemahmendek, Kamulyan, Kec. Tambak, Kabupaten Banyumas, Jawa Tengah 53196";"Lemahmendek, Kamulyan, Kec. Tambak, Kabupaten Banyumas";"JAWA TENGAH";"53196";"Indonesia";"";"-7.6111309";"109.4000768";"https://maps.google.com/?cid=0x0:0xc7f337cf2118a4fa"
"perumahan";"Komplek perumahan";"Keluarga Supriyanto";"99MX+QMQ, Gramang, Karangpetir, Kec. Tambak, Kabupaten Banyumas, Jawa Tengah";"Kabupaten Banyumas, Jawa Tengah";"JAWA TENGAH";"";"Indonesia";"";"-7.6155464";"109.3992443";"https://maps.google.com/?cid=0x0:0xc9e3e23f99c9196f"
"perumahan";"Komplek perumahan";"Uyut home";"9CP8+F6M, Jl. Raya Pesantren, Pesantren, Kec. Tambak, Kabupaten Banyumas, Jawa Tengah 53196";"Jl. Raya Pesantren, Pesantren, Kec. Tambak, Kabupaten Banyumas";"JAWA TENGAH";"53196";"Indonesia";"";"-7.6137984";"109.415553";"https://maps.google.com/?cid=0x0:0x86909772a4bad9c1"
"perumahan";"Komplek perumahan";"Rumah mbah gendut";"CC39+V97, Jl. Mahameru, Karangwangkal, Watuagung, Kec. Tambak, Kabupaten Banyumas, Jawa Tengah 53196";"Jl. Mahameru, Karangwangkal, Watuagung, Kec. Tambak, Kabupaten Banyumas";"JAWA TENGAH";"53196";"Indonesia";"";"-7.5953359";"109.4184255";"https://maps.google.com/?cid=0x0:0xf677e3f427938653"
"perumahan";"Komplek perumahan";"Rumah keisha";"9CV9+JP2, Jl. Puteran, Gamblok, Purwodadi, Kec. Tambak, Kabupaten Banyumas, Jawa Tengah 53196";"Jl. Puteran, Gamblok, Purwodadi, Kec. Tambak, Kabupaten Banyumas";"JAWA TENGAH";"53196";"Indonesia";"";"-7.6063128";"109.4199845";"https://maps.google.com/?cid=0x0:0x61f98b62edb2f83f"
"perumahan";"Komplek perumahan";"Yuris Home";"9CX3+799, Kamulyan, Kec. Tambak, Kabupaten Banyumas, Jawa Tengah";"Kabupaten Banyumas, Jawa Tengah";"JAWA TENGAH";"";"Indonesia";"";"-7.6018444";"109.4034991";"https://maps.google.com/?cid=0x0:0x4fedd4867d33f72f"
"perumahan";"Kompleks Apartemen";"Mbah Badani Rumah";"99RW+5M, Koplak, Kamulyan, Kec. Tambak, Kabupaten Banyumas, Jawa Tengah 53196";"Koplak, Kamulyan, Kec. Tambak, Kabupaten Banyumas";"JAWA TENGAH";"53196";"Indonesia";"";"-7.6095371";"109.3966807";"https://maps.google.com/?cid=0x0:0x76fc2af69e6cb646"
"perumahan";"perumahan";"Yulian Shoodiqin";"9CM6+2F2, Jl. Tegalan, Sigigil, Karangpucung, Kec. Tambak, Kabupaten Banyumas, Jawa Tengah 53196";"Jl. Tegalan, Sigigil, Karangpucung, Kec. Tambak, Kabupaten Banyumas";"JAWA TENGAH";"53196";"Indonesia";"";"-7.6174805";"109.411156";"https://maps.google.com/?cid=0x0:0xf20c021b8231adc8"
"perumahan";"perumahan";"Mamat";"CC37+C87, Gadog, Watuagung, Kec. Tambak, Kabupaten Banyumas, Jawa Tengah 53196";"Gadog, Watuagung, Kec. Tambak, Kabupaten Banyumas";"JAWA TENGAH";"53196";"Indonesia";"";"-7.5964672";"109.4133102";"https://maps.google.com/?cid=0x0:0x8b0898d4ecf83bd5"
"perumahan";"Komplek perumahan";"RUMAH PAK SUTOWO";"9CP2+43H, Gramang, Karangpetir, Kec. Tambak, Kabupaten Banyumas, Jawa Tengah";"Kabupaten Banyumas, Jawa Tengah";"JAWA TENGAH";"";"Indonesia";"";"-7.6146767";"109.4002428";"https://maps.google.com/?cid=0x0:0xc77be2051447139a"
"perumahan";"Komplek perumahan";"Home aura  kenzi";"99RW+5M, Koplak, Kamulyan, Kec. Tambak, Kabupaten Banyumas, Jawa Tengah 53196";"Koplak, Kamulyan, Kec. Tambak, Kabupaten Banyumas";"JAWA TENGAH";"53196";"Indonesia";"";"-7.6095071";"109.3967167";"https://maps.google.com/?cid=0x0:0x2c4036cf3398dc9d"
"perumahan";"Pembangunan Perumahan";"Perumahan Griya Kartika Wangon kabupaten banyumas";"Pecikalan Dua, Wangon, Kec. Wangon, Kabupaten Banyumas, Jawa Tengah 53176";"Wangon, Kec. Wangon, Kabupaten Banyumas";"JAWA TENGAH";"53176";"Indonesia";"";"-7.5184073";"109.0518946";"https://maps.google.com/?cid=0x0:0xa973999fdbff8a8e"
"perumahan";"Pembangunan Perumahan";"Perumahan Kotawa Wangon";"F3P5+V6M, Pumas Kotawa Raya, Ledar, Banteran, Kec. Wangon, Kabupaten Banyumas, Jawa Tengah 53176";"Pumas Kotawa Raya, Ledar, Banteran, Kec. Wangon, Kabupaten Banyumas";"JAWA TENGAH";"53176";"Indonesia";"";"-7.5127953";"109.0580556";"https://maps.google.com/?cid=0x0:0xeaa8cd1b3cf2d74e"
"perumahan";"Pembangunan Perumahan";"Perumahan Griya Rancabanteng Indah Kp.gading Kulon - Wangon";"Jl. Kauman No.19, RT.02/RW.01, Tengah, Wangon, Kec. Wangon, Kabupaten Banyumas, Jawa Tengah 53176";"RT.02/RW.01, Tengah, Wangon, Kec. Wangon, Kabupaten Banyumas";"JAWA TENGAH";"53176";"Indonesia";" 081225326335";"-7.5156796";"109.0560941";"https://maps.google.com/?cid=0x0:0xf097355fcdc00176"
"perumahan";"Otoritas Perumahan";"Perumahan Astana Permai Wangon";"Jl. Damar, RT.02/RW.06, Pecikalan Dua, Wangon, Kec. Wangon, Kabupaten Banyumas, Jawa Tengah 53176";"RT.02/RW.06, Pecikalan Dua, Wangon, Kec. Wangon, Kabupaten Banyumas";"JAWA TENGAH";"53176";"Indonesia";" 085159618055";"-7.5173597";"109.0527144";"https://maps.google.com/?cid=0x0:0xd4f44be7783ecd5"
"perumahan";"Pembangunan Perumahan";"Perumahan Griya Mutiara Gading";"Jl. Satria Mandala, Pecikalan Satu, Klapagading Kulon, Kec. Wangon, Kabupaten Banyumas, Jawa Tengah 53176";"Pecikalan Satu, Klapagading Kulon, Kec. Wangon, Kabupaten Banyumas";"JAWA TENGAH";"53176";"Indonesia";"";"-7.5154446";"109.063765";"https://maps.google.com/?cid=0x0:0x7f57be938690515b"
"perumahan";"Komplek perumahan";"Perumahan Rancabanteng Indah";"F29X+F8F, RT.01/RW.01, Randegan Tengah, Randegan, Kec. Wangon, Kabupaten Banyumas, Jawa Tengah 53176";"RT.01/RW.01, Randegan Tengah, Randegan, Kec. Wangon, Kabupaten Banyumas";"JAWA TENGAH";"53176";"Indonesia";"";"-7.5313103";"109.0482984";"https://maps.google.com/?cid=0x0:0x943ffc65d494a3e6"
"perumahan";"Komplek perumahan";"Rumah SEPTINA FITRI KURNIAWATI/Febri Anada V.R/Sigit Sudianto";"F3W8+98R, Jl. Inpres, Sengkalputung, Banteran, Kec. Wangon, Kabupaten Banyumas, Jawa Tengah 53176";"Jl. Inpres, Sengkalputung, Banteran, Kec. Wangon, Kabupaten Banyumas";"JAWA TENGAH";"53176";"Indonesia";" 082225311833";"-7.5040197";"109.0657608";"https://maps.google.com/?cid=0x0:0xa943cdf066d476f4"
"perumahan";"Pembangunan Perumahan";"Snjvmrdli";"Klapagading, Kec. Wangon, Kabupaten Banyumas, Jawa Tengah 53176";"Kec. Wangon, Kabupaten Banyumas";"JAWA TENGAH";"53176";"Indonesia";"";"-7.517088";"109.0716405";"https://maps.google.com/?cid=0x0:0x6315ce9ea98ec38b"
"perumahan";"Komplek perumahan";"Zombie";"F3G2+G89, Pecikalan Dua, Wangon, Kec. Wangon, Kabupaten Banyumas, Jawa Tengah 53176";"Pecikalan Dua, Wangon, Kec. Wangon, Kabupaten Banyumas";"JAWA TENGAH";"53176";"Indonesia";"";"-7.5237076";"109.0508445";"https://maps.google.com/?cid=0x0:0x6c09583486018854"
"perumahan";"Kantor Perusahaan";"koi central wangon";"Jl. Raya Utara No.58, Mejingklak, Wangon, Kec. Wangon, Kabupaten Banyumas, Jawa Tengah 53176";"Mejingklak, Wangon, Kec. Wangon, Kabupaten Banyumas";"JAWA TENGAH";"53176";"Indonesia";" 081246173346";"-7.5149117";"109.0584784";"https://maps.google.com/?cid=0x0:0x79a894db4069f100"
"perumahan";"Pembangunan Perumahan";"Pecikalan dua";"F3H2+GMX, Pecikalan Dua, Wangon, Kec. Wangon, Kabupaten Banyumas, Jawa Tengah 53176";"Pecikalan Dua, Wangon, Kec. Wangon, Kabupaten Banyumas";"JAWA TENGAH";"53176";"Indonesia";" 081373524114";"-7.5211383";"109.0517382";"https://maps.google.com/?cid=0x0:0x13710b1a58728175"
"perumahan";"Kafe";"Rumah Rosita R.A";"Rancabanteng, Klapagading Kulon, Kec. Wangon, Kabupaten Banyumas, Jawa Tengah 53176";"Klapagading Kulon, Kec. Wangon, Kabupaten Banyumas";"JAWA TENGAH";"53176";"Indonesia";" 088983879383";"-7.5158124";"109.0609821";"https://maps.google.com/?cid=0x0:0xa7b6e38149c4e42"
"perumahan";"perumahan";"Rumah Pak Sumar_Bu Lina";"F3M3+GRP, Wangon, Kec. Wangon, Kabupaten Banyumas, Jawa Tengah 53176";"Wangon, Kec. Wangon, Kabupaten Banyumas";"JAWA TENGAH";"53176";"Indonesia";"";"-7.5160446";"109.0547159";"https://maps.google.com/?cid=0x0:0xabae4fbc66790228"
"perumahan";"Komplek perumahan";"MABES LSM HARIMAU PAC WANGON";"F3M6+245, Jl. Kelapa Gading, Pecikalan Satu, Klapagading Kulon, Kec. Wangon, Kabupaten Banyumas, Jawa Tengah 53176";"Jl. Kelapa Gading, Pecikalan Satu, Klapagading Kulon, Kec. Wangon, Kabupaten Banyumas";"JAWA TENGAH";"53176";"Indonesia";"";"-7.5174528";"109.0603486";"https://maps.google.com/?cid=0x0:0x7239b15ef22ef545"
"housing complex";"Perumahan";"Perumahan Green Sapphire Residence Ajibarang";"Jl. Pandansari, Kauman, Ajibarang Wetan, Kec. Ajibarang, Kabupaten Banyumas, Jawa Tengah 53163";"Kauman, Ajibarang Wetan, Kec. Ajibarang, Kabupaten Banyumas";"JAWA TENGAH";"53163";"Indonesia";" 082211149836";"-7.402728";"109.0793879";"https://maps.google.com/?cid=0x0:0xc397873b6a766a7f"
"housing complex";"Perumahan";"Gwynnies Collections";"Perumahan Green Sapphire Residence Blok Emerald 19, Kauman, Ajibarang Wetan, Kec. Ajibarang, Kabupaten Banyumas, Jawa Tengah 53163";"Kauman, Ajibarang Wetan, Kec. Ajibarang, Kabupaten Banyumas";"JAWA TENGAH";"53163";"Indonesia";" 08562605907";"-7.403932";"109.0761889";"https://maps.google.com/?cid=0x0:0xe9f65d3edb01bd52"
"housing complex";"Komplek perumahan";"Griya Saphire Ajibarang";"H3WG+6VF, Jl. Kauman, Kauman, Ajibarang Wetan, Kec. Ajibarang, Kabupaten Banyumas, Jawa Tengah 53162";"Jl. Kauman, Kauman, Ajibarang Wetan, Kec. Ajibarang, Kabupaten Banyumas";"JAWA TENGAH";"53162";"Indonesia";"";"-7.4044299";"109.0771841";"https://maps.google.com/?cid=0x0:0x259141b97b7c2077"
"housing complex";"Komplek perumahan";"My home stay.keluarga kecile pak ugeng.";"H3WG+73c, Jl. Lkr. Ajibarang, Gondangmanis, Ajibarang Kulon, Kec. Ajibarang, Kabupaten Banyumas, Jawa Tengah 53163";"Jl. Lkr. Ajibarang, Gondangmanis, Ajibarang Kulon, Kec. Ajibarang, Kabupaten Banyumas";"JAWA TENGAH";"53163";"Indonesia";"";"-7.4115863";"109.0741087";"https://maps.google.com/?cid=0x0:0xdd137def2c61493d"
"housing complex";"Pembangunan Perumahan";"Durendampit House";"J33G+H2H, Durendampit, Ciberung, Kec. Ajibarang, Kabupaten Banyumas, Jawa Tengah 53163";"Durendampit, Ciberung, Kec. Ajibarang, Kabupaten Banyumas";"JAWA TENGAH";"53163";"Indonesia";"";"-7.3960746";"109.0751175";"https://maps.google.com/?cid=0x0:0xa7b6dce834fca1ae"
"housing complex";"Kantor Perusahaan";"Perumahan Avante Syariah Ajibarang";"H3RQ+Q6W, Jl. Munggangsari Utara, Munggangsari Lor, Lesmana, Kec. Ajibarang, Kabupaten Banyumas, Jawa Tengah 53163";"Jl. Munggangsari Utara, Munggangsari Lor, Lesmana, Kec. Ajibarang, Kabupaten Banyumas";"JAWA TENGAH";"53163";"Indonesia";" 085870141465";"-7.408015";"109.0880719";"https://maps.google.com/?cid=0x0:0x6131ff322dac3ab9"
"housing complex";"Toko bahan makanan";"DAPUR SNACK";"J33C+HR8, RT.02/RW.06, Durendampit, Ciberung, Kec. Ajibarang, Kabupaten Banyumas, Jawa Tengah 53163";"RT.02/RW.06, Durendampit, Ciberung, Kec. Ajibarang, Kabupaten Banyumas";"JAWA TENGAH";"53163";"Indonesia";" 081545923865";"-7.3960882";"109.0720699";"https://maps.google.com/?cid=0x0:0x65d53bae616db08d"
"housing complex";"Komplek perumahan";"Rumah hasbi";"J36F+PH2, Ciberung, Kec. Ajibarang, Kabupaten Banyumas, Jawa Tengah 53163";"Ciberung, Kec. Ajibarang, Kabupaten Banyumas";"JAWA TENGAH";"53163";"Indonesia";"";"-7.3882285";"109.0739095";"https://maps.google.com/?cid=0x0:0xf70cc09ec707b227"
"housing complex";"Perumahan";"Ihub Global Ajibarang Purwokerto Banyumas";"Perum Griya Safira, Jl. Lkr. Ajibarang No.30, Gondangmanis, Ajibarang Kulon, Kec. Ajibarang, Kabupaten Banyumas, Jawa Tengah 53163";"Jl. Lkr. Ajibarang No.30, Gondangmanis, Ajibarang Kulon, Kec. Ajibarang, Kabupaten Banyumas";"JAWA TENGAH";"53163";"Indonesia";" 085700000848";"-7.4107034";"109.0726722";"https://maps.google.com/?cid=0x0:0x58883c53ef6e1e26"
"housing complex";"Komplek perumahan";"AL HOME";"H354+VH3, Watubedil, Tipar Kidul, Kec. Ajibarang, Kabupaten Banyumas, Jawa Tengah 53163";"Watubedil, Tipar Kidul, Kec. Ajibarang, Kabupaten Banyumas";"JAWA TENGAH";"53163";"Indonesia";"";"-7.440287";"109.056906";"https://maps.google.com/?cid=0x0:0x3209b97a1665f19"
"housing complex";"Komplek perumahan";"Rumah Rendika";"H3X9+R2J, Legok, Ciberung, Kec. Ajibarang, Kabupaten Banyumas, Jawa Tengah 53163";"Legok, Ciberung, Kec. Ajibarang, Kabupaten Banyumas";"JAWA TENGAH";"53163";"Indonesia";"";"-7.4004069";"109.0675308";"https://maps.google.com/?cid=0x0:0x6fab2aeac5a98ded"
"housing complex";"Komplek perumahan";"Rumah Piza";"H3W3+8R6, Pulasari, Kracak, Kec. Ajibarang, Kabupaten Banyumas, Jawa Tengah 53163";"Pulasari, Kracak, Kec. Ajibarang, Kabupaten Banyumas";"JAWA TENGAH";"53163";"Indonesia";"";"-7.4042236";"109.0545068";"https://maps.google.com/?cid=0x0:0x4d36cd0a992d3d82"
"housing complex";"Komplek perumahan";"MARKAS DAMPOE AWANG PDA BC";"H3RF+Q7F, Jl. Lkr. Ajibarang, Gondangmanis, Ajibarang Kulon, Kec. Ajibarang, Kabupaten Banyumas, Jawa Tengah 53163";"Jl. Lkr. Ajibarang, Gondangmanis, Ajibarang Kulon, Kec. Ajibarang, Kabupaten Banyumas";"JAWA TENGAH";"53163";"Indonesia";"";"-7.4080656";"109.0731711";"https://maps.google.com/?cid=0x0:0x7201490736dbb614"
"housing complex";"Komplek perumahan";"Sawangan";"H39Q+8CM, Jl. Cidora 1, Mungguhan, Sawangan, Kec. Ajibarang, Kabupaten Banyumas, Jawa Tengah 53163";"Jl. Cidora 1, Mungguhan, Sawangan, Kec. Ajibarang, Kabupaten Banyumas";"JAWA TENGAH";"53163";"Indonesia";"";"-7.4316661";"109.0885375";"https://maps.google.com/?cid=0x0:0x6eca5f841c9fe5c3"
"housing complex";"Studio Fotografi";"Apartment Complex";"H6RW+49V, Jl. Gn. Merapi, Pakembaran, Bancarkembar, Kec. Purwokerto Utara, Kabupaten Banyumas, Jawa Tengah 53122";"Jl. Gn. Merapi, Pakembaran, Bancarkembar, Kec. Purwokerto Utara, Kabupaten Banyumas";"JAWA TENGAH";"53122";"Indonesia";" 087880891694";"-7.4096269";"109.2459149";"https://maps.google.com/?cid=0x0:0xac853958c3623b17"
"housing complex";"Pembangunan Perumahan";"Sudirman Village Tahap 2";"J6JW+3C2, Bewok, Karanggintung, Kec. Sumbang, Kabupaten Banyumas, Jawa Tengah";"Kabupaten Banyumas, Jawa Tengah";"JAWA TENGAH";"";"Indonesia";" 082220428866";"-7.3698506";"109.2460171";"https://maps.google.com/?cid=0x0:0xa9124ca0bfe20f00"
"housing complex";"Pembangunan Perumahan";"SUDIRMAN VILLAGE PURWOKERTO";"Gewok, Bewok, Karanggintung, Kec. Sumbang, Kabupaten Banyumas, Jawa Tengah 53183";"Bewok, Karanggintung, Kec. Sumbang, Kabupaten Banyumas";"JAWA TENGAH";"53183";"Indonesia";" 082220428866";"-7.3728294";"109.2478147";"https://maps.google.com/?cid=0x0:0xe295c4a8b098adbf"
"housing complex";"Pembangunan Perumahan";"Perumahan Graha Sudirman Purwokerto";"J762+752, Kedung Malang, Kedungmalang, Kec. Sumbang, Kabupaten Banyumas, Jawa Tengah 53183";"Kedung Malang, Kedungmalang, Kec. Sumbang, Kabupaten Banyumas";"JAWA TENGAH";"53183";"Indonesia";"";"-7.3893571";"109.2504015";"https://maps.google.com/?cid=0x0:0x8035bbd30083b48b"
"housing complex";"Komplek perumahan";"Tegar House";"H687+JC6,Jl. Veteran, RT.05/RW.06, Pasirmuncang Kulon, Pasirmuncang, Kec. Purwokerto Bar., Kabupaten Banyumas, Jawa Tengah 53137";"RT.05/RW.06, Pasirmuncang Kulon, Pasirmuncang, Kec. Purwokerto Bar., Kabupaten Banyumas";"JAWA TENGAH";"53137";"Indonesia";"";"-7.4335025";"109.2135101";"https://maps.google.com/?cid=0x0:0xf127762c85ca6fd0"
"housing complex";"housing complex";"MAHIKA PABUARAN";"J67R+GGF, Jl. Moh. Besar, Karang Blimbing, Pabuaran, Kec. Purwokerto Utara, Kabupaten Banyumas, Jawa Tengah";"Kabupaten Banyumas, Jawa Tengah";"JAWA TENGAH";"";"Indonesia";"";"-7.3861883";"109.2412984";"https://maps.google.com/?cid=0x0:0x19cbdb004c65b4cc"
"housing complex";"Komplek perumahan";"Perumahan Graha Timur Tahap - 2";"Jl. Supriyadi No.1A blok 9, Purwokerto Wetan, Kec. Purwokerto Tim., Kabupaten Banyumas, Jawa Tengah 53146";"Purwokerto Wetan, Kec. Purwokerto Tim., Kabupaten Banyumas";"JAWA TENGAH";"53146";"Indonesia";"";"-7.4273291";"109.2598159";"https://maps.google.com/?cid=0x0:0x48c49cd36f43bae1"
"housing complex";"Komplek perumahan";"Perumahan Griya Satria Mandalatama";"Dusun I, Karanglewas Kidul, Kec. Karanglewas, Kabupaten Banyumas, Jawa Tengah 53161";"Karanglewas Kidul, Kec. Karanglewas, Kabupaten Banyumas";"JAWA TENGAH";"53161";"Indonesia";"";"-7.4312635";"109.2085303";"https://maps.google.com/?cid=0x0:0xcb89fd0a8e85e279"
"housing complex";"Komplek perumahan";"Rumah";"G7QC+H3W, Jl. Wiradadi, Dusun I Wiradadi, Wiradadi, Kec. Sokaraja, Kabupaten Banyumas, Jawa Tengah 53181";"Jl. Wiradadi, Dusun I Wiradadi, Wiradadi, Kec. Sokaraja, Kabupaten Banyumas";"JAWA TENGAH";"53181";"Indonesia";"";"-7.4610489";"109.2701715";"https://maps.google.com/?cid=0x0:0x9d0ae2566625c567"
"housing complex";"Otoritas Perumahan";"Perumahan Ledug Asri Residence";"H7FF+X5C, Jl. Raya Bojongsari, Ledug Lor, Ledug, Kec. Kembaran, Kabupaten Banyumas, Jawa Tengah 53182";"Jl. Raya Bojongsari, Ledug Lor, Ledug, Kec. Kembaran, Kabupaten Banyumas";"JAWA TENGAH";"53182";"Indonesia";"";"-7.4250571";"109.2728821";"https://maps.google.com/?cid=0x0:0x8ffc92061c2363b0"
"housing complex";"Perumahan";"Perumahan Graha Agung Karangnanas";"G7Q5+FM4, Dusun II, Karangnanas, Kec. Sokaraja, Kabupaten Banyumas, Jawa Tengah 53181";"Dusun II, Karangnanas, Kec. Sokaraja, Kabupaten Banyumas";"JAWA TENGAH";"53181";"Indonesia";"";"-7.4613527";"109.2592165";"https://maps.google.com/?cid=0x0:0x69e9ef17ad2f922e"
"housing complex";"Komplek perumahan";"PERUMAHAN";"Blok F No.16, Dusun III, Sokaraja Kulon, Kabupaten Banyumas, Jawa Tengah";"Kabupaten Banyumas, Jawa Tengah";"JAWA TENGAH";"";"Indonesia";"";"-7.4659324";"109.2613982";"https://maps.google.com/?cid=0x0:0x9f0fbd6cccc1af74"
"housing complex";"Perumahan";"Cluster Wiradadi";"G7P5+6GH, Dusun II Wiradadi, Wiradadi, Kec. Sokaraja, Kabupaten Banyumas, Jawa Tengah";"Kabupaten Banyumas, Jawa Tengah";"JAWA TENGAH";"";"Indonesia";"";"-7.4644304";"109.2588651";"https://maps.google.com/?cid=0x0:0xe3ada56d02136228"
"housing complex";"housing complex";"Graha Teluk";"Pamujan, Teluk, Kec. Purwokerto Sel., Kabupaten Banyumas, Jawa Tengah 53145";"Teluk, Kec. Purwokerto Sel., Kabupaten Banyumas";"JAWA TENGAH";"53145";"Indonesia";" 085642542991";"-7.467843";"109.2481132";"https://maps.google.com/?cid=0x0:0x18e7ca6a0c8c0004"
"housing complex";"housing complex";"PERUM NEW GRAND RESIDENCE BANYUMAS";"Kedungter Kidul, Kedunguter, Kec. Banyumas, Kabupaten Banyumas, Jawa Tengah 53192";"Kedunguter, Kec. Banyumas, Kabupaten Banyumas";"JAWA TENGAH";"53192";"Indonesia";"";"-7.5217906";"109.2964408";"https://maps.google.com/?cid=0x0:0xa097e26c48c084b8"
"housing complex";"Komplek perumahan";"Desi's Home";"F7QH+FXQ, Karangkamal, Kalisube, Kec. Banyumas, Kabupaten Banyumas, Jawa Tengah 53192";"Karangkamal, Kalisube, Kec. Banyumas, Kabupaten Banyumas";"JAWA TENGAH";"53192";"Indonesia";"";"-7.5112757";"109.2799985";"https://maps.google.com/?cid=0x0:0x7bf765f3a3bd4340"
"housing complex";"Komplek perumahan";"Rumahnya Adhyagung Nurendra Winarto";"F7HW+3HH, Jl. Nagasari II, Kedungter Kidul, Kedunguter, Kec. Banyumas, Kabupaten Banyumas, Jawa Tengah 53192";"Jl. Nagasari II, Kedungter Kidul, Kedunguter, Kec. Banyumas, Kabupaten Banyumas";"JAWA TENGAH";"53192";"Indonesia";" 08975926378";"-7.5221876";"109.2962727";"https://maps.google.com/?cid=0x0:0x3f5d3b907ec7480a"
"housing complex";"Pembangunan Perumahan";"WISMA MUKTADIYAH";"F7MR+8F3, Jl. Kulon, Mruyung, Sudagaran, Kec. Banyumas, Kabupaten Banyumas, Jawa Tengah 53192";"Jl. Kulon, Mruyung, Sudagaran, Kec. Banyumas, Kabupaten Banyumas";"JAWA TENGAH";"53192";"Indonesia";" 081391325555";"-7.5167276";"109.2911619";"https://maps.google.com/?cid=0x0:0xfacaa7e7188b6478"
"housing complex";"Komplek perumahan";"salsabill house";"C7XH+WVR, Dukuh, Pasinggangan, Kec. Banyumas, Kabupaten Banyumas, Jawa Tengah 53192";"Dukuh, Pasinggangan, Kec. Banyumas, Kabupaten Banyumas";"JAWA TENGAH";"53192";"Indonesia";"";"-7.5503112";"109.2791635";"https://maps.google.com/?cid=0x0:0xdb7ef6c7898e9a2b"
"housing complex";"Pembangunan Perumahan";"Eka Joko (Pak Ritun)";"F72R+22F, Jl. Banyumas Kemranj, Karangrau Satu, Karangrau, Kec. Banyumas, Kabupaten Banyumas, Jawa Tengah 53192";"Jl. Banyumas Kemranj, Karangrau Satu, Karangrau, Kec. Banyumas, Kabupaten Banyumas";"JAWA TENGAH";"53192";"Indonesia";"";"-7.5499427";"109.2900339";"https://maps.google.com/?cid=0x0:0xb78e5af4776162a4"
"housing complex";"Komplek perumahan";"Rumahku";"F7V3+4QV, Sibak, Papringan, Kec. Banyumas, Kabupaten Banyumas, Jawa Tengah 53192";"Sibak, Papringan, Kec. Banyumas, Kabupaten Banyumas";"JAWA TENGAH";"53192";"Indonesia";"";"-7.5071375";"109.2544219";"https://maps.google.com/?cid=0x0:0x735cd70199a97f94"
"housing complex";"housing complex";"PDA Home";"F7PR+M3F, Jl. Sekolahan, Pekunden Tengah, Pekunden, Kec. Banyumas, Kabupaten Banyumas, Jawa Tengah 53192";"Jl. Sekolahan, Pekunden Tengah, Pekunden, Kec. Banyumas, Kabupaten Banyumas";"JAWA TENGAH";"53192";"Indonesia";" 085696964879";"-7.513309";"109.2901733";"https://maps.google.com/?cid=0x0:0xb26b46e2eb4392ed"
"housing complex";"Komplek perumahan";"Housing Aan";"F7JC+PJJ, Jl. Pesarehan Adipati Mrapat, Dawuhan, Kec. Banyumas, Kabupaten Banyumas, Jawa Tengah 53192";"Jl. Pesarehan Adipati Mrapat, Dawuhan, Kec. Banyumas, Kabupaten Banyumas";"JAWA TENGAH";"53192";"Indonesia";" 081391846202";"-7.5181613";"109.2715115";"https://maps.google.com/?cid=0x0:0xa417840f575adf0d"
"housing complex";"Komplek perumahan";"Nizam Home";"F79W+VH8, RT.006/RW.001, Karangpucung, Kejawar, Kec. Banyumas, Kabupaten Banyumas, Jawa Tengah 53192";"RT.006/RW.001, Karangpucung, Kejawar, Kec. Banyumas, Kabupaten Banyumas";"JAWA TENGAH";"53192";"Indonesia";"";"-7.5303862";"109.2964752";"https://maps.google.com/?cid=0x0:0xe43d748edcf5284a"
"housing complex";"Pembangunan Perumahan";"Gubug @kusnen";"F77Q+R2R, RT.03/RW.02, Karangwangkal, Kedunggede, Kec. Banyumas, Kabupaten Banyumas, Jawa Tengah 53192";"RT.03/RW.02, Karangwangkal, Kedunggede, Kec. Banyumas, Kabupaten Banyumas";"JAWA TENGAH";"53192";"Indonesia";"";"-7.53547";"109.2875633";"https://maps.google.com/?cid=0x0:0x6af4a5ae895b6738"
"housing complex";"Komplek perumahan";"Ndalem ngandhap";"RT.01/RW.02, Karangrau Dua, Karangrau, Kec. Banyumas, Kabupaten Banyumas, Jawa Tengah 53192";"Karangrau Dua, Karangrau, Kec. Banyumas, Kabupaten Banyumas";"JAWA TENGAH";"53192";"Indonesia";"";"-7.5518259";"109.2879575";"https://maps.google.com/?cid=0x0:0x748ae7509088d004"
"housing complex";"Pembangunan Perumahan";"Kalisube banyumas";"Jl. GENDAYAKAN, RT.003/RW.004, Karangkamal, Kalisube, Kec. Banyumas, Kabupaten Banyumas, Jawa Tengah 53192";"RT.003/RW.004, Karangkamal, Kalisube, Kec. Banyumas, Kabupaten Banyumas";"JAWA TENGAH";"53192";"Indonesia";"";"-7.5155698";"109.2801794";"https://maps.google.com/?cid=0x0:0x193687d988c04011"
"housing complex";"Pembangunan Perumahan";"Bro Anton";"F7MQ+HW2, Pekunden Tengah, Pekunden, Kec. Banyumas, Kabupaten Banyumas, Jawa Tengah 53192";"Pekunden Tengah, Pekunden, Kec. Banyumas, Kabupaten Banyumas";"JAWA TENGAH";"53192";"Indonesia";" 081391636857";"-7.5161131";"109.2897703";"https://maps.google.com/?cid=0x0:0xa53301954d43da87"
"housing complex";"Komplek perumahan";"Perumahan Purwosari";"J63M+8HQ, Jl. Gn. Slamet, Dusun II, Purwosari, Kec. Baturaden, Kabupaten Banyumas, Jawa Tengah 53151";"Jl. Gn. Slamet, Dusun II, Purwosari, Kec. Baturaden, Kabupaten Banyumas";"JAWA TENGAH";"53151";"Indonesia";"";"-7.396662";"109.2339798";"https://maps.google.com/?cid=0x0:0xa6831e5e716b7089"
