Category;Real Category;Business Name;Address;City;State;Postal Code;Country;Phone;Latitude;Longitude;Map Link
"housing complex";"Perhimpunan Pengembang Perumahan";"Enzi Home";"Jl. Pahlawan Gg. IX No.10, Tanjung, Kec. Purwokerto Sel., Kabupaten Banyumas, Jawa Tengah 53144";"Tanjung, Kec. Purwokerto Sel., Kabupaten Banyumas";"JAWA TENGAH";"53144";"Indonesia";"";"-7.436828";"109.2230772";"https://maps.google.com/?cid=0x0:0x6d9791758f712df1"
"housing complex";"Kantor Perusahaan";"HB Purwokerto";"Kost Tanjung Indah Purwokerto Jalan Margantara Gg. II rt 04/04 no 11, Tanjung, Kec. Purwokerto Sel., Kabupaten Banyumas";"Kabupaten Banyumas, Jawa Tengah";"JAWA TENGAH";"";"Indonesia";"";"-7.4363821";"109.2188021";"https://maps.google.com/?cid=0x0:0xc76d23a129776ac6"
"housing complex";"Komplek perumahan";"Nasabah Macet Kareszatama";"H69F+VMF, Pasirmuncang Wetan, Pasirmuncang, Kec. Purwokerto Bar., Kabupaten Banyumas, Jawa Tengah";"Kabupaten Banyumas, Jawa Tengah";"JAWA TENGAH";"";"Indonesia";"";"-7.4303164";"109.2241648";"https://maps.google.com/?cid=0x0:0xe06355993cbcb4fa"
"housing complex";"Komplek perumahan";"Gang kecil margabakti";"H69F+V5C, Pasirmuncang Wetan, Pasirmuncang, Kec. Purwokerto Bar., Kabupaten Banyumas, Jawa Tengah 53137";"Pasirmuncang Wetan, Pasirmuncang, Kec. Purwokerto Bar., Kabupaten Banyumas";"JAWA TENGAH";"53137";"Indonesia";"";"-7.4304889";"109.2228968";"https://maps.google.com/?cid=0x0:0x126010a4bbdcb05e"
"housing complex";"housing complex";"Rumah";"Gg. Pepaya No.1, Pagedangan, Rejasari, Kec. Purwokerto Bar., Kabupaten Banyumas, Jawa Tengah 53134";"Pagedangan, Rejasari, Kec. Purwokerto Bar., Kabupaten Banyumas";"JAWA TENGAH";"53134";"Indonesia";"";"-7.4238301";"109.2126405";"https://maps.google.com/?cid=0x0:0xed966f67ebdfea87"
"housing complex";"housing complex";"Rumah";"Jl. Suka Damai No.16, Gandasuli, Karangpucung, Kec. Purwokerto Sel., Kabupaten Banyumas, Jawa Tengah 53142";"Gandasuli, Karangpucung, Kec. Purwokerto Sel., Kabupaten Banyumas";"JAWA TENGAH";"53142";"Indonesia";"";"-7.4395407";"109.2403379";"https://maps.google.com/?cid=0x0:0x46e4cdc3ffbe8e81"
"housing complex";"Komplek perumahan";"Home 2";"Pumas 4 No.10, Windusara, Karangklesem, Kec. Purwokerto Sel., Kabupaten Banyumas, Jawa Tengah 53145";"Windusara, Karangklesem, Kec. Purwokerto Sel., Kabupaten Banyumas";"JAWA TENGAH";"53145";"Indonesia";"";"-7.4414296";"109.2467384";"https://maps.google.com/?cid=0x0:0x72a5a4d8052c1252"
"housing complex";"Pembangunan Perumahan";"GG House";"Jl. DI Panjaitan No.101, Sodagaran, Purwokerto Kidul, Kec. Purwokerto Sel., Kabupaten Banyumas, Jawa Tengah 53141";"Sodagaran, Purwokerto Kidul, Kec. Purwokerto Sel., Kabupaten Banyumas";"JAWA TENGAH";"53141";"Indonesia";"";"-7.4321973";"109.2485722";"https://maps.google.com/?cid=0x0:0xa0cda7f491c8eea9"
"housing complex";"Komplek perumahan";"Rumah";"Jl. Gandasuli No.1A, Gandasuli, Karangpucung, Kec. Purwokerto Sel., Kabupaten Banyumas, Jawa Tengah 53142";"Gandasuli, Karangpucung, Kec. Purwokerto Sel., Kabupaten Banyumas";"JAWA TENGAH";"53142";"Indonesia";"";"-7.4374041";"109.2359604";"https://maps.google.com/?cid=0x0:0x466e5eef5d2b0d40"
"housing complex";"Perhimpunan Pengembang Perumahan";"Krista House";"Jl. Puri Hijau, Belakang Ruko No.B9, Windusara, Karangklesem, Kec. Purwokerto Sel., Kabupaten Banyumas, Jawa Tengah 53144";"Belakang Ruko No.B9, Windusara, Karangklesem, Kec. Purwokerto Sel., Kabupaten Banyumas";"JAWA TENGAH";"53144";"Indonesia";"";"-7.4431043";"109.2457076";"https://maps.google.com/?cid=0x0:0xc986a72c4ee178c4"
"housing complex";"Kantor Perusahaan";"TKPN PURWOKERTO";"Jl. Prof. M Yamin I No.5, Karangklesem, Karangpucung, Kec. Purwokerto Sel., Kabupaten Banyumas, Jawa Tengah 53144";"Karangklesem, Karangpucung, Kec. Purwokerto Sel., Kabupaten Banyumas";"JAWA TENGAH";"53144";"Indonesia";"";"-7.4414312";"109.2415524";"https://maps.google.com/?cid=0x0:0x5fd3c6edc3a26e3e"
"housing complex";"Perumahan";"Taman Mas Residence Sidabowa";"Perum taman mas No.blok C28, Bersole, Karangpucung, Purwokerto Selatan, Banyumas Regency, Central Java 53142";"Bersole, Karangpucung, Purwokerto Selatan, Banyumas Regency";"JAWA TENGAH";"53142";"Indonesia";"";"-7.4537902";"109.2324789";"https://maps.google.com/?cid=0x0:0xa5f4c8e43759ec36"
"housing complex";"Komplek perumahan";"Haryono House";"Jl. Pramuka No.174, Sodagaran, Purwokerto Kulon, Kec. Purwokerto Sel., Kabupaten Banyumas, Jawa Tengah 53141";"Sodagaran, Purwokerto Kulon, Kec. Purwokerto Sel., Kabupaten Banyumas";"JAWA TENGAH";"53141";"Indonesia";"";"-7.4297638";"109.24772";"https://maps.google.com/?cid=0x0:0x5cef81d1b264874d"
"housing complex";"Otoritas Perumahan";"Purwokerto Banyumas";"H66V+3PG, Windusara, Karangklesem, Kec. Purwokerto Sel., Kabupaten Banyumas, Jawa Tengah 53144";"Windusara, Karangklesem, Kec. Purwokerto Sel., Kabupaten Banyumas";"JAWA TENGAH";"53144";"Indonesia";"";"-7.43982";"109.2443128";"https://maps.google.com/?cid=0x0:0xa9ccf041cc68c80a"
"housing complex";"Komplek perumahan";"ValesFlynn Home";"Perum Taman Anggrek Jl. Taman Anggrek No.21, Kedungampel, Purwokerto Kulon, Kec. Purwokerto Sel., Kabupaten Banyumas, Jawa Tengah 53141";"Kedungampel, Purwokerto Kulon, Kec. Purwokerto Sel., Kabupaten Banyumas";"JAWA TENGAH";"53141";"Indonesia";"";"-7.4346945";"109.2466294";"https://maps.google.com/?cid=0x0:0x5136d71ab2c37ef0"
"housing complex";"Perumahan";"Perum Citra Pratama Residence";"Jl. Pembina, Bersole, Karangpucung, Kec. Purwokerto Sel., Kabupaten Banyumas, Jawa Tengah 53142";"Bersole, Karangpucung, Kec. Purwokerto Sel., Kabupaten Banyumas";"JAWA TENGAH";"53142";"Indonesia";"";"-7.4467654";"109.2344043";"https://maps.google.com/?cid=0x0:0x1e59a1a96f4726bc"
"housing complex";"Komplek perumahan";"ek46itar";"H69X+V34, Jl. Sudagaran III, Sodagaran, Purwokerto Kulon, Kec. Purwokerto Sel., Kabupaten Banyumas, Jawa Tengah 53141";"Jl. Sudagaran III, Sodagaran, Purwokerto Kulon, Kec. Purwokerto Sel., Kabupaten Banyumas";"JAWA TENGAH";"53141";"Indonesia";" 081328721215";"-7.4303633";"109.2476889";"https://maps.google.com/?cid=0x0:0x6933bb99be45eac7"
"housing complex";"Komplek perumahan";"Dr Dikky Home";"No.4 no 10, Gg. Sarwo Endah II, Karanganyar, Purwokerto Kidul, Kec. Purwokerto Sel., Kabupaten Banyumas, Jawa Tengah 53147";"Gg. Sarwo Endah II, Karanganyar, Purwokerto Kidul, Kec. Purwokerto Sel., Kabupaten Banyumas";"JAWA TENGAH";"53147";"Indonesia";"";"-7.4352832";"109.2557558";"https://maps.google.com/?cid=0x0:0x726b869ba97a8df1"
"housing complex";"Komplek perumahan";"Grand Tanjung Elok Purwokerto";"H65J+3XF, Bojong, Tanjung, Kec. Purwokerto Sel., Kabupaten Banyumas, Jawa Tengah 53144";"Bojong, Tanjung, Kec. Purwokerto Sel., Kabupaten Banyumas";"JAWA TENGAH";"53144";"Indonesia";"";"-7.4423069";"109.2324179";"https://maps.google.com/?cid=0x0:0xd6a06c25ba1f7716"
"housing complex";"Komplek perumahan";"Hahihutzy";"Jl. Teknas No.a6, Karangpucung, Kec. Purwokerto Sel., Kabupaten Banyumas, Jawa Tengah 53142";"Karangpucung, Kec. Purwokerto Sel., Kabupaten Banyumas";"JAWA TENGAH";"53142";"Indonesia";"";"-7.4465633";"109.2361293";"https://maps.google.com/?cid=0x0:0x1281083dd4237c5d"
"housing complex";"Perumahan";"Perum Citra Pratama Residence";"Jl. Pembina, Bersole, Karangpucung, Kec. Purwokerto Sel., Kabupaten Banyumas, Jawa Tengah 53142";"Bersole, Karangpucung, Kec. Purwokerto Sel., Kabupaten Banyumas";"JAWA TENGAH";"53142";"Indonesia";"";"-7.4467654";"109.2344043";"https://maps.google.com/?cid=0x0:0x1e59a1a96f4726bc"
"housing complex";"Perumahan";"Taman Mas Residence Sidabowa";"Perum taman mas No.blok C28, Bersole, Karangpucung, Purwokerto Selatan, Banyumas Regency, Central Java 53142";"Bersole, Karangpucung, Purwokerto Selatan, Banyumas Regency";"JAWA TENGAH";"53142";"Indonesia";"";"-7.4537902";"109.2324789";"https://maps.google.com/?cid=0x0:0xa5f4c8e43759ec36"
"housing complex";"Perumahan";"Buntown Residence";"Jl. Kalibener, Kalibener, Purwanegara, Kec. Purwokerto Tim., Kabupaten Banyumas, Jawa Tengah 53142";"Kalibener, Purwanegara, Kec. Purwokerto Tim., Kabupaten Banyumas";"JAWA TENGAH";"53142";"Indonesia";" 087848118000";"-7.4362374";"109.2376207";"https://maps.google.com/?cid=0x0:0x63677abd55bed7f5"
"housing complex";"Komplek perumahan";"RizkyFamily";"Blok E No.3, Bersole, Karangpucung, Purwokerto Selatan, Banyumas Regency, Central Java 53142";"Bersole, Karangpucung, Purwokerto Selatan, Banyumas Regency";"JAWA TENGAH";"53142";"Indonesia";" 082110365356";"-7.4540801";"109.230459";"https://maps.google.com/?cid=0x0:0x7a0ad9b490d40466"
"housing complex";"housing complex";"Rumah";"Jl. Suka Damai No.16, Gandasuli, Karangpucung, Kec. Purwokerto Sel., Kabupaten Banyumas, Jawa Tengah 53142";"Gandasuli, Karangpucung, Kec. Purwokerto Sel., Kabupaten Banyumas";"JAWA TENGAH";"53142";"Indonesia";"";"-7.4395407";"109.2403379";"https://maps.google.com/?cid=0x0:0x46e4cdc3ffbe8e81"
"housing complex";"Otoritas Perumahan";"Perumahan Karang Pucung Indah";"H62J+83P, Bersole, Karangpucung, Kec. Purwokerto Sel., Kabupaten Banyumas, Jawa Tengah 53171";"Bersole, Karangpucung, Kec. Purwokerto Sel., Kabupaten Banyumas";"JAWA TENGAH";"53171";"Indonesia";"";"-7.4491562";"109.2301886";"https://maps.google.com/?cid=0x0:0xbbdcdf422ae68c48"
"housing complex";"Komplek perumahan";"Grand Tanjung Elok Purwokerto";"H65J+3XF, Bojong, Tanjung, Kec. Purwokerto Sel., Kabupaten Banyumas, Jawa Tengah 53144";"Bojong, Tanjung, Kec. Purwokerto Sel., Kabupaten Banyumas";"JAWA TENGAH";"53144";"Indonesia";"";"-7.4423069";"109.2324179";"https://maps.google.com/?cid=0x0:0xd6a06c25ba1f7716"
"housing complex";"housing complex";"Ross Fam";"Jl. Sridadi 5 No.104, Windusara, Karangklesem, Kec. Purwokerto Sel., Kabupaten Banyumas, Jawa Tengah 53144";"Windusara, Karangklesem, Kec. Purwokerto Sel., Kabupaten Banyumas";"JAWA TENGAH";"53144";"Indonesia";"";"-7.4478696";"109.2372335";"https://maps.google.com/?cid=0x0:0x4b6069f511f98714"
"housing complex";"Komplek perumahan";"Rumah";"Jl. Gandasuli No.1A, Gandasuli, Karangpucung, Kec. Purwokerto Sel., Kabupaten Banyumas, Jawa Tengah 53142";"Gandasuli, Karangpucung, Kec. Purwokerto Sel., Kabupaten Banyumas";"JAWA TENGAH";"53142";"Indonesia";"";"-7.4374041";"109.2359604";"https://maps.google.com/?cid=0x0:0x466e5eef5d2b0d40"
"housing complex";"Komplek perumahan";"Perum Mulawarman";"H62V+3MH, Windusara, Karangklesem, Kec. Purwokerto Sel., Kabupaten Banyumas, Jawa Tengah 53144";"Windusara, Karangklesem, Kec. Purwokerto Sel., Kabupaten Banyumas";"JAWA TENGAH";"53144";"Indonesia";"";"-7.4498227";"109.2442197";"https://maps.google.com/?cid=0x0:0x5146e54df0c60e88"
"housing complex";"housing complex";"Bodyast As";"Jl. Sridadi 5 No.104, Windusara, Karangklesem, Kec. Purwokerto Sel., Kabupaten Banyumas, Jawa Tengah 53144";"Windusara, Karangklesem, Kec. Purwokerto Sel., Kabupaten Banyumas";"JAWA TENGAH";"53144";"Indonesia";"";"-7.4478696";"109.2372335";"https://maps.google.com/?cid=0x0:0x8588e4777ee1bed5"
"housing complex";"housing complex";"KASAMAGOHAUS";"G6WM+22C, Bersole, Karangpucung, Kec. Purwokerto Sel., Kabupaten Banyumas, Jawa Tengah 53142";"Bersole, Karangpucung, Kec. Purwokerto Sel., Kabupaten Banyumas";"JAWA TENGAH";"53142";"Indonesia";"";"-7.4549164";"109.2325092";"https://maps.google.com/?cid=0x0:0xdea0710e23e9af42"
"housing complex";"Pembangunan Perumahan";"Sapphire Boutique Purwokerto";"H67F+RR9, Jl. Pahlawan Gg. VII, Cileleng, Tanjung, Kec. Purwokerto Sel., Kabupaten Banyumas, Jawa Tengah 53144";"Jl. Pahlawan Gg. VII, Cileleng, Tanjung, Kec. Purwokerto Sel., Kabupaten Banyumas";"JAWA TENGAH";"53144";"Indonesia";" 0281627123";"-7.4354642";"109.2246196";"https://maps.google.com/?cid=0x0:0xd6db1d3b1aa063d9"
"housing complex";"Perumahan";"Taman Mas Residence Sidabowa";"Perum taman mas No.blok C28, Bersole, Karangpucung, Purwokerto Selatan, Banyumas Regency, Central Java 53142";"Bersole, Karangpucung, Purwokerto Selatan, Banyumas Regency";"JAWA TENGAH";"53142";"Indonesia";"";"-7.4537902";"109.2324789";"https://maps.google.com/?cid=0x0:0xa5f4c8e43759ec36"
"housing complex";"Komplek perumahan";"Perumahan Griya Permata Karangklesem";"Unnamed Road, Pringgede, Pringgede, Karangklesem, Purwokerto Selatan, Banyumas Regency, Central Java 53144";"Pringgede, Pringgede, Karangklesem, Purwokerto Selatan, Banyumas Regency";"JAWA TENGAH";"53144";"Indonesia";"";"-7.4545538";"109.2342147";"https://maps.google.com/?cid=0x0:0x237f1569f87d9776"
"housing complex";"Komplek perumahan";"Gavbill House";"G6WJ+V57, Jl. Wadas Kelir Jl. Terpadu, Windusara, Karangklesem, Kec. Purwokerto Sel., Kabupaten Banyumas, Jawa Tengah";"Kabupaten Banyumas, Jawa Tengah";"JAWA TENGAH";"";"Indonesia";" 081341443635";"-7.4528483";"109.2304238";"https://maps.google.com/?cid=0x0:0x4412948c34b25d34"
"housing complex";"Perhimpunan Pengembang Perumahan";"Krista House";"Jl. Puri Hijau, Belakang Ruko No.B9, Windusara, Karangklesem, Kec. Purwokerto Sel., Kabupaten Banyumas, Jawa Tengah 53144";"Belakang Ruko No.B9, Windusara, Karangklesem, Kec. Purwokerto Sel., Kabupaten Banyumas";"JAWA TENGAH";"53144";"Indonesia";"";"-7.4431043";"109.2457076";"https://maps.google.com/?cid=0x0:0xc986a72c4ee178c4"
"housing complex";"housing complex";"Bodyast As";"Jl. Sridadi 5 No.104, Windusara, Karangklesem, Kec. Purwokerto Sel., Kabupaten Banyumas, Jawa Tengah 53144";"Windusara, Karangklesem, Kec. Purwokerto Sel., Kabupaten Banyumas";"JAWA TENGAH";"53144";"Indonesia";"";"-7.4478696";"109.2372335";"https://maps.google.com/?cid=0x0:0x8588e4777ee1bed5"
"housing complex";"Komplek perumahan";"PURNOMO FAMILY";"G6XP+8XP, Windusara, Karangklesem, Kec. Purwokerto Sel., Kabupaten Banyumas, Jawa Tengah 53144";"Windusara, Karangklesem, Kec. Purwokerto Sel., Kabupaten Banyumas";"JAWA TENGAH";"53144";"Indonesia";"";"-7.4516558";"109.2373998";"https://maps.google.com/?cid=0x0:0xd0a40ced47e117de"
"housing complex";"Kantor Perusahaan";"TKPN PURWOKERTO";"Jl. Prof. M Yamin I No.5, Karangklesem, Karangpucung, Kec. Purwokerto Sel., Kabupaten Banyumas, Jawa Tengah 53144";"Karangklesem, Karangpucung, Kec. Purwokerto Sel., Kabupaten Banyumas";"JAWA TENGAH";"53144";"Indonesia";"";"-7.4414312";"109.2415524";"https://maps.google.com/?cid=0x0:0x5fd3c6edc3a26e3e"
"housing complex";"Komplek perumahan";"Rumah Reza";"Jl. Berkah No.7, RT.05/RW.07, Pringgede, Karangklesem, Kec. Purwokerto Sel., Kabupaten Banyumas, Jawa Tengah 53144";"RT.05/RW.07, Pringgede, Karangklesem, Kec. Purwokerto Sel., Kabupaten Banyumas";"JAWA TENGAH";"53144";"Indonesia";"";"-7.4581188";"109.2428786";"https://maps.google.com/?cid=0x0:0x951ff010a671b8cc"
"housing complex";"Komplek perumahan";"Perum Mulawarman";"H62V+3MH, Windusara, Karangklesem, Kec. Purwokerto Sel., Kabupaten Banyumas, Jawa Tengah 53144";"Windusara, Karangklesem, Kec. Purwokerto Sel., Kabupaten Banyumas";"JAWA TENGAH";"53144";"Indonesia";"";"-7.4498227";"109.2442197";"https://maps.google.com/?cid=0x0:0x5146e54df0c60e88"
"housing complex";"Perumahan";"Perum Citra Pratama Residence";"Jl. Pembina, Bersole, Karangpucung, Kec. Purwokerto Sel., Kabupaten Banyumas, Jawa Tengah 53142";"Bersole, Karangpucung, Kec. Purwokerto Sel., Kabupaten Banyumas";"JAWA TENGAH";"53142";"Indonesia";"";"-7.4467654";"109.2344043";"https://maps.google.com/?cid=0x0:0x1e59a1a96f4726bc"
"housing complex";"Komplek perumahan";"Christian L.H saphire boutique F6";"H67G+94V, Jl. Pahlawan Gg. VII, Cileleng, Tanjung, Kec. Purwokerto Sel., Kabupaten Banyumas, Jawa Tengah 53144";"Jl. Pahlawan Gg. VII, Cileleng, Tanjung, Kec. Purwokerto Sel., Kabupaten Banyumas";"JAWA TENGAH";"53144";"Indonesia";"";"-7.4365026";"109.2253082";"https://maps.google.com/?cid=0x0:0x6cbb41521540efb6"
"housing complex";"housing complex";"Ross Fam";"Jl. Sridadi 5 No.104, Windusara, Karangklesem, Kec. Purwokerto Sel., Kabupaten Banyumas, Jawa Tengah 53144";"Windusara, Karangklesem, Kec. Purwokerto Sel., Kabupaten Banyumas";"JAWA TENGAH";"53144";"Indonesia";"";"-7.4478696";"109.2372335";"https://maps.google.com/?cid=0x0:0x4b6069f511f98714"
"housing complex";"Komplek perumahan";"Titik kumpul wong tulus";"H64R+9MP, Windusara, Karangklesem, Kec. Purwokerto Sel., Kabupaten Banyumas, Jawa Tengah 53144";"Windusara, Karangklesem, Kec. Purwokerto Sel., Kabupaten Banyumas";"JAWA TENGAH";"53144";"Indonesia";"";"-7.4438174";"109.2418104";"https://maps.google.com/?cid=0x0:0x4746e4501916bf77"
"housing complex";"Komplek perumahan";"AREA family";"G6QR+RCG, Jl. Raya Gn. Tugel, Sudimara, Karangklesem, Kec. Purwokerto Sel., Kabupaten Banyumas, Jawa Tengah";"Kabupaten Banyumas, Jawa Tengah";"JAWA TENGAH";"";"Indonesia";"";"-7.4608817";"109.2413739";"https://maps.google.com/?cid=0x0:0xbced251848a69cb8"
"housing complex";"Komplek perumahan";"Djoko Trimulyo";"Jl. Cemara Ray No.75, Karang Malang, Teluk, Purwokerto Selatan, Banyumas Regency, Central Java 53145";"Karang Malang, Teluk, Purwokerto Selatan, Banyumas Regency";"JAWA TENGAH";"53145";"Indonesia";"";"-7.4524903";"109.2561952";"https://maps.google.com/?cid=0x0:0x952420d483b6becf"
"housing complex";"Pembangunan Perumahan";"CHANNYS STAY";"G6QW+256, Pamujan, Teluk, Kec. Purwokerto Sel., Kabupaten Banyumas, Jawa Tengah 53145";"Pamujan, Teluk, Kec. Purwokerto Sel., Kabupaten Banyumas";"JAWA TENGAH";"53145";"Indonesia";"";"-7.4624681";"109.2454036";"https://maps.google.com/?cid=0x0:0x6c0b3b6f1017ac5c"
"housing complex";"Pembangunan Perumahan";"Perumnas Teluk";"H723+3G3, Jl. Rasamala, Karang Malang, Teluk, Kec. Purwokerto Sel., Kabupaten Banyumas, Jawa Tengah 53145";"Jl. Rasamala, Karang Malang, Teluk, Kec. Purwokerto Sel., Kabupaten Banyumas";"JAWA TENGAH";"53145";"Indonesia";"";"-7.449856";"109.2538062";"https://maps.google.com/?cid=0x0:0xffaba130c660dd25"
"housing complex";"Toko";"CAHAYA BARU";"G7R2+56J, Pamujan, Teluk, Kec. Purwokerto Sel., Kabupaten Banyumas, Jawa Tengah 53145";"Pamujan, Teluk, Kec. Purwokerto Sel., Kabupaten Banyumas";"JAWA TENGAH";"53145";"Indonesia";"";"-7.4596163";"109.250502";"https://maps.google.com/?cid=0x0:0x5383bfc9d0231a2d"
"housing complex";"housing complex";"Dhita_putu";"G7W3+JGF, Patilampa, Teluk, Kec. Purwokerto Sel., Kabupaten Banyumas, Jawa Tengah 53145";"Patilampa, Teluk, Kec. Purwokerto Sel., Kabupaten Banyumas";"JAWA TENGAH";"53145";"Indonesia";"";"-7.4534757";"109.2536933";"https://maps.google.com/?cid=0x0:0x761e8efc60d3f181"
"housing complex";"Komplek perumahan";"Murend House";"Regency, Perumahan Teluk Keminte, Blk. A No.3, Pamujan, Teluk, Kec. Purwokerto Sel., Kabupaten Banyumas, Jawa Tengah 53145";"Perumahan Teluk Keminte, Blk. A No.3, Pamujan, Teluk, Kec. Purwokerto Sel., Kabupaten Banyumas";"JAWA TENGAH";"53145";"Indonesia";" 08157906286";"-7.4685633";"109.2483449";"https://maps.google.com/?cid=0x0:0x810371474a4ce24"
"housing complex";"Perumahan";"Zavair House A5";"G7H2+J4P, Purwokerto, Pamujan, Teluk, Kec. Purwokerto Sel., Kabupaten Banyumas, Jawa Tengah 53145";"Purwokerto, Pamujan, Teluk, Kec. Purwokerto Sel., Kabupaten Banyumas";"JAWA TENGAH";"53145";"Indonesia";"";"-7.4709083";"109.2503435";"https://maps.google.com/?cid=0x0:0x1854d8ae47ff354"
"housing complex";"housing complex";"Rumah Ibu Helmi";"G6VX+X87, Jl. Arsadimedja, Bantarmangu, Teluk, Kec. Purwokerto Sel., Kabupaten Banyumas, Jawa Tengah 53145";"Jl. Arsadimedja, Bantarmangu, Teluk, Kec. Purwokerto Sel., Kabupaten Banyumas";"JAWA TENGAH";"53145";"Indonesia";"";"-7.4552898";"109.2482933";"https://maps.google.com/?cid=0x0:0xe509d93edb7f09d9"
"housing complex";"Komplek perumahan";"Danu";"G7W2+P2P, Jl. Wiryo Suparno, Bantarmangu, Teluk, Kec. Purwokerto Sel., Kabupaten Banyumas, Jawa Tengah 53145";"Jl. Wiryo Suparno, Bantarmangu, Teluk, Kec. Purwokerto Sel., Kabupaten Banyumas";"JAWA TENGAH";"53145";"Indonesia";"";"-7.4530767";"109.2496703";"https://maps.google.com/?cid=0x0:0xf5debdeecf55bbf"
"housing complex";"Komplek perumahan";"Perumahan Bumi Pamujan Indah";"Jl. Pamujan Indah III, Sudimara, Karangklesem, Kec. Purwokerto Sel., Kabupaten Banyumas, Jawa Tengah 53145";"Sudimara, Karangklesem, Kec. Purwokerto Sel., Kabupaten Banyumas";"JAWA TENGAH";"53145";"Indonesia";"";"-7.4613025";"109.2439135";"https://maps.google.com/?cid=0x0:0x1f076da2a57f19d3"
"housing complex";"Komplek perumahan";"Kayyisa";"Jl. Wiryo Suparno No.36, Bantarmangu, Teluk, Kec. Purwokerto Sel., Kabupaten Banyumas, Jawa Tengah 53145";"Bantarmangu, Teluk, Kec. Purwokerto Sel., Kabupaten Banyumas";"JAWA TENGAH";"53145";"Indonesia";"";"-7.4540214";"109.2503718";"https://maps.google.com/?cid=0x0:0xb1fd7bec2cbc3ecb"
"housing complex";"housing complex";"SALMAN HOME";"G6VX+423, Pamujan, Teluk, Kec. Purwokerto Sel., Kabupaten Banyumas, Jawa Tengah 53145";"Pamujan, Teluk, Kec. Purwokerto Sel., Kabupaten Banyumas";"JAWA TENGAH";"53145";"Indonesia";"";"-7.457075";"109.2475946";"https://maps.google.com/?cid=0x0:0xd6adcdfa00992e30"
"housing complex";"Komplek perumahan";"Perumahan Teluk Keminte Regency II";"G6JX+H79, Pamujan, Teluk, Kec. Purwokerto Sel., Kabupaten Banyumas, Jawa Tengah 53145";"Pamujan, Teluk, Kec. Purwokerto Sel., Kabupaten Banyumas";"JAWA TENGAH";"53145";"Indonesia";"";"-7.4685876";"109.2482483";"https://maps.google.com/?cid=0x0:0x1629bde5cd3eb772"
"housing complex";"Komplek perumahan";"AREA family";"G6QR+RCG, Jl. Raya Gn. Tugel, Sudimara, Karangklesem, Kec. Purwokerto Sel., Kabupaten Banyumas, Jawa Tengah";"Kabupaten Banyumas, Jawa Tengah";"JAWA TENGAH";"";"Indonesia";"";"-7.4608817";"109.2413739";"https://maps.google.com/?cid=0x0:0xbced251848a69cb8"
"housing complex";"Komplek perumahan";"House";"Jl. Pamujan Indah III No.534, RT.08/RW.10, Pamujan, Teluk, Kec. Purwokerto Sel., Kabupaten Banyumas, Jawa Tengah 53145";"RT.08/RW.10, Pamujan, Teluk, Kec. Purwokerto Sel., Kabupaten Banyumas";"JAWA TENGAH";"53145";"Indonesia";"";"-7.4229109";"109.2641555";"https://maps.google.com/?cid=0x0:0x9360d1fe7d8921f5"
"housing complex";"Otoritas Perumahan";"Perumahan Syariah Grand Oase Purwokerto";"Jl. Raya Bojongsari, Kedungparuk, Ledug, Kec. Kembaran, Kabupaten Banyumas, Jawa Tengah 53182";"Kedungparuk, Ledug, Kec. Kembaran, Kabupaten Banyumas";"JAWA TENGAH";"53182";"Indonesia";" 082242683680";"-7.4232966";"109.2725751";"https://maps.google.com/?cid=0x0:0x4f0c78689b56a8a6"
"housing complex";"Perhimpunan Pengembang Perumahan";"Egnkong widi";"H776+X5, Jl. Sokayasa, Berkoh, Kec. Purwokerto Sel., Kabupaten Banyumas, Jawa Tengah 53146";"Jl. Sokayasa, Berkoh, Kec. Purwokerto Sel., Kabupaten Banyumas";"JAWA TENGAH";"53146";"Indonesia";"";"-7.4361369";"109.2625181";"https://maps.google.com/?cid=0x0:0x23e8105b4fa396dc"
"housing complex";"Perumahan";"Ceria and Hazzel Home";"H745+QMW Spring townloft no B3, Karangbenda, Berkoh, Purwokerto Selatan, Banyumas Regency, Central Java";"Kabupaten Banyumas, Jawa Tengah";"JAWA TENGAH";"";"Indonesia";"";"-7.4430062";"109.2592166";"https://maps.google.com/?cid=0x0:0x5236672dc5688fdf"
"housing complex";"Komplek perumahan";"Dr Dikky Home";"No.4 no 10, Gg. Sarwo Endah II, Karanganyar, Purwokerto Kidul, Kec. Purwokerto Sel., Kabupaten Banyumas, Jawa Tengah 53147";"Gg. Sarwo Endah II, Karanganyar, Purwokerto Kidul, Kec. Purwokerto Sel., Kabupaten Banyumas";"JAWA TENGAH";"53147";"Indonesia";"";"-7.4352832";"109.2557558";"https://maps.google.com/?cid=0x0:0x726b869ba97a8df1"
"housing complex";"Komplek perumahan";"ek46itar";"H69X+V34, Jl. Sudagaran III, Sodagaran, Purwokerto Kulon, Kec. Purwokerto Sel., Kabupaten Banyumas, Jawa Tengah 53141";"Jl. Sudagaran III, Sodagaran, Purwokerto Kulon, Kec. Purwokerto Sel., Kabupaten Banyumas";"JAWA TENGAH";"53141";"Indonesia";" 081328721215";"-7.4303633";"109.2476889";"https://maps.google.com/?cid=0x0:0x6933bb99be45eac7"
"housing complex";"Komplek perumahan";"Perumahan "Mersi21"";"H7F8+H9M, Kepetek, Mersi, Kec. Purwokerto Tim., Kabupaten Banyumas, Jawa Tengah 53112";"Kepetek, Mersi, Kec. Purwokerto Tim., Kabupaten Banyumas";"JAWA TENGAH";"53112";"Indonesia";"";"-7.4260317";"109.2659317";"https://maps.google.com/?cid=0x0:0x7f29ee533c47350a"
"housing complex";"housing complex";"Rumah Boy";"H794+GC8, Jl. Sarwodadi II No.A, Karanganyar, Purwokerto Kidul, Kec. Purwokerto Sel., Kabupaten Banyumas, Jawa Tengah 53147";"Jl. Sarwodadi II No.A, Karanganyar, Purwokerto Kidul, Kec. Purwokerto Sel., Kabupaten Banyumas";"JAWA TENGAH";"53147";"Indonesia";"";"-7.4314998";"109.2559045";"https://maps.google.com/?cid=0x0:0x3e59abcf2925f3ab"
"housing complex";"Komplek perumahan";"ALF HOUSE";"Jl. Pratama No.b12a, Kalibakal, Berkoh, Purwokerto Selatan, Banyumas Regency, Central Java 53146";"Kalibakal, Berkoh, Purwokerto Selatan, Banyumas Regency";"JAWA TENGAH";"53146";"Indonesia";"";"-7.4436911";"109.2653059";"https://maps.google.com/?cid=0x0:0x253f7b168e0e9f15"
"housing complex";"Komplek perumahan";"Rumah suci";"H757+C4V, Gg. Melati, Kalibakal, Berkoh, Kec. Purwokerto Sel., Kabupaten Banyumas, Jawa Tengah 53146";"Gg. Melati, Kalibakal, Berkoh, Kec. Purwokerto Sel., Kabupaten Banyumas";"JAWA TENGAH";"53146";"Indonesia";"";"-7.441394";"109.2627872";"https://maps.google.com/?cid=0x0:0xf2d4b5150e4e81d8"
"housing complex";"Perumahan";"ALANA CROWN";"H64X+62W, Jl. Samparangin, RT.05/RW.01, Tasari, Teluk, Kec. Purwokerto Sel., Kabupaten Banyumas, Jawa Tengah 53145";"Jl. Samparangin, RT.05/RW.01, Tasari, Teluk, Kec. Purwokerto Sel., Kabupaten Banyumas";"JAWA TENGAH";"53145";"Indonesia";" 081234569636";"-7.4443792";"109.2475832";"https://maps.google.com/?cid=0x0:0xa899f2b118659f6a"
"housing complex";"housing complex";"Kos waroeng griya limas ( Arjuma)";"Jl. Jend. Sudirman No.46, Kebontebu, Berkoh, Kec. Purwokerto Sel., Kabupaten Banyumas, Jawa Tengah 53146";"Kebontebu, Berkoh, Kec. Purwokerto Sel., Kabupaten Banyumas";"JAWA TENGAH";"53146";"Indonesia";"";"-7.4371627";"109.2635049";"https://maps.google.com/?cid=0x0:0xfbbee733be876fb5"
"housing complex";"Perumahan";"Berkoh Indah";"Jl. Beringin, Berkoh, Kec. Purwokerto Sel., Kabupaten Banyumas, Jawa Tengah 53146";"Berkoh, Kec. Purwokerto Sel., Kabupaten Banyumas";"JAWA TENGAH";"53146";"Indonesia";"";"-7.4334256";"109.2612937";"https://maps.google.com/?cid=0x0:0x33a58454c5dd0e54"
