Category;Real Category;Business Name;Address;City;State;Postal Code;Country;Phone;Email;Website;Latitude;Longitude;Map Link;Details Link
"cafe";"Kafe";"KOPI.ID Pamotan";"6FHR+QQW, Tajen, Pamotan, Kec. Pamotan, Kabupaten Rembang, Jawa Tengah 59261";"Tajen, Pamotan, Kec. Pamotan, Kabupaten Rembang";"JAWA TENGAH";"59261";"Indonesia";" 08992030050";"";"";"-6.7705207";"111.491939";"https://maps.google.com/?cid=0x0:0x7b05eafb5816153e";""
"cafe";"Kafe";"Wk Coffie";"6FMQ+MGV, Karangantik, Pamotan, Kec. Pamotan, Kabupaten Rembang, Jawa Tengah 59261";"Karangantik, Pamotan, Kec. Pamotan, Kabupaten Rembang";"JAWA TENGAH";"59261";"Indonesia";" 082226078377";"";"";"-6.7657602";"111.4887921";"https://maps.google.com/?cid=0x0:0x15c7058749e23cc6";""
"cafe";"Kedai Kopi";"Angkringan Pamotan";"6FPQ+6W4, Tajen, Pamotan, Kec. Pamotan, Kabupaten Rembang, Jawa Tengah 59261";"Tajen, Pamotan, Kec. Pamotan, Kabupaten Rembang";"JAWA TENGAH";"59261";"Indonesia";" 089526150666";"";"";"-6.7644782";"111.4898425";"https://maps.google.com/?cid=0x0:0xbe80b5f44b2d9fdd";""
"cafe";"Kedai Kopi";"Kopi Nyeni Pamotan";"6FPJ+2P7, Karangantik, Pamotan, Kec. Pamotan, Kabupaten Rembang, Jawa Tengah 59261";"Karangantik, Pamotan, Kec. Pamotan, Kabupaten Rembang";"JAWA TENGAH";"59261";"Indonesia";"";"";"/url?q>>u003dhttps://www.instagram.com/kopinyenipamotan%3Figsh%3DMXJ5ZGtxdmUxa2s1Ng%3D%3D>>u0026opi>>u003d79508299>>u0026sa>>u003dU>>u0026ved>>u003d0ahUKEwiv7L6Hko2MAxUtSGwGHZSUHYkQ61gIESgN>>u0026usg>>u003dAOvVaw0vck8atOvXOTbo1NFoSQ7E";"-6.7657983";"111.4808206";"https://maps.google.com/?cid=0x0:0xe2bff6c59051cad4";""
"cafe";"Kafe";"Cafe Lutils";"6FJQ+P4P, Cikalan, Pamotan, Kec. Pamotan, Kabupaten Rembang, Jawa Tengah 59261";"Cikalan, Pamotan, Kec. Pamotan, Kabupaten Rembang";"JAWA TENGAH";"59261";"Indonesia";" 081326055256";"";"";"-6.7681721";"111.4878132";"https://maps.google.com/?cid=0x0:0xf07df85823dbc407";""
"cafe";"Kafe";"A'ang Coffee";"6FJX+99J, Jl. Pamotan-Sedan, Tajen, Sumberan, Kec. Pamotan, Kabupaten Rembang, Jawa Tengah 59261";"Jl. Pamotan-Sedan, Tajen, Sumberan, Kec. Pamotan, Kabupaten Rembang";"JAWA TENGAH";"59261";"Indonesia";"";"";"";"-6.7690492";"111.4983769";"https://maps.google.com/?cid=0x0:0x5fe0077663eadbb0";""
"cafe";"Kafe";"Coffe Ruang Tunggu";"Jl. Pamotan No.17, Tajen, Pamotan, Kec. Pamotan, Kabupaten Rembang, Jawa Tengah 59261";"Tajen, Pamotan, Kec. Pamotan, Kabupaten Rembang";"JAWA TENGAH";"59261";"Indonesia";"";"";"";"-6.7651152";"111.4902701";"https://maps.google.com/?cid=0x0:0xc8b3094c6d0f3c2e";""
"cafe";"Kafe";"Teh Kota Pamotan";"Jl. Pancur-Pamotan, Candisari, Pamotan, Kec. Pamotan, Kabupaten Rembang, Jawa Tengah";"Kabupaten Rembang, Jawa Tengah";"JAWA TENGAH";"";"Indonesia";"";"";"";"-6.7551772";"111.4863306";"https://maps.google.com/?cid=0x0:0x5b21990d08b57d76";""
"cafe";"Kafe";"Kopi Bang Udin";"6FQQ+RRX, Jalan, Candisari, Pamotan, Rembang Regency, Central Java 59261";"Jalan, Candisari, Pamotan, Rembang Regency";"JAWA TENGAH";"59261";"Indonesia";" 08985992851";"";"";"-6.7603796";"111.4895959";"https://maps.google.com/?cid=0x0:0x544ec52279146bf3";""
"cafe";"Kafe";"Kopi Tulen";"6FVQ+366, Mudal, Pamotan, Kec. Pamotan, Kabupaten Rembang, Jawa Tengah 59261";"Mudal, Pamotan, Kec. Pamotan, Kabupaten Rembang";"JAWA TENGAH";"59261";"Indonesia";" 089524117722";"";"";"-6.7573289";"111.4880206";"https://maps.google.com/?cid=0x0:0xed90e5b4d1faabf3";""
"cafe";"Grosir Kopi";"Kopi Lelet Ibu. Sulasih";"6FQC+V7X, Jl. Pamotan, Angkatan, Ringin, Kec. Pamotan, Kabupaten Rembang, Jawa Tengah 59261";"Jl. Pamotan, Angkatan, Ringin, Kec. Pamotan, Kabupaten Rembang";"JAWA TENGAH";"59261";"Indonesia";"";"";"";"-6.76027";"111.470732";"https://maps.google.com/?cid=0x0:0xefea012040c8655f";""
"cafe";"Kafe";"Caffee shop";"6CRH+C3Q, Jl. Japerejo, Gondang, Gegersimo, Kec. Pamotan, Kabupaten Rembang, Jawa Tengah 59261";"Jl. Japerejo, Gondang, Gegersimo, Kec. Pamotan, Kabupaten Rembang";"JAWA TENGAH";"59261";"Indonesia";"";"";"";"-6.7589183";"111.4277236";"https://maps.google.com/?cid=0x0:0x89d1629f7b072f76";""
"cafe";"Kafe";"Kopi Tahes 86 Free Wifi";"6GF7+7H5, Nglongko, Bangunrejo, Kec. Pamotan, Kabupaten Rembang, Jawa Tengah 59261";"Nglongko, Bangunrejo, Kec. Pamotan, Kabupaten Rembang";"JAWA TENGAH";"59261";"Indonesia";" 085230079799";"";"";"-6.7768731";"111.513974";"https://maps.google.com/?cid=0x0:0x24e9381241a7927";""
"cafe";"Mi";"Mie Ayam Kasmaran pamotan";"Jl. Pamotan, Kanoman, Pamotan, Kec. Pamotan, Kabupaten Rembang, Jawa Tengah 59261";"Kanoman, Pamotan, Kec. Pamotan, Kabupaten Rembang";"JAWA TENGAH";"59261";"Indonesia";" 085231045030";"";"";"-6.761615";"111.4866393";"https://maps.google.com/?cid=0x0:0x4254991f6ae8d311";""
"cafe";"Kafe";"Caffe Gembrot";"Unnamed Road, 59261, Candisari, Pamotan, Kec. Pamotan, Kabupaten Rembang, Jawa Tengah 59261";"59261, Candisari, Pamotan, Kec. Pamotan, Kabupaten Rembang";"JAWA TENGAH";"59261";"Indonesia";" 082135109708";"";"";"-6.7613162";"111.4925291";"https://maps.google.com/?cid=0x0:0x9cc31da58c189937";""
"cafe";"Kafe";"Warung kopi Mbah pomo";"6FRP+6Q3, RT.2/RW.13, Mudal, Pamotan, Kec. Pamotan, Kabupaten Rembang, Jawa Tengah 59261";"RT.2/RW.13, Mudal, Pamotan, Kec. Pamotan, Kabupaten Rembang";"JAWA TENGAH";"59261";"Indonesia";"";"";"";"-6.7599022";"111.4866567";"https://maps.google.com/?cid=0x0:0xcaacef9494824400";""
"cafe";"Kompleks Kondominium";"Ngasinan kec pamotan";"6FPJ+2P7, Karangantik, Pamotan, Kec. Pamotan, Kabupaten Rembang, Jawa Tengah 59261";"Karangantik, Pamotan, Kec. Pamotan, Kabupaten Rembang";"JAWA TENGAH";"59261";"Indonesia";"";"";"";"-6.7658333";"111.4810556";"https://maps.google.com/?cid=0x0:0x3d9b672935dd7afb";""
"cafe";"Kafe";"Warkop mama gemoy";"6FQP+8FX, Barat balai, Mudal, Pamotan, Kec. Pamotan, Kabupaten Rembang, Jawa Tengah 59261";"Barat balai, Mudal, Pamotan, Kec. Pamotan, Kabupaten Rembang";"JAWA TENGAH";"59261";"Indonesia";"";"";"";"-6.7616401";"111.4862401";"https://maps.google.com/?cid=0x0:0xfae56389093dca0e";""
"cafe";"cafe";"Pamotan";"Kanoman, Pamotan, Kec. Pamotan, Kabupaten Rembang, Jawa Tengah";"Kabupaten Rembang, Jawa Tengah";"JAWA TENGAH";"";"Indonesia";"";"";"";"-6.761747";"111.486801";"https://maps.google.com/?cid=0x0:0xc9a4d063f68f83e";""
"cafe";"Kafe";"ANGKRINGAN.WEDANGAN";"6FQP+73Q, Jl. Pamotan, Mudal, JAPEREJO, Kec. Pamotan, Kabupaten Rembang, Jawa Tengah";"Kabupaten Rembang, Jawa Tengah";"JAWA TENGAH";"";"Indonesia";"";"";"";"-6.761789";"111.4852367";"https://maps.google.com/?cid=0x0:0xbf83563ffbd4d532";""
"cafe";"Rumah Makan";"Seblak prasmanan 47";"Jl. Pamotan, Mudal, Pamotan, Kec. Pamotan, Kabupaten Rembang, Jawa Tengah";"Kabupaten Rembang, Jawa Tengah";"JAWA TENGAH";"";"Indonesia";"";"";"";"-6.7616533";"111.4861503";"https://maps.google.com/?cid=0x0:0xda8d10614d237ace";""
"cafe";"Kafe";"Mlyang city";"6FQP+8P3, Kanoman, Mlyang, Kec. Pamotan, Kabupaten Rembang, Jawa Tengah";"Kabupaten Rembang, Jawa Tengah";"JAWA TENGAH";"";"Indonesia";"";"";"";"-6.761747";"111.486801";"https://maps.google.com/?cid=0x0:0x4672ce9fdd7476df";""
"cafe";"Kafe";"ANGKRING CEMPLON";"6FX3+5RG, Jl. Pamotan, Sengkan, Japerejo, Kec. Pamotan, Kabupaten Rembang, Jawa Tengah 59261";"Jl. Pamotan, Sengkan, Japerejo, Kec. Pamotan, Kabupaten Rembang";"JAWA TENGAH";"59261";"Indonesia";"";"";"";"-6.7520632";"111.454563";"https://maps.google.com/?cid=0x0:0xe06dbf6d39ee0667";""
"cafe";"Rumah Makan";"Dapur Lasem Cafe  Resto";"Pandeyan, Sumbergirang, Kec. Lasem, Kabupaten Rembang, Jawa Tengah 59271";"Sumbergirang, Kec. Lasem, Kabupaten Rembang";"JAWA TENGAH";"59271";"Indonesia";" 08988984888";"";"";"-6.7000579";"111.4476383";"https://maps.google.com/?cid=0x0:0x1038a4823c01e25a";""
"cafe";"Kedai Kopi";"Warkop sablah";"7FJF+QPX, Unnamed Road, Tengger, Pancur, Kec. Pancur, Kabupaten Rembang, Jawa Tengah 59262";"Unnamed Road, Tengger, Pancur, Kec. Pancur, Kabupaten Rembang";"JAWA TENGAH";"59262";"Indonesia";"";"";"";"-6.7180137";"111.4743593";"https://maps.google.com/?cid=0x0:0x8454a528acc08c0c";""
"cafe";"Kedai Kopi";"Kopi Rinjani Cafe";"Ngroto, Kec. Pancur, Kabupaten Rembang, Jawa Tengah 59262";"Kec. Pancur, Kabupaten Rembang";"JAWA TENGAH";"59262";"Indonesia";" 082313797553";"";"";"-6.7151886";"111.5189804";"https://maps.google.com/?cid=0x0:0x4dd9677c68085b7d";""
"cafe";"Kedai Kopi";"ALIN CAFE";"Jl. Jatirogo, Nyade, Sumberagung, Kec. Pancur, Kabupaten Rembang, Jawa Tengah 59262";"Nyade, Sumberagung, Kec. Pancur, Kabupaten Rembang";"JAWA TENGAH";"59262";"Indonesia";"";"";"";"-6.7397918";"111.4774995";"https://maps.google.com/?cid=0x0:0xfe0993ea25919a6a";""
"cafe";"Kedai Kopi";"Bojom coffe";"7FFF+9VG, Punggurharjo, Kec. Pancur, Kabupaten Rembang, Jawa Tengah 59262";"Punggurharjo, Kec. Pancur, Kabupaten Rembang";"JAWA TENGAH";"59262";"Indonesia";" 081227180308";"";"";"-6.7265737";"111.4747024";"https://maps.google.com/?cid=0x0:0xbe435efa6c2064ce";""
"cafe";"Kedai Kopi";"Aldycoffee(ndayak)";"7FV4+8JF, RT.13/RW.01, Warugunung, Kec. Pancur, Kabupaten Rembang, Jawa Tengah 59262";"RT.13/RW.01, Warugunung, Kec. Pancur, Kabupaten Rembang";"JAWA TENGAH";"59262";"Indonesia";" 085726353597";"";"";"-6.7066896";"111.4565489";"https://maps.google.com/?cid=0x0:0x37ea7900bdeb9b0";""
"cafe";"Kafe";"Kun's Coffee Shop";"Jl. Pancur-Pamotan, Nyade, Sumberagung, Kec. Pancur, Kabupaten Rembang, Jawa Tengah 59262";"Nyade, Sumberagung, Kec. Pancur, Kabupaten Rembang";"JAWA TENGAH";"59262";"Indonesia";" 082226424550";"";"";"-6.7406197";"111.4773708";"https://maps.google.com/?cid=0x0:0x201c78813dd21b17";""
"cafe";"Kedai Kopi";"kedai setia";"RT.1/RW.1, Warugunung, Kec. Pancur, Kabupaten Rembang, Jawa Tengah 59262";"Warugunung, Kec. Pancur, Kabupaten Rembang";"JAWA TENGAH";"59262";"Indonesia";" 082242394399";"";"";"-6.7085913";"111.4543732";"https://maps.google.com/?cid=0x0:0xeef7b32ddd854f";""
"cafe";"Kafe";"D'NUNG";"7CFX+365, Lor, RT.008/RW.004, Dukuh, Tuyuhan, Kec. Pancur, Kabupaten Rembang, Jawa Tengah";"Kabupaten Rembang, Jawa Tengah";"JAWA TENGAH";"";"Indonesia";"";"";"";"-6.7273664";"111.448097";"https://maps.google.com/?cid=0x0:0x520b6f0e6a9b16f5";""
"cafe";"Kafe";"Warung Sumber Rejeki";"7F7Q+HMQ, Bageuran, Kalitengah, Kec. Pancur, Kabupaten Rembang, Jawa Tengah";"Kabupaten Rembang, Jawa Tengah";"JAWA TENGAH";"";"Indonesia";" 082137495784";"";"";"-6.7360395";"111.4892311";"https://maps.google.com/?cid=0x0:0xecd48388baae0814";""
"cafe";"Kafe";"WM.Omah Joglo";"7FM7+2X5, Dk.Tiyang, Tiang, Pancur, Rembang Regency, Central Java 59262";"Dk.Tiyang, Tiang, Pancur, Rembang Regency";"JAWA TENGAH";"59262";"Indonesia";" 081325457820";"";"";"-6.7174924";"111.4649724";"https://maps.google.com/?cid=0x0:0xf051244d3469ff52";""
"cafe";"Kafe";"Mak NANA Cafe";"7FR6+GCP, Unnamed Road, Srandu, Warugunung, Kec. Pancur, Kabupaten Rembang, Jawa Tengah 59262";"Unnamed Road, Srandu, Warugunung, Kec. Pancur, Kabupaten Rembang";"JAWA TENGAH";"59262";"Indonesia";" 082329726476";"";"";"-6.7086734";"111.4610896";"https://maps.google.com/?cid=0x0:0x346d61c3b3cbc1b0";""
"cafe";"Kedai Teh";"Teh desa Indonesia lasem";"7CVX+MFH, Jl. Raya Lasem, Demungan, Jolotundo, Kec. Pancur, Kabupaten Rembang, Jawa Tengah 59271";"Jl. Raya Lasem, Demungan, Jolotundo, Kec. Pancur, Kabupaten Rembang";"JAWA TENGAH";"59271";"Indonesia";" 082313527831";"";"";"-6.7058083";"111.4487381";"https://maps.google.com/?cid=0x0:0xd07c16ced709c1bf";""
"cafe";"Kedai Kopi";"Kedai Jajanan Mbak Asih";"Unnamed Road, Ropoh, Pancur, Kec. Pancur, Kabupaten Rembang, Jawa Tengah 59262";"Ropoh, Pancur, Kec. Pancur, Kabupaten Rembang";"JAWA TENGAH";"59262";"Indonesia";" 08991618407";"";"/url?q>>u003dhttps://youtu.be/gpFeBzvk9pY>>u0026opi>>u003d79508299>>u0026sa>>u003dU>>u0026ved>>u003d0ahUKEwi-qpWeko2MAxXWzTgGHZfIIMQQ61gIFigS>>u0026usg>>u003dAOvVaw2LGIjdwiP6Yeyw4gSjIiDu";"-6.7245036";"111.4582076";"https://maps.google.com/?cid=0x0:0x530d799c31349387";""
"cafe";"Kafe";"Teras ARMC";"7F7Q+CMV, Bageuran, Kalitengah, Kec. Pancur, Kabupaten Rembang, Jawa Tengah 59262";"Bageuran, Kalitengah, Kec. Pancur, Kabupaten Rembang";"JAWA TENGAH";"59262";"Indonesia";" 081327369085";"";"";"-6.7363884";"111.4891694";"https://maps.google.com/?cid=0x0:0x9c13b2cd0f264";""
"cafe";"Kedai Kopi";"Warung JMP";"7FJ7+G23, Tiang, Pancur, Kec. Pancur, Kabupaten Rembang, Jawa Tengah 59262";"Tiang, Pancur, Kec. Pancur, Kabupaten Rembang";"JAWA TENGAH";"59262";"Indonesia";"";"";"";"-6.7187325";"111.462543";"https://maps.google.com/?cid=0x0:0x179779110f2cc0e1";""
"cafe";"Kedai Kopi";"Warkop Mak Indah";"7C5R+R3P, Sawah  Kebun, Jeruk, Kec. Pancur, Kabupaten Rembang, Jawa Tengah 59262";"Sawah  Kebun, Jeruk, Kec. Pancur, Kabupaten Rembang";"JAWA TENGAH";"59262";"Indonesia";"";"";"";"-6.7404043";"111.4402076";"https://maps.google.com/?cid=0x0:0x47a5400753290e20";""
"cafe";"Kedai Kopi";"Agung coffe";"7C8W+P8M, Tuyuhan Kidul, Tuyuhan, Kec. Pancur, Kabupaten Rembang, Jawa Tengah 59262";"Tuyuhan Kidul, Tuyuhan, Kec. Pancur, Kabupaten Rembang";"JAWA TENGAH";"59262";"Indonesia";" 085218412410";"";"";"-6.733161";"111.4457966";"https://maps.google.com/?cid=0x0:0x346413348d91b32";""
"cafe";"Toko";"Arno Coffe";"7FR7+J2J, Srandu, Warugunung, Kec. Pancur, Kabupaten Rembang, Jawa Tengah 59262";"Srandu, Warugunung, Kec. Pancur, Kabupaten Rembang";"JAWA TENGAH";"59262";"Indonesia";"";"";"";"-6.7084124";"111.4625203";"https://maps.google.com/?cid=0x0:0xd422552c2ec2677c";""
"cafe";"Toko";"ATHAR RIZQI COFFE";"Sidowayah, Kec. Pancur, Kabupaten Rembang, Jawa Tengah 59262";"Kec. Pancur, Kabupaten Rembang";"JAWA TENGAH";"59262";"Indonesia";" 082317964666";"";"";"-6.7355006";"111.5028428";"https://maps.google.com/?cid=0x0:0xb326f4941060bd98";""
"cafe";"cafe";"Jawa Tengah 59262";"Kec. Pancur, Kabupaten Rembang, Jawa Tengah";"Kabupaten Rembang, Jawa Tengah";"JAWA TENGAH";"";"Indonesia";"";"";"";"-6.7202106";"111.4812472";"https://maps.google.com/?cid=0x0:0x1c00c5eb5b53df70";""
"cafe";"Kedai Kopi";"warkop 99";"karasjajar 1/2, Kebun  Sawah, Doropayung, Kec. Pancur, Kabupaten Rembang, Jawa Tengah 59262";"Kebun  Sawah, Doropayung, Kec. Pancur, Kabupaten Rembang";"JAWA TENGAH";"59262";"Indonesia";" 082137221964";"";"";"-6.7243222";"111.4337083";"https://maps.google.com/?cid=0x0:0x72a3d2483d13ce35";""
"cafe";"Kedai Kopi";"rumah ARETHA";"7FV6+286, Unnamed Road, Srandu, Warugunung, Kec. Pancur, Kabupaten Rembang, Jawa Tengah 59262";"Unnamed Road, Srandu, Warugunung, Kec. Pancur, Kabupaten Rembang";"JAWA TENGAH";"59262";"Indonesia";"";"";"";"-6.707474";"111.4607771";"https://maps.google.com/?cid=0x0:0x3fe533c1eb3490c3";""
"cafe";"Kedai Kopi";"Warkop Njagong";"7CGP+CH3, Doropayung, Kec. Pancur, Kabupaten Rembang, Jawa Tengah 59262";"Doropayung, Kec. Pancur, Kabupaten Rembang";"JAWA TENGAH";"59262";"Indonesia";"";"";"";"-6.723989";"111.4364276";"https://maps.google.com/?cid=0x0:0xeaf9f427150caaf6";""
"cafe";"Restoran";"Kawasan Kuliner Lontong Tuyuhan Pancur";"7CGX+F7R, Unnamed Road, Muragan, Tuyuhan, Sawah, Pancur, Rembang Regency, Central Java 59262";"Unnamed Road, Muragan, Tuyuhan, Sawah, Pancur, Rembang Regency";"JAWA TENGAH";"59262";"Indonesia";"";"";"";"-6.7237703";"111.4481509";"https://maps.google.com/?cid=0x0:0x4baf7c2fd6a41b61";""
"cafe";"Kedai Kopi";"Pendipipit Coffe";"7FR4+PV9, Unnamed Road, Warugunung, Kec. Pancur, Kabupaten Rembang, Jawa Tengah 59262";"Unnamed Road, Warugunung, Kec. Pancur, Kabupaten Rembang";"JAWA TENGAH";"59262";"Indonesia";"";"";"";"-6.7082024";"111.4572225";"https://maps.google.com/?cid=0x0:0x1bda939d805ea3fd";""
"cafe";"Kedai Kopi";"Angkringan GP ansor Pancur";"7C8X+R44, Tuyuhan Kidul, Tuyuhan, Kec. Pancur, Kabupaten Rembang, Jawa Tengah 59262";"Tuyuhan Kidul, Tuyuhan, Kec. Pancur, Kabupaten Rembang";"JAWA TENGAH";"59262";"Indonesia";" 081215771854";"";"";"-6.7330474";"111.4478683";"https://maps.google.com/?cid=0x0:0x93fb7ba8006fcf9a";""
"cafe";"Kedai Kopi";"Warung Degan+kopi Mbah Man";"7C4R+CPR, Jepeledok, Japeledok, Kec. Pancur, Kabupaten Rembang, Jawa Tengah 59262";"Jepeledok, Japeledok, Kec. Pancur, Kabupaten Rembang";"JAWA TENGAH";"59262";"Indonesia";"";"";"";"-6.7438764";"111.4417532";"https://maps.google.com/?cid=0x0:0xcf220c1941cf4f5f";""
"cafe";"Kafe";"Laskar kepundung";"7CMV+C3F, Muragan, Tuyuhan, Kec. Pancur, Kabupaten Rembang, Jawa Tengah 59262";"Muragan, Tuyuhan, Kec. Pancur, Kabupaten Rembang";"JAWA TENGAH";"59262";"Indonesia";"";"";"";"-6.7164421";"111.4426686";"https://maps.google.com/?cid=0x0:0x41583ca7efb20612";""
"cafe";"Toko Makanan";"ROYAL h37d Cafe  Resto";"MGH7+Q2, Dusun IV, Bodas Karangjati, Kec. Rembang, Kabupaten Purbalingga, Jawa Tengah 53356";"Dusun IV, Bodas Karangjati, Kec. Rembang, Kabupaten Purbalingga";"JAWA TENGAH";"53356";"Indonesia";" 082322122474";"";"";"-7.3209199";"109.5125606";"https://maps.google.com/?cid=0x0:0x64c9ba670d960843";""
"cafe";"Kafe";"cafe sapi";"MHW6+G32, Jalan Raya Losari, Area Hutan, Gunungwuled, Rembang, Purbalingga Regency, Central Java 53356";"Jalan Raya Losari, Area Hutan, Gunungwuled, Rembang, Purbalingga Regency";"JAWA TENGAH";"53356";"Indonesia";"";"";"";"-7.303749";"109.5601447";"https://maps.google.com/?cid=0x0:0xb01a13dd0a980d36";""
"cafe";"Kafe";"Djoembleng Coffee";"MGVC+7GR, RT.02/RW.01, Dusun I, Losari, Kec. Rembang, Kabupaten Purbalingga, Jawa Tengah 53356";"RT.02/RW.01, Dusun I, Losari, Kec. Rembang, Kabupaten Purbalingga";"JAWA TENGAH";"53356";"Indonesia";" 085225775803";"";"";"-7.3067582";"109.5212591";"https://maps.google.com/?cid=0x0:0xe4d570801ac89ee5";""
"cafe";"Kedai Kopi";"Kopi Manik Cafe";"Jl. Dusun II, Dusun II, Losari, Kec. Rembang, Kabupaten Purbalingga, Jawa Tengah 53356";"Dusun II, Losari, Kec. Rembang, Kabupaten Purbalingga";"JAWA TENGAH";"53356";"Indonesia";" 082218830941";"";"";"-7.3068002";"109.5274482";"https://maps.google.com/?cid=0x0:0xdd695af56698b4a";""
"cafe";"Kafe";"Cafe Supri";"PG32+463, Dusun III, Makam, Kec. Rembang, Kabupaten Purbalingga, Jawa Tengah 53356";"Dusun III, Makam, Kec. Rembang, Kabupaten Purbalingga";"JAWA TENGAH";"53356";"Indonesia";" 083840083823";"";"";"-7.2972398";"109.5005583";"https://maps.google.com/?cid=0x0:0x9b6611c2d0361c36";""
"cafe";"Kafe";"OMBE_Coffee";"MGW6+JM4, Jl. Bulupayung, Dusun II, Bodas Karangjati, Kec. Rembang, Kabupaten Purbalingga, Jawa Tengah 53356";"Jl. Bulupayung, Dusun II, Bodas Karangjati, Kec. Rembang, Kabupaten Purbalingga";"JAWA TENGAH";"53356";"Indonesia";" 085741453013";"";"";"-7.3034979";"109.5117003";"https://maps.google.com/?cid=0x0:0xf1c6b43f1d07815a";""
"cafe";"Kedai Kopi";"Mili Coffee Brewers";"Stana Cilik No.RT06/04, Dusun I, Makam, Kec. Rembang, Kabupaten Purbalingga, Jawa Tengah 53356";"Dusun I, Makam, Kec. Rembang, Kabupaten Purbalingga";"JAWA TENGAH";"53356";"Indonesia";" 087874378214";"";"";"-7.2920772";"109.497575";"https://maps.google.com/?cid=0x0:0x8f3b2224e3cffc8f";""
"cafe";"Kafe";"Mendha Cafe";"Dusun 4, Wanogara Wetan, Kec. Rembang, Kabupaten Purbalingga, Jawa Tengah 53356";"Wanogara Wetan, Kec. Rembang, Kabupaten Purbalingga";"JAWA TENGAH";"53356";"Indonesia";" 081229944223";"";"";"-7.3298514";"109.4937377";"https://maps.google.com/?cid=0x0:0x873b42fbbde9ca99";""
"cafe";"Restoran";"Zero Cafe";"Jl. Dr. Wahidin No.4, Rembangan, Tasikagung, Kec. Rembang, Kabupaten Rembang, Jawa Tengah 59215";"Rembangan, Tasikagung, Kec. Rembang, Kabupaten Rembang";"JAWA TENGAH";"59215";"Indonesia";" 081225339177";"";"";"-6.7052754";"111.336277";"https://maps.google.com/?cid=0x0:0x62f89d480e3558e4";""
"cafe";"Kafe anak-anak";"JURAGAN ICE CREAM";"MGVC+6PX, Jalan Raya, Dusun II, Losari, Rembang, Purbalingga Regency, Central Java 53356";"Jalan Raya, Dusun II, Losari, Rembang, Purbalingga Regency";"JAWA TENGAH";"53356";"Indonesia";" 085641220985";"";"";"-7.306894";"109.5218698";"https://maps.google.com/?cid=0x0:0x9ae83cf2357b4598";""
"cafe";"Kedai Kopi";"Tentang Kopi Cafe  Resto";"Gg. Undaan No.9, Sumberjo, Kec. Rembang, Kabupaten Rembang, Jawa Tengah 59215";"Sumberjo, Kec. Rembang, Kabupaten Rembang";"JAWA TENGAH";"59215";"Indonesia";" 082134485822";"";"";"-6.7074375";"111.3373271";"https://maps.google.com/?cid=0x0:0x6eab6cdfa38d9e";""
"cafe";"Kedai Kopi";"CHAWIS Coffee";"Jl. Asnawi, Sidowayah Lor, Leteh, Kec. Rembang, Kabupaten Rembang, Jawa Tengah 59217";"Sidowayah Lor, Leteh, Kec. Rembang, Kabupaten Rembang";"JAWA TENGAH";"59217";"Indonesia";" 0895324821188";"";"";"-6.7087099";"111.3460029";"https://maps.google.com/?cid=0x0:0x840a7bb83a089fc6";""
"cafe";"Kedai Kopi";"Cafe mas charis";"MGC9+72Q, Dusun II, Bantarbarang, Kec. Rembang, Kabupaten Purbalingga, Jawa Tengah 53356";"Dusun II, Bantarbarang, Kec. Rembang, Kabupaten Purbalingga";"JAWA TENGAH";"53356";"Indonesia";"";"";"";"-7.3294898";"109.5176079";"https://maps.google.com/?cid=0x0:0xa9893b61a3ed3c51";""
"cafe";"Kedai Kopi";"META COFFE";"MGCX+9CR, Limus Duwur, Karangbawang, Kec. Rembang, Kabupaten Purbalingga, Jawa Tengah 53356";"Limus Duwur, Karangbawang, Kec. Rembang, Kabupaten Purbalingga";"JAWA TENGAH";"53356";"Indonesia";"";"";"";"-7.3290114";"109.5485031";"https://maps.google.com/?cid=0x0:0xfd880b169ea74519";""
"cafe";"Indonesia";"Mie Hotplate Gachoor Rembang";"Dusun I, Sumampir, Kec. Rembang, Kabupaten Purbalingga, Jawa Tengah 53356";"Sumampir, Kec. Rembang, Kabupaten Purbalingga";"JAWA TENGAH";"53356";"Indonesia";" 085647939345";"";"";"-7.3021322";"109.5176954";"https://maps.google.com/?cid=0x0:0x96092956e8b487bb";""
"cafe";"Kedai Kopi";"Kopi.sitangkil";"RT.002/RW.001, Dusun 1, Wanogara Wetan, Kec. Rembang, Kabupaten Purbalingga, Jawa Tengah 53356";"Dusun 1, Wanogara Wetan, Kec. Rembang, Kabupaten Purbalingga";"JAWA TENGAH";"53356";"Indonesia";" 085877485006";"";"";"-7.3308043";"109.4994456";"https://maps.google.com/?cid=0x0:0x2ddc60e191c363f6";""
"cafe";"Toko bahan makanan";"Coffe RIMBA";"PH73+FJQ, Bawahan, Gunungwuled, Kec. Rembang, Kabupaten Purbalingga, Jawa Tengah 53356";"Bawahan, Gunungwuled, Kec. Rembang, Kabupaten Purbalingga";"JAWA TENGAH";"53356";"Indonesia";" 081391437677";"";"";"-7.286298";"109.55411";"https://maps.google.com/?cid=0x0:0x44907d0c46604178";""
"cafe";"Minimarket";"NITA Warung kopi  wifi";"PG2W+F2H, Jl. Raya Losari-Gunung Wuled, Dusun IV, Losari, Kec. Rembang, Kabupaten Purbalingga, Jawa Tengah 53356";"Jl. Raya Losari-Gunung Wuled, Dusun IV, Losari, Kec. Rembang, Kabupaten Purbalingga";"JAWA TENGAH";"53356";"Indonesia";" 082254902789";"";"";"-7.2988055";"109.5450989";"https://maps.google.com/?cid=0x0:0x2350cd064750320";""
"cafe";"Kafe";"d'Nata Kopi";"Dusun III, Panusupan, Kec. Rembang, Kabupaten Purbalingga, Jawa Tengah 53356";"Panusupan, Kec. Rembang, Kabupaten Purbalingga";"JAWA TENGAH";"53356";"Indonesia";" 085290003457";"";"";"-7.2736065";"109.5033144";"https://maps.google.com/?cid=0x0:0x33af7cce2725e7aa";""
"cafe";"cafe";"Jawa Tengah 53356";"Kec. Rembang, Kabupaten Purbalingga, Jawa Tengah";"Kabupaten Purbalingga, Jawa Tengah";"JAWA TENGAH";"";"Indonesia";"";"";"";"-7.2908223";"109.5330069";"https://maps.google.com/?cid=0x0:0x1c00c5eb5b53b5b0";""
"cafe";"Restoran";"Dunia Akhirat Coffee  Eatery";"Jl. Hos Cokroaminoto No.80 B, Sidowayah Lor, Sidowayah, Kec. Rembang, Kabupaten Rembang, Jawa Tengah 59218";"Sidowayah Lor, Sidowayah, Kec. Rembang, Kabupaten Rembang";"JAWA TENGAH";"59218";"Indonesia";" 087738838722";"";"";"-6.7075757";"111.3498349";"https://maps.google.com/?cid=0x0:0xea5d3bd069ee5f71";""
"cafe";"Kafe";"Ranu Coffee  Eatery";"Jl. Veteran No.2, Kutoharjo, Kec. Rembang, Kabupaten Rembang, Jawa Tengah";"Kabupaten Rembang, Jawa Tengah";"JAWA TENGAH";"";"Indonesia";" 081249778411";"";"";"-6.7050276";"111.3431664";"https://maps.google.com/?cid=0x0:0x9bf46387f17ad2d4";""
"cafe";"Kafe";"Biskope Cafe";"Jl. Jenderal Ahmad Yani No.7, Sawahan, Kec. Rembang, Kabupaten Rembang, Jawa Tengah 59215";"Sawahan, Kec. Rembang, Kabupaten Rembang";"JAWA TENGAH";"59215";"Indonesia";" 082282842111";"";"/url?q>>u003dhttp://www.orangrembang.com/cafe-resto/biskope-rembang-nongkrong-sambil.html>>u0026opi>>u003d79508299>>u0026sa>>u003dU>>u0026ved>>u003d0ahUKEwjCtaGyko2MAxXgUGwGHRXECIIQ61gIGigS>>u0026usg>>u003dAOvVaw3j7XGII1_eXcKTsPXQ1oaj";"-6.708701";"111.338632";"https://maps.google.com/?cid=0x0:0x6689a9678e839926";""
"cafe";"Kedai Kopi";"BARIX COFFEE - MANUAL BREW INSIDE";"Jl. Slamet Riyadi No.RT.5, RT.5/RW.7, Sumbermuktindah, Sumberjo, Kec. Rembang, Kabupaten Rembang, Jawa Tengah 59219";"RT.5/RW.7, Sumbermuktindah, Sumberjo, Kec. Rembang, Kabupaten Rembang";"JAWA TENGAH";"59219";"Indonesia";" 082323357708";"";"";"-6.7204801";"111.34303";"https://maps.google.com/?cid=0x0:0xbd35bb365663a60d";""
"cafe";"Kedai Kopi";"NoboN Coffe";"78VW+V26, Kutoharjo, Kec. Rembang, Kabupaten Rembang, Jawa Tengah 59211";"Kutoharjo, Kec. Rembang, Kabupaten Rembang";"JAWA TENGAH";"59211";"Indonesia";" 082226423026";"";"";"-6.7053383";"111.3450246";"https://maps.google.com/?cid=0x0:0xf1b4dcc833f3e9c3";""
"cafe";"Restoran";"Reunique cafe";"Jl. Dampo Awang No.3, Rembangan, Tasikagung, Kec. Rembang, Kabupaten Rembang, Jawa Tengah 59212";"Rembangan, Tasikagung, Kec. Rembang, Kabupaten Rembang";"JAWA TENGAH";"59212";"Indonesia";" 081935088889";"";"";"-6.7048828";"111.3367259";"https://maps.google.com/?cid=0x0:0x925d6cd55403b8c6";""
"cafe";"Kedai Kopi";"Cokro Cafe";"79V4+5JQ, Jl. Hos Cokroaminoto, Kabongan Kidul, Kec. Rembang, Kabupaten Rembang, Jawa Tengah 59218";"Jl. Hos Cokroaminoto, Kabongan Kidul, Kec. Rembang, Kabupaten Rembang";"JAWA TENGAH";"59218";"Indonesia";"";"";"";"-6.7070286";"111.3565939";"https://maps.google.com/?cid=0x0:0xd60313f4796fc947";""
"cafe";"Kafe";"Bee Coffee";"78VW+G2G, Kutoharjo, Kec. Rembang, Kabupaten Rembang, Jawa Tengah 59211";"Kutoharjo, Kec. Rembang, Kabupaten Rembang";"JAWA TENGAH";"59211";"Indonesia";"";"";"";"-6.7061952";"111.345083";"https://maps.google.com/?cid=0x0:0x77137d1940a70edf";""
"cafe";"Kedai Kopi";"Alex Coffee";"Jl. Notoprojo No.2, Kutoharjo, Kec. Rembang, Kabupaten Rembang, Jawa Tengah 59211";"Kutoharjo, Kec. Rembang, Kabupaten Rembang";"JAWA TENGAH";"59211";"Indonesia";"";"";"";"-6.7055275";"111.3513661";"https://maps.google.com/?cid=0x0:0x1ac12dc521dc5a10";""
