Category;Real Category;Business Name;Address;City;State;Postal Code;Country;Phone;Email;Website;Latitude;Longitude;Map Link;Details Link
"restaurant";"Hidangan Laut";"SHIJI";"Jl. Dr. Wahidin No.17, Sumberjo, Kec. Rembang, Kabupaten Rembang, Jawa Tengah 59215";"Sumberjo, Kec. Rembang, Kabupaten Rembang";"JAWA TENGAH";"59215";"Indonesia";" 082226879453";"";"";"-6.7057822";"111.336678";"https://maps.google.com/?cid=0x0:0x184329ab677500db";""
"restaurant";"Restoran";"RM Cabe";"Jl. Kragan - Rembang - Surabaya No.110, Sukoharjo, Kec. Rembang, Kabupaten Rembang, Jawa Tengah 59218";"Sukoharjo, Kec. Rembang, Kabupaten Rembang";"JAWA TENGAH";"59218";"Indonesia";" 085236717434";"";"";"-6.705363";"111.3553488";"https://maps.google.com/?cid=0x0:0x73948507daef9998";""
"restaurant";"Seblak";"Seblak Juara Prasmanan";"79V4+MMG, Jl. Hos Cokroaminoto, Kabongan Kidul, Kec. Rembang, Kabupaten Rembang, Jawa Tengah 59218";"Jl. Hos Cokroaminoto, Kabongan Kidul, Kec. Rembang, Kabupaten Rembang";"JAWA TENGAH";"59218";"Indonesia";" 087719729491";"";"";"-6.7058532";"111.3566987";"https://maps.google.com/?cid=0x0:0x32e319eba447196f";""
"restaurant";"Korea";"Homecha Rembang";"79V3+7J6, Sukoharjo, Kec. Rembang, Kabupaten Rembang, Jawa Tengah 59218";"Sukoharjo, Kec. Rembang, Kabupaten Rembang";"JAWA TENGAH";"59218";"Indonesia";" 087887175964";"";"";"-6.7064742";"111.3540647";"https://maps.google.com/?cid=0x0:0xbd0abb0993bcee6a";""
"restaurant";"Mi";"Mie Ndower Cabang 2";"Jl. Jend. Sudirman No.132b, Kabongan Lor, Kabongan Kidul, Kec. Rembang, Kabupaten Rembang, Jawa Tengah 59218";"Kabongan Lor, Kabongan Kidul, Kec. Rembang, Kabupaten Rembang";"JAWA TENGAH";"59218";"Indonesia";" 085779432412";"";"";"-6.7055342";"111.3573102";"https://maps.google.com/?cid=0x0:0xb0f9889b40f09e51";""
"restaurant";"Restoran";"MaK LeNJeH";"Jl. Hos Cokroaminoto No.39, Sidowayah Lor, Kutoharjo, Kec. Rembang, Kabupaten Rembang, Jawa Tengah 59218";"Sidowayah Lor, Kutoharjo, Kec. Rembang, Kabupaten Rembang";"JAWA TENGAH";"59218";"Indonesia";" 082326444282";"";"";"-6.7079576";"111.3511312";"https://maps.google.com/?cid=0x0:0xbb6ab88d41d1f9e2";""
"restaurant";"Indonesia";"Rumah Makan Hien";"Jl. Airlangga No.24, Sumberjo, Kec. Rembang, Kabupaten Rembang, Jawa Tengah 59215";"Sumberjo, Kec. Rembang, Kabupaten Rembang";"JAWA TENGAH";"59215";"Indonesia";" 0295691583";"";"";"-6.7065281";"111.3363263";"https://maps.google.com/?cid=0x0:0xa6822966a3aaadb9";""
"restaurant";"Restoran";"Warung Mbak Sih";"79F2+64F, Jl. Raya Blora - Rembang, Rambutmalang, Kabongan Kidul, Kec. Rembang, Kabupaten Rembang, Jawa Tengah 59218";"Jl. Raya Blora - Rembang, Rambutmalang, Kabongan Kidul, Kec. Rembang, Kabupaten Rembang";"JAWA TENGAH";"59218";"Indonesia";"";"";"";"-6.7269475";"111.3503107";"https://maps.google.com/?cid=0x0:0xf2063879b57bcfa4";""
"restaurant";"restaurant";"Jawa Tengah 59218";"Kec. Rembang, Kabupaten Rembang, Jawa Tengah";"Kabupaten Rembang, Jawa Tengah";"JAWA TENGAH";"";"Indonesia";"";"";"";"-6.7134795";"111.3530641";"https://maps.google.com/?cid=0x0:0x1c00c5eb5b53dee0";""
"restaurant";"Kafe";"SATU LAGI REMBANG";"Kabongan Lor, Kec. Rembang, Kabupaten Rembang, Jawa Tengah 59219";"Kec. Rembang, Kabupaten Rembang";"JAWA TENGAH";"59219";"Indonesia";" 0295532884";"";"";"-6.7057103";"111.3596622";"https://maps.google.com/?cid=0x0:0x53235806546aa9f0";""
"restaurant";"Steak";"Nyetik Nyetik and Blend Rembang";"Jl dr wahidin 27 (pojokan, Kedungsingkil, tembok, Kec. Rembang, Kabupaten Rembang, Jawa Tengah 59215";"Kedungsingkil, tembok, Kec. Rembang, Kabupaten Rembang";"JAWA TENGAH";"59215";"Indonesia";" 08179506328";"";"";"-6.7051616";"111.3348345";"https://maps.google.com/?cid=0x0:0x86621be3f8f3d61a";""
"restaurant";"Rumah Makan";"Dapur Lasem Cafe  Resto";"Pandeyan, Sumbergirang, Kec. Lasem, Kabupaten Rembang, Jawa Tengah 59271";"Sumbergirang, Kec. Lasem, Kabupaten Rembang";"JAWA TENGAH";"59271";"Indonesia";" 08988984888";"";"";"-6.7000579";"111.4476383";"https://maps.google.com/?cid=0x0:0x1038a4823c01e25a";""
"restaurant";"Dapur Umum";"EndoXxx resto";"Jl. Hos Cokroaminoto, Kabongan Kidul, Kec. Rembang, Kabupaten Rembang, Jawa Tengah 59218";"Kabongan Kidul, Kec. Rembang, Kabupaten Rembang";"JAWA TENGAH";"59218";"Indonesia";"";"";"";"-6.7080358";"111.3519954";"https://maps.google.com/?cid=0x0:0x6b9fdd3159bc2e21";""
"restaurant";"Prasmanan";"Kedai Kawula Muda Rembang";"Jl. Pahlawan, Kabongan Kidul, Kec. Rembang, Kabupaten Rembang, Jawa Tengah 59217";"Kabongan Kidul, Kec. Rembang, Kabupaten Rembang";"JAWA TENGAH";"59217";"Indonesia";"";"";"/url?q>>u003dhttp://www.instagram.com/seblakkawulamudarembang>>u0026opi>>u003d79508299>>u0026sa>>u003dU>>u0026ved>>u003d0ahUKEwjR7Pjijo2MAxWNzDgGHb4PFFoQ61gIFigO>>u0026usg>>u003dAOvVaw3S3zilMMubmZeqmEcEws3s";"-6.7095311";"111.3563764";"https://maps.google.com/?cid=0x0:0x9c0c5e52d14cf9eb";""
"restaurant";"Sup";"Teras Kota Resto";"78VP+JM6, Jl. Dr. Wahidin, Sumberjo, Kec. Rembang, Kabupaten Rembang, Jawa Tengah 59215";"Jl. Dr. Wahidin, Sumberjo, Kec. Rembang, Kabupaten Rembang";"JAWA TENGAH";"59215";"Indonesia";" 081229247690";"";"/url?q>>u003dhttps://instagram.com/terraskota_rembang%3Figshid%3DMDM4ZDc5MmU%3D>>u0026opi>>u003d79508299>>u0026sa>>u003dU>>u0026ved>>u003d0ahUKEwjtybTtjo2MAxW-4zgGHT7nKWAQ61gIGigR>>u0026usg>>u003dAOvVaw0B7HPeRBqBYdz-v2ufb2YK";"-6.7059718";"111.3366382";"https://maps.google.com/?cid=0x0:0xb07bbb2119989184";""
"restaurant";"Kafe";"SATU LAGI REMBANG";"Kabongan Lor, Kec. Rembang, Kabupaten Rembang, Jawa Tengah 59219";"Kec. Rembang, Kabupaten Rembang";"JAWA TENGAH";"59219";"Indonesia";" 0295532884";"";"";"-6.7057103";"111.3596622";"https://maps.google.com/?cid=0x0:0x53235806546aa9f0";""
"restaurant";"Ikan Bakar";"Rumah Makan Praukuno";"Jl. Jend. Sudirman No.158, Kabongan Lor, Kec. Rembang, Kabupaten Rembang, Jawa Tengah 59219";"Kabongan Lor, Kec. Rembang, Kabupaten Rembang";"JAWA TENGAH";"59219";"Indonesia";"";"";"/url?q>>u003dhttps://instagram.com/praukuno%3Figshid%3DMDM4ZDc5MmU%3D>>u0026opi>>u003d79508299>>u0026sa>>u003dU>>u0026ved>>u003d0ahUKEwie9PTtjo2MAxXJVmwGHdlkAYMQ61gIFygO>>u0026usg>>u003dAOvVaw12eXXHmDTSmMUQI9AINLjj";"-6.705413";"111.3600457";"https://maps.google.com/?cid=0x0:0x70a490ac54adbdf9";""
"restaurant";"Restoran";"Oregano Restaurant and Cafe";"Jl. Airlangga No.3, Sumberjo, Kec. Rembang, Kabupaten Rembang, Jawa Tengah 59214";"Sumberjo, Kec. Rembang, Kabupaten Rembang";"JAWA TENGAH";"59214";"Indonesia";" 082136551398";"";"";"-6.706832";"111.3382626";"https://maps.google.com/?cid=0x0:0xaf513bf624229673";""
"restaurant";"Restoran";"Citra Resto";"Jl. Jend. Sudirman No.47, Sukoharjo, Kec. Rembang, Kabupaten Rembang, Jawa Tengah 59218";"Sukoharjo, Kec. Rembang, Kabupaten Rembang";"JAWA TENGAH";"59218";"Indonesia";" 082210902868";"";"";"-6.7055298";"111.3535845";"https://maps.google.com/?cid=0x0:0xf65170c71e6812a1";""
"restaurant";"Rumah Makan";"Aqilah Resto  Cafe Milenial";"78GW+33M, Mondoteko, Kec. Rembang, Kabupaten Rembang, Jawa Tengah 59219";"Mondoteko, Kec. Rembang, Kabupaten Rembang";"JAWA TENGAH";"59219";"Indonesia";" 081380199713";"";"";"-6.7247825";"111.3451813";"https://maps.google.com/?cid=0x0:0xfea02d9c701020b";""
"restaurant";"Ikan Bakar";"Rumah Makan Pinggir Kali";"Jl. Jend. Sudirman, Kabongan Lor, Kec. Rembang, Kabupaten Rembang, Jawa Tengah 59219";"Kabongan Lor, Kec. Rembang, Kabupaten Rembang";"JAWA TENGAH";"59219";"Indonesia";" 0295691672";"";"/url?q>>u003dhttps://www.youtube.com/%40faisberangchanel7860>>u0026opi>>u003d79508299>>u0026sa>>u003dU>>u0026ved>>u003d0ahUKEwic3_bujo2MAxVdUGwGHfm9D6wQ61gIGigS>>u0026usg>>u003dAOvVaw3KX6abspLOag-mYwmOdxPs";"-6.7062098";"111.362742";"https://maps.google.com/?cid=0x0:0xf70ffa8c861992d6";""
"restaurant";"Indonesia";"DASAKE (Dapur Sambal Kerasa)";"79F2+25J, Purimondoteko, Mondoteko, Kec. Rembang, Kabupaten Rembang, Jawa Tengah 59219";"Purimondoteko, Mondoteko, Kec. Rembang, Kabupaten Rembang";"JAWA TENGAH";"59219";"Indonesia";" 085225353988";"";"";"-6.7274073";"111.3503904";"https://maps.google.com/?cid=0x0:0x10ba0e3be25bbfcc";""
"restaurant";"Mi";"Mie Gacoan Rembang";"Jl. Dr. Soetomo No.25, Tawangsari, Leteh, Kec. Rembang, Kabupaten Rembang, Jawa Tengah 59219";"Tawangsari, Leteh, Kec. Rembang, Kabupaten Rembang";"JAWA TENGAH";"59219";"Indonesia";"";"";"";"-6.7070972";"111.3436025";"https://maps.google.com/?cid=0x0:0x2d71f800f642301f";""
"restaurant";"Ikan Bakar";"Warung Pesisir";"Jl. Notoprojo 5/12, Sukoharjo, Kecamatan Rembang, Kutoharjo, Kec. Rembang, Kabupaten Rembang, Jawa Tengah 59219";"Sukoharjo, Kecamatan Rembang, Kutoharjo, Kec. Rembang, Kabupaten Rembang";"JAWA TENGAH";"59219";"Indonesia";"";"";"";"-6.7069469";"111.352223";"https://maps.google.com/?cid=0x0:0xd97cedefb175c938";""
"restaurant";"Rumah Makan";"Warung Makan Melati";"78MM+W8C, Jl. KS Tubun, Sugihan, Pulo, Kec. Rembang, Kabupaten Rembang, Jawa Tengah 59219";"Jl. KS Tubun, Sugihan, Pulo, Kec. Rembang, Kabupaten Rembang";"JAWA TENGAH";"59219";"Indonesia";"";"";"";"-6.7151815";"111.3332796";"https://maps.google.com/?cid=0x0:0x503c5ecb30854db7";""
"restaurant";"Indonesia";"Rumah Makan Hien";"Jl. Airlangga No.24, Sumberjo, Kec. Rembang, Kabupaten Rembang, Jawa Tengah 59215";"Sumberjo, Kec. Rembang, Kabupaten Rembang";"JAWA TENGAH";"59215";"Indonesia";" 0295691583";"";"";"-6.7065281";"111.3363263";"https://maps.google.com/?cid=0x0:0xa6822966a3aaadb9";""
"restaurant";"Bakso";"Bakso So'oen Zada Rembang";"78CV+FJ7, Jl. Slamet Riyadi, Mondoteko, Kec. Rembang, Kabupaten Rembang, Jawa Tengah 59219";"Jl. Slamet Riyadi, Mondoteko, Kec. Rembang, Kabupaten Rembang";"JAWA TENGAH";"59219";"Indonesia";"";"";"";"-6.728861";"111.3440014";"https://maps.google.com/?cid=0x0:0x5febd788b8d0592b";""
"restaurant";"Sup";"Warung Makan "gembet"";"78GV+38W, Ketanggi, Kec. Rembang, Kabupaten Rembang, Jawa Tengah 59219";"Ketanggi, Kec. Rembang, Kabupaten Rembang";"JAWA TENGAH";"59219";"Indonesia";" 081326602177";"";"";"-6.7247529";"111.3433406";"https://maps.google.com/?cid=0x0:0x6bfbbdee60821f40";""
"restaurant";"Restoran";"Cobek Bakar";"Jl. Slamet Riyadi No.57, Karangmencol, Sumberjo, Kec. Rembang, Kabupaten Rembang, Jawa Tengah 59219";"Karangmencol, Sumberjo, Kec. Rembang, Kabupaten Rembang";"JAWA TENGAH";"59219";"Indonesia";"";"";"";"-6.7167232";"111.3422531";"https://maps.google.com/?cid=0x0:0x390a4975bd21c4f1";""
"restaurant";"Restoran";"RM Bu Joyo";"Jl. Gajah Mada No.27, Retjo, Magersari, Kec. Rembang, Kabupaten Rembang, Jawa Tengah 59214";"Retjo, Magersari, Kec. Rembang, Kabupaten Rembang";"JAWA TENGAH";"59214";"Indonesia";" 0295691281";"";"";"-6.7009403";"111.3239748";"https://maps.google.com/?cid=0x0:0xe2d90331fdc41c5d";""
"restaurant";"Restoran";"Namua Coffee  Eatery";"Jl. Magnolia, Sawah, Kabongan Kidul, Kec. Rembang, Kabupaten Rembang, Jawa Tengah 59218";"Sawah, Kabongan Kidul, Kec. Rembang, Kabupaten Rembang";"JAWA TENGAH";"59218";"Indonesia";" 085150737377";"";"";"-6.7116498";"111.360272";"https://maps.google.com/?cid=0x0:0xc3bfe0781f9f8f44";""
"restaurant";"Steak";"Logissteak Rbg";"Jl. Pemuda No.15 A, Tawangsari, Leteh, Kec. Rembang, Kabupaten Rembang, Jawa Tengah 59217";"Tawangsari, Leteh, Kec. Rembang, Kabupaten Rembang";"JAWA TENGAH";"59217";"Indonesia";"";"";"";"-6.7122867";"111.342311";"https://maps.google.com/?cid=0x0:0x9c57057ad50f1882";""
"restaurant";"Sate";"Sate Serepeh Podo Moro Grajen";"78VM+8X2, Sumberjo, Kec. Rembang, Kabupaten Rembang, Jawa Tengah 59215";"Sumberjo, Kec. Rembang, Kabupaten Rembang";"JAWA TENGAH";"59215";"Indonesia";" 082136381435";"";"";"-6.7067454";"111.334902";"https://maps.google.com/?cid=0x0:0xd9bf386dbf97ca20";""
"restaurant";"restaurant";"Rembang";"Kec. Rembang, Kabupaten Rembang, Jawa Tengah";"Kabupaten Rembang, Jawa Tengah";"JAWA TENGAH";"";"Indonesia";"";"";"";"-6.7093739";"111.3413151";"https://maps.google.com/?cid=0x0:0xbc8117e0521e1119";""
"restaurant";"Tujuan Wisata";"Saung Matoh";"797H+X34, Jl. Raya Kumendung, Balong Kulon, Kumendung, Kec. Rembang, Kabupaten Rembang, Jawa Tengah 59219";"Jl. Raya Kumendung, Balong Kulon, Kumendung, Kec. Rembang, Kabupaten Rembang";"JAWA TENGAH";"59219";"Indonesia";" 081326345820";"";"/url?q>>u003dhttps://www.instagram.com/saungmatoh%3Figsh%3DMW85bHQ1eGxwY2twYQ%3D%3D>>u0026opi>>u003d79508299>>u0026sa>>u003dU>>u0026ved>>u003d0ahUKEwiKkLnyjo2MAxWf4jgGHYPUNXMQ61gIGSgR>>u0026usg>>u003dAOvVaw1JlihRI8ERKerCiF-ChGO5";"-6.7346842";"111.37704";"https://maps.google.com/?cid=0x0:0xc78baa4ddde8c95f";""
"restaurant";"Steak";"Nyetik Nyetik and Blend Rembang";"Jl dr wahidin 27 (pojokan, Kedungsingkil, tembok, Kec. Rembang, Kabupaten Rembang, Jawa Tengah 59215";"Kedungsingkil, tembok, Kec. Rembang, Kabupaten Rembang";"JAWA TENGAH";"59215";"Indonesia";" 08179506328";"";"";"-6.7051616";"111.3348345";"https://maps.google.com/?cid=0x0:0x86621be3f8f3d61a";""
"restaurant";"Jawa";"Warung Langganan";"No. 59219, Jl. Wr. Supratman No.11, Kutoharjo, Kec. Rembang, Kabupaten Rembang, Jawa Tengah 59211";"Jl. Wr. Supratman No.11, Kutoharjo, Kec. Rembang, Kabupaten Rembang";"JAWA TENGAH";"59211";"Indonesia";" 08122809800";"";"";"-6.7061139";"111.3450889";"https://maps.google.com/?cid=0x0:0x197f5bd6aeddd10b";""
"restaurant";"Steak";"COMO Rembang "Coffee and virtual Resto"";"78VX+R65, Kutoharjo, Kec. Rembang, Kabupaten Rembang, Jawa Tengah 59219";"Kutoharjo, Kec. Rembang, Kabupaten Rembang";"JAWA TENGAH";"59219";"Indonesia";"";"";"";"-6.7054796";"111.3480982";"https://maps.google.com/?cid=0x0:0xce03924747e8185b";""
"restaurant";"Sup";"Waroeng Cabe Rembang";"79V3+RWM, Sukoharjo, Kec. Rembang, Kabupaten Rembang, Jawa Tengah 59219";"Sukoharjo, Kec. Rembang, Kabupaten Rembang";"JAWA TENGAH";"59219";"Indonesia";" 082148304304";"";"";"-6.7054053";"111.354801";"https://maps.google.com/?cid=0x0:0xfc2d17f4427663da";""
"restaurant";"Jawa";"Warung Makan Nambahi Rasa";"Jl. Diponegoro No.113, Kutoharjo, Kec. Rembang, Kabupaten Rembang, Jawa Tengah 59219";"Kutoharjo, Kec. Rembang, Kabupaten Rembang";"JAWA TENGAH";"59219";"Indonesia";"";"";"";"-6.7050243";"111.3476019";"https://maps.google.com/?cid=0x0:0xf9ed590e54e5b557";""
"restaurant";"Rumah Makan";"Dapur Lasem Cafe  Resto";"Pandeyan, Sumbergirang, Kec. Lasem, Kabupaten Rembang, Jawa Tengah 59271";"Sumbergirang, Kec. Lasem, Kabupaten Rembang";"JAWA TENGAH";"59271";"Indonesia";" 08988984888";"";"";"-6.7000579";"111.4476383";"https://maps.google.com/?cid=0x0:0x1038a4823c01e25a";""
"restaurant";"Dapur Umum";"Penyetan moro seneng sumberjo";"78QQ+4R6, Sumberjo, Kec. Rembang, Kabupaten Rembang, Jawa Tengah 59219";"Sumberjo, Kec. Rembang, Kabupaten Rembang";"JAWA TENGAH";"59219";"Indonesia";"";"";"";"-6.7122088";"111.3395225";"https://maps.google.com/?cid=0x0:0x5488a6cadb29bc8f";""
"restaurant";"restaurant";"Jawa Tengah 59219";"Kec. Rembang, Kabupaten Rembang, Jawa Tengah";"Kabupaten Rembang, Jawa Tengah";"JAWA TENGAH";"";"Indonesia";"";"";"";"-6.735169";"111.3739309";"https://maps.google.com/?cid=0x0:0x1c00c5eb5b53def0";""
"restaurant";"Restoran";"Oregano Restaurant and Cafe";"Jl. Airlangga No.3, Sumberjo, Kec. Rembang, Kabupaten Rembang, Jawa Tengah 59214";"Sumberjo, Kec. Rembang, Kabupaten Rembang";"JAWA TENGAH";"59214";"Indonesia";" 082136551398";"";"";"-6.706832";"111.3382626";"https://maps.google.com/?cid=0x0:0xaf513bf624229673";""
"restaurant";"Steak";"Nyetik Nyetik and Blend Rembang";"Jl dr wahidin 27 (pojokan, Kedungsingkil, tembok, Kec. Rembang, Kabupaten Rembang, Jawa Tengah 59215";"Kedungsingkil, tembok, Kec. Rembang, Kabupaten Rembang";"JAWA TENGAH";"59215";"Indonesia";" 08179506328";"";"";"-6.7051616";"111.3348345";"https://maps.google.com/?cid=0x0:0x86621be3f8f3d61a";""
"restaurant";"Indonesia";"Locall Kitchen's";"Jl. Dampo Awang No.3, Rembangan, Tasikagung, Kec. Rembang, Kabupaten Rembang, Jawa Tengah 59212";"Rembangan, Tasikagung, Kec. Rembang, Kabupaten Rembang";"JAWA TENGAH";"59212";"Indonesia";" 0818399906";"";"";"-6.7048828";"111.3367259";"https://maps.google.com/?cid=0x0:0x36feb3163992bb73";""
"restaurant";"Kafe";"SATU LAGI REMBANG";"Kabongan Lor, Kec. Rembang, Kabupaten Rembang, Jawa Tengah 59219";"Kec. Rembang, Kabupaten Rembang";"JAWA TENGAH";"59219";"Indonesia";" 0295532884";"";"";"-6.7057103";"111.3596622";"https://maps.google.com/?cid=0x0:0x53235806546aa9f0";""
"restaurant";"Sup";"Teras Kota Resto";"78VP+JM6, Jl. Dr. Wahidin, Sumberjo, Kec. Rembang, Kabupaten Rembang, Jawa Tengah 59215";"Jl. Dr. Wahidin, Sumberjo, Kec. Rembang, Kabupaten Rembang";"JAWA TENGAH";"59215";"Indonesia";" 081229247690";"";"/url?q>>u003dhttps://instagram.com/terraskota_rembang%3Figshid%3DMDM4ZDc5MmU%3D>>u0026opi>>u003d79508299>>u0026sa>>u003dU>>u0026ved>>u003d0ahUKEwiJkvKEj42MAxWMRmcHHZA6Kd4Q61gIGigR>>u0026usg>>u003dAOvVaw33aU3fGwULuXRuoFIDml7X";"-6.7059718";"111.3366382";"https://maps.google.com/?cid=0x0:0xb07bbb2119989184";""
"restaurant";"Kafe";"Ranu Coffee  Eatery";"Jl. Veteran No.2, Kutoharjo, Kec. Rembang, Kabupaten Rembang, Jawa Tengah";"Kabupaten Rembang, Jawa Tengah";"JAWA TENGAH";"";"Indonesia";" 081249778411";"";"";"-6.7050276";"111.3431664";"https://maps.google.com/?cid=0x0:0x9bf46387f17ad2d4";""
"restaurant";"Ikan Bakar";"Warung Pesisir";"Jl. Notoprojo 5/12, Sukoharjo, Kecamatan Rembang, Kutoharjo, Kec. Rembang, Kabupaten Rembang, Jawa Tengah 59219";"Sukoharjo, Kecamatan Rembang, Kutoharjo, Kec. Rembang, Kabupaten Rembang";"JAWA TENGAH";"59219";"Indonesia";"";"";"";"-6.7069469";"111.352223";"https://maps.google.com/?cid=0x0:0xd97cedefb175c938";""
"restaurant";"Kedai Kopi";"Tentang Kopi Cafe  Resto";"Gg. Undaan No.9, Sumberjo, Kec. Rembang, Kabupaten Rembang, Jawa Tengah 59215";"Sumberjo, Kec. Rembang, Kabupaten Rembang";"JAWA TENGAH";"59215";"Indonesia";" 082134485822";"";"";"-6.7074375";"111.3373271";"https://maps.google.com/?cid=0x0:0x6eab6cdfa38d9e";""
"restaurant";"Restoran";"Citra Resto";"Jl. Jend. Sudirman No.47, Sukoharjo, Kec. Rembang, Kabupaten Rembang, Jawa Tengah 59218";"Sukoharjo, Kec. Rembang, Kabupaten Rembang";"JAWA TENGAH";"59218";"Indonesia";" 082210902868";"";"";"-6.7055298";"111.3535845";"https://maps.google.com/?cid=0x0:0xf65170c71e6812a1";""
"restaurant";"Indonesia";"Rumah Makan Hien";"Jl. Airlangga No.24, Sumberjo, Kec. Rembang, Kabupaten Rembang, Jawa Tengah 59215";"Sumberjo, Kec. Rembang, Kabupaten Rembang";"JAWA TENGAH";"59215";"Indonesia";" 0295691583";"";"";"-6.7065281";"111.3363263";"https://maps.google.com/?cid=0x0:0xa6822966a3aaadb9";""
"restaurant";"Restoran";"Reunique cafe";"Jl. Dampo Awang No.3, Rembangan, Tasikagung, Kec. Rembang, Kabupaten Rembang, Jawa Tengah 59212";"Rembangan, Tasikagung, Kec. Rembang, Kabupaten Rembang";"JAWA TENGAH";"59212";"Indonesia";" 081935088889";"";"";"-6.7048828";"111.3367259";"https://maps.google.com/?cid=0x0:0x925d6cd55403b8c6";""
"restaurant";"Rumah Makan";"Aqilah Resto  Cafe Milenial";"78GW+33M, Mondoteko, Kec. Rembang, Kabupaten Rembang, Jawa Tengah 59219";"Mondoteko, Kec. Rembang, Kabupaten Rembang";"JAWA TENGAH";"59219";"Indonesia";" 081380199713";"";"";"-6.7247825";"111.3451813";"https://maps.google.com/?cid=0x0:0xfea02d9c701020b";""
"restaurant";"Steak";"Logissteak Rbg";"Jl. Pemuda No.15 A, Tawangsari, Leteh, Kec. Rembang, Kabupaten Rembang, Jawa Tengah 59217";"Tawangsari, Leteh, Kec. Rembang, Kabupaten Rembang";"JAWA TENGAH";"59217";"Indonesia";"";"";"";"-6.7122867";"111.342311";"https://maps.google.com/?cid=0x0:0x9c57057ad50f1882";""
"restaurant";"Es Krim";"Orso Gelato  Cafe Rembang";"Jl. Pemuda No.61, Kedungdoro, Leteh, Kec. Rembang, Kabupaten Rembang, Jawa Tengah 59217";"Kedungdoro, Leteh, Kec. Rembang, Kabupaten Rembang";"JAWA TENGAH";"59217";"Indonesia";" 085877074381";"";"/url?q>>u003dhttp://instagram.com/theorso.rembang>>u0026opi>>u003d79508299>>u0026sa>>u003dU>>u0026ved>>u003d0ahUKEwizspqHj42MAxVCQ2cHHfO8BrgQ61gIGygS>>u0026usg>>u003dAOvVaw3vM_Wiue_mK6UUr4Hq-bU-";"-6.7152883";"111.3438675";"https://maps.google.com/?cid=0x0:0xbe83cd7bea723fad";""
"restaurant";"Sate";"Sate Serepeh Podo Moro Grajen";"78VM+8X2, Sumberjo, Kec. Rembang, Kabupaten Rembang, Jawa Tengah 59215";"Sumberjo, Kec. Rembang, Kabupaten Rembang";"JAWA TENGAH";"59215";"Indonesia";" 082136381435";"";"";"-6.7067454";"111.334902";"https://maps.google.com/?cid=0x0:0xd9bf386dbf97ca20";""
"restaurant";"Toko Roti";"Golden Donut  Cafe";"Jl. Dr. Wahidin No.9, Sawahan, Kec. Rembang, Kabupaten Rembang, Jawa Tengah 59215";"Sawahan, Kec. Rembang, Kabupaten Rembang";"JAWA TENGAH";"59215";"Indonesia";" 081234480333";"";"";"-6.7065831";"111.3397529";"https://maps.google.com/?cid=0x0:0x77c208ff5e63debf";""
"restaurant";"Restoran";"RM Bu Joyo";"Jl. Gajah Mada No.27, Retjo, Magersari, Kec. Rembang, Kabupaten Rembang, Jawa Tengah 59214";"Retjo, Magersari, Kec. Rembang, Kabupaten Rembang";"JAWA TENGAH";"59214";"Indonesia";" 0295691281";"";"";"-6.7009403";"111.3239748";"https://maps.google.com/?cid=0x0:0xe2d90331fdc41c5d";""
"restaurant";"Kafe";"Sky Monster Cafe (SM)";"ROOFTOP, Jl. Ra. Kartini No.73 2ND FLOOR, Sawahan, Kec. Rembang, Kabupaten Rembang, Jawa Tengah 59217";"Jl. Ra. Kartini No.73 2ND FLOOR, Sawahan, Kec. Rembang, Kabupaten Rembang";"JAWA TENGAH";"59217";"Indonesia";" 0895397090000";"";"/url?q>>u003dhttps://linktr.ee/skymonster>>u0026opi>>u003d79508299>>u0026sa>>u003dU>>u0026ved>>u003d0ahUKEwiqmpyIj42MAxWEfGwGHfvqBd4Q61gIGigS>>u0026usg>>u003dAOvVaw21dEm6WGpEo0LVmSv4C2rX";"-6.7096118";"111.341082";"https://maps.google.com/?cid=0x0:0xb7986235042c38f4";""
"restaurant";"Mi";"Mie Gacoan Rembang";"Jl. Dr. Soetomo No.25, Tawangsari, Leteh, Kec. Rembang, Kabupaten Rembang, Jawa Tengah 59219";"Tawangsari, Leteh, Kec. Rembang, Kabupaten Rembang";"JAWA TENGAH";"59219";"Indonesia";"";"";"";"-6.7070972";"111.3436025";"https://maps.google.com/?cid=0x0:0x2d71f800f642301f";""
"restaurant";"restaurant";"Rembang";"Kec. Rembang, Kabupaten Rembang, Jawa Tengah";"Kabupaten Rembang, Jawa Tengah";"JAWA TENGAH";"";"Indonesia";"";"";"";"-6.7093739";"111.3413151";"https://maps.google.com/?cid=0x0:0xbc8117e0521e1119";""
"restaurant";"Restoran";"Kampung Steak and Blend Rembang";"78VM+XX3, Jl. KS Tubun, Kedungsingkil, Sumberjo, Kec. Rembang, Kabupaten Rembang, Jawa Tengah 59215";"Jl. KS Tubun, Kedungsingkil, Sumberjo, Kec. Rembang, Kabupaten Rembang";"JAWA TENGAH";"59215";"Indonesia";" 02956980780";"";"";"-6.7051001";"111.3349255";"https://maps.google.com/?cid=0x0:0xca2fb27b3d1a2093";""
"restaurant";"Rumah Makan";"Dapur Lasem Cafe  Resto";"Pandeyan, Sumbergirang, Kec. Lasem, Kabupaten Rembang, Jawa Tengah 59271";"Sumbergirang, Kec. Lasem, Kabupaten Rembang";"JAWA TENGAH";"59271";"Indonesia";" 08988984888";"";"";"-6.7000579";"111.4476383";"https://maps.google.com/?cid=0x0:0x1038a4823c01e25a";""
"restaurant";"Ikan Bakar";"Rumah Makan Pinggir Kali";"Jl. Jend. Sudirman, Kabongan Lor, Kec. Rembang, Kabupaten Rembang, Jawa Tengah 59219";"Kabongan Lor, Kec. Rembang, Kabupaten Rembang";"JAWA TENGAH";"59219";"Indonesia";" 0295691672";"";"/url?q>>u003dhttps://www.youtube.com/%40faisberangchanel7860>>u0026opi>>u003d79508299>>u0026sa>>u003dU>>u0026ved>>u003d0ahUKEwiiwL6Jj42MAxWnUGwGHd96EYcQ61gIGigS>>u0026usg>>u003dAOvVaw1i7awdsdX5yUBa-xxLnQTp";"-6.7062098";"111.362742";"https://maps.google.com/?cid=0x0:0xf70ffa8c861992d6";""
"restaurant";"Restoran";"Cafe  Resto";"59PG+PW9, Jl. Sulang-Sumber, Sulang, Kec. Sulang, Kabupaten Rembang, Jawa Tengah 59254";"Jl. Sulang-Sumber, Sulang, Kec. Sulang, Kabupaten Rembang";"JAWA TENGAH";"59254";"Indonesia";" 08232796558";"";"";"-6.8132228";"111.377363";"https://maps.google.com/?cid=0x0:0x89a68f019b2a1314";""
"restaurant";"Ikan Bakar";"Rumah Makan  Lesehan Segoro";"79VF+5MV, Jl. Raya Lasem-Rembang, Tireman Timur, Tireman, Kec. Rembang, Kabupaten Rembang, Jawa Tengah 59219";"Jl. Raya Lasem-Rembang, Tireman Timur, Tireman, Kec. Rembang, Kabupaten Rembang";"JAWA TENGAH";"59219";"Indonesia";" 081227389445";"";"";"-6.707021";"111.374174";"https://maps.google.com/?cid=0x0:0x9afce6ee5667a929";""
"restaurant";"Ikan Bakar";"Ikan Bakar Pantura Rembang";"Dekat, Ngotet Kidul, Ngotet, Kec. Rembang, Kabupaten Rembang, Jawa Tengah";"Kabupaten Rembang, Jawa Tengah";"JAWA TENGAH";"";"Indonesia";" 085143431909";"";"";"-6.7345697";"111.3549817";"https://maps.google.com/?cid=0x0:0x7eef42df65f91968";""
"restaurant";"Restoran";"Eskafe Rembang";"78VP+W59, Jl. Dr. Wahidin, Sumberjo, Tasikagung, Kec. Rembang, Kabupaten Rembang, Jawa Tengah 59215";"Jl. Dr. Wahidin, Sumberjo, Tasikagung, Kec. Rembang, Kabupaten Rembang";"JAWA TENGAH";"59215";"Indonesia";" 085222810304";"";"/url?q>>u003dhttps://www.facebook.com/eskafe.rembang>>u0026opi>>u003d79508299>>u0026sa>>u003dU>>u0026ved>>u003d0ahUKEwin9LuKj42MAxUeT2wGHcM3MOUQ61gIFigR>>u0026usg>>u003dAOvVaw0Q331quGM7wF2NKK06wWhu";"-6.7052016";"111.3354805";"https://maps.google.com/?cid=0x0:0xb7aab31009958099";""
"restaurant";"Rumah Makan";"RM Sumber Rejeki";"9R63+9RQ, Rembang 1, Rembang, Kec. Rembang, Pasuruan, Jawa Timur 67152";"Rembang 1, Rembang, Kec. Rembang, Pasuruan";"JAWA TENGAH";"67152";"Indonesia";" 082139379816";"";"";"-7.639047";"112.8046108";"https://maps.google.com/?cid=0x0:0xe5f30b72963d0e28";""
"restaurant";"Jawa";"Lesehan Raja Rasa";"9R72+42V, Unnamed Road, Rembang 1, Rembang, Kec. Rembang, Pasuruan, Jawa Timur 67152";"Unnamed Road, Rembang 1, Rembang, Kec. Rembang, Pasuruan";"JAWA TENGAH";"67152";"Indonesia";" 085804070035";"";"";"-7.6371401";"112.8000368";"https://maps.google.com/?cid=0x0:0xf53ce25ab34e3064";""
"restaurant";"Mi";"Mulono Djati Resto dan Cafe";"4HGP+9J7, Salaman, Mrayun, Kec. Sale, Kabupaten Rembang, Jawa Tengah 59265";"Salaman, Mrayun, Kec. Sale, Kabupaten Rembang";"JAWA TENGAH";"59265";"Indonesia";"";"";"";"-6.8740792";"111.5865389";"https://maps.google.com/?cid=0x0:0x39ed7f92adb9089e";""
"restaurant";"Jawa";"Warung SERBU";"4JQ6+355, Jl. Raya Jatirogo-Lasem, Krinjo, Sale, Kec. Sale, Kabupaten Rembang, Jawa Tengah 59265";"Jl. Raya Jatirogo-Lasem, Krinjo, Sale, Kec. Sale, Kabupaten Rembang";"JAWA TENGAH";"59265";"Indonesia";" 088227898929";"";"";"-6.8623649";"111.6104967";"https://maps.google.com/?cid=0x0:0xfd5c27d6a3ed7a78";""
