Category;Real Category;Business Name;Address;City;State;Postal Code;Country;Phone;Email;Website;Latitude;Longitude;Map Link;Details Link
"restaurant";"Mi";"Special Bakmi Jawa dan Ayam Goreng Kampung";"3M3J+CHH, Jl. Karangmojo Semin, Karang Mojo II, Karangmojo, Kec. Karangmojo, Kabupaten Gunung Kidul, Daerah Istimewa Yogyakarta 55891";"Jl. Karangmojo Semin, Karang Mojo II, Karangmojo, Kec. Karangmojo, Kabupaten Gunung Kidul";"DAERAH ISTIMEWA YOGYAKARTA";"55891";"Indonesia";"";"";"";"-7.9464489";"110.6814845";"https://maps.google.com/?cid=0x0:0xf5698d4f4154edc2";""
"restaurant";"Bakso";"Warung Makan Sari Roso";"Jl. MT Pontjodirjo No.16, Grogol I, Bejiharjo, Kec. Karangmojo, Kabupaten Gunung Kidul, Daerah Istimewa Yogyakarta 55891";"Grogol I, Bejiharjo, Kec. Karangmojo, Kabupaten Gunung Kidul";"DAERAH ISTIMEWA YOGYAKARTA";"55891";"Indonesia";" 087839121642";"";"";"-7.9462385";"110.6194734";"https://maps.google.com/?cid=0x0:0x74711e0b985d8fc6";""
"restaurant";"Restoran";"Kalahari resto  cafe";"Tegalmulyo 03/05, Bansari, Kepek, Kec. Wonosari, Kabupaten Gunung Kidul, Daerah Istimewa Yogyakarta 55813";"Bansari, Kepek, Kec. Wonosari, Kabupaten Gunung Kidul";"DAERAH ISTIMEWA YOGYAKARTA";"55813";"Indonesia";" 081325257474";"";"";"-7.9678525";"110.5933802";"https://maps.google.com/?cid=0x0:0xb6a86ee3ddd22a4";""
"restaurant";"Indonesia";"Pondok Makan Sekar Kusuma";"Jl. Sri Tj., Purwosari, Baleharjo, Kec. Wonosari, Kabupaten Gunung Kidul, Daerah Istimewa Yogyakarta 55881";"Purwosari, Baleharjo, Kec. Wonosari, Kabupaten Gunung Kidul";"DAERAH ISTIMEWA YOGYAKARTA";"55881";"Indonesia";" 0274394555";"";"";"-7.9726793";"110.603592";"https://maps.google.com/?cid=0x0:0x4352d287bd1d989c";""
"restaurant";"Restoran";"Griya Hinggil (GH) RESTO";"Jl. Kyai Legi No.Rt 07/04, Bansari, Kepek, Kec. Wonosari, Kabupaten Gunung Kidul, Daerah Istimewa Yogyakarta 55813";"Bansari, Kepek, Kec. Wonosari, Kabupaten Gunung Kidul";"DAERAH ISTIMEWA YOGYAKARTA";"55813";"Indonesia";" 085943073937";"";"/url?q>>u003dhttps://instagram.com/griyahinggil.gk%3Futm_medium%3Dcopy_link>>u0026opi>>u003d79508299>>u0026sa>>u003dU>>u0026ved>>u003d0ahUKEwi7xJzHx4CMAxUqTGwGHYphAm0Q61gIGigS>>u0026usg>>u003dAOvVaw0Z0gmx7FNeCL0CY4emt4SC";"-7.9649239";"110.5889727";"https://maps.google.com/?cid=0x0:0xff3f744df96de35b";""
"restaurant";"Jawa";"Rumah Makan Bu Wiwik";"Jl. Baron No.Km. 6, Mulo, Kec. Wonosari, Kabupaten Gunung Kidul, Daerah Istimewa Yogyakarta 55851";"Mulo, Kec. Wonosari, Kabupaten Gunung Kidul";"DAERAH ISTIMEWA YOGYAKARTA";"55851";"Indonesia";" 081227843271";"";"";"-8.0139712";"110.5873576";"https://maps.google.com/?cid=0x0:0xef9fed95859a2181";""
"restaurant";"Restoran";"Limasan Kembar Pak Kumis Kidul Tlogo";"Jl. Sri Kaloka, Purwosari, Baleharjo, Kec. Wonosari, Kabupaten Gunung Kidul, Daerah Istimewa Yogyakarta 55811";"Purwosari, Baleharjo, Kec. Wonosari, Kabupaten Gunung Kidul";"DAERAH ISTIMEWA YOGYAKARTA";"55811";"Indonesia";" 087839950303";"";"/url?q>>u003dhttp://www.instagram.com/pakkumis_gk>>u0026opi>>u003d79508299>>u0026sa>>u003dU>>u0026ved>>u003d0ahUKEwjnnoHIx4CMAxU7yzgGHXm6KTgQ61gIGSgS>>u0026usg>>u003dAOvVaw22odEFmbD3Qx37qhpsDC3Q";"-7.9767612";"110.6070008";"https://maps.google.com/?cid=0x0:0xf07a39fb38844719";""
"restaurant";"Rumah Makan";"Waroeng Spesial Sambal "SS" Wonosari";"Jl. Baron No.KM 1, Seneng, Siraman, Kec. Wonosari, Kabupaten Gunung Kidul, Daerah Istimewa Yogyakarta 55851";"Seneng, Siraman, Kec. Wonosari, Kabupaten Gunung Kidul";"DAERAH ISTIMEWA YOGYAKARTA";"55851";"Indonesia";" 08562575039";"";"";"-7.9737352";"110.6019041";"https://maps.google.com/?cid=0x0:0x2ef74342b96b8f6c";""
"restaurant";"Ikan Bakar";"Lesehan Katamso";"2JM2+4V5, Jl. Brigjen Katamso, Purbosari, Wonosari, Kec. Wonosari, Kabupaten Gunung Kidul, Daerah Istimewa Yogyakarta 55851";"Jl. Brigjen Katamso, Purbosari, Wonosari, Kec. Wonosari, Kabupaten Gunung Kidul";"DAERAH ISTIMEWA YOGYAKARTA";"55851";"Indonesia";" 081328716111";"";"";"-7.967249";"110.6022258";"https://maps.google.com/?cid=0x0:0x9ea965e4d999142";""
"restaurant";"Traditional restaurant";"Taman Kuliner Wonosari";"Jl. Masjid, Purbosari, Wonosari, Kec. Wonosari, Kabupaten Gunung Kidul, Daerah Istimewa Yogyakarta 55851";"Purbosari, Wonosari, Kec. Wonosari, Kabupaten Gunung Kidul";"DAERAH ISTIMEWA YOGYAKARTA";"55851";"Indonesia";"";"";"";"-7.9627292";"110.6012434";"https://maps.google.com/?cid=0x0:0x466ae7b75e5951cf";""
"restaurant";"Restoran";"Warung Lesehan Pak Kirun";"Komplek Kodim/Timur RSUD Wonosari, Jalan Kasatrian No.3, Wonosari, Purbosari, Wonosari, Kec. Wonosari, Kabupaten Gunung Kidul, Daerah Istimewa Yogyakarta 55851";"Jalan Kasatrian No.3, Wonosari, Purbosari, Wonosari, Kec. Wonosari, Kabupaten Gunung Kidul";"DAERAH ISTIMEWA YOGYAKARTA";"55851";"Indonesia";" 087839870070";"";"/url?q>>u003dhttp://gitewan.com/>>u0026opi>>u003d79508299>>u0026sa>>u003dU>>u0026ved>>u003d0ahUKEwjJzoPJx4CMAxXncGwGHV1cChEQ61gIGygS>>u0026usg>>u003dAOvVaw3TvIzeiiwdDdz5zWxab3fq";"-7.9631051";"110.6051749";"https://maps.google.com/?cid=0x0:0x90937d8a041c7ba8";""
"restaurant";"Restoran";"Opor Kulwer";"Gg. Sindoro, Jeruksari, Wonosari, Kec. Wonosari, Kabupaten Gunung Kidul, Daerah Istimewa Yogyakarta 55851";"Jeruksari, Wonosari, Kec. Wonosari, Kabupaten Gunung Kidul";"DAERAH ISTIMEWA YOGYAKARTA";"55851";"Indonesia";" 087839528099";"";"";"-7.9605501";"110.6035605";"https://maps.google.com/?cid=0x0:0xad03e441f5ee47bb";""
"restaurant";"Indonesia";"Sere Ratu Resto";"Jl. Jogja - Wonosari No.Km.04, Plumbon Kidul, Logandeng, Kec. Playen, Kabupaten Gunung Kidul, Daerah Istimewa Yogyakarta 55861";"Plumbon Kidul, Logandeng, Kec. Playen, Kabupaten Gunung Kidul";"DAERAH ISTIMEWA YOGYAKARTA";"55861";"Indonesia";" 08117779838";"";"";"-7.9361238";"110.5730192";"https://maps.google.com/?cid=0x0:0xd6e9ccae5823d563";""
"restaurant";"Makanan Siap Saji";"Gudeg YU DJUM Pusat - JL Wonosari";"Jl. Jogja - Wonosari No.KM 7, Gading II, Gading, Kec. Playen, Kabupaten Gunung Kidul, Daerah Istimewa Yogyakarta 55861";"Gading II, Gading, Kec. Playen, Kabupaten Gunung Kidul";"DAERAH ISTIMEWA YOGYAKARTA";"55861";"Indonesia";" 02742910155";"";"/url?q>>u003dhttp://gudegyudjumpusat.com/>>u0026opi>>u003d79508299>>u0026sa>>u003dU>>u0026ved>>u003d0ahUKEwjq_ufJx4CMAxXJzDgGHcDuKvAQ61gIGigS>>u0026usg>>u003dAOvVaw2MuRU5B6rZWUfAo9Kf0Sdy";"-7.9105901";"110.5544433";"https://maps.google.com/?cid=0x0:0xb3a7ade8180271c5";""
"restaurant";"Hidangan Laut";"Panda asian food";"Jl. Taman Bakti No.7, Jeruk, Kepek, Kec. Wonosari, Kabupaten Gunung Kidul, Daerah Istimewa Yogyakarta 55813";"Jeruk, Kepek, Kec. Wonosari, Kabupaten Gunung Kidul";"DAERAH ISTIMEWA YOGYAKARTA";"55813";"Indonesia";" 081283468050";"";"";"-7.9618529";"110.6025825";"https://maps.google.com/?cid=0x0:0x34bb29c7a11d684e";""
"restaurant";"Restoran";"Omahena";"Logandeng, 21/05, Logandeng, Kec. Playen, Kabupaten Gunung Kidul, Daerah Istimewa Yogyakarta 55861";"21/05, Logandeng, Kec. Playen, Kabupaten Gunung Kidul";"DAERAH ISTIMEWA YOGYAKARTA";"55861";"Indonesia";" 081325472910";"";"";"-7.9348481";"110.5775136";"https://maps.google.com/?cid=0x0:0xcf0f6103e2054a62";""
"restaurant";"Restoran";"SalSari Resto  Coffee ️ ️ ️ ️ ️";"Jl. Nasional III No.4, Logandeng, Kec. Playen, Kabupaten Gunung Kidul, Daerah Istimewa Yogyakarta 55861";"Logandeng, Kec. Playen, Kabupaten Gunung Kidul";"DAERAH ISTIMEWA YOGYAKARTA";"55861";"Indonesia";" 081233003040";"";"/url?q>>u003dhttps://www.instagram.com/salsariresto/>>u0026opi>>u003d79508299>>u0026sa>>u003dU>>u0026ved>>u003d0ahUKEwjmx87Kx4CMAxX-TmwGHSp8OgcQ61gIGygS>>u0026usg>>u003dAOvVaw1lPRyDGlRT6td56XSdK2UF";"-7.9391306";"110.5763068";"https://maps.google.com/?cid=0x0:0xa0dfd27e5812fb9d";""
"restaurant";"Jawa";"Warung Simbok";"Jl.Wonosari-Yogyakarta KM. 5 Bandung Playen Bandung, Bandung, Kabupaten Gunung Kidul, Daerah Istimewa Yogyakarta 55861";"Bandung, Kabupaten Gunung Kidul";"DAERAH ISTIMEWA YOGYAKARTA";"55861";"Indonesia";" 08112552575";"";"";"-7.9297613";"110.567522";"https://maps.google.com/?cid=0x0:0x7c08b9d37b6c7899";""
"restaurant";"Prasmanan";"Seblak teh upa wonosari";"Smpn 2 Wonosari, Trimulyo I, Kepek, Kec. Wonosari, Kabupaten Gunung Kidul, Daerah Istimewa Yogyakarta 55813";"Trimulyo I, Kepek, Kec. Wonosari, Kabupaten Gunung Kidul";"DAERAH ISTIMEWA YOGYAKARTA";"55813";"Indonesia";"";"";"";"-7.9674454";"110.5988054";"https://maps.google.com/?cid=0x0:0x254d7c4a57d2daee";""
"restaurant";"Mi";"Kedai Badjoeri Wonosari (Warmindo)";"Jl. Brigjen Katamso No.59, Kepek I, Wonosari, Kec. Wonosari, Kabupaten Gunung Kidul, Daerah Istimewa Yogyakarta 55851";"Kepek I, Wonosari, Kec. Wonosari, Kabupaten Gunung Kidul";"DAERAH ISTIMEWA YOGYAKARTA";"55851";"Indonesia";"";"";"";"-7.9693246";"110.6043994";"https://maps.google.com/?cid=0x0:0xb26ed3df2f9dacf2";""
"restaurant";"Rumah Makan";"Warung Lesehan "Sugarni"";"Jl. Brigjen Katamso No.57, Gadungsari, Wonosari, Kec. Wonosari, Kabupaten Gunung Kidul, Daerah Istimewa Yogyakarta 55851";"Gadungsari, Wonosari, Kec. Wonosari, Kabupaten Gunung Kidul";"DAERAH ISTIMEWA YOGYAKARTA";"55851";"Indonesia";"";"";"";"-7.9686529";"110.6036863";"https://maps.google.com/?cid=0x0:0x7a4b7b3c9bd63bf8";""
"restaurant";"restaurant";"Wonosari";"Kec. Wonosari, Kabupaten Gunung Kidul, Daerah Istimewa Yogyakarta";"Kabupaten Gunung Kidul, Daerah Istimewa Yogyakarta";"DAERAH ISTIMEWA YOGYAKARTA";"";"Indonesia";"";"";"";"-7.9655412";"110.6008827";"https://maps.google.com/?cid=0x0:0x1d9d005a0dcd50c3";""
"restaurant";"Restoran";"Rinten Ndalu Coffee  Resto";"Daerah Istimewa Jl. Baron No.54, Seneng, Siraman, Wonosari, Gunung Kidul Regency, Special Region of Yogyakarta 55851";"Seneng, Siraman, Wonosari, Gunung Kidul Regency";"DAERAH ISTIMEWA YOGYAKARTA";"55851";"Indonesia";" 081329276099";"";"/url?q>>u003dhttps://www.instagram.com/rn_resto/>>u0026opi>>u003d79508299>>u0026sa>>u003dU>>u0026ved>>u003d0ahUKEwjh5JXMx4CMAxXrxDgGHerALZIQ61gIGigS>>u0026usg>>u003dAOvVaw3IvBIVqfx4RsgFEMAaC5Oh";"-7.9727784";"110.6010829";"https://maps.google.com/?cid=0x0:0xe577a82bc4ffd35";""
"restaurant";"Ikan Bakar";"Pondok Pademangan";"2HQX+HRR, Jl. Kasatrian, Kepek II, Kepek, Kec. Wonosari, Kabupaten Gunung Kidul, Daerah Istimewa Yogyakarta 55851";"Jl. Kasatrian, Kepek II, Kepek, Kec. Wonosari, Kabupaten Gunung Kidul";"DAERAH ISTIMEWA YOGYAKARTA";"55851";"Indonesia";" 08170836001";"";"";"-7.9610146";"110.5995151";"https://maps.google.com/?cid=0x0:0xb9ed564ebe4d0b51";""
"restaurant";"Restoran";"Lesehan Layah Kembar Garden";"Seneng, Siraman, Kec. Wonosari, Kabupaten Gunung Kidul, Daerah Istimewa Yogyakarta 55813";"Siraman, Kec. Wonosari, Kabupaten Gunung Kidul";"DAERAH ISTIMEWA YOGYAKARTA";"55813";"Indonesia";" 087860244200";"";"";"-7.9747495";"110.59342";"https://maps.google.com/?cid=0x0:0x4948d92af7bb4c04";""
"restaurant";"Kafe";"Waroeng Ngumpul Coffee  Resto Wonosari";"2HRV+GF2, Jl. Brigjen Katamso, Kepek I, Kepek, Kec. Wonosari, Kabupaten Gunung Kidul, Daerah Istimewa Yogyakarta";"Kabupaten Gunung Kidul, Daerah Istimewa Yogyakarta";"DAERAH ISTIMEWA YOGYAKARTA";"";"Indonesia";"";"";"";"-7.9587457";"110.593631";"https://maps.google.com/?cid=0x0:0xa013abfc44cb915c";""
"restaurant";"Jawa";"Nasi Merah Wonosari";"2HFW+P9J, Jl. KRT Judodiningrat, Seneng, Siraman, Kec. Wonosari, Kabupaten Gunung Kidul, Daerah Istimewa Yogyakarta 55851";"Jl. KRT Judodiningrat, Seneng, Siraman, Kec. Wonosari, Kabupaten Gunung Kidul";"DAERAH ISTIMEWA YOGYAKARTA";"55851";"Indonesia";" 087843118081";"";"";"-7.9756618";"110.5958844";"https://maps.google.com/?cid=0x0:0xc6e248a26eb2a697";""
"restaurant";"Restoran";"Resto Rakyat Remen Temen";"Jl. KH Agus Salim No.20, Ledoksari, Kepek, Kec. Wonosari, Kabupaten Gunung Kidul, Daerah Istimewa Yogyakarta 55813";"Ledoksari, Kepek, Kec. Wonosari, Kabupaten Gunung Kidul";"DAERAH ISTIMEWA YOGYAKARTA";"55813";"Indonesia";" 087836601344";"";"";"-7.9550846";"110.5902756";"https://maps.google.com/?cid=0x0:0x36c8e2bb527df815";""
"restaurant";"Restoran";"Kalahari resto  cafe";"Tegalmulyo 03/05, Bansari, Kepek, Kec. Wonosari, Kabupaten Gunung Kidul, Daerah Istimewa Yogyakarta 55813";"Bansari, Kepek, Kec. Wonosari, Kabupaten Gunung Kidul";"DAERAH ISTIMEWA YOGYAKARTA";"55813";"Indonesia";" 081325257474";"";"";"-7.9678525";"110.5933802";"https://maps.google.com/?cid=0x0:0xb6a86ee3ddd22a4";""
"restaurant";"Restoran";"Griya Hinggil (GH) RESTO";"Jl. Kyai Legi No.Rt 07/04, Bansari, Kepek, Kec. Wonosari, Kabupaten Gunung Kidul, Daerah Istimewa Yogyakarta 55813";"Bansari, Kepek, Kec. Wonosari, Kabupaten Gunung Kidul";"DAERAH ISTIMEWA YOGYAKARTA";"55813";"Indonesia";" 085943073937";"";"/url?q>>u003dhttps://instagram.com/griyahinggil.gk%3Futm_medium%3Dcopy_link>>u0026opi>>u003d79508299>>u0026sa>>u003dU>>u0026ved>>u003d0ahUKEwjr3fjdx4CMAxVt7jgGHcyjMYoQ61gIGigS>>u0026usg>>u003dAOvVaw0b0iannjxoVGhoMQbJx_Nh";"-7.9649239";"110.5889727";"https://maps.google.com/?cid=0x0:0xff3f744df96de35b";""
"restaurant";"Indonesia";"Pondok Makan Sekar Kusuma";"Jl. Sri Tj., Purwosari, Baleharjo, Kec. Wonosari, Kabupaten Gunung Kidul, Daerah Istimewa Yogyakarta 55881";"Purwosari, Baleharjo, Kec. Wonosari, Kabupaten Gunung Kidul";"DAERAH ISTIMEWA YOGYAKARTA";"55881";"Indonesia";" 0274394555";"";"";"-7.9726793";"110.603592";"https://maps.google.com/?cid=0x0:0x4352d287bd1d989c";""
"restaurant";"Pujasera";"Kebon Ijo Kulma";"Jl. Tentara Pelajar Gg. Kulma, Tegalmulyo, Kepek, Kec. Wonosari, Kabupaten Gunung Kidul, Daerah Istimewa Yogyakarta 55813";"Tegalmulyo, Kepek, Kec. Wonosari, Kabupaten Gunung Kidul";"DAERAH ISTIMEWA YOGYAKARTA";"55813";"Indonesia";" 085163181815";"";"";"-7.9656727";"110.594277";"https://maps.google.com/?cid=0x0:0xa630f22e580fb287";""
"restaurant";"Jawa";"RM Jawa "Bu Sudar"";"Jl. Taman Bakti, Jeruksari, Wonosari, Kec. Wonosari, Kabupaten Gunung Kidul, Daerah Istimewa Yogyakarta 55851";"Jeruksari, Wonosari, Kec. Wonosari, Kabupaten Gunung Kidul";"DAERAH ISTIMEWA YOGYAKARTA";"55851";"Indonesia";" 081326481879";"";"";"-7.9565174";"110.6036527";"https://maps.google.com/?cid=0x0:0x20368a88cd529f5c";""
"restaurant";"Rumah Makan";"Waroeng Spesial Sambal "SS" Wonosari";"Jl. Baron No.KM 1, Seneng, Siraman, Kec. Wonosari, Kabupaten Gunung Kidul, Daerah Istimewa Yogyakarta 55851";"Seneng, Siraman, Kec. Wonosari, Kabupaten Gunung Kidul";"DAERAH ISTIMEWA YOGYAKARTA";"55851";"Indonesia";" 08562575039";"";"";"-7.9737352";"110.6019041";"https://maps.google.com/?cid=0x0:0x2ef74342b96b8f6c";""
"restaurant";"Restoran";"Gaung Resto Rest Area 24 Jam";"Jalan Djoyodiningrat, Tegalsari, Siraman, Seneng, Siraman, Kec. Wonosari, Kabupaten Gunung Kidul, Daerah Istimewa Yogyakarta 55851";"Tegalsari, Siraman, Seneng, Siraman, Kec. Wonosari, Kabupaten Gunung Kidul";"DAERAH ISTIMEWA YOGYAKARTA";"55851";"Indonesia";" 08112802442";"";"";"-7.976718";"110.6020926";"https://maps.google.com/?cid=0x0:0x233cf40dca31d3bc";""
"restaurant";"Prasmanan";"Seblak teh upa wonosari";"Smpn 2 Wonosari, Trimulyo I, Kepek, Kec. Wonosari, Kabupaten Gunung Kidul, Daerah Istimewa Yogyakarta 55813";"Trimulyo I, Kepek, Kec. Wonosari, Kabupaten Gunung Kidul";"DAERAH ISTIMEWA YOGYAKARTA";"55813";"Indonesia";"";"";"";"-7.9674454";"110.5988054";"https://maps.google.com/?cid=0x0:0x254d7c4a57d2daee";""
"restaurant";"Steak";"Star Steak";"2HQX+HV4, Jeruk, Kepek, Kec. Wonosari, Kabupaten Gunung Kidul, Daerah Istimewa Yogyakarta 55813";"Jeruk, Kepek, Kec. Wonosari, Kabupaten Gunung Kidul";"DAERAH ISTIMEWA YOGYAKARTA";"55813";"Indonesia";" 085731435031";"";"";"-7.9611208";"110.5997047";"https://maps.google.com/?cid=0x0:0x4b8d6956e5a37347";""
"restaurant";"Kedai Kopi";"MOUNTAIN PLEASURE Coffee";"No.27 Tegalmulyo Rt 08/05, Kepek, Kec. Wonosari, Kabupaten Gunung Kidul, Daerah Istimewa Yogyakarta 55813";"Kepek, Kec. Wonosari, Kabupaten Gunung Kidul";"DAERAH ISTIMEWA YOGYAKARTA";"55813";"Indonesia";" 089526782700";"";"";"-7.9614735";"110.5951039";"https://maps.google.com/?cid=0x0:0xc4cab8d11961df2f";""
"restaurant";"Kafetaria";"OMAH KANDANG";"2HPV+JJ5, Tegalmulyo, Kepek, Kec. Wonosari, Kabupaten Gunung Kidul, Daerah Istimewa Yogyakarta 55813";"Tegalmulyo, Kepek, Kec. Wonosari, Kabupaten Gunung Kidul";"DAERAH ISTIMEWA YOGYAKARTA";"55813";"Indonesia";" 082136373435";"";"";"-7.9634894";"110.5941092";"https://maps.google.com/?cid=0x0:0x3bb1f6c6d25aaeb2";""
"restaurant";"Rumah Makan";"Warung Makan Bu Yanti";"2HVV+24F, Jalan KH Agus Salim, Ledoksari, Kepek, Wonosari, Kranon, Kepek, Kec. Wonosari, Kabupaten Gunung Kidul, Daerah Istimewa Yogyakarta 55813";"Jalan KH Agus Salim, Ledoksari, Kepek, Wonosari, Kranon, Kepek, Kec. Wonosari, Kabupaten Gunung Kidul";"DAERAH ISTIMEWA YOGYAKARTA";"55813";"Indonesia";" 02742910354";"";"";"-7.9574279";"110.5927831";"https://maps.google.com/?cid=0x0:0xe0ae01054d2b90cb";""
"restaurant";"Ikan Bakar";"Lesehan Katamso";"2JM2+4V5, Jl. Brigjen Katamso, Purbosari, Wonosari, Kec. Wonosari, Kabupaten Gunung Kidul, Daerah Istimewa Yogyakarta 55851";"Jl. Brigjen Katamso, Purbosari, Wonosari, Kec. Wonosari, Kabupaten Gunung Kidul";"DAERAH ISTIMEWA YOGYAKARTA";"55851";"Indonesia";" 081328716111";"";"";"-7.967249";"110.6022258";"https://maps.google.com/?cid=0x0:0x9ea965e4d999142";""
"restaurant";"Jawa";"Warung Makan Primadona";"Jalan Tentara Pelajar No. 99, Kranon, Wonosari, Tegalmulyo, Kepek, Kec. Wonosari, Kabupaten Gunung Kidul, Daerah Istimewa Yogyakarta 55813";"Kranon, Wonosari, Tegalmulyo, Kepek, Kec. Wonosari, Kabupaten Gunung Kidul";"DAERAH ISTIMEWA YOGYAKARTA";"55813";"Indonesia";" 087838126068";"";"";"-7.9609479";"110.5948491";"https://maps.google.com/?cid=0x0:0x41758b6e95f8bc4e";""
"restaurant";"Traditional restaurant";"Taman Kuliner Wonosari";"Jl. Masjid, Purbosari, Wonosari, Kec. Wonosari, Kabupaten Gunung Kidul, Daerah Istimewa Yogyakarta 55851";"Purbosari, Wonosari, Kec. Wonosari, Kabupaten Gunung Kidul";"DAERAH ISTIMEWA YOGYAKARTA";"55851";"Indonesia";"";"";"";"-7.9627292";"110.6012434";"https://maps.google.com/?cid=0x0:0x466ae7b75e5951cf";""
"restaurant";"Restoran";"Sop Buntut dan Soto SARPRING";"Jl. Kasatrian No.12, Kepek II, Kepek, Kec. Wonosari, Kabupaten Gunung Kidul, Daerah Istimewa Yogyakarta 55813";"Kepek II, Kepek, Kec. Wonosari, Kabupaten Gunung Kidul";"DAERAH ISTIMEWA YOGYAKARTA";"55813";"Indonesia";" 081904194848";"";"";"-7.9597067";"110.5973901";"https://maps.google.com/?cid=0x0:0x4e94aef343ae4ff6";""
"restaurant";"Kafe";"Limasan Ledoksari";"2HVV+253, Jl. Nusantara, Kranon, Kepek, Kec. Wonosari, Kabupaten Gunung Kidul, Daerah Istimewa Yogyakarta 55813";"Jl. Nusantara, Kranon, Kepek, Kec. Wonosari, Kabupaten Gunung Kidul";"DAERAH ISTIMEWA YOGYAKARTA";"55813";"Indonesia";"";"";"";"-7.9574917";"110.5929347";"https://maps.google.com/?cid=0x0:0x10473e4bf1338d9f";""
"restaurant";"Restoran";"Olive Fried Chicken Wonosari 1";"Jl. KH Agus Salim No.1, Kepek I, Kepek, Kec. Wonosari, Kabupaten Gunung Kidul, Daerah Istimewa Yogyakarta 55813";"Kepek I, Kepek, Kec. Wonosari, Kabupaten Gunung Kidul";"DAERAH ISTIMEWA YOGYAKARTA";"55813";"Indonesia";"";"";"";"-7.9619247";"110.5966079";"https://maps.google.com/?cid=0x0:0x8bf6355f8757667c";""
"restaurant";"restaurant";"Daerah Istimewa Yogyakarta 55813";"Kec. Wonosari, Kabupaten Gunung Kidul, Daerah Istimewa Yogyakarta";"Kabupaten Gunung Kidul, Daerah Istimewa Yogyakarta";"DAERAH ISTIMEWA YOGYAKARTA";"";"Indonesia";"";"";"";"-7.9623155";"110.5900751";"https://maps.google.com/?cid=0x0:0x1c00c5eb5b53c380";""
"restaurant";"Hidangan Laut";"Panda asian food";"Jl. Taman Bakti No.7, Jeruk, Kepek, Kec. Wonosari, Kabupaten Gunung Kidul, Daerah Istimewa Yogyakarta 55813";"Jeruk, Kepek, Kec. Wonosari, Kabupaten Gunung Kidul";"DAERAH ISTIMEWA YOGYAKARTA";"55813";"Indonesia";" 081283468050";"";"";"-7.9618529";"110.6025825";"https://maps.google.com/?cid=0x0:0x34bb29c7a11d684e";""
"restaurant";"Restoran";"Rinten Ndalu Coffee  Resto";"Daerah Istimewa Jl. Baron No.54, Seneng, Siraman, Wonosari, Gunung Kidul Regency, Special Region of Yogyakarta 55851";"Seneng, Siraman, Wonosari, Gunung Kidul Regency";"DAERAH ISTIMEWA YOGYAKARTA";"55851";"Indonesia";" 081329276099";"";"/url?q>>u003dhttps://www.instagram.com/rn_resto/>>u0026opi>>u003d79508299>>u0026sa>>u003dU>>u0026ved>>u003d0ahUKEwiL-frix4CMAxUXTGwGHfLTEKIQ61gIGigS>>u0026usg>>u003dAOvVaw0ECmnfCn4jG-wv1Xf5tfsT";"-7.9727784";"110.6010829";"https://maps.google.com/?cid=0x0:0xe577a82bc4ffd35";""
"restaurant";"Kafe";"Waroeng Ngumpul Coffee  Resto Wonosari";"2HRV+GF2, Jl. Brigjen Katamso, Kepek I, Kepek, Kec. Wonosari, Kabupaten Gunung Kidul, Daerah Istimewa Yogyakarta";"Kabupaten Gunung Kidul, Daerah Istimewa Yogyakarta";"DAERAH ISTIMEWA YOGYAKARTA";"";"Indonesia";"";"";"";"-7.9587457";"110.593631";"https://maps.google.com/?cid=0x0:0xa013abfc44cb915c";""
"restaurant";"Rumah Makan";"Waroeng Spesial Sambal "SS" Wonosari";"Jl. Baron No.KM 1, Seneng, Siraman, Kec. Wonosari, Kabupaten Gunung Kidul, Daerah Istimewa Yogyakarta 55851";"Seneng, Siraman, Kec. Wonosari, Kabupaten Gunung Kidul";"DAERAH ISTIMEWA YOGYAKARTA";"55851";"Indonesia";" 08562575039";"";"";"-7.9737352";"110.6019041";"https://maps.google.com/?cid=0x0:0x2ef74342b96b8f6c";""
"restaurant";"Restoran";"Rinten Ndalu Coffee  Resto";"Daerah Istimewa Jl. Baron No.54, Seneng, Siraman, Wonosari, Gunung Kidul Regency, Special Region of Yogyakarta 55851";"Seneng, Siraman, Wonosari, Gunung Kidul Regency";"DAERAH ISTIMEWA YOGYAKARTA";"55851";"Indonesia";" 081329276099";"";"";"-7.9727784";"110.6010829";"https://maps.google.com/?cid=0x0:0xe577a82bc4ffd35";""
"restaurant";"Restoran";"Kalahari resto  cafe";"Tegalmulyo 03/05, Bansari, Kepek, Kec. Wonosari, Kabupaten Gunung Kidul, Daerah Istimewa Yogyakarta 55813";"Bansari, Kepek, Kec. Wonosari, Kabupaten Gunung Kidul";"DAERAH ISTIMEWA YOGYAKARTA";"55813";"Indonesia";" 081325257474";"";"";"-7.9678525";"110.5933802";"https://maps.google.com/?cid=0x0:0xb6a86ee3ddd22a4";""
"restaurant";"Jawa";"RM Jawa "Bu Sudar"";"Jl. Taman Bakti, Jeruksari, Wonosari, Kec. Wonosari, Kabupaten Gunung Kidul, Daerah Istimewa Yogyakarta 55851";"Jeruksari, Wonosari, Kec. Wonosari, Kabupaten Gunung Kidul";"DAERAH ISTIMEWA YOGYAKARTA";"55851";"Indonesia";" 081326481879";"";"";"-7.9565174";"110.6036527";"https://maps.google.com/?cid=0x0:0x20368a88cd529f5c";""
"restaurant";"Rumah Makan";"Warung Kampung Tani";"Jl. Ki Demang Wonopawiro Jl. Ngemplek No.16, Ngrebah I, Piyaman, Kec. Wonosari, Kabupaten Gunung Kidul, Daerah Istimewa Yogyakarta 55851";"Ngrebah I, Piyaman, Kec. Wonosari, Kabupaten Gunung Kidul";"DAERAH ISTIMEWA YOGYAKARTA";"55851";"Indonesia";" 081774160589";"";"";"-7.9405774";"110.5994722";"https://maps.google.com/?cid=0x0:0x3433c4d46846011d";""
"restaurant";"Traditional restaurant";"Taman Kuliner Wonosari";"Jl. Masjid, Purbosari, Wonosari, Kec. Wonosari, Kabupaten Gunung Kidul, Daerah Istimewa Yogyakarta 55851";"Purbosari, Wonosari, Kec. Wonosari, Kabupaten Gunung Kidul";"DAERAH ISTIMEWA YOGYAKARTA";"55851";"Indonesia";"";"";"";"-7.9627292";"110.6012434";"https://maps.google.com/?cid=0x0:0x466ae7b75e5951cf";""
"restaurant";"Traditional restaurant";"Omah Kampoeng Kuliner Gunungkidul ( Rest Area  Transit )";"Sebelah Timurnya Griya mbah Bagong, Jl. Raya Wonosari-Semanu No.52, Semanu, Kabupaten Gunung Kidul, Daerah Istimewa Yogyakarta 55893";"Jl. Raya Wonosari-Semanu No.52, Semanu, Kabupaten Gunung Kidul";"DAERAH ISTIMEWA YOGYAKARTA";"55893";"Indonesia";" 087883356802";"";"";"-7.9818686";"110.6176849";"https://maps.google.com/?cid=0x0:0x4b52865e35b84a10";""
"restaurant";"Restoran";"Opor Kulwer";"Gg. Sindoro, Jeruksari, Wonosari, Kec. Wonosari, Kabupaten Gunung Kidul, Daerah Istimewa Yogyakarta 55851";"Jeruksari, Wonosari, Kec. Wonosari, Kabupaten Gunung Kidul";"DAERAH ISTIMEWA YOGYAKARTA";"55851";"Indonesia";" 087839528099";"";"";"-7.9605501";"110.6035605";"https://maps.google.com/?cid=0x0:0xad03e441f5ee47bb";""
"restaurant";"Indonesia";"Pondok Makan Sekar Kusuma";"Jl. Sri Tj., Purwosari, Baleharjo, Kec. Wonosari, Kabupaten Gunung Kidul, Daerah Istimewa Yogyakarta 55881";"Purwosari, Baleharjo, Kec. Wonosari, Kabupaten Gunung Kidul";"DAERAH ISTIMEWA YOGYAKARTA";"55881";"Indonesia";" 0274394555";"";"";"-7.9726793";"110.603592";"https://maps.google.com/?cid=0x0:0x4352d287bd1d989c";""
"restaurant";"";"Warung Kangen Pasar Pahing";"Jl. Piyaman, Piyaman I, Piyaman, Kec. Wonosari, Kabupaten Gunung Kidul, Daerah Istimewa Yogyakarta 55851";"Piyaman I, Piyaman, Kec. Wonosari, Kabupaten Gunung Kidul";"DAERAH ISTIMEWA YOGYAKARTA";"55851";"Indonesia";" 08179416453";"";"";"-7.9308496";"110.5915783";"https://maps.google.com/?cid=0x0:0x7633a63ab917b39";""
"restaurant";"Toko Roti";"Martabak Indoholand Dan NN Resto Bakery";"Jl. Brigjen Katamso No.22, Madusari, Purbosari, Kec. Wonosari, Kabupaten Gunung Kidul, Daerah Istimewa Yogyakarta 55851";"Madusari, Purbosari, Kec. Wonosari, Kabupaten Gunung Kidul";"DAERAH ISTIMEWA YOGYAKARTA";"55851";"Indonesia";" 081229302216";"";"";"-7.9666714";"110.6013943";"https://maps.google.com/?cid=0x0:0x98e82a07b19b582e";""
"restaurant";"Ikan Bakar";"Lesehan Katamso";"2JM2+4V5, Jl. Brigjen Katamso, Purbosari, Wonosari, Kec. Wonosari, Kabupaten Gunung Kidul, Daerah Istimewa Yogyakarta 55851";"Jl. Brigjen Katamso, Purbosari, Wonosari, Kec. Wonosari, Kabupaten Gunung Kidul";"DAERAH ISTIMEWA YOGYAKARTA";"55851";"Indonesia";" 081328716111";"";"";"-7.967249";"110.6022258";"https://maps.google.com/?cid=0x0:0x9ea965e4d999142";""
"restaurant";"Masakan Asia";"Panda Seafood";"Jl. Jagalan, Tawarsari, Wonosari, Kec. Wonosari, Kabupaten Gunung Kidul, Daerah Istimewa Yogyakarta 55851";"Tawarsari, Wonosari, Kec. Wonosari, Kabupaten Gunung Kidul";"DAERAH ISTIMEWA YOGYAKARTA";"55851";"Indonesia";" 087889955698";"";"";"-7.9587258";"110.6069593";"https://maps.google.com/?cid=0x0:0x475af4bf39d5489a";""
