Category;Real Category;Business Name;Address;City;State;Postal Code;Country;Phone;Email;Website;Latitude;Longitude;Map Link;Details Link
"cafe";"Kedai Kopi";"Cafe Codoti Inspirasi";"XF6R+C3J, Dondong, Jetis, Kec. Saptosari, Kabupaten Gunung Kidul, Daerah Istimewa Yogyakarta 55871";"Dondong, Jetis, Kec. Saptosari, Kabupaten Gunung Kidul";"DAERAH ISTIMEWA YOGYAKARTA";"55871";"Indonesia";"";"";"";"-8.0389005";"110.4901413";"https://maps.google.com/?cid=0x0:0xe37f671d3de1889c";""
"cafe";"Kedai Kopi";"Sijum  sundi art";"WHJ2+473, Jl. Pantai Sel. Jawa, Singkil, Giring, Kec. Paliyan, Kabupaten Gunung Kidul, Daerah Istimewa Yogyakarta 55871";"Jl. Pantai Sel. Jawa, Singkil, Giring, Kec. Paliyan, Kabupaten Gunung Kidul";"DAERAH ISTIMEWA YOGYAKARTA";"55871";"Indonesia";" 085877170902";"";"";"-8.0699213";"110.5506906";"https://maps.google.com/?cid=0x0:0x77148299ac83755c";""
"cafe";"Kafe";"Popice Tempura Paliyan Lor";"XFXW+2V5, Paliyan Lor, Karangduwet, Kec. Paliyan, Kabupaten Gunung Kidul, Daerah Istimewa Yogyakarta 55871";"Paliyan Lor, Karangduwet, Kec. Paliyan, Kabupaten Gunung Kidul";"DAERAH ISTIMEWA YOGYAKARTA";"55871";"Indonesia";" 085702030792";"";"";"-8.0024953";"110.4972264";"https://maps.google.com/?cid=0x0:0x2c84e4b52b9882e2";""
"cafe";"Kedai Kopi";"Angkringan mabar꧋ꦄꦁꦏꦿꦶꦔꦤ꧀ꦩꦧꦂ";"XFWX+58V, Paliyan Tengah, Karangduwet, Kec. Paliyan, Kabupaten Gunung Kidul, Daerah Istimewa Yogyakarta 55871";"Paliyan Tengah, Karangduwet, Kec. Paliyan, Kabupaten Gunung Kidul";"DAERAH ISTIMEWA YOGYAKARTA";"55871";"Indonesia";"";"";"";"-8.0045029";"110.4982889";"https://maps.google.com/?cid=0x0:0xa2391cd9060c0b42";""
"cafe";"Kedai Kopi";"Santaimawon";"XGMV+2VP, Karangmiri, Mulusan, Kec. Paliyan, Kabupaten Gunung Kidul, Daerah Istimewa Yogyakarta 55871";"Karangmiri, Mulusan, Kec. Paliyan, Kabupaten Gunung Kidul";"DAERAH ISTIMEWA YOGYAKARTA";"55871";"Indonesia";"";"";"";"-8.0174162";"110.5447089";"https://maps.google.com/?cid=0x0:0x2c20d5f99a63c6ca";""
"cafe";"Kedai Kopi";"Kopi Telo";"XF6V+GR4, Jl. Raya Panggang Wonosari, Sumuran, Kepek, Kec. Saptosari, Kabupaten Gunung Kidul, Daerah Istimewa Yogyakarta 55871";"Jl. Raya Panggang Wonosari, Sumuran, Kepek, Kec. Saptosari, Kabupaten Gunung Kidul";"DAERAH ISTIMEWA YOGYAKARTA";"55871";"Indonesia";" 082137165582";"";"";"-8.0387327";"110.4945631";"https://maps.google.com/?cid=0x0:0x31457dd4d51da151";""
"cafe";"Kedai Kopi";"Angkringan guyub rukun kang otong";"XG3G+WGX, Trowono A, Karangasem, Kec. Paliyan, Kabupaten Gunung Kidul, Daerah Istimewa Yogyakarta 55871";"Trowono A, Karangasem, Kec. Paliyan, Kabupaten Gunung Kidul";"DAERAH ISTIMEWA YOGYAKARTA";"55871";"Indonesia";" 089619329656";"";"";"-8.0451468";"110.5263686";"https://maps.google.com/?cid=0x0:0x40937e90d35ea3dc";""
"cafe";"Jus";"Warung jajan Es POP";"XGVF+V4F, Jalan Raya Wonosari, Karang Asem A, Karangasem, Paliyan, Gunung Kidul Regency, Special Region of Yogyakarta 55871";"Jalan Raya Wonosari, Karang Asem A, Karangasem, Paliyan, Gunung Kidul Regency";"DAERAH ISTIMEWA YOGYAKARTA";"55871";"Indonesia";" 082125414167";"";"";"-8.0053073";"110.5228049";"https://maps.google.com/?cid=0x0:0xc32ff788678b42c3";""
"cafe";"cafe";"Daerah Istimewa Yogyakarta 55871";"Kec. Saptosari, Kabupaten Gunung Kidul, Daerah Istimewa Yogyakarta";"Kabupaten Gunung Kidul, Daerah Istimewa Yogyakarta";"DAERAH ISTIMEWA YOGYAKARTA";"";"Indonesia";"";"";"";"-8.046398";"110.5096283";"https://maps.google.com/?cid=0x0:0x1c00c5eb5b53c400";""
"cafe";"Kedai Kopi";"Markas FR AUDIO";"XGRF+GF7, Karang Asem A, Karangasem, Kec. Paliyan, Kabupaten Gunung Kidul, Daerah Istimewa Yogyakarta 55871";"Karang Asem A, Karangasem, Kec. Paliyan, Kabupaten Gunung Kidul";"DAERAH ISTIMEWA YOGYAKARTA";"55871";"Indonesia";"";"";"";"-8.0087197";"110.5236844";"https://maps.google.com/?cid=0x0:0xc9afaf7604956f2f";""
"cafe";"Restoran";"Angker(Angkringan keren) mas Aris";"Jl. Raya Wonosari-Paliyan No.16, Tambakrejo, Sodo, Kec. Paliyan, Kabupaten Gunung Kidul, Daerah Istimewa Yogyakarta 55871";"Tambakrejo, Sodo, Kec. Paliyan, Kabupaten Gunung Kidul";"DAERAH ISTIMEWA YOGYAKARTA";"55871";"Indonesia";" 081228436006";"";"";"-8.0102684";"110.5589871";"https://maps.google.com/?cid=0x0:0x1d830a9099b729a4";""
"cafe";"Kedai Kopi";"NONONINO kitchen  coffee";"Dondong, Jetis, Kec. Saptosari, Kabupaten Gunung Kidul, Daerah Istimewa Yogyakarta 55871";"Jetis, Kec. Saptosari, Kabupaten Gunung Kidul";"DAERAH ISTIMEWA YOGYAKARTA";"55871";"Indonesia";"";"";"";"-8.0392551";"110.4913614";"https://maps.google.com/?cid=0x0:0xce76d2009e98f88b";""
"cafe";"Restoran";"Pule Coffee and Eatery";"Jl. Mgr. Sugiyo Pranoto No.23a, Purwosari, Baleharjo, Kec. Wonosari, Kabupaten Gunung Kidul, Daerah Istimewa Yogyakarta 55881";"Purwosari, Baleharjo, Kec. Wonosari, Kabupaten Gunung Kidul";"DAERAH ISTIMEWA YOGYAKARTA";"55881";"Indonesia";"";"";"/url?q>>u003dhttp://instagram.com/pule.coffee.eatery>>u0026opi>>u003d79508299>>u0026sa>>u003dU>>u0026ved>>u003d0ahUKEwj3uaT1yoCMAxU24TgGHftHEBkQ61gIFigO>>u0026usg>>u003dAOvVaw0g4pCX8zNTEjZMEKJKzXFO";"-7.9723661";"110.6072338";"https://maps.google.com/?cid=0x0:0xb28c0d6b72ac5f90";""
"cafe";"Restoran";"Omah Angon Farm  Cafe";"Wiyoko Utara, Plembutan, Kec. Playen, Kabupaten Gunung Kidul, Daerah Istimewa Yogyakarta";"Kabupaten Gunung Kidul, Daerah Istimewa Yogyakarta";"DAERAH ISTIMEWA YOGYAKARTA";"";"Indonesia";" 082323816086";"";"";"-7.969305";"110.537569";"https://maps.google.com/?cid=0x0:0x136a4f18126ea098";""
"cafe";"Pempek";"Empek-Empek Bu Mur";"XGRJ+MRW, Jl. Raya Wonosari-Paliyan, Manggul, Karangasem, Kec. Paliyan, Kabupaten Gunung Kidul, Daerah Istimewa Yogyakarta 55871";"Jl. Raya Wonosari-Paliyan, Manggul, Karangasem, Kec. Paliyan, Kabupaten Gunung Kidul";"DAERAH ISTIMEWA YOGYAKARTA";"55871";"Indonesia";"";"";"";"-8.0082652";"110.532071";"https://maps.google.com/?cid=0x0:0x41fec2a585435f83";""
"cafe";"Restoran";"RM teko lego";"XG3F+M2C, Unnamed Road, Trowono A, Karangasem, Kec. Paliyan, Kabupaten Gunung Kidul, Daerah Istimewa Yogyakarta 55871";"Unnamed Road, Trowono A, Karangasem, Kec. Paliyan, Kabupaten Gunung Kidul";"DAERAH ISTIMEWA YOGYAKARTA";"55871";"Indonesia";"";"";"";"-8.0458074";"110.522526";"https://maps.google.com/?cid=0x0:0x978b6133c4e754c9";""
"cafe";"Restoran";"Angkringan Senenjong Luwong";"XG2G+H28, raya trowono, Jl. Pantai Sel. Jawa, Trowono A, Karangasem, Kec. Paliyan, Kabupaten Gunung Kidul, Daerah Istimewa Yogyakarta 55871";"raya trowono, Jl. Pantai Sel. Jawa, Trowono A, Karangasem, Kec. Paliyan, Kabupaten Gunung Kidul";"DAERAH ISTIMEWA YOGYAKARTA";"55871";"Indonesia";" 085238375553";"";"";"-8.0485887";"110.5250743";"https://maps.google.com/?cid=0x0:0xac15b7dec8ea83c8";""
"cafe";"Kedai Kopi";"Cafe Codoti Inspirasi";"XF6R+C3J, Dondong, Jetis, Kec. Saptosari, Kabupaten Gunung Kidul, Daerah Istimewa Yogyakarta 55871";"Dondong, Jetis, Kec. Saptosari, Kabupaten Gunung Kidul";"DAERAH ISTIMEWA YOGYAKARTA";"55871";"Indonesia";"";"";"";"-8.0389005";"110.4901413";"https://maps.google.com/?cid=0x0:0xe37f671d3de1889c";""
"cafe";"Kedai Kopi";"Kopi Telo";"XF6V+GR4, Jl. Raya Panggang Wonosari, Sumuran, Kepek, Kec. Saptosari, Kabupaten Gunung Kidul, Daerah Istimewa Yogyakarta 55871";"Jl. Raya Panggang Wonosari, Sumuran, Kepek, Kec. Saptosari, Kabupaten Gunung Kidul";"DAERAH ISTIMEWA YOGYAKARTA";"55871";"Indonesia";" 082137165582";"";"";"-8.0387327";"110.4945631";"https://maps.google.com/?cid=0x0:0x31457dd4d51da151";""
"cafe";"Kedai Kopi";"Bolang Cafe";"Wareng, Kepek, Kec. Saptosari, Kabupaten Gunung Kidul, Daerah Istimewa Yogyakarta 55871";"Kepek, Kec. Saptosari, Kabupaten Gunung Kidul";"DAERAH ISTIMEWA YOGYAKARTA";"55871";"Indonesia";" 08712345765";"";"";"-8.0517112";"110.5092922";"https://maps.google.com/?cid=0x0:0x7e15496a3d8fea7b";""
"cafe";"Komplek perumahan";"Griya ismanto";"WGHC+VR9, Pakel, Planjan, Kec. Saptosari, Kabupaten Gunung Kidul, Daerah Istimewa Yogyakarta 55871";"Pakel, Planjan, Kec. Saptosari, Kabupaten Gunung Kidul";"DAERAH ISTIMEWA YOGYAKARTA";"55871";"Indonesia";" 082336777781";"";"";"-8.0703357";"110.522119";"https://maps.google.com/?cid=0x0:0x7a46dc81c2b531e8";""
"cafe";"Kedai Kopi";"NONONINO kitchen  coffee";"Dondong, Jetis, Kec. Saptosari, Kabupaten Gunung Kidul, Daerah Istimewa Yogyakarta 55871";"Jetis, Kec. Saptosari, Kabupaten Gunung Kidul";"DAERAH ISTIMEWA YOGYAKARTA";"55871";"Indonesia";"";"";"";"-8.0392551";"110.4913614";"https://maps.google.com/?cid=0x0:0xce76d2009e98f88b";""
"cafe";"Jawa";"Angkringan Si Jog Proliman";"XF7Q+46X, Temanggung, Jetis, Kec. Saptosari, Kabupaten Gunung Kidul, Daerah Istimewa Yogyakarta 55871";"Temanggung, Jetis, Kec. Saptosari, Kabupaten Gunung Kidul";"DAERAH ISTIMEWA YOGYAKARTA";"55871";"Indonesia";" 082110589872";"";"";"-8.0371354";"110.4881082";"https://maps.google.com/?cid=0x0:0xd42497bb381ec33a";""
"cafe";"Tempat Pencucian Mobil";"Sah carwash";"WFHJ+VRW, Unnamed Road, Area, Ngondel Kulon, Krambil Sawit, Kec. Saptosari, Kabupaten Gunung Kidul, Daerah Istimewa Yogyakarta 55871";"Unnamed Road, Area, Ngondel Kulon, Krambil Sawit, Kec. Saptosari, Kabupaten Gunung Kidul";"DAERAH ISTIMEWA YOGYAKARTA";"55871";"Indonesia";" 081234494499";"";"";"-8.0702507";"110.4820708";"https://maps.google.com/?cid=0x0:0xc3cb2e88aa62ede6";""
"cafe";"Kafe";"Aanas,s home";"XG23+6WW, Kepek, Kec. Saptosari, Kabupaten Gunung Kidul, Daerah Istimewa Yogyakarta 55871";"Kepek, Kec. Saptosari, Kabupaten Gunung Kidul";"DAERAH ISTIMEWA YOGYAKARTA";"55871";"Indonesia";"";"";"";"-8.0494691";"110.5045974";"https://maps.google.com/?cid=0x0:0x292db6fbcde74d85";""
"cafe";"Jawa";"Djamarie";"XG25+M36, Kepek, Kec. Saptosari, Kabupaten Gunung Kidul, Daerah Istimewa Yogyakarta 55871";"Kepek, Kec. Saptosari, Kabupaten Gunung Kidul";"DAERAH ISTIMEWA YOGYAKARTA";"55871";"Indonesia";"";"";"";"-8.0483413";"110.5076417";"https://maps.google.com/?cid=0x0:0xd07a4bb02ba05e0b";""
"cafe";"Kafe";"Wong Peung";"WGHF+H46, Pakel, Planjan, Kec. Saptosari, Kabupaten Gunung Kidul, Daerah Istimewa Yogyakarta 55871";"Pakel, Planjan, Kec. Saptosari, Kabupaten Gunung Kidul";"DAERAH ISTIMEWA YOGYAKARTA";"55871";"Indonesia";" 081333647567";"";"";"-8.0710999";"110.5227546";"https://maps.google.com/?cid=0x0:0x4bd863ea0babb3c8";""
"cafe";"Restoran";"Monetha Coeswoyo";"Bibis, Krambil Sawit, Kec. Saptosari, Kabupaten Gunung Kidul, Daerah Istimewa Yogyakarta 55871";"Krambil Sawit, Kec. Saptosari, Kabupaten Gunung Kidul";"DAERAH ISTIMEWA YOGYAKARTA";"55871";"Indonesia";"";"";"";"-8.0905065";"110.4883464";"https://maps.google.com/?cid=0x0:0x18c887efdd90c983";""
"cafe";"Jawa";"OMAH SOP JAWA SUNDA ( RESTO  HOME STAY SYARI'AH)";"Jl. Raya Panggang Wonosari, Kepek, Kec. Saptosari, Kabupaten Gunung Kidul, Daerah Istimewa Yogyakarta 55871";"Kepek, Kec. Saptosari, Kabupaten Gunung Kidul";"DAERAH ISTIMEWA YOGYAKARTA";"55871";"Indonesia";" 087739012322";"";"";"-8.0470554";"110.5088917";"https://maps.google.com/?cid=0x0:0xa1b888caf0850d55";""
"cafe";"Restoran";"Angkringan Mr";"XF8J+62J, Cekel, Jetis, Kec. Saptosari, Kabupaten Gunung Kidul, Daerah Istimewa Yogyakarta 55871";"Cekel, Jetis, Kec. Saptosari, Kabupaten Gunung Kidul";"DAERAH ISTIMEWA YOGYAKARTA";"55871";"Indonesia";"";"";"";"-8.0343863";"110.4799565";"https://maps.google.com/?cid=0x0:0xc8b7994b290d5823";""
"cafe";"Kedai Kopi";"Warkop om rian";"WF9P+68C, Ngondel Wetan, Krambil Sawit, Kec. Saptosari, Kabupaten Gunung Kidul, Daerah Istimewa Yogyakarta 55871";"Ngondel Wetan, Krambil Sawit, Kec. Saptosari, Kabupaten Gunung Kidul";"DAERAH ISTIMEWA YOGYAKARTA";"55871";"Indonesia";"";"";"";"-8.0819108";"110.4856174";"https://maps.google.com/?cid=0x0:0xdf205ab12a7d7b8";""
"cafe";"Restoran";"Angkringan Semende";"Kepek, Kec. Saptosari, Kabupaten Gunung Kidul, Daerah Istimewa Yogyakarta 55871";"Kec. Saptosari, Kabupaten Gunung Kidul";"DAERAH ISTIMEWA YOGYAKARTA";"55871";"Indonesia";" 083146195747";"";"";"-8.0478166";"110.510848";"https://maps.google.com/?cid=0x0:0x975cc4334b617617";""
"cafe";"Rumah Makan";"Angkringan Pak list";"Jl. Raya Panggang Wonosari, wuluh, Jetis, Kec. Saptosari, Kabupaten Gunung Kidul, Daerah Istimewa Yogyakarta 55871";"wuluh, Jetis, Kec. Saptosari, Kabupaten Gunung Kidul";"DAERAH ISTIMEWA YOGYAKARTA";"55871";"Indonesia";" 081232347456";"";"";"-8.0396659";"110.4963938";"https://maps.google.com/?cid=0x0:0x5f084d4392913246";""
"cafe";"Rumah Makan";"Angkringan Menthuranto";"XF6R+FWC, Unnamed Road, Dondong, Jetis, Kec. Saptosari, Kabupaten Gunung Kidul, Daerah Istimewa Yogyakarta 55871";"Unnamed Road, Dondong, Jetis, Kec. Saptosari, Kabupaten Gunung Kidul";"DAERAH ISTIMEWA YOGYAKARTA";"55871";"Indonesia";" 082220015119";"";"";"-8.038805";"110.4922695";"https://maps.google.com/?cid=0x0:0xd5dc819d7e5c393f";""
"cafe";"Dapur Umum";"si kembar";"WF3Q+JP8, Jl. Pantai Ngedan, Bibis, Krambil Sawit, Kec. Saptosari, Kabupaten Gunung Kidul, Daerah Istimewa Yogyakarta 55871";"Jl. Pantai Ngedan, Bibis, Krambil Sawit, Kec. Saptosari, Kabupaten Gunung Kidul";"DAERAH ISTIMEWA YOGYAKARTA";"55871";"Indonesia";"";"";"";"-8.0959567";"110.4893157";"https://maps.google.com/?cid=0x0:0x56f8bc4ededa68c8";""
"cafe";"Kedai Kopi";"ANGKRINGAN GUBUK KOPI";"Jl. Raya Saptosari-Paliyan, Sumuran, Kepek, Kec. Saptosari, Kabupaten Gunung Kidul, Daerah Istimewa Yogyakarta 55871";"Sumuran, Kepek, Kec. Saptosari, Kabupaten Gunung Kidul";"DAERAH ISTIMEWA YOGYAKARTA";"55871";"Indonesia";" 085648648431";"";"";"-8.0392472";"110.4952657";"https://maps.google.com/?cid=0x0:0xb1a68c385d85d221";""
"cafe";"cafe";"Kec. Saptosari";"Kabupaten Gunung Kidul, Daerah Istimewa Yogyakarta";"Kabupaten Gunung Kidul, Daerah Istimewa Yogyakarta";"DAERAH ISTIMEWA YOGYAKARTA";"";"Indonesia";"";"";"";"-8.0476212";"110.5101224";"https://maps.google.com/?cid=0x0:0x4027a76e352fdb0";""
"cafe";"Hidangan Laut";"Resto  Rest Area Fedora";"XF6W+47J Jl. Legundi - Paliyan, Kepek, Kec. Saptosari, Kabupaten Gunung Kidul, Daerah Istimewa Yogyakarta 55871";"Kepek, Kec. Saptosari, Kabupaten Gunung Kidul";"DAERAH ISTIMEWA YOGYAKARTA";"55871";"Indonesia";" 085200311103";"";"";"-8.0396875";"110.4956875";"https://maps.google.com/?cid=0x0:0xadc0da3ea488278c";""
"cafe";"Dapur Umum";"ANGKRINGAN SOR TALOK";"XG3J+P4X, Jl. Raya Paliyan-Saptosari, Mojosari, Monggol, Kec. Saptosari, Kabupaten Gunung Kidul, Daerah Istimewa Yogyakarta 55871";"Jl. Raya Paliyan-Saptosari, Mojosari, Monggol, Kec. Saptosari, Kabupaten Gunung Kidul";"DAERAH ISTIMEWA YOGYAKARTA";"55871";"Indonesia";"";"";"";"-8.0456467";"110.53037";"https://maps.google.com/?cid=0x0:0xf5ce88e72f2ddd21";""
"cafe";"Dapur Umum";"Warung Kang Sigit";"Jl. Pantai Ngobaran KM 0,5, Kanigoro, Sapto Sari, Gebang, Kanigoro, Kec. Saptosari, Kabupaten Gunung Kidul, Daerah Istimewa Yogyakarta 55871";"Kanigoro, Sapto Sari, Gebang, Kanigoro, Kec. Saptosari, Kabupaten Gunung Kidul";"DAERAH ISTIMEWA YOGYAKARTA";"55871";"Indonesia";" 082116862537";"";"";"-8.1195919";"110.5060394";"https://maps.google.com/?cid=0x0:0x9677ae91d2c5f9ff";""
"cafe";"Rumah Makan";"Dapoer Caca Saptosari";"Jl. Raya Panggang Wonosari No.009/006, Karang, Jetis, Kec. Saptosari, Kabupaten Gunung Kidul, Daerah Istimewa Yogyakarta 88571";"Karang, Jetis, Kec. Saptosari, Kabupaten Gunung Kidul";"DAERAH ISTIMEWA YOGYAKARTA";"88571";"Indonesia";"";"";"";"-8.0463424";"110.5055193";"https://maps.google.com/?cid=0x0:0xd66b62361fb159a2";""
"cafe";"Toko bahan makanan";"Yuni's Saptosari";"WGX4+9V7, Sumuran, Kepek, Kec. Saptosari, Kabupaten Gunung Kidul, Daerah Istimewa Yogyakarta 55871";"Sumuran, Kepek, Kec. Saptosari, Kabupaten Gunung Kidul";"DAERAH ISTIMEWA YOGYAKARTA";"55871";"Indonesia";" 083840504402";"";"";"-8.0515847";"110.5071623";"https://maps.google.com/?cid=0x0:0x960f2b9e7646f309";""
"cafe";"Kedai Kopi";"Kedai Enggal Sae";"Jalan Tahunan, Pendem, Karangduwet, Kec. Paliyan, Kabupaten Gunung Kidul, Daerah Istimewa Yogyakarta 55871";"Pendem, Karangduwet, Kec. Paliyan, Kabupaten Gunung Kidul";"DAERAH ISTIMEWA YOGYAKARTA";"55871";"Indonesia";"";"";"";"-8.002006";"110.5115952";"https://maps.google.com/?cid=0x0:0x988f1153da43db93";""
"cafe";"Rumah Makan";"Cafe de Slili";"Jl. Pantai Krakal, Pule Gundes II, Sidoharjo, Kec. Tepus, Kabupaten Gunung Kidul, Daerah Istimewa Yogyakarta 55881";"Pule Gundes II, Sidoharjo, Kec. Tepus, Kabupaten Gunung Kidul";"DAERAH ISTIMEWA YOGYAKARTA";"55881";"Indonesia";" 0882005442397";"";"/url?q>>u003dhttp://giriselakandha.id/>>u0026opi>>u003d79508299>>u0026sa>>u003dU>>u0026ved>>u003d0ahUKEwjR2ZOby4CMAxUqxTgGHdGoNQcQ61gIFygS>>u0026usg>>u003dAOvVaw2HB_wQwHCuUCMrFhy8S89z";"-8.1450813";"110.6026763";"https://maps.google.com/?cid=0x0:0xc843e2d9f69753ef";""
"cafe";"Kedai Kopi";"Omah Lesung Kopi Roempi";"WJ5H+23J, Bintaos, Sidoharjo, Kec. Tepus, Kabupaten Gunung Kidul, Daerah Istimewa Yogyakarta 55881";"Bintaos, Sidoharjo, Kec. Tepus, Kabupaten Gunung Kidul";"DAERAH ISTIMEWA YOGYAKARTA";"55881";"Indonesia";" 081329827296";"";"";"-8.092424";"110.6276549";"https://maps.google.com/?cid=0x0:0x6e404d184e926c83";""
"cafe";"Kedai Kopi";"Kopi Nyenuk";"VJ8R+V73, Jl. Pantai Sel. Jawa, Wakangan, Tepus, Kec. Tepus, Kabupaten Gunung Kidul, Daerah Istimewa Yogyakarta 55881";"Jl. Pantai Sel. Jawa, Wakangan, Tepus, Kec. Tepus, Kabupaten Gunung Kidul";"DAERAH ISTIMEWA YOGYAKARTA";"55881";"Indonesia";"";"";"";"-8.13287";"110.6406857";"https://maps.google.com/?cid=0x0:0x2da8cbdccffc704a";""
"cafe";"Hidangan Laut";"Resto Indrayanti GK Yogyakarta Indonesia";"Pantai, Tepus, Kec. Tepus, Kabupaten Gunung Kidul, Daerah Istimewa Yogyakarta 55881";"Tepus, Kec. Tepus, Kabupaten Gunung Kidul";"DAERAH ISTIMEWA YOGYAKARTA";"55881";"Indonesia";" 082135255558";"";"/url?q>>u003dhttps://www.instagram.com/pantai_indrayanti>>u0026opi>>u003d79508299>>u0026sa>>u003dU>>u0026ved>>u003d0ahUKEwjm5oycy4CMAxVaTGwGHR6rH9gQ61gIFygS>>u0026usg>>u003dAOvVaw2rpD-sr1PUT0dK_dnnVn58";"-8.1499508";"110.6119476";"https://maps.google.com/?cid=0x0:0xa3d6030054af07c4";""
"cafe";"Bar";"djantikmanis";"WJ7P+J9C, Klepu, Sidoharjo, Kec. Tepus, Kabupaten Gunung Kidul, Daerah Istimewa Yogyakarta 55881";"Klepu, Sidoharjo, Kec. Tepus, Kabupaten Gunung Kidul";"DAERAH ISTIMEWA YOGYAKARTA";"55881";"Indonesia";"";"";"";"-8.0859363";"110.6358849";"https://maps.google.com/?cid=0x0:0x655565b64c50dafa";""
"cafe";"Kedai Kopi";"Tongkrongan Bersejarah";"RMXP+RJ9, Kotekan, Purwodadi, Kec. Tepus, Kabupaten Gunung Kidul, Daerah Istimewa Yogyakarta 55881";"Kotekan, Purwodadi, Kec. Tepus, Kabupaten Gunung Kidul";"DAERAH ISTIMEWA YOGYAKARTA";"55881";"Indonesia";" 082227596713";"";"";"-8.1504712";"110.6866025";"https://maps.google.com/?cid=0x0:0x771573544f619d8e";""
"cafe";"Restoran";"Rumah Makan Wonodarmo";"Ngasem, Sidoharjo, Kec. Tepus, Kabupaten Gunung Kidul, Daerah Istimewa Yogyakarta 55881";"Sidoharjo, Kec. Tepus, Kabupaten Gunung Kidul";"DAERAH ISTIMEWA YOGYAKARTA";"55881";"Indonesia";"";"";"";"-8.1510278";"110.6133095";"https://maps.google.com/?cid=0x0:0xddddbbc755f16010";""
"cafe";"Kafe";"Lokasi terkini";"RJWC+2J6, Jl. Pok Tunggal, Pantai, Tepus, Kec. Tepus, Kabupaten Gunung Kidul, Daerah Istimewa Yogyakarta 55881";"Jl. Pok Tunggal, Pantai, Tepus, Kec. Tepus, Kabupaten Gunung Kidul";"DAERAH ISTIMEWA YOGYAKARTA";"55881";"Indonesia";"";"";"";"-8.1547898";"110.6215398";"https://maps.google.com/?cid=0x0:0xdfc02011870fd31b";""
"cafe";"Kafe";"Omahe Plecing";"VMH9+76Q, Gude I, Sumberwungu, Kec. Tepus, Kabupaten Gunung Kidul, Daerah Istimewa Yogyakarta 55881";"Gude I, Sumberwungu, Kec. Tepus, Kabupaten Gunung Kidul";"DAERAH ISTIMEWA YOGYAKARTA";"55881";"Indonesia";" 088227991822";"";"";"-8.1217837";"110.6681139";"https://maps.google.com/?cid=0x0:0x8d591ad1d58fe163";""
"cafe";"Komplek perumahan";"Rumah Simbah Bp Waidi";"WM57+V47, Karang Gebang, Sumberwungu, Kec. Tepus, Kabupaten Gunung Kidul, Daerah Istimewa Yogyakarta 55881";"Karang Gebang, Sumberwungu, Kec. Tepus, Kabupaten Gunung Kidul";"DAERAH ISTIMEWA YOGYAKARTA";"55881";"Indonesia";"";"";"";"-8.0903452";"110.6627961";"https://maps.google.com/?cid=0x0:0x9f6c45641b37e02d";""
"cafe";"Restoran";"RESTO SEDERHANA tepus";"Jl. Tepus No.16, Pacungan, Tepus, Kec. Tepus, Kabupaten Gunung Kidul, Daerah Istimewa Yogyakarta 55881";"Pacungan, Tepus, Kec. Tepus, Kabupaten Gunung Kidul";"DAERAH ISTIMEWA YOGYAKARTA";"55881";"Indonesia";" 085292213900";"";"";"-8.1169263";"110.6431237";"https://maps.google.com/?cid=0x0:0x75777e86370f6a11";""
"cafe";"Hidangan Laut";"Warung Makan Pawon Ndeso";"Jl. Pantai Sel. Jawa No.2, Pantai, Tepus, Kec. Tepus, Kabupaten Gunung Kidul, Daerah Istimewa Yogyakarta 55881";"Pantai, Tepus, Kec. Tepus, Kabupaten Gunung Kidul";"DAERAH ISTIMEWA YOGYAKARTA";"55881";"Indonesia";" 081227463806";"";"";"-8.1506211";"110.6134089";"https://maps.google.com/?cid=0x0:0xa5adf5ec4610556c";""
"cafe";"Kafe";"GN SEWU 1";"VMVH+82X, Kropak, Giripanggung, Kec. Tepus, Kabupaten Gunung Kidul, Daerah Istimewa Yogyakarta 55881";"Kropak, Giripanggung, Kec. Tepus, Kabupaten Gunung Kidul";"DAERAH ISTIMEWA YOGYAKARTA";"55881";"Indonesia";"";"";"";"-8.1066284";"110.6776043";"https://maps.google.com/?cid=0x0:0x7f3b4b6366aa198";""
"cafe";"Hidangan Laut";"Warung Makan Dinda Goa Watulawang";"Pantai Goa Watulawang, Kec. Tepus, Kabupaten Gunung Kidul, Daerah Istimewa Yogyakarta 55881";"Kec. Tepus, Kabupaten Gunung Kidul";"DAERAH ISTIMEWA YOGYAKARTA";"55881";"Indonesia";" 085866402623";"";"";"-8.1540712";"110.6186913";"https://maps.google.com/?cid=0x0:0xe1389faba00d53cf";""
"cafe";"Makanan Kecil";"Watu resto pantai ngitun";"RMH3+V32, Pantai Ngetun, Sureng, Pantai, Purwodadi, Kec. Tepus, Kabupaten Gunung Kidul, Daerah Istimewa Yogyakarta 55881";"Pantai Ngetun, Sureng, Pantai, Purwodadi, Kec. Tepus, Kabupaten Gunung Kidul";"DAERAH ISTIMEWA YOGYAKARTA";"55881";"Indonesia";" 082327919289";"";"";"-8.1701187";"110.6530735";"https://maps.google.com/?cid=0x0:0xd44ccbc34beb6c95";""
"cafe";"Ayam";"Warung Kopi  Jasa Antar Wisata Pantai";"VM3H+VCF, Unnamed Road, Cak Bohol, Purwodadi, Kec. Tepus, Kabupaten Gunung Kidul, Daerah Istimewa Yogyakarta 55881";"Unnamed Road, Cak Bohol, Purwodadi, Kec. Tepus, Kabupaten Gunung Kidul";"DAERAH ISTIMEWA YOGYAKARTA";"55881";"Indonesia";" 081392985577";"";"/url?q>>u003dhttp://www.jelajahpantai.com/>>u0026opi>>u003d79508299>>u0026sa>>u003dU>>u0026ved>>u003d0ahUKEwjL-5Cfy4CMAxURxjgGHXfUNQsQ61gIFSgR>>u0026usg>>u003dAOvVaw3cfKuQwkoKVL2xBwK_Ahk_";"-8.1453211";"110.6785343";"https://maps.google.com/?cid=0x0:0xdf3144244fa0452a";""
"cafe";"Jawa";"LESEHAN MBOK IDUN";"Jl. Tepus No.10, Dongsari, Tepus, Kec. Tepus, Kabupaten Gunung Kidul, Daerah Istimewa Yogyakarta 55881";"Dongsari, Tepus, Kec. Tepus, Kabupaten Gunung Kidul";"DAERAH ISTIMEWA YOGYAKARTA";"55881";"Indonesia";" 083863671103";"";"";"-8.126999";"110.640087";"https://maps.google.com/?cid=0x0:0xd6be8294a94adc59";""
"cafe";"Tujuan Wisata";"Pantai Seruni";"RJRJ+2JP, Jl. Pantai Seruni, Pantai, Tepus, Kec. Tepus, Kabupaten Gunung Kidul, Daerah Istimewa Yogyakarta 55881";"Jl. Pantai Seruni, Pantai, Tepus, Kec. Tepus, Kabupaten Gunung Kidul";"DAERAH ISTIMEWA YOGYAKARTA";"55881";"Indonesia";" 082393929336";"";"";"-8.159907";"110.6315752";"https://maps.google.com/?cid=0x0:0x1f4cf1cba4c4c077";""
"cafe";"Restoran";"Kedai NoNa";"Jl. Tepus No.1, RT.3/RW.8, Dongsari, Tepus, Kec. Tepus, Kabupaten Gunung Kidul, Daerah Istimewa Yogyakarta 55881";"RT.3/RW.8, Dongsari, Tepus, Kec. Tepus, Kabupaten Gunung Kidul";"DAERAH ISTIMEWA YOGYAKARTA";"55881";"Indonesia";" 081809963232";"";"";"-8.1262256";"110.6424681";"https://maps.google.com/?cid=0x0:0x33cf5bad830b5d65";""
"cafe";"cafe";"Kec. Tepus";"Kabupaten Gunung Kidul, Daerah Istimewa Yogyakarta";"Kabupaten Gunung Kidul, Daerah Istimewa Yogyakarta";"DAERAH ISTIMEWA YOGYAKARTA";"";"Indonesia";"";"";"";"-8.1260179";"110.6420079";"https://maps.google.com/?cid=0x0:0x4027a76e352fd20";""
"cafe";"Kafe";"Omah E Mbah Mol";"RMXP+WMC, Kotekan, Purwodadi, Kec. Tepus, Kabupaten Gunung Kidul, Daerah Istimewa Yogyakarta 55881";"Kotekan, Purwodadi, Kec. Tepus, Kabupaten Gunung Kidul";"DAERAH ISTIMEWA YOGYAKARTA";"55881";"Indonesia";" 0818888333";"";"";"-8.1501857";"110.686642";"https://maps.google.com/?cid=0x0:0xf585a73343c90a85";""
"cafe";"Vila";"Light blue resto";"VJ28+GC5, Jl. Indrayanti, Pantai, Tepus, Kec. Tepus, Kabupaten Gunung Kidul, Daerah Istimewa Yogyakarta 55881";"Jl. Indrayanti, Pantai, Tepus, Kec. Tepus, Kabupaten Gunung Kidul";"DAERAH ISTIMEWA YOGYAKARTA";"55881";"Indonesia";" 088983103136";"";"";"-8.1487473";"110.6161109";"https://maps.google.com/?cid=0x0:0x8902546b491c9384";""
"cafe";"Pondok";"Resto Watulawang";"Pule Gundes II, Sidoharjo, Kec. Tepus, Kabupaten Gunung Kidul, Daerah Istimewa Yogyakarta 55881";"Sidoharjo, Kec. Tepus, Kabupaten Gunung Kidul";"DAERAH ISTIMEWA YOGYAKARTA";"55881";"Indonesia";"";"";"";"-8.1459375";"110.6049375";"https://maps.google.com/?cid=0x0:0x98ba499feaf73a99";""
"cafe";"Hidangan Laut";"Ines Cah Ndeso";"RJW9+J6C, Pantai, Tepus, Kec. Tepus, Kabupaten Gunung Kidul, Daerah Istimewa Yogyakarta 55881";"Pantai, Tepus, Kec. Tepus, Kabupaten Gunung Kidul";"DAERAH ISTIMEWA YOGYAKARTA";"55881";"Indonesia";"";"";"";"-8.153445";"110.6180005";"https://maps.google.com/?cid=0x0:0x9dfac6c4be7946fe";""
"cafe";"Kedai Kopi";"Rumah Tendibayu";"RMXQ+876, Nagnde Ande, Purwodadi, Kec. Tepus, Kabupaten Gunung Kidul, Daerah Istimewa Yogyakarta 55881";"Nagnde Ande, Purwodadi, Kec. Tepus, Kabupaten Gunung Kidul";"DAERAH ISTIMEWA YOGYAKARTA";"55881";"Indonesia";"";"";"";"-8.1517031";"110.6881303";"https://maps.google.com/?cid=0x0:0x238a8dd6afc5869d";""
"cafe";"Sarapan";"Gorengan mbok lengges (ꦒꦺꦴꦫꦺꦔꦤ꧀ꦩ꧀ꦧꦺꦴꦏ꧀ꦊꦁꦒꦼꦱ꧀)";"VJHX+G8V, Pacungan, Walangan, Kec. Tepus, Kabupaten Gunung Kidul, Daerah Istimewa Yogyakarta 55881";"Pacungan, Walangan, Kec. Tepus, Kabupaten Gunung Kidul";"DAERAH ISTIMEWA YOGYAKARTA";"55881";"Indonesia";"";"";"";"-8.121138";"110.6482867";"https://maps.google.com/?cid=0x0:0x65c4dca0b84188a3";""
