Category;Real Category;Business Name;Address;City;State;Postal Code;Country;Phone;Email;Website;Latitude;Longitude;Map Link;Details Link
"hotel";"hotel";"Hotel Cyka Raya";"2HFX+MH6, Jl. KRT Judodiningrat, Seneng, Siraman, Kec. Wonosari, Kabupaten Gunung Kidul, Daerah Istimewa Yogyakarta 55881";"Jl. KRT Judodiningrat, Seneng, Siraman, Kec. Wonosari, Kabupaten Gunung Kidul";"DAERAH ISTIMEWA YOGYAKARTA";"55881";"Indonesia";" 0274392030";"";"";"-7.9758425";"110.5989016";"https://maps.google.com/?cid=0x0:0xda65348bc076439d";""
"hotel";"hotel";"The Mulyo - Homestay";"Jalan Wunut, Dungabah 1 RW No.8, Dungabah I, Duwet, Kec. Wonosari, Kabupaten Gunung Kidul, Daerah Istimewa Yogyakarta 55851";"Dungabah 1 RW No.8, Dungabah I, Duwet, Kec. Wonosari, Kabupaten Gunung Kidul";"DAERAH ISTIMEWA YOGYAKARTA";"55851";"Indonesia";" 087878555266";"";"";"-7.9942725";"110.5920867";"https://maps.google.com/?cid=0x0:0x1ad3c70c601bde3c";""
"hotel";"hotel";"BeGe HOMESTAY";"Jl. Dewandaru No.55, Madusari, Kec. Wonosari, Kabupaten Gunung Kidul, Daerah Istimewa Yogyakarta 55851";"Madusari, Kec. Wonosari, Kabupaten Gunung Kidul";"DAERAH ISTIMEWA YOGYAKARTA";"55851";"Indonesia";" 02129707600";"";"";"-7.9688165";"110.6003059";"https://maps.google.com/?cid=0x0:0x17968dc42adc1ab2";""
"hotel";"hotel";"Wonosari";"Kec. Wonosari, Kabupaten Gunung Kidul, Daerah Istimewa Yogyakarta";"Kabupaten Gunung Kidul, Daerah Istimewa Yogyakarta";"DAERAH ISTIMEWA YOGYAKARTA";"";"Indonesia";"";"";"";"-7.9655412";"110.6008827";"https://maps.google.com/?cid=0x0:0x1d9d005a0dcd50c3";""
"hotel";"hotel";"RedDoorz Syariah near Alun Alun Wonosari";"Jl. Baron No.34, RW.1, Purwosari, Baleharjo, Kec. Wonosari, Kabupaten Gunung Kidul, Daerah Istimewa Yogyakarta 55811";"RW.1, Purwosari, Baleharjo, Kec. Wonosari, Kabupaten Gunung Kidul";"DAERAH ISTIMEWA YOGYAKARTA";"55811";"Indonesia";" 0895417300072";"";"";"-7.9721627";"110.6022846";"https://maps.google.com/?cid=0x0:0x942e9b91aa2047db";""
"hotel";"hotel";"Hotel Santika Gunungkidul - Jogja";"Jl. Jogja - Wonosari No.KM. 3.5, Logandeng, Kec. Playen, Kabupaten Gunung Kidul, Daerah Istimewa Yogyakarta 55861";"Logandeng, Kec. Playen, Kabupaten Gunung Kidul";"DAERAH ISTIMEWA YOGYAKARTA";"55861";"Indonesia";" 02742902000";"";"/url?q>>u003dhttps://www.mysantika.com/indonesia/gunung-kidul/hotel-santika-gunungkidul/>>u0026opi>>u003d79508299>>u0026sa>>u003dU>>u0026ved>>u003d0ahUKEwiVyKagw4CMAxUxxzgGHde2OvoQ61gIFigS>>u0026usg>>u003dAOvVaw2DH_wzbJQHFHKIV74yjCJw";"-7.9386531";"110.5759683";"https://maps.google.com/?cid=0x0:0x1552c34b694723d5";""
"hotel";"hotel";"D'Ninetysix Inn Hotel Gunungkidul";"Jl. Jogja - Wonosari No.Km 3, RW.5, Plumbon Kidul, Logandeng, Kec. Playen, Kabupaten Gunung Kidul, Daerah Istimewa Yogyakarta";"Kabupaten Gunung Kidul, Daerah Istimewa Yogyakarta";"DAERAH ISTIMEWA YOGYAKARTA";"";"Indonesia";" 081239483314";"";"";"-7.9386619";"110.5756093";"https://maps.google.com/?cid=0x0:0xb6ecd7a62c7d9477";""
"hotel";"hotel";"Dea Lokha HOTEL";"Jl. KH Agus Salim No.148, Ledoksari, Kepek, Kec. Wonosari, Kabupaten Gunung Kidul, Daerah Istimewa Yogyakarta 55813";"Ledoksari, Kepek, Kec. Wonosari, Kabupaten Gunung Kidul";"DAERAH ISTIMEWA YOGYAKARTA";"55813";"Indonesia";" 082138137696";"";"";"-7.9563827";"110.5918885";"https://maps.google.com/?cid=0x0:0xd82c70d83166eed4";""
"hotel";"hotel";"N/A";"";"";"DAERAH ISTIMEWA YOGYAKARTA";"";"Indonesia";"";"";"";"";"";"https://maps.google.com/?cid=0x0:0xc2a91e4b9a049c41%7C/g/11bvt40dbm%7Cen-ID";""
"hotel";"hotel";"Homestay Joglo Beji";"3HP8+85W, Gading VII, Gading, Kec. Playen, Kabupaten Gunung Kidul, Daerah Istimewa Yogyakarta 55861";"Gading VII, Gading, Kec. Playen, Kabupaten Gunung Kidul";"DAERAH ISTIMEWA YOGYAKARTA";"55861";"Indonesia";" 082226307000";"";"";"-7.9141674";"110.5656427";"https://maps.google.com/?cid=0x0:0xc0038c1fe76fa89d";""
"hotel";"hotel";"Omah Artho Moro";"Jl. Kenanga No.16, Purbosari, Wonosari, Kec. Wonosari, Kabupaten Gunung Kidul, Daerah Istimewa Yogyakarta 55851";"Purbosari, Wonosari, Kec. Wonosari, Kabupaten Gunung Kidul";"DAERAH ISTIMEWA YOGYAKARTA";"55851";"Indonesia";" 087839858547";"";"";"-7.9672658";"110.6039922";"https://maps.google.com/?cid=0x0:0xff35fe2784294f4a";""
"hotel";"hotel";"Litto (Little Tokyo) Jogja";"Gn. Cilik, Muntuk, Kec. Dlingo, Kabupaten Bantul, Daerah Istimewa Yogyakarta 55783";"Muntuk, Kec. Dlingo, Kabupaten Bantul";"DAERAH ISTIMEWA YOGYAKARTA";"55783";"Indonesia";" 081226927555";"";"/url?q>>u003dhttp://www.littojogja.com/>>u0026opi>>u003d79508299>>u0026sa>>u003dU>>u0026ved>>u003d0ahUKEwj8nuKhw4CMAxWEcGwGHTNwK5kQ61gIFigS>>u0026usg>>u003dAOvVaw2GwpGEuC6fMwlwvP59t4QR";"-7.8955224";"110.4399784";"https://maps.google.com/?cid=0x0:0x517695ab6727d62";""
"hotel";"hotel";"Omah NgGunung";"Jl. Dewandaru Jl. Madusari No.66, Madusari, Kepek, Kec. Wonosari, Kabupaten Gunung Kidul, Daerah Istimewa Yogyakarta 55813";"Madusari, Kepek, Kec. Wonosari, Kabupaten Gunung Kidul";"DAERAH ISTIMEWA YOGYAKARTA";"55813";"Indonesia";" 081914202299";"";"";"-7.968984";"110.5986406";"https://maps.google.com/?cid=0x0:0x285b20837658484b";""
"hotel";"hotel";"Kenewae Living Near Alun-alun Wonosari Mitra RedDoorz";"Jl. Brigjen Katamso No.59, Gadungsari, Wonosari, Kec. Wonosari, Kabupaten Gunung Kidul, Daerah Istimewa Yogyakarta 55812";"Gadungsari, Wonosari, Kec. Wonosari, Kabupaten Gunung Kidul";"DAERAH ISTIMEWA YOGYAKARTA";"55812";"Indonesia";" 0895417300072";"";"";"-7.9691094";"110.6045372";"https://maps.google.com/?cid=0x0:0x4ccae0c7fa4aa90d";""
"hotel";"hotel";"Wulenpari";"Jelok, Beji, Kec. Patuk, Kabupaten Gunung Kidul, Daerah Istimewa Yogyakarta 55862";"Beji, Kec. Patuk, Kabupaten Gunung Kidul";"DAERAH ISTIMEWA YOGYAKARTA";"55862";"Indonesia";" 087839427171";"";"";"-7.8856773";"110.5121019";"https://maps.google.com/?cid=0x0:0xb92f34dfdc406846";""
"hotel";"hotel";"N/A";"";"";"DAERAH ISTIMEWA YOGYAKARTA";"";"Indonesia";"";"";"";"";"";"https://maps.google.com/?cid=0x0:0x93f879c946476968%7C/g/11c54_0krg%7Cen-ID";""
"hotel";"hotel";"Prime Cailendra Hotel";"Jl. Taman Siswa No.91, Wirogunan, Kec. Mergangsan, Kota Yogyakarta, Daerah Istimewa Yogyakarta 55111";"Wirogunan, Kec. Mergangsan, Kota Yogyakarta";"DAERAH ISTIMEWA YOGYAKARTA";"55111";"Indonesia";" 0895417300072";"";"";"-7.810462";"110.377238";"https://maps.google.com/?cid=0x0:0x93f879c946476968";""
"hotel";"hotel";"Calida Hotel RedPartner near Alun Alun Wonosari";"Jl. KH Agus Salim No.7, Kepek I, Kepek, Kec. Wonosari, Kabupaten Gunung Kidul, Daerah Istimewa Yogyakarta 55813";"Kepek I, Kepek, Kec. Wonosari, Kabupaten Gunung Kidul";"DAERAH ISTIMEWA YOGYAKARTA";"55813";"Indonesia";" 0274391152";"";"";"-7.9638477";"110.5984187";"https://maps.google.com/?cid=0x0:0xbf49aca77bfcc850";""
"hotel";"hotel";"Penginapan Rudi";"4FC4+X3R, Jl. Patuk - Dlingo, Pantirejo, Terong, Kec. Dlingo, Kabupaten Bantul, Daerah Istimewa Yogyakarta 55783";"Jl. Patuk - Dlingo, Pantirejo, Terong, Kec. Dlingo, Kabupaten Bantul";"DAERAH ISTIMEWA YOGYAKARTA";"55783";"Indonesia";"";"";"/url?q>>u003dhttp://penginapanrudi.zoombookdirect.com/>>u0026opi>>u003d79508299>>u0026sa>>u003dU>>u0026ved>>u003d0ahUKEwjl_Omjw4CMAxXi1DgGHf3qMUYQ61gIESgN>>u0026usg>>u003dAOvVaw26aP4pNd-CCQQqPmmPHDQB";"-7.8775176";"110.4551504";"https://maps.google.com/?cid=0x0:0x5703ade2415e09c8";""
"hotel";"hotel";"BeGe HOMESTAY";"Jl. Dewandaru No.55, Madusari, Kec. Wonosari, Kabupaten Gunung Kidul, Daerah Istimewa Yogyakarta 55851";"Madusari, Kec. Wonosari, Kabupaten Gunung Kidul";"DAERAH ISTIMEWA YOGYAKARTA";"55851";"Indonesia";" 02129707600";"";"";"-7.9688165";"110.6003059";"https://maps.google.com/?cid=0x0:0x17968dc42adc1ab2";""
"hotel";"hotel";"Hotel Cyka Raya";"2HFX+MH6, Jl. KRT Judodiningrat, Seneng, Siraman, Kec. Wonosari, Kabupaten Gunung Kidul, Daerah Istimewa Yogyakarta 55881";"Jl. KRT Judodiningrat, Seneng, Siraman, Kec. Wonosari, Kabupaten Gunung Kidul";"DAERAH ISTIMEWA YOGYAKARTA";"55881";"Indonesia";" 0274392030";"";"";"-7.9758425";"110.5989016";"https://maps.google.com/?cid=0x0:0xda65348bc076439d";""
"hotel";"hotel";"The Mulyo - Homestay";"Jalan Wunut, Dungabah 1 RW No.8, Dungabah I, Duwet, Kec. Wonosari, Kabupaten Gunung Kidul, Daerah Istimewa Yogyakarta 55851";"Dungabah 1 RW No.8, Dungabah I, Duwet, Kec. Wonosari, Kabupaten Gunung Kidul";"DAERAH ISTIMEWA YOGYAKARTA";"55851";"Indonesia";" 087878555266";"";"";"-7.9942725";"110.5920867";"https://maps.google.com/?cid=0x0:0x1ad3c70c601bde3c";""
"hotel";"hotel";"Wisma Handayani Syariah";"Jl. Taman Bakti No.25, Jeruksari, Wonosari, Kec. Wonosari, Kabupaten Gunung Kidul, Daerah Istimewa Yogyakarta 55813";"Jeruksari, Wonosari, Kec. Wonosari, Kabupaten Gunung Kidul";"DAERAH ISTIMEWA YOGYAKARTA";"55813";"Indonesia";" 0895417300072";"";"";"-7.9601523";"110.6032528";"https://maps.google.com/?cid=0x0:0x2bbacf92b0323ab5";""
"hotel";"hotel";"VILLA OPA DOEL";"Sendangsari, Terong, Kec. Dlingo, Kabupaten Bantul, Daerah Istimewa Yogyakarta 55783";"Terong, Kec. Dlingo, Kabupaten Bantul";"DAERAH ISTIMEWA YOGYAKARTA";"55783";"Indonesia";" 081217058780";"";"";"-7.8718886";"110.4608612";"https://maps.google.com/?cid=0x0:0xe740b59b1076f4a6";""
"hotel";"hotel";"D'TRUST HOMESTAY WONOSARI GUNUNGKIDUL";"Jl. Nusantara, Ledoksari, Kepek, Kec. Wonosari, Kabupaten Gunung Kidul, Daerah Istimewa Yogyakarta 55813";"Ledoksari, Kepek, Kec. Wonosari, Kabupaten Gunung Kidul";"DAERAH ISTIMEWA YOGYAKARTA";"55813";"Indonesia";" 081338858232";"";"";"-7.9537162";"110.5933675";"https://maps.google.com/?cid=0x0:0x6498e136084e6581";""
"hotel";"hotel";"Homestay Arva komplek pindul(Nyamplung)";"Gelaran I, Bejiharjo, Kec. Karangmojo, Kabupaten Gunung Kidul, Daerah Istimewa Yogyakarta 55891";"Bejiharjo, Kec. Karangmojo, Kabupaten Gunung Kidul";"DAERAH ISTIMEWA YOGYAKARTA";"55891";"Indonesia";" 02129707601";"";"/url?q>>u003dhttps://www.oyorooms.com/245159/>>u0026opi>>u003d79508299>>u0026sa>>u003dU>>u0026ved>>u003d0ahUKEwi2y7-lw4CMAxUY4zgGHUyHLCoQ61gIFigS>>u0026usg>>u003dAOvVaw1lIwPasqYfsCyp6dqJSsRl";"-7.9264375";"110.6460625";"https://maps.google.com/?cid=0x0:0x894d333a36c6c2e1";""
"hotel";"hotel";"Kec. Playen";"Kabupaten Gunung Kidul, Daerah Istimewa Yogyakarta";"Kabupaten Gunung Kidul, Daerah Istimewa Yogyakarta";"DAERAH ISTIMEWA YOGYAKARTA";"";"Indonesia";"";"";"";"-7.9438551";"110.5500626";"https://maps.google.com/?cid=0x0:0x16772e0cffafd09e";""
"hotel";"hotel";"The New Orlinds Guest House";"Jl. Goa Pindul pos-2, Gunungbang, Bejiharjo, Kec. Karangmojo, Kabupaten Gunung Kidul, Daerah Istimewa Yogyakarta 55891";"Gunungbang, Bejiharjo, Kec. Karangmojo, Kabupaten Gunung Kidul";"DAERAH ISTIMEWA YOGYAKARTA";"55891";"Indonesia";" 081328077444";"";"/url?q>>u003dhttp://www.orlindsguesthouse.com/>>u0026opi>>u003d79508299>>u0026sa>>u003dU>>u0026ved>>u003d0ahUKEwih6KGmw4CMAxU44zgGHeuxKUwQ61gIFigS>>u0026usg>>u003dAOvVaw3aX2USB2jsXaZw6GQqoAGS";"-7.9261418";"110.6464141";"https://maps.google.com/?cid=0x0:0x50e24c89f6ed526e";""
"hotel";"hotel";"Tilamsari Hotel";"2JM4+5CW, Jl. Mayang, Gadungsari, Wonosari, Kec. Wonosari, Kabupaten Gunung Kidul, Daerah Istimewa Yogyakarta 55851";"Jl. Mayang, Gadungsari, Wonosari, Kec. Wonosari, Kabupaten Gunung Kidul";"DAERAH ISTIMEWA YOGYAKARTA";"55851";"Indonesia";" 0274391219";"";"";"-7.967017";"110.6060936";"https://maps.google.com/?cid=0x0:0x2efa626bf93d7ffa";""
"hotel";"hotel";"Homestay Omahmbesi";"RT 01/09, Gading IX, Gading, Kec. Playen, Kabupaten Gunung Kidul, Daerah Istimewa Yogyakarta 55861";"Gading IX, Gading, Kec. Playen, Kabupaten Gunung Kidul";"DAERAH ISTIMEWA YOGYAKARTA";"55861";"Indonesia";" 081393040963";"";"";"-7.9166173";"110.5773393";"https://maps.google.com/?cid=0x0:0x582bdaf894534576";""
"hotel";"hotel";""nGGon Toeroe" Kost  Homestay Syariah";"Kemorosari II, Piyaman, Kec. Wonosari, Kabupaten Gunung Kidul, Daerah Istimewa Yogyakarta";"Kabupaten Gunung Kidul, Daerah Istimewa Yogyakarta";"DAERAH ISTIMEWA YOGYAKARTA";"";"Indonesia";" 085624242146";"";"";"-7.9409327";"110.5890326";"https://maps.google.com/?cid=0x0:0x64fedf92ddff4ea";""
"hotel";"hotel";"Griya Limasan Hotel";"Jl. Kecubung, Pandansari, Wonosari, Kec. Wonosari, Kabupaten Gunung Kidul, Daerah Istimewa Yogyakarta 55851";"Pandansari, Wonosari, Kec. Wonosari, Kabupaten Gunung Kidul";"DAERAH ISTIMEWA YOGYAKARTA";"55851";"Indonesia";" 081915496777";"";"/url?q>>u003dhttp://www.hotelgriyalimasan.com/2023/08/pemesanan.html%3Fm%3D1>>u0026opi>>u003d79508299>>u0026sa>>u003dU>>u0026ved>>u003d0ahUKEwj4kKqnw4CMAxWryDgGHTHSI6cQ61gIFigS>>u0026usg>>u003dAOvVaw1LnmCVip1HFwPiHIMmxvaC";"-7.9648727";"110.6089885";"https://maps.google.com/?cid=0x0:0x4dc04ff3f9990263";""
"hotel";"hotel";"Contana Hotel Glamping";"Plesedan rt7, Patuk, Srimulyo, Kec. Piyungan, Kabupaten Bantul, Daerah Istimewa Yogyakarta 55792";"Patuk, Srimulyo, Kec. Piyungan, Kabupaten Bantul";"DAERAH ISTIMEWA YOGYAKARTA";"55792";"Indonesia";" 082324943532";"";"/url?q>>u003dhttps://contanaglamping.com/>>u0026opi>>u003d79508299>>u0026sa>>u003dU>>u0026ved>>u003d0ahUKEwjXhPO3w4CMAxUqSWwGHVXAIDUQ61gIFigS>>u0026usg>>u003dAOvVaw03a3WANYR1Tj-K4YzD1IxH";"-7.8494521";"110.4775963";"https://maps.google.com/?cid=0x0:0x376b7b3308eac922";""
"hotel";"hotel";"Maryam Homestay";"Patuk, Kec. Patuk, Kabupaten Gunung Kidul, Daerah Istimewa Yogyakarta 55862";"Kec. Patuk, Kabupaten Gunung Kidul";"DAERAH ISTIMEWA YOGYAKARTA";"55862";"Indonesia";" 081904154292";"";"";"-7.8496925";"110.4856749";"https://maps.google.com/?cid=0x0:0x557becc4b0a28170";""
"hotel";"hotel";"Hotel Santika Gunungkidul - Jogja";"Jl. Jogja - Wonosari No.KM. 3.5, Logandeng, Kec. Playen, Kabupaten Gunung Kidul, Daerah Istimewa Yogyakarta 55861";"Logandeng, Kec. Playen, Kabupaten Gunung Kidul";"DAERAH ISTIMEWA YOGYAKARTA";"55861";"Indonesia";" 02742902000";"";"/url?q>>u003dhttps://www.mysantika.com/indonesia/gunung-kidul/hotel-santika-gunungkidul/>>u0026opi>>u003d79508299>>u0026sa>>u003dU>>u0026ved>>u003d0ahUKEwjakbC4w4CMAxXzyzgGHbOAFRUQ61gIFigS>>u0026usg>>u003dAOvVaw1PL2rrm8uKCapLrYypFiRj";"-7.9386531";"110.5759683";"https://maps.google.com/?cid=0x0:0x1552c34b694723d5";""
"hotel";"hotel";"D'Ninetysix Inn Hotel Gunungkidul";"Jl. Jogja - Wonosari No.Km 3, RW.5, Plumbon Kidul, Logandeng, Kec. Playen, Kabupaten Gunung Kidul, Daerah Istimewa Yogyakarta";"Kabupaten Gunung Kidul, Daerah Istimewa Yogyakarta";"DAERAH ISTIMEWA YOGYAKARTA";"";"Indonesia";" 081239483314";"";"";"-7.9386619";"110.5756093";"https://maps.google.com/?cid=0x0:0xb6ecd7a62c7d9477";""
"hotel";"hotel";"Rumpal Cafe dan Vila Patuk Gunungkidul";"Patuk, Kec. Patuk, Kabupaten Gunung Kidul, Daerah Istimewa Yogyakarta 78810";"Kec. Patuk, Kabupaten Gunung Kidul";"DAERAH ISTIMEWA YOGYAKARTA";"78810";"Indonesia";" 081915456074";"";"";"-7.8472682";"110.4793568";"https://maps.google.com/?cid=0x0:0x7df77d011813eb1a";""
"hotel";"hotel";"Wulenpari";"Jelok, Beji, Kec. Patuk, Kabupaten Gunung Kidul, Daerah Istimewa Yogyakarta 55862";"Beji, Kec. Patuk, Kabupaten Gunung Kidul";"DAERAH ISTIMEWA YOGYAKARTA";"55862";"Indonesia";" 087839427171";"";"";"-7.8856773";"110.5121019";"https://maps.google.com/?cid=0x0:0xb92f34dfdc406846";""
"hotel";"hotel";"Penginapan Rudi";"4FC4+X3R, Jl. Patuk - Dlingo, Pantirejo, Terong, Kec. Dlingo, Kabupaten Bantul, Daerah Istimewa Yogyakarta 55783";"Jl. Patuk - Dlingo, Pantirejo, Terong, Kec. Dlingo, Kabupaten Bantul";"DAERAH ISTIMEWA YOGYAKARTA";"55783";"Indonesia";"";"";"";"-7.8775176";"110.4551504";"https://maps.google.com/?cid=0x0:0x5703ade2415e09c8";""
"hotel";"hotel";"Litto (Little Tokyo) Jogja";"Gn. Cilik, Muntuk, Kec. Dlingo, Kabupaten Bantul, Daerah Istimewa Yogyakarta 55783";"Muntuk, Kec. Dlingo, Kabupaten Bantul";"DAERAH ISTIMEWA YOGYAKARTA";"55783";"Indonesia";" 081226927555";"";"/url?q>>u003dhttp://www.littojogja.com/>>u0026opi>>u003d79508299>>u0026sa>>u003dU>>u0026ved>>u003d0ahUKEwiL5Py5w4CMAxWNoGMGHT_bKMwQ61gIFigS>>u0026usg>>u003dAOvVaw3VH6RPDtEUBS76M9IPuZrd";"-7.8955224";"110.4399784";"https://maps.google.com/?cid=0x0:0x517695ab6727d62";""
"hotel";"hotel";"Villa Gunung Purba View";"Jl. Piyungan - Ngoro Oro, Sengoran, Ngoro-oro, Kec. Patuk, Kabupaten Gunung Kidul, Daerah Istimewa Yogyakarta 55862";"Sengoran, Ngoro-oro, Kec. Patuk, Kabupaten Gunung Kidul";"DAERAH ISTIMEWA YOGYAKARTA";"55862";"Indonesia";" 082135633400";"";"";"-7.83956";"110.5201994";"https://maps.google.com/?cid=0x0:0x95cbe3c0886403b6";""
"hotel";"hotel";"Homestay Joglo Beji";"3HP8+85W, Gading VII, Gading, Kec. Playen, Kabupaten Gunung Kidul, Daerah Istimewa Yogyakarta 55861";"Gading VII, Gading, Kec. Playen, Kabupaten Gunung Kidul";"DAERAH ISTIMEWA YOGYAKARTA";"55861";"Indonesia";" 082226307000";"";"";"-7.9141674";"110.5656427";"https://maps.google.com/?cid=0x0:0xc0038c1fe76fa89d";""
"hotel";"hotel";"Bina Karya Guesthouse Syariah";"Jl. Ngelosari No.RT.01, Jombor, Srimulyo, Kec. Piyungan, Kabupaten Bantul, Daerah Istimewa Yogyakarta 55792";"Jombor, Srimulyo, Kec. Piyungan, Kabupaten Bantul";"DAERAH ISTIMEWA YOGYAKARTA";"55792";"Indonesia";" 089674405860";"";"/url?q>>u003dhttp://binakaryaguesthouse.zoombookdirect.com/>>u0026opi>>u003d79508299>>u0026sa>>u003dU>>u0026ved>>u003d0ahUKEwjZxYK7w4CMAxW-R2cHHSK5DjIQ61gIFigS>>u0026usg>>u003dAOvVaw3Zq5zjsqjalYFnY5cHhyMW";"-7.8573967";"110.4519828";"https://maps.google.com/?cid=0x0:0x854b379bbc2c6664";""
"hotel";"hotel";"Omah Singo stay  resto";"Gunung Wangi, Bangkil, Srimulyo, Kec. Piyungan, Kabupaten Bantul, Daerah Istimewa Yogyakarta 55792";"Bangkil, Srimulyo, Kec. Piyungan, Kabupaten Bantul";"DAERAH ISTIMEWA YOGYAKARTA";"55792";"Indonesia";" 087881888875";"";"";"-7.8221875";"110.4588125";"https://maps.google.com/?cid=0x0:0xd153dbcbf9c159b8";""
"hotel";"hotel";"Sampai Villa Mediterania";"5FQJ+77C, Plembangan, Jogotirto, Kec. Berbah, Kabupaten Sleman, Daerah Istimewa Yogyakarta 55573";"Plembangan, Jogotirto, Kec. Berbah, Kabupaten Sleman";"DAERAH ISTIMEWA YOGYAKARTA";"55573";"Indonesia";" 082144520327";"";"/url?q>>u003dhttps://www.instagram.com/sampaivilla%3Figsh%3DNDRydDgzN2x5a2dx%26utm_source%3Dqr>>u0026opi>>u003d79508299>>u0026sa>>u003dU>>u0026ved>>u003d0ahUKEwixj527w4CMAxUxxzgGHde2OvoQ61gIFSgR>>u0026usg>>u003dAOvVaw1XRV5beVXwaPvpk0Zz_3UQ";"-7.8116549";"110.480676";"https://maps.google.com/?cid=0x0:0x22b597a9b5cf4fe9";""
"hotel";"hotel";"N/A";"";"";"DAERAH ISTIMEWA YOGYAKARTA";"";"Indonesia";"";"";"";"";"";"https://maps.google.com/?cid=0x0:0xcb1d24dc80eea6a3%7C/g/11b6xd4xxc%7Cen-ID";""
"hotel";"hotel";"Kalya Hotel Yogyakarta";"Jl. Gedongkuning No.118, Rejowinangun, Kec. Kotagede, Kota Yogyakarta, Daerah Istimewa Yogyakarta 55171";"Rejowinangun, Kec. Kotagede, Kota Yogyakarta";"DAERAH ISTIMEWA YOGYAKARTA";"55171";"Indonesia";" 0274371225";"";"/url?q>>u003dhttps://kalyahoteljogja.com/>>u0026opi>>u003d79508299>>u0026sa>>u003dU>>u0026ved>>u003d0ahUKEwjVq-e7w4CMAxUbxzgGHUUdEIgQ61gIFigS>>u0026usg>>u003dAOvVaw2aIPLhSKIKoHBk3orcMEXe";"-7.8135318";"110.4014146";"https://maps.google.com/?cid=0x0:0xcb1d24dc80eea6a3";""
"hotel";"hotel";"VIKI -Villa KLENGKONG INDAH-";"Jl. Pleret-Patuk, Sendangsari, Terong, Kec. Dlingo, Kabupaten Bantul, Daerah Istimewa Yogyakarta 55783";"Sendangsari, Terong, Kec. Dlingo, Kabupaten Bantul";"DAERAH ISTIMEWA YOGYAKARTA";"55783";"Indonesia";" 02129707601";"";"/url?q>>u003dhttps://www.oyorooms.com/245156/>>u0026opi>>u003d79508299>>u0026sa>>u003dU>>u0026ved>>u003d0ahUKEwizlJ68w4CMAxWOyjgGHeE2FfgQ61gIFigS>>u0026usg>>u003dAOvVaw33uwac6l3nq3j4CUMSEAWd";"-7.8703035";"110.4607715";"https://maps.google.com/?cid=0x0:0xae542cce939b86f0";""
"hotel";"hotel";"VILLA OPA DOEL";"Sendangsari, Terong, Kec. Dlingo, Kabupaten Bantul, Daerah Istimewa Yogyakarta 55783";"Terong, Kec. Dlingo, Kabupaten Bantul";"DAERAH ISTIMEWA YOGYAKARTA";"55783";"Indonesia";" 081217058780";"";"";"-7.8718886";"110.4608612";"https://maps.google.com/?cid=0x0:0xe740b59b1076f4a6";""
"hotel";"hotel";"Bitu Garden";"Widoro Kulon, Bunder, Kec. Patuk, Kabupaten Gunung Kidul, Daerah Istimewa Yogyakarta 55862";"Bunder, Kec. Patuk, Kabupaten Gunung Kidul";"DAERAH ISTIMEWA YOGYAKARTA";"55862";"Indonesia";" 08121579239";"";"";"-7.8843723";"110.5346742";"https://maps.google.com/?cid=0x0:0x9dbe06ba05d2a277";""
"hotel";"hotel";"Hotel The Margaux Yogyakarta";"Jl. Tri Margo Kulon No.14, Karangwaru, Kec. Tegalrejo, Kota Yogyakarta, Daerah Istimewa Yogyakarta 55241";"Karangwaru, Kec. Tegalrejo, Kota Yogyakarta";"DAERAH ISTIMEWA YOGYAKARTA";"55241";"Indonesia";" 0274563377";"";"/url?q>>u003dhttps://themargaux-yogyakarta.com/>>u0026opi>>u003d79508299>>u0026sa>>u003dU>>u0026ved>>u003d0ahUKEwjCx4G9w4CMAxW-4TgGHYo7OaoQ61gIFigS>>u0026usg>>u003dAOvVaw0S4TUKMQp369mmn0dcAzKV";"-7.7791167";"110.3637741";"https://maps.google.com/?cid=0x0:0xad28e42fdd6d5793";""
"hotel";"hotel";"Calma Jawon Jogja";"JL Wonosari km 8, asri I No.10, Potorono, Kec. Banguntapan, Kabupaten Bantul, Daerah Istimewa Yogyakarta 55573";"asri I No.10, Potorono, Kec. Banguntapan, Kabupaten Bantul";"DAERAH ISTIMEWA YOGYAKARTA";"55573";"Indonesia";" 0811286054";"";"/url?q>>u003dhttps://twospaces.id/property/calma-jawon-jogja>>u0026opi>>u003d79508299>>u0026sa>>u003dU>>u0026ved>>u003d0ahUKEwiskra9w4CMAxXE4zgGHXcrG7cQ61gIFigS>>u0026usg>>u003dAOvVaw2leM46eq5owFv9UItcbEcd";"-7.8253443";"110.4271443";"https://maps.google.com/?cid=0x0:0x1a4917536697dbf2";""
"hotel";"hotel";"Kec. Patuk";"Kabupaten Gunung Kidul, Daerah Istimewa Yogyakarta";"Kabupaten Gunung Kidul, Daerah Istimewa Yogyakarta";"DAERAH ISTIMEWA YOGYAKARTA";"";"Indonesia";"";"";"";"-7.8694517";"110.5195771";"https://maps.google.com/?cid=0x0:0x4027a76e352fdd0";""
"hotel";"hotel";"OYO 94377 Maryam Homestay Syariah 2";"Jl. Jogja - Wonosari, Patuk, Kec. Patuk, Yogyakarta, Daerah Istimewa Yogyakarta 55862";"Patuk, Kec. Patuk, Yogyakarta";"DAERAH ISTIMEWA YOGYAKARTA";"55862";"Indonesia";" 02129707601";"";"";"-7.849559";"110.485685";"https://maps.google.com/?cid=0x0:0x70284710d5e3c7fe";""
"hotel";"hotel";"Kopilimo";"Jl. Patuk Ngoro Oro RT 20 RW 04, Sumber Tetes, Patuk, Kec. Patuk, Kabupaten Gunung Kidul, Daerah Istimewa Yogyakarta 55862";"Sumber Tetes, Patuk, Kec. Patuk, Kabupaten Gunung Kidul";"DAERAH ISTIMEWA YOGYAKARTA";"55862";"Indonesia";" 082135633400";"";"/url?q>>u003dhttp://kopilimo.id/>>u0026opi>>u003d79508299>>u0026sa>>u003dU>>u0026ved>>u003d0ahUKEwjmlpu-w4CMAxWO-jgGHS1TGM4Q61gIFigS>>u0026usg>>u003dAOvVaw3VGkfcaT-LZwe-J1pQex_j";"-7.8406406";"110.4931382";"https://maps.google.com/?cid=0x0:0x5c0269035442d303";""
"hotel";"hotel";"Camping Ground Bukit Tinatar";"Jolosutro No.RT 04, Jombor, Srimulyo, Piyungan, Bantul Regency, Special Region of Yogyakarta 55792";"Jombor, Srimulyo, Piyungan, Bantul Regency";"DAERAH ISTIMEWA YOGYAKARTA";"55792";"Indonesia";" 082137680003";"";"/url?q>>u003dhttps://vacationsstay.eu/camping-ground-bukit-tinatar-indonesia>>u0026opi>>u003d79508299>>u0026sa>>u003dU>>u0026ved>>u003d0ahUKEwj-nb2-w4CMAxW4TmwGHURiNDAQ61gIFigS>>u0026usg>>u003dAOvVaw115UTTfqxPC5Ok2bPo9ZQr";"-7.8592515";"110.4657462";"https://maps.google.com/?cid=0x0:0xf451e96e5175c442";""
"hotel";"hotel";"Camping Ground Watu Amben";"4FRF+G43, pandeyan, Duwen Bintang, Srimulyo, Special Region of Yogyakarta 55792";"pandeyan, Duwen Bintang, Srimulyo";"DAERAH ISTIMEWA YOGYAKARTA";"55792";"Indonesia";" 082137680003";"";"";"-7.8587277";"110.4727824";"https://maps.google.com/?cid=0x0:0x6ee71d9ec5ca3f2e";""
"hotel";"hotel";"Homestay Joglo Beji";"3HP8+85W, Gading VII, Gading, Kec. Playen, Kabupaten Gunung Kidul, Daerah Istimewa Yogyakarta 55861";"Gading VII, Gading, Kec. Playen, Kabupaten Gunung Kidul";"DAERAH ISTIMEWA YOGYAKARTA";"55861";"Indonesia";" 082226307000";"";"";"-7.9141674";"110.5656427";"https://maps.google.com/?cid=0x0:0xc0038c1fe76fa89d";""
"hotel";"hotel";"Villa Gunung Purba View";"Jl. Piyungan - Ngoro Oro, Sengoran, Ngoro-oro, Kec. Patuk, Kabupaten Gunung Kidul, Daerah Istimewa Yogyakarta 55862";"Sengoran, Ngoro-oro, Kec. Patuk, Kabupaten Gunung Kidul";"DAERAH ISTIMEWA YOGYAKARTA";"55862";"Indonesia";" 082135633400";"";"";"-7.83956";"110.5201994";"https://maps.google.com/?cid=0x0:0x95cbe3c0886403b6";""
"hotel";"hotel";"Front One Resort Jogja";"Jl. Ring Road Utara No.186, Ngringin, Mancasan Kidul, Kec. Depok, Kabupaten Sleman, Daerah Istimewa Yogyakarta 55282";"Ngringin, Mancasan Kidul, Kec. Depok, Kabupaten Sleman";"DAERAH ISTIMEWA YOGYAKARTA";"55282";"Indonesia";" 08170977977";"";"/url?q>>u003dhttps://azanahotel.com/hotel/front-one-resort-jogja>>u0026opi>>u003d79508299>>u0026sa>>u003dU>>u0026ved>>u003d0ahUKEwjDwJTOw4CMAxUiUGwGHUJfBR4Q61gIFigS>>u0026usg>>u003dAOvVaw0Bp_p7468ygK1EoKtRHsL8";"-7.7624247";"110.4160753";"https://maps.google.com/?cid=0x0:0x279d5c4b74031c63";""
"hotel";"hotel";"FORRIZ Hotel Yogyakarta";"Jl. HOS Cokroaminoto No.60, Pakuncen, Wirobrajan, Kota Yogyakarta, Daerah Istimewa Yogyakarta 55253";"Pakuncen, Wirobrajan, Kota Yogyakarta";"DAERAH ISTIMEWA YOGYAKARTA";"55253";"Indonesia";"  kolam renang (kecil), gazebo, tempat olahraga mini, ballroom.>>";"";"/url?q>>u003dhttps://www.forrizhotels.com/>>u0026opi>>u003d79508299>>u0026sa>>u003dU>>u0026ved>>u003d0ahUKEwil9bnOw4CMAxW9zTgGHaPNJ-4Q61gIFigS>>u0026usg>>u003dAOvVaw0CSvTHT-O1HwJrueurY5Yw";"-7.7954415";"110.3535053";"https://maps.google.com/?cid=0x0:0x2a562cbb3d5af40c";""
"hotel";"hotel";"N/A";"";"";"DAERAH ISTIMEWA YOGYAKARTA";"";"Indonesia";"";"";"";"";"";"https://maps.google.com/?cid=0x0:0x2a562cbb3d5af40c%7C/g/11dfgsvsvs%7Cen-ID";""
"hotel";"hotel";"Cokro Hinggil Resort";"Jl. Bimomartani No.3, Area Sawah, Bimomartani, Kec. Ngemplak, Kabupaten Sleman, Daerah Istimewa Yogyakarta 55584";"Area Sawah, Bimomartani, Kec. Ngemplak, Kabupaten Sleman";"DAERAH ISTIMEWA YOGYAKARTA";"55584";"Indonesia";" 081390632933";"";"";"-7.7001163";"110.4574976";"https://maps.google.com/?cid=0x0:0x2292428d14316970";""
"hotel";"hotel";"Taman Watu Resort Gunung Kidul";"VFV7+H49, Bolang, Girikarto, Kec. Panggang, Kabupaten Gunung Kidul, Daerah Istimewa Yogyakarta 55872";"Bolang, Girikarto, Kec. Panggang, Kabupaten Gunung Kidul";"DAERAH ISTIMEWA YOGYAKARTA";"55872";"Indonesia";"";"";"";"-8.1061166";"110.4633573";"https://maps.google.com/?cid=0x0:0x30204f7140e89bb3";""
