Category,Real Category,Business Name,Address,City,State,Postal Code,Country,Phone,Email,Website,Latitude,Longitude,Map Link,Details Link
mall,Toko Sepatu,SHOESKLUNGKUNG_,"F95V+CR8, Jl. Raya Batu Tabih, Semarapura Kelod, Kec. Klungkung, Kabupaten Klungkung, Bali 80716","Jl. Raya Batu Tabih, Semarapura Kelod, Kec. Klungkung, Kabupaten Klungkung",BALI,80716.0,Indonesia,83114420015.0,,,-85.414.648,1.153.945.694,https://maps.google.com/?cid=0x0:0x98c0ea1f050ae4f7,
mall,Pasar,Toko puspa Agung -Didalam Pasar Seni Semarapura klungkung bali.,"Jl. Diponegoro No.16, Semarapura Kelod Kangin, Kec. Klungkung, Kabupaten Klungkung, Bali 80761","Semarapura Kelod Kangin, Kec. Klungkung, Kabupaten Klungkung",BALI,80761.0,Indonesia,81229230891.0,,,-85.354.833,115.404.216,https://maps.google.com/?cid=0x0:0x8d7b7e7cc6e557d9,
mall,Pusat Perbelanjaan,CEMERLANG FLAMBOYAN,"Jl. Raya Batu Tabih No.63, Semarapura Kelod, Kec. Klungkung, Kabupaten Klungkung, Bali 80716","Semarapura Kelod, Kec. Klungkung, Kabupaten Klungkung",BALI,80716.0,Indonesia,36621418.0,,,-85.414.682,1.153.948.994,https://maps.google.com/?cid=0x0:0xde6773d568428e2d,
mall,Pusat Perbelanjaan,MIC Store,"CCV6+RM7, Kp. Gelgel, Kec. Klungkung, Kabupaten Klungkung, Bali 80761","Kp. Gelgel, Kec. Klungkung, Kabupaten Klungkung",BALI,80761.0,Indonesia,85954130363.0,,,-85.554.516,1.154.116.864,https://maps.google.com/?cid=0x0:0x975466d1530894da,
mall,Pusat Perbelanjaan,GAMELAN,"Jl. Raya Tihingan No.21, Tihingan, Kec. Banjarangkan, Kabupaten Klungkung, Bali 80716","Tihingan, Kec. Banjarangkan, Kabupaten Klungkung",BALI,80716.0,Indonesia,89651323642.0,,,-85.303.317,1.153.829.968,https://maps.google.com/?cid=0x0:0x828f849c48335ce8,
mall,Pasar,Pasar Umum Klungkung,"Jl. Puputan No.7, Semarapura Kangin, Kec. Klungkung, Kabupaten Klungkung, Bali 80761","Semarapura Kangin, Kec. Klungkung, Kabupaten Klungkung",BALI,80761.0,Indonesia,,,,-85.371.512,1.154.046.376,https://maps.google.com/?cid=0x0:0x655915630f00f0a5,
mall,Pusat Perbelanjaan,Widii_karya gambelan,"F99M+FFH, Tihingan, Kec. Banjarangkan, Kabupaten Klungkung, Bali 80716","Tihingan, Kec. Banjarangkan, Kabupaten Klungkung",BALI,80716.0,Indonesia,,,,-8.531.484,115.384.223,https://maps.google.com/?cid=0x0:0x28b33605b5370e92,
mall,Pusat Perbelanjaan,QIQIMART KLUNGKUNG,"Semarapura Kelod Kangin, Kec. Klungkung, Kabupaten Klungkung, Bali","Kabupaten Klungkung, Bali",BALI,,Indonesia,81337770564.0,,,-85.318.909,1.154.067.139,https://maps.google.com/?cid=0x0:0x5354edccf9490b23,
mall,Toko Makanan,Toko Saputra,"Jl. Flamboyan No.37, Semarapura Kauh, Kec. Klungkung, Kabupaten Klungkung, Bali 80716","Semarapura Kauh, Kec. Klungkung, Kabupaten Klungkung",BALI,80716.0,Indonesia,,,,-8.538.351,115.395.354,https://maps.google.com/?cid=0x0:0x6a5be7667ce2e9e0,
mall,Toko Pakaian,Arjuna Bali,"G9MR+4R4, Nyanglan, Banjarangkan, Nyanglan, Kec. Klungkung, Kabupaten Klungkung, Bali 80752","Nyanglan, Banjarangkan, Nyanglan, Kec. Klungkung, Kabupaten Klungkung",BALI,80752.0,Indonesia,81337215737.0,,,-84.672.317,1.153.920.662,https://maps.google.com/?cid=0x0:0xe8d6aec5417e946,
mall,Pusat Perbelanjaan,Clandy's Mart Klungkung,"Jl. Ngurah Rai No.10, Semarapura Kauh, Kec. Klungkung, Kabupaten Klungkung, Bali 80716","Semarapura Kauh, Kec. Klungkung, Kabupaten Klungkung",BALI,80716.0,Indonesia,87761299130.0,,,-8.533.107,115.397.265,https://maps.google.com/?cid=0x0:0x3b17e2ccd55271bf,
mall,Kantor Perusahaan,Ud. PANDE KUSUMA BARGAWA GONG,"F98M+96M, Tihingan, Kec. Banjarangkan, Kabupaten Klungkung, Bali 80713","Tihingan, Kec. Banjarangkan, Kabupaten Klungkung",BALI,80713.0,Indonesia,81936238424.0,,,-85.340.484,1.153.830.325,https://maps.google.com/?cid=0x0:0x59af5bba6dd990a1,
mall,Toko,Wangga foto copy,"Jl. Flamboyan No.48, Semarapura Kauh, Kec. Klungkung, Kabupaten Klungkung, Bali 80716","Semarapura Kauh, Kec. Klungkung, Kabupaten Klungkung",BALI,80716.0,Indonesia,,,,-85.405.717,1.153.949.121,https://maps.google.com/?cid=0x0:0x3bff3dc0adbd1b5d,
mall,Kedai Pernak-pernik,SA.AccessoriesMotor,"Jl. Flamboyan No.13, Semarapura Kelod, Kec. Klungkung, Kabupaten Klungkung, Bali 80711","Semarapura Kelod, Kec. Klungkung, Kabupaten Klungkung",BALI,80711.0,Indonesia,81246742192.0,,,-85.358.894,1.153.962.393,https://maps.google.com/?cid=0x0:0x1973aa86bcd6740d,
mall,Kantor Pemerintah,Mal Pelayanan Publik (MPP) Kabupaten Klungkung,"Jl. Gajah Mada No.50, Semarapura Kelod Kangin, Kec. Klungkung, Kabupaten Klungkung, Bali 80761","Semarapura Kelod Kangin, Kec. Klungkung, Kabupaten Klungkung",BALI,80761.0,Indonesia,,,,-85.307.734,1.154.048.376,https://maps.google.com/?cid=0x0:0x4ad8165955693918,
mall,Toko,Al2 Store,"FC45+QX4, Kamasan, Kec. Klungkung, Kabupaten Klungkung, Bali 80761","Kamasan, Kec. Klungkung, Kabupaten Klungkung",BALI,80761.0,Indonesia,81353319397.0,,,-85.431.161,1.154.099.533,https://maps.google.com/?cid=0x0:0xe4c4661e40ad36ab,
mall,Grosir,Mawar Collection,"C9WW+4V2, Satra, Kec. Klungkung, Kabupaten Klungkung, Bali 80716","Satra, Kec. Klungkung, Kabupaten Klungkung",BALI,80716.0,Indonesia,87777962669.0,,,-85.547.378,1.153.971.555,https://maps.google.com/?cid=0x0:0xa8b0bacaddcc7b8f,
mall,Produsen makanan,Nanta Produksi Kripik,"F96J+925, Getakan, Kec. Banjarangkan, Kabupaten Klungkung, Bali 80752","Getakan, Kec. Banjarangkan, Kabupaten Klungkung",BALI,80752.0,Indonesia,81936255447.0,,,-85.391.137,1.153.801.094,https://maps.google.com/?cid=0x0:0x56e61103696334bc,
mall,Pusat Perbelanjaan,Gong Yoga Pande Lanus,"F98M+C8X, Tihingan, Kec. Banjarangkan, Kabupaten Klungkung, Bali 80713","Tihingan, Kec. Banjarangkan, Kabupaten Klungkung",BALI,80713.0,Indonesia,,,,-85.338.979,1.153.833.465,https://maps.google.com/?cid=0x0:0x608d6c730d6e81de,
mall,Pusat Perbelanjaan,Yoga Gamelan Maker,"F99P+G6C, Tihingan, Kec. Banjarangkan, Kabupaten Klungkung, Bali","Kabupaten Klungkung, Bali",BALI,,Indonesia,8563745484.0,,,-85.311.977,1.153.855.167,https://maps.google.com/?cid=0x0:0x7d28e8d3e2724189,
mall,Pusat Perbelanjaan,Warung Nasib,"F9FJ+WHF, Tihingan, Kec. Banjarangkan, Kabupaten Klungkung, Bali 80716","Tihingan, Kec. Banjarangkan, Kabupaten Klungkung",BALI,80716.0,Indonesia,,,,-85.251.973,1.153.814.203,https://maps.google.com/?cid=0x0:0x74ac4be72c27d2e4,
mall,mall,Semarapura,"Kec. Klungkung, Kabupaten Klungkung, Bali","Kabupaten Klungkung, Bali",BALI,,Indonesia,,,,-85.388.252,115.402.367,https://maps.google.com/?cid=0x0:0x4030bfbca7d2ed0,
mall,Mal outlet,Miniso Klungkung,"Jl. Ngurah Rai No.60, Semarapura Tengah, Kec. Klungkung, Kabupaten Klungkung, Bali 80716","Semarapura Tengah, Kec. Klungkung, Kabupaten Klungkung",BALI,80716.0,Indonesia,81215672599.0,,,-85.288.157,1.153.986.771,https://maps.google.com/?cid=0x0:0x6b952e2d34b9db64,
mall,Toko Kosmetik,Dewa Ayu Shop Klungkung,"Jl. Untung Suropati No.45, Semarapura Tengah, Kec. Klungkung, Kabupaten Klungkung, Bali 80761","Semarapura Tengah, Kec. Klungkung, Kabupaten Klungkung",BALI,80761.0,Indonesia,85935049741.0,,,-85.346.406,1.153.990.262,https://maps.google.com/?cid=0x0:0x5da955d7be084be1,
mall,Pusat Perbelanjaan,Genta Gending,"Jl. Hasanudin No.1, Semarapura Kauh, Kec. Klungkung, Kabupaten Klungkung, Bali 80711","Semarapura Kauh, Kec. Klungkung, Kabupaten Klungkung",BALI,80711.0,Indonesia,85239096028.0,,,-85.334.271,1.153.949.998,https://maps.google.com/?cid=0x0:0x601ca4ae0ef8275f,
mall,Pusat Perbelanjaan,CEMERLANG FLAMBOYAN,"Jl. Raya Batu Tabih No.63, Semarapura Kelod, Kec. Klungkung, Kabupaten Klungkung, Bali 80716","Semarapura Kelod, Kec. Klungkung, Kabupaten Klungkung",BALI,80716.0,Indonesia,36621418.0,,,-85.414.682,1.153.948.994,https://maps.google.com/?cid=0x0:0xde6773d568428e2d,
mall,Pusat Perbelanjaan,MIC Store,"CCV6+RM7, Kp. Gelgel, Kec. Klungkung, Kabupaten Klungkung, Bali 80761","Kp. Gelgel, Kec. Klungkung, Kabupaten Klungkung",BALI,80761.0,Indonesia,85954130363.0,,,-85.554.516,1.154.116.864,https://maps.google.com/?cid=0x0:0x975466d1530894da,
mall,Toko Sepatu,SHOESKLUNGKUNG_,"F95V+CR8, Jl. Raya Batu Tabih, Semarapura Kelod, Kec. Klungkung, Kabupaten Klungkung, Bali 80716","Jl. Raya Batu Tabih, Semarapura Kelod, Kec. Klungkung, Kabupaten Klungkung",BALI,80716.0,Indonesia,83114420015.0,,,-85.414.648,1.153.945.694,https://maps.google.com/?cid=0x0:0x98c0ea1f050ae4f7,
mall,Toko Makanan,Kurnia AgungMulia Sejahtera Galiran,"Jl. Puputan No.112, Semarapura Kangin, Kec. Klungkung, Kabupaten Klungkung, Bali 80716","Semarapura Kangin, Kec. Klungkung, Kabupaten Klungkung",BALI,80716.0,Indonesia,81278887909.0,,,-85.459.634,1.154.026.831,https://maps.google.com/?cid=0x0:0x8c41c36838a7fc1f,
mall,Pasar,Toko puspa Agung -Didalam Pasar Seni Semarapura klungkung bali.,"Jl. Diponegoro No.16, Semarapura Kelod Kangin, Kec. Klungkung, Kabupaten Klungkung, Bali 80761","Semarapura Kelod Kangin, Kec. Klungkung, Kabupaten Klungkung",BALI,80761.0,Indonesia,81229230891.0,,,-85.354.833,115.404.216,https://maps.google.com/?cid=0x0:0x8d7b7e7cc6e557d9,
mall,Pasar,Pasar Klungkung,"FC73+HV9, Semarapura Kangin, Kec. Klungkung, Kabupaten Klungkung, Bali 80761","Semarapura Kangin, Kec. Klungkung, Kabupaten Klungkung",BALI,80761.0,Indonesia,,,,-85.360.839,1.154.047.405,https://maps.google.com/?cid=0x0:0xecfc9e5d0cba1ffe,
mall,Toko,UD. Sari Yadnya,"Jl. Puputan No.121, Tojan, Kec. Klungkung, Kabupaten Klungkung, Bali 80716","Tojan, Kec. Klungkung, Kabupaten Klungkung",BALI,80716.0,Indonesia,81337502778.0,,,-85.470.029,1.154.029.982,https://maps.google.com/?cid=0x0:0xf65d2465ccac927f,
mall,Pusat Perbelanjaan,MK. DANA,"Semarapura Kangin, Kec. Klungkung, Kabupaten Klungkung, Bali 80761","Kec. Klungkung, Kabupaten Klungkung",BALI,80761.0,Indonesia,87761041934.0,,,-85.406.958,1.154.041.906,https://maps.google.com/?cid=0x0:0xe7fda7a9c1607399,
mall,Toko Swalayan,BALI PLASTIK,"Jl. Arjuna No.18B, Semarapura Kangin, Kec. Klungkung, Kabupaten Klungkung, Bali 80761","Semarapura Kangin, Kec. Klungkung, Kabupaten Klungkung",BALI,80761.0,Indonesia,3612735878.0,,,-85.377.224,1.154.044.635,https://maps.google.com/?cid=0x0:0x691d3644fd10cc38,
mall,Pasar,Pasar Galiran Klungkung,"FC42+CJ5, Semarapura Kelod, Kec. Klungkung, Kabupaten Klungkung, Bali 80716","Semarapura Kelod, Kec. Klungkung, Kabupaten Klungkung",BALI,80716.0,Indonesia,,,,-85.439.762,1.154.016.092,https://maps.google.com/?cid=0x0:0x839c8ef1c389811d,
mall,Pusat Perbelanjaan,Nusantara Koi,"FCH2+3PM, Gg. Bangau, Akah, Kec. Klungkung, Kabupaten Klungkung, Bali 80711","Gg. Bangau, Akah, Kec. Klungkung, Kabupaten Klungkung",BALI,80711.0,Indonesia,81236941727.0,,,-85.222.877,1.154.017.882,https://maps.google.com/?cid=0x0:0x7fd9e7b34a8ab7b6,
mall,Pusat Perbelanjaan,QIQIMART KLUNGKUNG,"Semarapura Kelod Kangin, Kec. Klungkung, Kabupaten Klungkung, Bali","Kabupaten Klungkung, Bali",BALI,,Indonesia,81337770564.0,,,-85.318.909,1.154.067.139,https://maps.google.com/?cid=0x0:0x5354edccf9490b23,
mall,Komplek perumahan,Tu tapa dgj,"Jl. Raya Takmung, Satra, Kec. Klungkung, Kabupaten Klungkung, Bali 80716","Satra, Kec. Klungkung, Kabupaten Klungkung",BALI,80716.0,Indonesia,81916758337.0,,,-85.537.296,1.153.961.144,https://maps.google.com/?cid=0x0:0xc2c5902b7283abcf,
mall,Pusat Perbelanjaan,Tk.TOMI BUK EFA,"FC42+65P, Jl. Jepun, Semarapura Kelod, Kec. Klungkung, Kabupaten Klungkung, Bali 80716","Jl. Jepun, Semarapura Kelod, Kec. Klungkung, Kabupaten Klungkung",BALI,80716.0,Indonesia,81337766367.0,,,-85.444.083,1.154.004.439,https://maps.google.com/?cid=0x0:0x3f4af15d9a5df699,
mall,Toko Pakaian,Aryakoi 9,"Jl. Puputan No.122, Tojan, Kec. Klungkung, Kabupaten Klungkung, Bali 80716","Tojan, Kec. Klungkung, Kabupaten Klungkung",BALI,80716.0,Indonesia,,,,-85.470.641,1.154.027.778,https://maps.google.com/?cid=0x0:0xaff263add6a84a7a,
mall,Grosir,Mawar Collection,"C9WW+4V2, Satra, Kec. Klungkung, Kabupaten Klungkung, Bali 80716","Satra, Kec. Klungkung, Kabupaten Klungkung",BALI,80716.0,Indonesia,87777962669.0,,,-85.547.378,1.153.971.555,https://maps.google.com/?cid=0x0:0xa8b0bacaddcc7b8f,
mall,Pusat Perbelanjaan,UD sumber akbar klungkung,"FC32+X76, Semarapura Kelod, Kec. Klungkung, Kabupaten Klungkung, Bali 80716","Semarapura Kelod, Kec. Klungkung, Kabupaten Klungkung",BALI,80716.0,Indonesia,81236378658.0,,,-85.450.819,1.154.006.354,https://maps.google.com/?cid=0x0:0x2dc4885655bda75b,
mall,Toko Makanan,Toko Saputra,"Jl. Flamboyan No.37, Semarapura Kauh, Kec. Klungkung, Kabupaten Klungkung, Bali 80716","Semarapura Kauh, Kec. Klungkung, Kabupaten Klungkung",BALI,80716.0,Indonesia,,,,-8.538.351,115.395.354,https://maps.google.com/?cid=0x0:0x6a5be7667ce2e9e0,
mall,Pusat Perbelanjaan,Utama Grosir,"Jl. Puputan No.87, Semarapura Kangin, Kec. Klungkung, Kabupaten Klungkung, Bali 80716","Semarapura Kangin, Kec. Klungkung, Kabupaten Klungkung",BALI,80716.0,Indonesia,,,,-85.441.025,1.154.027.246,https://maps.google.com/?cid=0x0:0xba8e245dee7bce05,
mall,mall,Bali 80771,"Kec. Nusa Penida, Kabupaten Klungkung, Bali","Kabupaten Klungkung, Bali",BALI,,Indonesia,,,,-8.727.807,1.155.444.231,https://maps.google.com/?cid=0x0:0x1c00c5eb6016c020,
mall,Toko,BINTANG Souvenir Nusa Penida,"Br. pendem No.Desa, Pejukutan, Kec. Nusa Penida, Kabupaten Klungkung, Bali 80771","Pejukutan, Kec. Nusa Penida, Kabupaten Klungkung",BALI,80771.0,Indonesia,85238460866.0,,,-87.615.013,11.559.267,https://maps.google.com/?cid=0x0:0xc13ea646873e3299,
mall,Pasar,Pasar Tradisional Sampalan,"Jl. Nusa Indah No.11, Batununggul, Kec. Nusa Penida, Kabupaten Klungkung, Bali 80771","Batununggul, Kec. Nusa Penida, Kabupaten Klungkung",BALI,80771.0,Indonesia,,,,-8.672.656,1.155.564.764,https://maps.google.com/?cid=0x0:0x135d06e67de2b101,
mall,Toko Suvenir,Nusa Udeng Collection(Hyang Api Cottage),"7G4C+GPW, Klumpu, Kec. Nusa Penida, Kabupaten Klungkung, Bali 80771","Klumpu, Kec. Nusa Penida, Kabupaten Klungkung",BALI,80771.0,Indonesia,82247036708.0,,,-8.743.643,115.521.813,https://maps.google.com/?cid=0x0:0xf8f00a971efc70f6,
mall,Toko bahan makanan,Toko Rama,"8F9Q+2CC, Kp. Toyapakeh, Kec. Nusa Penida, Kabupaten Klungkung, Bali 80771","Kp. Toyapakeh, Kec. Nusa Penida, Kabupaten Klungkung",BALI,80771.0,Indonesia,81246466633.0,,,-86.824.263,115.488.514,https://maps.google.com/?cid=0x0:0x3e1c40ac86740d3b,
mall,Toko Suvenir,Gaya Island Souvenir,"8FM2+RH8, Jungutbatu, Kec. Nusa Penida, Kabupaten Klungkung, Bali 80771","Jungutbatu, Kec. Nusa Penida, Kabupaten Klungkung",BALI,80771.0,Indonesia,81999198228.0,,,-86.654.642,1.154.514.653,https://maps.google.com/?cid=0x0:0x9285f8014adda83c,
mall,Toko Swalayan,Saren Mini Store,"6GV7+3R5, Batumadeg, Kec. Nusa Penida, Kabupaten Klungkung, Bali 80771","Batumadeg, Kec. Nusa Penida, Kabupaten Klungkung",BALI,80771.0,Indonesia,85237941786.0,,,-87.573.542,1.155.145.987,https://maps.google.com/?cid=0x0:0x8fe7626f73439b86,
mall,Toko bahan makanan,Dewi Artha Mart,"Jl. Nusa Ceningan, Lembongan, Kec. Nusa Penida, Kabupaten Klungkung, Bali 80771","Lembongan, Kec. Nusa Penida, Kabupaten Klungkung",BALI,80771.0,Indonesia,81239301324.0,,,-86.997.074,1.154.455.946,https://maps.google.com/?cid=0x0:0x80369cce9414113c,
mall,Persewaan Skuter,Maha shop  scooter rental,"8CCW+GCX, Jungutbatu, Kec. Nusa Penida, Kabupaten Klungkung, Bali 80771","Jungutbatu, Kec. Nusa Penida, Kabupaten Klungkung",BALI,80771.0,Indonesia,82114723719.0,,,-86.786.448,1.154.461.236,https://maps.google.com/?cid=0x0:0x87eafc495666fbac,
mall,Pusat Perbelanjaan,Japfa silver,"8G8R+8Q7, Jl. Buyuk Limo, Kutampi Kaler, Kec. Nusa Penida, Kabupaten Klungkung, Bali 80771","Jl. Buyuk Limo, Kutampi Kaler, Kec. Nusa Penida, Kabupaten Klungkung",BALI,80771.0,Indonesia,81337574462.0,,,-86.842.118,1.155.419.168,https://maps.google.com/?cid=0x0:0x29ed68e056c5c847,
mall,Pusat Perbelanjaan,Toko Liong Crystal Bay,"7FMH+3PC, Br. Penida Desa Sakti. Nusa Penida, Sakti, Kec. Nusa Penida, Kabupaten Klungkung, Bali 80771","Br. Penida Desa Sakti. Nusa Penida, Sakti, Kec. Nusa Penida, Kabupaten Klungkung",BALI,80771.0,Indonesia,82339964886.0,,,-87.173.108,1.154.792.784,https://maps.google.com/?cid=0x0:0x9b97b65859eb590a,
mall,Toko bahan makanan,Lukya Ping,"Ped, Kec. Nusa Penida, Kabupaten Klungkung, Bali 80771","Kec. Nusa Penida, Kabupaten Klungkung",BALI,80771.0,Indonesia,82260815792.0,,,-8.675.682,1.154.918.098,https://maps.google.com/?cid=0x0:0x98b4e93bb269c383,
mall,Pusat Perbelanjaan,Warung Bu Peby,"7G58+RF9, Unnamed Road, Batumadeg, Nusa Penida, Klungkung Regency, Bali 80771","Unnamed Road, Batumadeg, Nusa Penida, Klungkung Regency",BALI,80771.0,Indonesia,85338688766.0,,,-87.404.589,1.155.162.419,https://maps.google.com/?cid=0x0:0x3d042d08a90d2ca2,
mall,Toko bahan makanan,Lolot Fresh,"8HF9+CW6, Batununggul, Kec. Nusa Penida, Kabupaten Klungkung, Bali 80771","Batununggul, Kec. Nusa Penida, Kabupaten Klungkung",BALI,80771.0,Indonesia,81338163703.0,,,-86.764.578,115.569.766,https://maps.google.com/?cid=0x0:0x18592bd339cc3811,
mall,Pusat Perbelanjaan,Bali silver smith,"6HW5+CM7, Jl. Batu Kandik-Tanglad, Banjar Gepuh, Kec. Nusa Penida, Kabupaten Klungkung, Bali 59274","Jl. Batu Kandik-Tanglad, Banjar Gepuh, Kec. Nusa Penida, Kabupaten Klungkung",BALI,59274.0,Indonesia,85238003979.0,,,-8.753.958,11.555.916,https://maps.google.com/?cid=0x0:0x8bc117c42fe0f4ea,
mall,Pusat Perbelanjaan,Warung Made Suandri,"7F8H+W6W, Bunga Mekar, Kec. Nusa Penida, Kabupaten Klungkung, Bali 80771","Bunga Mekar, Kec. Nusa Penida, Kabupaten Klungkung",BALI,80771.0,Indonesia,85338161697.0,,,-87.326.263,1.154.780.723,https://maps.google.com/?cid=0x0:0x44a85a8e67d151b6,
mall,Toko Pakaian,Ayu Colection,"Nusa Lembongan, Jungutbatu, Kec. Nusa Penida, Kabupaten Klungkung, Bali 80771","Jungutbatu, Kec. Nusa Penida, Kabupaten Klungkung",BALI,80771.0,Indonesia,,,,-86.823.266,1.154.383.504,https://maps.google.com/?cid=0x0:0x9699788a023207c1,
mall,Toko Swalayan,WARUNG YOGA MART,"7J76+7HP, Jl. Raya Semaya, Nusa, penida, Kabupaten Klungkung, Bali 80771","Jl. Raya Semaya, Nusa, penida, Kabupaten Klungkung",BALI,80771.0,Indonesia,82340864525.0,,,-87.367.968,1.156.114.635,https://maps.google.com/?cid=0x0:0xe288a9f9e33ae163,
mall,Pusat Perbelanjaan,Warung Putu Bawe,"7HH9+GQ5, Unnamed Road, Kutampi, Kec. Nusa Penida, Kabupaten Klungkung, Bali 80771","Unnamed Road, Kutampi, Kec. Nusa Penida, Kabupaten Klungkung",BALI,80771.0,Indonesia,,,,-87.212.434,1.155.694.885,https://maps.google.com/?cid=0x0:0xcb565b266134fd88,
mall,Pondok,Rumah belajar bukit keker,"8F8V+QG3, Unnamed Road, Ped, Kec. Nusa Penida, Kabupaten Klungkung, Bali 80771","Unnamed Road, Ped, Kec. Nusa Penida, Kabupaten Klungkung",BALI,80771.0,Indonesia,82144881945.0,,,-86.831.064,1.154.938.054,https://maps.google.com/?cid=0x0:0x3a1beb4b59a59ec4,
mall,Pusat Perbelanjaan,Warung Mek Deker,"8C2X+M98, Jl. Nusa Ceningan, Lembongan, Kec. Nusa Penida, Kabupaten Klungkung, Bali 80771","Jl. Nusa Ceningan, Lembongan, Kec. Nusa Penida, Kabupaten Klungkung",BALI,80771.0,Indonesia,,,,-86.983.449,1.154.484.531,https://maps.google.com/?cid=0x0:0x5fbb754860dc49be,
mall,Pusat Perbelanjaan,Warung Mek Agus,"7GXH+224, Ped, Kec. Nusa Penida, Kabupaten Klungkung, Bali 80771","Ped, Kec. Nusa Penida, Kabupaten Klungkung",BALI,80771.0,Indonesia,,,,-87.024.963,1.155.275.731,https://maps.google.com/?cid=0x0:0xcdbdd03609d3034a,
mall,Pusat Perbelanjaan,Warung diaseh,"6JC2+6XX, Unnamed Road, Pejukutan, Kec. Nusa Penida, Kabupaten Klungkung, Bali 80771","Unnamed Road, Pejukutan, Kec. Nusa Penida, Kabupaten Klungkung",BALI,80771.0,Indonesia,,,,-87.793.941,1.156.024.699,https://maps.google.com/?cid=0x0:0x11c407f75075e5c8,
supermarket,supermarket,Bali 80752,"Kec. Banjarangkan, Kabupaten Klungkung, Bali","Kabupaten Klungkung, Bali",BALI,,Indonesia,,,,-8.512.833,1.153.726.469,https://maps.google.com/?cid=0x0:0x1c00c5eb6016c000,
supermarket,Toko Swalayan,Swalayan Cintamani,"C9XF+VX8, Jl. Raya Banjarangkan, Kabupaten, Kec. Klungkung, Kabupaten Klungkung, Bali 80752","Jl. Raya Banjarangkan, Kabupaten, Kec. Klungkung, Kabupaten Klungkung",BALI,80752.0,Indonesia,36631638.0,,,-85.503.389,1.153.749.386,https://maps.google.com/?cid=0x0:0x7091b38d7622f422,
supermarket,Minimarket,Indomaret Banjarangkan 2,"C9XG+M8X, Jl. Raya Banjarangkan, Klungkung, Kec. Banjarangkan, Kabupaten Klungkung, Bali 80752","Jl. Raya Banjarangkan, Klungkung, Kec. Banjarangkan, Kabupaten Klungkung",BALI,80752.0,Indonesia,8873437414.0,,,-85.507.622,1.153.758.651,https://maps.google.com/?cid=0x0:0x111c858faa117b23,
supermarket,Minimarket,Alfamart Banjarangkan,"Jl. Letda Ida Bagus Puja, Banjarangkan, Kec. Banjarangkan, Kab. Klungkung, Bali 80752","Banjarangkan, Kec. Banjarangkan, Kab. Klungkung",BALI,80752.0,Indonesia,1500959.0,,,-85.502.104,1.153.712.566,https://maps.google.com/?cid=0x0:0xdeaf1241fb6cc8dd,
supermarket,Toko bahan makanan,"Toko Manandana, grosir dan ecer","Jl. Raya Takmung, Takmung, Kec. Banjarangkan, Kabupaten Klungkung, Bali 80752","Takmung, Kec. Banjarangkan, Kabupaten Klungkung",BALI,80752.0,Indonesia,85737425398.0,,,-85.569.701,1.153.872.221,https://maps.google.com/?cid=0x0:0xb8debd411beddcf7,
supermarket,Toko,Garage shop,"Jl. Raya Tusan, Tusan, Kec. Banjarangkan, Kabupaten Klungkung, Bali 80752","Tusan, Kec. Banjarangkan, Kabupaten Klungkung",BALI,80752.0,Indonesia,,,,-85.335.854,115.366.827,https://maps.google.com/?cid=0x0:0xcd51147687b55453,
supermarket,Minimarket,SRC Suwitra,"F9H8+236, Jl. Bakas, Tusan, Kec. Banjarangkan, Kabupaten Klungkung, Bali 80752","Jl. Bakas, Tusan, Kec. Banjarangkan, Kabupaten Klungkung",BALI,80752.0,Indonesia,,,,-85.224.555,1.153.651.528,https://maps.google.com/?cid=0x0:0x49e95ce4254b6f64,
supermarket,Minimarket,Warung Dewa Nyoman Sayang,"F9MG+937, Desa, Getakan, Kec. Banjarangkan, Kabupaten Klungkung, Bali 80752","Desa, Getakan, Kec. Banjarangkan, Kabupaten Klungkung",BALI,80752.0,Indonesia,81239127173.0,,,-85.165.929,1.153.751.763,https://maps.google.com/?cid=0x0:0x4661b4eee22be99d,
supermarket,Toko,Warung carangsari,"G9GM+83P, Unnamed Road, Bungbungan, Kec. Banjarangkan, Kabupaten Klungkung, Bali 80752","Unnamed Road, Bungbungan, Kec. Banjarangkan, Kabupaten Klungkung",BALI,80752.0,Indonesia,,,,-84.741.617,1.153.827.165,https://maps.google.com/?cid=0x0:0x1a1695a69d1a5d85,
supermarket,Toko,Men Gede Mart,"Jl. Bakas No.kangin, Br. Kangin, Kec. Banjarangkan, Kelungkung, Bali 80752","Br. Kangin, Kec. Banjarangkan, Kelungkung",BALI,80752.0,Indonesia,82247412947.0,,,-85.215.234,1.153.660.354,https://maps.google.com/?cid=0x0:0x6351dcb471e43001,
supermarket,Toko Perlengkapan Rumah,Toko Napura,"Nyalian, Kec. Banjarangkan, Kabupaten Klungkung, Bali 80752","Kec. Banjarangkan, Kabupaten Klungkung",BALI,80752.0,Indonesia,81338799619.0,,,-84.988.176,1.153.676.805,https://maps.google.com/?cid=0x0:0x7616ce6be370c166,
supermarket,Toko bahan makanan,WARUNG BIANG WENTEN,"G978+RWF, Bungbungan, Kec. Banjarangkan, Kabupaten Klungkung, Bali 80752","Bungbungan, Kec. Banjarangkan, Kabupaten Klungkung",BALI,80752.0,Indonesia,,,,-84.854.398,1.153.673.099,https://maps.google.com/?cid=0x0:0x540164c24a5e80b5,
supermarket,Toko bahan makanan,Jero Mangku Gunawan,"F9QM+RH8, Unnamed Rd, Kabupaten KlungkungBanjarankan, Aan, Kec. Banjarangkan, Kabupaten Klungkung, Bali 80716","Unnamed Rd, Kabupaten KlungkungBanjarankan, Aan, Kec. Banjarangkan, Kabupaten Klungkung",BALI,80716.0,Indonesia,81321249903.0,,,-8.510.454,1.153.839.624,https://maps.google.com/?cid=0x0:0x78c10acd1c184dd7,
supermarket,Toko bahan makanan,Warung Genta,"F9RJ+QMC, Aan, Kec. Banjarangkan, Kabupaten Klungkung, Bali 80752","Aan, Kec. Banjarangkan, Kabupaten Klungkung",BALI,80752.0,Indonesia,81338384086.0,,,-85.080.723,115.381.629,https://maps.google.com/?cid=0x0:0xfaa9f544ec4a2986,
supermarket,Toko,Warung Sukrani,"F9XF+RPM, Aan, Kec. Banjarangkan, Kabupaten Klungkung, Bali 80752","Aan, Kec. Banjarangkan, Kabupaten Klungkung",BALI,80752.0,Indonesia,85936102927.0,,,-85.004.055,1.153.743.082,https://maps.google.com/?cid=0x0:0x390fd5c64a399222,
supermarket,Toko Swalayan,Indomaret Banjarangkan,"JL. Letnan Dua Ida Bagus Puja, No. 19, Klungkung, Banjarangkan, Kec. Gianyar, Kabupaten Klungkung, Bali 80752","No. 19, Klungkung, Banjarangkan, Kec. Gianyar, Kabupaten Klungkung",BALI,80752.0,Indonesia,36622550.0,,,-85.495.567,1.153.687.466,https://maps.google.com/?cid=0x0:0xea3ed07a3be2d87b,
supermarket,Toko,Warung Bu Gusti Sriati,"BTN Penasan Blok D no. 1, Tihingan, Kec. Banjarangkan, Kabupaten Klungkung, Bali 80713","Tihingan, Kec. Banjarangkan, Kabupaten Klungkung",BALI,80713.0,Indonesia,,,,-85.328.789,1.153.856.117,https://maps.google.com/?cid=0x0:0xef49050c6085ccf2,
supermarket,Supermarket Diskon,Unit Swalayan Mini,"Jl. Jempiring No.18, Semarapura Kelod, Kec. Klungkung, Kabupaten Klungkung, Bali 80711","Semarapura Kelod, Kec. Klungkung, Kabupaten Klungkung",BALI,80711.0,Indonesia,36625656.0,,,-85.388.147,1.153.999.291,https://maps.google.com/?cid=0x0:0xbb2237f769f95858,
supermarket,Toko,Adi Chan Waroeng,"GC82+WXG, Br.Gembalan, Selat, Kec. Klungkung, Kabupaten Klungkung, Bali 80716","Br.Gembalan, Selat, Kec. Klungkung, Kabupaten Klungkung",BALI,80716.0,Indonesia,85792489030.0,,,-84.826.877,1.154.024.396,https://maps.google.com/?cid=0x0:0xb7cc786c9ca6b424,
supermarket,Toko bahan makanan,Supermarket Inti,"Jl. Gn. Batukaru No.10, Semarapura Kelod Kangin, Kec. Klungkung, Kabupaten Klungkung, Bali 80761","Semarapura Kelod Kangin, Kec. Klungkung, Kabupaten Klungkung",BALI,80761.0,Indonesia,36621997.0,,,-85.345.619,1.154.046.405,https://maps.google.com/?cid=0x0:0xabcd68283db9de3c,
supermarket,Toko,Warung Lekok Made Ajra,"F9PF+CPC, Unnamed Road, Getakan, Kec. Banjarangkan, Kabupaten Klungkung, Bali 80752","Unnamed Road, Getakan, Kec. Banjarangkan, Kabupaten Klungkung",BALI,80752.0,Indonesia,,,,-85.139.337,1.153.742.568,https://maps.google.com/?cid=0x0:0xeb37b31f026c35b2,
supermarket,Toko Swalayan,MANAN DANA MART,"C9VP+5VW, Jl. Raya Takmung, Takmung, Kec. Banjarangkan, Kabupaten Klungkung, Bali 80716","Jl. Raya Takmung, Takmung, Kec. Banjarangkan, Kabupaten Klungkung",BALI,80716.0,Indonesia,,,,-8.557.013,1.153.872.137,https://maps.google.com/?cid=0x0:0x78c89fe8a7cc6f3a,
