Category,Real Category,Business Name,Address,City,State,Postal Code,Country,Phone,Email,Website,Latitude,Longitude,Map Link,Details Link
supermarket,Toko,Warung Bu Murtini Getakan,"F9JF+HF, Getakan, Kec. Banjarangkan, Kabupaten Klungkung, Bali 80752","Getakan, Kec. Banjarangkan, Kabupaten Klungkung",BALI,80752.0,Indonesia,,,,-85.185.346,1.153.736.594,https://maps.google.com/?cid=0x0:0xbacdec463347187f,
supermarket,Toko,Warung Bu Ariyana,"C9MM+PX5, jl. raya Lepang, Banjar Lepang, Kec. Banjarangkan, Kabupaten Klungkung, Bali 80752","jl. raya Lepang, Banjar Lepang, Kec. Banjarangkan, Kabupaten Klungkung",BALI,80752.0,Indonesia,81998972881.0,,,-85.657.394,1.153.849.904,https://maps.google.com/?cid=0x0:0x79a84401fb9acaff,
supermarket,supermarket,Bali 80761,"Kec. Dawan, Kabupaten Klungkung, Bali","Kabupaten Klungkung, Bali",BALI,,Indonesia,,,,-85.234.217,1.154.378.152,https://maps.google.com/?cid=0x0:0x1c00c5eb6016c010,
supermarket,Toko bahan makanan,SURYA NADI MART,"Paksebali, Kec. Dawan, Kabupaten Klungkung, Bali 80761","Kec. Dawan, Kabupaten Klungkung",BALI,80761.0,Indonesia,3665551260.0,,,-85.259.361,115.415.956,https://maps.google.com/?cid=0x0:0x6ef4df5d2ff5d901,
supermarket,Minimarket,Lais Mart,"FC6V+P8G, Dawan Klod, Kec. Dawan, Kabupaten Klungkung, Bali 80761","Dawan Klod, Kec. Dawan, Kabupaten Klungkung",BALI,80761.0,Indonesia,81337724679.0,,,-85.381.896,1.154.433.342,https://maps.google.com/?cid=0x0:0x61e46403eb56fc00,
supermarket,Minimarket,Toko nesh,"Jl. Bima No.5, Sampalan Tengah, Kec. Dawan, Kabupaten Klungkung, Bali 80761","Sampalan Tengah, Kec. Dawan, Kabupaten Klungkung",BALI,80761.0,Indonesia,,,,-85.384.325,1.154.149.231,https://maps.google.com/?cid=0x0:0xaf748439f2ae8509,
supermarket,Pemasok Produk Makanan,Supermarket Srinadi,"CCW7+C4H, Gelgel, Kec. Klungkung, Kabupaten Klungkung, Bali 80761","Gelgel, Kec. Klungkung, Kabupaten Klungkung",BALI,80761.0,Indonesia,36625750.0,,,-85.539.334,1.154.128.607,https://maps.google.com/?cid=0x0:0xce1d14e7af1e62f0,
supermarket,Toko,Warung Luh Nik   ,"Dawan Kaler, Kec. Dawan, Kabupaten Klungkung, Bali 80761","Kec. Dawan, Kabupaten Klungkung",BALI,80761.0,Indonesia,,,,-85.275.812,1.154.451.967,https://maps.google.com/?cid=0x0:0x5496297d1e94dffe,
supermarket,Toko bahan makanan,Nurta's Market,"Jl. Dharmawangsa Dusun Pasekan, Dawan Kaler, Kec. Dawan, Kabupaten Klungkung, Bali 80761","Dawan Kaler, Kec. Dawan, Kabupaten Klungkung",BALI,80761.0,Indonesia,,,,-8.527.301,115.445.262,https://maps.google.com/?cid=0x0:0xa81243f345a51a85,
supermarket,Rumah Makan,Warung Tepi Sawah Dawan,"CCWX+994, Gunaksa, Kec. Dawan, Kabupaten Klungkung, Bali 80761","Gunaksa, Kec. Dawan, Kabupaten Klungkung",BALI,80761.0,Indonesia,85738533528.0,,,-85.541.066,1.154.484.464,https://maps.google.com/?cid=0x0:0xbc1d8b33e22a77dc,
supermarket,Toko,Kios Bintang,"FC98+88C, Paksebali, Kec. Dawan, Kabupaten Klungkung, Bali 80761","Paksebali, Kec. Dawan, Kabupaten Klungkung",BALI,80761.0,Indonesia,,,,-85.316.894,1.154.157.676,https://maps.google.com/?cid=0x0:0x2b1beba264e056eb,
supermarket,Toko,Sri Sedana,"CFR2+23R, Banjaranyar, Jl. Pandu, Kusamba, Kec. Dawan, Kabupaten Klungkung, Bali 80761","Banjaranyar, Jl. Pandu, Kusamba, Kec. Dawan, Kabupaten Klungkung",BALI,80761.0,Indonesia,81234710991.0,,,-8.559.882,1.154.501.289,https://maps.google.com/?cid=0x0:0x784edc84c548f3b9,
supermarket,Pusat Perbelanjaan,Warung Om Dedik,"FC9V+VV7, Jl. Sawo Kabeh, Dawan Kaler, Kec. Dawan, Kabupaten Klungkung, Bali 80761","Jl. Sawo Kabeh, Dawan Kaler, Kec. Dawan, Kabupaten Klungkung",BALI,80761.0,Indonesia,87860253708.0,,,-85.303.296,1.154.446.833,https://maps.google.com/?cid=0x0:0xb3c34ec9e5f6a94a,
supermarket,Toko bahan makanan,Supermarket Inti,"Jl. Gn. Batukaru No.10, Semarapura Kelod Kangin, Kec. Klungkung, Kabupaten Klungkung, Bali 80761","Semarapura Kelod Kangin, Kec. Klungkung, Kabupaten Klungkung",BALI,80761.0,Indonesia,36621997.0,,,-85.345.619,1.154.046.405,https://maps.google.com/?cid=0x0:0xabcd68283db9de3c,
supermarket,Toko,Wr mega,"FC6V+G65, Dawan Klod, Kec. Dawan, Kabupaten Klungkung, Bali 80761","Dawan Klod, Kec. Dawan, Kabupaten Klungkung",BALI,80761.0,Indonesia,,,,-85.387.334,1.154.430.994,https://maps.google.com/?cid=0x0:0x4574c1fd62cafa32,
supermarket,Toko,Warung Koko,"Jl. Giri Wisma, Dawan Kaler, Kec. Dawan, Kabupaten Klungkung, Bali 80761","Dawan Kaler, Kec. Dawan, Kabupaten Klungkung",BALI,80761.0,Indonesia,81338636648.0,,,-85.270.704,1.154.454.351,https://maps.google.com/?cid=0x0:0x4bf42b52bd052427,
supermarket,Pusat Perbelanjaan,Bali Gendis. UD,"FC3R+H9H, Jl. Br Tengah, Dawan Klod, Kec. Klungkung, Kabupaten Klungkung, Bali 80761","Jl. Br Tengah, Dawan Klod, Kec. Klungkung, Kabupaten Klungkung",BALI,80761.0,Indonesia,36622602.0,,,-8.546.053,115.440.974,https://maps.google.com/?cid=0x0:0x1c11894e2f13e356,
supermarket,Toko,Natasha Mart,"Dawan Klod, Kec. Dawan, Kabupaten Klungkung, Bali","Kabupaten Klungkung, Bali",BALI,,Indonesia,87861477717.0,,,-85.399.543,1.154.430.247,https://maps.google.com/?cid=0x0:0x1656dc04d179924c,
supermarket,Toko Swalayan,Rahayu cell  shop,"Jl. Sri Rama, dusun pakel, Sampalan Tengah, Kec. Dawan, Kabupaten Klungkung, Bali 80761","dusun pakel, Sampalan Tengah, Kec. Dawan, Kabupaten Klungkung",BALI,80761.0,Indonesia,81999487344.0,,,-85.371.868,1.154.176.891,https://maps.google.com/?cid=0x0:0xf949892ab4a4cc63,
supermarket,Toko Bahan Bangunan,"Toko Bangunan KERTA JAYA, Dawan Klungkung","Jl. Subak Sedahan Ayung, Gunaksa, Dawan, Klungkung Regency, Bali 80761","Gunaksa, Dawan, Klungkung Regency",BALI,80761.0,Indonesia,85738960650.0,,,-85.521.736,11.544.849,https://maps.google.com/?cid=0x0:0x60ef2d8105f8abee,
supermarket,Toko Pertanian,KIOS SARI TANI,"CCVP+7JJ, Jl. Kusanegara, Gunaksa, Kec. Dawan, Kabupaten Klungkung, Bali 80761","Jl. Kusanegara, Gunaksa, Kec. Dawan, Kabupaten Klungkung",BALI,80761.0,Indonesia,81916820040.0,,,-85.567.922,1.154.365.258,https://maps.google.com/?cid=0x0:0x3a0689ca9953240a,
supermarket,Toko bahan makanan,Denata Mart,"Jalan dawan pundukdawa, Kec. Dawan, Kabupaten Klungkung, Bali 80716","Kec. Dawan, Kabupaten Klungkung",BALI,80716.0,Indonesia,81802311322.0,,,-8.543.379,1.154.452.267,https://maps.google.com/?cid=0x0:0xda09b003252ed27d,
supermarket,Toko,Warung Bu Ketut Taman,"Dawan Kaler, Kec. Dawan, Kabupaten Klungkung, Bali 80761","Kec. Dawan, Kabupaten Klungkung",BALI,80761.0,Indonesia,81936271054.0,,,-85.295.116,1.154.448.495,https://maps.google.com/?cid=0x0:0x4e7cce10aae36490,
supermarket,Toko Bahan Bangunan,TB. Darma,"FC6V+R7Q, Jl. Sawo Kabeh, Dawan Kaler, Kec. Dawan, Kabupaten Klungkung, Bali 80761","Jl. Sawo Kabeh, Dawan Kaler, Kec. Dawan, Kabupaten Klungkung",BALI,80761.0,Indonesia,87860486598.0,,,-85.379.088,1.154.432.332,https://maps.google.com/?cid=0x0:0xa4ec9e82f1e4a029,
supermarket,Produsen,Natural Salt Ketut Kaping From Bali,"CCJV+RHP, Jl. Kusuma Bahari, Kusamba, Kec. Dawan, Kabupaten Klungkung, Bali 80761","Jl. Kusuma Bahari, Kusamba, Kec. Dawan, Kabupaten Klungkung",BALI,80761.0,Indonesia,87860091428.0,,,-8.567.909,1.154.439.423,https://maps.google.com/?cid=0x0:0xd92e5765839c0ee0,
supermarket,Toko Swalayan,Bumi Mart,"Jl. Semarapura-Karangasem No.desa, Lokasari, Kec. Sidemen, Kabupaten Karangasem, Bali 80761","Lokasari, Kec. Sidemen, Kabupaten Karangasem",BALI,80761.0,Indonesia,,,,-85.153.452,1.154.228.757,https://maps.google.com/?cid=0x0:0xf9c97049c6811724,
supermarket,Toko bahan makanan,Peken Dawan,"Dawan Klod, Kec. Dawan, Kabupaten Klungkung, Bali","Kabupaten Klungkung, Bali",BALI,,Indonesia,,,,-8.539.717,1.154.431.076,https://maps.google.com/?cid=0x0:0xb9bb9aa2c6415b36,
supermarket,Toko,Family Rejeki,"Jl. Babung Kangin, Gunaksa, Dawan, Klungkung Regency, Bali 80761","Gunaksa, Dawan, Klungkung Regency",BALI,80761.0,Indonesia,,,,-85.328.031,1.154.375.094,https://maps.google.com/?cid=0x0:0x2515cd5b20f138e2,
supermarket,supermarket,Bali 80711,"Kec. Klungkung, Kabupaten Klungkung, Bali","Kabupaten Klungkung, Bali",BALI,,Indonesia,,,,-8.527.468,1.153.978.272,https://maps.google.com/?cid=0x0:0x1c00c5eb6016bf90,
supermarket,Supermarket Diskon,Unit Swalayan Mini,"Jl. Jempiring No.18, Semarapura Kelod, Kec. Klungkung, Kabupaten Klungkung, Bali 80711","Semarapura Kelod, Kec. Klungkung, Kabupaten Klungkung",BALI,80711.0,Indonesia,36625656.0,,,-85.388.147,1.153.999.291,https://maps.google.com/?cid=0x0:0xbb2237f769f95858,
supermarket,Pusat Perbelanjaan,Clandy's Mart Klungkung,"Jl. Ngurah Rai No.10, Semarapura Kauh, Kec. Klungkung, Kabupaten Klungkung, Bali 80716","Semarapura Kauh, Kec. Klungkung, Kabupaten Klungkung",BALI,80716.0,Indonesia,87761299130.0,,,-8.533.107,115.397.265,https://maps.google.com/?cid=0x0:0x3b17e2ccd55271bf,
supermarket,Toko bahan makanan,Supermarket Inti,"Jl. Gn. Batukaru No.10, Semarapura Kelod Kangin, Kec. Klungkung, Kabupaten Klungkung, Bali 80761","Semarapura Kelod Kangin, Kec. Klungkung, Kabupaten Klungkung",BALI,80761.0,Indonesia,36621997.0,,,-85.345.619,1.154.046.405,https://maps.google.com/?cid=0x0:0xabcd68283db9de3c,
supermarket,Toko bahan makanan,Cahaya Melati Grosir,"FC43+V22, Semarapura Kelod, Kec. Klungkung, Kabupaten Klungkung, Bali 80761","Semarapura Kelod, Kec. Klungkung, Kabupaten Klungkung",BALI,80761.0,Indonesia,,,,-85.428.627,1.154.025.217,https://maps.google.com/?cid=0x0:0xe24436bbed3f0ba9,
supermarket,Toko Swalayan,Cahaya Melati Toko,"Jl. Puputan No.03, Semarapura Kangin, Kec. Klungkung, Kabupaten Klungkung, Bali 80715","Semarapura Kangin, Kec. Klungkung, Kabupaten Klungkung",BALI,80715.0,Indonesia,36121406.0,,,-85.359.424,1.154.037.796,https://maps.google.com/?cid=0x0:0x751b87bebf5cd561,
supermarket,Toko,Surya Jaya,"Jl. Ahmad Yani No.23, Semarapura Kaja, Kec. Klungkung, Kabupaten Klungkung, Bali 80711","Semarapura Kaja, Kec. Klungkung, Kabupaten Klungkung",BALI,80711.0,Indonesia,8179716221.0,,,-85.244.267,115.397.524,https://maps.google.com/?cid=0x0:0xfe855ad934e7e9a7,
supermarket,Toko Swalayan,Toko Sudira,"Jl. Pudak No.4, Semarapura Kauh, Kec. Klungkung, Kabupaten Klungkung, Bali 80711","Semarapura Kauh, Kec. Klungkung, Kabupaten Klungkung",BALI,80711.0,Indonesia,,,,-85.348.246,1.153.946.278,https://maps.google.com/?cid=0x0:0x9b173e5db5549f4e,
supermarket,Toko bahan makanan,Toko Kusamba,"Jalan Diponegoro Kangin No.82, Semarapura Kelod, Kec. Klungkung, Kabupaten Klungkung, Bali 80715","Semarapura Kelod, Kec. Klungkung, Kabupaten Klungkung",BALI,80715.0,Indonesia,87828948429.0,,,-85.357.664,1.154.062.647,https://maps.google.com/?cid=0x0:0xa20cc74adff550f6,
supermarket,Minimarket,Toko Modern 3 Langit,"Jl. Sakura No.8, Semarapura Kelod, Kec. Klungkung, Kabupaten Klungkung, Bali 80716","Semarapura Kelod, Kec. Klungkung, Kabupaten Klungkung",BALI,80716.0,Indonesia,85158339106.0,,,-85.430.732,1.153.981.508,https://maps.google.com/?cid=0x0:0xd36311b1e1d41102,
supermarket,Toko Swalayan,Warung Kas Mulia,"Jl. Dewi Sartika, Semarapura Tengah, Kec. Klungkung, Kabupaten Klungkung, Bali 80711","Semarapura Tengah, Kec. Klungkung, Kabupaten Klungkung",BALI,80711.0,Indonesia,,,,-85.279.355,1.154.000.902,https://maps.google.com/?cid=0x0:0x5ecbefb5c90f115c,
supermarket,Minimarket,Alfamart,"Jl. Flamboyan Kel No.53, Semarapura Kelod, Kec. Klungkung, Kab. Klungkung, Bali 80714","Semarapura Kelod, Kec. Klungkung, Kab. Klungkung",BALI,80714.0,Indonesia,211500959.0,,,-85.391.366,1.153.952.278,https://maps.google.com/?cid=0x0:0x1e9516a691e63f,
supermarket,Toko,Toko Surya Plastik,"FC42+GCX, Jl. Anyelir, Semarapura Kelod, Kec. Klungkung, Kabupaten Klungkung, Bali 80711","Jl. Anyelir, Semarapura Kelod, Kec. Klungkung, Kabupaten Klungkung",BALI,80711.0,Indonesia,87861142007.0,,,-85.436.443,1.154.011.107,https://maps.google.com/?cid=0x0:0x16427d566eff5d0d,
supermarket,Pasar,Pasar Klungkung,"FC73+HV9, Semarapura Kangin, Kec. Klungkung, Kabupaten Klungkung, Bali 80761","Semarapura Kangin, Kec. Klungkung, Kabupaten Klungkung",BALI,80761.0,Indonesia,,,,-85.360.839,1.154.047.405,https://maps.google.com/?cid=0x0:0xecfc9e5d0cba1ffe,
supermarket,Toko,Candra Mart,"F9FX+5W3, Jl. Ngurah Rai, Semarapura Kaja, Kec. Klungkung, Kabupaten Klungkung, Bali 80721","Jl. Ngurah Rai, Semarapura Kaja, Kec. Klungkung, Kabupaten Klungkung",BALI,80721.0,Indonesia,81339341000.0,,,-85.271.123,1.153.998.051,https://maps.google.com/?cid=0x0:0x81ac088a81ebae47,
supermarket,Tujuan Wisata,Kembang Kemoning,"Jl. Diponegoro No.7, Semarapura Kelod Kangin, Kec. Klungkung, Kabupaten Klungkung, Bali 80761","Semarapura Kelod Kangin, Kec. Klungkung, Kabupaten Klungkung",BALI,80761.0,Indonesia,81585328210.0,,,-8.535.197,1.154.042.251,https://maps.google.com/?cid=0x0:0xa0554e1539506778,
supermarket,Minimarket,Indomaret | Semarapura Tengah,"Jl. Untung Suropati No.23, Semarapura Tengah, Kec. Klungkung, Kabupaten Klungkung, Bali 80711","Semarapura Tengah, Kec. Klungkung, Kabupaten Klungkung",BALI,80711.0,Indonesia,816500580.0,,,-85.348.614,1.153.999.189,https://maps.google.com/?cid=0x0:0x8b74161e282be118,
supermarket,Grosir,Toko Eka 1,"Jl. Arjuna No.2, Semarapura Kangin, Kec. Klungkung, Kabupaten Klungkung, Bali 80761","Semarapura Kangin, Kec. Klungkung, Kabupaten Klungkung",BALI,80761.0,Indonesia,82146431849.0,,,-85.376.425,1.154.035.781,https://maps.google.com/?cid=0x0:0x1fa5cb0c674a4174,
supermarket,supermarket,DUTA DEWATA Grosir,"F9GX+53C, Jl. Hasanudin, Semarapura Kaja, Kec. Klungkung, Kabupaten Klungkung, Bali 80711","Jl. Hasanudin, Semarapura Kaja, Kec. Klungkung, Kabupaten Klungkung",BALI,80711.0,Indonesia,82236905528.0,,,-85.245.517,1.153.976.553,https://maps.google.com/?cid=0x0:0x3a183a81e3f5dbc1,
supermarket,Toko,WARUNG ARTHA SEDANA,"Akah, Kec. Klungkung, Kabupaten Klungkung, Bali 80711","Kec. Klungkung, Kabupaten Klungkung",BALI,80711.0,Indonesia,8164734214.0,,,-85.202.037,1.154.010.688,https://maps.google.com/?cid=0x0:0x5d32cd77944eaded,
supermarket,Minimarket,Indomaret Semarapura Kauh,"Jl. Ngurah Rai No.64, Semarapura Kauh, Kec. Klungkung, Kabupaten Klungkung, Bali 80711","Semarapura Kauh, Kec. Klungkung, Kabupaten Klungkung",BALI,80711.0,Indonesia,,,,-85.290.289,1.153.984.405,https://maps.google.com/?cid=0x0:0x770560b7cd5758bd,
supermarket,Minimarket,Alfamart,"Jl. Diponegoro Kel No.5, Semarapura Kangin, Kec. Klungkung, Kabupaten Klungkung, Bali 80716","Semarapura Kangin, Kec. Klungkung, Kabupaten Klungkung",BALI,80716.0,Indonesia,1500959.0,,,-85.352.321,115.404.051,https://maps.google.com/?cid=0x0:0x2046bd85a7e3746f,
supermarket,Grosir buku,UD KINARA,"Jl. DR. Sutomo Libgkungan Bendul No.9, Semarapura Tengah, Kec. Klungkung, Kabupaten Klungkung, Bali 80711","Semarapura Tengah, Kec. Klungkung, Kabupaten Klungkung",BALI,80711.0,Indonesia,81805406100.0,,,-85.295.336,1.154.040.992,https://maps.google.com/?cid=0x0:0x29af6c76ede9fa92,
supermarket,supermarket,Bali 80712,"Kec. Klungkung, Kabupaten Klungkung, Bali","Kabupaten Klungkung, Bali",BALI,,Indonesia,,,,-85.253.594,1.153.919.027,https://maps.google.com/?cid=0x0:0x1c00c5eb6016bfa0,
supermarket,Supermarket Diskon,Unit Swalayan Mini,"Jl. Jempiring No.18, Semarapura Kelod, Kec. Klungkung, Kabupaten Klungkung, Bali 80711","Semarapura Kelod, Kec. Klungkung, Kabupaten Klungkung",BALI,80711.0,Indonesia,36625656.0,,,-85.388.147,1.153.999.291,https://maps.google.com/?cid=0x0:0xbb2237f769f95858,
supermarket,Pusat Perbelanjaan,Clandy's Mart Klungkung,"Jl. Ngurah Rai No.10, Semarapura Kauh, Kec. Klungkung, Kabupaten Klungkung, Bali 80716","Semarapura Kauh, Kec. Klungkung, Kabupaten Klungkung",BALI,80716.0,Indonesia,87761299130.0,,,-8.533.107,115.397.265,https://maps.google.com/?cid=0x0:0x3b17e2ccd55271bf,
supermarket,Toko bahan makanan,Cahaya Melati Grosir,"FC43+V22, Semarapura Kelod, Kec. Klungkung, Kabupaten Klungkung, Bali 80761","Semarapura Kelod, Kec. Klungkung, Kabupaten Klungkung",BALI,80761.0,Indonesia,,,,-85.428.627,1.154.025.217,https://maps.google.com/?cid=0x0:0xe24436bbed3f0ba9,
supermarket,Toko Swalayan,Swalayan Cintamani,"C9XF+VX8, Jl. Raya Banjarangkan, Kabupaten, Kec. Klungkung, Kabupaten Klungkung, Bali 80752","Jl. Raya Banjarangkan, Kabupaten, Kec. Klungkung, Kabupaten Klungkung",BALI,80752.0,Indonesia,36631638.0,,,-85.503.389,1.153.749.386,https://maps.google.com/?cid=0x0:0x7091b38d7622f422,
supermarket,Toko,Surya Jaya,"Jl. Ahmad Yani No.23, Semarapura Kaja, Kec. Klungkung, Kabupaten Klungkung, Bali 80711","Semarapura Kaja, Kec. Klungkung, Kabupaten Klungkung",BALI,80711.0,Indonesia,8179716221.0,,,-85.244.267,115.397.524,https://maps.google.com/?cid=0x0:0xfe855ad934e7e9a7,
supermarket,Toko bahan makanan,Toko Kusamba,"Jalan Diponegoro Kangin No.82, Semarapura Kelod, Kec. Klungkung, Kabupaten Klungkung, Bali 80715","Semarapura Kelod, Kec. Klungkung, Kabupaten Klungkung",BALI,80715.0,Indonesia,87828948429.0,,,-85.357.664,1.154.062.647,https://maps.google.com/?cid=0x0:0xa20cc74adff550f6,
supermarket,Toko Swalayan,Toko Sudira,"Jl. Pudak No.4, Semarapura Kauh, Kec. Klungkung, Kabupaten Klungkung, Bali 80711","Semarapura Kauh, Kec. Klungkung, Kabupaten Klungkung",BALI,80711.0,Indonesia,,,,-85.348.246,1.153.946.278,https://maps.google.com/?cid=0x0:0x9b173e5db5549f4e,
supermarket,Toko,Candra Mart,"F9FX+5W3, Jl. Ngurah Rai, Semarapura Kaja, Kec. Klungkung, Kabupaten Klungkung, Bali 80721","Jl. Ngurah Rai, Semarapura Kaja, Kec. Klungkung, Kabupaten Klungkung",BALI,80721.0,Indonesia,81339341000.0,,,-85.271.123,1.153.998.051,https://maps.google.com/?cid=0x0:0x81ac088a81ebae47,
supermarket,Toko Swalayan,Warung Kas Mulia,"Jl. Dewi Sartika, Semarapura Tengah, Kec. Klungkung, Kabupaten Klungkung, Bali 80711","Semarapura Tengah, Kec. Klungkung, Kabupaten Klungkung",BALI,80711.0,Indonesia,,,,-85.279.355,1.154.000.902,https://maps.google.com/?cid=0x0:0x5ecbefb5c90f115c,
supermarket,supermarket,DUTA DEWATA Grosir,"F9GX+53C, Jl. Hasanudin, Semarapura Kaja, Kec. Klungkung, Kabupaten Klungkung, Bali 80711","Jl. Hasanudin, Semarapura Kaja, Kec. Klungkung, Kabupaten Klungkung",BALI,80711.0,Indonesia,82236905528.0,,,-85.245.517,1.153.976.553,https://maps.google.com/?cid=0x0:0x3a183a81e3f5dbc1,
supermarket,Mal outlet,Miniso Klungkung,"Jl. Ngurah Rai No.60, Semarapura Tengah, Kec. Klungkung, Kabupaten Klungkung, Bali 80716","Semarapura Tengah, Kec. Klungkung, Kabupaten Klungkung",BALI,80716.0,Indonesia,81215672599.0,,,-85.288.157,1.153.986.771,https://maps.google.com/?cid=0x0:0x6b952e2d34b9db64,
supermarket,Toko,Toko Dupa Bali Klungkung,"Bendul, Jl. Antasari No.108X, Semarapura Tengah, Kec. Klungkung, Kabupaten Klungkung, Bali 80761","Jl. Antasari No.108X, Semarapura Tengah, Kec. Klungkung, Kabupaten Klungkung",BALI,80761.0,Indonesia,81946705358.0,,,-85.289.295,1.154.018.245,https://maps.google.com/?cid=0x0:0xfe1a8c475a4948e3,
supermarket,Toko,WARUNG ARTHA SEDANA,"Akah, Kec. Klungkung, Kabupaten Klungkung, Bali 80711","Kec. Klungkung, Kabupaten Klungkung",BALI,80711.0,Indonesia,8164734214.0,,,-85.202.037,1.154.010.688,https://maps.google.com/?cid=0x0:0x5d32cd77944eaded,
supermarket,Minimarket,Indomaret Semarapura Kauh,"Jl. Ngurah Rai No.64, Semarapura Kauh, Kec. Klungkung, Kabupaten Klungkung, Bali 80711","Semarapura Kauh, Kec. Klungkung, Kabupaten Klungkung",BALI,80711.0,Indonesia,,,,-85.290.289,1.153.984.405,https://maps.google.com/?cid=0x0:0x770560b7cd5758bd,
supermarket,Grosir,Toko Cakrawala,"Jl. Arjuna- Pasar Klungkung Blok D No. 8, Semarapura Kangin, Kec. Klungkung, Kabupaten Klungkung, Bali 80711","Semarapura Kangin, Kec. Klungkung, Kabupaten Klungkung",BALI,80711.0,Indonesia,87760353695.0,,,-85.375.516,1.154.048.288,https://maps.google.com/?cid=0x0:0xe129ae34de978a82,
supermarket,Minimarket,Alfamart,"Jl. Flamboyan Kel No.53, Semarapura Kelod, Kec. Klungkung, Kab. Klungkung, Bali 80714","Semarapura Kelod, Kec. Klungkung, Kab. Klungkung",BALI,80714.0,Indonesia,211500959.0,,,-85.391.366,1.153.952.278,https://maps.google.com/?cid=0x0:0x1e9516a691e63f,
supermarket,Toko Kelontong Asia,Warung Yogi's,"Manduang, Kec. Klungkung, Kabupaten Klungkung, Bali 80716","Kec. Klungkung, Kabupaten Klungkung",BALI,80716.0,Indonesia,85237449599.0,,,-8.518.332,1.153.914.598,https://maps.google.com/?cid=0x0:0xb0001234e03fb88b,
supermarket,Distributor Baja,TOKO BALI KLUNGKUNG,"Jl. Nakula, Semarapura Kangin, Kec. Klungkung, Kabupaten Klungkung, Bali 80716","Semarapura Kangin, Kec. Klungkung, Kabupaten Klungkung",BALI,80716.0,Indonesia,81236563756.0,,,-85.366.122,1.154.055.096,https://maps.google.com/?cid=0x0:0x73f0375dab3d9652,
supermarket,Minimarket,Alfamart,"Jl. Diponegoro Kel No.5, Semarapura Kangin, Kec. Klungkung, Kabupaten Klungkung, Bali 80716","Semarapura Kangin, Kec. Klungkung, Kabupaten Klungkung",BALI,80716.0,Indonesia,1500959.0,,,-85.352.321,115.404.051,https://maps.google.com/?cid=0x0:0x2046bd85a7e3746f,
supermarket,Toko Kosmetik,Mutiara Permai Klungkung,"Jl. Ngurah Rai No.60, Semarapura Tengah, Kec. Klungkung, Kabupaten Klungkung, Bali 80711","Semarapura Tengah, Kec. Klungkung, Kabupaten Klungkung",BALI,80711.0,Indonesia,81236015862.0,,,-85.288.157,1.153.986.771,https://maps.google.com/?cid=0x0:0x7601f6a8993358ff,
supermarket,Toko Swalayan,Toko Pak Teja,"FC56+X2Q, Semarapura Kangin, Kec. Klungkung, Kabupaten Klungkung, Bali 80761","Semarapura Kangin, Kec. Klungkung, Kabupaten Klungkung",BALI,80761.0,Indonesia,89528920902.0,,,-85.400.262,1.154.100.955,https://maps.google.com/?cid=0x0:0xeabe024a50266012,
supermarket,Toko bahan makanan,Toko buah Nang-Ning,"Jl. Puputan No.27, Semarapura Kangin, Kec. Klungkung, Kabupaten Klungkung, Bali 80761","Semarapura Kangin, Kec. Klungkung, Kabupaten Klungkung",BALI,80761.0,Indonesia,,,,-85.373.451,1.154.035.685,https://maps.google.com/?cid=0x0:0xd3f9ae5ce8512fcf,
supermarket,Toko,Bali art kamasan,"F9FX+4VH, Jl. Dewi Sartika, Semarapura Tengah, Kec. Klungkung, Kabupaten Klungkung, Bali 80711","Jl. Dewi Sartika, Semarapura Tengah, Kec. Klungkung, Kabupaten Klungkung",BALI,80711.0,Indonesia,,,,-8.527.183,1.153.997.328,https://maps.google.com/?cid=0x0:0x26b0e919263c80f0,
supermarket,Toko,Mawi Janur,"F9FX+XH9, Semarapura Kaja, Kec. Klungkung, Kabupaten Klungkung, Bali","Kabupaten Klungkung, Bali",BALI,,Indonesia,,,,-85.250.988,1.153.989.855,https://maps.google.com/?cid=0x0:0x1f16214f26d306a8,
supermarket,Toko bahan makanan,Warung Dewi Sri,"FCC2+85M, Semarapura Tengah, Kec. Klungkung, Kabupaten Klungkung, Bali 80711","Semarapura Tengah, Kec. Klungkung, Kabupaten Klungkung",BALI,80711.0,Indonesia,,,,-85.291.702,1.154.004.129,https://maps.google.com/?cid=0x0:0xb4dfd9fc4ec4414a,
supermarket,supermarket,Warung Kurnia,"Jl. Dewi Sartika No.2, Semarapura Kaja, Kec. Klungkung, Kabupaten Klungkung, Bali 80711","Semarapura Kaja, Kec. Klungkung, Kabupaten Klungkung",BALI,80711.0,Indonesia,,,,-85.264.771,115.399.591,https://maps.google.com/?cid=0x0:0xa49d50918669d7ba,
supermarket,supermarket,Bali 80713,"Tihingan, Kec. Banjarangkan, Kabupaten Klungkung, Bali","Kabupaten Klungkung, Bali",BALI,,Indonesia,,,,-8.533.129,1.153.889.403,https://maps.google.com/?cid=0x0:0x1c00c5eb6016bfb0,
supermarket,Supermarket Diskon,Unit Swalayan Mini,"Jl. Jempiring No.18, Semarapura Kelod, Kec. Klungkung, Kabupaten Klungkung, Bali 80711","Semarapura Kelod, Kec. Klungkung, Kabupaten Klungkung",BALI,80711.0,Indonesia,36625656.0,,,-85.388.147,1.153.999.291,https://maps.google.com/?cid=0x0:0xbb2237f769f95858,
supermarket,Pusat Perbelanjaan,Clandy's Mart Klungkung,"Jl. Ngurah Rai No.10, Semarapura Kauh, Kec. Klungkung, Kabupaten Klungkung, Bali 80716","Semarapura Kauh, Kec. Klungkung, Kabupaten Klungkung",BALI,80716.0,Indonesia,87761299130.0,,,-8.533.107,115.397.265,https://maps.google.com/?cid=0x0:0x3b17e2ccd55271bf,
supermarket,Toko bahan makanan,Supermarket Inti,"Jl. Gn. Batukaru No.10, Semarapura Kelod Kangin, Kec. Klungkung, Kabupaten Klungkung, Bali 80761","Semarapura Kelod Kangin, Kec. Klungkung, Kabupaten Klungkung",BALI,80761.0,Indonesia,36621997.0,,,-85.345.619,1.154.046.405,https://maps.google.com/?cid=0x0:0xabcd68283db9de3c,
supermarket,Toko Swalayan,Toko Sudira,"Jl. Pudak No.4, Semarapura Kauh, Kec. Klungkung, Kabupaten Klungkung, Bali 80711","Semarapura Kauh, Kec. Klungkung, Kabupaten Klungkung",BALI,80711.0,Indonesia,,,,-85.348.246,1.153.946.278,https://maps.google.com/?cid=0x0:0x9b173e5db5549f4e,
supermarket,Toko bahan makanan,Toko Kusamba,"Jalan Diponegoro Kangin No.82, Semarapura Kelod, Kec. Klungkung, Kabupaten Klungkung, Bali 80715","Semarapura Kelod, Kec. Klungkung, Kabupaten Klungkung",BALI,80715.0,Indonesia,87828948429.0,,,-85.357.664,1.154.062.647,https://maps.google.com/?cid=0x0:0xa20cc74adff550f6,
supermarket,Toko,ZUMA Klungkung,"Jl. Flamboyan No.24-22, Semarapura Kauh, Kec. Klungkung, Kabupaten Klungkung, Bali 80716","Semarapura Kauh, Kec. Klungkung, Kabupaten Klungkung",BALI,80716.0,Indonesia,,,,-85.365.308,1.153.957.461,https://maps.google.com/?cid=0x0:0x32120a9e8890fee1,
supermarket,Minimarket,Alfamart,"Jl. Flamboyan Kel No.53, Semarapura Kelod, Kec. Klungkung, Kab. Klungkung, Bali 80714","Semarapura Kelod, Kec. Klungkung, Kab. Klungkung",BALI,80714.0,Indonesia,211500959.0,,,-85.391.366,1.153.952.278,https://maps.google.com/?cid=0x0:0x1e9516a691e63f,
supermarket,Toko,Warung Bu Gusti Sriati,"BTN Penasan Blok D no. 1, Tihingan, Kec. Banjarangkan, Kabupaten Klungkung, Bali 80713","Tihingan, Kec. Banjarangkan, Kabupaten Klungkung",BALI,80713.0,Indonesia,,,,-85.328.789,1.153.856.117,https://maps.google.com/?cid=0x0:0xef49050c6085ccf2,
supermarket,Toko makanan beku,lucky Frozen,"Jl. Flamboyan No.34, Semarapura Kelod, Kec. Klungkung, Kabupaten Klungkung, Bali 80716","Semarapura Kelod, Kec. Klungkung, Kabupaten Klungkung",BALI,80716.0,Indonesia,89524655182.0,,,-85.377.776,1.153.954.486,https://maps.google.com/?cid=0x0:0xd41c0676af5d4571,
supermarket,Kedai Kopi,Kopi Ninibali,"Br. Sangkanbuana, Semarapura Kauh, Kec. Klungkung, Kabupaten Klungkung, Bali 80713","Semarapura Kauh, Kec. Klungkung, Kabupaten Klungkung",BALI,80713.0,Indonesia,817345770.0,,,-85.328.882,1.153.928.543,https://maps.google.com/?cid=0x0:0x6e9f1123c0214dc1,
