Category;Real Category;Business Name;Address;City;State;Postal Code;Country;Phone;Email;Website;Latitude;Longitude;Map Link;Details Link
"mall";"Kantor Perusahaan";"Jasa Pembuatan Aplikasi Berbasis Website";"X3M5+V5C, Jombang Wetan, Kec. Jombang, Kota Cilegon, Banten 42411";"Jombang Wetan, Kec. Jombang, Kota Cilegon";"BANTEN";"42411";"Indonesia";" 089637599772";"";"";"-6.0153088";"106.0578832";"https://maps.google.com/?cid=0x0:0xfc7b6289bd8c7c08";""
"mall";"Pusat Perbelanjaan";"Konter MSR Cell";"Jl. Ps. Kranggot No.206, RT.5/RW.3, Jombang Wetan, Kec. Jombang, Kota Cilegon, Banten 42411";"RT.5/RW.3, Jombang Wetan, Kec. Jombang, Kota Cilegon";"BANTEN";"42411";"Indonesia";"";"";"";"-6.0148926";"106.0595747";"https://maps.google.com/?cid=0x0:0xa6a55b7632b7b95c";""
"mall";"Pusat Perbelanjaan";"WARUNG MADURA SUSAN";"X3R4+XG8 Link. Martapura, Jl. Pangeran Jayakarta, Masigit, Kec. Jombang, Kota Cilegon, Banten 42414";"Jl. Pangeran Jayakarta, Masigit, Kec. Jombang, Kota Cilegon";"BANTEN";"42414";"Indonesia";"";"";"";"-6.0075751";"106.0563197";"https://maps.google.com/?cid=0x0:0xfcc9e87022521c24";""
"mall";"Pusat Perbelanjaan";"Cilegon Reload";"Jombang Wetan, Kec. Jombang, Kota Cilegon, Banten 42411";"Kec. Jombang, Kota Cilegon";"BANTEN";"42411";"Indonesia";" 087808899927";"";"";"-6.0168467";"106.0556779";"https://maps.google.com/?cid=0x0:0x775ea0df4860c3b2";""
"mall";"Toko Perlengkapan Rumah";"Toko GLORI";"Jl. Ahmad Yani No.107, Masigit, Kec. Jombang, Kota Cilegon, Banten 42414";"Masigit, Kec. Jombang, Kota Cilegon";"BANTEN";"42414";"Indonesia";" 081280991781";"";"";"-6.0154882";"106.0489522";"https://maps.google.com/?cid=0x0:0x9a32e5ead0b9a0fe";""
"mall";"Minimarket";"MINISO CCM CILEGON CENTER MALL";"Jl. Ahmad Yani, Sukmajaya, Kec. Jombang, Kota Cilegon, Banten 42416";"Sukmajaya, Kec. Jombang, Kota Cilegon";"BANTEN";"42416";"Indonesia";" 087771561802";"";"";"-6.0241344";"106.0699395";"https://maps.google.com/?cid=0x0:0xebf9e1f3472cdf6d";""
"mall";"Tempat Parkir";"Cilegon Center Mall";"Jl. Ahmad Yani, Sukmajaya, Kec. Jombang, Kota Cilegon, Banten 42426";"Sukmajaya, Kec. Jombang, Kota Cilegon";"BANTEN";"42426";"Indonesia";" 02547817447";"";"";"-6.0246159";"106.0699058";"https://maps.google.com/?cid=0x0:0x35dde04f05071026";""
"mall";"Pusat Perbelanjaan";"CitiMall Cilegon";"Jl. Jenderal Sudirman, Ramanuju, Kec. Purwakarta, Kota Cilegon, Banten 42431";"Ramanuju, Kec. Purwakarta, Kota Cilegon";"BANTEN";"42431";"Indonesia";"";"";"";"-6.0131211";"106.045255";"https://maps.google.com/?cid=0x0:0x74cd8e02666473ae";""
"mall";"Bioskop";"Cilegon Center Mall XXI";"Sukmajaya, Kec. Jombang, Kota Cilegon, Banten 42416";"Kec. Jombang, Kota Cilegon";"BANTEN";"42416";"Indonesia";" 02545752121";"";"/url?q>>u003dhttps://www.21cineplex.com/>>u0026opi>>u003d79508299>>u0026sa>>u003dU>>u0026ved>>u003d0ahUKEwjBpa2MxK6LAxUHT2wGHb7SJCcQ61gIFigS>>u0026usg>>u003dAOvVaw2DcA-wd_t5RTpKAM0FNRAF";"-6.0237755";"106.0700234";"https://maps.google.com/?cid=0x0:0x9d69fcfc46d57287";""
"mall";"Pusat Perbelanjaan";"CIPLAZ CILEGON (RAMAYANA)";"Jl. Raya Cilegon, Sukmajaya, Kec. Jombang, Kota Cilegon, Banten 42416";"Sukmajaya, Kec. Jombang, Kota Cilegon";"BANTEN";"42416";"Indonesia";"";"";"/url?q>>u003dhttp://ramayana.co.id/>>u0026opi>>u003d79508299>>u0026sa>>u003dU>>u0026ved>>u003d0ahUKEwjOzuWMxK6LAxXETWwGHROIHgoQ61gIEigO>>u0026usg>>u003dAOvVaw09hxawnSfKeSh4iN-ua8P2";"-6.0216681";"106.06362";"https://maps.google.com/?cid=0x0:0x3f3ea9461d4738de";""
"mall";"Toko Swalayan";"Super Indo Cilegon Center";"Cilegon Center Mall, Lt. LG, Sukmajaya, Kec. Jombang, Kota Cilegon, Banten 42416";"Lt. LG, Sukmajaya, Kec. Jombang, Kota Cilegon";"BANTEN";"42416";"Indonesia";" 02547817192";"";"/url?q>>u003dhttp://www.superindo.co.id/>>u0026opi>>u003d79508299>>u0026sa>>u003dU>>u0026ved>>u003d0ahUKEwj7g-uMxK6LAxXmV2wGHUxKEPIQ61gIFigS>>u0026usg>>u003dAOvVaw3O_YTcvqH_FI-rQMVP1Vp1";"-6.0246159";"106.0699058";"https://maps.google.com/?cid=0x0:0xec91b2fbb5919de";""
"mall";"mall";"OH!SOME - Cilegon Center Mall";"Cilegon Center Mall, Jl. Ahmad Yani, Sukmajaya, Kec. Jombang, Kota Cilegon, Banten 42426";"Jl. Ahmad Yani, Sukmajaya, Kec. Jombang, Kota Cilegon";"BANTEN";"42426";"Indonesia";" 081380776487";"";"";"-6.0247074";"106.0700777";"https://maps.google.com/?cid=0x0:0x633bc65e13db6471";""
"mall";"Toko Elektronik";"Informa Cilegon Center Mall (CCM)";"Jl. Ahmad Yani, Sukmajaya, Kec. Jombang, Kota Cilegon, Banten 42416";"Sukmajaya, Kec. Jombang, Kota Cilegon";"BANTEN";"42416";"Indonesia";" 085817854299";"";"/url?q>>u003dhttp://linktr.ee/salesinformacilegon>>u0026opi>>u003d79508299>>u0026sa>>u003dU>>u0026ved>>u003d0ahUKEwjRuO2NxK6LAxVGSWwGHdC3JaIQ61gIFigS>>u0026usg>>u003dAOvVaw0q2qUdETBBBP0iKkbHnuAk";"-6.0249082";"106.0698679";"https://maps.google.com/?cid=0x0:0x47069e0c5f0a4463";""
"mall";"Pusat Perbelanjaan";"Shopping";"Jl. Simpang Tiga No.47, Masigit, Kec. Jombang, Kota Cilegon, Banten 42414";"Masigit, Kec. Jombang, Kota Cilegon";"BANTEN";"42414";"Indonesia";"";"";"";"-6.0142616";"106.0470968";"https://maps.google.com/?cid=0x0:0x231c017f666d21d8";""
"mall";"Pusat Perbelanjaan";"Cilegon Reload";"Jombang Wetan, Kec. Jombang, Kota Cilegon, Banten 42411";"Kec. Jombang, Kota Cilegon";"BANTEN";"42411";"Indonesia";" 087808899927";"";"";"-6.0168467";"106.0556779";"https://maps.google.com/?cid=0x0:0x775ea0df4860c3b2";""
"mall";"Pusat Perbelanjaan";"Toko Berkah Jombang";"Jl. RA. Kartini No.11, RT.2/RW.5, Jombang Wetan, Kec. Jombang, Kota Cilegon, Banten 42411";"RT.2/RW.5, Jombang Wetan, Kec. Jombang, Kota Cilegon";"BANTEN";"42411";"Indonesia";"";"";"";"-6.0170767";"106.0552332";"https://maps.google.com/?cid=0x0:0xbefeba57639af815";""
"mall";"Pengolahan Ikan";"Ketileng Timur Kalbeng";"X3G8+J7J, Unnamed Road, Sukmajaya, Kec. Jombang, Kota Cilegon, Banten 42416";"Unnamed Road, Sukmajaya, Kec. Jombang, Kota Cilegon";"BANTEN";"42416";"Indonesia";" 08176956097";"";"";"-6.023419";"106.065654";"https://maps.google.com/?cid=0x0:0xf7f78f1a91237dc9";""
"mall";"Toko Pakaian";"3SECOND CILEGON";"TOKO 3SECOND, Jl. Ahmad Yani No.13, Sukmajaya, Kec. Jombang, Kota Cilegon, Banten 42411";"Jl. Ahmad Yani No.13, Sukmajaya, Kec. Jombang, Kota Cilegon";"BANTEN";"42411";"Indonesia";" 089678819814";"";"/url?q>>u003dhttp://www.3second.co.id/>>u0026opi>>u003d79508299>>u0026sa>>u003dU>>u0026ved>>u003d0ahUKEwjiod6PxK6LAxXsUGcHHccWHhYQ61gIFigS>>u0026usg>>u003dAOvVaw08hpIfw0rjPaENhe-FvJOH";"-6.0237214";"106.0674305";"https://maps.google.com/?cid=0x0:0x468f8098d5456b51";""
"mall";"Toko Elektronik";"Electronic City Cilegon Center Mall";"Cilegon Center Mall, Jl. Ahmad Yani, Sukmajaya, Kec. Jombang, Kota Cilegon, Banten 42416";"Jl. Ahmad Yani, Sukmajaya, Kec. Jombang, Kota Cilegon";"BANTEN";"42416";"Indonesia";" 1500032";"";"";"-6.0242248";"106.0699435";"https://maps.google.com/?cid=0x0:0x2d61229e87ae2c49";""
"mall";"Pusat Perbelanjaan";"Transmart Cilegon";"Jl. KH. Yasin Beji No.2, Kebondalem, Kec. Purwakarta, Kota Cilegon, Banten 42433";"Kebondalem, Kec. Purwakarta, Kota Cilegon";"BANTEN";"42433";"Indonesia";" 085888376350";"";"";"-6.0072741";"106.0427409";"https://maps.google.com/?cid=0x0:0xdc16e98a9f63a51c";""
"mall";"Toko";"Surya aquarium";"belakang Ramayana, Jl. KH. Wasyid, Jombang Wetan, Kec. Jombang, Kota Cilegon, Banten 42416";"Jl. KH. Wasyid, Jombang Wetan, Kec. Jombang, Kota Cilegon";"BANTEN";"42416";"Indonesia";" 085773795098";"";"";"-6.0210577";"106.0648082";"https://maps.google.com/?cid=0x0:0x17800b6de8f6de5b";""
"mall";"Pusat Perbelanjaan";"PAMERAN MOBIL TOYOTA (Mayofield Mall Cilegon)";"Jl. Nn No.15, Ramanuju, Kec. Purwakarta, Kota Cilegon, Banten 42431";"Ramanuju, Kec. Purwakarta, Kota Cilegon";"BANTEN";"42431";"Indonesia";" 0817628841";"";"";"-6.0132639";"106.045219";"https://maps.google.com/?cid=0x0:0x4bbe23243d3f6e6e";""
"mall";"Toko Rokok Elektrik";"King Vapor Cilegon";"Jl. Ahmad Yani No.12, Sukmajaya, Kec. Jombang, Kota Cilegon, Banten 42416";"Sukmajaya, Kec. Jombang, Kota Cilegon";"BANTEN";"42416";"Indonesia";" 087796212959";"";"";"-6.0223398";"106.0641376";"https://maps.google.com/?cid=0x0:0x47e1bc649bb0ce7f";""
"mall";"Rumah Kaca";"Rumah Pangan Kita Sabina";"Komp. TCI Blok J1 No 30, Sukmajaya, Jombang, Cilegon, Banten 42426";"Sukmajaya, Jombang, Cilegon";"BANTEN";"42426";"Indonesia";" 085920777700";"";"";"-6.0151743";"106.0756151";"https://maps.google.com/?cid=0x0:0x3feccfc4fcc8954f";""
"mall";"mall";"Banten 42416";"Kota Cilegon, Banten";"Kota Cilegon, Banten";"BANTEN";"";"Indonesia";"";"";"";"-6.0240292";"106.0610787";"https://maps.google.com/?cid=0x0:0x1c00c5eb568ecd90";""
"mall";"Toko";"Toko Teh mul";"X3H6+67X, Sukmajaya, Kec. Jombang, Kota Cilegon, Banten 42416";"Sukmajaya, Kec. Jombang, Kota Cilegon";"BANTEN";"42416";"Indonesia";" 085947367567";"";"";"-6.0218948";"106.0607219";"https://maps.google.com/?cid=0x0:0x9c1303fbfbef5b09";""
"mall";"Pusat Perbelanjaan";"Ojol_cell Cilegon";"Jl. Impres No.67, RT.3/RW.13, Masigit, Kec. Jombang, Kota Cilegon, Banten 42414";"RT.3/RW.13, Masigit, Kec. Jombang, Kota Cilegon";"BANTEN";"42414";"Indonesia";" 085945636244";"";"";"-6.0090655";"106.0544765";"https://maps.google.com/?cid=0x0:0xab4867ff976fcc1d";""
"mall";"Pusat Perbelanjaan";"Permata Cilegon Motor";"Sebrang Bank BJB, Jl. Ahmad Yani No.35 Kav A-B, Sukmajaya, Kec. Jombang, Kota Cilegon, Banten 42416";"Jl. Ahmad Yani No.35 Kav A-B, Sukmajaya, Kec. Jombang, Kota Cilegon";"BANTEN";"42416";"Indonesia";" 0254374486";"";"";"-6.0237785";"106.0669722";"https://maps.google.com/?cid=0x0:0x3348d16e02d24a55";""
"mall";"Pusat Perbelanjaan";"Matahari Lama";"Cilegon Plaza, Jl. Raya Cilegon Drangong Serang - Banten No.5-6 Blok C, Jombang Wetan, Kec. Jombang, Kota Cilegon, Banten 42411";"Jl. Raya Cilegon Drangong Serang - Banten No.5-6 Blok C, Jombang Wetan, Kec. Jombang, Kota Cilegon";"BANTEN";"42411";"Indonesia";"";"";"";"-6.0182836";"106.0554104";"https://maps.google.com/?cid=0x0:0x62a3a3c4f6d23bc8";""
"mall";"Toko Perlengkapan Olahraga";"OB Fitness  Health - Cilegon Center Mall";"Cilegon Center Mall, Jl. Ahmad Yani, Sukmajaya, Kec. Jombang, Kota Cilegon, Banten 42416";"Jl. Ahmad Yani, Sukmajaya, Kec. Jombang, Kota Cilegon";"BANTEN";"42416";"Indonesia";" 083871055876";"";"/url?q>>u003dhttps://www.ob-fit.com/>>u0026opi>>u003d79508299>>u0026sa>>u003dU>>u0026ved>>u003d0ahUKEwjc74yUxK6LAxXeh68BHYnsDIkQ61gIFigS>>u0026usg>>u003dAOvVaw0hHBNSI0SCRKWbZtnRzr2I";"-6.0244488";"106.0697426";"https://maps.google.com/?cid=0x0:0xdc27d7a968073586";""
"mall";"";"Surya Tehnik";"Jl. Raya Cilegon Jl. Pesut No.101, Sukmajaya, Kec. Jombang, Kota Cilegon, Banten 42416";"Sukmajaya, Kec. Jombang, Kota Cilegon";"BANTEN";"42416";"Indonesia";" 0254388064";"";"";"-6.0203825";"106.0607427";"https://maps.google.com/?cid=0x0:0xda13bca2f6157796";""
"mall";"Toko bahan makanan";"Warung Sayurmayur Dan Bumbu Kering Pak H.Muhtadi";"X3M9+76M, Sukmajaya, Kec. Jombang, Kota Cilegon, Banten 42416";"Sukmajaya, Kec. Jombang, Kota Cilegon";"BANTEN";"42416";"Indonesia";" 087871501777";"";"";"-6.0167811";"106.06804";"https://maps.google.com/?cid=0x0:0x8df7c7df46eb6a72";""
"mall";"Toko Pakaian";"PD. Maju Jaya";"Jl. Ps. Kranggot, Sukmajaya, Kec. Jombang, Kota Cilegon, Banten 42416";"Sukmajaya, Kec. Jombang, Kota Cilegon";"BANTEN";"42416";"Indonesia";"";"";"";"-6.017311";"106.0682271";"https://maps.google.com/?cid=0x0:0x509f8d0a6f7e390a";""
"mall";"Toko";"Ruko Fahmi Family";"Masjid Al-Huda, Jalan, Jombang, Ciputat, South Tangerang City, Banten 15414";"Jalan, Jombang, Ciputat, South Tangerang City";"BANTEN";"15414";"Indonesia";"";"";"";"-6.2922044";"106.6983286";"https://maps.google.com/?cid=0x0:0xb72010b8fa390537";""
"mall";"Toko Alat Tulis";"Toko Rifa Stationery Jombang";"Jl. Jombang Raya No.73, Jombang, Kec. Ciputat, Kota Tangerang Selatan, Banten 15414";"Jombang, Kec. Ciputat, Kota Tangerang Selatan";"BANTEN";"15414";"Indonesia";" 0217454002";"";"";"-6.2961606";"106.7117386";"https://maps.google.com/?cid=0x0:0xdcc3ac261583f10";""
"mall";"Pusat Perbelanjaan";"WARUNG BIKOM CILALUNG";"Jl. H. M. Marjaya I No.103, RT.2/RW.15, Jombang, Kec. Ciputat, Kota Tangerang Selatan, Banten 15414";"RT.2/RW.15, Jombang, Kec. Ciputat, Kota Tangerang Selatan";"BANTEN";"15414";"Indonesia";"";"";"";"-6.304532";"106.705306";"https://maps.google.com/?cid=0x0:0x2cd6a869367667a0";""
"mall";"Toko Ponsel";"SEVEN PHONE";"Jl. Jombang Raya No.98, Jombang, Kec. Ciputat, Kota Tangerang Selatan, Banten 15414";"Jombang, Kec. Ciputat, Kota Tangerang Selatan";"BANTEN";"15414";"Indonesia";" 081288345626";"";"";"-6.2966144";"106.7120428";"https://maps.google.com/?cid=0x0:0x9185b7ce2e4dbe08";""
"mall";"Pasar";"TOKO SUYONO BERKAH 2";"PP36+CWG, pasar jombang blok A nomer, Jombang, Kec. Ciputat, Kota Tangerang Selatan, Banten 15414";"pasar jombang blok A nomer, Jombang, Kec. Ciputat, Kota Tangerang Selatan";"BANTEN";"15414";"Indonesia";" 081310198647";"";"";"-6.2964371";"106.7123348";"https://maps.google.com/?cid=0x0:0x25ec78cc65e58f2f";""
"mall";"Pusat Perbelanjaan";"Waroeng Bang Leman";"Jl. Tidore No.27, Jombang, Kec. Ciputat, Kota Tangerang Selatan, Banten 15414";"Jombang, Kec. Ciputat, Kota Tangerang Selatan";"BANTEN";"15414";"Indonesia";"";"";"";"-6.2906938";"106.6950468";"https://maps.google.com/?cid=0x0:0x424163a52252e2ac";""
"mall";"Pusat Perbelanjaan";"Warung Barjah";"Jalan Sumatera, kampung rawa lele Rt05 Rw 07 No 93, Jombang, Kec. Ciputat, Kota Tangerang Selatan, Banten 15414";"kampung rawa lele Rt05 Rw 07 No 93, Jombang, Kec. Ciputat, Kota Tangerang Selatan";"BANTEN";"15414";"Indonesia";" 08176544143";"";"";"-6.2966123";"106.7028843";"https://maps.google.com/?cid=0x0:0x54ca7cdc8286422";""
"mall";"Toko umum";"Sudimara toko mainan";"Jl. Jombang Raya No.66, Jombang, Kec. Ciputat, Kota Tangerang Selatan, Banten 15414";"Jombang, Kec. Ciputat, Kota Tangerang Selatan";"BANTEN";"15414";"Indonesia";"";"";"";"-6.2963251";"106.7116836";"https://maps.google.com/?cid=0x0:0x53eee83602e9d0cb";""
"mall";"Tempat Parkir";"Cilegon Center Mall";"Jl. Ahmad Yani, Sukmajaya, Kec. Jombang, Kota Cilegon, Banten 42426";"Sukmajaya, Kec. Jombang, Kota Cilegon";"BANTEN";"42426";"Indonesia";" 02547817447";"";"";"-6.0246159";"106.0699058";"https://maps.google.com/?cid=0x0:0x35dde04f05071026";""
"mall";"Toko Swalayan";"Frozen Food KFF";"Gg. Sakinah Jl. Jombang Raya No.9 BLOK E13, RW.11, Jombang, Kec. Ciputat, Kota Tangerang Selatan, Banten 15414";"RW.11, Jombang, Kec. Ciputat, Kota Tangerang Selatan";"BANTEN";"15414";"Indonesia";" 0818690120";"";"";"-6.2956359";"106.7055514";"https://maps.google.com/?cid=0x0:0x20a9ce979224ee97";""
"mall";"Pusat Perbelanjaan";"Silent Speedshop";"Jl. Sumatra, Jl. Jombang Rw. Lele Gg. Al-Furqon No.57, Rt. 005/007, Jombang, Kec. Ciputat, Kota Tangerang Selatan, Banten 15414";"Jl. Jombang Rw. Lele Gg. Al-Furqon No.57, Rt. 005/007, Jombang, Kec. Ciputat, Kota Tangerang Selatan";"BANTEN";"15414";"Indonesia";" 085716284785";"";"";"-6.2948068";"106.699836";"https://maps.google.com/?cid=0x0:0x914daf6a23f7bb99";""
"mall";"Toko";"Toko areng wawan";"Jl. Kalimantan II Gg. H Boang No.99, RT.06/RW.12, Jombang, Kec. Ciputat, Kota Tangerang Selatan, Banten 15414";"RT.06/RW.12, Jombang, Kec. Ciputat, Kota Tangerang Selatan";"BANTEN";"15414";"Indonesia";" 081389122299";"";"";"-6.2905753";"106.700977";"https://maps.google.com/?cid=0x0:0xb8b7161295b1a70e";""
"mall";"Pedagang ternak";"Kandang Bae";"Jl.Pertanian, Parigi Lama RT.RW 02/021, Jombang, Kec. Ciputat, Kota Tangerang Selatan, Banten 15414";"Parigi Lama RT.RW 02/021, Jombang, Kec. Ciputat, Kota Tangerang Selatan";"BANTEN";"15414";"Indonesia";" 081519276262";"";"";"-6.2886585";"106.6984691";"https://maps.google.com/?cid=0x0:0x4be8c07fb2c9c4bc";""
"mall";"Pusat Perbelanjaan";"Warung Ma Uwie";"PP42+969, Jombang, Kec. Ciputat, Kota Tangerang Selatan, Banten 15414";"Jombang, Kec. Ciputat, Kota Tangerang Selatan";"BANTEN";"15414";"Indonesia";" 08998064920";"";"";"-6.2940796";"106.7006132";"https://maps.google.com/?cid=0x0:0x10d0d705c08da13c";""
"mall";"Pusat Perbelanjaan";"waroeng bu isti";"PP25+4G9, Jombang, Kec. Ciputat, Kota Tangerang Selatan, Banten 15414";"Jombang, Kec. Ciputat, Kota Tangerang Selatan";"BANTEN";"15414";"Indonesia";"";"";"";"-6.2997039";"106.7088717";"https://maps.google.com/?cid=0x0:0x980b60643b6c12ef";""
"mall";"Taman";"Freesia Garden";"Sinar Bintaro, jl jombang raya no 148, Jl. Jombang Raya No.12, Jombang, Kec. Ciputat, Kota Tangerang Selatan, Banten 15414";"jl jombang raya no 148, Jl. Jombang Raya No.12, Jombang, Kec. Ciputat, Kota Tangerang Selatan";"BANTEN";"15414";"Indonesia";"";"";"";"-6.294342";"106.709311";"https://maps.google.com/?cid=0x0:0xab7cbcac5efa6af0";""
"mall";"Pujasera";"Plaza Cordoba";"MMXR+MQH, Rw. Mekar Jaya, Kec. Serpong, Kota Tangerang Selatan, Banten 15310";"Rw. Mekar Jaya, Kec. Serpong, Kota Tangerang Selatan";"BANTEN";"15310";"Indonesia";"";"";"";"-6.3008154";"106.6919976";"https://maps.google.com/?cid=0x0:0xbd48cf47057dbead";""
"mall";"Toko";"Bagas jengkol Mg_okle";"Jombang, Kec. Ciputat, Kota Tangerang Selatan, Banten 15414";"Kec. Ciputat, Kota Tangerang Selatan";"BANTEN";"15414";"Indonesia";" 089669662221";"";"/url?q>>u003dhttps://mgoklegroup.wordpress.com/home/>>u0026opi>>u003d79508299>>u0026sa>>u003dU>>u0026ved>>u003d0ahUKEwjQrcy0xK6LAxXOSGwGHSBeBhUQ61gIFigS>>u0026usg>>u003dAOvVaw36LKumuztVH7gNA5AcsB3G";"-6.2960608";"106.7118027";"https://maps.google.com/?cid=0x0:0x5c269a4ce540c712";""
"mall";"Taman";"AMMA GARDEN Madinatunnajah";"PM5W+GGF, Jombang, Kec. Ciputat, Kota Tangerang Selatan, Banten 15414";"Jombang, Kec. Ciputat, Kota Tangerang Selatan";"BANTEN";"15414";"Indonesia";" 085773239400";"";"";"-6.2911812";"106.6962882";"https://maps.google.com/?cid=0x0:0x160f82d49eecca04";""
"mall";"mall";"Jombang";"Kec. Ciputat, Kota Tangerang Selatan, Banten";"Kota Tangerang Selatan, Banten";"BANTEN";"";"Indonesia";"";"";"";"-6.2953922";"106.702825";"https://maps.google.com/?cid=0x0:0xbcdb8cf2b6fd73f4";""
"mall";"Pemasok Produk Kecantikan";"Nu Amoorea Jombang";"Bintaro Asri Resident, Jl. Jombang Raya Blok B No. 3, Jombang, Ciputat, South Tangerang City, Banten 15414";"Jl. Jombang Raya Blok B No. 3, Jombang, Ciputat, South Tangerang City";"BANTEN";"15414";"Indonesia";" 08128825313";"";"";"-6.3026858";"106.7157701";"https://maps.google.com/?cid=0x0:0x37c1cb3efe420530";""
"mall";"Toko";"Bravo Supermarket";"F638+Q4R, Jalan Yos Sudarso, Tunggorono, Kecamatan Jombang, Sumbernongko, Denanyar, Kec. Jombang, Kabupaten Jombang, Jawa Timur 61419";"Jalan Yos Sudarso, Tunggorono, Kecamatan Jombang, Sumbernongko, Denanyar, Kec. Jombang, Kabupaten Jombang";"BANTEN";"61419";"Indonesia";"";"";"";"-7.5455052";"112.215255";"https://maps.google.com/?cid=0x0:0xa6a9cdf614ae8f8d";""
"mall";"Pusat Perbelanjaan";"Linggajati Plaza";"Jl. KH. Wahid Hasyim No.3C, Candi Mulyo, Kec. Jombang, Kabupaten Jombang, Jawa Timur 61413";"Candi Mulyo, Kec. Jombang, Kabupaten Jombang";"BANTEN";"61413";"Indonesia";" 0321866010";"";"";"-7.5391655";"112.2384491";"https://maps.google.com/?cid=0x0:0x165ab3e9ca331cff";""
"mall";"Pusat Perbelanjaan";"Keraton Jombang";"Jl. A.Yani No.56, Jombang, Kec. Jombang, Kabupaten Jombang, Jawa Timur 61419";"Jombang, Kec. Jombang, Kabupaten Jombang";"BANTEN";"61419";"Indonesia";"";"";"";"-7.5380912";"112.234347";"https://maps.google.com/?cid=0x0:0x998ac4d840d6f326";""
"mall";"Pusat Perbelanjaan";"PREMIUM STORE";"Jl. RE. Martadinata No.111, Kepatihan, Kec. Jombang, Kabupaten Jombang, Jawa Timur 61419";"Kepatihan, Kec. Jombang, Kabupaten Jombang";"BANTEN";"61419";"Indonesia";" 081318804288";"";"";"-7.5425032";"112.2327581";"https://maps.google.com/?cid=0x0:0x79ae7c9699c2a38";""
"mall";"Pembangunan Perumahan";"The Eighteen";"Jl. KH. A. Dahlan No.18, Jombatan, Kec. Jombang, Kabupaten Jombang, Jawa Timur 61419";"Jombatan, Kec. Jombang, Kabupaten Jombang";"BANTEN";"61419";"Indonesia";" 081330000018";"";"";"-7.5548926";"112.232333";"https://maps.google.com/?cid=0x0:0x451cbf3e4b797964";""
"mall";"Toko Swalayan";"Borobudur Store Jombang";"Jl. Gus Dur No.148, Candi Mulyo, Kec. Jombang, Kabupaten Jombang, Jawa Timur 61419";"Candi Mulyo, Kec. Jombang, Kabupaten Jombang";"BANTEN";"61419";"Indonesia";"";"";"";"-7.5382214";"112.2398542";"https://maps.google.com/?cid=0x0:0x12c160f1aa161d28";""
"mall";"Penyedia Layanan Telekomunikasi";"Telkomsel Distributor Center";"Jalan Dokter Sutomo No.58, Jombatan, Kec. Jombang, Kabupaten Jombang, Jawa Timur 61411";"Jombatan, Kec. Jombang, Kabupaten Jombang";"BANTEN";"61411";"Indonesia";"";"";"";"-7.553025";"112.2320584";"https://maps.google.com/?cid=0x0:0xfadc9ce2e978ae46";""
"mall";"Toko Alat Tulis";"Atkstore Jombang By Gading Murni";"Jl. Kusuma Bangsa No.83-85, Kepanjen, Kec. Jombang, Kabupaten Jombang, Jawa Timur";"Kabupaten Jombang, Jawa Timur";"BANTEN";"";"Indonesia";" 082189000409";"";"";"-7.5464983";"112.2299683";"https://maps.google.com/?cid=0x0:0xc5300e7d0eaa3f46";""
"mall";"Toko";"Ruko Fahmi Family";"Masjid Al-Huda, Jalan, Jombang, Ciputat, South Tangerang City, Banten 15414";"Jalan, Jombang, Ciputat, South Tangerang City";"BANTEN";"15414";"Indonesia";"";"";"";"-6.2922044";"106.6983286";"https://maps.google.com/?cid=0x0:0xb72010b8fa390537";""
"mall";"Pusat Perbelanjaan";"WARUNG BIKOM CILALUNG";"Jl. H. M. Marjaya I No.103, RT.2/RW.15, Jombang, Kec. Ciputat, Kota Tangerang Selatan, Banten 15414";"RT.2/RW.15, Jombang, Kec. Ciputat, Kota Tangerang Selatan";"BANTEN";"15414";"Indonesia";"";"";"";"-6.304532";"106.705306";"https://maps.google.com/?cid=0x0:0x2cd6a869367667a0";""
"mall";"Toko Alat Tulis";"Toko Rifa Stationery Jombang";"Jl. Jombang Raya No.73, Jombang, Kec. Ciputat, Kota Tangerang Selatan, Banten 15414";"Jombang, Kec. Ciputat, Kota Tangerang Selatan";"BANTEN";"15414";"Indonesia";" 0217454002";"";"";"-6.2961606";"106.7117386";"https://maps.google.com/?cid=0x0:0xdcc3ac261583f10";""
"mall";"";"OMOTESANDO MALL BINTARO";"Jl. Jombang Raya, Bintaro, Kec. Pd. Aren, Kota Tangerang Selatan, Banten 15414";"Bintaro, Kec. Pd. Aren, Kota Tangerang Selatan";"BANTEN";"15414";"Indonesia";"";"";"";"-6.2813314";"106.7034174";"https://maps.google.com/?cid=0x0:0x60c0384241516989";""
"mall";"Toko Ponsel";"SEVEN PHONE";"Jl. Jombang Raya No.98, Jombang, Kec. Ciputat, Kota Tangerang Selatan, Banten 15414";"Jombang, Kec. Ciputat, Kota Tangerang Selatan";"BANTEN";"15414";"Indonesia";" 081288345626";"";"";"-6.2966144";"106.7120428";"https://maps.google.com/?cid=0x0:0x9185b7ce2e4dbe08";""
"mall";"Pusat Perbelanjaan";"Waroeng Bang Leman";"Jl. Tidore No.27, Jombang, Kec. Ciputat, Kota Tangerang Selatan, Banten 15414";"Jombang, Kec. Ciputat, Kota Tangerang Selatan";"BANTEN";"15414";"Indonesia";"";"";"";"-6.2906938";"106.6950468";"https://maps.google.com/?cid=0x0:0x424163a52252e2ac";""
"mall";"Pusat Perbelanjaan";"Warung Barjah";"Jalan Sumatera, kampung rawa lele Rt05 Rw 07 No 93, Jombang, Kec. Ciputat, Kota Tangerang Selatan, Banten 15414";"kampung rawa lele Rt05 Rw 07 No 93, Jombang, Kec. Ciputat, Kota Tangerang Selatan";"BANTEN";"15414";"Indonesia";" 08176544143";"";"";"-6.2966123";"106.7028843";"https://maps.google.com/?cid=0x0:0x54ca7cdc8286422";""
"mall";"Toko";"Toko areng wawan";"Jl. Kalimantan II Gg. H Boang No.99, RT.06/RW.12, Jombang, Kec. Ciputat, Kota Tangerang Selatan, Banten 15414";"RT.06/RW.12, Jombang, Kec. Ciputat, Kota Tangerang Selatan";"BANTEN";"15414";"Indonesia";" 081389122299";"";"";"-6.2905753";"106.700977";"https://maps.google.com/?cid=0x0:0xb8b7161295b1a70e";""
"mall";"Toko umum";"Sudimara toko mainan";"Jl. Jombang Raya No.66, Jombang, Kec. Ciputat, Kota Tangerang Selatan, Banten 15414";"Jombang, Kec. Ciputat, Kota Tangerang Selatan";"BANTEN";"15414";"Indonesia";"";"";"";"-6.2963251";"106.7116836";"https://maps.google.com/?cid=0x0:0x53eee83602e9d0cb";""
"mall";"Tempat Parkir";"Cilegon Center Mall";"Jl. Ahmad Yani, Sukmajaya, Kec. Jombang, Kota Cilegon, Banten 42426";"Sukmajaya, Kec. Jombang, Kota Cilegon";"BANTEN";"42426";"Indonesia";" 02547817447";"";"";"-6.0246159";"106.0699058";"https://maps.google.com/?cid=0x0:0x35dde04f05071026";""
"mall";"Toko Swalayan";"Frozen Food KFF";"Gg. Sakinah Jl. Jombang Raya No.9 BLOK E13, RW.11, Jombang, Kec. Ciputat, Kota Tangerang Selatan, Banten 15414";"RW.11, Jombang, Kec. Ciputat, Kota Tangerang Selatan";"BANTEN";"15414";"Indonesia";" 0818690120";"";"";"-6.2956359";"106.7055514";"https://maps.google.com/?cid=0x0:0x20a9ce979224ee97";""
"mall";"Pedagang ternak";"Kandang Bae";"Jl.Pertanian, Parigi Lama RT.RW 02/021, Jombang, Kec. Ciputat, Kota Tangerang Selatan, Banten 15414";"Parigi Lama RT.RW 02/021, Jombang, Kec. Ciputat, Kota Tangerang Selatan";"BANTEN";"15414";"Indonesia";" 081519276262";"";"";"-6.2886585";"106.6984691";"https://maps.google.com/?cid=0x0:0x4be8c07fb2c9c4bc";""
"mall";"Pusat Perbelanjaan";"waroeng bu isti";"PP25+4G9, Jombang, Kec. Ciputat, Kota Tangerang Selatan, Banten 15414";"Jombang, Kec. Ciputat, Kota Tangerang Selatan";"BANTEN";"15414";"Indonesia";"";"";"";"-6.2997039";"106.7088717";"https://maps.google.com/?cid=0x0:0x980b60643b6c12ef";""
"mall";"Toko";"Bagas jengkol Mg_okle";"Jombang, Kec. Ciputat, Kota Tangerang Selatan, Banten 15414";"Kec. Ciputat, Kota Tangerang Selatan";"BANTEN";"15414";"Indonesia";" 089669662221";"";"";"-6.2960608";"106.7118027";"https://maps.google.com/?cid=0x0:0x5c269a4ce540c712";""
"mall";"Pujasera";"Plaza Cordoba";"MMXR+MQH, Rw. Mekar Jaya, Kec. Serpong, Kota Tangerang Selatan, Banten 15310";"Rw. Mekar Jaya, Kec. Serpong, Kota Tangerang Selatan";"BANTEN";"15310";"Indonesia";"";"";"";"-6.3008154";"106.6919976";"https://maps.google.com/?cid=0x0:0xbd48cf47057dbead";""
"mall";"Pusat Perbelanjaan";"Warung Ma Uwie";"PP42+969, Jombang, Kec. Ciputat, Kota Tangerang Selatan, Banten 15414";"Jombang, Kec. Ciputat, Kota Tangerang Selatan";"BANTEN";"15414";"Indonesia";" 08998064920";"";"";"-6.2940796";"106.7006132";"https://maps.google.com/?cid=0x0:0x10d0d705c08da13c";""
