Category;Real Category;Business Name;Address;City;State;Postal Code;Country;Phone;Email;Website;Latitude;Longitude;Map Link;Details Link
"mall";"Pusat Perbelanjaan";"Waroeng Nabila";"Cikarang, Kec. Cibeber, Kabupaten Lebak, Banten 42394";"Kec. Cibeber, Kabupaten Lebak";"BANTEN";"42394";"Indonesia";" 085716569863";"";"";"-6.8137218";"106.4282924";"https://maps.google.com/?cid=0x0:0xe2e65dec646947d2";""
"mall";"Pusat Perbelanjaan";"Reiifha Grosir";"Jalan Raya Cibeber, Cikotok, Kec. Cibeber, Kabupaten Lebak, Banten 42394";"Cikotok, Kec. Cibeber, Kabupaten Lebak";"BANTEN";"42394";"Indonesia";" 083891735778";"";"";"-6.8414369";"106.3088943";"https://maps.google.com/?cid=0x0:0x143f7bdbde1c00bf";""
"mall";"Pusat Perbelanjaan";"DHEVIRA CELLULAR";"Wanasari, Kec. Cibeber, Kabupaten Lebak, Banten 42394";"Kec. Cibeber, Kabupaten Lebak";"BANTEN";"42394";"Indonesia";" 085219337377";"";"";"-6.8382219";"106.3807155";"https://maps.google.com/?cid=0x0:0x1eeaa637b064c164";""
"mall";"Tempat Parkir";"Cilegon Center Mall";"Jl. Ahmad Yani, Sukmajaya, Kec. Jombang, Kota Cilegon, Banten 42426";"Sukmajaya, Kec. Jombang, Kota Cilegon";"BANTEN";"42426";"Indonesia";" 02547817447";"";"";"-6.0246159";"106.0699058";"https://maps.google.com/?cid=0x0:0x35dde04f05071026";""
"mall";"Kedai Kopi";"PERSEMAIAN KOPI ARABIKA";"59JM+XC3, Wanasari, Kec. Cibeber, Kabupaten Lebak, Banten 42394";"Wanasari, Kec. Cibeber, Kabupaten Lebak";"BANTEN";"42394";"Indonesia";" 085794255057";"";"";"-6.817615";"106.38354";"https://maps.google.com/?cid=0x0:0x8a4b2f73afec3a10";""
"mall";"Toko Alat Tulis Kantor";"ATK BALQIS";"786W+GJG, Jembatan Ciomas, Ciusul, Citorek Kidul, Kec. Cibeber, Kabupaten Lebak, Banten 42394";"Jembatan Ciomas, Ciusul, Citorek Kidul, Kec. Cibeber, Kabupaten Lebak";"BANTEN";"42394";"Indonesia";" 085888404764";"";"";"-6.7386852";"106.3465813";"https://maps.google.com/?cid=0x0:0xb663a6ef7033311b";""
"mall";"Pusat Perbelanjaan";"GHIRAS SPORT";"588G+6VG, Raya Muhara, Warungbanten, Cibeber, Lebak Regency, Banten 42394";"Raya Muhara, Warungbanten, Cibeber, Lebak Regency";"BANTEN";"42394";"Indonesia";"";"";"";"-6.8344355";"106.3272055";"https://maps.google.com/?cid=0x0:0xd1aade5f2fdefbb";""
"mall";"Toko";"Toko Desi Putri";"58GF+MRX, Unnamed Road, Warungbanten, Kec. Cibeber, Kabupaten Lebak, Banten 42394";"Unnamed Road, Warungbanten, Kec. Cibeber, Kabupaten Lebak";"BANTEN";"42394";"Indonesia";"";"";"";"-6.8232645";"106.3245978";"https://maps.google.com/?cid=0x0:0x448029b5c442737f";""
"mall";"Toko";"Toko rigitha";"5824+9X9, Jl. Ciherang, Ciherang, Kec. Cibeber, Kabupaten Lebak, Banten 42394";"Jl. Ciherang, Ciherang, Kec. Cibeber, Kabupaten Lebak";"BANTEN";"42394";"Indonesia";"";"";"";"-6.8490821";"106.3074736";"https://maps.google.com/?cid=0x0:0x96a2657249fdc369";""
"mall";"Area Mendaki";"Zura Hill (Taman Durian)";"48X2+QGQ, Cikotok, Kec. Cibeber, Kabupaten Lebak, Banten 42394";"Cikotok, Kec. Cibeber, Kabupaten Lebak";"BANTEN";"42394";"Indonesia";" 0210888888";"";"";"-6.8505264";"106.3013607";"https://maps.google.com/?cid=0x0:0xac187d6e70153f66";""
"mall";"Toko";"DORVE STORE";"Pasir Nangka, RT.1/RW.4, Cikotok, Kec. Cibeber, Kabupaten Lebak, Banten 42394";"RT.1/RW.4, Cikotok, Kec. Cibeber, Kabupaten Lebak";"BANTEN";"42394";"Indonesia";" 085694055672";"";"/url?q>>u003dhttps://dorvestore.com/>>u0026opi>>u003d79508299>>u0026sa>>u003dU>>u0026ved>>u003d0ahUKEwiOwqvjvK6LAxWXUfUHHd_gNu8Q61gIFigS>>u0026usg>>u003dAOvVaw2Yn2-_DS6dm6CW25fc6w7L";"-6.851403";"106.3063902";"https://maps.google.com/?cid=0x0:0x4fb4144b74fe23a8";""
"mall";"Pusat Perbelanjaan";"WARUNG PANJANG";"6F8P+846, Pangamboan, Sinargalih, Kec. Cibeber, Kabupaten Lebak, Banten 42394";"Pangamboan, Sinargalih, Kec. Cibeber, Kabupaten Lebak";"BANTEN";"42394";"Indonesia";"";"";"";"-6.7841557";"106.4852324";"https://maps.google.com/?cid=0x0:0xe1390f7a547370a0";""
"mall";"Pusat Perbelanjaan";"Mianmart";"Lebak Larang, Wanasari, Kec. Cibeber, Kabupaten Lebak, Banten 42394";"Wanasari, Kec. Cibeber, Kabupaten Lebak";"BANTEN";"42394";"Indonesia";"";"";"";"-6.8434264";"106.369903";"https://maps.google.com/?cid=0x0:0xd9dc1dce4e8aaf24";""
"mall";"Supermarket Industri";"Agen Sembako";"883M+HPV, Jl. Raya Cipanas-Cibeber, Citorek Tengah, Kec. Cibeber, Kabupaten Lebak, Banten 42394";"Jl. Raya Cipanas-Cibeber, Citorek Tengah, Kec. Cibeber, Kabupaten Lebak";"BANTEN";"42394";"Indonesia";"";"";"";"-6.6960066";"106.3343114";"https://maps.google.com/?cid=0x0:0x13634a8f7a351005";""
"mall";"Supermarket Industri";"Warung Sembako, Bpk. Rohmat";"58RJ+QR, Cihambali, Kec. Cibeber, Kabupaten Lebak, Banten";"Kabupaten Lebak, Banten";"BANTEN";"";"Indonesia";" 081282517032";"";"";"-6.808028";"106.3320541";"https://maps.google.com/?cid=0x0:0xf4adb99ae904a2f8";""
"mall";"Pusat Perbelanjaan";"CitiMall Cilegon";"Jl. Jenderal Sudirman, Ramanuju, Kec. Purwakarta, Kota Cilegon, Banten 42431";"Ramanuju, Kec. Purwakarta, Kota Cilegon";"BANTEN";"42431";"Indonesia";"";"";"";"-6.0131211";"106.045255";"https://maps.google.com/?cid=0x0:0x74cd8e02666473ae";""
"mall";"Pusat Perbelanjaan";"Toko Sembako Via";"6FCP+445, Nangela, Sinargalih, Kec. Cibeber, Kabupaten Lebak, Banten 42394";"Nangela, Sinargalih, Kec. Cibeber, Kabupaten Lebak";"BANTEN";"42394";"Indonesia";"";"";"";"-6.779725";"106.4852837";"https://maps.google.com/?cid=0x0:0xf4541a7a7f4ab83a";""
"mall";"Pusat Perbelanjaan";"Agen Eiger Warxy";"48M2+76X, Cibeber, Kec. Cibeber, Kabupaten Lebak, Banten 42394";"Cibeber, Kec. Cibeber, Kabupaten Lebak";"BANTEN";"42394";"Indonesia";" 081245587110";"";"";"-6.8667651";"106.3005961";"https://maps.google.com/?cid=0x0:0xa2cc9831b003c81d";""
"mall";"Toko Pakaian";"Rumah Intan";"47G5+CMC, kp, Pasir Eurih, Cimancak, Kec. Bayah, Kabupaten Lebak, Banten 42393";"kp, Pasir Eurih, Cimancak, Kec. Bayah, Kabupaten Lebak";"BANTEN";"42393";"Indonesia";" 083147325096";"";"";"-6.8739283";"106.2591517";"https://maps.google.com/?cid=0x0:0x6a1c62f9107837ba";""
"mall";"mall";"Kec. Cibeber";"Kabupaten Lebak, Banten";"Kabupaten Lebak, Banten";"BANTEN";"";"Indonesia";"";"";"";"-6.8192431";"106.383813";"https://maps.google.com/?cid=0x0:0x401e8f1fc28deb0";""
"mall";"Pusat Perbelanjaan";"warung ikan kebut 23";"5CQG+29W, Kujangjaya, Kec. Cibeber, Kabupaten Lebak, Banten 42394";"Kujangjaya, Kec. Cibeber, Kabupaten Lebak";"BANTEN";"42394";"Indonesia";" 082246747114";"";"";"-6.8123855";"106.4259421";"https://maps.google.com/?cid=0x0:0xbb834daaef3489a8";""
"mall";"Pusat Perbelanjaan";"Waroeng Eiger";"48M2+746, Cikotok, Kec. Cibeber, Kabupaten Lebak, Banten 42394";"Cikotok, Kec. Cibeber, Kabupaten Lebak";"BANTEN";"42394";"Indonesia";"";"";"";"-6.8668324";"106.30025";"https://maps.google.com/?cid=0x0:0x95de156183191ebb";""
"mall";"Toko Pakaian";"CIKUNING INDAH";"88MV+PG8, Cikuning, Sukamaju, Kec. Sobang, Kabupaten Lebak, Banten 42318";"Cikuning, Sukamaju, Kec. Sobang, Kabupaten Lebak";"BANTEN";"42318";"Indonesia";"";"";"";"-6.6623318";"106.3409487";"https://maps.google.com/?cid=0x0:0x4a8eab51111b4ab3";""
"mall";"Pusat Perbelanjaan";"Toko pa Ono sumarna";"883M+JQP, Jl. Raya Cipanas-Cibeber, Citorek Tengah, Kec. Cibeber, Kabupaten Lebak, Banten 42394";"Jl. Raya Cipanas-Cibeber, Citorek Tengah, Kec. Cibeber, Kabupaten Lebak";"BANTEN";"42394";"Indonesia";"";"";"";"-6.6959104";"106.3344643";"https://maps.google.com/?cid=0x0:0xb16dca886e6a32d8";""
"mall";"Restoran atau Kafe";"Pasar Warungbanten";"588H+R78, Warungbanten, Kec. Cibeber, Kabupaten Lebak, Banten 42394";"Warungbanten, Kec. Cibeber, Kabupaten Lebak";"BANTEN";"42394";"Indonesia";"";"";"";"-6.8329677";"106.328208";"https://maps.google.com/?cid=0x0:0x39815588b5216405";""
"mall";"Tempat Parkir";"Cilegon Center Mall";"Jl. Ahmad Yani, Sukmajaya, Kec. Jombang, Kota Cilegon, Banten 42426";"Sukmajaya, Kec. Jombang, Kota Cilegon";"BANTEN";"42426";"Indonesia";" 02547817447";"";"";"-6.0246159";"106.0699058";"https://maps.google.com/?cid=0x0:0x35dde04f05071026";""
"mall";"Pusat Perbelanjaan";"CitiMall Cilegon";"Jl. Jenderal Sudirman, Ramanuju, Kec. Purwakarta, Kota Cilegon, Banten 42431";"Ramanuju, Kec. Purwakarta, Kota Cilegon";"BANTEN";"42431";"Indonesia";"";"";"";"-6.0131211";"106.045255";"https://maps.google.com/?cid=0x0:0x74cd8e02666473ae";""
"mall";"Bioskop";"Cilegon Center Mall XXI";"Sukmajaya, Kec. Jombang, Kota Cilegon, Banten 42416";"Kec. Jombang, Kota Cilegon";"BANTEN";"42416";"Indonesia";" 02545752121";"";"/url?q>>u003dhttps://www.21cineplex.com/>>u0026opi>>u003d79508299>>u0026sa>>u003dU>>u0026ved>>u003d0ahUKEwiD56P-vK6LAxU-ZvUHHbNtG6YQ61gIFigS>>u0026usg>>u003dAOvVaw2wqjsNMUrmBnwdCFXQRC8Z";"-6.0237755";"106.0700234";"https://maps.google.com/?cid=0x0:0x9d69fcfc46d57287";""
"mall";"Toko";"Cocoa Nut Premium Seserahan";"PCI Blok B19/11, Kedaleman, Cibeber, Cilegon, Banten 42422";"Kedaleman, Cibeber, Cilegon";"BANTEN";"42422";"Indonesia";" 081294352499";"";"";"-6.0381019";"106.0793288";"https://maps.google.com/?cid=0x0:0x4fa0040c765620d4";""
"mall";"Restoran";"Bunderan kecil perumnas cibeber";"X387+GXM, Cibeber, Kec. Cibeber, Kota Cilegon, Banten 42426";"Cibeber, Kec. Cibeber, Kota Cilegon";"BANTEN";"42426";"Indonesia";"";"";"";"-6.033671";"106.0649286";"https://maps.google.com/?cid=0x0:0x5c0535209f1cce54";""
"mall";"Pusat Perbelanjaan";"CnJ@";"X356+V96, Cibeber, Kec. Cibeber, Kota Cilegon, Banten 42426";"Cibeber, Kec. Cibeber, Kota Cilegon";"BANTEN";"42426";"Indonesia";" 081911145446";"";"";"-6.0403312";"106.0609009";"https://maps.google.com/?cid=0x0:0x8bb802a378142f9a";""
"mall";"Toko makanan beku";"Prima Freshmart Pondok Cilegon Indah";"X36C+PH7, Cibeber, Kec. Cibeber, Kota Cilegon, Banten 42422";"Cibeber, Kec. Cibeber, Kota Cilegon";"BANTEN";"42422";"Indonesia";" 08176021353";"";"";"-6.0382213";"106.071436";"https://maps.google.com/?cid=0x0:0xde2c830292a7fbe8";""
"mall";"Pusat Perbelanjaan";"Cilegon Center Mall Lobby Matahari dept Store";"X3GC+G27, Sukmajaya, Kec. Jombang, Kota Cilegon, Banten 42416";"Sukmajaya, Kec. Jombang, Kota Cilegon";"BANTEN";"42416";"Indonesia";"";"";"";"-6.023708";"106.0700473";"https://maps.google.com/?cid=0x0:0xd320cd494c699bf0";""
"mall";"Toko Elektronik";"Informa Cilegon Center Mall (CCM)";"Jl. Ahmad Yani, Sukmajaya, Kec. Jombang, Kota Cilegon, Banten 42416";"Sukmajaya, Kec. Jombang, Kota Cilegon";"BANTEN";"42416";"Indonesia";" 085817854299";"";"/url?q>>u003dhttp://linktr.ee/salesinformacilegon>>u0026opi>>u003d79508299>>u0026sa>>u003dU>>u0026ved>>u003d0ahUKEwiGvsiAva6LAxU5afUHHbpfNZEQ61gIFigS>>u0026usg>>u003dAOvVaw03slNr_jdPQJSYvMfg1XLq";"-6.0249082";"106.0698679";"https://maps.google.com/?cid=0x0:0x47069e0c5f0a4463";""
"mall";"Pusat Perbelanjaan";"Pusat Oleh-Oleh KENEKE Cilegon";"Jl. Lingkar Selatan No.Km 0,6 Blok.A No.2, Kedaleman, Kec. Cibeber, Kota Cilegon, Banten 42422";"Kedaleman, Kec. Cibeber, Kota Cilegon";"BANTEN";"42422";"Indonesia";" 085966317453";"";"";"-6.0378432";"106.0808215";"https://maps.google.com/?cid=0x0:0x9eef2267f105bee7";""
"mall";"Toko Swalayan";"Super Indo Cilegon Center";"Cilegon Center Mall, Lt. LG, Sukmajaya, Kec. Jombang, Kota Cilegon, Banten 42416";"Lt. LG, Sukmajaya, Kec. Jombang, Kota Cilegon";"BANTEN";"42416";"Indonesia";" 02547817192";"";"/url?q>>u003dhttp://www.superindo.co.id/>>u0026opi>>u003d79508299>>u0026sa>>u003dU>>u0026ved>>u003d0ahUKEwiWztaBva6LAxW_oa8BHaJZGTcQ61gIFigS>>u0026usg>>u003dAOvVaw3I9l1s1zTu_94t3futFY2T";"-6.0246159";"106.0699058";"https://maps.google.com/?cid=0x0:0xec91b2fbb5919de";""
"mall";"Pusat Perbelanjaan";"betta.spply";"Kode Pos, Perumnas BCK Blok C.15 No.21, RT002/RW010, Cibeber, Kec. Cibeber, Kota Cilegon, Banten 42423";"Perumnas BCK Blok C.15 No.21, RT002/RW010, Cibeber, Kec. Cibeber, Kota Cilegon";"BANTEN";"42423";"Indonesia";"";"";"";"-6.0400184";"106.0625294";"https://maps.google.com/?cid=0x0:0x58805d47be2d17ad";""
"mall";"Restoran";"KAMPUNG KULINER LATAR AMBEU (LA)";"Jl. Lingkar Selatan No.Dalam, Cibeber, Kec. Cibeber, Kota Cilegon, Banten 42426";"Cibeber, Kec. Cibeber, Kota Cilegon";"BANTEN";"42426";"Indonesia";"";"";"";"-6.03494";"106.0666969";"https://maps.google.com/?cid=0x0:0xc5a38da72453888b";""
"mall";"Minimarket";"Indomaret Karangasem Cibeber";"X364+M5H, Jalan, Karangasem, Cibeber, Cilegon, Banten 42426";"Jalan, Karangasem, Cibeber, Cilegon";"BANTEN";"42426";"Indonesia";"";"";"";"-6.0383185";"106.0554865";"https://maps.google.com/?cid=0x0:0xb9313b13ad39ea96";""
"mall";"Minimarket";"Alfamart bunderan perumnas";"Jl. Garuda No.4e, Cibeber, Kec. Cibeber, Kota Cilegon, Banten 42426";"Cibeber, Kec. Cibeber, Kota Cilegon";"BANTEN";"42426";"Indonesia";"";"";"";"-6.0320582";"106.0656515";"https://maps.google.com/?cid=0x0:0x2d1044b9ec1c6d98";""
"mall";"Kafe";"Janee's Base Camp";"Jl Belibis Raya Perumnas Bumi, Kencana, Kec. Cibeber, Kota Cilegon, Banten 42421";"Kencana, Kec. Cibeber, Kota Cilegon";"BANTEN";"42421";"Indonesia";" 081297988010";"";"";"-6.0363934";"106.0639403";"https://maps.google.com/?cid=0x0:0x31f2c3ed6946496";""
"mall";"Asosiasi/organisasi";"Primkokas Krakatau Junction";"X37H+PXJ, Jalan Pondok Cilegon Indah, Ruko Pondok Cilegon Indah Blok A, Kedaleman, Kec. Cilegon, Kota Cilegon, Banten 42448";"Jalan Pondok Cilegon Indah, Ruko Pondok Cilegon Indah Blok A, Kedaleman, Kec. Cilegon, Kota Cilegon";"BANTEN";"42448";"Indonesia";" 0254387156";"";"/url?q>>u003dhttp://www.primkokas.co.id/>>u0026opi>>u003d79508299>>u0026sa>>u003dU>>u0026ved>>u003d0ahUKEwjk-5OEva6LAxUWavUHHSM_ALEQ61gIFSgR>>u0026usg>>u003dAOvVaw2Dh8-7qH2deFQ-2TzohCPM";"-6.035658";"106.0798812";"https://maps.google.com/?cid=0x0:0xab176b92148fe264";""
"mall";"Toko";"Winda Shop";"X3HM+7WG, Terminal Seruni, Jl. Raya Cilegon, Kedaleman, Kec. Cibeber, Kota Cilegon, Banten 42422";"Terminal Seruni, Jl. Raya Cilegon, Kedaleman, Kec. Cibeber, Kota Cilegon";"BANTEN";"42422";"Indonesia";" 087808274400";"";"";"-6.0218094";"106.0848165";"https://maps.google.com/?cid=0x0:0xbca1b9af51fd5d67";""
"mall";"Pusat Perbelanjaan";"CIPLAZ CILEGON (RAMAYANA)";"Jl. Raya Cilegon, Sukmajaya, Kec. Jombang, Kota Cilegon, Banten 42416";"Sukmajaya, Kec. Jombang, Kota Cilegon";"BANTEN";"42416";"Indonesia";"";"";"/url?q>>u003dhttp://ramayana.co.id/>>u0026opi>>u003d79508299>>u0026sa>>u003dU>>u0026ved>>u003d0ahUKEwicu4WFva6LAxXZSfUHHS0uM3gQ61gIEigO>>u0026usg>>u003dAOvVaw0kfjj0Nb0psOg1onjBHXkc";"-6.0216681";"106.06362";"https://maps.google.com/?cid=0x0:0x3f3ea9461d4738de";""
"mall";"mall";"Banten 42422";"Kec. Cibeber, Kota Cilegon, Banten";"Kota Cilegon, Banten";"BANTEN";"";"Indonesia";"";"";"";"-6.0337179";"106.0787142";"https://maps.google.com/?cid=0x0:0x1c00c5eb568ecdd0";""
"mall";"Komplek perumahan";"Gerbang PCI Cilegon";"X38J+HH9, Kedaleman, Kec. Cibeber, Kota Cilegon, Banten 42422";"Kedaleman, Kec. Cibeber, Kota Cilegon";"BANTEN";"42422";"Indonesia";"";"";"";"-6.0335926";"106.0814882";"https://maps.google.com/?cid=0x0:0xe74e4f39d6bd04b";""
"mall";"mall";"OH!SOME - Cilegon Center Mall";"Cilegon Center Mall, Jl. Ahmad Yani, Sukmajaya, Kec. Jombang, Kota Cilegon, Banten 42426";"Jl. Ahmad Yani, Sukmajaya, Kec. Jombang, Kota Cilegon";"BANTEN";"42426";"Indonesia";" 081380776487";"";"";"-6.0247074";"106.0700777";"https://maps.google.com/?cid=0x0:0x633bc65e13db6471";""
"mall";"Toko Pakaian";"Celcius Cilegon Center Mall (CCM) Cilegon";"TOKO CELCIUS, lantai UG, Sukmajaya, Kec. Jombang, Kota Cilegon, Banten 42416";"lantai UG, Sukmajaya, Kec. Jombang, Kota Cilegon";"BANTEN";"42416";"Indonesia";" 081281249508";"";"";"-6.0254252";"106.0702699";"https://maps.google.com/?cid=0x0:0xe9a5e14617559915";""
"mall";"Pusat Perbelanjaan";"Transmart Cilegon";"Jl. KH. Yasin Beji No.2, Kebondalem, Kec. Purwakarta, Kota Cilegon, Banten 42433";"Kebondalem, Kec. Purwakarta, Kota Cilegon";"BANTEN";"42433";"Indonesia";" 085888376350";"";"";"-6.0072741";"106.0427409";"https://maps.google.com/?cid=0x0:0xdc16e98a9f63a51c";""
"mall";"Pusat Perbelanjaan";"Hypermart - Cilegon";"MAYOFIELD MALL JL SA TIRTASAYA SIMPANG TIGA, Kota Cilegon, Banten 42431";"Kota Cilegon";"BANTEN";"42431";"Indonesia";" 0254388741";"";"/url?q>>u003dhttp://www.hypermart.co.id/>>u0026opi>>u003d79508299>>u0026sa>>u003dU>>u0026ved>>u003d0ahUKEwjb5LqHva6LAxXVa_UHHd37E94Q61gIFCgQ>>u0026usg>>u003dAOvVaw3BakRTs7WNYbGn2LliCtLK";"-6.0131239";"106.0452553";"https://maps.google.com/?cid=0x0:0x76e8c77645e65068";""
"mall";"Tempat Parkir";"Cilegon Center Mall";"Jl. Ahmad Yani, Sukmajaya, Kec. Jombang, Kota Cilegon, Banten 42426";"Sukmajaya, Kec. Jombang, Kota Cilegon";"BANTEN";"42426";"Indonesia";" 02547817447";"";"";"-6.0246159";"106.0699058";"https://maps.google.com/?cid=0x0:0x35dde04f05071026";""
"mall";"Pusat Perbelanjaan";"CitiMall Cilegon";"Jl. Jenderal Sudirman, Ramanuju, Kec. Purwakarta, Kota Cilegon, Banten 42431";"Ramanuju, Kec. Purwakarta, Kota Cilegon";"BANTEN";"42431";"Indonesia";"";"";"";"-6.0131211";"106.045255";"https://maps.google.com/?cid=0x0:0x74cd8e02666473ae";""
"mall";"Bioskop";"Cilegon Center Mall XXI";"Sukmajaya, Kec. Jombang, Kota Cilegon, Banten 42416";"Kec. Jombang, Kota Cilegon";"BANTEN";"42416";"Indonesia";" 02545752121";"";"/url?q>>u003dhttps://www.21cineplex.com/>>u0026opi>>u003d79508299>>u0026sa>>u003dU>>u0026ved>>u003d0ahUKEwjV0Mefva6LAxWsia8BHXr8JBYQ61gIFigS>>u0026usg>>u003dAOvVaw2Nfomylxt7CqfxQv7dJtSe";"-6.0237755";"106.0700234";"https://maps.google.com/?cid=0x0:0x9d69fcfc46d57287";""
"mall";"Pusat Perbelanjaan";"betta.spply";"Kode Pos, Perumnas BCK Blok C.15 No.21, RT002/RW010, Cibeber, Kec. Cibeber, Kota Cilegon, Banten 42423";"Perumnas BCK Blok C.15 No.21, RT002/RW010, Cibeber, Kec. Cibeber, Kota Cilegon";"BANTEN";"42423";"Indonesia";"";"";"";"-6.0400184";"106.0625294";"https://maps.google.com/?cid=0x0:0x58805d47be2d17ad";""
"mall";"Restoran";"Bunderan kecil perumnas cibeber";"X387+GXM, Cibeber, Kec. Cibeber, Kota Cilegon, Banten 42426";"Cibeber, Kec. Cibeber, Kota Cilegon";"BANTEN";"42426";"Indonesia";"";"";"";"-6.033671";"106.0649286";"https://maps.google.com/?cid=0x0:0x5c0535209f1cce54";""
"mall";"Minimarket";"Indomaret Karangasem Cibeber";"X364+M5H, Jalan, Karangasem, Cibeber, Cilegon, Banten 42426";"Jalan, Karangasem, Cibeber, Cilegon";"BANTEN";"42426";"Indonesia";"";"";"";"-6.0383185";"106.0554865";"https://maps.google.com/?cid=0x0:0xb9313b13ad39ea96";""
"mall";"Toko";"Naura grosir cilegon";"Jl. Komp. Pd. Cilegon Indah, Cibeber, Kec. Cibeber, Kota Cilegon, Banten 42422";"Cibeber, Kec. Cibeber, Kota Cilegon";"BANTEN";"42422";"Indonesia";"";"";"";"-6.0382859";"106.075816";"https://maps.google.com/?cid=0x0:0x99d4dd2250d319f5";""
"mall";"Pusat Perbelanjaan";"Cilegon Center Mall Lobby Matahari dept Store";"X3GC+G27, Sukmajaya, Kec. Jombang, Kota Cilegon, Banten 42416";"Sukmajaya, Kec. Jombang, Kota Cilegon";"BANTEN";"42416";"Indonesia";"";"";"";"-6.023708";"106.0700473";"https://maps.google.com/?cid=0x0:0xd320cd494c699bf0";""
"mall";"Toko Ponsel";"HR CELL Counter (Sparta)";"X345+R2P link, Jl. Ciberko Jl. Kalitimbang, Kalitimbang, Cibeber, Cilegon, Banten 42426";"Jl. Ciberko Jl. Kalitimbang, Kalitimbang, Cibeber, Cilegon";"BANTEN";"42426";"Indonesia";" 081911279691";"";"";"-6.0429108";"106.0575718";"https://maps.google.com/?cid=0x0:0xbc0c49dfff348dfd";""
"mall";"Minimarket";"Alfamart bunderan perumnas";"Jl. Garuda No.4e, Cibeber, Kec. Cibeber, Kota Cilegon, Banten 42426";"Cibeber, Kec. Cibeber, Kota Cilegon";"BANTEN";"42426";"Indonesia";"";"";"";"-6.0320582";"106.0656515";"https://maps.google.com/?cid=0x0:0x2d1044b9ec1c6d98";""
"mall";"Toko bahan makanan";"Peyek Bu Mar";"Jalan Perum Harjatani Permai No.1 Blok K, RT.4/RW.4, Cibeber, Kec. Cibeber, Kota Cilegon, Banten 42426";"RT.4/RW.4, Cibeber, Kec. Cibeber, Kota Cilegon";"BANTEN";"42426";"Indonesia";" 081911231455";"";"";"-6.039379";"106.0598227";"https://maps.google.com/?cid=0x0:0xf0e1bf22e5e05dac";""
"mall";"Toko makanan beku";"Prima Freshmart Pondok Cilegon Indah";"X36C+PH7, Cibeber, Kec. Cibeber, Kota Cilegon, Banten 42422";"Cibeber, Kec. Cibeber, Kota Cilegon";"BANTEN";"42422";"Indonesia";" 08176021353";"";"";"-6.0382213";"106.071436";"https://maps.google.com/?cid=0x0:0xde2c830292a7fbe8";""
"mall";"Restoran";"KAMPUNG KULINER LATAR AMBEU (LA)";"Jl. Lingkar Selatan No.Dalam, Cibeber, Kec. Cibeber, Kota Cilegon, Banten 42426";"Cibeber, Kec. Cibeber, Kota Cilegon";"BANTEN";"42426";"Indonesia";"";"";"";"-6.03494";"106.0666969";"https://maps.google.com/?cid=0x0:0xc5a38da72453888b";""
"mall";"Kafe";"Janee's Base Camp";"Jl Belibis Raya Perumnas Bumi, Kencana, Kec. Cibeber, Kota Cilegon, Banten 42421";"Kencana, Kec. Cibeber, Kota Cilegon";"BANTEN";"42421";"Indonesia";" 081297988010";"";"";"-6.0363934";"106.0639403";"https://maps.google.com/?cid=0x0:0x31f2c3ed6946496";""
"mall";"Pusat Perbelanjaan";"Transmart Cilegon";"Jl. KH. Yasin Beji No.2, Kebondalem, Kec. Purwakarta, Kota Cilegon, Banten 42433";"Kebondalem, Kec. Purwakarta, Kota Cilegon";"BANTEN";"42433";"Indonesia";" 085888376350";"";"";"-6.0072741";"106.0427409";"https://maps.google.com/?cid=0x0:0xdc16e98a9f63a51c";""
"mall";"Pusat Perbelanjaan";"CIPLAZ CILEGON (RAMAYANA)";"Jl. Raya Cilegon, Sukmajaya, Kec. Jombang, Kota Cilegon, Banten 42416";"Sukmajaya, Kec. Jombang, Kota Cilegon";"BANTEN";"42416";"Indonesia";"";"";"/url?q>>u003dhttp://ramayana.co.id/>>u0026opi>>u003d79508299>>u0026sa>>u003dU>>u0026ved>>u003d0ahUKEwj38-2kva6LAxUEkK8BHaj-ASYQ61gIEigO>>u0026usg>>u003dAOvVaw1GRcvHlgJY52tbBkbDsAC_";"-6.0216681";"106.06362";"https://maps.google.com/?cid=0x0:0x3f3ea9461d4738de";""
"mall";"Pusat Perbelanjaan";"PAMERAN MOBIL TOYOTA (Mayofield Mall Cilegon)";"Jl. Nn No.15, Ramanuju, Kec. Purwakarta, Kota Cilegon, Banten 42431";"Ramanuju, Kec. Purwakarta, Kota Cilegon";"BANTEN";"42431";"Indonesia";" 0817628841";"";"";"-6.0132639";"106.045219";"https://maps.google.com/?cid=0x0:0x4bbe23243d3f6e6e";""
"mall";"Toko";"WBJ";"gedong cilegon damai, Kalitimbang, Kec. Cibeber, Kota Cilegon, Banten";"Kota Cilegon, Banten";"BANTEN";"";"Indonesia";"";"";"";"-6.0447609";"106.0579418";"https://maps.google.com/?cid=0x0:0x6857e644dff79189";""
"mall";"Pemasok Produk Kecantikan";"Mamie Keyza Olshop Oriflame";"Jl. Bincarung IX No.13, Cibeber, Kec. Cibeber, Kota Cilegon, Banten 42423";"Cibeber, Kec. Cibeber, Kota Cilegon";"BANTEN";"42423";"Indonesia";" 085945219044";"";"";"-6.0404544";"106.0603938";"https://maps.google.com/?cid=0x0:0x755df3348969fc63";""
"mall";"mall";"Banten 42423";"Cibeber, Kec. Cibeber, Kota Cilegon, Banten";"Kota Cilegon, Banten";"BANTEN";"";"Indonesia";"";"";"";"-6.0396008";"106.0637165";"https://maps.google.com/?cid=0x0:0x412bfea9163d3581";""
"mall";"Minimarket";"MINISO CCM CILEGON CENTER MALL";"Jl. Ahmad Yani, Sukmajaya, Kec. Jombang, Kota Cilegon, Banten 42416";"Sukmajaya, Kec. Jombang, Kota Cilegon";"BANTEN";"42416";"Indonesia";" 087771561802";"";"/url?q>>u003dhttp://www.miniso.com/>>u0026opi>>u003d79508299>>u0026sa>>u003dU>>u0026ved>>u003d0ahUKEwiryvCmva6LAxXtoa8BHc1gKjIQ61gIFigS>>u0026usg>>u003dAOvVaw1y2RldFwEP7UFeQ7UixYCK";"-6.0241344";"106.0699395";"https://maps.google.com/?cid=0x0:0xebf9e1f3472cdf6d";""
"mall";"Toko Pakaian";"3SECOND CILEGON";"TOKO 3SECOND, Jl. Ahmad Yani No.13, Sukmajaya, Kec. Jombang, Kota Cilegon, Banten 42411";"Jl. Ahmad Yani No.13, Sukmajaya, Kec. Jombang, Kota Cilegon";"BANTEN";"42411";"Indonesia";" 089678819814";"";"/url?q>>u003dhttp://www.3second.co.id/>>u0026opi>>u003d79508299>>u0026sa>>u003dU>>u0026ved>>u003d0ahUKEwib7KSnva6LAxUmavUHHRJvNt8Q61gIFigS>>u0026usg>>u003dAOvVaw150Ws5HEI7Ozo171mhud5c";"-6.0237214";"106.0674305";"https://maps.google.com/?cid=0x0:0x468f8098d5456b51";""
"mall";"Restoran";"TEH POCI  SUJELL";"X388+XCX, Jl. Garuda, Cibeber, Kec. Cibeber, Kota Cilegon, Banten 42426";"Jl. Garuda, Cibeber, Kec. Cibeber, Kota Cilegon";"BANTEN";"42426";"Indonesia";" 087774062488";"";"";"-6.0325212";"106.0660984";"https://maps.google.com/?cid=0x0:0xcc0f5972fcc57579";""
"mall";"Toko";"Toko amrue";"X378+RW2, Jl. Imam Bonjol, Cibeber, Kec. Cibeber, Kota Cilegon, Banten 42426";"Jl. Imam Bonjol, Cibeber, Kec. Cibeber, Kota Cilegon";"BANTEN";"42426";"Indonesia";"";"";"";"-6.035483";"106.0672562";"https://maps.google.com/?cid=0x0:0xcc4473200dcc9e0b";""
"mall";"Toko Pakaian";"Carvil Store - GCI Cilegon";"PERUM GRIYA CILEGON JL. SERDANG BLOK D NO. 3A, RT.07/RW.03, Harjatani, Kec. Kramatwatu, Kabupaten Serang, Banten 42434";"RT.07/RW.03, Harjatani, Kec. Kramatwatu, Kabupaten Serang";"BANTEN";"42434";"Indonesia";"";"";"";"-6.0498234";"106.0729137";"https://maps.google.com/?cid=0x0:0xe3a0432b25e0825a";""
"mall";"Pusat Perbelanjaan";"Les Pak Ndang (Ar royyan)";"Jl. Nn No.10 Blok C2, Cibeber, Cilegon, Banten 42426";"Cibeber, Cilegon";"BANTEN";"42426";"Indonesia";" 08777";"";"";"-6.0339904";"106.0676143";"https://maps.google.com/?cid=0x0:0xeab21b29a4ad41f8";""
"mall";"Tempat Parkir";"Cilegon Center Mall";"Jl. Ahmad Yani, Sukmajaya, Kec. Jombang, Kota Cilegon, Banten 42426";"Sukmajaya, Kec. Jombang, Kota Cilegon";"BANTEN";"42426";"Indonesia";" 02547817447";"";"";"-6.0246159";"106.0699058";"https://maps.google.com/?cid=0x0:0x35dde04f05071026";""
"mall";"Bioskop";"Cilegon Center Mall XXI";"Sukmajaya, Kec. Jombang, Kota Cilegon, Banten 42416";"Kec. Jombang, Kota Cilegon";"BANTEN";"42416";"Indonesia";" 02545752121";"";"/url?q>>u003dhttps://www.21cineplex.com/>>u0026opi>>u003d79508299>>u0026sa>>u003dU>>u0026ved>>u003d0ahUKEwj57o6-va6LAxUYxjgGHan9G5kQ61gIFigS>>u0026usg>>u003dAOvVaw273F7t7VtILP-WchIkAkW0";"-6.0237755";"106.0700234";"https://maps.google.com/?cid=0x0:0x9d69fcfc46d57287";""
"mall";"Pusat Perbelanjaan";"CitiMall Cilegon";"Jl. Jenderal Sudirman, Ramanuju, Kec. Purwakarta, Kota Cilegon, Banten 42431";"Ramanuju, Kec. Purwakarta, Kota Cilegon";"BANTEN";"42431";"Indonesia";"";"";"";"-6.0131211";"106.045255";"https://maps.google.com/?cid=0x0:0x74cd8e02666473ae";""
"mall";"Pusat Perbelanjaan";"CnJ@";"X356+V96, Cibeber, Kec. Cibeber, Kota Cilegon, Banten 42426";"Cibeber, Kec. Cibeber, Kota Cilegon";"BANTEN";"42426";"Indonesia";" 081911145446";"";"";"-6.0403312";"106.0609009";"https://maps.google.com/?cid=0x0:0x8bb802a378142f9a";""
