Category;Real Category;Business Name;Address;City;State;Postal Code;Country;Phone;Email;Website;Latitude;Longitude;Map Link;Details Link
"supermarket";"supermarket";"Warfer(Warung Ferdinand)";"PP32+W34, Gg.bakrie Jl. Jombang Rw. Lele, RT.005/RW.007, Jombang, Kec. Ciputat, Kota Tangerang Selatan, Banten 15414";"Gg.bakrie Jl. Jombang Rw. Lele, RT.005/RW.007, Jombang, Kec. Ciputat, Kota Tangerang Selatan";"BANTEN";"15414";"Indonesia";"";"";"";"-6.2952265";"106.7001899";"https://maps.google.com/?cid=0x0:0x43a79052601352e5";""
"supermarket";"Grosir Barang Kelontong";"Toko siregar";"Jl. Kp. Jombang Sel. Blok B3 No.32, RT.3/RW.3, Lengkong Gudang Tim., Kec. Serpong, Kota Tangerang Selatan, Banten 15310";"RT.3/RW.3, Lengkong Gudang Tim., Kec. Serpong, Kota Tangerang Selatan";"BANTEN";"15310";"Indonesia";"";"";"";"-6.2972496";"106.6885464";"https://maps.google.com/?cid=0x0:0x2a5eddd8b6b1becc";""
"supermarket";"Toko Swalayan";"Alfamart Jombang Raya";"Jl. Jombang Raya No. 5 Dan 6, RT.4/RW.002, Pd. Pucung, Kec. Pd. Aren, Kota Tangerang Selatan, Banten 15229";"RT.4/RW.002, Pd. Pucung, Kec. Pd. Aren, Kota Tangerang Selatan";"BANTEN";"15229";"Indonesia";" 1500959";"";"";"-6.2862266";"106.7027345";"https://maps.google.com/?cid=0x0:0x44de0a5cbf4de33f";""
"supermarket";"Toko bahan makanan";"Toko Spora";"Sektor XIV , BSD, Jl. Batam Jl. Griya Loka Raya No.1 Blok i3, Rw. Mekar Jaya, Kec. Serpong, Kota Tangerang Selatan, Banten 15310";"BSD, Jl. Batam Jl. Griya Loka Raya No.1 Blok i3, Rw. Mekar Jaya, Kec. Serpong, Kota Tangerang Selatan";"BANTEN";"15310";"Indonesia";" 08561999945";"";"";"-6.3022669";"106.6918193";"https://maps.google.com/?cid=0x0:0x24e9fe59be984fbc";""
"supermarket";"Toko Swalayan";"Good Mart";"Jl. Bakti No.1, RT.1/RW.6, Rw. Bar., Kec. Kby. Baru, Kota Jakarta Selatan, Daerah Khusus Ibukota Jakarta 12180";"RT.1/RW.6, Rw. Bar., Kec. Kby. Baru, Kota Jakarta Selatan";"BANTEN";"12180";"Indonesia";" 0217261816";"";"";"-6.2333417";"106.8149537";"https://maps.google.com/?cid=0x0:0x387e65b5163fa4ab";""
"supermarket";"Kedai Kopi";"JONA Mart";"Rest Area Jalan To Jakarta -Serpong Km 7.200 Serpong Tangerang Selatan, Jombang, Kec. Ciputat, Kota Tangerang Selatan, Banten 15326";"Jombang, Kec. Ciputat, Kota Tangerang Selatan";"BANTEN";"15326";"Indonesia";" 085697981786";"";"";"-6.2953151";"106.7143294";"https://maps.google.com/?cid=0x0:0x6670eb5bbb63ff71";""
"supermarket";"Toko bahan makanan";"Warung Sembako mba Jum";"Gg. Alpukat No.38, Jombang, Kec. Ciputat, Kota Tangerang Selatan, Banten 15414";"Jombang, Kec. Ciputat, Kota Tangerang Selatan";"BANTEN";"15414";"Indonesia";" 085285622311";"";"";"-6.2944302";"106.6952471";"https://maps.google.com/?cid=0x0:0x5ef37834df773349";""
"supermarket";"Minimarket";"Mu Gung Hwa Supermarket - Senopati";"Jl. Senayan No.43, RT.8/RW.5, Rw. Bar., Kec. Kby. Baru, Kota Jakarta Selatan, Daerah Khusus Ibukota Jakarta 12180";"RT.8/RW.5, Rw. Bar., Kec. Kby. Baru, Kota Jakarta Selatan";"BANTEN";"12180";"Indonesia";" 0217222214";"";"/url?q>>u003dhttp://mugunghwa.co.id/>>u0026opi>>u003d79508299>>u0026sa>>u003dU>>u0026ved>>u003d0ahUKEwiOjo6q066LAxWjRWcHHeO5InAQ61gIFigS>>u0026usg>>u003dAOvVaw0O32H3YlTxuvTSrXCtrDU-";"-6.2353938";"106.8158782";"https://maps.google.com/?cid=0x0:0x9ffba79e59c537d5";""
"supermarket";"Toko Swalayan";"Warung Bu Yustin";"PM5V+5RM, Jl. Tidore, Jombang, Kec. Ciputat, Kota Tangerang Selatan, Banten 15414";"Jl. Tidore, Jombang, Kec. Ciputat, Kota Tangerang Selatan";"BANTEN";"15414";"Indonesia";" 087799440895";"";"";"-6.2920281";"106.6945564";"https://maps.google.com/?cid=0x0:0x3d9bf570a6c7b3e1";""
"supermarket";"Minimarket";"Indomaret Sudimara GRAB PICK UP POINT";"Jl. Jombang Raya No.18, RT.1/RW.3, Jombang, Kec. Ciputat, Kota Tangerang Selatan, Banten 15414";"RT.1/RW.3, Jombang, Kec. Ciputat, Kota Tangerang Selatan";"BANTEN";"15414";"Indonesia";"";"";"/url?q>>u003dhttp://grab.co.id/>>u0026opi>>u003d79508299>>u0026sa>>u003dU>>u0026ved>>u003d0ahUKEwjUtfWq066LAxWESmwGHWd-NGsQ61gIEigO>>u0026usg>>u003dAOvVaw3yL62ph2qI1DbzjuMSDEBJ";"-6.2981589";"106.7138013";"https://maps.google.com/?cid=0x0:0xbdb5cc78938ffae8";""
"supermarket";"Toko bahan makanan";"Arif Kelapa Tua Santan";"Jl. Pembangunan No.10, Jombang, Kec. Ciputat, Kabupaten Jombang, Banten 15414";"Jombang, Kec. Ciputat, Kabupaten Jombang";"BANTEN";"15414";"Indonesia";" 081537426367";"";"";"-6.3010347";"106.7130751";"https://maps.google.com/?cid=0x0:0x6010d88a175770b9";""
"supermarket";"Tempat Istirahat di Jalan Tol";"O Mart Rest Area Km 7";"Rest Area, Jl. Tol Jkt - Serpong No.Km 7, Jombang, Kec. Ciputat, Kota Tangerang Selatan, Banten 15414";"Jl. Tol Jkt - Serpong No.Km 7, Jombang, Kec. Ciputat, Kota Tangerang Selatan";"BANTEN";"15414";"Indonesia";" 0217458998";"";"";"-6.294827";"106.714654";"https://maps.google.com/?cid=0x0:0xcbf7b45ac8215409";""
"supermarket";"Pemasok Air Minum Dalam Kemasan";"Warung Ibu Anggit";"Jombang, Kec. Ciputat, Kota Tangerang Selatan, Banten 15414";"Kec. Ciputat, Kota Tangerang Selatan";"BANTEN";"15414";"Indonesia";" 089602458491";"";"";"-6.3012673";"106.7128589";"https://maps.google.com/?cid=0x0:0x1371b2de5ff4b454";""
"supermarket";"Minimarket";"Alfamart Jombang Raya 3";"Jl. Jombang Raya, RT.002/RW.008, Jombang, Kec. Ciputat, Kota Tangerang Selatan, Banten 15414";"RT.002/RW.008, Jombang, Kec. Ciputat, Kota Tangerang Selatan";"BANTEN";"15414";"Indonesia";" 1500959";"";"";"-6.2977217";"106.7133607";"https://maps.google.com/?cid=0x0:0xc401d4aabe0ddbe6";""
"supermarket";"Minimarket";"Indomaret Astek Jombang";"PM4P+2V8, Jl. Lengkong Gudang Timur Raya, Lengkong Gudang Tim., Kec. Serpong, Kota Tangerang Selatan, Banten 15321";"Jl. Lengkong Gudang Timur Raya, Lengkong Gudang Tim., Kec. Serpong, Kota Tangerang Selatan";"BANTEN";"15321";"Indonesia";" 0215372228";"";"/url?q>>u003dhttps://indomaret.co.id/>>u0026opi>>u003d79508299>>u0026sa>>u003dU>>u0026ved>>u003d0ahUKEwiC5ZWt066LAxXJRWcHHTrGJO8Q61gIFSgR>>u0026usg>>u003dAOvVaw0ISllBQuUs24xyXemdUfjE";"-6.294975";"106.6871879";"https://maps.google.com/?cid=0x0:0x9a59532eaaa31508";""
"supermarket";"supermarket";"Warung Toha.";"Jl. H. Sawil No.22-21, Jombang, Kec. Ciputat, Kota Tangerang Selatan, Banten 15414";"Jombang, Kec. Ciputat, Kota Tangerang Selatan";"BANTEN";"15414";"Indonesia";"";"";"";"-6.2888068";"106.7013023";"https://maps.google.com/?cid=0x0:0x645c5b0c8847ae77";""
"supermarket";"Minimarket";"Alfamart jl sumatra";"Jl. Sumatra No.Rt 004/002, Jombang, Kec. Ciputat, Kota Tangerang Selatan, Banten 15225";"Jombang, Kec. Ciputat, Kota Tangerang Selatan";"BANTEN";"15225";"Indonesia";"";"";"";"-6.2962069";"106.7068252";"https://maps.google.com/?cid=0x0:0x8abba25d600ab7bf";""
"supermarket";"Toko bahan makanan";"Warung Bang Heri";"Jl. Masjid Nurul Qomar, Sawah Baru, Kec. Ciputat, Kota Tangerang Selatan, Banten 15413";"Sawah Baru, Kec. Ciputat, Kota Tangerang Selatan";"BANTEN";"15413";"Indonesia";" 082225968120";"";"";"-6.2920881";"106.7173491";"https://maps.google.com/?cid=0x0:0xa85948106cb87ebe";""
"supermarket";"Grosir Barang Kelontong";"Warung SRC TUTIK";"PP26+QMV, Jl. Jombang Raya, Jombang, Kec. Ciputat, Kota Tangerang Selatan, Banten 15414";"Jl. Jombang Raya, Jombang, Kec. Ciputat, Kota Tangerang Selatan";"BANTEN";"15414";"Indonesia";"";"";"";"-6.2980077";"106.7116756";"https://maps.google.com/?cid=0x0:0x7f5102ee6259058d";""
"supermarket";"supermarket";"Jombang";"Kec. Ciputat, Kota Tangerang Selatan, Banten";"Kota Tangerang Selatan, Banten";"BANTEN";"";"Indonesia";"";"";"";"-6.2953922";"106.702825";"https://maps.google.com/?cid=0x0:0xbcdb8cf2b6fd73f4";""
"supermarket";"Toko";"Bravo Supermarket";"F638+Q4R, Jalan Yos Sudarso, Tunggorono, Kecamatan Jombang, Sumbernongko, Denanyar, Kec. Jombang, Kabupaten Jombang, Jawa Timur 61419";"Jalan Yos Sudarso, Tunggorono, Kecamatan Jombang, Sumbernongko, Denanyar, Kec. Jombang, Kabupaten Jombang";"BANTEN";"61419";"Indonesia";"";"";"";"-7.5455052";"112.215255";"https://maps.google.com/?cid=0x0:0xa6a9cdf614ae8f8d";""
"supermarket";"Toko Swalayan";"Tsamaniya";"Jl. KH. Wahid Hasyim No.3, Candi Mulyo, Kec. Jombang, Kabupaten Jombang, Jawa Timur";"Kabupaten Jombang, Jawa Timur";"BANTEN";"";"Indonesia";" 0321865955";"";"/url?q>>u003dhttp://www.superindo.co.id/>>u0026opi>>u003d79508299>>u0026sa>>u003dU>>u0026ved>>u003d0ahUKEwiujemv066LAxVYV2wGHf32K0gQ61gIFigS>>u0026usg>>u003dAOvVaw1T1lZ6qBEceRGeVZ4V6dy4";"-7.5391564";"112.238434";"https://maps.google.com/?cid=0x0:0xa1a514046e7b3cd";""
"supermarket";"Toko Swalayan";"Superindo Sudimara Forestwalk";"Jl. Jombang Raya, Sawah Baru, Kec. Ciputat, Kota Tangerang Selatan, Banten";"Kota Tangerang Selatan, Banten";"BANTEN";"";"Indonesia";" 02174792995";"";"/url?q>>u003dhttps://www.superindo.co.id/artikel/info-pelanggan/telah-buka-super-indo-sudimara-forest-walk/18>>u0026opi>>u003d79508299>>u0026sa>>u003dU>>u0026ved>>u003d0ahUKEwiu0PHH066LAxVAU2wGHUwAEToQ61gIFigS>>u0026usg>>u003dAOvVaw2I86KZix-gLjfZTj7MQSOM";"-6.3026432";"106.7175805";"https://maps.google.com/?cid=0x0:0x9e150382d3484e68";""
"supermarket";"Toko Swalayan";"Saung Jombang";"Pd. Pucung, Kec. Pd. Aren, Kota Tangerang Selatan, Banten 15229";"Kec. Pd. Aren, Kota Tangerang Selatan";"BANTEN";"15229";"Indonesia";" 087885577048";"";"";"-6.2930433";"106.7106519";"https://maps.google.com/?cid=0x0:0x43fdb6027f6396b7";""
"supermarket";"Toko Swalayan";"Alfamart Jombang Raya";"Jl. Jombang Raya No. 5 Dan 6, RT.4/RW.002, Pd. Pucung, Kec. Pd. Aren, Kota Tangerang Selatan, Banten 15229";"RT.4/RW.002, Pd. Pucung, Kec. Pd. Aren, Kota Tangerang Selatan";"BANTEN";"15229";"Indonesia";" 1500959";"";"";"-6.2862266";"106.7027345";"https://maps.google.com/?cid=0x0:0x44de0a5cbf4de33f";""
"supermarket";"Minimarket";"Indomaret Riau Jombang";"PP46+922, Pd. Pucung, Kec. Pd. Aren, Kota Tangerang Selatan, Banten 15414";"Pd. Pucung, Kec. Pd. Aren, Kota Tangerang Selatan";"BANTEN";"15414";"Indonesia";"";"";"";"-6.2941125";"106.710002";"https://maps.google.com/?cid=0x0:0x122e9ee808544080";""
"supermarket";"Kios";"Toko banyu";"Jl. H. Sawil Jl. Jombang Raya No.8, RT.1/RW.12, Jombang, Kec. Ciputat, Kota Tangerang Selatan, Banten 15414";"RT.1/RW.12, Jombang, Kec. Ciputat, Kota Tangerang Selatan";"BANTEN";"15414";"Indonesia";"";"";"";"-6.2888546";"106.7009637";"https://maps.google.com/?cid=0x0:0xed616a2e601dfd20";""
"supermarket";"Toko bahan makanan";"Warung Sembako mba Jum";"Gg. Alpukat No.38, Jombang, Kec. Ciputat, Kota Tangerang Selatan, Banten 15414";"Jombang, Kec. Ciputat, Kota Tangerang Selatan";"BANTEN";"15414";"Indonesia";" 085285622311";"";"";"-6.2944302";"106.6952471";"https://maps.google.com/?cid=0x0:0x5ef37834df773349";""
"supermarket";"Toko bahan makanan";"Toko Serba ARS";"Gg. Supandi Jl. Jombang Raya No.10, RT.3/RW.6, Jombang, Kec. Ciputat, Kota Tangerang Selatan, Banten 15414";"RT.3/RW.6, Jombang, Kec. Ciputat, Kota Tangerang Selatan";"BANTEN";"15414";"Indonesia";" 081383068969";"";"";"-6.2937892";"106.6975878";"https://maps.google.com/?cid=0x0:0x7ae9c420d52495cf";""
"supermarket";"Minimarket";"Indomaret VBI Sumatera Dalam";"PP35+H33, Jl. Sumatra, Jombang, Kec. Ciputat, Kota Tangerang Selatan, Banten 15414";"Jl. Sumatra, Jombang, Kec. Ciputat, Kota Tangerang Selatan";"BANTEN";"15414";"Indonesia";"";"";"";"-6.2961091";"106.7076678";"https://maps.google.com/?cid=0x0:0xa80f4a57f416a7d1";""
"supermarket";"Minimarket";"Indomaret Jombang 89";"Jl. Jombang Raya, Parigi, Kec. Pd. Aren, Kota Tangerang Selatan, Banten 15227";"Parigi, Kec. Pd. Aren, Kota Tangerang Selatan";"BANTEN";"15227";"Indonesia";"";"";"/url?q>>u003dhttps://indomaret.co.id/>>u0026opi>>u003d79508299>>u0026sa>>u003dU>>u0026ved>>u003d0ahUKEwjY1-bK066LAxVXS2wGHVffEUwQ61gIEigO>>u0026usg>>u003dAOvVaw3EhLBJSCMQzcHUWzi1I55w";"-6.2875021";"106.7027318";"https://maps.google.com/?cid=0x0:0x5e72ea586e95ad7c";""
"supermarket";"Kedai Kopi";"JONA Mart";"Rest Area Jalan To Jakarta -Serpong Km 7.200 Serpong Tangerang Selatan, Jombang, Kec. Ciputat, Kota Tangerang Selatan, Banten 15326";"Jombang, Kec. Ciputat, Kota Tangerang Selatan";"BANTEN";"15326";"Indonesia";" 085697981786";"";"";"-6.2953151";"106.7143294";"https://maps.google.com/?cid=0x0:0x6670eb5bbb63ff71";""
"supermarket";"Minimarket";"Indomaret Sudimara GRAB PICK UP POINT";"Jl. Jombang Raya No.18, RT.1/RW.3, Jombang, Kec. Ciputat, Kota Tangerang Selatan, Banten 15414";"RT.1/RW.3, Jombang, Kec. Ciputat, Kota Tangerang Selatan";"BANTEN";"15414";"Indonesia";"";"";"/url?q>>u003dhttp://grab.co.id/>>u0026opi>>u003d79508299>>u0026sa>>u003dU>>u0026ved>>u003d0ahUKEwin06_L066LAxXIcWwGHUX0OocQ61gIEigO>>u0026usg>>u003dAOvVaw1oO1HwwI24yAsiNo8QKeSA";"-6.2981589";"106.7138013";"https://maps.google.com/?cid=0x0:0xbdb5cc78938ffae8";""
"supermarket";"Toko bahan makanan";"TOKO SARRAH";"MPW4+G7Q, Jombang, Kec. Ciputat, Kota Tangerang Selatan, Banten 15414";"Jombang, Kec. Ciputat, Kota Tangerang Selatan";"BANTEN";"15414";"Indonesia";" 089605485291";"";"";"-6.3036647";"106.7057413";"https://maps.google.com/?cid=0x0:0xb5c151171a21f5ef";""
"supermarket";"supermarket";"Warung Toha.";"Jl. H. Sawil No.22-21, Jombang, Kec. Ciputat, Kota Tangerang Selatan, Banten 15414";"Jombang, Kec. Ciputat, Kota Tangerang Selatan";"BANTEN";"15414";"Indonesia";"";"";"";"-6.2888068";"106.7013023";"https://maps.google.com/?cid=0x0:0x645c5b0c8847ae77";""
"supermarket";"Grosir Barang Kelontong";"Toko siregar";"Jl. Kp. Jombang Sel. Blok B3 No.32, RT.3/RW.3, Lengkong Gudang Tim., Kec. Serpong, Kota Tangerang Selatan, Banten 15310";"RT.3/RW.3, Lengkong Gudang Tim., Kec. Serpong, Kota Tangerang Selatan";"BANTEN";"15310";"Indonesia";"";"";"";"-6.2972496";"106.6885464";"https://maps.google.com/?cid=0x0:0x2a5eddd8b6b1becc";""
"supermarket";"Toko bahan makanan";"Toko arman2";"Jl. Sumatra Jl. Jombang Raya No.14, RT.3/RW.10, Jombang, Kec. Ciputat, Kota Tangerang Selatan, Banten 15414";"RT.3/RW.10, Jombang, Kec. Ciputat, Kota Tangerang Selatan";"BANTEN";"15414";"Indonesia";"";"";"";"-6.2972367";"106.7005172";"https://maps.google.com/?cid=0x0:0x6a2b3a309565a81c";""
"supermarket";"Minimarket";"Indomaret Astek Jombang";"PM4P+2V8, Jl. Lengkong Gudang Timur Raya, Lengkong Gudang Tim., Kec. Serpong, Kota Tangerang Selatan, Banten 15321";"Jl. Lengkong Gudang Timur Raya, Lengkong Gudang Tim., Kec. Serpong, Kota Tangerang Selatan";"BANTEN";"15321";"Indonesia";" 0215372228";"";"/url?q>>u003dhttps://indomaret.co.id/>>u0026opi>>u003d79508299>>u0026sa>>u003dU>>u0026ved>>u003d0ahUKEwiBsvPN066LAxW4SmwGHXnEOswQ61gIFSgR>>u0026usg>>u003dAOvVaw2MW-PZ_gF85XqYHGAJPqwv";"-6.294975";"106.6871879";"https://maps.google.com/?cid=0x0:0x9a59532eaaa31508";""
"supermarket";"Toko bahan makanan";"Warung Bang Heri";"Jl. Masjid Nurul Qomar, Sawah Baru, Kec. Ciputat, Kota Tangerang Selatan, Banten 15413";"Sawah Baru, Kec. Ciputat, Kota Tangerang Selatan";"BANTEN";"15413";"Indonesia";" 082225968120";"";"";"-6.2920881";"106.7173491";"https://maps.google.com/?cid=0x0:0xa85948106cb87ebe";""
"supermarket";"supermarket";"Jombang";"Kec. Ciputat, Kota Tangerang Selatan, Banten";"Kota Tangerang Selatan, Banten";"BANTEN";"";"Indonesia";"";"";"";"-6.2953922";"106.702825";"https://maps.google.com/?cid=0x0:0xbcdb8cf2b6fd73f4";""
"supermarket";"Minimarket";"Alfamart jl sumatra";"Jl. Sumatra No.Rt 004/002, Jombang, Kec. Ciputat, Kota Tangerang Selatan, Banten 15225";"Jombang, Kec. Ciputat, Kota Tangerang Selatan";"BANTEN";"15225";"Indonesia";"";"";"";"-6.2962069";"106.7068252";"https://maps.google.com/?cid=0x0:0x8abba25d600ab7bf";""
"supermarket";"Toko bahan makanan";"Warung Ma'e  Pa'e";"PP25+8H8, Jl. Utama Kp. Gn., RT.004/RW.009, Jombang, Kec. Ciputat, Kota Tangerang Selatan, Banten 15414";"Jl. Utama Kp. Gn., RT.004/RW.009, Jombang, Kec. Ciputat, Kota Tangerang Selatan";"BANTEN";"15414";"Indonesia";" 085714782919";"";"";"-6.2992164";"106.7089629";"https://maps.google.com/?cid=0x0:0x77c25c869e5f502f";""
"supermarket";"Tempat Istirahat di Jalan Tol";"O Mart Rest Area Km 7";"Rest Area, Jl. Tol Jkt - Serpong No.Km 7, Jombang, Kec. Ciputat, Kota Tangerang Selatan, Banten 15414";"Jl. Tol Jkt - Serpong No.Km 7, Jombang, Kec. Ciputat, Kota Tangerang Selatan";"BANTEN";"15414";"Indonesia";" 0217458998";"";"";"-6.294827";"106.714654";"https://maps.google.com/?cid=0x0:0xcbf7b45ac8215409";""
"supermarket";"Toko bahan makanan";"Toko Spora";"Sektor XIV , BSD, Jl. Batam Jl. Griya Loka Raya No.1 Blok i3, Rw. Mekar Jaya, Kec. Serpong, Kota Tangerang Selatan, Banten 15310";"BSD, Jl. Batam Jl. Griya Loka Raya No.1 Blok i3, Rw. Mekar Jaya, Kec. Serpong, Kota Tangerang Selatan";"BANTEN";"15310";"Indonesia";" 08561999945";"";"";"-6.3022669";"106.6918193";"https://maps.google.com/?cid=0x0:0x24e9fe59be984fbc";""
"supermarket";"Distributor minuman";"Rawalele";"MMXX+X2Q, Jl. Jombang Rw. Lele, Jombang, Kec. Ciputat, Kota Tangerang Selatan, Banten 15414";"Jl. Jombang Rw. Lele, Jombang, Kec. Ciputat, Kota Tangerang Selatan";"BANTEN";"15414";"Indonesia";" 081317796564";"";"";"-6.3000306";"106.6976199";"https://maps.google.com/?cid=0x0:0xe0fae495e845bbeb";""
"supermarket";"Toko";"Bravo Supermarket";"F638+Q4R, Jalan Yos Sudarso, Tunggorono, Kecamatan Jombang, Sumbernongko, Denanyar, Kec. Jombang, Kabupaten Jombang, Jawa Timur 61419";"Jalan Yos Sudarso, Tunggorono, Kecamatan Jombang, Sumbernongko, Denanyar, Kec. Jombang, Kabupaten Jombang";"BANTEN";"61419";"Indonesia";"";"";"";"-7.5455052";"112.215255";"https://maps.google.com/?cid=0x0:0xa6a9cdf614ae8f8d";""
"supermarket";"Toko bahan makanan";"Matra MiniMarket";"Depan RS Pelengkap, Jl. IR. H. Juanda No.4, Kepanjen, Kec. Jombang, Kabupaten Jombang, Jawa Timur 61411";"Jl. IR. H. Juanda No.4, Kepanjen, Kec. Jombang, Kabupaten Jombang";"BANTEN";"61411";"Indonesia";" 085792442576";"";"";"-7.5485653";"112.2355359";"https://maps.google.com/?cid=0x0:0xd4ac84a6cd5f439c";""
"supermarket";"Toko Kelontong Asia";"Mitra Swalayan";"Jl. KH. Wahid Hasyim No.181, Kepanjen, Kaliwungu, Kec. Jombang, Kabupaten Jombang, Jawa Timur 61419";"Kepanjen, Kaliwungu, Kec. Jombang, Kabupaten Jombang";"BANTEN";"61419";"Indonesia";" 0321861346";"";"";"-7.5545295";"112.2355229";"https://maps.google.com/?cid=0x0:0x2a1fd47d89d84f1c";""
"supermarket";"Grosir perlengkapan rumah tangga";"Gajah Mada Toserba";"Jl. A.Yani No.72, Jombang, Kec. Jombang, Kabupaten Jombang, Jawa Timur 61415";"Jombang, Kec. Jombang, Kabupaten Jombang";"BANTEN";"61415";"Indonesia";" 08563339007";"";"";"-7.537824";"112.234771";"https://maps.google.com/?cid=0x0:0xaca25f04edd69034";""
"supermarket";"Minimarket";"Toko Soso";"Jl. Brigjen Katamso No.25, Pulo Lor, Kec. Jombang, Kabupaten Jombang, Jawa Timur 61419";"Pulo Lor, Kec. Jombang, Kabupaten Jombang";"BANTEN";"61419";"Indonesia";" 081216922425";"";"";"-7.5453506";"112.2287294";"https://maps.google.com/?cid=0x0:0x332780fab3de827b";""
"supermarket";"Toko Swalayan";"Borobudur Store Jombang";"Jl. Gus Dur No.148, Candi Mulyo, Kec. Jombang, Kabupaten Jombang, Jawa Timur 61419";"Candi Mulyo, Kec. Jombang, Kabupaten Jombang";"BANTEN";"61419";"Indonesia";"";"";"";"-7.5382214";"112.2398542";"https://maps.google.com/?cid=0x0:0x12c160f1aa161d28";""
"supermarket";"supermarket";"Warfer(Warung Ferdinand)";"PP32+W34, Gg.bakrie Jl. Jombang Rw. Lele, RT.005/RW.007, Jombang, Kec. Ciputat, Kota Tangerang Selatan, Banten 15414";"Gg.bakrie Jl. Jombang Rw. Lele, RT.005/RW.007, Jombang, Kec. Ciputat, Kota Tangerang Selatan";"BANTEN";"15414";"Indonesia";"";"";"";"-6.2952265";"106.7001899";"https://maps.google.com/?cid=0x0:0x43a79052601352e5";""
"supermarket";"Toko Swalayan";"Saung Jombang";"Pd. Pucung, Kec. Pd. Aren, Kota Tangerang Selatan, Banten 15229";"Kec. Pd. Aren, Kota Tangerang Selatan";"BANTEN";"15229";"Indonesia";" 087885577048";"";"";"-6.2930433";"106.7106519";"https://maps.google.com/?cid=0x0:0x43fdb6027f6396b7";""
"supermarket";"Kios";"Toko banyu";"Jl. H. Sawil Jl. Jombang Raya No.8, RT.1/RW.12, Jombang, Kec. Ciputat, Kota Tangerang Selatan, Banten 15414";"RT.1/RW.12, Jombang, Kec. Ciputat, Kota Tangerang Selatan";"BANTEN";"15414";"Indonesia";"";"";"";"-6.2888546";"106.7009637";"https://maps.google.com/?cid=0x0:0xed616a2e601dfd20";""
"supermarket";"Grosir Barang Kelontong";"Toko siregar";"Jl. Kp. Jombang Sel. Blok B3 No.32, RT.3/RW.3, Lengkong Gudang Tim., Kec. Serpong, Kota Tangerang Selatan, Banten 15310";"RT.3/RW.3, Lengkong Gudang Tim., Kec. Serpong, Kota Tangerang Selatan";"BANTEN";"15310";"Indonesia";"";"";"";"-6.2972496";"106.6885464";"https://maps.google.com/?cid=0x0:0x2a5eddd8b6b1becc";""
"supermarket";"Toko bahan makanan";"Arif Kelapa Tua Santan";"Jl. Pembangunan No.10, Jombang, Kec. Ciputat, Kabupaten Jombang, Banten 15414";"Jombang, Kec. Ciputat, Kabupaten Jombang";"BANTEN";"15414";"Indonesia";" 081537426367";"";"";"-6.3010347";"106.7130751";"https://maps.google.com/?cid=0x0:0x6010d88a175770b9";""
"supermarket";"Toko Swalayan";"Superindo Sudimara Forestwalk";"Jl. Jombang Raya, Sawah Baru, Kec. Ciputat, Kota Tangerang Selatan, Banten";"Kota Tangerang Selatan, Banten";"BANTEN";"";"Indonesia";" 02174792995";"";"/url?q>>u003dhttps://www.superindo.co.id/artikel/info-pelanggan/telah-buka-super-indo-sudimara-forest-walk/18>>u0026opi>>u003d79508299>>u0026sa>>u003dU>>u0026ved>>u003d0ahUKEwj4qc3l066LAxVOUGcHHaFTDZUQ61gIFigS>>u0026usg>>u003dAOvVaw3Y3WsHJ8p1d5ODMKwj0Rgi";"-6.3026432";"106.7175805";"https://maps.google.com/?cid=0x0:0x9e150382d3484e68";""
"supermarket";"Toko bahan makanan";"TOKO SARRAH";"MPW4+G7Q, Jombang, Kec. Ciputat, Kota Tangerang Selatan, Banten 15414";"Jombang, Kec. Ciputat, Kota Tangerang Selatan";"BANTEN";"15414";"Indonesia";" 089605485291";"";"";"-6.3036647";"106.7057413";"https://maps.google.com/?cid=0x0:0xb5c151171a21f5ef";""
"supermarket";"Toko bahan makanan";"Warung Sembako mba Jum";"Gg. Alpukat No.38, Jombang, Kec. Ciputat, Kota Tangerang Selatan, Banten 15414";"Jombang, Kec. Ciputat, Kota Tangerang Selatan";"BANTEN";"15414";"Indonesia";" 085285622311";"";"";"-6.2944302";"106.6952471";"https://maps.google.com/?cid=0x0:0x5ef37834df773349";""
"supermarket";"supermarket";"Warung Toha.";"Jl. H. Sawil No.22-21, Jombang, Kec. Ciputat, Kota Tangerang Selatan, Banten 15414";"Jombang, Kec. Ciputat, Kota Tangerang Selatan";"BANTEN";"15414";"Indonesia";"";"";"";"-6.2888068";"106.7013023";"https://maps.google.com/?cid=0x0:0x645c5b0c8847ae77";""
"supermarket";"supermarket";"Warung Sembako";"MPX6+WHQ, Jl. Betawi, Jombang, Kec. Ciputat, Kota Tangerang Selatan, Banten 15414";"Jl. Betawi, Jombang, Kec. Ciputat, Kota Tangerang Selatan";"BANTEN";"15414";"Indonesia";" 085772577426";"";"";"-6.3001712";"106.7114835";"https://maps.google.com/?cid=0x0:0x4a072ca24010660b";""
"supermarket";"Toko Swalayan";"Warung Bu Yustin";"PM5V+5RM, Jl. Tidore, Jombang, Kec. Ciputat, Kota Tangerang Selatan, Banten 15414";"Jl. Tidore, Jombang, Kec. Ciputat, Kota Tangerang Selatan";"BANTEN";"15414";"Indonesia";" 087799440895";"";"";"-6.2920281";"106.6945564";"https://maps.google.com/?cid=0x0:0x3d9bf570a6c7b3e1";""
"supermarket";"Minimarket";"Warung Alfa Midin";"PP32+F94, Gg. H. M. Bakri, Jombang, Kec. Ciputat, Kota Tangerang Selatan, Banten 15414";"Gg. H. M. Bakri, Jombang, Kec. Ciputat, Kota Tangerang Selatan";"BANTEN";"15414";"Indonesia";" 087883335327";"";"";"-6.2963634";"106.7009379";"https://maps.google.com/?cid=0x0:0x2a233d35c9555f4b";""
"supermarket";"Pemasok Air Minum Dalam Kemasan";"Warung Ibu Anggit";"Jombang, Kec. Ciputat, Kota Tangerang Selatan, Banten 15414";"Kec. Ciputat, Kota Tangerang Selatan";"BANTEN";"15414";"Indonesia";" 089602458491";"";"";"-6.3012673";"106.7128589";"https://maps.google.com/?cid=0x0:0x1371b2de5ff4b454";""
"supermarket";"Toko";"Toko Alida";"PM4W+Q59, Jl. Sumatra, Jombang, Kec. Ciputat, Kota Tangerang Selatan, Banten 15414";"Jl. Sumatra, Jombang, Kec. Ciputat, Kota Tangerang Selatan";"BANTEN";"15414";"Indonesia";" 081282352629";"";"";"-6.293088";"106.695482";"https://maps.google.com/?cid=0x0:0x2340e7268d621e49";""
"supermarket";"Distributor minuman";"Rawalele";"MMXX+X2Q, Jl. Jombang Rw. Lele, Jombang, Kec. Ciputat, Kota Tangerang Selatan, Banten 15414";"Jl. Jombang Rw. Lele, Jombang, Kec. Ciputat, Kota Tangerang Selatan";"BANTEN";"15414";"Indonesia";" 081317796564";"";"";"-6.3000306";"106.6976199";"https://maps.google.com/?cid=0x0:0xe0fae495e845bbeb";""
"supermarket";"Toko bahan makanan";"Warung Ma'e  Pa'e";"PP25+8H8, Jl. Utama Kp. Gn., RT.004/RW.009, Jombang, Kec. Ciputat, Kota Tangerang Selatan, Banten 15414";"Jl. Utama Kp. Gn., RT.004/RW.009, Jombang, Kec. Ciputat, Kota Tangerang Selatan";"BANTEN";"15414";"Indonesia";" 085714782919";"";"";"-6.2992164";"106.7089629";"https://maps.google.com/?cid=0x0:0x77c25c869e5f502f";""
"supermarket";"Minimarket";"Indomaret Riau Jombang";"PP46+922, Pd. Pucung, Kec. Pd. Aren, Kota Tangerang Selatan, Banten 15414";"Pd. Pucung, Kec. Pd. Aren, Kota Tangerang Selatan";"BANTEN";"15414";"Indonesia";"";"";"";"-6.2941125";"106.710002";"https://maps.google.com/?cid=0x0:0x122e9ee808544080";""
"supermarket";"Grosir Barang Kelontong";"Warung SRC TUTIK";"PP26+QMV, Jl. Jombang Raya, Jombang, Kec. Ciputat, Kota Tangerang Selatan, Banten 15414";"Jl. Jombang Raya, Jombang, Kec. Ciputat, Kota Tangerang Selatan";"BANTEN";"15414";"Indonesia";"";"";"";"-6.2980077";"106.7116756";"https://maps.google.com/?cid=0x0:0x7f5102ee6259058d";""
"supermarket";"Toko bahan makanan";"Toko arman2";"Jl. Sumatra Jl. Jombang Raya No.14, RT.3/RW.10, Jombang, Kec. Ciputat, Kota Tangerang Selatan, Banten 15414";"RT.3/RW.10, Jombang, Kec. Ciputat, Kota Tangerang Selatan";"BANTEN";"15414";"Indonesia";"";"";"";"-6.2972367";"106.7005172";"https://maps.google.com/?cid=0x0:0x6a2b3a309565a81c";""
"supermarket";"supermarket";"Jombang";"Kec. Ciputat, Kota Tangerang Selatan, Banten";"Kota Tangerang Selatan, Banten";"BANTEN";"";"Indonesia";"";"";"";"-6.2953922";"106.702825";"https://maps.google.com/?cid=0x0:0xbcdb8cf2b6fd73f4";""
