Category;Real Category;Business Name;Address;City;State;Postal Code;Country;Phone;Email;Website;Latitude;Longitude;Map Link;Details Link
"mall";"Toko";"SPO LISA CILEGON 34942";"222X+FGG, Kebondalem, Kec. Purwakarta, Kota Cilegon, Banten 42433";"Kebondalem, Kec. Purwakarta, Kota Cilegon";"BANTEN";"42433";"Indonesia";" 089633635687";"";"";"-5.9988038";"106.0488216";"https://maps.google.com/?cid=0x0:0xc5749893f8d533af";""
"mall";"Layanan penyewaan gaun pernikahan";"WO Calista Salon  Baso MD";"Jl. KH. Simin, Kebondalem, Kec. Purwakarta, Kota Cilegon, Banten 42434";"Kebondalem, Kec. Purwakarta, Kota Cilegon";"BANTEN";"42434";"Indonesia";" 081388712235";"";"/url?q>>u003dhttp://www.calistasalon.com/>>u0026opi>>u003d79508299>>u0026sa>>u003dU>>u0026ved>>u003d0ahUKEwjJtPaZy66LAxWzZ_UHHcbpLowQ61gIFigS>>u0026usg>>u003dAOvVaw257X-zF0zr8Lg7UtwmETz5";"-5.9963643";"106.0536506";"https://maps.google.com/?cid=0x0:0xcb0fb73d749445b8";""
"mall";"Pusat Perbelanjaan";"Transmart Cilegon";"Jl. KH. Yasin Beji No.2, Kebondalem, Kec. Purwakarta, Kota Cilegon, Banten 42433";"Kebondalem, Kec. Purwakarta, Kota Cilegon";"BANTEN";"42433";"Indonesia";" 085888376350";"";"";"-6.0072741";"106.0427409";"https://maps.google.com/?cid=0x0:0xdc16e98a9f63a51c";""
"mall";"Distributor minuman";"Distributor My Healthy Yoghurt Cilegon";"2324+R28, perumahan metro cluster cendana, Kebondalem, Kec. Purwakarta, Kota Cilegon, Banten 42413";"perumahan metro cluster cendana, Kebondalem, Kec. Purwakarta, Kota Cilegon";"BANTEN";"42413";"Indonesia";" 087822181782";"";"";"-5.9979639";"106.0550717";"https://maps.google.com/?cid=0x0:0xc81eb085340f9421";""
"mall";"Pusat Perbelanjaan";"Ruko PT WM SENTOSA.tbk";"Link. Rama Baru jln bhayangkara rt.01/06, no 1, Kebondalem, Kec. Purwakarta, Kota Cilegon, Banten 42433";"no 1, Kebondalem, Kec. Purwakarta, Kota Cilegon";"BANTEN";"42433";"Indonesia";" 087809421990";"";"";"-5.9970052";"106.0482013";"https://maps.google.com/?cid=0x0:0xcc54581d21602a4d";""
"mall";"Pertanian";"Ayam Kampung CILEGON";"23C2+WV7, Jl. Pabean, Tegal Bunder, Kec. Purwakarta, Kota Cilegon, Banten 42437";"Jl. Pabean, Tegal Bunder, Kec. Purwakarta, Kota Cilegon";"BANTEN";"42437";"Indonesia";" 081906422026";"";"";"-5.977719";"106.0521867";"https://maps.google.com/?cid=0x0:0x871c93a81a492586";""
"mall";"Pusat Perbelanjaan";"KudapanciAlexa";"Masigit, Kec. Jombang, Kota Cilegon, Banten 42412";"Kec. Jombang, Kota Cilegon";"BANTEN";"42412";"Indonesia";"";"";"";"-6.0064003";"106.0614459";"https://maps.google.com/?cid=0x0:0x4761a08a25cdf6aa";""
"mall";"Pusat Perbelanjaan";"PAMERAN MOBIL TOYOTA (Mayofield Mall Cilegon)";"Jl. Nn No.15, Ramanuju, Kec. Purwakarta, Kota Cilegon, Banten 42431";"Ramanuju, Kec. Purwakarta, Kota Cilegon";"BANTEN";"42431";"Indonesia";" 0817628841";"";"";"-6.0132639";"106.045219";"https://maps.google.com/?cid=0x0:0x4bbe23243d3f6e6e";""
"mall";"Bengkel Sepeda Motor";"Kids Matic Shop";"Jl. Persatuan, Kebondalem, Kec. Purwakarta, Kota Cilegon, Banten 42433";"Kebondalem, Kec. Purwakarta, Kota Cilegon";"BANTEN";"42433";"Indonesia";" 087871998318";"";"";"-6.0009969";"106.0500878";"https://maps.google.com/?cid=0x0:0x3f30410248656357";""
"mall";"mall";"Banten 42437";"Kec. Purwakarta, Kota Cilegon, Banten";"Kota Cilegon, Banten";"BANTEN";"";"Indonesia";"";"";"";"-5.9682018";"106.0493226";"https://maps.google.com/?cid=0x0:0x1c00c5eb568ece70";""
"mall";"Tempat Parkir";"Cilegon Center Mall";"Jl. Ahmad Yani, Sukmajaya, Kec. Jombang, Kota Cilegon, Banten 42426";"Sukmajaya, Kec. Jombang, Kota Cilegon";"BANTEN";"42426";"Indonesia";" 02547817447";"";"";"-6.0246159";"106.0699058";"https://maps.google.com/?cid=0x0:0x35dde04f05071026";""
"mall";"Pasar";"Distributor ayam mang safi";"2384+CPP Cilentrang, RT.002/RW.001, Purwakarta, Kec. Gerogol, Kota Cilegon, Banten 42437";"RT.002/RW.001, Purwakarta, Kec. Gerogol, Kota Cilegon";"BANTEN";"42437";"Indonesia";"";"";"";"-5.9839079";"106.056839";"https://maps.google.com/?cid=0x0:0x9d3f2a27645e9738";""
"mall";"Tempat Penjualan Teh";"Mang dim kacang sangrai";"2365+873, Purwakarta, Kec. Gerogol, Kota Cilegon, Banten 42437";"Purwakarta, Kec. Gerogol, Kota Cilegon";"BANTEN";"42437";"Indonesia";" 085946562490";"";"";"-5.9892301";"106.0581728";"https://maps.google.com/?cid=0x0:0x426b90778c0b507a";""
"mall";"Pusat Perbelanjaan";"Isi Ulang Air Minum Galon FAMILY";"23H3+248, Jl. Pabean, Tegal Bunder, Kec. Purwakarta, Kota Cilegon, Banten 42437";"Jl. Pabean, Tegal Bunder, Kec. Purwakarta, Kota Cilegon";"BANTEN";"42437";"Indonesia";"";"";"";"-5.9724688";"106.0528231";"https://maps.google.com/?cid=0x0:0xf9393c5b5069a8f1";""
"mall";"Kafe";"Angkringan Warung Kang Rif";"23G3+98H, Jl. Pabean, Tegal Bunder, Kec. Purwakarta, Kota Cilegon, Banten 42437";"Jl. Pabean, Tegal Bunder, Kec. Purwakarta, Kota Cilegon";"BANTEN";"42437";"Indonesia";" 085715388203";"";"";"-5.9740564";"106.0533748";"https://maps.google.com/?cid=0x0:0xf55fac49f09e8c70";""
"mall";"Kantor Pemerintah";"Mall Pelayanan Publik Purwakarta";"FC4V+6GC, Pasar Juma'ah, Nagri Kaler, Kec. Purwakarta, Kabupaten Purwakarta, Jawa Barat 41115";"Pasar Juma'ah, Nagri Kaler, Kec. Purwakarta, Kabupaten Purwakarta";"BANTEN";"41115";"Indonesia";"";"";"";"-6.5444307";"107.4437553";"https://maps.google.com/?cid=0x0:0x5f4e3212bc20438d";""
"mall";"Toko Pernak-Pernik";"Miniso Ruko Purwakarta";"Jl. Veteran No.23, Nagri Kaler, Kec. Purwakarta, Kabupaten Purwakarta, Jawa Barat 41115";"Nagri Kaler, Kec. Purwakarta, Kabupaten Purwakarta";"BANTEN";"41115";"Indonesia";"";"";"/url?q>>u003dhttps://www.tiktok.com/%40minisorukopurwakarta>>u0026opi>>u003d79508299>>u0026sa>>u003dU>>u0026ved>>u003d0ahUKEwiZjZGgy66LAxWkgK8BHSyPMBMQ61gIEigO>>u0026usg>>u003dAOvVaw3-TQIBhvCBCyVrw3QsRMRO";"-6.5394368";"107.4438637";"https://maps.google.com/?cid=0x0:0x4456f46b5e3cb0a2";""
"mall";"Pusat Perbelanjaan";"Jalan Jenderal Sudirman, Kabupaten Purwakarta";"Jl. Jendral Sudirman No.93, Nagri Tengah, Kec. Purwakarta, Kabupaten Purwakarta, Jawa Barat 41114";"Nagri Tengah, Kec. Purwakarta, Kabupaten Purwakarta";"BANTEN";"41114";"Indonesia";"";"";"";"-6.5466828";"107.4434801";"https://maps.google.com/?cid=0x0:0x573810743408c14b";""
"mall";"Pusat Perbelanjaan";"Sutan Mudo Sukses Mandiri, PT.";"Raya No. 337, Kp. Suka Mulya,, Jl. Ipik Gandamanah, Ciseureuh, Kec. Purwakarta, Kabupaten Purwakarta, Jawa Barat 41118";"Kp. Suka Mulya,, Jl. Ipik Gandamanah, Ciseureuh, Kec. Purwakarta, Kabupaten Purwakarta";"BANTEN";"41118";"Indonesia";" 081222129891";"";"";"-6.5215915";"107.459339";"https://maps.google.com/?cid=0x0:0xf2dfd922b5ac25e1";""
"supermarket";"Komplek perumahan";"Apicita Village";"Wanasari, Kec. Cibeber, Kabupaten Lebak, Banten 42394";"Kec. Cibeber, Kabupaten Lebak";"BANTEN";"42394";"Indonesia";" 082312462942";"";"";"-6.8177263";"106.3979306";"https://maps.google.com/?cid=0x0:0xf7f7b17113470b51";""
"supermarket";"Minimarket";"Indomart Pasir Kuray";"5CM5+JQJ, Kujangjaya, Kec. Cibeber, Kabupaten Lebak, Banten 42394";"Kujangjaya, Kec. Cibeber, Kabupaten Lebak";"BANTEN";"42394";"Indonesia";" 081210707311";"";"";"-6.815908";"106.4094007";"https://maps.google.com/?cid=0x0:0xe32fffc87dbde406";""
"supermarket";"Minimarket";"Alfamart";"Jl. Raya Cikotok Pelabuhan Ratu Rt/Rw 02/06, Ds, Cibeber, Kec. Cibeber, Kab. Lebak, Banten 42394";"Ds, Cibeber, Kec. Cibeber, Kab. Lebak";"BANTEN";"42394";"Indonesia";" 0211500959";"";"";"-6.8516541";"106.3064839";"https://maps.google.com/?cid=0x0:0xfffa65c4013f3efe";""
"supermarket";"Minimarket";"Alfamart Pasir Kuray";"Kp, Pasir Kuray, RT.001/RW.002, Kujangjaya, Kec. Cibeber, Kab. Lebak, Banten 42394";"Pasir Kuray, RT.001/RW.002, Kujangjaya, Kec. Cibeber, Kab. Lebak";"BANTEN";"42394";"Indonesia";" 1500959";"";"";"-6.8159997";"106.4094202";"https://maps.google.com/?cid=0x0:0xdf7e6c3dad95d81";""
"supermarket";"Toko";"Warung Hejo Cikadu";"5CH9+5VX, Cikadu, Kec. Cibeber, Kabupaten Lebak, Banten 42394";"Cikadu, Kec. Cibeber, Kabupaten Lebak";"BANTEN";"42394";"Indonesia";"";"";"";"-6.8220088";"106.4197208";"https://maps.google.com/?cid=0x0:0x5778da5e4b16810e";""
"supermarket";"Toko Swalayan";"AHA CELL";"883P+JFJ, Citorek Tim., Kec. Cibeber, Kabupaten Lebak, Banten 42394";"Citorek Tim., Kec. Cibeber, Kabupaten Lebak";"BANTEN";"42394";"Indonesia";" 085888863198";"";"";"-6.6959222";"106.3361425";"https://maps.google.com/?cid=0x0:0xe2c9c0cbf5c51898";""
"supermarket";"Toko bahan makanan";"toko bakso";"59X8+8RH, Jl. Raya Cikotok, Hegarmanah, Kec. Cibeber, Kabupaten Lebak, Banten 42394";"Jl. Raya Cikotok, Hegarmanah, Kec. Cibeber, Kabupaten Lebak";"BANTEN";"42394";"Indonesia";" 085680366424";"";"";"-6.8016822";"106.3671219";"https://maps.google.com/?cid=0x0:0x8452bc965cfeca23";""
"supermarket";"Minimarket";"Indomaret cikotok";"48Q4+68W, Cibeber, Kec. Cibeber, Kabupaten Lebak, Banten 42394";"Cibeber, Kec. Cibeber, Kabupaten Lebak";"BANTEN";"42394";"Indonesia";" 1500580";"";"/url?q>>u003dhttps://indomaret.co.id/>>u0026opi>>u003d79508299>>u0026sa>>u003dU>>u0026ved>>u003d0ahUKEwiQu-e-y66LAxW3a_UHHQnnHs4Q61gIFSgR>>u0026usg>>u003dAOvVaw19DCQa0eo4B6rKMws384No";"-6.8618862";"106.3058255";"https://maps.google.com/?cid=0x0:0xb82ee7f48fc19e49";""
"supermarket";"Toko Ponsel";"Lira cell";"478X+5XG, Jl. Raya Bayah-Cikotok, Suwakan, Kec. Cibeber, Kabupaten Lebak, Banten 42393";"Jl. Raya Bayah-Cikotok, Suwakan, Kec. Cibeber, Kabupaten Lebak";"BANTEN";"42393";"Indonesia";"";"";"";"-6.8845562";"106.2999406";"https://maps.google.com/?cid=0x0:0x8c7e5a999b61adbd";""
"supermarket";"Minimarket";"ALFAMART CIKOTOK";"Jl. Raya Bayah-Cikotok No.Rt02/08 Ds, Cibeber, Kec. Cibeber, Kab. Lebak, Banten 42423";"Cibeber, Kec. Cibeber, Kab. Lebak";"BANTEN";"42423";"Indonesia";" 1500959";"";"";"-6.863693";"106.306545";"https://maps.google.com/?cid=0x0:0x576993ab28e6fe00";""
"supermarket";"Toko Swalayan";"Konter Ferro Cell";"594C+Q78, Lebak Larang, Wanasari, Kec. Cibeber, Kabupaten Lebak, Banten 42394";"Lebak Larang, Wanasari, Kec. Cibeber, Kabupaten Lebak";"BANTEN";"42394";"Indonesia";" 085773666992";"";"";"-6.8430907";"106.3706895";"https://maps.google.com/?cid=0x0:0x368cbbff01202771";""
"supermarket";"Minimarket";"Indomaret Majasari";"Jl. Raya Warungbanten No.km 22, Majasari, Kec. Sobang, Kabupaten Lebak, Banten 42365";"Majasari, Kec. Sobang, Kabupaten Lebak";"BANTEN";"42365";"Indonesia";"";"";"";"-6.6576793";"106.3651161";"https://maps.google.com/?cid=0x0:0x2d819ef232bb4355";""
"supermarket";"Pusat Perbelanjaan";"Warung Sembako";"Kp. Pasirnagka, RT., 04/RW., 03, Citorek Sabrang, Kec. Cibeber, Kabupaten Lebak, Banten 42394";"RT., 04/RW., 03, Citorek Sabrang, Kec. Cibeber, Kabupaten Lebak";"BANTEN";"42394";"Indonesia";" 081290439669";"";"";"-6.6997491";"106.3394681";"https://maps.google.com/?cid=0x0:0x7994b3add8a2b419";""
"supermarket";"Supermarket Industri";"Warung Ratna";"786V+4P8, Ciusul, Citorek Kidul, Kec. Cibeber, Kabupaten Lebak, Banten 42394";"Ciusul, Citorek Kidul, Kec. Cibeber, Kabupaten Lebak";"BANTEN";"42394";"Indonesia";"";"";"";"-6.739713";"106.3443299";"https://maps.google.com/?cid=0x0:0x4b4ba917cf4905e8";""
"supermarket";"Toko Komputer";"Riki CellFotocopy";"Jl. Raya Bayah-Cikotok, Cibeber, Kec. Cibeber, Kabupaten Lebak, Banten 42394";"Cibeber, Kec. Cibeber, Kabupaten Lebak";"BANTEN";"42394";"Indonesia";" 083841234455";"";"";"-6.8924542";"106.2950604";"https://maps.google.com/?cid=0x0:0x546388e86703714c";""
"supermarket";"Toko Kelontong Asia";"Toko Sembako H. Ahyar";"786W+84H, Ciusul, Citorek Kidul, Kec. Cibeber, Kabupaten Lebak, Banten 42394";"Ciusul, Citorek Kidul, Kec. Cibeber, Kabupaten Lebak";"BANTEN";"42394";"Indonesia";"";"";"";"-6.7391773";"106.3453482";"https://maps.google.com/?cid=0x0:0x6f4f9a8c94089ace";""
"supermarket";"Minimarket";"Toko EUIS SUPARTINI";"Cimancak, Kec. Bayah, Kabupaten Lebak, Banten 42393";"Kec. Bayah, Kabupaten Lebak";"BANTEN";"42393";"Indonesia";" 081283631089";"";"";"-6.9040229";"106.2592236";"https://maps.google.com/?cid=0x0:0x112696a751430a16";""
"supermarket";"Toko Perlengkapan Rumah";"Toko Rustandi Putra";"29JR+58H, Cibareno, Kec. Cilograng, Kabupaten Lebak, Banten 42393";"Cibareno, Kec. Cilograng, Kabupaten Lebak";"BANTEN";"42393";"Indonesia";"";"";"";"-6.9695697";"106.3908526";"https://maps.google.com/?cid=0x0:0xbcfc0f5c8762f5a6";""
"supermarket";"";"Kios Diwintar";"Jl. Raya Bayah-Cikotok No.Km. 8, Cinangga, Kec. Bayah, Kabupaten Lebak, Banten 42393";"Cinangga, Kec. Bayah, Kabupaten Lebak";"BANTEN";"42393";"Indonesia";" 087772923030";"";"";"-6.8949036";"106.2947817";"https://maps.google.com/?cid=0x0:0x78ced5930613964b";""
"supermarket";"Toko Swalayan";"Toko SRC Ihat";"Jl. Raya Lb. Gedong Cibeber Ps., Curug Bitung, Kec. Nanggung, Kabupaten Bogor, Jawa Barat 16650";"Curug Bitung, Kec. Nanggung, Kabupaten Bogor";"BANTEN";"16650";"Indonesia";"";"";"";"-6.6333577";"106.5375457";"https://maps.google.com/?cid=0x0:0x7c814d000f5edf09";""
"supermarket";"supermarket";"Kec. Cibeber";"Kabupaten Lebak, Banten";"Kabupaten Lebak, Banten";"BANTEN";"";"Indonesia";"";"";"";"-6.8192431";"106.383813";"https://maps.google.com/?cid=0x0:0x401e8f1fc28deb0";""
"supermarket";"Toko Swalayan";"Konter pulsa Olief Cell";"594C+Q9F, Wanasari, Kec. Cibeber, Kabupaten Lebak, Banten 42394";"Wanasari, Kec. Cibeber, Kabupaten Lebak";"BANTEN";"42394";"Indonesia";" 08558718941";"";"";"-6.8430693";"106.3709284";"https://maps.google.com/?cid=0x0:0x989502a096eaf483";""
"supermarket";"Pusat Perbelanjaan";"FRESHMART (Fresh and Healthy)";"Jl. Boulevard Raya No.28, Cibeber, Kec. Cibeber, Kota Cilegon, Banten 42426";"Cibeber, Kec. Cibeber, Kota Cilegon";"BANTEN";"42426";"Indonesia";" 087740000021";"";"/url?q>>u003dhttps://www.instagram.com/freshmart_cibeber/%3Fhl%3Den>>u0026opi>>u003d79508299>>u0026sa>>u003dU>>u0026ved>>u003d0ahUKEwj759njy66LAxXccPUHHehvAMcQ61gIFigS>>u0026usg>>u003dAOvVaw29Lrcd9BCiYeh7q1P0XfnU";"-6.0317025";"106.0668288";"https://maps.google.com/?cid=0x0:0xb141ff31165e875a";""
"supermarket";"Apotek";"Hero Supermarket - Cilegon City Square";"Cilegon City Square, Jl. Lingkar Selatan, Kedaleman, Kec. Cilegon, Kota Cilegon, Banten 42414";"Jl. Lingkar Selatan, Kedaleman, Kec. Cilegon, Kota Cilegon";"BANTEN";"42414";"Indonesia";" 062254269900";"";"";"-6.0343612";"106.0823563";"https://maps.google.com/?cid=0x0:0xf79e8b5377b4334a";""
"supermarket";"Smart shop";"212 Mart PCI";"Ruko PCI Blok KK1 /12A, Kedaleman, Cibeber, Cilegon, Banten 42422";"Kedaleman, Cibeber, Cilegon";"BANTEN";"42422";"Indonesia";" 0811110703";"";"";"-6.0337485";"106.0810803";"https://maps.google.com/?cid=0x0:0xb8d39fb988e517cb";""
"supermarket";"Toko makanan beku";"FROZEN FOOD CILEGON BY BELLA";"Jl. Boulevard Raya No.119, Cibeber, Kec. Cibeber, Kota Cilegon, Banten 42426";"Cibeber, Kec. Cibeber, Kota Cilegon";"BANTEN";"42426";"Indonesia";" 081288704114";"";"/url?q>>u003dhttps://shopee.co.id/frozenfoodcilegon>>u0026opi>>u003d79508299>>u0026sa>>u003dU>>u0026ved>>u003d0ahUKEwjviPzky66LAxWhYPUHHZmaAfsQ61gIFigS>>u0026usg>>u003dAOvVaw0-z4fGUhw7CthFbhdKaMdR";"-6.0278342";"106.0695309";"https://maps.google.com/?cid=0x0:0x555c27538e1b6aa3";""
"supermarket";"Toko sembako pemerintah";"Pbs gemini cilegon 1";"X388+J49, Cibeber, Kec. Cibeber, Kota Cilegon, Banten";"Kota Cilegon, Banten";"BANTEN";"";"Indonesia";"";"";"";"-6.0334742";"106.0653438";"https://maps.google.com/?cid=0x0:0x723cb55a59db2be2";""
"supermarket";"Toko bahan makanan";"Alfamart";"Jalan Komp Pci Kel No.19 Blok C2, RT.005/RW.001, Kedaleman, Kec. Cibeber, Kota Cilegon, Banten 42422";"RT.005/RW.001, Kedaleman, Kec. Cibeber, Kota Cilegon";"BANTEN";"42422";"Indonesia";" 1500959";"";"";"-6.0385888";"106.0762712";"https://maps.google.com/?cid=0x0:0xee6f1e861cb3ea83";""
"supermarket";"Toko Swalayan";"Bintang Swalayan";"Jl. SA. Tirtayasa No.23, Ramanuju, Kec. Purwakarta, Kota Cilegon, Banten 42431";"Ramanuju, Kec. Purwakarta, Kota Cilegon";"BANTEN";"42431";"Indonesia";"";"";"";"-6.0127456";"106.0447061";"https://maps.google.com/?cid=0x0:0xf872cd311ed34b69";""
"supermarket";"Minimarket";"Indomaret Fresh Cibeber";"JL. Garuda, RT 05 RW 08, Cibeber, Kec. Cilegon, Kota Cilegon, Banten 42426";"RT 05 RW 08, Cibeber, Kec. Cilegon, Kota Cilegon";"BANTEN";"42426";"Indonesia";" 0254390121";"";"/url?q>>u003dhttps://indomaret.co.id/>>u0026opi>>u003d79508299>>u0026sa>>u003dU>>u0026ved>>u003d0ahUKEwj2-ajmy66LAxXfnK8BHaADOA8Q61gIFigS>>u0026usg>>u003dAOvVaw01Uz6lflnF2PRaopPyOXxP";"-6.032372";"106.0657433";"https://maps.google.com/?cid=0x0:0xcf208c3e716cd4c0";""
"supermarket";"Pusat Perbelanjaan";"Hypermart - Cilegon";"MAYOFIELD MALL JL SA TIRTASAYA SIMPANG TIGA, Kota Cilegon, Banten 42431";"Kota Cilegon";"BANTEN";"42431";"Indonesia";" 0254388741";"";"/url?q>>u003dhttp://www.hypermart.co.id/>>u0026opi>>u003d79508299>>u0026sa>>u003dU>>u0026ved>>u003d0ahUKEwiVjInny66LAxWFbPUHHYqLAYUQ61gIFCgQ>>u0026usg>>u003dAOvVaw3i8laMkgQ7vtB-qJvFEFWX";"-6.0131239";"106.0452553";"https://maps.google.com/?cid=0x0:0x76e8c77645e65068";""
"supermarket";"Toko bahan makanan";"Alfamart Kali Timbang";"Jl. Kp, Jl. Krotek No.Kel, Kalitimbang, Kec. Cibeber, Kota Cilegon, Banten 42424";"Jl. Krotek No.Kel, Kalitimbang, Kec. Cibeber, Kota Cilegon";"BANTEN";"42424";"Indonesia";" 1500959";"";"";"-6.049225";"106.0590159";"https://maps.google.com/?cid=0x0:0x69ea8bfcf9eb7731";""
"supermarket";"Toko Swalayan";"SuperIndo Cilegon";"Supermall, Jl. Jenderal Sudirman Jl. Simpang Tiga, Ramanuju, Cilegon, Banten 42411";"Jl. Jenderal Sudirman Jl. Simpang Tiga, Ramanuju, Cilegon";"BANTEN";"42411";"Indonesia";" 0254377097";"";"/url?q>>u003dhttp://www.superindo.co.id/>>u0026opi>>u003d79508299>>u0026sa>>u003dU>>u0026ved>>u003d0ahUKEwii1PLny66LAxU_i68BHewWPUYQ61gIFigS>>u0026usg>>u003dAOvVaw194Ra1_wyWH1FBuuca6Fcq";"-6.014553";"106.0458452";"https://maps.google.com/?cid=0x0:0x347542dc362be6e4";""
"supermarket";"Toko Swalayan";"Tk robiyatul";"W2RX+C88, Bulakan, Kec. Cibeber, Kota Cilegon, Banten 42426";"Bulakan, Kec. Cibeber, Kota Cilegon";"BANTEN";"42426";"Indonesia";"";"";"";"-6.0589629";"106.0483197";"https://maps.google.com/?cid=0x0:0x369f2979b3a3d7c2";""
"supermarket";"Toko";"Warung Mamah Alif";"X38C+W9R, Cibeber, Kec. Cibeber, Kota Cilegon, Banten 42426";"Cibeber, Kec. Cibeber, Kota Cilegon";"BANTEN";"42426";"Indonesia";" 085216348656";"";"";"-6.0326448";"106.0709057";"https://maps.google.com/?cid=0x0:0xa2577121a86ac353";""
"supermarket";"Minimarket";"Toko Rizki Jaya";"X336+V6X, Kalitimbang, Kec. Cibeber, Kota Cilegon, Banten 42426";"Kalitimbang, Kec. Cibeber, Kota Cilegon";"BANTEN";"42426";"Indonesia";"";"";"";"-6.0447821";"106.0608037";"https://maps.google.com/?cid=0x0:0xdc6cd5d052f42c26";""
"supermarket";"Toko Aki Mobil";"Super Shop  Drive - Cibeber, Cilegon";"Jl. Raya Ahmad Yani Kota, Cibeber, Cilegon, Banten 42421";"Cibeber, Cilegon";"BANTEN";"42421";"Indonesia";" 0254391707";"";"";"-6.028678";"106.0744668";"https://maps.google.com/?cid=0x0:0x5fa7957be411e65c";""
"supermarket";"Toko bahan makanan";"Warung Ibu Robihat";"X363+XP3, Karangasem, Kec. Cibeber, Kota Cilegon, Banten 42426";"Karangasem, Kec. Cibeber, Kota Cilegon";"BANTEN";"42426";"Indonesia";" 087871607734";"";"";"-6.0376107";"106.0543115";"https://maps.google.com/?cid=0x0:0x8e8fcfce4e0f322c";""
"supermarket";"Toko Swalayan";"Super Indo Cilegon Center";"Cilegon Center Mall, Lt. LG, Sukmajaya, Kec. Jombang, Kota Cilegon, Banten 42416";"Lt. LG, Sukmajaya, Kec. Jombang, Kota Cilegon";"BANTEN";"42416";"Indonesia";" 02547817192";"";"/url?q>>u003dhttp://www.superindo.co.id/>>u0026opi>>u003d79508299>>u0026sa>>u003dU>>u0026ved>>u003d0ahUKEwif05Hry66LAxU2jK8BHb2RGIsQ61gIFigS>>u0026usg>>u003dAOvVaw2zhCv7Nm5KyiSbrDGVpVJC";"-6.0246159";"106.0699058";"https://maps.google.com/?cid=0x0:0xec91b2fbb5919de";""
"supermarket";"Toko umum";"Sumber Makmur Cilegon";"Sukmajaya, Kec. Jombang, Kota Cilegon, Banten 42411";"Kec. Jombang, Kota Cilegon";"BANTEN";"42411";"Indonesia";" 02548482121";"";"";"-6.0182797";"106.065245";"https://maps.google.com/?cid=0x0:0xee22e93c58ab26c8";""
"supermarket";"Toko bahan makanan";"Diskon Supermarket Ciwandan";"Jl. Brigjend Katamso No.KM.120, Kepuh, Kec. Ciwandan, Kota Cilegon, Banten 42446";"Kepuh, Kec. Ciwandan, Kota Cilegon";"BANTEN";"42446";"Indonesia";" 085922910600";"";"";"-6.0277278";"105.9465923";"https://maps.google.com/?cid=0x0:0x90fd85eb06cf9cac";""
"supermarket";"supermarket";"Banten 42422";"Kec. Cibeber, Kota Cilegon, Banten";"Kota Cilegon, Banten";"BANTEN";"";"Indonesia";"";"";"";"-6.0337179";"106.0787142";"https://maps.google.com/?cid=0x0:0x1c00c5eb568ecdd0";""
"supermarket";"Pusat Perbelanjaan";"FDBC Grosir Cilegon";"Jl. Stasiun, Jombang Wetan, Kec. Jombang, Kota Cilegon, Banten 42411";"Jombang Wetan, Kec. Jombang, Kota Cilegon";"BANTEN";"42411";"Indonesia";" 08982819830";"";"/url?q>>u003dhttp://www.facebook.com/fdbeautycollection>>u0026opi>>u003d79508299>>u0026sa>>u003dU>>u0026ved>>u003d0ahUKEwil9eLsy66LAxXwsFYBHeVFOz0Q61gIFigS>>u0026usg>>u003dAOvVaw1JLcId9du3iOF1o4fj-zIB";"-6.0190803";"106.0518903";"https://maps.google.com/?cid=0x0:0x1e18654420bc89cd";""
"supermarket";"Minimarket";"Neiska";"Jl. Perum Pd. Cilegon Indah No.D23, RW.9, Karangasem, Kec. Cibeber, Kota Cilegon, Banten 42426";"RW.9, Karangasem, Kec. Cibeber, Kota Cilegon";"BANTEN";"42426";"Indonesia";" 085311013505";"";"";"-6.0312316";"106.0597928";"https://maps.google.com/?cid=0x0:0x3982c6b316308251";""
"supermarket";"Tempat Parkir";"Cilegon Center Mall";"Jl. Ahmad Yani, Sukmajaya, Kec. Jombang, Kota Cilegon, Banten 42426";"Sukmajaya, Kec. Jombang, Kota Cilegon";"BANTEN";"42426";"Indonesia";" 02547817447";"";"";"-6.0246159";"106.0699058";"https://maps.google.com/?cid=0x0:0x35dde04f05071026";""
"supermarket";"Minimarket";"Toko Tita Jaya";"Jl. Kerinci, Ciwaduk, Kec. Cilegon, Kota Cilegon, Banten 42415";"Ciwaduk, Kec. Cilegon, Kota Cilegon";"BANTEN";"42415";"Indonesia";" 087808426248";"";"";"-6.0248386";"106.0506442";"https://maps.google.com/?cid=0x0:0xdb924766a1da0023";""
"supermarket";"Minimarket";"Alfamart Raya Bagendong";"Jl Raya Bagendong, Kel No.67, RT.01/RW.01, Ciwedus, Kec. Cilegon, Kota Cilegon, Banten 42418";"Kel No.67, RT.01/RW.01, Ciwedus, Kec. Cilegon, Kota Cilegon";"BANTEN";"42418";"Indonesia";" 1500959";"";"";"-6.034132";"106.0382419";"https://maps.google.com/?cid=0x0:0x2e499daa7fd3d8f3";""
"supermarket";"Pusat Perbelanjaan";"FRESHMART (Fresh and Healthy)";"Jl. Boulevard Raya No.28, Cibeber, Kec. Cibeber, Kota Cilegon, Banten 42426";"Cibeber, Kec. Cibeber, Kota Cilegon";"BANTEN";"42426";"Indonesia";" 087740000021";"";"/url?q>>u003dhttps://www.instagram.com/freshmart_cibeber/%3Fhl%3Den>>u0026opi>>u003d79508299>>u0026sa>>u003dU>>u0026ved>>u003d0ahUKEwjGwLOHzK6LAxWTSmwGHZQSKPcQ61gIFigS>>u0026usg>>u003dAOvVaw1S9JAvks4MShES7beR_wY1";"-6.0317025";"106.0668288";"https://maps.google.com/?cid=0x0:0xb141ff31165e875a";""
"supermarket";"Pusat Perbelanjaan";"Hypermart - Cilegon";"MAYOFIELD MALL JL SA TIRTASAYA SIMPANG TIGA, Kota Cilegon, Banten 42431";"Kota Cilegon";"BANTEN";"42431";"Indonesia";" 0254388741";"";"/url?q>>u003dhttp://www.hypermart.co.id/>>u0026opi>>u003d79508299>>u0026sa>>u003dU>>u0026ved>>u003d0ahUKEwi6_NWHzK6LAxVnTWwGHVtLO0wQ61gIFCgQ>>u0026usg>>u003dAOvVaw3RsJeMBLLpTQK6UqDEH0yq";"-6.0131239";"106.0452553";"https://maps.google.com/?cid=0x0:0x76e8c77645e65068";""
"supermarket";"Toko Swalayan";"Bintang Swalayan";"Jl. SA. Tirtayasa No.23, Ramanuju, Kec. Purwakarta, Kota Cilegon, Banten 42431";"Ramanuju, Kec. Purwakarta, Kota Cilegon";"BANTEN";"42431";"Indonesia";"";"";"";"-6.0127456";"106.0447061";"https://maps.google.com/?cid=0x0:0xf872cd311ed34b69";""
"supermarket";"Toko sembako pemerintah";"Pbs gemini cilegon 1";"X388+J49, Cibeber, Kec. Cibeber, Kota Cilegon, Banten";"Kota Cilegon, Banten";"BANTEN";"";"Indonesia";"";"";"";"-6.0334742";"106.0653438";"https://maps.google.com/?cid=0x0:0x723cb55a59db2be2";""
"supermarket";"Minimarket";"Indomaret Fresh Cibeber";"JL. Garuda, RT 05 RW 08, Cibeber, Kec. Cilegon, Kota Cilegon, Banten 42426";"RT 05 RW 08, Cibeber, Kec. Cilegon, Kota Cilegon";"BANTEN";"42426";"Indonesia";" 0254390121";"";"/url?q>>u003dhttps://indomaret.co.id/>>u0026opi>>u003d79508299>>u0026sa>>u003dU>>u0026ved>>u003d0ahUKEwihmNqIzK6LAxXvU2wGHaeRF9IQ61gIFigS>>u0026usg>>u003dAOvVaw3yFFxWMkHDC8kAIsrs9Ztx";"-6.032372";"106.0657433";"https://maps.google.com/?cid=0x0:0xcf208c3e716cd4c0";""
"supermarket";"Toko Swalayan";"SuperIndo Cilegon";"Supermall, Jl. Jenderal Sudirman Jl. Simpang Tiga, Ramanuju, Cilegon, Banten 42411";"Jl. Jenderal Sudirman Jl. Simpang Tiga, Ramanuju, Cilegon";"BANTEN";"42411";"Indonesia";" 0254377097";"";"/url?q>>u003dhttp://www.superindo.co.id/>>u0026opi>>u003d79508299>>u0026sa>>u003dU>>u0026ved>>u003d0ahUKEwja-uyIzK6LAxWmTWwGHSXFM_QQ61gIFigS>>u0026usg>>u003dAOvVaw2-B2X8nU2jLAX8uFmpd76x";"-6.014553";"106.0458452";"https://maps.google.com/?cid=0x0:0x347542dc362be6e4";""
"supermarket";"Toko makanan beku";"FROZEN FOOD CILEGON BY BELLA";"Jl. Boulevard Raya No.119, Cibeber, Kec. Cibeber, Kota Cilegon, Banten 42426";"Cibeber, Kec. Cibeber, Kota Cilegon";"BANTEN";"42426";"Indonesia";" 081288704114";"";"/url?q>>u003dhttps://shopee.co.id/frozenfoodcilegon>>u0026opi>>u003d79508299>>u0026sa>>u003dU>>u0026ved>>u003d0ahUKEwiFpLWJzK6LAxVRTGwGHTlmNssQ61gIFigS>>u0026usg>>u003dAOvVaw3fh4ufR-MUAmcAhlQPyhdr";"-6.0278342";"106.0695309";"https://maps.google.com/?cid=0x0:0x555c27538e1b6aa3";""
"supermarket";"Toko bahan makanan";"Alfamart";"Perum Baru Cilegon Kencana Blok E No.6 Rt/Rw 001/009 Kel, Cibeber, Kec. Cibeber, Kota Cilegon, Banten 42423";"Cibeber, Kec. Cibeber, Kota Cilegon";"BANTEN";"42423";"Indonesia";" 1500959";"";"";"-6.0328124";"106.0658567";"https://maps.google.com/?cid=0x0:0xaa4d611dbfe0082a";""
"supermarket";"Pusat Perbelanjaan";"FDBC Grosir Cilegon";"Jl. Stasiun, Jombang Wetan, Kec. Jombang, Kota Cilegon, Banten 42411";"Jombang Wetan, Kec. Jombang, Kota Cilegon";"BANTEN";"42411";"Indonesia";" 08982819830";"";"/url?q>>u003dhttp://www.facebook.com/fdbeautycollection>>u0026opi>>u003d79508299>>u0026sa>>u003dU>>u0026ved>>u003d0ahUKEwiC1_eJzK6LAxUQRWwGHYgZHjsQ61gIFigS>>u0026usg>>u003dAOvVaw1xk-Ee14N14KChBElIDN5i";"-6.0190803";"106.0518903";"https://maps.google.com/?cid=0x0:0x1e18654420bc89cd";""
