Category,Real Category,Business Name,Address,City,State,Postal Code,Country,Phone,Email,Website,Latitude,Longitude,Map Link,Details Link
cafe,Restoran,Hilda,"9X8Q+P42, Lapasi-Pasi, Kec. Lambai, Kabupaten Kolaka Utara, Sulawesi Tenggara 93956","Lapasi-Pasi, Kec. Lambai, Kabupaten Kolaka Utara",SULAWESI TENGGARA,93956.0,Indonesia,85255496661.0,,,-3.6336224,120.9881446,https://maps.google.com/?cid=0x0:0x654da5b5d259590d,
cafe,Restoran,Bunda rara,"Jl. Poros Ranteangin - Kolaka, Walasiho, Kec. Wawo, Kabupaten Kolaka Utara, Sulawesi Tenggara 93956","Walasiho, Kec. Wawo, Kabupaten Kolaka Utara",SULAWESI TENGGARA,93956.0,Indonesia,82324460428.0,,,-3.7073279,121.0708256,https://maps.google.com/?cid=0x0:0xc1cd21d1f3f19664,
cafe,Kafe,Cafe Macawa,"GV2J+MMR, Unnamed Road, Lasusua, Kec. Lasusua, Kabupaten Kolaka Utara, Sulawesi Tenggara 93914","Unnamed Road, Lasusua, Kec. Lasusua, Kabupaten Kolaka Utara",SULAWESI TENGGARA,93914.0,Indonesia,,,,-3.4982508,120.8816469,https://maps.google.com/?cid=0x0:0x40e34c92352bfd9,
cafe,Restoran,Rumah Makan Simpatig,"Jl. Poros Ranteangin - Kolaka No.17, Rante Angin, Kecamatan Rante Angin, Kabupaten Kolaka Utara, Sulawesi Tenggara 93956","Rante Angin, Kecamatan Rante Angin, Kabupaten Kolaka Utara",SULAWESI TENGGARA,93956.0,Indonesia,81341545850.0,,,-3.6658049,121.0360698,https://maps.google.com/?cid=0x0:0xcc272d3aa4fe4e36,
cafe,cafe,Kedai Ahmad inna,"lorong belakang No.RT 05, Pohu, Kecamatan Rante Angin, Kabupaten Kolaka Utara, Sulawesi Tenggara 93956","Pohu, Kecamatan Rante Angin, Kabupaten Kolaka Utara",SULAWESI TENGGARA,93956.0,Indonesia,,,,-3.6455094,121.0052418,https://maps.google.com/?cid=0x0:0x5cdaf61d50399755,
cafe,Restoran,Rumah Makan Sido Mampir,"9X9P+7CG, Jl. Poros Ranteangin - Kolaka, Lapasi-Pasi, Kec. Lambai, Kabupaten Kolaka Utara, Sulawesi Tenggara 93956","Jl. Poros Ranteangin - Kolaka, Lapasi-Pasi, Kec. Lambai, Kabupaten Kolaka Utara",SULAWESI TENGGARA,93956.0,Indonesia,,,,-3.6318135,120.9860894,https://maps.google.com/?cid=0x0:0x9c1173b87cb739d8,
cafe,Padang,PENGINAPAN PARAIKATTE  Rumah Makan,"Jl. Poros Ranteangin - Kolaka, Tamborasi, Kec. Wolo, Kabupaten Kolaka, Sulawesi Tenggara 93552","Tamborasi, Kec. Wolo, Kabupaten Kolaka",SULAWESI TENGGARA,93552.0,Indonesia,85394565055.0,,,-3.760462,121.1226294,https://maps.google.com/?cid=0x0:0x395affafab94b50,
cafe,Kedai Kopi,Waroong Lo,"PP73+W9X, Jl. Elang IV, Pd. Pucung, Kec. Pd. Aren, Kota Tangerang Selatan, Banten 15229","Jl. Elang IV, Pd. Pucung, Kec. Pd. Aren, Kota Tangerang Selatan",SULAWESI TENGGARA,15229.0,Indonesia,,,,-6.2851284,106.7034999,https://maps.google.com/?cid=0x0:0xf22dbc1526897a09,
cafe,Kafe,CAFE WOW,"Jl. Wadassari I No.47, RT.6/RW.1, Pd. Karya, Kec. Pd. Aren, Kota Tangerang Selatan, Banten 15225","RT.6/RW.1, Pd. Karya, Kec. Pd. Aren, Kota Tangerang Selatan",SULAWESI TENGGARA,15225.0,Indonesia,82110791117.0,,,-6.2578333,106.746739,https://maps.google.com/?cid=0x0:0xbb922f015edfeefa,
cafe,Kedai Kopi,Kopi waw,"Jl. Pembangunan IV No.47, RT.005, RT.001/RW.012, Karang Sari, Kec. Neglasari, Kota Tangerang, Banten 15121","RT.005, RT.001/RW.012, Karang Sari, Kec. Neglasari, Kota Tangerang",SULAWESI TENGGARA,15121.0,Indonesia,82125061976.0,,,-6.1575222,106.6418938,https://maps.google.com/?cid=0x0:0xdd375986b1f4fb1f,
hotel,hotel,Kec. Batu Putih,"Kabupaten Kolaka Utara, Sulawesi Tenggara","Kabupaten Kolaka Utara, Sulawesi Tenggara",SULAWESI TENGGARA,,Indonesia,,,,-3.074246,121.082312,https://maps.google.com/?cid=0x0:0x212cea78674168b6,
hotel,Hotel,HOTEL RR DUa Putra,"W3GP+4QF, Jl. Poros Malili - Batuputih, Latowu, Kec. Batu Putih, Kabupaten Kolaka Utara, Sulawesi Tenggara 93955","Jl. Poros Malili - Batuputih, Latowu, Kec. Batu Putih, Kabupaten Kolaka Utara",SULAWESI TENGGARA,93955.0,Indonesia,85256621739.0,,,-3.0746764,121.0869292,https://maps.google.com/?cid=0x0:0x42eae3159bd55dec,
hotel,Hotel,Penginapan RISKA,"W4F4+C68, Batu Putih, Kec. Batu Putih, Kabupaten Kolaka Utara, Sulawesi Tenggara","Kabupaten Kolaka Utara, Sulawesi Tenggara",SULAWESI TENGGARA,,Indonesia,81354653352.0,,,-3.0764624,121.1055841,https://maps.google.com/?cid=0x0:0x2b423b2a2b816ff4,
hotel,Motel,Wisma Kartini,"W4F4+7X7, Batu Putih, Kec. Batu Putih, Kabupaten Kolaka Utara, Sulawesi Tenggara 93955","Batu Putih, Kec. Batu Putih, Kabupaten Kolaka Utara",SULAWESI TENGGARA,93955.0,Indonesia,,,,-3.0768397,121.1074337,https://maps.google.com/?cid=0x0:0xbeb1e4dab7207df5,
hotel,Rumah wisata,Penginapan Tiga Serangkai,"W3GQ+543, Jl. Poros Malili - Batuputih, Makkuaseng, Kec. Batu Putih, Kabupaten Kolaka Utara, Sulawesi Tenggara 93955","Jl. Poros Malili - Batuputih, Makkuaseng, Kec. Batu Putih, Kabupaten Kolaka Utara",SULAWESI TENGGARA,93955.0,Indonesia,,,,-3.0748474,121.0879307,https://maps.google.com/?cid=0x0:0x56280eb05ce0e6a0,
hotel,Hotel,Wisma Peronikel,"Latowu, Kec. Batu Putih, Kabupaten Kolaka Utara, Sulawesi Tenggara 93955","Kec. Batu Putih, Kabupaten Kolaka Utara",SULAWESI TENGGARA,93955.0,Indonesia,85241988980.0,,,-3.074371,121.0874365,https://maps.google.com/?cid=0x0:0xb7cc6ab5e6a65d9,
hotel,Hotel,Hotel Veronikel,"W3GR+35J, Makkuaseng, Kec. Batu Putih, Kabupaten Kolaka Utara, Sulawesi Tenggara 93955","Makkuaseng, Kec. Batu Putih, Kabupaten Kolaka Utara",SULAWESI TENGGARA,93955.0,Indonesia,85241988980.0,,,-3.0747998,121.0904042,https://maps.google.com/?cid=0x0:0xdddaaf09472b41bd,
hotel,Hotel,Aulia Gibrank,"V58C+4C7, Salu Dongka, Kec. Pakue Utara, Kabupaten Kolaka Utara, Sulawesi Tenggara","Kabupaten Kolaka Utara, Sulawesi Tenggara",SULAWESI TENGGARA,,Indonesia,,,,-3.1347227,121.1710389,https://maps.google.com/?cid=0x0:0x9a66a896d811ae73,
hotel,hotel,,,,SULAWESI TENGGARA,,Indonesia,,,,,,https://maps.google.com/?cid=0x0:0x9a1a16327592b4c0%7C/g/11j65fnz4y%7Cen-ID,
hotel,hotel,OYO 3463 Cimahi Guest House,"Jl. Jend. H. Amir Machmud No.173, Cigugur Tengah, Kec. Cimahi Tengah, Kota Cimahi, Jawa Barat 40533","Cigugur Tengah, Kec. Cimahi Tengah, Kota Cimahi",SULAWESI TENGGARA,40533.0,Indonesia,2129707601.0,,,-6.8957828,107.5601114,https://maps.google.com/?cid=0x0:0x9a1a16327592b4c0,
hotel,hotel,OYO 2183 Cibeureum Residence,"Jl. Jend. Sudirman No.851, Cijerah, Kec. Bandung Kulon, Kota Bandung, Jawa Barat 40213","Cijerah, Kec. Bandung Kulon, Kota Bandung",SULAWESI TENGGARA,40213.0,Indonesia,81222219736.0,,,-6.9105922,107.568899,https://maps.google.com/?cid=0x0:0x43769858dd7dd5dd,
hotel,hotel,CIMAHI GUEST HOUSE,"JLN. KH, Jl. Jend. H. Amir Machmud No.173, Cibeureum, Kec. Cimahi Sel., Kota Cimahi, Jawa Barat 40535","Jl. Jend. H. Amir Machmud No.173, Cibeureum, Kec. Cimahi Sel., Kota Cimahi",SULAWESI TENGGARA,40535.0,Indonesia,81222219726.0,,,-6.8982028,107.561256,https://maps.google.com/?cid=0x0:0xd56f535940ba38,
hotel,hotel,Penginapan Bandung Syariah RBG,"Jalan Babakan Radio, Komplek, Jl. Mega Asri 3 No.6, Kota Bandung, Jawa Barat 40175","Komplek, Jl. Mega Asri 3 No.6, Kota Bandung",SULAWESI TENGGARA,40175.0,Indonesia,85189977852.0,,,-6.891408,107.5665287,https://maps.google.com/?cid=0x0:0x573741c570ee3d1,
hotel,hotel,Hotel Cassadua,"Jl. Cassa No.2, Sukawarna, Kec. Sukajadi, Kota Bandung, Jawa Barat 40164","Sukawarna, Kec. Sukajadi, Kota Bandung",SULAWESI TENGGARA,40164.0,Indonesia,222005822.0,,,-6.8897582,107.5782557,https://maps.google.com/?cid=0x0:0x22b5a16bc0ad8e13,
hotel,hotel,Cimindi Residence,"Jalan. KH.AmirMachmud Jl. Raya Cibeureum No.173, Cibeureum, Kec. Cimahi Sel., Kota Cimahi, Jawa Barat 40535","Cibeureum, Kec. Cimahi Sel., Kota Cimahi",SULAWESI TENGGARA,40535.0,Indonesia,81222219726.0,,,-6.8982606,107.5614139,https://maps.google.com/?cid=0x0:0xf95858ad4601c666,
hotel,hotel,OYO 1859 Rancabali Residence,"Jl. Ranca Bali No.1, Pasirkaliki, Kec. Cimahi Utara, Kota Cimahi, Jawa Barat 40553","Pasirkaliki, Kec. Cimahi Utara, Kota Cimahi",SULAWESI TENGGARA,40553.0,Indonesia,2129707601.0,,,-6.8877875,107.5654405,https://maps.google.com/?cid=0x0:0xf319409dbc1699b1,
hotel,hotel,Sukaraja Syariah Residence (Super OYO),"Jl. Sukaraja II No.190, Sukaraja, Kec. Cicendo, Kota Bandung, Jawa Barat 40175","Sukaraja, Kec. Cicendo, Kota Bandung",SULAWESI TENGGARA,40175.0,Indonesia,2129707601.0,,,-6.8938803,107.5735174,https://maps.google.com/?cid=0x0:0x40991a8effbdfd1e,
hotel,Museum,Gedung Sate,"Jl. Diponegoro No.22, Citarum, Kec. Bandung Wetan, Kota Bandung, Jawa Barat 40115","Citarum, Kec. Bandung Wetan, Kota Bandung",SULAWESI TENGGARA,40115.0,Indonesia,224233347.0,,,-6.9024715,107.6187018,https://maps.google.com/?cid=0x0:0x37be7ac9d575f7ed,
hotel,Perusahaan Kereta Api,Stasiun Cimindi,"Babakan Ciamis, Kec. Sumur Bandung, Kota Bandung, Jawa Barat 40117","Kec. Sumur Bandung, Kota Bandung",SULAWESI TENGGARA,40117.0,Indonesia,,,,-6.8961784,107.5611171,https://maps.google.com/?cid=0x0:0xf2085b45bcdde4c9,
hotel,Toko,POP GARUDA HOTSPOT CIBEUREUM,"Jl. Jend. H. Amir Machmud No.175, Cibeureum, Kec. Cimahi Sel., Kota Cimahi, Jawa Barat 40535","Cibeureum, Kec. Cimahi Sel., Kota Cimahi",SULAWESI TENGGARA,40535.0,Indonesia,81399254604.0,,,-6.8979248,107.5612365,https://maps.google.com/?cid=0x0:0x3e579d69282ffda3,
hotel,hotel,Kec. Batu Putih,"Kabupaten Kolaka Utara, Sulawesi Tenggara","Kabupaten Kolaka Utara, Sulawesi Tenggara",SULAWESI TENGGARA,,Indonesia,,,,-3.074246,121.082312,https://maps.google.com/?cid=0x0:0x212cea78674168b6,
hotel,Hotel,HOTEL RR DUa Putra,"W3GP+4QF, Jl. Poros Malili - Batuputih, Latowu, Kec. Batu Putih, Kabupaten Kolaka Utara, Sulawesi Tenggara 93955","Jl. Poros Malili - Batuputih, Latowu, Kec. Batu Putih, Kabupaten Kolaka Utara",SULAWESI TENGGARA,93955.0,Indonesia,85256621739.0,,,-3.0746764,121.0869292,https://maps.google.com/?cid=0x0:0x42eae3159bd55dec,
hotel,Taman,Batuh-putih,"W3GJ+3R7, Latowu, Kec. Batu Putih, Kabupaten Kolaka Utara, Sulawesi Tenggara 93955","Latowu, Kec. Batu Putih, Kabupaten Kolaka Utara",SULAWESI TENGGARA,93955.0,Indonesia,,,,-3.0748404,121.082053,https://maps.google.com/?cid=0x0:0x464dcc79181a3861,
hotel,Motel,Wisma Kartini,"W4F4+7X7, Batu Putih, Kec. Batu Putih, Kabupaten Kolaka Utara, Sulawesi Tenggara 93955","Batu Putih, Kec. Batu Putih, Kabupaten Kolaka Utara",SULAWESI TENGGARA,93955.0,Indonesia,,,,-3.0768397,121.1074337,https://maps.google.com/?cid=0x0:0xbeb1e4dab7207df5,
hotel,Hotel,Penginapan RISKA,"W4F4+C68, Batu Putih, Kec. Batu Putih, Kabupaten Kolaka Utara, Sulawesi Tenggara","Kabupaten Kolaka Utara, Sulawesi Tenggara",SULAWESI TENGGARA,,Indonesia,81354653352.0,,,-3.0764624,121.1055841,https://maps.google.com/?cid=0x0:0x2b423b2a2b816ff4,
hotel,Hotel,Wisma Peronikel,"Latowu, Kec. Batu Putih, Kabupaten Kolaka Utara, Sulawesi Tenggara 93955","Kec. Batu Putih, Kabupaten Kolaka Utara",SULAWESI TENGGARA,93955.0,Indonesia,85241988980.0,,,-3.074371,121.0874365,https://maps.google.com/?cid=0x0:0xb7cc6ab5e6a65d9,
hotel,Rumah wisata,Penginapan Tiga Serangkai,"W3GQ+543, Jl. Poros Malili - Batuputih, Makkuaseng, Kec. Batu Putih, Kabupaten Kolaka Utara, Sulawesi Tenggara 93955","Jl. Poros Malili - Batuputih, Makkuaseng, Kec. Batu Putih, Kabupaten Kolaka Utara",SULAWESI TENGGARA,93955.0,Indonesia,,,,-3.0748474,121.0879307,https://maps.google.com/?cid=0x0:0x56280eb05ce0e6a0,
hotel,hotel,"Spring, Texas 77373","Spring, Texas, Amerika Serikat","Spring, Texas, Amerika Serikat",SULAWESI TENGGARA,,Indonesia,,,,30.0605454,-95.3834854,https://maps.google.com/?cid=0x0:0x93cb797f30ad75dc,
hotel,hotel,Hilton Garden Inn North Houston Spring,"23535 Northgate Crossing Blvd, Spring, TX 77373, Amerika Serikat",Northgate Crossing Blvd,SULAWESI TENGGARA,23535.0,Indonesia,12815282900.0,,,30.105141,-95.4297667,https://maps.google.com/?cid=0x0:0xd991bc315618bf6d,
hotel,hotel,Kec. Batu Putih,"Kabupaten Kolaka Utara, Sulawesi Tenggara","Kabupaten Kolaka Utara, Sulawesi Tenggara",SULAWESI TENGGARA,,Indonesia,,,,-3.074246,121.082312,https://maps.google.com/?cid=0x0:0x212cea78674168b6,
hotel,Taman,Batuh-putih,"W3GJ+3R7, Latowu, Kec. Batu Putih, Kabupaten Kolaka Utara, Sulawesi Tenggara 93955","Latowu, Kec. Batu Putih, Kabupaten Kolaka Utara",SULAWESI TENGGARA,93955.0,Indonesia,,,,-3.0748404,121.082053,https://maps.google.com/?cid=0x0:0x464dcc79181a3861,
hotel,Hotel,HOTEL RR DUa Putra,"W3GP+4QF, Jl. Poros Malili - Batuputih, Latowu, Kec. Batu Putih, Kabupaten Kolaka Utara, Sulawesi Tenggara 93955","Jl. Poros Malili - Batuputih, Latowu, Kec. Batu Putih, Kabupaten Kolaka Utara",SULAWESI TENGGARA,93955.0,Indonesia,85256621739.0,,,-3.0746764,121.0869292,https://maps.google.com/?cid=0x0:0x42eae3159bd55dec,
hotel,Motel,Wisma Kartini,"W4F4+7X7, Batu Putih, Kec. Batu Putih, Kabupaten Kolaka Utara, Sulawesi Tenggara 93955","Batu Putih, Kec. Batu Putih, Kabupaten Kolaka Utara",SULAWESI TENGGARA,93955.0,Indonesia,,,,-3.0768397,121.1074337,https://maps.google.com/?cid=0x0:0xbeb1e4dab7207df5,
hotel,Hotel,Hotel Veronikel,"W3GR+35J, Makkuaseng, Kec. Batu Putih, Kabupaten Kolaka Utara, Sulawesi Tenggara 93955","Makkuaseng, Kec. Batu Putih, Kabupaten Kolaka Utara",SULAWESI TENGGARA,93955.0,Indonesia,85241988980.0,,,-3.0747998,121.0904042,https://maps.google.com/?cid=0x0:0xdddaaf09472b41bd,
hotel,Rumah wisata,Penginapan Tiga Serangkai,"W3GQ+543, Jl. Poros Malili - Batuputih, Makkuaseng, Kec. Batu Putih, Kabupaten Kolaka Utara, Sulawesi Tenggara 93955","Jl. Poros Malili - Batuputih, Makkuaseng, Kec. Batu Putih, Kabupaten Kolaka Utara",SULAWESI TENGGARA,93955.0,Indonesia,,,,-3.0748474,121.0879307,https://maps.google.com/?cid=0x0:0x56280eb05ce0e6a0,
hotel,Hotel,Wisma Peronikel,"Latowu, Kec. Batu Putih, Kabupaten Kolaka Utara, Sulawesi Tenggara 93955","Kec. Batu Putih, Kabupaten Kolaka Utara",SULAWESI TENGGARA,93955.0,Indonesia,85241988980.0,,,-3.074371,121.0874365,https://maps.google.com/?cid=0x0:0xb7cc6ab5e6a65d9,
hotel,Hotel,Aulia Gibrank,"V58C+4C7, Salu Dongka, Kec. Pakue Utara, Kabupaten Kolaka Utara, Sulawesi Tenggara","Kabupaten Kolaka Utara, Sulawesi Tenggara",SULAWESI TENGGARA,,Indonesia,,,,-3.1347227,121.1710389,https://maps.google.com/?cid=0x0:0x9a66a896d811ae73,
hotel,hotel,Sulawesi Tenggara 93955,"Kabupaten Kolaka Utara, Sulawesi Tenggara","Kabupaten Kolaka Utara, Sulawesi Tenggara",SULAWESI TENGGARA,,Indonesia,,,,-3.0486929,121.1481284,https://maps.google.com/?cid=0x0:0xf1a9ea3d80230301,
hotel,hotel,MJ Guest House Pusat Kota Malili,"Malili, Kec. Malili, Kabupaten Luwu Timur, Sulawesi Selatan 91131","Kec. Malili, Kabupaten Luwu Timur",SULAWESI TENGGARA,91131.0,Indonesia,895417300072.0,,,-2.6281848,121.1024074,https://maps.google.com/?cid=0x0:0x5e5376292e6533de,
hotel,hotel,HOTEL ALEXA TOWUTI,"100M dari Kantor POLSEK, Jl. Poros Wawondula - Timampu, Wawondula, Kec. Towuti, Kabupaten Luwu Timur, Sulawesi Selatan 92982","Jl. Poros Wawondula - Timampu, Wawondula, Kec. Towuti, Kabupaten Luwu Timur",SULAWESI TENGGARA,92982.0,Indonesia,8114199392.0,,,-2.6425812,121.3823365,https://maps.google.com/?cid=0x0:0x6070af28ae133bf2,
hotel,hotel,"Monterey Beach Hotel, a Tribute Portfolio Hotel","2600 Sand Dunes Dr, Monterey, CA 93940, Amerika Serikat","Monterey, CA",SULAWESI TENGGARA,93940.0,Indonesia,18313943321.0,,,36.6111545,-121.858933,https://maps.google.com/?cid=0x0:0xdb4b2143c70396cc,
hotel,hotel,,,,SULAWESI TENGGARA,,Indonesia,,,,,,https://maps.google.com/?cid=0x0:0xdb4b2143c70396cc%7C/g/1hdz7mpn0%7Cen-ID,
hotel,Akuarium,Monterey Bay Aquarium,"886 Cannery Row, Monterey, CA 93940, Amerika Serikat","Monterey, CA",SULAWESI TENGGARA,93940.0,Indonesia,18316484800.0,,,36.6182622,-121.9019542,https://maps.google.com/?cid=0x0:0xb5a84a1997229b63,
hotel,hotel,Hotel Batu Putih,"Jl. Bhayangkara No.73, Gunungpuyuh, Kec. Gunungpuyuh, Kota Sukabumi, Jawa Barat 43123","Gunungpuyuh, Kec. Gunungpuyuh, Kota Sukabumi",SULAWESI TENGGARA,43123.0,Indonesia,266221422.0,,,-6.9148455,106.9197365,https://maps.google.com/?cid=0x0:0x9c6aa645a90d0ba8,
hotel,Perhentian bus,Del Monte / Canyon Del Rey,"Seaside, California 93955, Amerika Serikat",California,SULAWESI TENGGARA,93955.0,Indonesia,,,,36.607438,-121.856463,https://maps.google.com/?cid=0x0:0x81fb98bac43543d2,
hotel,hotel,Sulawesi Tenggara 93913,"Kabupaten Kolaka Utara, Sulawesi Tenggara","Kabupaten Kolaka Utara, Sulawesi Tenggara",SULAWESI TENGGARA,,Indonesia,,,,-3.4802612,120.9618181,https://maps.google.com/?cid=0x0:0x6689ca82f105e43,
hotel,hotel,Hotel Puri Yasmin Potowanua Lasusua Mitra RedDoorz,"FVVQ+9C5, Jl. Baru, Patowonua, Kec. Lasusua, Kabupaten Kolaka Utara, Sulawesi Tenggara 93913","Jl. Baru, Patowonua, Kec. Lasusua, Kabupaten Kolaka Utara",SULAWESI TENGGARA,93913.0,Indonesia,895417300072.0,,,-3.5057797,120.8900901,https://maps.google.com/?cid=0x0:0x73b0e3edb5fc0342,
hotel,hotel,Wisma Auliyah Kolaka Utara,"Jl. Amd, Lasusua, Kec. Lasusua, Kabupaten Kolaka Utara, Sulawesi Tenggara 93913","Lasusua, Kec. Lasusua, Kabupaten Kolaka Utara",SULAWESI TENGGARA,93913.0,Indonesia,895417300072.0,,,-3.5108029,120.8803299,https://maps.google.com/?cid=0x0:0x2fe8363bc99ab236,
hotel,hotel,Hotel Utama,"Jl. Poros Lasusua - Ranteangin, Tojabi, Kec. Lasusua, Kabupaten Kolaka Utara, Sulawesi Tenggara 93916","Tojabi, Kec. Lasusua, Kabupaten Kolaka Utara",SULAWESI TENGGARA,93916.0,Indonesia,85341155854.0,,,-3.5123766,120.9017213,https://maps.google.com/?cid=0x0:0xa3e623456d23d89e,
hotel,hotel,Hotel Qubah 9 Kendari,"Jl. Martandu No.99A, Kambu, Kec. Kambu, Kota Kendari, Sulawesi Tenggara 93231","Kambu, Kec. Kambu, Kota Kendari",SULAWESI TENGGARA,93231.0,Indonesia,4013136047.0,,,-4.0082509,122.5345007,https://maps.google.com/?cid=0x0:0x16da52124c17b9e7,
hotel,hotel,Kahianga Residence,"Jl. Damai No.12, Bende, Kec. Kadia, Kota Kendari, Sulawesi Tenggara 93117","Bende, Kec. Kadia, Kota Kendari",SULAWESI TENGGARA,93117.0,Indonesia,,,,-3.9847321,122.5162638,https://maps.google.com/?cid=0x0:0x2dc4b2acb26593f7,
hotel,hotel,Swiss-Belinn Bogor,"Jl. Pajajaran Indah V, RT.01/RW.14, Baranangsiang, Kec. Bogor Tim., Kota Bogor, Jawa Barat 16143","RT.01/RW.14, Baranangsiang, Kec. Bogor Tim., Kota Bogor",SULAWESI TENGGARA,16143.0,Indonesia,2518306666.0,,,-6.6104095,106.8144012,https://maps.google.com/?cid=0x0:0xf0140abb97c5413a,
hotel,hotel,,,,SULAWESI TENGGARA,,Indonesia,,,,,,https://maps.google.com/?cid=0x0:0xf0140abb97c5413a%7C/g/11jvms8wqv%7Cen-ID,
hotel,hotel,Agria Hotel Bogor,"Jl. Raya Tajur No.612, RT.02/RW.05, Muarasari, Kec. Bogor Sel., Kota Bogor, Jawa Barat 16145","RT.02/RW.05, Muarasari, Kec. Bogor Sel., Kota Bogor",SULAWESI TENGGARA,16145.0,Indonesia,2517550700.0,,,-6.6380172,106.8320141,https://maps.google.com/?cid=0x0:0xe00061240df57cda,
hotel,hotel,,,,SULAWESI TENGGARA,,Indonesia,,,,,,https://maps.google.com/?cid=0x0:0xe00061240df57cda%7C/g/11b8t71b8b%7Cen-ID,
hotel,hotel,Padjadjaran Suite Resort  Convention Hotel,"Lot XIX C-2, Jl. Bogor Nirwana Residence No.17, RT.01/RW.05, Mulyaharja, Kec. Bogor Sel., Kota Bogor, Jawa Barat 16132","Jl. Bogor Nirwana Residence No.17, RT.01/RW.05, Mulyaharja, Kec. Bogor Sel., Kota Bogor",SULAWESI TENGGARA,16132.0,Indonesia,2517569000.0,,,-6.6402218,106.7864821,https://maps.google.com/?cid=0x0:0x4909580788467e73,
hotel,hotel,,,,SULAWESI TENGGARA,,Indonesia,,,,,,https://maps.google.com/?cid=0x0:0x4909580788467e73%7C/g/12m98_lsf%7Cen-ID,
hotel,hotel,Luminor Hotel Padjadjaran Bogor,"Jl. Cidangiang No.9, RT.004/RW.05, Tegallega, Kecamatan Bogor Tengah, Kota Bogor, Jawa Barat 16127","RT.004/RW.05, Tegallega, Kecamatan Bogor Tengah, Kota Bogor",SULAWESI TENGGARA,16127.0,Indonesia,2518203888.0,,,-6.602423,106.8077919,https://maps.google.com/?cid=0x0:0x1a6c2f087d090539,
hotel,hotel,,,,SULAWESI TENGGARA,,Indonesia,,,,,,https://maps.google.com/?cid=0x0:0xf01576df7f835a0%7C/g/1v0bw1cf%7Cen-ID,
hotel,hotel,Hotel Novotel Bogor Golf Resort and Convention Center,"Jl. Golf Estate Bogor Raya, Sukaraja, Kec. Sukaraja, Kabupaten Bogor, Jawa Barat 16710","Sukaraja, Kec. Sukaraja, Kabupaten Bogor",SULAWESI TENGGARA,16710.0,Indonesia,2518271555.0,,,-6.6044585,106.8385092,https://maps.google.com/?cid=0x0:0xf01576df7f835a0,
hotel,hotel,Sans Hotel Tajur Bogor,"Tajur, Kec. Bogor Tim., Kota Bogor, Jawa Barat","Kota Bogor, Jawa Barat",SULAWESI TENGGARA,,Indonesia,895417300072.0,,,-6.6269706,106.8225279,https://maps.google.com/?cid=0x0:0x2d762525609177a3,
hotel,hotel,,,,SULAWESI TENGGARA,,Indonesia,,,,,,https://maps.google.com/?cid=0x0:0x2040b7818b568622%7C/g/11fhwt8tv6%7Cen-ID,
hotel,hotel,Grande Padjadjaran Hotel Bogor,"Jl. Raya Pajajaran No.17, RT.02/RW.03, Bantarjati, Kec. Bogor Utara, Kota Bogor, Jawa Barat 16153","RT.02/RW.03, Bantarjati, Kec. Bogor Utara, Kota Bogor",SULAWESI TENGGARA,16153.0,Indonesia,2518359000.0,,,-6.5764571,106.8073282,https://maps.google.com/?cid=0x0:0x2040b7818b568622,
hotel,hotel,R Hotel Rancamaya Golf  Resort,"Jl. Rancamaya Utama, Kertamaya, Kec. Ciawi, Kota Bogor, Jawa Barat 16720","Kertamaya, Kec. Ciawi, Kota Bogor",SULAWESI TENGGARA,16720.0,Indonesia,2518248899.0,,,-6.6586908,106.8234422,https://maps.google.com/?cid=0x0:0x6e7acb1a875cfb7d,
hotel,hotel,,,,SULAWESI TENGGARA,,Indonesia,,,,,,https://maps.google.com/?cid=0x0:0x6e7acb1a875cfb7d%7C/g/1tfvw82p%7Cen-ID,
hotel,Taman bermain,R Garden,"RT.03/RW.03, Kertamaya, Kec. Bogor Sel., Kota Bogor, Jawa Barat 16138","Kertamaya, Kec. Bogor Sel., Kota Bogor",SULAWESI TENGGARA,16138.0,Indonesia,2518248899.0,,,-6.6585198,106.824327,https://maps.google.com/?cid=0x0:0x9f2239f26473ca8,
hotel,hotel,,,,SULAWESI TENGGARA,,Indonesia,,,,,,https://maps.google.com/?cid=0x0:0xeee5d405305c622c%7C/g/11h1m9578m%7Cen-ID,
hotel,hotel,Bigland Bogor Hotel,"Jl. Malabar No.1B, Tegallega, Kecamatan Bogor Tengah, Kota Bogor, Jawa Barat 16127","Tegallega, Kecamatan Bogor Tengah, Kota Bogor",SULAWESI TENGGARA,16127.0,Indonesia,8119625627.0,,,-6.5988303,106.8074977,https://maps.google.com/?cid=0x0:0xeee5d405305c622c,
hotel,hotel,ibis Styles Bogor Raya,"Golf Estate, Sukaraja, Bogor Raya, Bogor Regency, West Java 16710","Sukaraja, Bogor Raya, Bogor Regency",SULAWESI TENGGARA,16710.0,Indonesia,2518271999.0,,,-6.6046104,106.8370329,https://maps.google.com/?cid=0x0:0x91399abe48b8722e,
hotel,hotel,Royal Hotel Bogor,"Jl. Ir. H. Juanda No.16, Paledang, Kecamatan Bogor Tengah, Kota Bogor, Jawa Barat 16122","Paledang, Kecamatan Bogor Tengah, Kota Bogor",SULAWESI TENGGARA,16122.0,Indonesia,2518347123.0,,,-6.6026258,106.7953261,https://maps.google.com/?cid=0x0:0x5a9ee1d6644d7172,
hotel,hotel,,,,SULAWESI TENGGARA,,Indonesia,,,,,,https://maps.google.com/?cid=0x0:0x91399abe48b8722e%7C/g/11bx1ymptw%7Cen-ID,
hotel,hotel,,,,SULAWESI TENGGARA,,Indonesia,,,,,,https://maps.google.com/?cid=0x0:0x5a9ee1d6644d7172%7C/g/11g1ksrhls%7Cen-ID,
hotel,hotel,THE 1O1 Bogor Suryakancana,"Jl. Suryakencana No. 179 - 181, RT.01/RW.2, Babakan Ps., Kecamatan Bogor Tengah, Kota Bogor, Jawa Barat 16123","RT.01/RW.2, Babakan Ps., Kecamatan Bogor Tengah, Kota Bogor",SULAWESI TENGGARA,16123.0,Indonesia,2517565101.0,,,-6.6078068,106.8023158,https://maps.google.com/?cid=0x0:0xe022fe1c5bcef5c0,
hotel,hotel,,,,SULAWESI TENGGARA,,Indonesia,,,,,,https://maps.google.com/?cid=0x0:0xe022fe1c5bcef5c0%7C/g/11bcclx5dt%7Cen-ID,
hotel,hotel,Sulawesi Tenggara 93914,"Kabupaten Kolaka Utara, Sulawesi Tenggara","Kabupaten Kolaka Utara, Sulawesi Tenggara",SULAWESI TENGGARA,,Indonesia,,,,-3.4852698,120.8843434,https://maps.google.com/?cid=0x0:0x7054223535d63716,
hotel,hotel,Wisma Auliyah Kolaka Utara,"Jl. Amd, Lasusua, Kec. Lasusua, Kabupaten Kolaka Utara, Sulawesi Tenggara 93913","Lasusua, Kec. Lasusua, Kabupaten Kolaka Utara",SULAWESI TENGGARA,93913.0,Indonesia,895417300072.0,,,-3.5108029,120.8803299,https://maps.google.com/?cid=0x0:0x2fe8363bc99ab236,
hotel,hotel,Hotel Utama,"Jl. Poros Lasusua - Ranteangin, Tojabi, Kec. Lasusua, Kabupaten Kolaka Utara, Sulawesi Tenggara 93916","Tojabi, Kec. Lasusua, Kabupaten Kolaka Utara",SULAWESI TENGGARA,93916.0,Indonesia,85341155854.0,,,-3.5123766,120.9017213,https://maps.google.com/?cid=0x0:0xa3e623456d23d89e,
hotel,hotel,Hotel Puri Yasmin Potowanua Lasusua Mitra RedDoorz,"FVVQ+9C5, Jl. Baru, Patowonua, Kec. Lasusua, Kabupaten Kolaka Utara, Sulawesi Tenggara 93913","Jl. Baru, Patowonua, Kec. Lasusua, Kabupaten Kolaka Utara",SULAWESI TENGGARA,93913.0,Indonesia,895417300072.0,,,-3.5057797,120.8900901,https://maps.google.com/?cid=0x0:0x73b0e3edb5fc0342,
hotel,hotel,Swiss-Belinn Bogor,"Jl. Pajajaran Indah V, RT.01/RW.14, Baranangsiang, Kec. Bogor Tim., Kota Bogor, Jawa Barat 16143","RT.01/RW.14, Baranangsiang, Kec. Bogor Tim., Kota Bogor",SULAWESI TENGGARA,16143.0,Indonesia,2518306666.0,,,-6.6104095,106.8144012,https://maps.google.com/?cid=0x0:0xf0140abb97c5413a,
hotel,hotel,,,,SULAWESI TENGGARA,,Indonesia,,,,,,https://maps.google.com/?cid=0x0:0xf0140abb97c5413a%7C/g/11jvms8wqv%7Cen-ID,
hotel,hotel,,,,SULAWESI TENGGARA,,Indonesia,,,,,,https://maps.google.com/?cid=0x0:0xe00061240df57cda%7C/g/11b8t71b8b%7Cen-ID,
hotel,hotel,Agria Hotel Bogor,"Jl. Raya Tajur No.612, RT.02/RW.05, Muarasari, Kec. Bogor Sel., Kota Bogor, Jawa Barat 16145","RT.02/RW.05, Muarasari, Kec. Bogor Sel., Kota Bogor",SULAWESI TENGGARA,16145.0,Indonesia,2517550700.0,,,-6.6380172,106.8320141,https://maps.google.com/?cid=0x0:0xe00061240df57cda,
hotel,hotel,Padjadjaran Suite Resort  Convention Hotel,"Lot XIX C-2, Jl. Bogor Nirwana Residence No.17, RT.01/RW.05, Mulyaharja, Kec. Bogor Sel., Kota Bogor, Jawa Barat 16132","Jl. Bogor Nirwana Residence No.17, RT.01/RW.05, Mulyaharja, Kec. Bogor Sel., Kota Bogor",SULAWESI TENGGARA,16132.0,Indonesia,2517569000.0,,,-6.6402218,106.7864821,https://maps.google.com/?cid=0x0:0x4909580788467e73,
hotel,hotel,,,,SULAWESI TENGGARA,,Indonesia,,,,,,https://maps.google.com/?cid=0x0:0x4909580788467e73%7C/g/12m98_lsf%7Cen-ID,
hotel,hotel,Luminor Hotel Padjadjaran Bogor,"Jl. Cidangiang No.9, RT.004/RW.05, Tegallega, Kecamatan Bogor Tengah, Kota Bogor, Jawa Barat 16127","RT.004/RW.05, Tegallega, Kecamatan Bogor Tengah, Kota Bogor",SULAWESI TENGGARA,16127.0,Indonesia,2518203888.0,,,-6.602423,106.8077919,https://maps.google.com/?cid=0x0:0x1a6c2f087d090539,
