Category,Real Category,Business Name,Address,City,State,Postal Code,Country,Phone,Email,Website,Latitude,Longitude,Map Link,Details Link
supermarket,Pusat Perbelanjaan,Nurhikma Jaya,"Isimu Raya, Kec. Tibawa, Kabupaten Gorontalo, Gorontalo 96216","Kec. Tibawa, Kabupaten Gorontalo",GORONTALO,96216,Indonesia,85298247936.0,,,0.6478259,1.228.715.591,https://maps.google.com/?cid=0x0:0x93d6fc351d3152f1,
supermarket,supermarket,Kec. Limboto Bar.,"Kabupaten Gorontalo, Gorontalo","Kabupaten Gorontalo, Gorontalo",GORONTALO,,Indonesia,,,,0.6381602,1.229.265.738,https://maps.google.com/?cid=0x0:0x55b412f38ef11e3b,
supermarket,Toko umum,Toko Indah Sejati,"JWFV+MV8, Tunggulo, Kec. Limboto Bar., Kabupaten Gorontalo, Gorontalo 96271","Tunggulo, Kec. Limboto Bar., Kabupaten Gorontalo",GORONTALO,96271,Indonesia,,,,0.6241548,122.944.718,https://maps.google.com/?cid=0x0:0x61d429f27596e236,
supermarket,Minimarket,The linou mart,"Jl. Samaun Pulubuhu No.233, Hunggaluwa, Kec. Limboto, Kabupaten Gorontalo, Gorontalo 96214","Hunggaluwa, Kec. Limboto, Kabupaten Gorontalo",GORONTALO,96214,Indonesia,81917145678.0,,,0.627395,1.229.749.111,https://maps.google.com/?cid=0x0:0xb5483c699d43a03d,
supermarket,Toko bahan makanan,TOKO  Counter Di Justice,"Jl. Samaun Pulubuhu No.252, Pone, Kec. Limboto Bar., Kabupaten Gorontalo, Gorontalo 96271","Pone, Kec. Limboto Bar., Kabupaten Gorontalo",GORONTALO,96271,Indonesia,85399026010.0,,,0.6301661,1.229.526.479,https://maps.google.com/?cid=0x0:0x3bcd57f83b95e1e,
supermarket,Toko Kelontong Asia,TOKO BERKAH RIZKY,"Toko berkah, Pone, Kec. Limboto Bar., Kabupaten Gorontalo, Gorontalo 96271","Pone, Kec. Limboto Bar., Kabupaten Gorontalo",GORONTALO,96271,Indonesia,,,,0.6294854,1.229.579.617,https://maps.google.com/?cid=0x0:0x81ff925237b75696,
supermarket,Toko Swalayan,toko shinta ayuba,"JXP2+G25, Huidu, Kec. Limboto Bar., Kabupaten Gorontalo, Gorontalo 96219","Huidu, Kec. Limboto Bar., Kabupaten Gorontalo",GORONTALO,96219,Indonesia,85256247727.0,,,0.6362692,1.229.501.207,https://maps.google.com/?cid=0x0:0xdaa135b0122ad6b9,
supermarket,supermarket,Gorontalo 96216,"Kec. Tibawa, Kabupaten Gorontalo, Gorontalo","Kabupaten Gorontalo, Gorontalo",GORONTALO,,Indonesia,,,,0.6566947,1.228.648.538,https://maps.google.com/?cid=0x0:0x522c616744b13bc7,
supermarket,Toko,TOKO KUDUS,"JVVP+7GP, Jl. Trans-Sulawesi, Haya-Haya, Kec. Limboto Bar., Kabupaten Gorontalo, Gorontalo 96216","Jl. Trans-Sulawesi, Haya-Haya, Kec. Limboto Bar., Kabupaten Gorontalo",GORONTALO,96216,Indonesia,,,,0.6432214,1.228.863.399,https://maps.google.com/?cid=0x0:0x55e265af7fc58870,
supermarket,Pusat Perbelanjaan,Agung Supermarket,"JXGG+FF3, Jl. Ahmad A. Wahab, Hunggaluwa, Kec. Limboto, Kabupaten Gorontalo, Gorontalo 96181","Jl. Ahmad A. Wahab, Hunggaluwa, Kec. Limboto, Kabupaten Gorontalo",GORONTALO,96181,Indonesia,,,,0.6261414,1.229.761.873,https://maps.google.com/?cid=0x0:0x6ec6155e2dcb6ce3,
supermarket,Toko Swalayan,Al Husna Gorontalo,"JW4P+PCG, Hutabohu, Kec. Limboto Bar., Kabupaten Gorontalo, Gorontalo 96216","Hutabohu, Kec. Limboto Bar., Kabupaten Gorontalo",GORONTALO,96216,Indonesia,81242533364.0,,,0.606819,1.229.360.904,https://maps.google.com/?cid=0x0:0xe77fad6dfea93027,
supermarket,Pusat Perbelanjaan,Nurhikma Jaya,"Isimu Raya, Kec. Tibawa, Kabupaten Gorontalo, Gorontalo 96216","Kec. Tibawa, Kabupaten Gorontalo",GORONTALO,96216,Indonesia,85298247936.0,,,0.6478259,1.228.715.591,https://maps.google.com/?cid=0x0:0x93d6fc351d3152f1,
supermarket,Minimarket,Toko Allfatur,"Jl. Trans-Sulawesi KM.35, Tolotio, Kec. Pulubala, Kabupaten Gorontalo, Gorontalo 96251","Tolotio, Kec. Pulubala, Kabupaten Gorontalo",GORONTALO,96251,Indonesia,85298259342.0,,,0.642594,1.228.259.009,https://maps.google.com/?cid=0x0:0xf4ec1f91ec482c4f,
supermarket,Toko umum,Toko Deal,"JXJH+926, Kayumerah, Kec. Limboto, Kabupaten Gorontalo, Gorontalo 96214","Kayumerah, Kec. Limboto, Kabupaten Gorontalo",GORONTALO,96214,Indonesia,,,,0.6309021,1.229.775.306,https://maps.google.com/?cid=0x0:0x1623c20bce5c9ba6,
supermarket,Hipermarket,Hymart Supermarket,"Jl. Sultan Botutihe No.220, Moodu, Kec. Kota Tim., Kota Gorontalo, Gorontalo 96113","Moodu, Kec. Kota Tim., Kota Gorontalo",GORONTALO,96113,Indonesia,435830400.0,,,0.54034,123.074.965,https://maps.google.com/?cid=0x0:0x73ba3dabd9175daa,
supermarket,Minimarket,Alfamart,"Jl. Trans-Sulawesi, Yosonegoro, Kec. Limboto, Kabupaten Gorontalo, Gorontalo 96216","Yosonegoro, Kec. Limboto, Kabupaten Gorontalo",GORONTALO,96216,Indonesia,1500959.0,,,0.6380987,1.229.267.971,https://maps.google.com/?cid=0x0:0x2ab0e544e86f45e0,
supermarket,Toko bahan makanan,Toko Niaga Jaya,"MV22+798, Jl. Trans-Sulawesi, Tolotio, Kec. Tibawa, Kabupaten Gorontalo, Gorontalo 96251","Jl. Trans-Sulawesi, Tolotio, Kec. Tibawa, Kabupaten Gorontalo",GORONTALO,96251,Indonesia,81243216660.0,,,0.6506677,1.228.509.462,https://maps.google.com/?cid=0x0:0xf88ffb33331bbcea,
supermarket,Toko bahan makanan,Alfamart Isimu Gorontalo,"Jl. Trans-Sulawesi No.Desa, Isimu Raya, Kec. Tibawa, Kab. Gorontalo, Gorontalo 96267","Isimu Raya, Kec. Tibawa, Kab. Gorontalo",GORONTALO,96267,Indonesia,1500959.0,,,0.6488738,1.228.595.271,https://maps.google.com/?cid=0x0:0x29bdc444e2360a84,
supermarket,Toko Swalayan,Toko Hamid,"JVR7+97Q, Jl. Isimu - Gorontalo, Dunggala, Kec. Tibawa, Kabupaten Gorontalo, Gorontalo 96216","Jl. Isimu - Gorontalo, Dunggala, Kec. Tibawa, Kabupaten Gorontalo",GORONTALO,96216,Indonesia,85256410237.0,,,0.6409719,1.228.632.332,https://maps.google.com/?cid=0x0:0x2263763d53190ba7,
supermarket,Tempat Istirahat,Rest Area,"MV53+P77, Jl. Trans-Sulawesi, Botumoputi, Kec. Tibawa, Kabupaten Gorontalo, Gorontalo 96216","Jl. Trans-Sulawesi, Botumoputi, Kec. Tibawa, Kabupaten Gorontalo",GORONTALO,96216,Indonesia,82191921571.0,,,0.6592781,1.228.531.732,https://maps.google.com/?cid=0x0:0xd3b1297d5d6866d9,
supermarket,Minimarket,Alfamart Datahu Gorontalo,"MV44+4F8, Jl. Suaib Hemu, Datahu, Kec. Tibawa, Kabupaten Gorontalo, Gorontalo 96216","Jl. Suaib Hemu, Datahu, Kec. Tibawa, Kabupaten Gorontalo",GORONTALO,96216,Indonesia,81315480027.0,,,0.6552921,1.228.562.058,https://maps.google.com/?cid=0x0:0x886b84b1a8aa4913,
supermarket,Toko bahan makanan,TK. YANIKO,"JWXC+2W2, Ombulo, Kec. Limboto Bar., Kabupaten Gorontalo, Gorontalo 96218","Ombulo, Kec. Limboto Bar., Kabupaten Gorontalo",GORONTALO,96218,Indonesia,,,,0.6475207,1.229.222.611,https://maps.google.com/?cid=0x0:0x2ee8fecd05a3b920,
supermarket,Minimarket,Indomaret,"Jl. Trans-Sulawesi, Isimu Raya, Kec. Tibawa, Kabupaten Gorontalo, Gorontalo 96216","Isimu Raya, Kec. Tibawa, Kabupaten Gorontalo",GORONTALO,96216,Indonesia,,,,0.6489599,1.228.593.527,https://maps.google.com/?cid=0x0:0x582387fd0d324f2e,
supermarket,Pusat Perbelanjaan,Toko sagita,"MV63+XG2 Toko sagita, Isimu Raya, Kec. Tibawa, Kabupaten Gorontalo, Gorontalo 96216","Isimu Raya, Kec. Tibawa, Kabupaten Gorontalo",GORONTALO,96216,Indonesia,,,,0.662381,122.853.752,https://maps.google.com/?cid=0x0:0x623a7b99c8606976,
supermarket,Minimarket,Nur Mart,"JXFG+3JP, Hunggaluwa, Kec. Limboto, Kabupaten Gorontalo, Gorontalo 96181","Hunggaluwa, Kec. Limboto, Kabupaten Gorontalo",GORONTALO,96181,Indonesia,,,,0.6226454,122.976.595,https://maps.google.com/?cid=0x0:0xd35b4369bfdac885,
supermarket,Toko bahan makanan,Toko gunung sari (barang harian),"Jl. Trans-Sulawesi No.111, Isimu Raya, Kec. Tibawa, Kabupaten Gorontalo, Gorontalo 96251","Isimu Raya, Kec. Tibawa, Kabupaten Gorontalo",GORONTALO,96251,Indonesia,,,,0.6470864,1.228.724.362,https://maps.google.com/?cid=0x0:0xca440adec50c65ff,
supermarket,Toko bahan makanan,Minimarket Rezha,"JVX5+5F5, Jl. Isimu - Gorontalo, Tolotio, Kec. Tibawa, Kabupaten Gorontalo, Gorontalo 96216","Jl. Isimu - Gorontalo, Tolotio, Kec. Tibawa, Kabupaten Gorontalo",GORONTALO,96216,Indonesia,,,,0.6478975,1.228.587.426,https://maps.google.com/?cid=0x0:0x77a36dc7ac60ed57,
supermarket,Pusat Perbelanjaan,Muraa Supermarket Gorontalo,"Bulila, Kec. Telaga, Kabupaten Gorontalo, Gorontalo 96138","Kec. Telaga, Kabupaten Gorontalo",GORONTALO,96138,Indonesia,,,,0.5786076,1.230.445.856,https://maps.google.com/?cid=0x0:0x694a290777d48599,
supermarket,Minimarket,Kios ABID,"JRJP+R49, Reksonegoro, Kec. Tibawa, Kabupaten Gorontalo, Gorontalo 96251","Reksonegoro, Kec. Tibawa, Kabupaten Gorontalo",GORONTALO,96251,Indonesia,,,,0.6320405,1.228.353.453,https://maps.google.com/?cid=0x0:0x43b4ac9f1007ac6e,
supermarket,Toko umum,KIOS FIRMAN,"MW2C+FVP, Ombulo, Kec. Limboto Bar., Kabupaten Gorontalo, Gorontalo 96218","Ombulo, Kec. Limboto Bar., Kabupaten Gorontalo",GORONTALO,96218,Indonesia,,,,0.6512165,1.229.222.057,https://maps.google.com/?cid=0x0:0x2b6f3d100ed8b30b,
supermarket,Toko Swalayan,Toko Fitrah pasar limboto,"Pasar sentral, Kayubulan, Kec. Limboto, Kabupaten Gorontalo, Gorontalo","Kabupaten Gorontalo, Gorontalo",GORONTALO,,Indonesia,81355848227.0,,,0.6214404,1.229.815.981,https://maps.google.com/?cid=0x0:0x795232fadb6be013,
supermarket,Toko,Toko Tia Twins,"Jl. Trans-Sulawesi, Isimu Raya, Kec. Tibawa, Kabupaten Gorontalo, Gorontalo 96251","Isimu Raya, Kec. Tibawa, Kabupaten Gorontalo",GORONTALO,96251,Indonesia,,,,0.6477284,1.228.647.231,https://maps.google.com/?cid=0x0:0x3718454d211dd655,
supermarket,Minimarket,Indomaret,"Jl. Djalaluddin Tantu No.196, Dunggala, Kec. Tibawa, Kabupaten Gorontalo, Gorontalo 96251","Dunggala, Kec. Tibawa, Kabupaten Gorontalo",GORONTALO,96251,Indonesia,,,,0.6426985,1.228.620.319,https://maps.google.com/?cid=0x0:0xd85c37ac666e3bd8,
supermarket,Toko Swalayan,Naufa Zahra Tsabita Manono,"JVWP+5JH, Haya-Haya, Kec. Limboto Bar., Kabupaten Gorontalo, Gorontalo 96216","Haya-Haya, Kec. Limboto Bar., Kabupaten Gorontalo",GORONTALO,96216,Indonesia,,,,0.6454929,1.228.866.407,https://maps.google.com/?cid=0x0:0x3701378f807ba2db,
supermarket,supermarket,Gorontalo 96217,"Kec. Limboto Bar., Kabupaten Gorontalo, Gorontalo","Kabupaten Gorontalo, Gorontalo",GORONTALO,,Indonesia,,,,0.6424891,1.228.958.627,https://maps.google.com/?cid=0x0:0xf4dbe00d2a414468,
supermarket,Pusat Perbelanjaan,Agung Supermarket,"JXGG+FF3, Jl. Ahmad A. Wahab, Hunggaluwa, Kec. Limboto, Kabupaten Gorontalo, Gorontalo 96181","Jl. Ahmad A. Wahab, Hunggaluwa, Kec. Limboto, Kabupaten Gorontalo",GORONTALO,96181,Indonesia,,,,0.6261414,1.229.761.873,https://maps.google.com/?cid=0x0:0x6ec6155e2dcb6ce3,
supermarket,Toko,TOKO KUDUS,"JVVP+7GP, Jl. Trans-Sulawesi, Haya-Haya, Kec. Limboto Bar., Kabupaten Gorontalo, Gorontalo 96216","Jl. Trans-Sulawesi, Haya-Haya, Kec. Limboto Bar., Kabupaten Gorontalo",GORONTALO,96216,Indonesia,,,,0.6432214,1.228.863.399,https://maps.google.com/?cid=0x0:0x55e265af7fc58870,
supermarket,Hipermarket,Hymart Supermarket,"Jl. Sultan Botutihe No.220, Moodu, Kec. Kota Tim., Kota Gorontalo, Gorontalo 96113","Moodu, Kec. Kota Tim., Kota Gorontalo",GORONTALO,96113,Indonesia,435830400.0,,,0.54034,123.074.965,https://maps.google.com/?cid=0x0:0x73ba3dabd9175daa,
supermarket,Toko Swalayan,Al Husna Gorontalo,"JW4P+PCG, Hutabohu, Kec. Limboto Bar., Kabupaten Gorontalo, Gorontalo 96216","Hutabohu, Kec. Limboto Bar., Kabupaten Gorontalo",GORONTALO,96216,Indonesia,81242533364.0,,,0.606819,1.229.360.904,https://maps.google.com/?cid=0x0:0xe77fad6dfea93027,
supermarket,Minimarket,Alfamart,"Jl. Trans-Sulawesi, Yosonegoro, Kec. Limboto, Kabupaten Gorontalo, Gorontalo 96216","Yosonegoro, Kec. Limboto, Kabupaten Gorontalo",GORONTALO,96216,Indonesia,1500959.0,,,0.6380987,1.229.267.971,https://maps.google.com/?cid=0x0:0x2ab0e544e86f45e0,
supermarket,Minimarket,Nur Mart,"JXFG+3JP, Hunggaluwa, Kec. Limboto, Kabupaten Gorontalo, Gorontalo 96181","Hunggaluwa, Kec. Limboto, Kabupaten Gorontalo",GORONTALO,96181,Indonesia,,,,0.6226454,122.976.595,https://maps.google.com/?cid=0x0:0xd35b4369bfdac885,
supermarket,Pusat Perbelanjaan,Q-Mart Super Store,"Jl. Kalimantan No.94, Dulalowo Tim., Kec. Kota Tengah, Kota Gorontalo, Gorontalo 96138","Dulalowo Tim., Kec. Kota Tengah, Kota Gorontalo",GORONTALO,96138,Indonesia,435834318.0,,,0.5663315,1.230.421.559,https://maps.google.com/?cid=0x0:0xa31fb94e230fb4cf,
supermarket,Toko Swalayan,Toko Fitrah pasar limboto,"Pasar sentral, Kayubulan, Kec. Limboto, Kabupaten Gorontalo, Gorontalo","Kabupaten Gorontalo, Gorontalo",GORONTALO,,Indonesia,81355848227.0,,,0.6214404,1.229.815.981,https://maps.google.com/?cid=0x0:0x795232fadb6be013,
supermarket,Minimarket,Alfamart,"Jl. Sudirman, Hunggaluwa, Kec. Limboto, Kabupaten Gorontalo, Gorontalo 96129","Hunggaluwa, Kec. Limboto, Kabupaten Gorontalo",GORONTALO,96129,Indonesia,1500959.0,,,0.6243866,1.229.762.506,https://maps.google.com/?cid=0x0:0x13099fd4f2d4140b,
supermarket,Minimarket,Alfamart,"Jl. Kasmat Lahay, Hunggaluwa, Kec. Limboto, Kabupaten Gorontalo, Gorontalo 96129","Hunggaluwa, Kec. Limboto, Kabupaten Gorontalo",GORONTALO,96129,Indonesia,1500959.0,,,0.6199605,1.229.737.001,https://maps.google.com/?cid=0x0:0xf61bab6297a9c057,
supermarket,Toko bahan makanan,Indomaaret,"JXMR+RQM, Unnamed Road, Dutulanaa, Kec. Limboto, Kabupaten Gorontalo, Gorontalo 96214","Unnamed Road, Dutulanaa, Kec. Limboto, Kabupaten Gorontalo",GORONTALO,96214,Indonesia,,,,0.6345805,122.991.931,https://maps.google.com/?cid=0x0:0x4c06c92f5bc93737,
supermarket,Toko Swalayan,Naufa Zahra Tsabita Manono,"JVWP+5JH, Haya-Haya, Kec. Limboto Bar., Kabupaten Gorontalo, Gorontalo 96216","Haya-Haya, Kec. Limboto Bar., Kabupaten Gorontalo",GORONTALO,96216,Indonesia,,,,0.6454929,1.228.866.407,https://maps.google.com/?cid=0x0:0x3701378f807ba2db,
supermarket,Minimarket,Alfamart Hutuo Limboto,"Jl. Aa Wahab Limboto, Paguyaman, Kota Tengah, Kabupaten Gorontalo, Gorontalo 96129","Paguyaman, Kota Tengah, Kabupaten Gorontalo",GORONTALO,96129,Indonesia,1500959.0,,,0.625538,1.230.023.637,https://maps.google.com/?cid=0x0:0xcf61e3a0addf24f1,
supermarket,Toko umum,ALBA MART,"G3X2+5JC, Limba U Dua, Kota Sel., Kota Gorontalo, Gorontalo 96136","Limba U Dua, Kota Sel., Kota Gorontalo",GORONTALO,96136,Indonesia,,,,0.5479399,1.230.515.034,https://maps.google.com/?cid=0x0:0xca1cc3390f143fd1,
supermarket,Toko bahan makanan,Warong ta neli,"Jalan kadir otaya No.2, Hutabohu, Kec. Limboto Bar., Kabupaten Gorontalo, Gorontalo","Kabupaten Gorontalo, Gorontalo",GORONTALO,,Indonesia,,,,0.6261341,1.229.031.957,https://maps.google.com/?cid=0x0:0x3f8b290561d7a17,
supermarket,Toko bahan makanan,Mocca Delli Super Market BAHAN KUE  DAPUR,"Moodu, Kec. Kota Tim., Kota Gorontalo, Gorontalo 96135","Kec. Kota Tim., Kota Gorontalo",GORONTALO,96135,Indonesia,89560112299.0,,,0.5403059,1.230.750.174,https://maps.google.com/?cid=0x0:0x16e2ba97955d038a,
supermarket,Toko Swalayan,KIOS MEMORI,"Jl. Sudirman, Hunggaluwa, Kec. Limboto, Kabupaten Gorontalo, Gorontalo 96214","Hunggaluwa, Kec. Limboto, Kabupaten Gorontalo",GORONTALO,96214,Indonesia,82187172176.0,,,0.6236102,1.229.763.356,https://maps.google.com/?cid=0x0:0x4ddcb9ff36957da5,
supermarket,Minimarket,Alfamart Limboto Gorontalo,"Jl. Aa Jl. Ahmad A. Wahab No.Kel, Hutuo, Kec. Limboto, Kabupaten Gorontalo, Gorontalo 96213","Hutuo, Kec. Limboto, Kabupaten Gorontalo",GORONTALO,96213,Indonesia,1500959.0,,,0.6261051,1.230.001.059,https://maps.google.com/?cid=0x0:0x9e734e47ec47ebe,
supermarket,Pusat Perbelanjaan,Pasar Sore Limboto ( Shoping Center Lama),"JXCJ+J8X, Kayubulan, Kec. Limboto, Kabupaten Gorontalo, Gorontalo","Kabupaten Gorontalo, Gorontalo",GORONTALO,,Indonesia,,,,0.6215368,1.229.807.997,https://maps.google.com/?cid=0x0:0x38880e011f994282,
supermarket,Pusat Perbelanjaan,Muraa Supermarket Gorontalo,"Bulila, Kec. Telaga, Kabupaten Gorontalo, Gorontalo 96138","Kec. Telaga, Kabupaten Gorontalo",GORONTALO,96138,Indonesia,,,,0.5786076,1.230.445.856,https://maps.google.com/?cid=0x0:0x694a290777d48599,
supermarket,Toko,Muraa Supermarket Gorontalo 2,"Jl. Kalimantan No.94, Dulalowo Tim., Kec. Kota Tengah, Kota Gorontalo, Gorontalo 96138","Dulalowo Tim., Kec. Kota Tengah, Kota Gorontalo",GORONTALO,96138,Indonesia,,,,0.5600187,1.230.567.167,https://maps.google.com/?cid=0x0:0x3f600202ab0d158e,
supermarket,Pusat Perbelanjaan,DK MART Limboto,"JXGJ+9HR, Kayubulan, Kec. Limboto, Kabupaten Gorontalo, Gorontalo 96214","Kayubulan, Kec. Limboto, Kabupaten Gorontalo",GORONTALO,96214,Indonesia,,,,0.6259903,1.229.813.999,https://maps.google.com/?cid=0x0:0xab9912f95e2aac44,
supermarket,Toko Swalayan,Toko SRC ANGGUN Limboto,"JX9C+X36, Jl. A. Otoluwa, Bolihuangga, Kec. Limboto, Kabupaten Gorontalo, Gorontalo 96271","Jl. A. Otoluwa, Bolihuangga, Kec. Limboto, Kabupaten Gorontalo",GORONTALO,96271,Indonesia,,,,0.6199016,1.229.701.423,https://maps.google.com/?cid=0x0:0xc261da80d35509e4,
supermarket,Toko,Toko Putra utama( PUTAMA),"JXFJ+G83, Kayubulan, Kec. Limboto, Kabupaten Gorontalo, Gorontalo 96181","Kayubulan, Kec. Limboto, Kabupaten Gorontalo",GORONTALO,96181,Indonesia,81916669222.0,,,0.623844,1.229.810.737,https://maps.google.com/?cid=0x0:0x22c63b438c5a3b5d,
supermarket,Minimarket,Alfamart Swalayan,"JWJJ+PCV, Yosonegoro, Kec. Limboto Bar., Kabupaten Gorontalo, Gorontalo 96218","Yosonegoro, Kec. Limboto Bar., Kabupaten Gorontalo",GORONTALO,96218,Indonesia,,,,0.6318617,1.229.310.502,https://maps.google.com/?cid=0x0:0x50968fd2169c746a,
supermarket,Toko Kelontong Asia,Warung Sembako,"Tunggulo, Kec. Limboto Bar., Kabupaten Gorontalo, Gorontalo 96217","Kec. Limboto Bar., Kabupaten Gorontalo",GORONTALO,96217,Indonesia,85256444757.0,,,0.6279265,1.229.372.288,https://maps.google.com/?cid=0x0:0x5b9b0137c5c6fac,
supermarket,Toko,Kios RAHMAT,"JVQG+JH6, Balahu, Kec. Tibawa, Kabupaten Gorontalo, Gorontalo 96216","Balahu, Kec. Tibawa, Kabupaten Gorontalo",GORONTALO,96216,Indonesia,82187732684.0,,,0.6390334,1.228.763.939,https://maps.google.com/?cid=0x0:0x8b025c08b0b4c3da,
supermarket,supermarket,kios haja,"JVQG+FQX, Balahu, Kec. Tibawa, Kabupaten Gorontalo, Gorontalo","Kabupaten Gorontalo, Gorontalo",GORONTALO,,Indonesia,81342779133.0,,,0.6387483,1.228.769.812,https://maps.google.com/?cid=0x0:0x17322b0f6027eab7,
supermarket,supermarket,Gorontalo 96127,"Kabupaten Gorontalo, Gorontalo","Kabupaten Gorontalo, Gorontalo",GORONTALO,,Indonesia,,,,0.7140327,122.695.547,https://maps.google.com/?cid=0x0:0xf61bd4360c0dcb1a,
supermarket,Pusat Perbelanjaan,Muraa Supermarket Gorontalo,"Bulila, Kec. Telaga, Kabupaten Gorontalo, Gorontalo 96138","Kec. Telaga, Kabupaten Gorontalo",GORONTALO,96138,Indonesia,,,,0.5786076,1.230.445.856,https://maps.google.com/?cid=0x0:0x694a290777d48599,
supermarket,Toko,Muraa Supermarket Gorontalo 2,"Jl. Kalimantan No.94, Dulalowo Tim., Kec. Kota Tengah, Kota Gorontalo, Gorontalo 96138","Dulalowo Tim., Kec. Kota Tengah, Kota Gorontalo",GORONTALO,96138,Indonesia,,,,0.5600187,1.230.567.167,https://maps.google.com/?cid=0x0:0x3f600202ab0d158e,
supermarket,Pusat Perbelanjaan,Q-Mart Super Store,"Jl. Kalimantan No.94, Dulalowo Tim., Kec. Kota Tengah, Kota Gorontalo, Gorontalo 96138","Dulalowo Tim., Kec. Kota Tengah, Kota Gorontalo",GORONTALO,96138,Indonesia,435834318.0,,,0.5663315,1.230.421.559,https://maps.google.com/?cid=0x0:0xa31fb94e230fb4cf,
supermarket,Pusat Perbelanjaan,Agung Supermarket Kota Gorontalo,"G3W6+2V6, Jl. D.I. Panjaitan No.110, Limba U I, Kota Sel., Kota Gorontalo, Gorontalo 96135","Jl. D.I. Panjaitan No.110, Limba U I, Kota Sel., Kota Gorontalo",GORONTALO,96135,Indonesia,,,,0.544968,1.230.622.361,https://maps.google.com/?cid=0x0:0x9e7641346e022af1,
supermarket,Toko Perhiasan,Karsa Utama,"Jl. S. Parman No.45, Biawao, Kota Sel., Kota Gorontalo, Gorontalo 96133","Biawao, Kota Sel., Kota Gorontalo",GORONTALO,96133,Indonesia,,,,0.5364809,1.230.589.067,https://maps.google.com/?cid=0x0:0x1a7597bff92c0a71,
supermarket,Toko bahan makanan,Ririn Mart,"Jl. Buol - Gorontalo, Ilangata, Kec. Anggrek, Kabupaten Gorontalo Utara, Gorontalo 96525","Ilangata, Kec. Anggrek, Kabupaten Gorontalo Utara",GORONTALO,96525,Indonesia,812420068.0,,,0.8483166,1.227.725.207,https://maps.google.com/?cid=0x0:0x377c5861010a126d,
supermarket,Toko Swalayan,Lee Mart,"JRRV+GVJ, Padebuolo, Kec. Kota Tim., Kabupaten Gorontalo, Gorontalo 96135","Padebuolo, Kec. Kota Tim., Kabupaten Gorontalo",GORONTALO,96135,Indonesia,81340587151.0,,,0.6413346,1.228.446.495,https://maps.google.com/?cid=0x0:0x3e21ad5382d142bf,
supermarket,Toko umum,Kios Golden,"MJXR+P4F, Paris, Kec. Mootilango, Kabupaten Gorontalo, Gorontalo 96111","Paris, Kec. Mootilango, Kabupaten Gorontalo",GORONTALO,96111,Indonesia,81388881438.0,,,0.6993125,1.226.403.125,https://maps.google.com/?cid=0x0:0xa82944876f12427,
supermarket,Toko Beras,King Mart,"PH24+JM3, Sukamakmur, Kec. Tolangohula, Kabupaten Gorontalo, Gorontalo 96214","Sukamakmur, Kec. Tolangohula, Kabupaten Gorontalo",GORONTALO,96214,Indonesia,,,,0.7015049,1.225.566.773,https://maps.google.com/?cid=0x0:0xebdaf23edc847452,
supermarket,Pusat Perbelanjaan,RA.JAYA,"MJXR+RWR, Paris, Kec. Mootilango, Kabupaten Gorontalo, Gorontalo 96127","Paris, Kec. Mootilango, Kabupaten Gorontalo",GORONTALO,96127,Indonesia,,,,0.6995394,1.226.422.154,https://maps.google.com/?cid=0x0:0xa096e55263c437f4,
supermarket,Minimarket,Toko Allfatur,"Jl. Trans-Sulawesi KM.35, Tolotio, Kec. Pulubala, Kabupaten Gorontalo, Gorontalo 96251","Tolotio, Kec. Pulubala, Kabupaten Gorontalo",GORONTALO,96251,Indonesia,85298259342.0,,,0.642594,1.228.259.009,https://maps.google.com/?cid=0x0:0xf4ec1f91ec482c4f,
supermarket,Minimarket,Alfamart Tolongio,"RR3G+8R5, Jl. Buol - Gorontalo, Tolongio, Kec. Anggrek, Kabupaten Gorontalo Utara, Gorontalo 96252","Jl. Buol - Gorontalo, Tolongio, Kec. Anggrek, Kabupaten Gorontalo Utara",GORONTALO,96252,Indonesia,,,,0.8032576,1.228.271.035,https://maps.google.com/?cid=0x0:0x957f45623dc086e9,
supermarket,Toko bahan makanan,Nella Pidu,"MJXV+QR4, Unnamed Road, Paris, Kec. Mootilango, Kabupaten Gorontalo, Gorontalo 96127","Unnamed Road, Paris, Kec. Mootilango, Kabupaten Gorontalo",GORONTALO,96127,Indonesia,82291821655.0,,,0.6993803,1.226.445.795,https://maps.google.com/?cid=0x0:0x7ca93a06bdddf1c0,
supermarket,Toko bahan makanan,TOKO NISA,"Unnamed Road, Sido Mulyo, Kec. Boliyohuto, Kabupaten Gorontalo, Gorontalo 96264","Sido Mulyo, Kec. Boliyohuto, Kabupaten Gorontalo",GORONTALO,96264,Indonesia,82271084550.0,,,0.6552147,1.226.195.828,https://maps.google.com/?cid=0x0:0xbfbf498cb6b51dec,
supermarket,Toko umum,Toko Pulubala jaya,"JQWM+388, Pongongaila, Kec. Pulubala, Kabupaten Gorontalo, Gorontalo 96127","Pongongaila, Kec. Pulubala, Kabupaten Gorontalo",GORONTALO,96127,Indonesia,82340214317.0,,,0.6451577,1.227.833.425,https://maps.google.com/?cid=0x0:0x21318b22366a91b2,
supermarket,Toko umum,Toko Via,"Paris, Kec. Mootilango, Kabupaten Gorontalo, Gorontalo 96127","Kec. Mootilango, Kabupaten Gorontalo",GORONTALO,96127,Indonesia,82121422672.0,,,0.6894491,1.226.425.377,https://maps.google.com/?cid=0x0:0x37fcf6bea3254c53,
supermarket,Pusat Perbelanjaan,MAILMART,"Jl. Salim Manumba, Pilomonu, Kec. Mootilango, Kabupaten Gorontalo, Gorontalo 96264","Pilomonu, Kec. Mootilango, Kabupaten Gorontalo",GORONTALO,96264,Indonesia,,,,0.7332322,1.226.142.658,https://maps.google.com/?cid=0x0:0x2f0d5064e8a9bf4e,
supermarket,Minimarket,Toko ZelCin,"Huyula, Kec. Mootilango, Kabupaten Gorontalo, Gorontalo","Kabupaten Gorontalo, Gorontalo",GORONTALO,,Indonesia,82223300625.0,,,0.8024582,1.226.842.498,https://maps.google.com/?cid=0x0:0x7f6bb6527a8e5119,
supermarket,Toko Swalayan,Makro Supermarket  Department Store,"G3V5+6JR, Jl. Prof. Dr. H.B. Jassin, Limba U I, Kota Sel., Kota Gorontalo, Gorontalo 96134","Jl. Prof. Dr. H.B. Jassin, Limba U I, Kota Sel., Kota Gorontalo",GORONTALO,96134,Indonesia,,,,0.543104,123.059.011,https://maps.google.com/?cid=0x0:0x26476c4c695c115b,
supermarket,Minimarket,Alfa Mart,"Jl. Sultan Botutihe, Moodu, Kec. Kota Tim., Kota Gorontalo, Gorontalo 96113","Moodu, Kec. Kota Tim., Kota Gorontalo",GORONTALO,96113,Indonesia,1500959.0,,,0.5387301,1.230.713.771,https://maps.google.com/?cid=0x0:0x3ee74ec65bb6e48b,
supermarket,Toko Swalayan,Gelael Supermarket - Indotim Gorontalo,"G3W2+HWR, JL. Kartini No.74 - Gorontalo Mega Zanur Mall, 96115, Jl. Prof. Dr. H.B. Jassin, Limba U Dua, South Kota, Kota Gorontalo, Gorontalo 96138","JL. Kartini No.74 - Gorontalo Mega Zanur Mall, 96115, Jl. Prof. Dr. H.B. Jassin, Limba U Dua, South Kota, Kota Gorontalo",GORONTALO,96138,Indonesia,,,,0.543992,1.230.571.329,https://maps.google.com/?cid=0x0:0xa3b3d61f6721f784,
supermarket,Pusat Perbelanjaan,Agung Supermarket,"JXGG+FF3, Jl. Ahmad A. Wahab, Hunggaluwa, Kec. Limboto, Kabupaten Gorontalo, Gorontalo 96181","Jl. Ahmad A. Wahab, Hunggaluwa, Kec. Limboto, Kabupaten Gorontalo",GORONTALO,96181,Indonesia,,,,0.6261414,1.229.761.873,https://maps.google.com/?cid=0x0:0x6ec6155e2dcb6ce3,
supermarket,,Toko Khumairah,"J2C6+3M7, Bar., Pentadio Bar., Kec. Telaga Biru, Kabupaten Gorontalo, Gorontalo 96181","Bar., Pentadio Bar., Kec. Telaga Biru, Kabupaten Gorontalo",GORONTALO,96181,Indonesia,,,,0.6201629,1.230.116.831,https://maps.google.com/?cid=0x0:0xd8080b19c2934d,
supermarket,Toko Bahan Bangunan,Toko Prima Baru,"H28R+RFM, Jl. Durian, Tomulabutao Sel., Kec. Dungingi, Kabupaten Gorontalo, Gorontalo 96138","Jl. Durian, Tomulabutao Sel., Kec. Dungingi, Kabupaten Gorontalo",GORONTALO,96138,Indonesia,435828170.0,,,0.5670781,1.230.411.592,https://maps.google.com/?cid=0x0:0x8fe660166ddd130b,
supermarket,Toko Swalayan,Swalayan Dhidi Mart,"RWM9+27G, Titidu, Kec. Kwandang, Kabupaten Gorontalo Utara, Gorontalo 96252","Titidu, Kec. Kwandang, Kabupaten Gorontalo Utara",GORONTALO,96252,Indonesia,,,,0.8325745,1.229.181.882,https://maps.google.com/?cid=0x0:0xdebd6c0cac984e65,
supermarket,Kios,Kios Molindo,"J25H+7XV, Jl. Tahir Manyo, Tinelo, Kec. Telaga Biru, Kabupaten Gorontalo, Gorontalo 96181","Jl. Tahir Manyo, Tinelo, Kec. Telaga Biru, Kabupaten Gorontalo",GORONTALO,96181,Indonesia,85200278696.0,,,0.6082406,1.230.299.129,https://maps.google.com/?cid=0x0:0xa8b28fb2a781b1d2,
supermarket,Toko Swalayan,Rohmat Fadilah 001,"H25F+H93, Tilote, Kec. Tilango, Kabupaten Gorontalo, Gorontalo 96181","Tilote, Kec. Tilango, Kabupaten Gorontalo",GORONTALO,96181,Indonesia,85397016007.0,,,0.5588878,1.230.234.064,https://maps.google.com/?cid=0x0:0x622a6cf79676e6a9,
