Category,Real Category,Business Name,Address,City,State,Postal Code,Country,Phone,Email,Website,Latitude,Longitude,Map Link,Details Link
supermarket,Toko Pertanian,Kios Sembako Syahdan,"PH36+XWF, Sukamakmur, Kec. Tolangohula, Kabupaten Gorontalo, Gorontalo 96214","Sukamakmur, Kec. Tolangohula, Kabupaten Gorontalo",GORONTALO,96214,Indonesia,,,,0.704948,1.225.622.932,https://maps.google.com/?cid=0x0:0xac8e0b2e24aa894,
supermarket,Toko Pakaian,Ayu shoop,"PJ44+JJM, Potanga, Kec. Boliyohuto, Kabupaten Gorontalo, Gorontalo 96264","Potanga, Kec. Boliyohuto, Kabupaten Gorontalo",GORONTALO,96264,Indonesia,85146477074.0,,,0.7065998,1.226.065.347,https://maps.google.com/?cid=0x0:0xf6982da7dd20601a,
supermarket,Toko umum,Kios Golden,"MJXR+P4F, Paris, Kec. Mootilango, Kabupaten Gorontalo, Gorontalo 96111","Paris, Kec. Mootilango, Kabupaten Gorontalo",GORONTALO,96111,Indonesia,81388881438.0,,,0.6993125,1.226.403.125,https://maps.google.com/?cid=0x0:0xa82944876f12427,
supermarket,Toko umum,Toko Asparaga Jaya,"H26R+42V, Jl. Mangga II, Huangobotu, Kec. Dungingi, Kabupaten Gorontalo, Gorontalo 96136","Jl. Mangga II, Huangobotu, Kec. Dungingi, Kabupaten Gorontalo",GORONTALO,96136,Indonesia,,,,0.5603303,1.230.399.482,https://maps.google.com/?cid=0x0:0xec1107140015948e,
supermarket,Pusat Perbelanjaan,Agung Supermarket,"JXGG+FF3, Jl. Ahmad A. Wahab, Hunggaluwa, Kec. Limboto, Kabupaten Gorontalo, Gorontalo 96181","Jl. Ahmad A. Wahab, Hunggaluwa, Kec. Limboto, Kabupaten Gorontalo",GORONTALO,96181,Indonesia,,,,0.6261414,1.229.761.873,https://maps.google.com/?cid=0x0:0x6ec6155e2dcb6ce3,
supermarket,Toko umum,Toko Deal,"JXJH+926, Kayumerah, Kec. Limboto, Kabupaten Gorontalo, Gorontalo 96214","Kayumerah, Kec. Limboto, Kabupaten Gorontalo",GORONTALO,96214,Indonesia,,,,0.6309021,1.229.775.306,https://maps.google.com/?cid=0x0:0x1623c20bce5c9ba6,
supermarket,Toko Swalayan,Al Husna Gorontalo,"JW4P+PCG, Hutabohu, Kec. Limboto Bar., Kabupaten Gorontalo, Gorontalo 96216","Hutabohu, Kec. Limboto Bar., Kabupaten Gorontalo",GORONTALO,96216,Indonesia,81242533364.0,,,0.606819,1.229.360.904,https://maps.google.com/?cid=0x0:0xe77fad6dfea93027,
supermarket,,Toko Khumairah,"J2C6+3M7, Bar., Pentadio Bar., Kec. Telaga Biru, Kabupaten Gorontalo, Gorontalo 96181","Bar., Pentadio Bar., Kec. Telaga Biru, Kabupaten Gorontalo",GORONTALO,96181,Indonesia,,,,0.6201629,1.230.116.831,https://maps.google.com/?cid=0x0:0xd8080b19c2934d,
supermarket,Minimarket,Kayna LPP Gorontalo,"JXGJ+39Q, Kayubulan, Kec. Limboto, Kabupaten Gorontalo, Gorontalo 96214","Kayubulan, Kec. Limboto, Kabupaten Gorontalo",GORONTALO,96214,Indonesia,81241588694.0,,,0.6252007,1.229.809.704,https://maps.google.com/?cid=0x0:0xb4da8e3f2247c42b,
supermarket,Toko bahan makanan,Toko Sinta (Sinar Santika),"Jl. Ahmad A. Wahab, Tuladenggi, Kec. Telaga Biru, Kabupaten Gorontalo, Gorontalo 96181","Tuladenggi, Kec. Telaga Biru, Kabupaten Gorontalo",GORONTALO,96181,Indonesia,85241066713.0,,,0.6012427,1.230.313.269,https://maps.google.com/?cid=0x0:0x494795fc36197800,
supermarket,Toko umum,Toko Indah Sejati,"JWFV+MV8, Tunggulo, Kec. Limboto Bar., Kabupaten Gorontalo, Gorontalo 96271","Tunggulo, Kec. Limboto Bar., Kabupaten Gorontalo",GORONTALO,96271,Indonesia,,,,0.6241548,122.944.718,https://maps.google.com/?cid=0x0:0x61d429f27596e236,
supermarket,Toko,Toko Anisa,"J285+8WX, Bar., Pentadio Bar., Kec. Telaga Biru, Kabupaten Gorontalo, Gorontalo 96181","Bar., Pentadio Bar., Kec. Telaga Biru, Kabupaten Gorontalo",GORONTALO,96181,Indonesia,,,,0.6158622,1.230.098.649,https://maps.google.com/?cid=0x0:0x36daf59016ca7242,
supermarket,Toko Swalayan,Opa Rhafiq,"JXFQ+X3V, Jl. Ahmad A. Wahab, Hepuhulawa, Kec. Limboto, Kabupaten Gorontalo, Gorontalo 96181","Jl. Ahmad A. Wahab, Hepuhulawa, Kec. Limboto, Kabupaten Gorontalo",GORONTALO,96181,Indonesia,82293721261.0,,,0.6249806,1.229.876.653,https://maps.google.com/?cid=0x0:0x3a035c25aacbc3b3,
supermarket,Toko,TOKO NC,"Dusun Bululi tua, Desa Tiohu, Kec. Asparaga, Kabupaten Gorontalo, Gorontalo 96221","Desa Tiohu, Kec. Asparaga, Kabupaten Gorontalo",GORONTALO,96221,Indonesia,81354807635.0,,,0.7531125,1.224.834.191,https://maps.google.com/?cid=0x0:0x3a341ea9127b7bd6,
supermarket,Minimarket,Indomaret,"PH24+GVM, Sukamakmur, Kec. Tolangohula, Kabupaten Gorontalo, Gorontalo 96214","Sukamakmur, Kec. Tolangohula, Kabupaten Gorontalo",GORONTALO,96214,Indonesia,,,,0.7013392,122.557.158,https://maps.google.com/?cid=0x0:0xffcf327e96fe7408,
supermarket,supermarket,Kec. Batudaa,"Kabupaten Gorontalo, Gorontalo","Kabupaten Gorontalo, Gorontalo",GORONTALO,,Indonesia,,,,0.5526496,1.229.818.501,https://maps.google.com/?cid=0x0:0x23ad9825c6715c02,
supermarket,Minimarket,Alfa Mart Batudaa Gorontalo,"Jl. Raya Batudaa, Payunga, Kec. Batudaa, Kabupaten Gorontalo, Gorontalo 96271","Payunga, Kec. Batudaa, Kabupaten Gorontalo",GORONTALO,96271,Indonesia,1500959.0,,,0.5635182,1.229.520.298,https://maps.google.com/?cid=0x0:0x428bf26f2335266,
supermarket,Pusat Perbelanjaan,Muraa Supermarket Gorontalo,"Bulila, Kec. Telaga, Kabupaten Gorontalo, Gorontalo 96138","Kec. Telaga, Kabupaten Gorontalo",GORONTALO,96138,Indonesia,,,,0.5786076,1.230.445.856,https://maps.google.com/?cid=0x0:0x694a290777d48599,
supermarket,Toko Swalayan,Farisska,"GXMJ+P5R, Barakati, Kec. Batudaa, Kabupaten Gorontalo, Gorontalo 96271","Barakati, Kec. Batudaa, Kabupaten Gorontalo",GORONTALO,96271,Indonesia,81355869303.0,,,0.5343589,1.229.803.837,https://maps.google.com/?cid=0x0:0x19762b298fc09152,
supermarket,Toko Perhiasan,Karsa Utama,"Jl. S. Parman No.45, Biawao, Kota Sel., Kota Gorontalo, Gorontalo 96133","Biawao, Kota Sel., Kota Gorontalo",GORONTALO,96133,Indonesia,,,,0.5364809,1.230.589.067,https://maps.google.com/?cid=0x0:0x1a7597bff92c0a71,
supermarket,Pusat Perbelanjaan,Q-Mart Super Store,"Jl. Kalimantan No.94, Dulalowo Tim., Kec. Kota Tengah, Kota Gorontalo, Gorontalo 96138","Dulalowo Tim., Kec. Kota Tengah, Kota Gorontalo",GORONTALO,96138,Indonesia,435834318.0,,,0.5663315,1.230.421.559,https://maps.google.com/?cid=0x0:0xa31fb94e230fb4cf,
supermarket,Toko,Muraa Supermarket Gorontalo 2,"Jl. Kalimantan No.94, Dulalowo Tim., Kec. Kota Tengah, Kota Gorontalo, Gorontalo 96138","Dulalowo Tim., Kec. Kota Tengah, Kota Gorontalo",GORONTALO,96138,Indonesia,,,,0.5600187,1.230.567.167,https://maps.google.com/?cid=0x0:0x3f600202ab0d158e,
supermarket,Toko,Toko Anisa,"J285+8WX, Bar., Pentadio Bar., Kec. Telaga Biru, Kabupaten Gorontalo, Gorontalo 96181","Bar., Pentadio Bar., Kec. Telaga Biru, Kabupaten Gorontalo",GORONTALO,96181,Indonesia,,,,0.6158622,1.230.098.649,https://maps.google.com/?cid=0x0:0x36daf59016ca7242,
supermarket,Dapur Umum,Kios Anugrah Zainab,"HX66+XWG, Pilobuhuta, Kec. Batudaa, Kabupaten Gorontalo, Gorontalo 96271","Pilobuhuta, Kec. Batudaa, Kabupaten Gorontalo",GORONTALO,96271,Indonesia,81244970855.0,,,0.562438,1.229.623.173,https://maps.google.com/?cid=0x0:0x344f698ec66a206d,
supermarket,Toko Swalayan,Toko Nusa Dua,"H2CP+5W9, Jl. Beringin, Tomulabutao Sel., Kec. Dungingi, Kabupaten Gorontalo, Gorontalo 96138","Jl. Beringin, Tomulabutao Sel., Kec. Dungingi, Kabupaten Gorontalo",GORONTALO,96138,Indonesia,,,,0.5704035,1.230.373.651,https://maps.google.com/?cid=0x0:0x376b5a9a4d82bfe8,
supermarket,Toko Bahan Bangunan,Toko Prima Baru,"H28R+RFM, Jl. Durian, Tomulabutao Sel., Kec. Dungingi, Kabupaten Gorontalo, Gorontalo 96138","Jl. Durian, Tomulabutao Sel., Kec. Dungingi, Kabupaten Gorontalo",GORONTALO,96138,Indonesia,435828170.0,,,0.5670781,1.230.411.592,https://maps.google.com/?cid=0x0:0x8fe660166ddd130b,
supermarket,Toko umum,ALBA MART,"G3X2+5JC, Limba U Dua, Kota Sel., Kota Gorontalo, Gorontalo 96136","Limba U Dua, Kota Sel., Kota Gorontalo",GORONTALO,96136,Indonesia,,,,0.5479399,1.230.515.034,https://maps.google.com/?cid=0x0:0xca1cc3390f143fd1,
supermarket,Pusat Perbelanjaan,AISYA PUTRI CELL,"HX2V+962, Iluta, Kec. Batudaa, Kabupaten Gorontalo, Gorontalo 96271","Iluta, Kec. Batudaa, Kabupaten Gorontalo",GORONTALO,96271,Indonesia,85399815698.0,,,0.5508867,1.229.930.132,https://maps.google.com/?cid=0x0:0xe4dfcfe27c296f02,
supermarket,Pusat Perbelanjaan,Agung Supermarket Kota Gorontalo,"G3W6+2V6, Jl. D.I. Panjaitan No.110, Limba U I, Kota Sel., Kota Gorontalo, Gorontalo 96135","Jl. D.I. Panjaitan No.110, Limba U I, Kota Sel., Kota Gorontalo",GORONTALO,96135,Indonesia,,,,0.544968,1.230.622.361,https://maps.google.com/?cid=0x0:0x9e7641346e022af1,
supermarket,Toko bahan makanan,Alfamart,"Jl. Aa Wahab Limboto, Ulapato A, Kec. Telaga Biru, Kab. Gorontalo, Gorontalo 96184","Ulapato A, Kec. Telaga Biru, Kab. Gorontalo",GORONTALO,96184,Indonesia,1500959.0,,,0.6129878,1.230.216.407,https://maps.google.com/?cid=0x0:0x5aa3055496fedf96,
supermarket,Toko bahan makanan,Toko Sinta (Sinar Santika),"Jl. Ahmad A. Wahab, Tuladenggi, Kec. Telaga Biru, Kabupaten Gorontalo, Gorontalo 96181","Tuladenggi, Kec. Telaga Biru, Kabupaten Gorontalo",GORONTALO,96181,Indonesia,85241066713.0,,,0.6012427,1.230.313.269,https://maps.google.com/?cid=0x0:0x494795fc36197800,
supermarket,Toko Swalayan,Rohmat Fadilah 001,"H25F+H93, Tilote, Kec. Tilango, Kabupaten Gorontalo, Gorontalo 96181","Tilote, Kec. Tilango, Kabupaten Gorontalo",GORONTALO,96181,Indonesia,85397016007.0,,,0.5588878,1.230.234.064,https://maps.google.com/?cid=0x0:0x622a6cf79676e6a9,
supermarket,Toko Bahan Bangunan,Toko Anda (TLG),"Wadi Pala, Jl. Raja Wadipalapa, Tenggela, Tilango, Gorontalo Regency, Gorontalo 96137","Jl. Raja Wadipalapa, Tenggela, Tilango, Gorontalo Regency",GORONTALO,96137,Indonesia,,,,0.5669729,1.230.282.127,https://maps.google.com/?cid=0x0:0xe748a00b8f259ebd,
supermarket,Minimarket,Adis  Nadin,"J25F+F3H, Ulapato A, Kec. Telaga Biru, Kabupaten Gorontalo, Gorontalo 96181","Ulapato A, Kec. Telaga Biru, Kabupaten Gorontalo",GORONTALO,96181,Indonesia,,,,0.6086914,1.230.227.231,https://maps.google.com/?cid=0x0:0x2afea8f2b1ada03b,
supermarket,Kios,Al Fadhil Ilotidea,"H26G+W7M, Jl. Raja Wadipalapa, Ilotidea, Kec. Tilango, Kabupaten Gorontalo, Gorontalo 96137","Jl. Raja Wadipalapa, Ilotidea, Kec. Tilango, Kabupaten Gorontalo",GORONTALO,96137,Indonesia,,,,0.5623377,123.025.662,https://maps.google.com/?cid=0x0:0x3b76e976b03cba3,
supermarket,,Toko Khumairah,"J2C6+3M7, Bar., Pentadio Bar., Kec. Telaga Biru, Kabupaten Gorontalo, Gorontalo 96181","Bar., Pentadio Bar., Kec. Telaga Biru, Kabupaten Gorontalo",GORONTALO,96181,Indonesia,,,,0.6201629,1.230.116.831,https://maps.google.com/?cid=0x0:0xd8080b19c2934d,
supermarket,Toko Swalayan,Tk Fajar Jaya,"Buhu, Kec. Telaga Jaya, Kabupaten Gorontalo, Gorontalo 96181","Kec. Telaga Jaya, Kabupaten Gorontalo",GORONTALO,96181,Indonesia,,,,0.5762713,1.230.222.195,https://maps.google.com/?cid=0x0:0xddf95db0fef7a7b0,
supermarket,Toko bahan makanan,Warung ALAZKA,"HX58+P79, Huntu, Kec. Batudaa, Kabupaten Gorontalo, Gorontalo","Kabupaten Gorontalo, Gorontalo",GORONTALO,,Indonesia,,,,0.5593259,1.229.656.517,https://maps.google.com/?cid=0x0:0x55cc552a553dbbaa,
supermarket,Minimarket,Az Zahra,"J27C+F4P, Jl. Ahmad A. Wahab, Timuato, Kec. Telaga Biru, Kabupaten Gorontalo, Gorontalo 96181","Jl. Ahmad A. Wahab, Timuato, Kec. Telaga Biru, Kabupaten Gorontalo",GORONTALO,96181,Indonesia,895401623333.0,,,0.6137019,1.230.203.421,https://maps.google.com/?cid=0x0:0x1e0c46bbf71b30,
supermarket,Gudang,Alfamart,"Jl. Aa, Jl. Ahmad A. Wahab Desa, Pentadio Bar., Kec. Telaga Biru, Kabupaten Gorontalo, Gorontalo 96252","Jl. Ahmad A. Wahab Desa, Pentadio Bar., Kec. Telaga Biru, Kabupaten Gorontalo",GORONTALO,96252,Indonesia,1500959.0,,,0.5974713,1.230.327.819,https://maps.google.com/?cid=0x0:0xf44ad658738312a6,
supermarket,supermarket,Gorontalo 96272,"Kec. Biluhu, Kabupaten Gorontalo, Gorontalo","Kabupaten Gorontalo, Gorontalo",GORONTALO,,Indonesia,,,,0.513169,1.228.648.538,https://maps.google.com/?cid=0x0:0xb8cedc900e74ffd8,
supermarket,Minimarket,Alfa Mart Batudaa Gorontalo,"Jl. Raya Batudaa, Payunga, Kec. Batudaa, Kabupaten Gorontalo, Gorontalo 96271","Payunga, Kec. Batudaa, Kabupaten Gorontalo",GORONTALO,96271,Indonesia,1500959.0,,,0.5635182,1.229.520.298,https://maps.google.com/?cid=0x0:0x428bf26f2335266,
supermarket,Pusat Perbelanjaan,Muraa Supermarket Gorontalo,"Bulila, Kec. Telaga, Kabupaten Gorontalo, Gorontalo 96138","Kec. Telaga, Kabupaten Gorontalo",GORONTALO,96138,Indonesia,,,,0.5786076,1.230.445.856,https://maps.google.com/?cid=0x0:0x694a290777d48599,
supermarket,Toko umum,Syifa Mart Kec. Biluhu,"FPPF+8W2, Jl. Buke Panai, Huwongo, Kec. Biluhu, Kabupaten Gorontalo, Gorontalo 96272","Jl. Buke Panai, Huwongo, Kec. Biluhu, Kabupaten Gorontalo",GORONTALO,96272,Indonesia,,,,0.4857562,1.227.247.649,https://maps.google.com/?cid=0x0:0xd53c5ad124ad4f00,
supermarket,Toko Swalayan,Makro Supermarket  Department Store,"G3V5+6JR, Jl. Prof. Dr. H.B. Jassin, Limba U I, Kota Sel., Kota Gorontalo, Gorontalo 96134","Jl. Prof. Dr. H.B. Jassin, Limba U I, Kota Sel., Kota Gorontalo",GORONTALO,96134,Indonesia,,,,0.543104,123.059.011,https://maps.google.com/?cid=0x0:0x26476c4c695c115b,
supermarket,Toko Perhiasan,Karsa Utama,"Jl. S. Parman No.45, Biawao, Kota Sel., Kota Gorontalo, Gorontalo 96133","Biawao, Kota Sel., Kota Gorontalo",GORONTALO,96133,Indonesia,,,,0.5364809,1.230.589.067,https://maps.google.com/?cid=0x0:0x1a7597bff92c0a71,
supermarket,Pusat Perbelanjaan,Q-Mart Super Store,"Jl. Kalimantan No.94, Dulalowo Tim., Kec. Kota Tengah, Kota Gorontalo, Gorontalo 96138","Dulalowo Tim., Kec. Kota Tengah, Kota Gorontalo",GORONTALO,96138,Indonesia,435834318.0,,,0.5663315,1.230.421.559,https://maps.google.com/?cid=0x0:0xa31fb94e230fb4cf,
supermarket,Hipermarket,Hymart Supermarket,"Jl. Sultan Botutihe No.220, Moodu, Kec. Kota Tim., Kota Gorontalo, Gorontalo 96113","Moodu, Kec. Kota Tim., Kota Gorontalo",GORONTALO,96113,Indonesia,435830400.0,,,0.54034,123.074.965,https://maps.google.com/?cid=0x0:0x73ba3dabd9175daa,
supermarket,Toko bahan makanan,Omart Kampung Bugis,"G3H6+PPP, Jl. Jalaludin Tantu, Bugis, Kec. Kota Tim., Kota Gorontalo, Gorontalo 96133","Jl. Jalaludin Tantu, Bugis, Kec. Kota Tim., Kota Gorontalo",GORONTALO,96133,Indonesia,81245827330.0,,,0.5293345,1.230.618.132,https://maps.google.com/?cid=0x0:0xcc444a82191bb429,
supermarket,Toko Swalayan,Farisska,"GXMJ+P5R, Barakati, Kec. Batudaa, Kabupaten Gorontalo, Gorontalo 96271","Barakati, Kec. Batudaa, Kabupaten Gorontalo",GORONTALO,96271,Indonesia,81355869303.0,,,0.5343589,1.229.803.837,https://maps.google.com/?cid=0x0:0x19762b298fc09152,
supermarket,Pusat Perbelanjaan,Agung Supermarket Kota Gorontalo,"G3W6+2V6, Jl. D.I. Panjaitan No.110, Limba U I, Kota Sel., Kota Gorontalo, Gorontalo 96135","Jl. D.I. Panjaitan No.110, Limba U I, Kota Sel., Kota Gorontalo",GORONTALO,96135,Indonesia,,,,0.544968,1.230.622.361,https://maps.google.com/?cid=0x0:0x9e7641346e022af1,
supermarket,Toko Swalayan,Gelael Supermarket - Indotim Gorontalo,"G3W2+HWR, JL. Kartini No.74 - Gorontalo Mega Zanur Mall, 96115, Jl. Prof. Dr. H.B. Jassin, Limba U Dua, South Kota, Kota Gorontalo, Gorontalo 96138","JL. Kartini No.74 - Gorontalo Mega Zanur Mall, 96115, Jl. Prof. Dr. H.B. Jassin, Limba U Dua, South Kota, Kota Gorontalo",GORONTALO,96138,Indonesia,,,,0.543992,1.230.571.329,https://maps.google.com/?cid=0x0:0xa3b3d61f6721f784,
supermarket,Toko bahan makanan,Toko Leila,"Biawao, Kota Sel., Kota Gorontalo, Gorontalo 96134","Kota Sel., Kota Gorontalo",GORONTALO,96134,Indonesia,,,,0.5365939,1.230.598.002,https://maps.google.com/?cid=0x0:0x1790a23f8a0bef01,
supermarket,Toko umum,ALBA MART,"G3X2+5JC, Limba U Dua, Kota Sel., Kota Gorontalo, Gorontalo 96136","Limba U Dua, Kota Sel., Kota Gorontalo",GORONTALO,96136,Indonesia,,,,0.5479399,1.230.515.034,https://maps.google.com/?cid=0x0:0xca1cc3390f143fd1,
supermarket,Toko bahan makanan,Mocca Delli Super Market BAHAN KUE  DAPUR,"Moodu, Kec. Kota Tim., Kota Gorontalo, Gorontalo 96135","Kec. Kota Tim., Kota Gorontalo",GORONTALO,96135,Indonesia,89560112299.0,,,0.5403059,1.230.750.174,https://maps.google.com/?cid=0x0:0x16e2ba97955d038a,
supermarket,Supermarket Diskon,KIOS RHASYA,"FPMG+V48, Huwongo, Kec. Biluhu, Kabupaten Gorontalo, Gorontalo 96272","Huwongo, Kec. Biluhu, Kabupaten Gorontalo",GORONTALO,96272,Indonesia,82394488532.0,,,0.484669,1.227.253.353,https://maps.google.com/?cid=0x0:0x1f9b1cbb90c29745,
supermarket,Toko,KIOS SINTIA,"Biluhu Bar., Kec. Biluhu, Kabupaten, Gorontalo 96272","Kec. Biluhu, Kabupaten",GORONTALO,96272,Indonesia,82244895649.0,,,0.5019688,1.227.463.708,https://maps.google.com/?cid=0x0:0x200756a4808798b5,
supermarket,Toko Swalayan,Hypermart Gorontalo,"Jl. Sultan Botutihe No.8A, Heledulaa Sel., Kec. Kota Tim., Kota Gorontalo, Gorontalo","Kota Gorontalo, Gorontalo",GORONTALO,,Indonesia,435822242.0,,,0.5375812,1.230.624.791,https://maps.google.com/?cid=0x0:0xe1a4bf3e8b0b6f8,
supermarket,Toko Swalayan,NESSA MART,"H23V+RRV, Libuo, Kec. Dungingi, Kota Gorontalo, Gorontalo 96136","Libuo, Kec. Dungingi, Kota Gorontalo",GORONTALO,96136,Indonesia,81244772009.0,,,0.55462,123.044.539,https://maps.google.com/?cid=0x0:0x27f8d87b2ecf1d00,
supermarket,Toko Perlengkapan Rumah,JayaMart,"H28X+93M, Jl. Prof. Dr. H.B. Jassin, Liluwo, Kec. Kota Tengah, Kota Gorontalo, Gorontalo 96138","Jl. Prof. Dr. H.B. Jassin, Liluwo, Kec. Kota Tengah, Kota Gorontalo",GORONTALO,96138,Indonesia,81340141099.0,,,0.5659577,1.230.476.864,https://maps.google.com/?cid=0x0:0x689371028eb7430d,
supermarket,Toko Bahan Bangunan,Toko Prima Baru,"H28R+RFM, Jl. Durian, Tomulabutao Sel., Kec. Dungingi, Kabupaten Gorontalo, Gorontalo 96138","Jl. Durian, Tomulabutao Sel., Kec. Dungingi, Kabupaten Gorontalo",GORONTALO,96138,Indonesia,435828170.0,,,0.5670781,1.230.411.592,https://maps.google.com/?cid=0x0:0x8fe660166ddd130b,
supermarket,Toko bahan makanan,Warung ALAZKA,"HX58+P79, Huntu, Kec. Batudaa, Kabupaten Gorontalo, Gorontalo","Kabupaten Gorontalo, Gorontalo",GORONTALO,,Indonesia,,,,0.5593259,1.229.656.517,https://maps.google.com/?cid=0x0:0x55cc552a553dbbaa,
supermarket,Toko bahan makanan,Mekar Jaya Unit Toserba Lamu,"FVRX+WQ6, Unnamed Road, Lamu, Kec. Batudaa Pantai, Kabupaten Gorontalo, Gorontalo 96272","Unnamed Road, Lamu, Kec. Batudaa Pantai, Kabupaten Gorontalo",GORONTALO,96272,Indonesia,,,,0.4922862,1.228.994.053,https://maps.google.com/?cid=0x0:0x3a7feffb7164c0ba,
supermarket,Tempat Ibadah,Kios AIRAFA,"FXV6+92J, Biluhu Tim., Kec. Batudaa Pantai, Kabupaten Gorontalo, Gorontalo 96272","Biluhu Tim., Kec. Batudaa Pantai, Kabupaten Gorontalo",GORONTALO,96272,Indonesia,,,,0.4937013,1.229.598.998,https://maps.google.com/?cid=0x0:0x8817178e47b5ec0d,
supermarket,Kios,Kios Miqayla,"Dunggala, Kec. Batudaa, Kabupaten Gorontalo, Gorontalo 96271","Kec. Batudaa, Kabupaten Gorontalo",GORONTALO,96271,Indonesia,85298233453.0,,,0.5529062,1.229.464.808,https://maps.google.com/?cid=0x0:0x83f6539509e5b539,
supermarket,Kios,Kios candra All faraby,"FQXX+9F9, Lobuto Tim., Kec. Biluhu, Kabupaten Gorontalo, Gorontalo","Kabupaten Gorontalo, Gorontalo",GORONTALO,,Indonesia,82394937776.0,,,0.4984088,1.227.987.495,https://maps.google.com/?cid=0x0:0x6fd8c827e2886691,
supermarket,Kios,Al Fadhil Ilotidea,"H26G+W7M, Jl. Raja Wadipalapa, Ilotidea, Kec. Tilango, Kabupaten Gorontalo, Gorontalo 96137","Jl. Raja Wadipalapa, Ilotidea, Kec. Tilango, Kabupaten Gorontalo",GORONTALO,96137,Indonesia,,,,0.5623377,123.025.662,https://maps.google.com/?cid=0x0:0x3b76e976b03cba3,
supermarket,Toko Swalayan,Rohmat Fadilah 001,"H25F+H93, Tilote, Kec. Tilango, Kabupaten Gorontalo, Gorontalo 96181","Tilote, Kec. Tilango, Kabupaten Gorontalo",GORONTALO,96181,Indonesia,85397016007.0,,,0.5588878,1.230.234.064,https://maps.google.com/?cid=0x0:0x622a6cf79676e6a9,
supermarket,supermarket,Bilato,"Kec. Boliyohuto, Kabupaten Gorontalo, Gorontalo","Kabupaten Gorontalo, Gorontalo",GORONTALO,,Indonesia,,,,0.5362964,1.226.588.267,https://maps.google.com/?cid=0x0:0x19682f3f1bc693ac,
supermarket,Pasar,Pasar Bilato,"GM92+P5R, Bilato, Kec. Boliyohuto, Kabupaten Gorontalo, Gorontalo 96264","Bilato, Kec. Boliyohuto, Kabupaten Gorontalo",GORONTALO,96264,Indonesia,,,,0.5193739,122.650.404,https://maps.google.com/?cid=0x0:0x5b44885fd1ca5aa5,
supermarket,Toko bahan makanan,Toko Darma,"GM85+6VR, Ilomata, Bilato, Kabupaten Gorontalo, Gorontalo","Kabupaten Gorontalo, Gorontalo",GORONTALO,,Indonesia,85340144443.0,,,0.5156138,1.226.596.355,https://maps.google.com/?cid=0x0:0xfe9e8b6a6b72c3f6,
supermarket,Pusat Perbelanjaan,Muraa Supermarket Gorontalo,"Bulila, Kec. Telaga, Kabupaten Gorontalo, Gorontalo 96138","Kec. Telaga, Kabupaten Gorontalo",GORONTALO,96138,Indonesia,,,,0.5786076,1.230.445.856,https://maps.google.com/?cid=0x0:0x694a290777d48599,
supermarket,Pusat Perbelanjaan,Q-Mart Super Store,"Jl. Kalimantan No.94, Dulalowo Tim., Kec. Kota Tengah, Kota Gorontalo, Gorontalo 96138","Dulalowo Tim., Kec. Kota Tengah, Kota Gorontalo",GORONTALO,96138,Indonesia,435834318.0,,,0.5663315,1.230.421.559,https://maps.google.com/?cid=0x0:0xa31fb94e230fb4cf,
supermarket,Toko Perhiasan,Karsa Utama,"Jl. S. Parman No.45, Biawao, Kota Sel., Kota Gorontalo, Gorontalo 96133","Biawao, Kota Sel., Kota Gorontalo",GORONTALO,96133,Indonesia,,,,0.5364809,1.230.589.067,https://maps.google.com/?cid=0x0:0x1a7597bff92c0a71,
supermarket,Pusat Perbelanjaan,Agung Supermarket Kota Gorontalo,"G3W6+2V6, Jl. D.I. Panjaitan No.110, Limba U I, Kota Sel., Kota Gorontalo, Gorontalo 96135","Jl. D.I. Panjaitan No.110, Limba U I, Kota Sel., Kota Gorontalo",GORONTALO,96135,Indonesia,,,,0.544968,1.230.622.361,https://maps.google.com/?cid=0x0:0x9e7641346e022af1,
supermarket,Toko bahan makanan,PujaOlshop,"GM85+39W, Unnamed Road, Bilato, Kec. Boliyohuto, Kabupaten Gorontalo, Gorontalo","Kabupaten Gorontalo, Gorontalo",GORONTALO,,Indonesia,82290221286.0,,,0.5152423,1.226.584.569,https://maps.google.com/?cid=0x0:0xb44f9b2c2710f94f,
supermarket,Toko Bumbu,WARUNG SEMBAKO ALBHI,"GM86+5M8, Desa Pelehu, Bilato, Kabupaten Gorontalo","Kabupaten Gorontalo, Gorontalo",GORONTALO,,Indonesia,82349222260.0,,,0.515406,1.226.617.101,https://maps.google.com/?cid=0x0:0x259efde25707aaac,
supermarket,supermarket,Malaga Mart,"GM85+JV7, Ilomata, Bilato, Kabupaten Gorontalo, Gorontalo 96264","Ilomata, Bilato, Kabupaten Gorontalo",GORONTALO,96264,Indonesia,,,,0.51655,1.226.596.628,https://maps.google.com/?cid=0x0:0x1eef72587681d9dd,
supermarket,Toko,Muraa Supermarket Gorontalo 2,"Jl. Kalimantan No.94, Dulalowo Tim., Kec. Kota Tengah, Kota Gorontalo, Gorontalo 96138","Dulalowo Tim., Kec. Kota Tengah, Kota Gorontalo",GORONTALO,96138,Indonesia,,,,0.5600187,1.230.567.167,https://maps.google.com/?cid=0x0:0x3f600202ab0d158e,
supermarket,Toko Swalayan,Makro Supermarket  Department Store,"G3V5+6JR, Jl. Prof. Dr. H.B. Jassin, Limba U I, Kota Sel., Kota Gorontalo, Gorontalo 96134","Jl. Prof. Dr. H.B. Jassin, Limba U I, Kota Sel., Kota Gorontalo",GORONTALO,96134,Indonesia,,,,0.543104,123.059.011,https://maps.google.com/?cid=0x0:0x26476c4c695c115b,
supermarket,supermarket,Gorontalo 96272,"Kec. Biluhu, Kabupaten Gorontalo, Gorontalo","Kabupaten Gorontalo, Gorontalo",GORONTALO,,Indonesia,,,,0.513169,1.228.648.538,https://maps.google.com/?cid=0x0:0xb8cedc900e74ffd8,
supermarket,Toko umum,Syifa Mart Kec. Biluhu,"FPPF+8W2, Jl. Buke Panai, Huwongo, Kec. Biluhu, Kabupaten Gorontalo, Gorontalo 96272","Jl. Buke Panai, Huwongo, Kec. Biluhu, Kabupaten Gorontalo",GORONTALO,96272,Indonesia,,,,0.4857562,1.227.247.649,https://maps.google.com/?cid=0x0:0xd53c5ad124ad4f00,
supermarket,Supermarket Diskon,KIOS RHASYA,"FPMG+V48, Huwongo, Kec. Biluhu, Kabupaten Gorontalo, Gorontalo 96272","Huwongo, Kec. Biluhu, Kabupaten Gorontalo",GORONTALO,96272,Indonesia,82394488532.0,,,0.484669,1.227.253.353,https://maps.google.com/?cid=0x0:0x1f9b1cbb90c29745,
supermarket,Toko bahan makanan,Mekar Jaya Unit Toserba Lamu,"FVRX+WQ6, Unnamed Road, Lamu, Kec. Batudaa Pantai, Kabupaten Gorontalo, Gorontalo 96272","Unnamed Road, Lamu, Kec. Batudaa Pantai, Kabupaten Gorontalo",GORONTALO,96272,Indonesia,,,,0.4922862,1.228.994.053,https://maps.google.com/?cid=0x0:0x3a7feffb7164c0ba,
supermarket,Pusat Perbelanjaan,Muraa Supermarket Gorontalo,"Bulila, Kec. Telaga, Kabupaten Gorontalo, Gorontalo 96138","Kec. Telaga, Kabupaten Gorontalo",GORONTALO,96138,Indonesia,,,,0.5786076,1.230.445.856,https://maps.google.com/?cid=0x0:0x694a290777d48599,
supermarket,Hipermarket,Hymart Supermarket,"Jl. Sultan Botutihe No.220, Moodu, Kec. Kota Tim., Kota Gorontalo, Gorontalo 96113","Moodu, Kec. Kota Tim., Kota Gorontalo",GORONTALO,96113,Indonesia,435830400.0,,,0.54034,123.074.965,https://maps.google.com/?cid=0x0:0x73ba3dabd9175daa,
supermarket,Kios,Kios candra All faraby,"FQXX+9F9, Lobuto Tim., Kec. Biluhu, Kabupaten Gorontalo, Gorontalo","Kabupaten Gorontalo, Gorontalo",GORONTALO,,Indonesia,82394937776.0,,,0.4984088,1.227.987.495,https://maps.google.com/?cid=0x0:0x6fd8c827e2886691,
supermarket,Toko bahan makanan,Mocca Delli Super Market BAHAN KUE  DAPUR,"Moodu, Kec. Kota Tim., Kota Gorontalo, Gorontalo 96135","Kec. Kota Tim., Kota Gorontalo",GORONTALO,96135,Indonesia,89560112299.0,,,0.5403059,1.230.750.174,https://maps.google.com/?cid=0x0:0x16e2ba97955d038a,
supermarket,Toko Swalayan,Makro Supermarket  Department Store,"G3V5+6JR, Jl. Prof. Dr. H.B. Jassin, Limba U I, Kota Sel., Kota Gorontalo, Gorontalo 96134","Jl. Prof. Dr. H.B. Jassin, Limba U I, Kota Sel., Kota Gorontalo",GORONTALO,96134,Indonesia,,,,0.543104,123.059.011,https://maps.google.com/?cid=0x0:0x26476c4c695c115b,
supermarket,Toko Perhiasan,Karsa Utama,"Jl. S. Parman No.45, Biawao, Kota Sel., Kota Gorontalo, Gorontalo 96133","Biawao, Kota Sel., Kota Gorontalo",GORONTALO,96133,Indonesia,,,,0.5364809,1.230.589.067,https://maps.google.com/?cid=0x0:0x1a7597bff92c0a71,
supermarket,Toko Swalayan,Gelael Supermarket - Indotim Gorontalo,"G3W2+HWR, JL. Kartini No.74 - Gorontalo Mega Zanur Mall, 96115, Jl. Prof. Dr. H.B. Jassin, Limba U Dua, South Kota, Kota Gorontalo, Gorontalo 96138","JL. Kartini No.74 - Gorontalo Mega Zanur Mall, 96115, Jl. Prof. Dr. H.B. Jassin, Limba U Dua, South Kota, Kota Gorontalo",GORONTALO,96138,Indonesia,,,,0.543992,1.230.571.329,https://maps.google.com/?cid=0x0:0xa3b3d61f6721f784,
